,dialog
0,I am a genius.
1,I am the greatest artist of the 20th century.
2,My name is Pablo Picasso.
3,I pretty much invented modern art.
4,"And I do weird, abstract paintings..."
5,"...even though I can paint totally realistic, if I wanted to."
6,"Also, even though I'm super short and bald..."
7,...I am able to have sex with any beautiful woman I want...
8,...just because I'm so great.
9,Come here.
10,Look.
11, Pretty good.
12, Thanks.
13,"Some day, if you get famous, this can be worth a lot of money."
14,"You're wasting your time, Jerome."
15,You gotta set your sights on a more realistic girl.
16,"Shit, here comes Stoob."
17,"Hey, pencilprick, thanks for helping me with that poster for Erikson's class."
18, He said I was a natural artist.
19, A natural scam artist.
20,"Got that right, queerbait."
21,What's this?
22, Are you jacking off in school now?
23," It's a college brochure, you moron."
24,What college has a naked chick for a teacher?
25,"She's an art model, you stupid ape."
26,"Hey. You're all right, Platz."
27,"I don't know, Jerome. It just seems a little too good to be true."
28,Don't you think?
29,Fucking shit!
30,"Yeah, yeah, yeah."
31,"It's based on the whole thing with the campus murder, but Hell no, it ain't no boringass documentary."
32,"Look, forget that shit, okay?"
33,"Yeah, fucking A, there's gonna be tons of action, are you kidding me?"
34, You're an art major?
35, Yeah. Drawing and painting.
36, What are you guys?
37," I'm fashion. He's film, I guess."
38,Are you for real?
39,"You're shitting me, right?"
40," Well, yeah."
41," God, this is so depressing."
42," Why, what's wrong?"
43," I just really, really miss my girlfriend."
44,One hundred percent.
45,"Yeah, you won't be sorry."
46,"I love you too, Grandpa. Yes!"
47,Yes! I'm so fucking pumped!
48, I'm Vince.
49, Hi. Jerome. How are you?
50, What's your name again?
51, Matthew.
52,"God, I'm so fucking jazzed."
53,I get to make my movie.
54,That's fantastic.
55, You guys freshmen?
56, Yeah.
57, You a sophomore?
58, Junior.
59,It's all right.
60,"You listen to me, you'll be okay."
61,Why do you still live in the dorm?
62,A lot of juniors still live in the dorm.
63,What's wrong with that?
64,That guy's some hot shit sculpture major.
65,I have never seen so many beautiful girls.
66,"This is nothing. Dude, you should've seen last year's crop."
67,Enrollment's way off since the murders.
68, What murders?
69," You're shitting me, right?"
70,"I heard about it. Somebody killed a guy on campus, or whatever."
71,Yeah. Three people in the neighborhood since March.
72,You're fucking with me. You've never heard about the Strathmore Strangler?
73,"He killed a guy, like, 10 days ago."
74, Are you from out of state?
75, The suburbs.
76,Then you have no excuse.
77,What about Richard Natwick?
78, Jesus.
79," Sorry, I don't really follow the news."
80,"Okay, I'm gonna give you the story You gotta pay attention."
81,Because this story is huge.
82,"This is, like, national news, man."
83,I'm listening.
84,"Just after the first murder, there's this guy, Richard Natwick."
85,"He's, like, some secondyear painting major."
86,Does these stupidass word paintings.
87,He has a show at the student center.
88,Cops send some guys to check it out.
89,"But they're not used to this kind of artsy bullshit, right?"
90, Fucking  Cut your shit.
91,"Get used to being bent over, prick."
92,So then a couple of professors freak out.
93,"And before you know it, he's like a fucking martyr."
94,Art is not a crime! Art is not a crime!
95,"Of course, it turns out he's completely innocent."
96,And the cops have to totally eat shit.
97," So, what happened to him?"
98, He had his 15 minutes of fame.
99,Then he got hurt real bad in some crazyass performance art thing.
100,Okay...
101,...hit the juice.
102,"Anyway, you gotta read my script."
103,"I mean, it's all in there."
104,It's totally huge.
105,"So, what, you don't get the paper in the suburbs?"
106,"I mean, for all they know, the killer could be from the suburbs."
107,"Those cops, they don't know shit."
108,"So, what, you're a drawing major?"
109,Yeah. Drawing and painting.
110,That's awesome.
111,I hear you guys get to see tons of naked vagina.
112,"Okay, Leslie."
113,Time to work your magic.
114,"First pose, people."
115,We're gonna hit the ground running.
116,"Okay, first pose."
117,"I don't have any particular wisdom to impart to you people, except this: These four words: Don't have unrealistic expectations."
118,"If you wanna make money, better drop out right now."
119,Go to banking school or website school.
120,Anywhere but art school.
121,"And remember, only one out of 100 of you..."
122,...will ever make a living as an artist.
123,Hello?
124,Yes.
125,"Ah, Lorenzo."
126,"No. Absolutely, yes Sandy, can I get a break up here?"
127,Take a break. Five minutes.
128,Are you kidding? I would absolutely love to have you look at it.
129,"No, because I feel like I've really turned a corner with this latest series."
130,In January?
131,"Yeah, yeah. I'm sure I could."
132,"I mean, I don't think my plate is completely full."
133,"Well, I'd be happy...."
134,"No, of course not."
135,Hi.
136," Really pretty, what you're doing."
137, I gotta go.
138,Jesus.
139,Why are the people in these freshman classes exactly the same every year?
140,Look.
141,You got the vegan holy man.
142,The boring blowhard.
143, The angry lesbian.
144, Professor?
145,Professor? Professor?
146,"And here, you got kissass."
147,I wanted to tell you that I looked up some of your paintings on the Internet.
148, I thought they were really terrific.
149," You get an ""A"" for the class."
150,And Mom.
151,I feel that I am finally about to ripen.
152,Artistically.
153,Mom's youngest just left the nest...
154,...so she's ready to explore her creative side.
155,How do you know all this stuff?
156,Because I'm a living cliché just like the rest of these guys.
157,I'm the guy who keeps dropping out and changing majors...
158,...because he's afraid he really sucks at everything.
159,So who am I?
160,I don't know.
161,I haven't figured you out yet.
162,Jesus.
163,Who's the weirdo?
164,Professor? Professor?
165,Professor Okamura?
166,What is your attendance policy for this class?
167,I...
168,...don't...
169,...care...
170,...if you come to class or not.
171,This is ready for the kiln.
172,Let me see if I got this right: You're the guy that never got laid in high school.
173,So you came here to try to bone your way through...
174,...an endless lineup of art skanks.
175,"Not exactly. I mean, I really do wanna be an artist."
176,"A great artist, you know, if possible."
177,Which enables you to bone your way through a lineup of art skanks.
178,"So why wait, man?"
179,Art school's like a pussy buffet.
180,I don't want just any girl.
181,All right.
182,There she is.
183,There is the beautiful beatnik art chick of your dreams.
184," Yeah, so?"
185, So ask her to borrow something.
186,It's the easiest thing in the world.
187,Want me to teach you?
188,Daddy will bring you there.
189, Jesus....
190, Come on.
191,Hi....
192,Do you think I could borrow your pencil?
193,Why?
194, What for?
195," Doesn't matter, it was a stupid idea."
196,"Oh, my God."
197,You have the most beautiful eyes.
198,You have to let me take a picture of them.
199,Okay.
200,How about pizza?
201,Do you wanna go get pizza?
202,The only trouble with that is all those beatnik chicks are totally insane.
203,"Look, what you really want is a nice, innocent, suburban girl."
204,Some freshman chick who hasn't been corrupted yet.
205,"Stay out of that cave, Koala Bear."
206,There's snakes and bats.
207,"Don't be silly, Pepper."
208,I'm not afraid of a little snake.
209,"You know, come to think of it, they're all insane."
210,Just find yourself some nympho slut and get it over with.
211,Excuse me.
212,Can you help me get this off?
213,"I want you to know, I definitely don't have AIDS."
214,"I've been tested, like, 40 times, so I know it for a fact."
215,"Keep the fucking kid quiet, you motherfucking asshole!"
216,It's just my old man.
217,Are you serious?
218,You've never been laid before?
219,It just hasn't worked out yet.
220,I have very high standards.
221,"Man, I gotta take you out whorebusting some night."
222,We gotta remedy this situation before it gets any worse.
223,Maybe you have issues that make it difficult...
224,...to feel comfortable with your own sexuality.
225,"Could be, I guess."
226,"You guys know what whorebusting is, right?"
227,"You leave the money on the dresser, fuck the whore and go to sleep."
228,"You wake up, not only is your money still there, but she's left you a tip."
229,"It's the fucking greatest deal ever, man."
230,Crackheads aren't so good.
231,Their tip is a little glass pipe and a piece of tinfoil.
232,"You don't want that shit. Get a nice call girl or something, you know?"
233,"You fuck a lot of chicks, Matthew?"
234,"Yeah, I figured, man."
235,"Fashion, and all that shit. Models...."
236,"Crack whores, call girls, strippers...."
237,"We could bust some strippers together, that'd be fucking awesome."
238,What is art?
239,Is this art?
240,Or this?
241,Or this?
242,Who's that?
243,Ignore that. That's a mistake.
244,Hamlet. War and Peace.
245,"""Beethoven's 9th"". Guernica."
246,These are works which hold as much emotional resonance today...
247,...as they did at the time of their creation.
248,What makes a work of art timeless?
249,What qualities must it possess?
250, Yes?
251, Everything on your list...
252,...was done by a dead white male.
253,I noticed that too.
254,"To be clear, they were not yet dead when they created those works."
255,You're just playing into the patriarchy.
256,The history of art is largely about the implementation of masculinity.
257, That is such bullshit.
258, Part of some Darwinian imperative.
259,Most artists become artists because...
260,...they have no way to attract a mate.
261,I hardly think I'm the first to point out...
262,"...that the vast preponderance of artists are, shall we say..."
263,...physiologically deficient in some way.
264,"Dribble the ball, Hurst!"
265,Please don't yell.
266, Going to Marvin Bushmiller's talk?
267," Yeah, are you?"
268,We better get there early.
269,It's weird how he's so famous.
270,I used to see him around Strathmore when I was a freshman.
271,I saw his show at Broadway Bob's...
272,...now he's on the cover of Artforum.
273," Well, that's how it works."
274, Platz! Get in there.
275,"Mr. Bushmiller, The New York Times has called your work: ""An expedition to the far contours of an evolving technoculture."" With that in mind, where do you see art headed in the 21st century?"
276,"""Art"" who?"
277,"No, really, that's such..."
278,...a stupid question.
279,Why don't you ask me something relevant.
280,"Ask me how much money I have in the bank, or...."
281,Did you learn anything at Strathmore?
282,"Yes, I learned many things."
283,I learned that the faculty is made up of old failures...
284,...who teach only because they need the health insurance.
285,"Present company excluded, of course."
286,I was about to say.
287,David was too busy trolling the halls for fresh meat to worry about health.
288,What advice would you give to a young artist Shut up. There's only one question any of you wanna ask.
289,You wanna know what it would take to turn you into me.
290,"Well, listen closely, because I'm gonna give you the answer."
291,In order to be a great artist...
292,...you simply have to be a great artist.
293,"There's nothing to learn, so you're all wasting your time. Go home."
294,Why are you such an asshole?
295,"Now, that's a great question."
296,"No, it really is."
297,I am an asshole because that is my true nature.
298,Maybe it's everybody's true nature.
299,"Every one of you looks like a fucking asshole, but who knows?"
300,The difference between you and me is that...
301,...I have gained the freedom to express my true nature.
302,And what could be more beautiful than truth and freedom?
303,"Another day, another dollar."
304,"Hello, Larry."
305,"Oh, by the way..."
306,...are you and Lois gonna be free the night of January 18th?
307,How the hell should I know?
308,"Well, I have to do this little gallery thing."
309,Lorenzo Massengale has been torturing me...
310,...to put my new series of paintings in his new space...
311,...and I just thought maybe you and Lois would want an invitation.
312,"I think I'm busy that night, Sandiford."
313,"Here, I stopped off at Broadway Bob's."
314,You're welcome.
315,I thought Broadway Bob's was an art gallery or something.
316,It's a very famous shithole run by an obnoxious windbag...
317,...who takes credit for the career of every halftalented monkey...
318,...who ever took a class at Strathmore.
319,But the coffee's good.
320,"Hello, Lorenzo, it's Sandy."
321,Just wanted to make sure you got the slides and....
322,"You don't need to call me, because I have a class starting."
323,So I will call you afterwards.
324,Thanks. Bye.
325,Sorry I'm late.
326,"Hello, dear."
327,Looks like this is our lucky day.
328,"I'm sorry, Sandy, I'm just dying for a cigarette."
329,"Yes, absolutely."
330,Fiveminute break.
331,I'm gonna go to the john.
332,Let me borrow this.
333,All right.
334,"She smiled at you, how sweet."
335,You've seen her before?
336,Who is she?
337,Don't get your hopes up.
338,"She's prime real estate, my friend."
339,"Hey, faggots."
340,What a cute couple.
341,I think they like us.
342, Is she a student or just a model?
343, Can we forget about her for a minute?
344,We're about to have a lifechanging experience here.
345,"Jimmy, it's Bardo."
346,Brought someone over to meet you.
347,I got a bottle of Slivovitz here.
348,"It's 80 proof, made in Poland, imported by Boys, welcome."
349,I'm afraid you've interrupted me in the middle of one of my shows.
350,This is Jerome.
351,"Hi, nice to meet you."
352,Thank you for having us.
353,A pleasure.
354,Isn't this a great place?
355,Jimmy's got rent control.
356,So Jerome here...
357,"...wants to be a great artist, Jimmy."
358,How terrific.
359,"Jerome, are you exceptionally skilled as a cocksucker?"
360,It wasn't a rhetorical question.
361,Are you a great artist when it comes to fellatio?
362,No.
363,"No, I guess not."
364,"Well, that's no good."
365,So who do you like?
366,"Who's your favorite artist, Jerome?"
367, Maybe Picasso.
368, I see.
369,Very good.
370,Our old friend...
371,"...""pickasshole."" The nasty little dwarf who went his whole life..."
372,...without a single original thought.
373,"I presume you're joking, right?"
374,Jimmy's a Strathmore grad.
375,Just look at me now.
376,"Just think, Jerome."
377,"One day, this could all be yours."
378,"You're going places, young man."
379,I can feel it.
380,But you need to take some lessons in sucking cock and licking ass.
381,"Otherwise, you might find yourself rotting away in some shithole..."
382,...postponing suicide for the slim chance that you might one day...
383,...possibly see some glorious plague or pestilence...
384,...bring horrible suffering to your hateful species.
385,What are you smiling about?
386,"Laugh away, laughing boy!"
387,I will stomp your guts till they shoot out your ass!
388,I will bury you alive and shit on your grave!
389,"Okay, boys. Show's over."
390,I have to get back to my masturbation.
391,Isn't Jimmy great?
392,"Yeah, definitely."
393,Selfportrait.
394,Starting next week...
395,...I will be selecting the most effective work from each session...
396,...and placing it in the hall gallery.
397, Which gallery?
398, It's on this floor.
399, Down at the end of the hall.
400, By the men's toilet?
401,Yes.
402,"Now, let's get started on these."
403,Who wants to comment?
404,I like Flower's drawing.
405, Yeah. Me too.
406, It seems like she's trying to do...
407,...something more than just draw herself.
408,It's more about the process of drawing.
409,All right. Does anything else up here command your attention?
410,Does anyone have anything more to say on Flower's piece?
411,"Yes, Jerome?"
412, Nothing.
413," Well, ""nothing"" doesn't exist..."
414,...in this classroom.
415,What are you thinking?
416,"We're waiting, Jerome."
417,I don't know. It just It looks like a lame Cy Twombly imitation to me.
418,It looks like she did it in about two minutes.
419,That is such bullshit.
420,"Because her drawing isn't perfect, it's automatically bad?"
421,At least it has humanity.
422,"Yeah, totally."
423,"Jerome, your drawing looks like it was done by a machine."
424,Whereas Flower's....
425,Flower's is full of playfulness and....
426,"Yeah, like, humanity."
427,What's so great about humanity?
428,Humans are a bunch of jerks.
429,I hope a plague wipes out the species.
430, What is your problem?
431," Jesus Christ, Jerome."
432,"Okay, that's enough."
433,This is a required assignment.
434,I have to give it to you.
435,"And, Flower, it is certainly not worth crying about, okay?"
436,"Hey, man."
437,I agree with you 100 percent.
438,I think the entire human race should be wiped off the face of the earth.
439,"Oh, I didn't really mean I was just You don't have to apologize."
440,I'm totally with you on this.
441,So this is the hall gallery.
442,Hey.
443,You guys have to come to my opening tonight.
444,You were really an asshole in class today.
445,Hey. You guys.
446,So are we gonna go see Shilo's opening?
447, How did she ever get a gallery show?
448, It's totally meaningless.
449,Any idiot could sign up for a student gallery.
450,"Oh, my God."
451,What?
452,I didn't notice that.
453,We gotta go.
454,"Great work, Shilo."
455,Hey.
456,Do you know this girl?
457,Yeah. We had her as a model.
458,Remember?
459,But do you know who she is?
460,Do you know her name?
461,You are such a prick.
462,What? You can't say anything nice about my photos?
463, Hi.
464, Hi.
465,That came out really good.
466, Thank you.
467, Shilo.
468,What?
469,"Oh, hi. I'm Audrey, by the way."
470,So is that your real name?
471,Or are you just obsessed with Audrey Hepburn like every art school chick?
472,I was named after an old cartoon.
473,Another ironic pop culture reference.
474,She's a keeper.
475, Hey.
476," God, do you know that guy?"
477, No. I thought he was your friend.
478, No way.
479,"Oh, you're the guy from Sandy's class."
480,I have such a bad memory for faces.
481,I'm sorry.
482,That's okay. I'm Jerome.
483,I was thinking about you today.
484,I saw an old photo of MarieThérèse Walter...
485,...and it looked just like the way that you drew me.
486,She's one of the women who modeled for Picasso.
487,I know just the picture you're talking about.
488,You do?
489,Let's get out of here.
490,What? I said I liked your photos.
491, You didn't have to do that.
492, It's okay.
493,I couldn't bear to watch you get cornered by that creep again.
494,"Well, I have to get going anyway."
495,I'm kind of making the rounds tonight.
496,Really?
497,"Well, maybe sometime we could I have to go to a Donald Baumgarten show."
498,"Oh, I know who he is."
499,"He's an old pop art guy, right?"
500,"Yeah, he's really good. He's great."
501,He's absolutely awful.
502,But I can't get out of it.
503,Do you wanna go with me?
504,"Come on, please."
505,I hate to take the subway by myself.
506,Especially with that weirdo out there strangling everybody.
507,"A little bit. Well, my parents go a lot."
508,Hi.
509,"Audrey, I was afraid you weren't coming."
510,So how's it going?
511,"Well, I think I might have sold two of the small ones."
512, The ones you hate.
513, I like them just fine. You know that.
514,"Just not as much as the big, blue ones."
515,I know.
516,"Daddy, this is Jerome."
517,Jerome is a big fan of yours.
518,I brought him to meet you.
519,"Jerome, this is Donald Baumgarten."
520,"Wow. I'm a big fan of yours, sir."
521,It's really a pleasure.
522,"My pleasure, son."
523,"Daddy, I hate to do this, but I don't think we can stay."
524,"Jerome has to meet someone at another party, and we're late, so  Will I see you on Sunday?"
525, I'll call you.
526,I can't believe you grew up with a dad like that.
527,He's a famous artist.
528,He's hardly a famous artist.
529,It's really heartbreaking.
530,"He should've given up, like, God, I am starving."
531, Should we go eat somewhere?
532, Sure.
533,Have you ever heard of Broadway Bob's?
534,So why are you a model?
535,Just for the money?
536,"Oh, yeah. I make a fortune."
537,"My God, is that who I think it is?"
538,He's always here.
539,That table is practically reserved for postminimalists.
540,This is where everybody gets their first big show.
541,It's like the launching pad from Strathmore to the real world.
542, How do they pick who gets a show?
543, They go to the surveys and all that.
544,What's the matter?
545,Don't you love me anymore?
546,When's the last time you came to see me?
547,"Jerome, this is Broadway Bob."
548, How you doing?
549, Hi.
550,Bob knows everybody.
551,Every artist you can think of had their first show in this place.
552,"Bushmiller, Naugle, Bilbo, you name it."
553,"The minute they get famous, they got no time for me, right?"
554,Hey! I told you to stop hassling my customers!
555,Hector! Fucking Brown Shirts.
556,What are you doing?
557, Good to see you.
558, Bye.
559, Tell your father I said hi.
560, Okay.
561, Hey. Excuse me.
562," Yeah, what?"
563,You wanna help me out?
564,I got two homeless fucks outside...
565,...that panhandle all day.
566,They bother my customers outside.
567,This kid's not a serial killer.
568,Look at that guy out there.
569, Just get the fuck out.
570," All right, let's go."
571, Your coffee sucks.
572, Go to Starbucks.
573,Who's this?
574," Jerome, this is Candace."
575," Hi, how are you? Nice to meet you."
576,Audrey and I used to bump cunts.
577,Just kidding.
578,"But little Audrey doesn't wanna play with me anymore, does she."
579,What do you think of these paintings?
580,They're okay.
581,"I mean, they're not the most They're Candace's paintings."
582, They're really good.
583," Where do you find them, Audrey?"
584,"Anyway, thanks to this little exhibit, I'll get a spring show at the Haberman."
585, That's really great. Congratulations.
586, I know. Golly gosh!
587, You. Get over here.
588," Later, kids."
589,What's this I hear about a show at Haberman? You gotta let me know....
590,"So, what do you wanna do, Jerome?"
591,I wanna be the greatest artist of the 21st century.
592,"Oh, I just meant, ""What do you wanna do now?"" I should probably get home."
593," I'm stupid  No, no, I think it's great."
594,I think you really could be a great artist.
595,You have the right kind of...
596,...energy.
597, You won't believe  Did you hear the news?
598," No, but guess where I was?"
599, The strangler got another one.
600,Some poor schmuck on his way to the subway. I got a major rewrite to do.
601, I was on the subway tonight.
602, You're lucky to be alive.
603," Anyway, guess what I was doing."
604, Smoking pole?
605,"No, I was on a date with the most beautiful girl in the whole school."
606,All right. Can I smell your finger?
607,Look.
608,No shit.
609, Nice.
610, Yeah. She thinks I'm a great artist.
611,You fucking snake.
612,What the fuck are you doing here?
613,Did you already pop her?
614,"No, I...."
615," You know, we just met  Man, if she was my girlfriend..."
616,...I would be pounding that shit day and night.
617,November 28th.
618,November 28th.
619,Try and keep that date...
620,"...in your tiny, little, drugaddled brains."
621,That is the date of the postThanksgiving assessment...
622,...where you'll put up all your work...
623,...and a bunch of us professors are gonna sneak in...
624,...behind your backs and give you a grade.
625,"However, that is but a mere prelude to this day: December 19th."
626,December 19th is the final survey where you will receive...
627,...your oneandonly official grade for this class...
628,"...provided, of course, you all haven't been murdered by then."
629,I heard the final survey is where bigshot gallery owners...
630,...show up to troll for new talent.
631,I wouldn't worry about that too much right now.
632,This could be a big break for somebody.
633,But this is not Schwab's drugstore.
634,You are definitely not Lana Turner.
635, What does that mean?
636, It means you children are too young...
637,...to be worrying about that.
638,"Now, Eno, why haven't you been doing the assignments?"
639,"Frankly, I find them constricting and largely irrelevant."
640,My work has nothing to do with form or light or color...
641,...but with questioning the nature of aesthetic experience.
642,I'll buy that.
643," Jonah, what about you?"
644, I'll bring something next time. Sorry.
645,I also heard that the student with the best grade...
646, ...gets a show at Broadway Bob's.
647," That's been known to happen, yes."
648,Professor Okamura said no one in your class ever got the best grade.
649,"Well, Larry seems to care about that kind of thing a lot more than I do."
650,And Larry has a tendency to live vicariously through his students...
651,...which I find rather pathetic.
652,"I also heard they're cutting faculty, and all the profs..."
653,...are shitting bricks trying to get a student to the Broadway Bob show.
654,Actually. I'm too busy concentrating on my own painting...
655,...to get involved with any kind of faculty intrigue.
656,Is it true Marvin Bushmiller got his break when he got the best grade?
657,Audrey.
658,Hi.
659,I just came in to get a coffee.
660,I have to model for Professor Bogle's class at 6:30.
661,Can I walk with you?
662,"God, you're so polite. Sure."
663,Look at you.
664,"So content with your happy, little lives."
665,But none of you know the taste of true happiness...
666,...the happiness that only death can bring.
667,"I am hell on earth, personified!"
668,What do you think?
669,Should I trim that last part?
670,How much longer you gonna be?
671,It's up to the boss.
672,See you later.
673,"Hey, hey, hey. You can't just leave."
674,What do you think of the movie so far?
