,dialog
1129,"Until we reach your destination, Captain, you're just on for the ride."
1130," Stand by, Lance."
1131," Come on. Throw the rope, asshole."
1132,All right. Come on.
1133,Let's bring it over.
1134,Look in that forward hooch.
1135,Bring the people out of there.
1136,Come on!
1137,"Hurry up, motherfucker!"
1138,"Can couc,  you too."
1139," Keep your eyes open, Clean."
1140," I got you, Chief."
1141,"It's clear, Chief."
1142,"Okay, that's them."
1143,That's them. They're okay.
1144, Board and search it.
1145, It's just a fuckin' boat.
1146, There ain't nothin' on it.
1147, Board it and search it.
1148,"Just some baskets and some ducks, fuckin' bananas."
1149, Ain't nothin' on it.
1150, Chef?
1151, What's wrong? Search it.
1152, There's the goat and some fish.
1153, Chef!
1154, Fuckin' vegetables...
1155, Get on that boat!
1156," There's nothin' on it, man!"
1157, Get on it!
1158, All right!
1159,"Move it, asshole!"
1160,Goddam it!
1161,"Just some pigs! Look, mangoes!"
1162, What's in the rice bag?
1163, Fuckin' rice!
1164, Look in there!
1165, Some fuckin' fish!
1166,More coconuts.
1167,Rice. Here's rice.
1168, What's in that vegetable basket?
1169, Get out of here!
1170,Come on!
1171,Check that vegetable basket!
1172, All right!
1173," Shut up, slope!"
1174, There ain't nothin' in here!
1175, What's in the boxes?
1176, Look in that rusty can.
1177, Nothing!
1178,Just fuckin' rice!
1179,There ain't nothin' on it!
1180,Check the yellow can!
1181,She was sittin' on it. What's in it?
1182,Chef!
1183,Motherfuckers!
1184,Motherfuckers!
1185, Hold it!
1186, Come on! Let's kill them all.
1187, Motherfucking cocksuckers mothers!
1188, Hold it! Hold it!
1189,Let's kill all the assholes!
1190,Shoot the shit outta all of 'em.
1191, Hold it!
1192, Why not? Jesus Christ.
1193,Why the fuck not?
1194, Clean?
1195, I'm good.
1196," You okay, Lance?"
1197, Shit! Fuck! Shit!
1198, Chef!
1199, Look what she was hiding!
1200, You all right?
1201, See what she was runnin' for?
1202,It's a fuckin' puppy.
1203,It's a fuckin' puppy.
1204,Give me that dog!
1205, Give me that dog!
1206, No! You're not gonna get it!
1207, Give it to me!
1208," Give me the fuckin' dog, asshole!"
1209,Fuck you! Fuckin' mango too!
1210, Chef...
1211, You want that?
1212,She's moving behind you.
1213,She's alive. Check her out.
1214,Chef! She's moving behind you.
1215,Check her out!
1216,All right. All right.
1217,"Come on, Clean! Goddam it!"
1218,She's not dead. She's wounded.
1219,Give him a hand.
1220,Just take it easy.
1221,Take it easy!
1222, Slow down and take it easy.
1223," Chef, wait a minute."
1224, Bring her up.
1225, Is she breathing?
1226,She's hurt. She's bleedin'.
1227,Bring her on board.
1228,We're taking her to an ARVN.
1229, What are you talking about?
1230, We're taking her to some friendlies.
1231, She's wounded. She's not dead.
1232, Get out of there.
1233,The book says...
1234,Fuck you. Fuck him.
1235,I told you not to stop.
1236,Now let's go.
1237,"It was a way we had over here of living with ourselves.  We'd cut 'em in half with a machine gun and give 'em a BandAid.  It was a lie.  And the more I saw of them...  the more I hated lies.  Those boys were never gonna look at me the same way again...  but I felt like I knew one or two things about Kurtz that weren't in the dossier.  Do Lung Bridge was the last army outpost on the Nung River.  Beyond it, there was only Kurtz.   What do you think?"
1238, It's beautiful.
1239,Huh? What's the matter with you?
1240,You're acting kind of weird.
1241,"Hey, you know that last tab of acid I was saving?"
1242, I dropped it.
1243, You dropped acid?
1244,Far out.
1245,Friendly!
1246,Friendly! Friendly!
1247,Take me home!
1248,Goddam it!
1249, Fucking shore police! Shit!
1250," Man, you wanna die?"
1251,Don't keep goin'!
1252, You fuckin' police!
1253, Don't leave me!
1254,Fuck you!
1255,You'll get what you deserve!
1256,Is there a Captain Willard on board?
1257, Yeah.
1258, Captain Willard?
1259, Yeah. Who's that?
1260," Lieutenant Carlsen, sir."
1261,Get that light off me!
1262,"I was sent here from Nha Trang with these three days ago, sir."
1263,Expected you here a little sooner.
1264,This is mail for the boat.
1265, Don't know how happy this makes me.
1266, Why?
1267,"Now I can get out of here, if I can find a way."
1268,"You're in the asshole of the world, Captain."
1269,"Captain, where you going?"
1270,See if I can find some fuel and get some information.
1271,Pick me up at the other side of the bridge.
1272,Somebody go with him. Chef.
1273,I'll go.
1274,I wanna go.
1275,"Man, listen to the music, man."
1276,Where can I find the CO?
1277,"You came right to it, son of a bitch!"
1278,Get down here!
1279,You still got a commanding officer here?
1280, Beverly Hills.
1281, What?
1282,"Straight up the road, there's a concrete fucking bunker called Beverly Hills!"
1283,Where the fuck else do you think it would be?
1284, Goddam it! You stepped in my face.
1285, I thought you were dead.
1286,"Well, you thought wrong, damn it!"
1287,"I told you to stop fucking with me, didn't I?"
1288,"You think you're so bad, huh, nigger?"
1289,"What are you shooting at, soldier?"
1290,What the fuck ya think I'm shootin' at?
1291,"I'm sorry, sir. There are gooks out there by the wire."
1292,But I think I killed them all.
1293,You ain't shot shit. Listen.
1294,"Oh, shit. He's trying to call his friends. Send up a flare."
1295,"Think you so bad, huh, nigger?"
1296,"You think you bad, huh?"
1297,"They're all dead, stupid."
1298,There's one still alive underneath them bodies.
1299,Who's the commanding officer here?
1300,Ain't you?
1301,You think you so bad?
1302,"I got something for your ass now, nigger! I got something for you now!"
1303,"He's underneath the bodies, man."
1304,Go get the Roach for me.
1305,"Go get the Roach, nigger!"
1306,Go get the Roach.
1307,Roach. Roach.
1308,"Got slopes on the wire, man."
1309,You hear 'em?
1310,Do you hear 'em?
1311,"Fuck you, GI!"
1312,We'll bust 'em!
1313,"Hey, GI, fuck you!"
1314,"Fuck you, GI!"
1315,"Fuck you, GI!"
1316,"Hear him out there on the wire, man?"
1317," I kill you, GI!"
1318, You need a flare?
1319,"He's close, man."
1320,He's real close.
1321,"Fuck you, GI!"
1322,I kill you!
1323,"Fuck you, GI!"
1324,"GI, fuck you!"
1325,GI! GI...
1326,Motherfucker.
1327,"Hey, soldier."
1328,Do you know who's in command here?
1329,Holy shit.
1330,"Hey, Chief, man. Two guys just got blown off that bridge."
1331,"You hang on, man."
1332,You're gonna be okay.
1333, What's that?
1334," Mail, man. Mail."
1335,Later on the mail.
1336,Watch them trees.
1337,"There's no diesel fuel, but I picked up some ammo."
1338,Let's move out.
1339," Did you find the CO, Captain?"
1340, There's no fucking CO here.
1341,Let's just get goin'.
1342,"Which way, Captain?"
1343,"You know which way, Chief."
1344,"You're on your own, Captain."
1345,Still wanna go on?
1346,It's like this bridge.
1347,"We build it every night, Charlie blows it right back up again..."
1348,just so the generals can say the road's open.
1349,Think about it.
1350, Who cares?
1351, Just get us upriver!
1352,"Chef, on the bow."
1353," Stand by, Clean."
1354, Let's go!
1355,"You got one, Miller."
1356,"Jeez, I got some too."
1357,Whose package is that?
1358," Shit, you got another one, Clean."
1359, No shit? Wait a minute.
1360, Is that it?
1361, That's it for you. Lance.
1362,"Mr. L.B. Johnson, there you go."
1363,"Far out, man. All right."
1364,I've been waitin' for this one.
1365,I got another one.
1366,I got a box from Eva.
1367,"""Lance."
1368,I'm fine. I'm fine.
1369,Sue and I went tripping in Disneyland.
1370,"Sue skinned her knee."" Man, I wanna get back to Antoine's."
1371,"""I remember the time we went up to..."" How could I fucking forget? Beautiful."
1372,"""There could never be a place like Disneyland, or could there?"
1373,"Let me know."" Jim, it's here."
1374,It really is here.
1375,"""There has been a new development regarding your mission...  which we must now communicate to you.  Months ago, a man was ordered on a mission which was identical to yours.  We have reason to believe that he is now operating with Col. Kurtz.  Saigon was carrying him MIA for his family's sake...  but they assumed he was dead.  Then they intercepted a letter he tried to send to his wife. "" Captain Richard Colby.  He was with Kurtz.  Disneyland."
1376,"Fuck, man, this is better than Disneyland."
1377,"""Charles Miller Manson ordered the slaughter of all in the home..."
1378,"anyway as a symbol of protest."" That's really weird, ain't it?"
1379," Purple haze. Look, man."
1380," Hey, Lance, put away that smoke."
1381, I got a tape from my mom.
1382," Rainbow reality, man."
1383,"Hey, Chief, get a good whiff."
1384,Eva can't picture me in Vietnam.
1385,She pictures me at home having a beer watching TV.
1386,"Hey, Lance, man."
1387,"Oh, hot potato, hot potato."
1388,"I'm so glad you decided to join the navy.  Eva's not sure she can have a relationship with me, you know."
1389,"Here I am, trying to keep a relationship with my ass."
1390,That's much more than I can say for some of your friends.  If this tape is any good...  I will have Dad and the family send you a tape of their own.  Fuckers!
1391,There! Over there!
1392,Motherfuckers!
1393,There. Over there!
1394,"Chef, check out Clean!"
1395,"Captain, he's hit. Clean's hit."
1396,Where'd the dog go?
1397,Lance! Lance!
1398,They got Clean.
1399,Where's the dog?
1400,We gotta go back and get the dog.
1401,"Hey, Clean. Hey."
1402,"Hey, bubba."
1403,"Bubba, you can't die, you fucker!"
1404,"Hey, bubba."
1405,And so I'm hoping that...
1406,"pretty soon... not too soon...  but pretty soon I'll have a lot of grandchildren to love and spoil.  And then when your wife get 'em back, she'll be mad with me.  Even Aunt Jessie and Mama...  will come to celebrate your coming home.  Granny and Dad are trying to get enough money to get you a car...  but don't tell 'em because that's our secret.  Anyhow, do the right thing...  stay out of the way of the bullets...  and bring your heinie home all in one piece...  because we love you very much.  Love, Mom.  Hold on."
1407,Throw me the glasses.
1408,"Lance, take a 16 on the bow."
1409,Chef. Chef.
1410,On the 60.
1411,Fuck me.
1412,Cover the captain. Lance.
1413,Cover the captain.
1414,They're French.
1415,They're French.
1416,Pick up that weapon!
1417,Pick it up! Pick it up!
1418,Stand fast. Captain.
1419,"All right, you men."
1420,Put down your weapons.
1421,We lost one of our men.
1422,We French always pay respect to the dead of our allies.
1423,You're all welcome.
1424,My name is Hubert DeMarais.
1425,This is my family's plantation.
1426,It has been such for 70 years.
1427,And it will be such until we are all dead.
1428,"Captain, accept the flag of Tyrone Miller..."
1429,on behalf of a grateful nation.
1430,"This food is really wonderful, isn't it? The wine, the sauces."
1431,I can't believe it.
1432,"Hey, can I speak with the chef?"
1433,The chef speak only Vietnamese.
1434,No kidding? He cooks like this and he can't even speak French?
1435,"Hey, Lance, the chef's a slope."
1436,This is Baudelaire.
1437,It's a very cruel poem for children.
1438,"But they need it, 'cause life sometimes is very cruel."
1439,As you can see.
1440,Attack repels by the family.
1441,Just for this war.
1442,"Vietcong, 58."
1443,"North Vietnamese, 12."
1444,"South Vietnamese, 11."
1445,"Americans, six?"
1446,"Yes. Well, there were perhaps mistakes."
1447,May I present Captain Willard.
1448,He is of a paratroop regiment.
1449,Madame Sarrault.
1450,Captain.
1451,"Oh, I'm sorry, Captain."
1452,It was just a little story...
1453,about Paris and people starving during the war.
1454,"They are all around the table, and there was a silence and somebody say..."
1455,"""An angel is passing by."" So somebody said, ""Let's eat it."" Oh."
1456,How long can you possibly stay here?
1457,We stay forever.
1458,"No, no. I mean..."
1459,why don't you go back home to France?
1460, Back home?
1461," I mean, this is our home, Captain."
1462,"Sooner or later, you're..."
1463,You don't understand our mentality...
1464,the French officer mentality!
1465,"At first, we lose in Second World War."
1466,"I don't say that you Americans win, but we lose."
1467,"Oh, Papa..."
1468,"In Dien Bien Phu, we lose."
1469,"In Algeria, we lose."
1470,"In Indochina, we lose!"
1471,But here we don't lose!
1472,"This piece of earth, we keep it."
1473,We will never lose it.
1474,Never!
1475,You Americans.
1476,"In 1945, yeah..."
1477,"after the Japanese war, your President Roosevelt..."
1478,didn't want the French people to stay in Indochina.
1479,So...
1480,you Americans implant the Vietminh.
1481,What's he mean?
1482,"Yeah, that's true. The Vietcong were invented by the Americans."
1483,The Americans?
1484,And now you take the French place...
1485,and the Vietminh fight you.
1486,And what can you do?
1487,Nothing.
1488,Absolutely nothing.
1489,The Vietnamese are very intelligent.
1490,You never know what they think.
1491,"The Russian ones who help them, ""Come and give us their money."
1492,"We are all Communists. Chinese, give us guns. We are all brothers."" They hate the Chinese!"
1493,Maybe they hate the American less than the Russian and the Chinese.
1494,"I mean, if tomorrow the Vietnamese are Communists..."
1495,they will be Vietnamese Communists.
1496,"And this is something that you never understood, you American."
1497,I don't know.
1498,Maybe in the future we can make something with the Vietminh.
1499,Don't you understand?
1500,"The VC say, ""Go away. Go away."" That's finish for all the white people in Indochina."
1501,"If you're French, American, that's all the same."
1502,"""Go."" They want to forget you."
1503,"Look, Captain."
1504,"Look, this is the truth."
1505,An egg.
1506,The white left...
1507,but the yellow stays!
1508,"When I was in Saigon, I spoke to an American politician."
1509,He explained it very well.
1510,"He said, ""Look."
1511,"Yesterday, it was Korea."
1512,"Today, Vietnam."
1513,"Tomorrow, Thailand, the Philippines..."
1514,"then maybe Europe."" Come on. Why not Europe?"
1515,Look what happened in Czechoslovakia recently.
1516,Even before Second World War Americans knew exactly what was going on.
1517,They don't want that shit to take over! LeFevre!
1518,All you white people are shit.
1519,They are fighting...
1520,fighting for freedom.
1521,Freedom? Bullshit.
1522,French bullshit.
1523,American bullshit.
1524,"Dien Bien Phu, that serious."
1525,All soldiers know they are already dead.
1526,You know anything about Dien Bien Phu?
1527," Yeah, I know."
1528," No, you don't."
1529, Not really.
1530, Dien Bien Phu was an error.
1531,A military mistake.
1532,A mistake?
1533,A voluntary mistake!
1534,Voluntary!
1535,All the soldiers knew.
1536,We knew we would be dead.
1537,The generals and the colonels believe it's impossible for the Viets...
1538,to get the cannon up there in the mountains.
1539,But they do. Then they wait for the rain to come.
1540,"When it comes, no aeroplane can fly there."
1541,And our paratroopers jump at 90 meters.
1542,"I mean, you know, I mean, that's crazy."
1543,No army in the world can do that.
1544,And they only do that to be dead with their friends.
1545,The French Army was sacrificed.
1546,Sacrificed by the politicians safe at home.
1547,They put the army in an impossible situation where they couldn't win.
1548,The students are marching in Paris...
1549,"protesting, demonstrating."
1550,They stab the soldiers in their back.
1551,"The soldier would open the grenade, it wouldn't work."
1552,A piece of paper would fall...
1553,"""Union of French Women."" ""We are for the Viets."" Traitors!"
1554,Communist traitors at home.
1555,"Dien Bien Phu, okay."
1556,"The French is shit, huh?"
1557,No one care.
1558,No one want...
1559,"Why don't you Americans learn from us, from our mistakes?"
1560,"Mon Dieux,  with your army, your strength..."
1561,"your power, you could win if you want to!"
1562,You can win.
1563,"You know, I'm sure we can make something here."
1564,"I'm sure about it, you know?"
1565,I never do something wrong to the people here.
1566,"That's right, but the Communist at home have never been traitors."
1567, Communist!
1568, Socialist!
1569,"Capitaine,  good night."
1570,"He was a Socialist, you know."
1571,We can stay. I know that we can stay. We can.
1572,"You know, we always helped the people."
1573,We work with the people.
1574,"So we can be friends, we are agreed."
1575,"See, Captain, when my grandfather..."
1576,and my uncle's father came here...
1577,there was nothing...
1578,nothing.
1579,The Vietnamese were nothing.
1580,So we worked hard...
1581,"very hard, and brought..."
1582,"the rubber from Brazil, and then plant it here."
1583,"We took the Vietnamese, work with them..."
1584,make something...
1585,something out of nothing.
1586,"So when you ask me why we want to stay here, Captain..."
1587,we want to stay here because it's ours... it belongs to us.
1588,It keeps our family together.
1589,"I mean, we fight for that."
1590,"While you Americans, you are fighting for..."
1591,the biggest nothing in history.
1592,"I'm sorry, Captain. I will see if your men need any help to..."
1593,repair your boat...
1594,so that you can go on with your war.
1595,"I apologize for my family, Captain."
1596,We have all lost much here.
1597,Hubert... his wife and two sons.
1598,And I have lost a husband.
1599,I understand.
1600,You are tired of the war.
1601,I can see it in your face.
1602,'Twas the same in the eyes of the soldiers of our war.
1603,"We called them ""Les Soldats Perdus..."" The Lost Soldiers."
1604,"If you like, we can have some cognac."
1605,I have to...
1606,to see about my men and...
1607,The war will be still here tomorrow.
1608,"Yeah, I guess you're right."
1609,I noticed you had no wine at dinner.
1610,"No, I don't drink wine."
1611,"I do like cognac, but I don't want any now. Thank you."
1612,Well...
1613,then I...
1614,I must drink alone.
1615,Will you go back after the war to America?
1616,Then you're like us...
1617,your home is here.
1618,Do you know why you can never step into the same river twice?
1619,Yeah. 'Cause it's always moving.
1620,I used to prepare a pipe for my husband.
1621,'Twas the morphine he took for the wounds he suffered in his heart.
1622,"He would rage and he would cry, my lost soldier."
1623,"And I said to him, ""There are two of you."
1624,Don't you see?
1625,"One that kills and one that loves."" And he said to me..."
1626,"""I don't know whether I'm an animal or a god."" But you are both."
1627,You want more?
1628,All that matters is that you're alive.
1629,"You are alive, Captain."
1630,That's the truth.
1631,"There are two of you, don't you see?"
1632,One that kills...
1633,and one that loves.
1634,Can't see nothing.
1635,We stoppin'.
1636,"You're not authorized to stop this boat, Chief."
1637,"I said I can't see a thing, Captain."
1638,I'm stopping this boat.
1639,I ain't riskin' no more lives.
1640,"I'm in command here, goddam it."
1641,You'll do what I say.
1642,"You see anything, Chef?"
1643,"Why don't they fucking attack, man?"
1644,"Watch it over here, Chief."
1645,Got a stump.
1646,On the fifties.
1647,"He was close.  He was real close.  I couldn't see him yet, but I could feel him...  as if the boat were being sucked upriver...  and the water was flowing back into the jungle.  Whatever was going to happen...  it wasn't going to be the way they called it back in Nha Trang.   Arrows!"
1648, Fire!
1649,"Chef, open up! Fire!"
1650,"Lance, fire!"
1651,"Chef! Chef, it's okay."
1652,Quit firing.
1653, They're just little toy arrows.
1654, Cut it out! Quiet!
1655,"Chief, tell them to hold their fire!"
1656,They're just little sticks.
1657,They're just trying to scare us.
1658,Quiet!
1659,"You got us into this mess, and now you can't get us out..."
1660,"because you don't know where the hell you're going, do ya?"
1661,Do ya?
1662,You son of a bitch!
1663,You bastard!
1664,"Lance, get the wheel!"
1665,You savages! Come and get it!
1666,You son of a bitches!
1667,A spear?
1668,My mission is to make it up into Cambodia.
1669,There's a Green Beret colonel up there who's gone insane...
1670,and I'm supposed to kill him.
1671,That's fucking typical!
1672,Shit!
1673,Fuckin' Vietnam mission!
1674,I'm short and we gotta go up there so you can kill one of our own guys?
1675,That's fucking great!
1676,"That's just fucking great, man."
1677,Shit!
1678,That's fuckin' crazy.
1679,"I mean, I thought you were going in to blow up a bridge..."
1680,or some fuckin' railroad tracks or somethin'.
1681, That's all right.
1682," No. No, wait. Wait."
1683,"We'll go together, on the boat."
1684,We'll go with you.
1685,"We'll go up there, but on the boat. Okay?"
1686,Part of me was afraid of what I would find...  and what I would do when I got there.  I knew the risks...  or imagined I knew.  But the thing I felt the most...  much stronger than fear...  was the desire to confront him.  Just keep movin'.
1687,"Lance, keep your hands away from the guns."
1688,It's all right! It's all right!
1689,It's all been approved!
1690,I ain't comin' in there!
1691,Them bastards attacked us!
1692,"Hey, zap 'em with your siren, man."
1693,Zap 'em with your siren.
1694,There's mines over there and mines over there too.
1695,"And watch out. Those goddam monkeys will bite you, I'll tell you."
1696,"Ah, that's a pretty one."
1697,Move it right in towards me.
1698,I'm an American.
1699,Yeah. An American civilian.
1700,"Hi, Yanks."
1701,Hi. American.
1702,American civilian.
1703,It's all right.
1704,And you got the cigarettes. And that's what I've been dreaming about.
1705, Who are you?
1706, Who are you?
1707,I'm a photojournalist.
1708,I've covered the war since '64.
1709,"I've been in Laos, Cambodia and 'Nam."
1710,"Hoowee, baby. I'll tell you one thing."
1711,"This boat is a mess, man."
1712,Who are all these people?
1713,"Yeah, well, they think you've come to..."
1714,to take him away.
1715, And I hope that isn't true.
1716, Take who away?
1717,Him! Col. Kurtz.
1718,"These are all his children, man, as far as you can see."
1719,"Hell, man, out here we're all his children."
1720,Could we talk to Col. Kurtz?
1721,"Hey, Mac."
1722,You don't talk to the colonel.
1723,"Well, you listen to him."
1724,The man's enlarged my mind.
1725,He's a poet warrior in the classic sense.
1726,"I mean, sometimes he'll..."
1727,"Well, you say hello to him, right?"
1728,He'll just walk by you and he won't even notice you.
1729,Then suddenly he'll grab you and he'll throw you in a corner and he'll say...
1730,"""Do you know that 'if' is the middle word in 'life'?"
1731,If you can keep your head when all about you are losing theirs and blaming you.
1732,"If you can trust yourself when all men doubt you."" I'm a little man. I'm a little man."
1733,He's a great man.
1734,"""I should have been a pair of ragged claws..."
1735,"scuttling across floors of silent seas.""  I mean..."
1736, Stay with the boat.
1737,"Don't go any... Don't go without me, okay? I wanna get a picture."
1738,He can be terrible and he can be mean...
1739,and he can be right.
1740,He's fighting the war.
1741,He's a great man.
1742,I mean...
1743,"I wish I had words, you know."
1744,I wish I had words.
1745,"I could tell you something like, the other day he wanted to kill me."
1746, Something like that.
1747, Why'd he want to kill you?
1748,Because I took his picture.
1749,"He said, ""If you take my picture again..."
1750,"I'm gonna kill you."" And he meant it."
1751,"See, just lay cool."
1752,Lay cool.
1753,Lay back. Dig it.
1754,He gets friendly again.
1755,He really does.
1756,But you don't... you don't...
1757,you don't judge the colonel.
1758,You don't judge the colonel like an ordinary man.
1759,"Okay, watch it now."
1760,These are Americans. Americans!
1761,You can feel the vibe of this place.
1762,"Let me take your picture. Hey, could you hold... Hey, hello. Hello."
1763,Could you hold up a minute?
1764,Colby.
1765,The heads.
1766,You're looking at the heads.
1767,"I, uh... Sometimes he goes too far."
1768,He's the first one to admit it.
1769, He's gone crazy.
1770," Wrong, wrong!"
1771,If you could have heard the man just two days ago...
1772,"if you could have heard him then, God..."
1773, You were gonna call him crazy?
1774, Fuckin' A!
1775,I just wanna talk to him.
1776,"Well, man, he's gone away."
1777,He's gone away. He disappeared out in the jungle with his people.
1778, I'll wait for him.
1779, He feels comfortable with his people.
1780,He forgets himself with his people.
1781, He forgets himself.
1782, Captain?
1783,Maybe we should wait back at the boat.
1784, I think you should...
1785," Okay, Chef."
1786,We'll go back to the boat for a while.
1787,"Yeah, stay with Lance."
1788,"This colonel guy, he's wacko, man."
1789,He's worse than crazy.
1790,He's evil!
1791,"I mean, that's what the man's got set up here, man!"
1792,It's fuckin' pagan idolatry.
1793,Look around you!
1794," Shit, he's loco."
1795, Then you'll help me?
1796,"Fuckin' A, I'll help you. I'll do anything to get out of this joint."
1797, Good boy.
1798, We could blow all them assholes away.
1799,"They're so fuckin' spaced out, they wouldn't even know it."
1800,I ain't afraid of all them fuckin' skulls and altars and shit.
1801,I used to think if I died in an evil place...
1802,then my soul wouldn't be able to make it to Heaven.
1803,"But now, fuck..."
1804,"I mean, I don't care where it goes, as long as it ain't here."
1805,So what do you wanna do?
1806,I'll kill the fuck.
1807, Get out of here.
1808," I'm gonna need you to wait here, Chef."
1809,"I'll go up with Lance and scrounge around, check the place out."
1810,"See if I can find the colonel, okay?"
1811,"Well, what do you want me to do?"
1812,Here. You take the radio...
1813,and if I don't get back by 2200 hours...
1814,you call in the air strike.
