,dialog
541," Some other time, Bill."
542, Just 20 minutes!
543, I'm an artist.
544, Keep walking.
545,"Okay, give it a try, guys."
546,"One goes left and one goes right.  Look, Lance.   You through surfing?"
547, Yeah!
548, Wanna say goodbye to the colonel?
549, No.
550, You sure?
551, Yeah!
552, Get the fuck outta here.
553, It's the napalm.  Just wait 20 minutes!  Damn! Fuck!
554,They've been lookin' for ya.
555, Don't leave without me!
556, Where the fuck you goin'?
557,Here!
558,Incoming!
559,That's the colonel's surfboard!
560,"Hey, get the fuck off me!"
561,It's mine!
562,You fucking Airborne!
563, Lance.
564," Chef, light up, man."
565,Come on. Let's get high.
566, Wanna smoke?
567," Let's do it, man. Light up."
568,Someday this war's gonna end.  That would be just fine with the boys on the boat.  They weren't looking for anything more than a way home.   Captain?
569," Trouble is, I'd been back there...  and I knew that it just didn't exist any more.  Buddha time. Here."
570,"All right, that's great, you motherfuckers. Yeah."
571,"If that's how Kilgore fought the war...  I began to wonder what they really had against Kurtz.  It wasn't just insanity and murder.  There was enough of that to go around for everyone.  I mean, he never was hurtin' for pussy."
572,I'm not here. I'm walking through the jungle gathering mangos.
573,I meet Raquel Welch.
574,I make a nice mango cream pudding.
575,"You know, kind of spread it around on us."
576,She's into mangos too.
577,She's like one limb above me.
578, We're both in the jungle here nude.
579," Hey, Chief."
580, Yeah?
581, Here comes that colonel guy again.
582,"You know how hard it is to find a board you like.  I will not hurt or harm you.  I will not hurt or harm you.  Just give me back the board, Lance.  It was a good board, and I like it.  You know how hard it is to find a board you like.   He's a determined motherfucker!"
583," I will not hurt or harm you.  I will not hurt or harm you.  Just give me back the board, Lance.  It was a good board, and I like it.  You know how hard it is to find a board you like.   I will not hurt or harm you."
584, Jesus Christ.
585,"That guy's too fuckin' much, man."
586,Do you think he would have shot us?
587,He wouldn't have shot us on the beach...
588,but he would have shot us if he saw me taking his board.
589,Let's go surfin' now Everybody's learnin' how Let's get this board out of my turret.
590,Sucker.
591,How am I going to shoot him the next time he comes around?
592,"Hey, Chef, make some room back there for the board."
593,"Sock it to me, Lance."
594,I wonder if that's the same chopper.
595,He's probably got them all over the river with that recording.
596,"We'll have to hold up here till dark, Chief."
597,"Don't worry, Lance."
598,He won't follow us too far.
599,What makes you say that?
600,You think that big Cav colonel wants everyone upriver...
601,to know we stole his board?
602,I didn't steal it!
603, Captain?
604, Hmm?
605,Just how far up this river we goin'?
606,"It's classified, Chief."
607,I can't tell ya.
608,We're goin' up pretty far.
609,Is it gonna be hairy?
610,"I don't know, kid."
611,"Yeah, probably."
612,"You like it like that, Captain, when it's hot, hairy?"
613,Fuck.
614,Maybe you'll get a chance to know...
615,what the fuck you are in some factory in Ohio.
616,"Hey, Chief, I'm gonna go get those mangos now, okay?"
617, Take somebody with ya.
618," Yeah, I'll take..."
619,I'll go with him.
620,Chef?
621," Yes, sir?"
622, How come they call you that?
623," Call me what, sir?"
624, Chef.
625, Because you like mangos and stuff?
626," No, sir, I'm a real chef."
627, I'm a saucier.
628, Saucier?
629,"Yes, sir."
630,"See, I come from New Orleans."
631,"I was raised to be a saucier, a great saucier."
632, What's a saucier?
633, You specialize in sauces.
634,Gotta be a mango tree here somewhere.
635,"Then, I was supposed to go to Paris..."
636,study at the Escoffier school.
637,But then I got orders for my physical.
638,"Hell, I joined the navy."
639,Heard they had better food.
640,Cook school... that did it.
641," Yeah, how's that?"
642, You don't wanna hear about that.
643,They lined us up in front of a hundred yards of prime rib.
644,"All of us, you know, lined up lookin' at it."
645,Magnificent meat. Really!
646,Beautifully marbled.
647,"Next thing, they're throwing the meat into these big cauldrons..."
648,all of it... boiling it!
649,"I looked inside, man."
650,It was turning grey.
651,I couldn't fucking believe that one.
652,"That's when I applied for radioman school, but then they gave me..."
653,What is it?
654,Charlie?
655,It's a tiger!
656,Son of a bitch!
657,"It's a tiger, man! It's a tiger!"
658,Battle stations.
659,"Lance, up front."
660, Get on your 60!
661, Got it.
662, Holy shit! A fuckin' tiger!
663," Chef, come on!"
664," Captain, come on!"
665, Let's hop in and go!
666,Let's go!
667,You were right.
668,Never get out of the boat.
669, Bring that 60 forward!
670, Why never get out of the boat?
671,I gotta remember!
672,Never get out of the boat!
673,Never get out of the boat!
674, How many is it?
675, A fuckin' tiger!
676, What?
677, A tiger?
678,"Yes! I've had it! I've had the whole goddam fuckin' shit, man!"
679,You can kiss my ass on the county square...
680,because I'm fuckin' buggin' out.
681,I didn't come here for this.
682,I don't fuckin' need it!
683,I don't want it.
684,I didn't get out the goddam eighth grade for this kind of shit!
685,All I wanted to do was fuckin' cook!
686,"I just wanted to learn to fuckin' cook, man!"
687, You're all right.
688," What happened, bro?"
689,You're all right.
690,You're gonna be all right.
691,All right?
692,It's gonna be all right?
693,Never get out of the fuckin' boat.
694,"Hi, tiger! Bye, tiger!"
695,Goodbye!
696,"Never get out of the boat.  Absolutely goddam right...  unless you were going all the way.  Kurtz got off the boat.  He split from the whole fuckin' programme.  How did that happen?  What did he see here that first tour?  Thirtyeight fucking years old.  If you joined the Green Berets...  there was no way you'd ever get above colonel.  Kurtz knew what he was giving up.  The more I read and began to understand...  the more I admired him.  His family and friends couldn't understand it...  and they couldn't talk him out of it.  He had to apply three times, and he put up with a ton of shit.  But when he threatened to resign, they gave it to him.  The next youngest guy in his class was half his age.  They must have thought he was some farout old man...  humping it over that course.  I did it when I was 19."
697,It damn near wasted me.  A tough motherfucker.  He finished it.  He could have gone for general...  but he went for himself instead.  Dear Eva...
698,Today was really a new one.
699,Almost got eaten alive by a fuckin' tiger.
700,"Really unfucking believable, you know?"
701,"We're taking this guy, Captain Willard, up the river..."
702,but he hasn't told us yet where we're taking him.
703,"Come on, baby Thought you might have heard by now from Elwood."
704,October 1967.
705,"On special assignment...  Kontoom Province, II Corps.  Kurtz staged Operation Archangel with combined local forces.  Rated a major success.  He received no official clearance.  He just thought it up and did it.  What balls.  They were gonna nail his ass to the floorboards for that one.  But after the press got a hold of it...  they promoted him to full colonel instead.  Oh, man, the bullshit piled up so fast in Vietnam.  You needed wings to stay above it.  This sure enough is a bizarre sight in the middle of this shit."
706,Expecting us this time?
707,Damned if I know.
708,Hello. Hello.  Jesus...
709,Wow.
710, It goes back up into the truck.
711, What?
712,We gotta get all that stuff up.
713,"Hau Phat. You ever been up here before, Chef?"
714,I bet you we can score up here.
715,"Check out the bikes, Lance."
716,"Yamaha, Suzuki. Yeah!"
717, That's a good one.
718," Yeah, Sukiyaki."
719,"Yeah, man."
720,This is something.
721, Please!
722, This must be the guy.
723,Right over there.
724,Sergeant. Sergeant.
725,"Three drums of diesel fuel, PBR five..."
726,"Come on, man! Move!"
727,We don't have time. One hour.
728,That's all. What do you want?
729, Can I get some Panama Red?
730," Yeah, I'll get you Panama Red."
731, Sergeant?
732, Destination?
733,I don't have no destination.
734,I can't do a goddam thing without a destination.
735, Sarge? Sarge?
736, I need a destination!
737,I can't do a thing about it with a destination.
738,These guys are with me.
739,Destination's classified.
740,I carry priority papers from ComSec Intelligence.
741,"Okay, right, sir. Hey, listen, it's a real big night."
742,Eight bucks for that...
743,Hey!
744,All right. Damn.
745, Just give him some fuel.
746, You got it.
747, Dog starts barking.
748," Hey, listen, Captain."
749,I'm really sorry about tonight.
750,It's really bad around here.
751,Just take this over to the man at the supply desk and you got it.
752,Would you guys like some seats...
753,some press box seats for the show?
754,The show out here.
755," Bunnies, bunnies."
756, Playboy bunnies?
757,You got it.
758,You gonna be here?
759,"Hey, listen, Captain, on the house."
760,"No hard feelings, huh?"
761,"How ya doin' out there?  I said, how ya doin' out there?  Wanna say hello to you from all of us up here...  to all of you out there who work...  so goddam hard in Operation Brute Force!  Hello, all you paratroopers out there!  And the marines!"
762,"And the sailors!  We wanna let you know that we're proud of you!  We know how tough and how hard it's been.  To prove it we're gonna give you entertainment you're gonna like.  Miss August, Miss Sandra Beatty.  Miss May, Miss Terri Teray! Yeah!  And the playmate of the year, Miss Carrie Foster! Yeah!  Yo! Whoa!"
763,"Oh, SusieQ Oh, SusieQ  Oh, SusieQ baby, I love you  Hello!"
764,"SusieQ I like the way you walk I like the way you talk I like the way you walk I like the way you talk SusieQ Oh, SusieQ Oh, SusieQ Oh, SusieQ Baby, I love you SusieQ I love you!   Come on!"
765, What's the matter?
766,"Come on, baby!"
767,Grease my gun!
768,"I'm ready to powwow, baby!"
769,Come on! All right!
770,You're cute. I like you.
771,"I'm here, baby! I'm here!"
772,Yeah!
773, You fucking bitch!
774, Take it off!
775,Take it off!
776,"Hey, lover!"
777,You want us to come over!
778, I sure do!
779, Sign my centerfold!
780,Sign my centerfold!
781,"Come on, baby!"
782,Goddam!
783,Start her up. Hey!
784,Get out of my way!
785,Come on!
786, Will you sign these?
787, Let's go! Let's go!
788,Hurry!
789,So long!
790,"Charlie didn't get much USO.  He was dug in too deep or moving too fast.  His idea of great R and R was cold rice and a little rat meat.  He had only two ways home...  death or victory.  No wonder Kurtz put a weed up Command's ass.  The war was being run by a bunch of fourstar clowns...  who were gonna end up giving the whole circus away.  Hey, you know, man, that was farfuckingout."
791,"I collected every picture of her since she was Miss December, Chief."
792,"Hey, Clean, look at that."
793,"She was here, man."
794,I even wrote to the cunt.
795,She didn't write me back.
796,"You can really get hung up on these broads, man..."
797,just like that cat in the delta.
798," Yeah, you better believe it."
799, What cat?
800,The one that went up for murder.
801,He was an army sergeant.
802,"Remember? This cat, man..."
803,"He really dug his Playboy,  man."
804,Dig it.
805,"When the thing arrived, he was there to meet it, man."
806,"Look at these beautiful fuckin' jugs, man!"
807,"Yeah, so anyway, he was workin' ARVN patrols."
808,One of them cocky gook asshole lieutenants and shit...
809,One day the gook took his magazine and wouldn't give it back.
810,"He said, ""Give me my magazine back."" Gook say, ""You shut up."
811,"I have you courtmartialed.""  Typical fuckin' ARVN."
812, Yeah!
813, Then the gook starts to go too far.
814, Chef. Take the wheel.
815,This dude started to stick pinholes in the lady's tits.
816,Take the wheel.
817,He started sticking pinholes and mutilating the centerfold.
818,"The sergeant said, ""You better not do that to her."
819,You leave your shitty little gook hands off of that girl.
820,"Don't do her like that.""  Gook say ""Fuck you"" in Vietnamese."
821, Damn.
822,The sergeant couldn't handle it no more.
823,He just picked up his iron...
824,flipped it to rock and roll and...
825,Boom!
826,Gave that little zero a long burst straight through the Playboy mag.
827,It blew his ass clean off of the dock.
828,There wasn't no more lieutenant that day. That was it for his ass.
829, They burn him for it?
830," The sergeant? Yeah, man."
831,They stuck his ass in the LBJ.
832,It's too bad he didn't get no medals or nothin'.
833,"Fuckin' ARVN, man."
834,They should have killed the fuck.
835,Should have given the fucker a Silver Star.
836,"Bummer for the gook though, ain't it?"
837,"Good morning, Vietnam.  I'm Army Specialist Zack Johnson on AMVN.  It's about 82 degrees in downtown Saigon right now, also very humid.  We have an important message for all GI's...  who are living off base from the mayor of Saigon.  He'd like you to hang your laundry up indoors...  instead of on the windowsills.  The mayor wants you to keep Saigon beautiful.  Now here's another blast from the past going out to Big Sam...  who's all alone out there with the 1st Battalion, 35th Infantry...  and dedicated by the fire team to their groovy CO.  The Rolling Stones, ""Satisfaction. ""  All right!"
838,"Watch out, Clean!  Get down, bubba!  I can't get no Satisfaction Hang on, Lance!"
839,"I can't get no Satisfaction 'Cause I try and I try  Get down, bubba!"
840,And I try and I try I can't get no I can't get no Yeah!
841,"When I'm drivin' in my car And the man comes on the radio  Tell 'em you did it, Lance."
842,He's tellin' me more and more  I see you is right on target.
843,About useless information  Work out! Yeah! Yeah! Yeah!
844, All right!
845,"Look out, Lance!"
846,"That's what I say ""Commitment and Counterinsurgency...  by Col. Walter E. Kurtz.  As long as our officers and troops perform...  tours of duty limited to one year...  they will remain dilettantes in war and tourists in Vietnam.  As long as cold beer, hot food, rock and roll...  and all the other amenities remain the expected norm...  our conduct of the war will gain only impotence.  We need fewer men, and better.  If they were committed, this war could be won...  with a fourth of our present force. "" Shit. Chicken time."
847,"You ain't shittin', bro."
848,They're motherfuckin'.
849,Who is that?
850,"Is that you, Lazzaro?"
851,Don't chicken out.
852,Lazzaro!
853,Come on!
854, Fire on the canopy!
855, I got it! Get outta there!
856,Yeah! I got it!
857,I got it! I got it!
858,"Lance, get down!"
859,"Put that fucker out, man!"
860,What the fuck they think they're doin'?
861,"Late summer, autumn 1968."
862,Kurtz's patrols in the highlands coming under frequent ambush.  The camp started falling apart.  November.  Kurtz orders assassination of three Vietnamese men and one woman.  Two of the men were colonels in the South Vietnamese army.  Enemy activity in his old sector dropped off to nothing.  Guess he must have hit the right four people.  He joined the Special Forces.
863,After that his...  The army tried one last time to bring him back into the fold.   Methods...
864, If he'd pulled over...   It all would have been forgotten.
865, Unsound.
866,But he kept going.   Now he's crossed into Cambodia...
867, He kept winning it his way.   With this Montagnard army of his...
868," And they called me in.  Man like a god and follow every order, however ridiculous.  They lost him.  He was gone.  Nothing but rumors and random intelligence...  mostly from captured VC.  The VC knew his name by now, and they were scared of him.  He and his men were playing hitandrun...  all the way into Cambodia.  I know what I'm doin'."
869,I'm goin' to the White House to have dinner...
870,with the president of the United States.
871,That's where I'm goin'.
872,"Hey, Chef, put the cover on that."
873,Clean.
874,How long has that kid been on this boat?
875,Seven months.
876,He's really specializing in busting my balls.
877,"Very possible, Captain, he thinks the same of you."
878," Oh, yeah? What do you think, Chief?"
879, I don't think.
880,My orders say I'm not supposed to know where I'm taking this boat...
881,so I don't!
882,"But one look at you, and I know it's gonna be hot, wherever it is."
883,"We're going upriver about  That's Cambodia, Captain."
884, That's classified.
885,"We're not supposed to be in Cambodia, but that's where I'm going."
886,You just get me close to my destination...
887,and I'll cut you and the crew loose.
888,"All right, Captain."
889,"""Dear Son...  I'm afraid that both you and your mother will have been worried...  at not hearing from me during the past weeks...  but my situation here has become a difficult one.  I have been officially accused of murder by the army.  The alleged victims were four Vietnamese double agents.  We spent months uncovering them and accumulating evidence.  When absolute proof was completed, we acted... we acted like soldiers.  The charges are unjustified.  They are, in fact, and in the circumstances of this conflict...  quite completely insane.  In a war, there are many moments for compassion and tender action.  There are many moments for ruthless action...  what is often called ruthless...  but may in many circumstances be only clarity...  seeing clearly what there is to be done and doing it...""  Medevac, come in."
890," ""directly...   Quickly, awake. ""  Alpha, Tango, Tango, Echo, Tango, Alpha."
891," ""Looking at it. ""  Request dustoff.  Three, maybe four KIA 's. Over.  ""I trust you to tell your mother what you choose about this letter.  As for the charges against me, I am unconcerned. "" Medevac, come in.  ""I am beyond their timid, lying morality, and so I am beyond caring. "" Medevac, do you read? Over.  ""You have all my faith."
892,"Your loving father. "" Jesus."
893,No wonder I couldn't get 'em on the radio.
894,What a dump.
895, Hi there!
896, How ya doin'?
897,Wow. That's a nice little boat you got there.
898,Never seen one up here before.
899,We called in a request for Medevac. You receive it?
900,Medevac? No.
901,We passed a downed Huey with some KIA's.
902, On your way here?
903, Yeah.
904, You goin' up this river?
905, Way up.
906, Way upriver? Forget it.
907, Why?
908,We want to send some people downriver.
909, Just forget it.
910, What the fuck was that?
911, We'll be back in a couple of days.
912," Yeah, right, you'll be back."
913, Chief?
914," Yeah, Captain?"
915,Why don't you see what you can do with that engine?
916, I'm gonna look around.
917, All right.
918,"Hey, don't leave without me."
919,"Hey, soldier, where's your CO?"
920,"Don't ask me, man."
921,"Give my clothes back, you asshole!"
922,Asshole!
923,"Hey, guys, where's the CO?"
924,He stepped on a land mine about two months ago. He got blown to hell.
925, Who's in charge here?
926, Charge?
927,"I don't know, man."
928,I'm just the night man.
929,Just do what I'm told. Shit.
930,I'm just a working girl.
931,"What about you, fella?"
932,"Hey, Lance, man, I'm telling you it's gonna jam. You mark my words."
933, Keep it in that condition...
934, Get off my back!
935," No, man, I'm telling you..."
936, Lay off!
937,Hey! Hey! Come here!
938,Is that your boat?
939,Come on inside.
940,What do you want?
941,Come on inside.
942,I want to talk to you. Come on!
943,Get out of the rain.
944,Get off me!
945,Come on. Cut this shit.
946,"Hey, Chef. Hey, come on."
947,"Hey, how ya doin', Captain?"
948,I want you to meet some people.
949, I got your ass.
950, Your ass is shit.
951,"Chef, your ass is shit!"
952,"You're a motherfucker, man."
953,"Goddam, my ear, you motherfucker!"
954," Get him off me, Chef."
955, You smartass.
956,"Hey, guys."
957,I got you!
958,I got your ass!
959," You ain't shit, Chef."
960," Hey, fellas."
961, You pulled my fuckin'...
962," Hey, guys."
963,I just made a deal with the people from Hau Phat.
964,I negotiated two barrels of fuel for a couple of hours with the bunnies.
965,Whoa. Whoa. Captain!
966,Hey! Hey! You shittin' me?
967,"No, I'm not. Grab a couple of barrels and get up to that big tent."
968,Come on!
969,Captain.
970,You're giving away our fuel for a playmate of the month?
971,"Nope, playmate of the year, Chief."
972,"Warm 'em up, baby!"
973,Warm 'em up!
974,"Captain, we get in a fire fight and run out of fuel..."
975,I want you to tell me how she was.
976,"I made a deal for all of us, Chief."
977,How about you?
978, You got some mamas in there?
979, Some what?
980,"Forget it, Captain."
981,I'll stay with the boat.
982,"Hey, Captain!"
983,Give me a hand.
984,"You know, I got a..."
985,I got every one of your pictures.
986,"I got the centerfold, the playmate's review..."
987,the playmate of the year runoff.
988,I even got the calendar.
989,"Hey, oiseau."
990,How come you got a bird?
991,I used to be the bird girl at Busch Gardens.
992, Busch Gardens?
993, I used to train birds there.
994,You are...
995," You are Miss December, aren't you?"
996, Miss May.
997,Is it coming?
998, Miss December has black hair.
999, It's over there.
1000,He's not one of my regular birds.
1001,"Come on. Come on, baby. Snack?"
1002,Snatch a crack. Come here.
1003,Being playmate of the year...
1004,is the loneliest experience I can imagine.
1005,It's like...
1006,You try to express...
1007,your feelings to someone and show them your heart...
1008,"Yeah, I want to hear about your bird act."
1009,I'd love to hear about your bird act.
1010,But would you mind just puttin' this...
1011,"Would you just mind putting this black wig on for me, please?"
1012,And there's this glass wall between you...
1013,this invisible glass.
1014,They can see your mouth moving.
1015,I used to train birds for at least two years...
1016, That's beautiful.
1017, At Busch Gardens.
1018,This was cascading over your right shoulder. This was open here.
1019,But they can't hear what you're saying.
1020,I used to train them to stand on their head and ride a bicycle...
1021,Your right hand was...
1022,"Hey, Chef!"
1023," Get outta here, man!"
1024, Come on!
1025, Does he want to talk to you?
1026, Later. Give me 15 minutes.
1027,You can never really make them hear what you're trying to say.
1028,You okay with kind of bending?
1029,That's it.
1030,"Your ass was sticking out just a little... Hey, man, fuck off!"
1031,Fifteen minutes!
1032,That's why I tried so desperately...
1033,to show somebody that I had some talent.
1034,Little baby macaws.
1035, Have you ever seen a baby macaw?
1036, That's kind of open there.
1037, They're all blue...
1038," Take off, would you?"
1039,"I got my rights, man!"
1040,They make you do things you don't wanna do...
1041,"like, this picture here."
1042,I started feeling repulsed with myself.
1043,You were just kind of bending forward. Your ass kind of out a bit.
1044, I love training birds.
1045, That's it.
1046,That's it. That's very...
1047,That's it. Voila.
1048,You're beautiful.
1049,I just want to...
1050,"You know, I can't believe it."
1051,"Me, J. Hicks."
1052,I can't believe I'm really here.
1053,Maybe I'm unfit to have a relationship...
1054,"with a beautiful, innocent boy."
1055,"Just think, if it hadn't been for the Vietnam War..."
1056,"I never would have met you, Miss December."
1057,Miss May.
1058,I wish...
1059,I wish I could find...
1060,just one person...
1061,that could share my point of view.
1062,"Oh, you kiss like a bird!"
1063,"Oh, God! Kiss me! Kiss me!"
1064,Who is that?
1065, You're drivin' me crazy! Kiss me!
1066, I love birds!
1067,You finished yet?
1068,Oh! Fuck!
1069,Like a bird!
1070,Take me like a bird!
1071,"Fly, baby! Cock it to me!"
1072, Fly!
1073, I can fly like an eagle!
1074, Fly like an eagle!
1075, It drives me crazy!
1076,It drives me crazy!
1077,"Lance, that was somebody's son."
1078,"Lance, there were things that they made me do..."
1079,that I didn't want to do.
1080,"They said, ""Pull the ribbons between your legs."" I didn't want to do it."
1081,But they said that was what was expected of me...
1082,that that's what people wanted to see.
1083, Who are you?
1084," Well, I'm next, ma'am."
1085,"Ha, ha! Hell, I didn't know it was a cherry."
1086, Didn't know you never got no pussy.
1087," Shove it, fuckup."
1088,"Sorry about that. If I'd have known, I'd take you to New Orleans."
1089," Man, fuck you."
1090, Introduce you to...
1091," Lay off, Chef."
1092," Cherry boy, cherry boy."
1093,You're a fuckin' dog!
1094,Come to New Orleans.
1095,"I'll get you fixed up, ya prick."
1096,"Lay off, Chef."
1097,You're the only fuckin' prick I see around here.
1098,"If I wanna play with a prick, I'll play with my own."
1099,Lay off!
1100,"What are you gonna do with it, cherry boy?"
1101,"Chef, I said lay off!"
1102,"Chef, knock it off! Give him a break! What do you think I said?"
1103,Then give your jaws a rest!
1104,This ain't the army.
1105,You are a sailor!
1106,So get out of that frizzly armylooking shirt...
1107,and stop smoking that dope!
1108,You hear me?
1109,"Lance, what's with all the green paint?"
1110, Camouflage.
1111, How's that?
1112,So they can't see ya.
1113,"They're everywhere, Chief."
1114,"I want you to stay awake up there, man. You got a job to do."
1115,Sampan off the port bow.
1116,Sampan off the port bow.
1117,Let's take a look. Lance.
1118,Bring them in.
1119,"Clean, on the 60. Chef, get a 16."
1120,"Clean, get on that 60!"
1121,"What's up, Chief?"
1122,"A junk boat, Captain."
1123,We're gonna take a routine check.
1124,"Well, let's forget routine now and let 'em go."
1125,"These boats are running supplies in this delta, Captain."
1126,I'm gonna take a look.
1127,My mission's got priority.
1128,You wouldn't even be in this part of the river if it wasn't for me.
