,dialog
1815,"""Air strike?"" The code is ""Almighty""..."
1816,coordinates zeroninertwosix foursevenonetwo.
1817,It's all in there.
1818,Zeroninertwosix foursevenonetwo.
1819,"Everything I saw told me that Kurtz had gone insane.  The place was full of bodies...  North Vietnamese, Vietcong, Cambodians.  If I was still alive, it was because he wanted me that way.  It smelled like slow death in there...  malaria...  and nightmares.  This was the end of the river, all right.  Where are you from, Willard?"
1820,"I'm from Ohio, sir."
1821,Were you born there?
1822,"Yes, sir."
1823,Whereabouts?
1824,"Toledo, sir."
1825,How far are you from the river?
1826,"The Ohio River, sir?"
1827,About 200 miles.
1828,I went down that river once when I was a kid.
1829,There's a place in the river...
1830,I can't remember...
1831,Must've been a gardenia plantation or a flower plantation at one time.
1832,It's all wild and overgrown now.
1833,But for about...
1834,for about five miles you'd think that...
1835,heaven just fell on the earth...
1836,in the form of gardenias.
1837,Have you ever considered...
1838,any real freedoms?
1839,Freedoms from the opinion of others?
1840,Even the opinions of yourself?
1841,"Did they say why, Willard?"
1842,Why they wanted to terminate my command?
1843,"I was sent on a classified mission, sir."
1844,"It's no longer classified, is it?"
1845,What did they tell you?
1846,They told me...
1847,that you had gone...
1848,totally insane...
1849,and that your methods...
1850,were unsound.
1851,Are my methods unsound?
1852,I don't see any method...
1853,"at all, sir."
1854,I expected...
1855,someone like you.
1856,What did you expect?
1857,Are you an assassin?
1858,I'm a soldier.
1859,You're neither.
1860,You're an errand boy...
1861,sent by grocery clerks...
1862,to collect the bill.
1863,"Why, huh?"
1864,Why would a nice guy like you wanna kill a genius?
1865,"Feeling pretty good, huh?"
1866,Why?
1867,Do you know...
1868,Do you know that the man...
1869,the man really likes you?
1870,He likes you.
1871,He really likes you.
1872,But he's got something in mind for you.
1873,Aren't you curious about that?
1874,I'm curious. I'm very curious.
1875,Are you curious?
1876,"There's something happening out here, man."
1877,"You know something, man."
1878,I know something that you don't know.
1879,"That's right, Jack."
1880,The man is clear in his mind...
1881,but his soul is mad.
1882,"Oh, yeah."
1883,"He's dying, I think."
1884,He hates all this.
1885,He hates it.
1886,But the man's...
1887,"He reads poetry out loud, all right?"
1888,And a voice...
1889,a voice...
1890,He likes you 'cause you're still alive.
1891,He's got plans for you.
1892,"No, no, I'm not gonna help you."
1893,"You're gonna help him, man."
1894,You're gonna help him.
1895,"I mean, what are they gonna say, man, when he's gone, huh?"
1896,"'Cause he dies when it dies, man."
1897,"When it dies, he dies."
1898,What are they gonna say about him? What are they gonna say? He was a kind man?
1899,He was a wise man?
1900,He had plans? He had wisdom?
1901,"Bullshit, man!"
1902,Am I gonna be the one that's gonna set them straight? Look at me. Wrong!
1903,You.
1904,Almost eight hours.
1905,I'm asleep.
1906,I'm asleep and dreaming I'm on this shitty boat.
1907,Fuck.
1908,Has it been eight hours?
1909,Hello. Almighty. Almighty.
1910,This is PBR Street Gang.
1911,Radio check. Over.
1912,"PBRStreet Gang, this is Almighty standing by. Over.  Oh, Jesus!"
1913,"Oh, Christ!"
1914,Time magazine.
1915,The weekly newsmagazine.
1916,"September 22, 1967."
1917,Volume 90...
1918,number 12.
1919,"""The War on the Horizon. The American people may find it hard to believe..."
1920,that the US is winning the war in Vietnam.
1921,Nevertheless...
1922,one of the most exhaustive inquiries...
1923,into the status of the conflict yet compiled...
1924,offers considerable evidence that the weight of US power...
1925,twoandahalf years after the big buildup began...
1926,is beginning to make itself felt.
1927,White House officials maintain the impact of that strength...
1928,may bring the enemy to the point where he could...
1929,"simply be unable to continue fighting."" Is this familiar?"
1930,"""Because Lyndon Johnson fears that the US public..."
1931,is in no mood to accept its optimistic conclusions...
1932,he may never permit the report to be released in full.
1933,"Even so, he is sufficiently impressed with the findings..."
1934,and sufficiently anxious to make their conclusions known...
1935,to permit experts who have been working on it...
1936,"to talk about it in general terms."" No date, Time magazine."
1937,"""Sir Robert Thompson..."
1938,who led the victory over Communist guerrillas in Malaya...
1939,is now a RAND corporation consultant...
1940,recently returned to Vietnam to sound out the situation for President Nixon.
1941,He told the president last week...
1942,that things felt much better...
1943,"and smelled much better over there."" How do they smell to you, soldier?"
1944,You'll be free.
1945,You'll be under guard.
1946,Read these at your leisure.
1947,Don't lose them.
1948,Don't try to escape.
1949,You'll be shot.
1950,We can talk of these things later.
1951,"""We are the hollow men."
1952,We are the stuffed men...
1953,leaning together at peace filled with straw.
1954,"Alas, our dried voices when we whisper together..."
1955,are quiet and meaningless as wind in dry grass...
1956,or a rat's feet over broken glass in a dry cellar.
1957,He's really out there.
1958,Shape without form...
1959,shade without color...
1960,paralyzed force...
1961,"gesture without motion."" Do you know what the man's saying? Do you?"
1962,This is dialectics.
1963,It's very simple dialectics.
1964,It's one through nine.
1965,"No maybes, no supposes, no fractions."
1966,"You can't travel in space. You can't go out into space, you know..."
1967,"without like, you know, with fractions."
1968,What are you gonna land on?
1969,Onequarter? Threeeighths?
1970,What are you gonna do when you go from here to Venus?
1971,"That's dialectic physics, okay."
1972,"Dialectic logic is, there's only love and hate."
1973,You either love somebody or you hate 'em.
1974,Mutt!
1975,You mutt.
1976,This is the way the fucking world is.
1977,"Look at this fucking shit we're in, man!"
1978,Not with a bang.
1979,A whimper.
1980,"And with a whimper, I'm fucking splitting, Jack."
1981,"On the river, I thought that the minute I looked at him...  I'd know what to do.  But it didn't happen.  I was in there with him for days. Not under guard.  I was free.  But he knew I wasn't going anywhere.  He knew more about what I was going to do than I did.  If the generals back in Nha Trang could see what I saw...  would they still want me to kill him?  More than ever, probably.  And what would his people back home want if they ever learned...  just how far from them he'd really gone?  He broke from them...  and then he broke from himself.  I'd never seen a man so broken up and...  ripped apart.  I've seen the horrors..."
1982,horrors that you've seen.
1983,But you have no right to call me a murderer.
1984,You have a right to kill me.
1985,You have a right to do that.
1986,But you have no right to judge me.
1987,It's impossible for words...
1988,to describe...
1989,what is necessary...
1990,to those...
1991,who do not know...
1992,what horror means.
1993,Horror.
1994,Horror has a face.
1995,And you must make a friend of horror.
1996,Horror and moral terror...
1997,are your friends.
1998,If they are not...
1999,then they are enemies to be feared.
2000,They are truly enemies.
2001,I remember when I was with Special Forces.
2002,Seems a thousand centuries ago.
2003,We went into a camp to inoculate...
2004,some children.
2005,We'd left the camp...
2006,after we had inoculated the children for polio.
2007,"And this old man came running after us, and he was crying."
2008,He couldn't say.
2009,We went back there...
2010,and they had come and hacked off...
2011,every inoculated arm.
2012,"There they were, in a pile..."
2013,a pile of...
2014,little arms.
2015,And I remember...
2016,II... I cried.
2017,I wept like...
2018,some grandmother.
2019,I wanted to tear my teeth out.
2020,I didn't know what I wanted to do.
2021,And I want to remember it.
2022,I never want to forget it.
2023,I never want to forget.
2024,And then I realized...
2025,like I was shot...
2026,like I was shot with a diamond...
2027,a diamond bullet right through my forehead.
2028,"And I thought, ""My God, the genius of that."
2029,"The genius."" The will to do that."
2030,"Perfect, genuine, complete, crystalline, pure."
2031,And then I realized...
2032,they were stronger than me because they could stand it.
2033,These were not monsters.
2034,These were men...
2035,trained cadres.
2036,These men who fought with their hearts...
2037,"who have families, who have children..."
2038,who are filled with love...
2039,that they had the strength...
2040,the strength...
2041,to do that.
2042,If I had ten divisions of those men...
2043,then our troubles here would be over very quickly.
2044,You have to have men...
2045,who are moral...
2046,and at the same time...
2047,who are able to...
2048,utilize their...
2049,primordial instincts to kill...
2050,"without feeling, without passion..."
2051,without judgment...
2052,without judgment.
2053,Because it's judgment that defeats us.
2054,I worry that my son...
2055,might not understand what I've tried to be.
2056,"And if I were to be killed, Willard..."
2057,I would want someone to go to my home...
2058,and tell my son everything.
2059,Everything I did.
2060,Everything you saw.
2061,Because there's nothing that I detest more than...
2062,"the stench of lies.  And if you understand me, Willard, you...  you will do this for me.  PBRStreet Gang, this is Almighty. Over.  PBRStreet Gang, this is Almighty standing by. Over.  PBRStreet Gang, this is Almighty standing by. How do you copy?  They were gonna make me a major for this...  and I wasn't even in their fuckin' army any more.  Everybody wanted me to do it.  Him most of all.  I felt like he was up there...  waiting for me to take the pain away.  He just wanted to go out like a soldier...  standing up.  Not like some poor, wasted, ragassed renegade.  Even the jungle wanted him dead.  And that's who he really took his orders from anyway.  Come on, baby take a chance with us Come on, baby take a chance with us Come on, baby take a chance with us And meet me at the back of the blue bus tonight Blue bus tonight Blue bus tonight Blue Come on, yeah We train young men to drop fire on people..."
2063,but their commanders...
2064,"won't allow them to write ""fuck""..."
2065,on their aeroplanes because...
2066,it's obscene.
2067,The horror.
2068,The horror.
2069,"Calling PBRStreet Gang.  PBRStreet Gang, this is Almighty."
