,dialog
673,"In the name of his majesty, King Augment the Second, CommanderinChief of the Army, High Admiral of the Navy, drink that coffee."
674,"Now, you stay here and face the widow."
675,"And now, we come to the room, madam, where King Augment say to Queen Dolores for the first time, the historic words ""I love you""."
676,"Please, madam."
677,Well. What a surprise.
678,Captain Danilo.
679,"Well, of all people."
680,How did you get here?
681,When did you arrive?
682,"Oh, yes, what a coincidence."
683,What a coincidence.
684,I thought he was in Marshovia.
685,"And yes, Captain Danilo."
686,"Madam Sonia, may I present my dearest friend, none other than Captain Danilo."
687,"What a pleasure, madam."
688,It is?
689,"It's small, it's afraid."
690,Meeting you is the greatest good that would happen to me.
691,"Madam, may I ask a favor?"
692,"Shall I lift my veil, Captain?"
693,"Oh, no, madam. No."
694,I don't jump over the garden walls anymore.
695,Since when?
696,Since yesterday.
697,"I fell in love with a girl madly, but she disappeared."
698,"And you, madam, are the only one in the world that can help me find her."
699,Her name is Fifi.
700,Fifi is no more. You killed her.
701,"After she left you last night, she came home and committed suicide."
702,"She jumped into cold bath, and you'd be surprised, Captain, what a cold water can do."
703,Just a moment.
704,Another telegram to his majesty.
705,Following his accurate statement of happenings.
706,Copy word. Introduction performed Widow accused Danilo of murder but was willing to lift veil.
707,"Couldn't understand the rest of conversation as both talked in code, and shhhh..."
708,"At the moment, both are standing in the garden door."
709,"If he could only get her into the garden, he whisper something in her ear."
710,"Apparently, something nice."
711,"She gets very angry in fact, she's furious."
712,She opens the garden door.
713,She goes into the garden.
714,He follows.
715,Victory. Victory. Victory.
716,"I love you, Sonia."
717,"Well, I noticed it last night."
718,"Oh, please. I'm mad about you."
719,Everybody is.
720,"I've heard it at least a hundred times tonight, and everybody wants to marry me."
721,There must be something wonderful about me.
722,What is it that fascinate all these men?
723,What can it be?
724,"Is it my charm, or my beauty, or do you suppose it's my position?"
725,"You mean, your money?"
726,Yes.
727,"I don't know about the other men, but with me, it's strictly your money and nothing else."
728,I believe you.
729,I knew you would.
730,That's why I said it.
731,"If you have told me last night who you were, if I had only know that I had in my arms the richest widow, I'll..."
732,What did you come to Maxim's for anyway?
733,"Oh, I see. Just like a man, looking for a thrill."
734,"Goodbye, Captain."
735,A telegram to his majesty.
736,Just came out of the strawberry.
737,Big doings in garden.
738,"Overheard whole scene but could not understand a word because wind was against me, and yet..."
739,"Telegram, your Excellency."
740,It's from his majesty.
741,It's in code.
742,Zizipoff. Get your Excellency.
743,The first word is Darling.
744,What does it mean?
745,D...
746,"Da... Da... Darling, I consider you the greatest idiot in the diplomatic service."
747,"What is the next word, your Excellency?"
748,Lilac time.
749,Lilac time.
750,Azratevitch.
751,"Yes, your Excellency."
752,Go to my bedroom.
753,"In the cabinet behind his majesty's picture, there's a little brown bottle of poison."
754,Throw it away.
755,It's protective measure.
756,"Yes, your Excellency."
757,"Read it again, slowly."
758,I consider you the greatest idiot in the diplomatic service.
759,A diplomat who does not know what is going on under his very roof is unfit to be under the lower name of Potpot.
760,"It is hard to believe that you are the son of the great statesman, Potpot."
761,"But, Potpot or no Potpot, I consider you the greatest idiot in the diplomatic service."
762,"Now, listen, Potpot."
763,"Danilo gives secret away to Maxim's girls, secret all over terrace."
764,Local Marshovian newspapers read information by telegraph.
765,Opposition paper will print story tomorrow. Speedo.
766,Bring forth the marriage or everything lost.
767,She must be married tonight.
768,"Therefore, act quickly."
769,"Be brilliant, be creative."
770,Kill umas. Admit nothing.
771,Deny everything. Avail crisis.
772,Face fact. Stand fast.
773,Something lost if we don't do it now.
774,What are you waiting for. Augment You still like Maxim's girls?
775,"I love you and only you, darling."
776,Please believe me.
777,Danilo.
778,Ask me anything you want.
779,All my silly questions?
780,"Yes. About tomorrow, about all the days after tomorrow Ask me anything, everything."
781,"But please, believe me."
782,I do believe you because I want to believe you.
783,Ladies. Ladies and gentlemen.
784,"I have to honor to announce the coming marriage and the present engagement of the charming Marshovian lady, Madam Sonia, and our own Captain Danilo, captain of the royal guard."
785,It's a love match.
786,How does he know?
787,How does anyone know except you and me?
788,Darling.
789,"Captain Danilo, would you be good enough to come to his Excellency immediately?"
790,Sonia.
791,"Yes, Danilo?"
792,Would you wait here for me?
793,Of course.
794,"Your Excellency, how dare you made such an announcement."
795,How dare you.
796,Do you know whom you're talking?
797,To the biggest idiot.
798,You read the telegram.
799,What telegram?
800,Here. Here. Read it.
801,It's unbelievable.
802,An officer giving away a government secret to a lot of Maxim's girls.
803,All Paris knows this.
804,"Tomorrow, it'll be in all the papers."
805,"If the widow ever finds out that this is a conspiracy, that the government sends you here she'll call off the marriage, and the next thing she'll take her money out of Marshovia, then where will we be?"
806,You have to marry her tonight.
807,"Act quickly, be brilliant."
808,"Act quickly, meet crisis, deny everything, stand fast."
809,Something must be done.
810,Do it. Do it now.
811,What are you waiting for?
812,Your Excellency. Shut up.
813,"Sonia, you're crying."
814,I'm crying because I'm happy.
815,Why shouldn't I be happy?
816,Sonia.
817,"Yes, Danilo."
818,"There is something, something I must tell you."
819,Please. Just a moment.
820,"You love me, don't you?"
821,"Yes, I do. I do love you."
822,You don't have to convince me.
823,"I know it, and the Maxim's girls, all Paris, the whole world, everybody knows you love me."
824,And everybody knows why.
825,"Well, Captain, go ahead, I'm waiting."
826,I love to hear you lie.
827,Have you nothing to say to me?
828,"Nothing, madam, that you would believe."
829,"Goodbye, Captain."
830,Congratulations.
831,Ladies and gentlemen.
832,I wish to correct a misunderstanding.
833,The announcement of Madam's engagement has been made without Madam's knowledge or consent.
834,I am speaking for Madam Sonia when I said Madam has never entertained the slightest thought of such an engagement.
835,"Madam, there is nothing left to be said."
836,I shall make no attempt to explain.
837,I know it's all over.
838,There's only one thing I want to say before I go.
839,"I love you, Fifi."
840,"Now, what do you expect me to do?"
841,Fall in your arms?
842,Marshovia has elected the right man.
843,"You're brilliant, Captain, too brilliant."
844,"Sorry, Captain."
845,"In the name of your majesty, you're under arrest."
846,You leave for Marshovia immediately.
847,"Well, gentlemen, shall we dance?"
848,"Oh, please, madam."
849,"Open the gate for moment, for gay time is in Paris and play time with the man of sincerity, and he tells you he loves you indefinitely."
850,"What a pretty thing to see, Paris in the spring."
851,"High officer, Captain Danilo."
852,Widow has lost company.
853,King denies heart attack.
854,King denies heart attack.
855,"Yes, sir."
856,King denies heart attack.
857,Widows withdraws many from country.
858,Keep the change.
859,"Thank you, sir."
860,What are we going to do?
861,"If the widow doesn't change her mind, we can close up the country."
862,"Oh, Dolores, Dolores."
863,Looks like exile to me.
864,Revolution?
865,The cannon just announced the opening of the trial.
866,"Thank you, Gabrilovitch."
867,"In the name of His majesty, I herewith open the trial of the State of Marshovia versus Captain Danilo."
868,Would you be good enough to remove all the livestock in the court room?
869,Bring in the prisoner.
870,Bring in the witnesses and exhibits.
871,"In the name of the State, I accuse Captain Danilo of high treason, failing his duty."
872,"State is going to prove that this man who lives was always was a madness to Marshovia, with no respect for the sanctity of home, not even stopping on garden walls Exhibit Two."
873,"Now, generals of the jury."
874,I will prove this Exhibit...
875,"Your honor, I object."
876,I object this witness being called an Exhibit.
877,She's an Exhibit.
878,She's a witness.
879,She is not. She is.
880,Objection sustain.
881,"From now on, the prosecution will refer to Exhibit Number Two as Witness Number One."
882,"Your honor, when I read the charges against Count Danilo, I realize this case concerns me, so I came here from Paris."
883,May I have the opportunity to testify?
884,"The court appreciates your patriotism, Madam."
885,"Please, Madam."
886,"Madam, will you tell the generals of the jury, in your own charming way, everything you knew about this case."
887,"As I understand it, you are charging the defendant for neglecting his duty and being a traitor to his country Your honor, you are accusing an innocent man."
888,"He did everything in his power to be true to Marshovia, and betrayed me."
889,Don't put him in jail.
890,"Give him a medal, a monument, set him as an example."
891,A Marshovian patriot who stopped at nothing.
892,He did do his duty.
893,"He used every strategy, every trick."
894,"He lied, he deceive me, he played with emotions, romance, he was willing to break a woman's heart just to proceed what he is instructed."
895,"Your honor, may I be permitted to crossexamine the witness?"
896,Granted.
897,Witness is yours.
898,So I lied to you.
899,Yes.
900,I was playing you games.
901,Nothing else.
902,"When I danced with you, I was only thinking of your millions."
903,And when you took me in your arms I was following instructions.
904,Yes.
905,And when I kissed you.
906,That's was the biggest lie of all That's all I want to know.
907,I'm guilty.
908,"Guilty of treason, failing in duty, of everything you want."
909,"But most of all, I'm guilty of being your fool."
910,"Once in my life, I lost both my heart and my head."
911,"Therefore, I should be punished without mercy."
912,"Let my fate be a warning to every men, any man, who can dance through life with hundreds of women, and is willing to walk through life with one, should be hanged."
913,The widow.
914,Something must have happened to the widow.
915,What? What? What?
916,She wants to go to jail because of Captain Danilo.
917,I think... Quiet.
918,"Racheski, Gabrico."
919,"Yes, your majesty."
920,My horse.
921,"Yes, your majesty."
922,"Now, are you a friend of the captain, madam?"
923,Not exactly.
924,A relative?
925,No.
926,"But you knew him before, didn't you?"
927,"Oh, yes."
928,"Well, you wouldn't recognize him now."
929,He's a changed man.
930,Did you hear the story about the warden's daughter?
931,No.
932,"Well, last night, the warden's daughter brought his supper personally into his cell."
933,And what happened.
934,Nothing.
935,"I'm telling you, he's a changed man."
936,But here we are.
937,"But, he isn't here."
938,It looks that way.
939,Don't worry about that.
940,He always come back.
941,Just make yourself comfortable.
942,Danilo.
943,He's not here.
944,When do you expect him back?
945,I don't know.
946,"Well, anyway, tell him there's a big party going on in the women's ward."
947,I'm sorry.
948,I was chased by a mouse.
949,From your estate all the way here to the prison.
950,What a mouse.
951,You don't think I came here To see me? No.
952,"Yes, I came to see you and to leave with you one message."
953,"Tonight, there's a party going on in women's ward. Goodbye."
954,"Your majesty, not even Napoleon could have thought of this."
955,Thank you.
956,The plan can't fail.
957,"They can't get out, that's what they're in for."
958,"Now, put ourselves in their place."
959,We both have a quarrel and now we're locked in.
960,"At first, we don't talk at all, then I'll tell you what I think of you, and then you tell me what you think of me."
961,"Oh, no, your majesty."
962,I wouldn't dare.
963,That's right.
964,"Well anyhow, we're in the cell."
965,"We can't quarrel all night and as time passes, I begin to realize that after all you're a woman."
966,"And above all, I begin to realize you're a man."
967,"Right. And still more, you're a gorgeous woman."
968,"And as for me, You're wonderful, your majesty."
969,Thank you.
970,That's Marshovia.
971,"The minute you go to party, and people can't get out."
972,"Oh, you're not so innocent."
973,What? You did the whole thing.
974,Did what?
975,You bribed the jailer to lock you here with me.
976,"I have to apologize, you didn't bribe the jailer."
977,It's a conspiracy.
978,Against both of us.
979,They want us to fall for each other.
980,We are threat.
981,Oh. But this is terrible.
982,What are we doing to do?
983,"Oh, now, darling. You can't cry."
984,I beg your pardon. Let's calm down Let's keep cool. I have it.
985,Let's fool them.
986,Let's fall for each other.
987,That should be easy.
988,Really? Why should two people who hate each other Love each other.
989,Right. Why then? Let's not do it.
990,We won't.
991,Let's drink to that.
992,May our hearts remain as cold as the champagne.
993,Could be a little bit cooler.
994,"Oh, please."
995,Any man who can dance through life with a hundred women And is willing to walk through life with one should be married.
996,"Captain Danilo, do you take..."
997,"Yes, certainly."
998,Of course.
