,dialog
269,"Oh, John Lewis was a congressman, is a congressman now but I knew John Lewis 54 years ago when he stood on that same rock you're holdin'."
270,"He was the president of SNCC, the Student Nonviolent Coordinating Committee."
271,Look at you holdin' that history in your hand.
272,"You must be a history maker, too."
273,"When you feel like you can't do anything, go pick up that rock and hold it in your hand and take from it the strength of the ordinary people who stood on that same rock and made history that not only changed this little town, but America."
274,And then get up off your behinds and do somethin' about it.
275,Is that clear?
276,And they all answer yes ma'am.
277, Gerrymandering is as old as the nation itself.
278,But the way that it has basically come onto steroids in the 21st century is absolutely frightening.
279, Narrator Gerrymandering has always been about party and race.
280,"Every 10 years after the census, district maps are redrawn based on the number of representatives."
281,"In its simplest form, redistricting would work as follows."
282,Let's say you have 100 voters and you need to split them into 10 districts.
283,"If you split them up evenly, you would have 10 competitive districts that could go either way."
284,"However, what if you simply put all of your competitor's voters into one district and then split yours into the other nine?"
285,"Obviously, your opponent would win their one district but you would win the other nine and thus be able to make all the rules."
286,"In an ideal world, districts are drawn fairly."
287,But we don't live in an ideal world.
288,"President Benjamin Harrison called gerrymandering political robbery, and he was right."
289,"Both parties do it, that's nothing new."
290,"But in 2010, when Republicans gained control of the legislature in the governor's office in 26 states, everything changed."
291,"Aided by computerdriven software, gerrymandering went to a whole new level."
292,"Districts were now drawn down the block level, and even to the houses on the block."
293,Districts were drawn to pack and stack segments of the population in order to dilute their voting power and suppress voter turnout.
294,"Paul Weyrich with the American Legislative Exchange Council, or ALEC, which helped craft voter suppression legislation, was blunt in his reasoning."
295,I don't want everyone to vote.
296,The Republican party's leverage in the election quite candidly goes up as the voting populace goes down.
297,Texas is a minority majority state.
298,but they control 70% of the districts.
299,"And similar results are found in Michigan, Pennsylvania, Wisconsin, Georgia, and Florida, all because of the some of the craziest gerrymandering ever."
300,"The Louisiana Second District, Texas 35th, Illinois Fourth, Florida Fifth, Maryland's Third, and North Carolina's infamous 12th District."
301,"In fact, of the 10 most egregious gerrymandered districts, North Carolina leads the pack with three."
302, I'm tired of people beating us down and tryin' to act like we're not the same just because my skin is dark and some of my other brothers and sisters may be white doesn't mean that God didn't make me too.
303,"And I don't think God made it a joke, okay?"
304,"And the sooner we realize that we all human beings, the better this world will be."
305, The studies are really clear on this.
306,"When you're white, generally what happens is that whites in white neighborhoods have to wait in line the least amount of time to vote."
307,"And so it looks like ah, you go in, you show an ID 'cause everybody has an ID, you go cast your ballots, you're in and out in what, five minutes, six minutes?"
308,"If you're a minority, however, again the studies are clear."
309,"If you're black and you're in a black neighborhood, you have the longest amount of time to wait to vote."
310,And that is because there are fewer machines that actually work that have been assigned to your precinct.
311,There are fewer poll workers.
312,"In short, there are fewer resources put into minority precincts."
313,"And so with fewer resources, the line just grows and grows and grows."
314,"And so here in Georgia, for instance, in our last election, the average wait was about three hours to vote."
315,"It looks like it's working, it looks like everybody has the same opportunity."
316,They don't and that is deliberate.
317, Narrator One of those tricks is the restrictions placed on polling stations themselves.
318,African American and Latino voters have traditionally been early voters.
319,"Legislators in places like Ohio, Indiana, North Carolina, and Florida have reduced the availability of early voting."
320,do not have any early voting at all.
321,"In Ohio, the Secretary of State allowed for only one early polling station per county."
322,"That might work for the 6,000 people of Pickaway County, which is nearly 95% white."
323,"But in Hamilton County, home to the state's third largest city, the majority minority city of Cincinnati, one polling station for 800,000 people just isn't gonna cut it."
324,"In Indiana's 92 counties, only three have populations larger than 325,000 residents."
325,"live in two of the three counties, Marion and Lake."
326,"It probably comes as no surprise, then, that former governor Mike Pence and the Republicanled legislature decided that counties with a population over 325,000 were restricted to one polling station unless the bipartisan county election board unanimously voted to have more."
327,Smaller white counties have no such restrictions.
328,But closing early polling stations is just one way to restrict access to the vote.
329,"Moving the location is effective, as well."
330,North Carolina moved nearly 1/3 of those in predominantly black areas.
331,Studies have shown that voting by black voters drops .5% for every tenth of a mile the polling station is moved.
332,"It's estimated that 19,000 black voters were kept from voting using this method."
333, Joanne I need people to understand this.
334,This history happened.
335,And we can't go back and erase it.
336,But what came out of that history and where do we take it from there?
337,Sometimes I think I'm marchin' over that bridge again or definitely gonna have to march over there again to make a change.
338,"But we need each other, we're not goin' anywhere."
339,"We're not movin' forward when you try to hurt us, a whole segment of people."
340,"You're not movin' forward, you just think you are."
341,And it's gonna always be that unrest and that craziness you have to deal with when the power is not distributed properly.
342,"And that's what most movements are about, distribution of power."
343," One of the things that we began to understand in the movement, during the Civil Rights movement, was that as long as somebody was not free, none of us were free."
344,That hasn't changed.
345,That hasn't changed.
346,When we're talking about what is happening with voter suppression where we get representatives who are unrepresentative.
347,We get members in a democracy who are not responsible to that democracy.
348,None of us are free.
349," Narrator Of the one billion votes cast between 2000 and 2014, there were 31 reported incidents of voter fraud."
350,These included false claims by the loser.
351,The incident rate of voter fraud is between .0003% and .0025%.
352,"In 2016, there was no evidence of widespread voter fraud."
353,"In short, voter fraud is a false flag narrative designed to suppress and disenfranchise specific bodies of the electorate in order to maintain the status quo in a changing America."
354,Donald Trump lost the popular vote to Hillary Clinton by nearly three million votes in 2016.
355,"Pennsylvania, Michigan, and Wisconsin made him president."
356,"If Hillary won those three states, which Obama won in 2008 and But she didn't."
357,Voter suppression worked.
358,The most striking results are in Wisconsin where the voting rates of African Americans dropped to less than 50% in 2016 from 78% in 2012.
359,This decline was more than four times the national average.
360,Wisconsin is 92% white.
361,"There's 348,308 African American citizens make up just 6.1% of the population."
362,Nearly 70% of Wisconsin's black population lives in Milwaukee.
363,"In the 2016 election, in Milwaukee as a result of voter suppression."
364,"Donald J. Trump won Wisconsin by 22,748 votes."
365, Obama said yes we can.
366,And we saw what happened in that 2008 election.
367,"Today, we have to say yes we will."
368,It is upon us to stand up and fight for this democracy.
369,Yes we will.
370,It is that determination that had 11 year old Joanne Bland on the Edmund Pettus Bridge.
371,This was a little girl well before she could be able to vote willing to put it on the line to be free.
372,That's a freedom fighter.
373,Yes we will.
374,"That's how we get the democracy we deserve, not the one that they're trying to foist upon us."
