,dialog
0,"MURTAUGH: Riggs, you sure we're on the right street?"
1,Yeah.
2,Yeah?
3,We must be getting warm.
4,You see anything?
5,Where? I don't see anything.
6,This must be the place.
7,Holy shit!
8,What the hell is that?
9,Jesus.
10,Who's this joker?
11,I don't know.
12,A spokesman for the NRA.
13,Regular asshole.
14,What do we do now?
15,Run him over.
16,What if he shoots us with that rifle?
17,He hasn't yet. Maybe he won't.
18,What if he does?
19,Don't be a Don'tBee.
20,Be a DoBee. Be positive.
21,MURTAUGH: Positive?
22,Let's run him over.
23,Glad you see things my way.
24,I hope he doesn't turn around.
25,He won't. We'll creep up on him slow so he won't notice.
26,Yeah. Okay.
27,RIGGS: Will him not to turn.
28,Power of positive thinking.
29,Don't turn.
30,"Come on, will him with me."
31,Will him?
32,Don't turn around.
33,"l need you, man. Don't turn around."
34,MURTAUGH: Don't turn around.
35,Just believe.
36,Don't turn around!
37,We're better than him.
38,We're better!
39,He's turning.
40,"I was wrong, l was wrong."
41,"Get down, get down."
42,They just bounce right off him!
43,"I saw. We're in trouble, man!"
44,Shit. I'll draw his fire.
45,You run for cover.
46,"No, I'll draw his fire."
47,You run for cover.
48,Are you out of your mind?
49,"You got a wife, kids. l got less to lose!"
50,"Hey, Riggs."
51,"Get going, Rog. Get out of here!"
52,"Riggs, l wasn't supposed to tell you this, but Lorna's pregnant."
53,You're gonna be a father.
54,Get going. Get What'd you say?
55,You're gonna be a father!
56,Riggs....
57,GUNSHOTS SIREN WAILlNG lN DlSTANCE She was afraid to tell you.
58,She was afraid you'd get angry.
59,You never talked about children?
60,Shit.
61,A baby.
62,There's something l'm not supposed to tell you too.
63,What?
64,Rianne's pregnant.
65,You're gonna be a grandfather.
66,Rianne's what?
67,But Rianne can't be pregnant.
68,She's not married.
69,"Well, l don't think she intended to get that way."
70,They asking me to be a granddaddy?
71,Mmhm. Yeah.
72,ON RADlO a fire In the hole Son of a GUNSHOTS Here's what we'll do.
73,Take your clothes off.
74,What the hell for?
75,What for?
76,Yeah.
77,"Okay, you run."
78,"FlameO here turns, sees you in your undies."
79,"It distracts him, and that's when l shoot."
80,Shoot what?
81,The valve on that napalm tank!
82,Before he shoots me?
83,Maybe.
84,Maybe?
85,Is he black?
86,Too much armor on.
87,I can't tell!
88,No! Not him!
89,The father of the baby!
90,Okay.
91,Please let him be black!
92,Fire in the hole RIGGS: Get going! Here he comes!
93,Are those little hearts?
94,"Not now, Riggs."
95,Just hit the damn valve!
96,"Okay. Also, flap your arms and make noises like a bird."
97,Flap my arms? Why?
98,It'll distract him more.
99,l need him to turn.
100,"All right, all right."
101,On two!
102,We always go on three.
103,No time for three. Go. Two!
104,MURTAUGH: What about one?
105,"Okay. One, two, get going!"
106,I don't want to die in my underwear!
107,MURTAUGH CLUCKlNG Why are you waiting for?
108,Shoot the bastard!
109,"Shoot him, shoot him!"
110,SCREAMlNG RIGGS: Incoming!
111,Whew.
112,"Riggs, you think that bird thing helped?"
113,You think it helped?
114,"No, no, I just wanted to see if you'd do it."
115,RlGGS LAUGHING Cute shorts.
116,"Go spit, Riggs!"
117,"RIGGS: Come on, l'll buy you a doughnut."
118,Don't put your arms around me when l'm naked.
119,"Well, surely you're ashamed of your butt."
120,RIGGS: He's a lively one.
121,"MURTAUGH: That shark damages my new boat, l'll take it out on you, Leo."
122,LEO: I didn't mean to catch it.
123,RIGGS: What do you want to keep it for?
124,"MURTAUGH: Yeah, why keep a shark anyway?"
125,The teeth'll look great on a wall.
126,They gotta stop snapping first.
127,LEO: Maybe he'll fall asleep.
128,"Go down, converse with him."
129,He'll nod off.
130,He don't look tired.
131,Maybe chewing on Leo will wear him out.
132,You think sharks eat their own kind?
133,"RlGGS & MURTAUGH LAUGHING Oh, stop it. You guys got me in stitches."
134,"LAUGHlNG Okay, where's my bag?"
135,Starboard side aft.
136,"Starboard, that's left, right?"
137,"No, port's left. Starboard's right."
138,"Yeah, right."
139,"Yeah, right."
140,"Right, yeah. Right side aft."
141,Got it!
142,Whatever.
143,Check both sides. You'll find it.
144,Careful!
145,"He's behind you, shark!"
146,"RlGGS HUMS THEME FROM ""JAWS"" Maybe we should throw him overboard."
147,MURTAUGH: Throw them both overboard. Boy.
148,RIGGS: No witnesses out here tonight.
149,We'd probably get away with it.
150,MURTAUGH GROANS You too?
151,I kept my nose out of it...
152,...but you and Lorna.
153,"You're having a baby, you're living together."
154,You're not getting married.
155,"Why, does that violate your family values system or something?"
156,"No, I'm just trying to understand."
157,Rianne's not married either.
158,"Okay, okay. That's hitting below the belt."
159,"You know, when l was married..."
160,...it was good. You know.
161,You put the ring on.
162,You make the commitment.
163,You do all the....
164,She's dead because l'm a cop.
165,She's dead because l'm a cop and l....
166,I don't wear the ring anymore...
167,"...but l look down, it's still there."
168,I still feel it.
169,"And, l don't know, it's like I'm not finished with that yet."
170,I don't know how to explain it.
171,Is that bullshit?
172,No. It's not finished.
173,It's not finished. Yeah.
174,"Okay, you did say ""aft""?"
175,AFT. Aft!
176,That's a fucking word?
177,"In the back of the cabin on the right side, Leo!"
178,"Why didn't you say that to begin with, Roger?!"
179,"People get around boats and water, everything becomes fucking nautical!"
180,"""Astern! Avast, you landlubbers!"
181,"Man the bilge pump!"" Pump your fucking ass!"
182,"All right, all right, all right."
183,"Okay, okay, okay."
184,"No problem, no problem!"
185,What's Lorna say about this?
186,She doesn't like nautical terms either.
187,Huh?
188,We haven't discussed it.
189,That's pretty messed up.
190,The baby's due in days and you guys haven't talked about getting married?
191,No.
192,I haven't done it at all.
193,GUN CLlCKS Do we want Leo to shoot the shark?
194,Do we want Leo to shoot?
195,"Hey, hey! No, Leo!"
196,"LEO: What? Hey, hey."
197,What's the big deal?
198,You're shooting a gun on my boat!
199,"I'm not shooting your boat, I'm shooting Jaws."
200,Nobody's killing it. l'm not letting a good animal die so you can have its teeth.
201,Sure getting grumpy since you found out you're gonna be a grandpa.
202,"RIGGS: Get off of me, will you?"
203,Don't fool around!
204,This is some piece of hardware.
205,You got a permit?
206,l'm a P.I. now. Of course l do.
207,A P what?
208,"A P.l., a gumshoe! You get in ugly situations. l got guns, everything."
209,You are an ugly situation.
210,"Permit or no permit, you don't deserve this."
211,You're not safe.
212,"GUNSHOT MURTAUGH: Smart move, Riggs."
213,Shit!
214,"GUNSHOTS Hard right, Rog."
215,LEO: They're gonna hit us.
216,RIGGS: You hear shots?
217,"MURTAUGH: Coast Guard, this is Code 7."
218,MURTAUGH SPEAKING lNDISTINCTLY We're in L.A. Harbor. Over.
219,"We gotta go. Come on, Rog."
220,MURTAUGH: Code 7.
221,They're getting away!
222,LEO: Who was it? Do we know?
223,"No, no, I'll drive!"
224,Want me to help?
225,Get out of here!
226,This your gun?
227,"Yeah, you want some laser surgery?"
228,"Hey, hey! You could blind somebody!"
229,"Coast Guard, this is Code 7, in pursuit of freighter."
230,Heading north.
231,Awaiting instructions. Over.
232,"MAN OVER RADlO: Code 7, this is U.S."
233,Coast Guard. Maintain your present course.
234,We have a cutter en route.
235,RIGGS: Why you slowing down?
236,We'll hang here.
237,Coast Guard'll be here soon.
238,RIGGS: What do we do now?
239,MURTAUGH: Show them our badges.
240,LAPD! LAPD!
241,RIGGS: Los Angeles Police Department!
242,We heard gunfire!
243,The Coast Guard's on the SPEAKING IN CHlNESE MURTAUGH: Coast Guard! Freighter's on fire!
244,Let's board them.
245,What are you talking about?
246,Fire on the freighter!
247,"MURTAUGH: Okay, l'm upside."
248,Now what do you do?
249,They're getting away.
250,Get me up there!
251,ALARM BEEPlNG LEO: Hell of a fishing trip!
252,MURTAUGH: Shut up and keep your head down!
253,LAPD! LAPD!
254,Stop where you are!
255,Hold it right there!
256,LEO: He's got it! He's got it!
257,RlGGS SPEAKlNG lNDlSTlNCTLY LEO: What'd he say?
258,MURTAUGH: He said watch his back.
259,Why didn't you tell me you were gonna shoot?
260,Tie it up!
261,What?
262,Pull it up!
263,"That was great, wasn't it?"
264,I told you to keep the boat closer!
265,BOTH STAMMERlNG What are you listening to Leo for?
266,"Oh, shit."
267,"You all right, Riggs?"
268,Wow. Look at that.
269,"Oh, shit."
270,Jump! Jump!
271,LEO: Where are you?
272,My boat! My new boat!
273,"Hey, Rog."
274,What?
275,The shark.
276,What about the shark?
277,"Oh, shark!"
278,LEO: Don't leave me!
279,"GRUNTlNG Come on, Leo!"
280,MURTAUGH: Hurry up!
281,LEO: I'm coming!
282,"You can make it, Leo."
283,This is all l got left.
284,"And since l met Riggs, I've had my house destroyed..."
285,THUMP ...my car wrecked and now my boat sunk.
286,What's left?
287,LEO: I think that's about it.
288,"MAN: Four sets of papers, totally genuine."
289,They'll get in the country and they'll be able to stay forever.
290,U.S. citizens.
291,Ask them to vote the incumbent party next election.
292,Help me keep my State Department job.
293,Bloody marvelous!
294,They've redflagged the Asian visas lately.
295,Those weren't so easy to slip through.
296,IN CHlNESE Something wrong?
297,"IN ENGLlSH A small delivery problem, Mr. Proody."
298,Goodbye.
299,Leave!
300,IN CHlNESE TRAIN HORN BLOWlNG lN DlSTANCE BELL DINGlNG YELLS SCREAMS Coast Guard interdicts about one of these a month.
301,Pretty raggedylooking.
302,INS AGENT: Six weeks locked in a hole with one toilet.
303,Rice and a little fish to eat.
304,Lousy deal for 35 grand a head.
305,Thirtyfive grand.
306,Where'd they get that kind of money?
307,"Didn't. Got to work it off from the snakeheads, the smugglers."
308,They sell them as cheap labor.
309,Sell them?
310,Like slaves.
311,I guess these must be the lucky ones.
312,"INS AGENT: They'll claim asylum. Say they were persecuted, like everybody else."
313,We'll send them packing.
314,Cost you and me a goddamn fortune.
315,"What happened to, ""Bring me your tired, your poor..."
316,"...your wretched masses, yearning to be free""?"
317,"Now it reads, ""No vacancies."" I guess your parents were Native Americans."
318,They pop one every boatload.
319,Shows the rest what'll happen if they run off or don't pay.
320,At least he's nobody's slave now.
321,Come on.
322,"Don't coddle them, move them!"
323,We're on the boat and I see this barrel coming down.
324,"Murtaugh didn't see it, so l push him out of the way."
325,Big guy. l knock him over.
326,We're in the water.
327,I pull him because he doesn't swim good.
328,I gotta save him.
329,There's that kid.
330,What's his name? Bissel?
331,lt's a food.
332,Burger!
333,"No, Biscuits or something."
334,"He's always kissing my ass, giving me coffee and shit."
335,"Sergeant Riggs, Sergeant Murtaugh."
336,What are you doing here?
337,"Hell, that's a long story."
338,"BUTTERS: Hey, man, you're all wet."
339,You need a blanket?
340,"MURTAUGH: No, I'm fine."
341,Somebody get this man a blanket now!
342,"WOMAN: Yes, sir!"
343,BUTTERS: All right.
344,OFFlCER: Get this body out of here.
345,BUTTERS: Hold up. What do we got here?
346,"Step back, step back."
347,Shit.
348,"He's dead, man."
349,"He's fucking dead, man!"
350,Shit!
351,What?
352,This is how he wanted to come to America?
353,Was he in the killing section?
354,This guy's been shot four times!
355,"Well, yeah."
356,"At close range, like he was executed!"
357,He was executed.
358,"Yeah, by the crew."
359,"What the fuck, man? People get killed left, right and center in this town!"
360,Now we're importing victims?
361,"Gangbangers wanna kill each other, no problem."
362,"You and me, one of us gets shot, hey, occupational hazard."
363,"But just a normal guy, this fucking guy?"
364,What the fuck did he ever do to anybody?
365,That ain't right.
366,"Easy, Biscuits."
367,"You'll get an ulcer like this, kid."
368,Settle down.
369,BUTTERS: Blanket!
370,"Sorry, Blankets."
371,Here's your blanket.
372,"Sorry, l'm losing my head."
373,I just hate to see bad things happen to good folk.
374,"We'd like to stick around and shoot the breeze, Butler, but you're in charge so You should take this, it's free."
375,You're all wet.
376,Get some vapor rub on your chest.
377,"MURTAUGH: All right, Boogers."
378,"REPORTER: Sir, over here!"
379,"Hey, get them out of here!"
380,Get them out of here!
381,"Yeah, yeah."
382,He takes the job kind of personally.
383,"Personally? Yeah, he's pretty serious, I'd say. Overzealous."
384,Emotionally Jealous of who?
385,l don't know. Who?
386,You just said he was jealous.
387,"l didn't You just said No, I said he was zealous."
388,Full of zeal.
389,He's loud too.
390,What?
391,He's loud!
392,What?
393,We better get up before the sun's up.
394,I got something in the lifeboat.
395,"That's okay, see you tomorrow."
396,"I'll catch a squad ride. Hey, Rog."
397,I'm sorry about your boat.
398,Riggs.
399,l'm sorry.
400,Shit.
401,"All of a sudden, this big fucking shark comes Can I say that?"
402,"You can say it, but we can't air it."
403,So this big darn shark comes along....
404,Shit. My Code 7.
405,PERSON COUGHlNG Hey! Hey.
406,WOMAN: Hey.
407,You were coming home last night.
408,"l know, l'm sorry."
409,I had some bad Chinese.
410,You look a little banged up.
411,You look a little knocked up.
412,LORNA LAUGHS Are you okay?
413,Yeah.
414,You sure?
415,Yeah.
416,"Whoa. Easy, tiger!"
417,There he goes again.
418,She. There she goes again.
419,You okay?
420,I'm good. I'm better than Roger.
421,His boat sank.
422,LORNA: No. Boat sank?
423,l had something to do with it.
424,No! No grease!
425,RIGGS: Have some cookies.
426,What happened?
427,RIGGS: What happened?
428,"Gunfights, explosions, sharks."
429,The usual.
430,"Here, boy."
431,Oh. Thanks.
432,"You were out fishing. l mean, does trouble just go looking for you?"
433,"Well, it seems to know pretty much where l am most of the time."
434,You finished the nursery.
435,"Yeah, l did."
436,I figured it was good for a girl or a boy.
437,"Cute, huh?"
438,RIGGS: lt's a dogfest.
439,Did you get the whole 1 01 ?
440,I know. I got a little carried away with puppies.
441,Kid'll probably hate dogs.
442,"You know, Lorna, we never ever talked about marriage."
443,"Well, l sort of figured you didn't want that."
444,You want to get married?
445,"Well, no."
446,Me neither.
447,You want some breakfast?
448,Yeah. Yeah.
449,Serve and Protect.
450,Since when do you read this smut?
451,"lt's not smut, it's Ebony Clark."
452,Ebony Clark.
453,Trish gave it to me.
454,"""Every fiber in his being desired her."
455,"He devoured her with his eyes."" Hey. Can we try this thing on page 1 96 sometime?"
456,Whew.
457,There's a good one on 1 68.
458,Maybe later.
459,Nothing comes between a pregnant lady and a meal.
460,"Have l ever ""made your womanhood reach peaks..."
461,"...that would rival the highest Himalayas""?"
462,"Foothills of Malibu, maybe."
463,Not even a Teton?
464,l don't think so.
465,Thanks.
466,I thought I'd at least rate the Rockies.
467,"Well, you know l'm kidding."
468,You're just saying that to make me feel better.
469,"No, I'm not. No, l'm not."
470,You know I'm playing.
471,"I've been to plenty of mountaintops with you, Riggs."
472,It's just that l'm hungry.
473,"When you have that kid, we'll blow up Mount Saint Helens."
474,l brought you a doughnut.
475,A doughnut. Police food.
476,How did you know?
477,I dropped by lnternal Affairs yesterday.
478,Really? How's the rat squad?
479,"l picked something up, good one."
480,Some cheese?
481,"Oh, yeah. I.A. got an anonymous tip."
482,The person said Roger's on the take.
483,"No, he's not."
484,I know he's not. It's probably some jerk he put away.
485,But with the new boats and putting two kids through college...
486,...l thought you ought to know.
487,I actually tried to persuade him to take money.
488,"Oh! Stop it, Riggs!"
489,I can't hear that! Nothing!
490,I won't say anything anymore.
491,I'm kidding.
492,That's awful.
493,l'm kidding.
494,Don't tell him l said it.
495,He's got enough problems...
496,"...he'll blow his top, it'll be awful."
497,Just don't say anything.
498,What do you mean?
499,Like what?
500,"ln general, problems."
501,You mean something specific.
502,I got a nose for these things.
503,"Come on, tell me. What?"
504,"No, you know, you're pushing me."
505,I don't want you to go there.
506,Get it off your chest.
507,You'll feel better. Tell me.
508,I won't leave you alone till you tell me.
509,LORNA: Son of a bitch.
510,Tell me.
511,I'll tell you. Pregnancy destroyed my brain cells! I can't believe l said that!
512,What? What?
513,l'm drooling. What?
514,"Oh, Riggs."
515,"Okay. Promise me, swear to me that you'll never say a word about this ever."
516,"l swear, I swear."
517,Right hand!
518,"I swear l won't, ever."
519,I promise. What?
520,You know how Roger is about his daughter dating cops.
521,He'd kill them. So?
522,"Rianne married one, he's her baby's father."
523,She's too afraid to tell Roger.
524,"They met, fell in love."
525,"She got pregnant, they got hitched."
526,And nobody's telling Roger about this?
527,"After the baby's born, Riggs."
528,You mean it's a package deal?
529,"Here it is, take it or leave it? Ha, ha, ha."
530,Does Trish know about this?
531,"Yeah, she knows."
532,She doesn't know you know.
533,But Trish knows.
534,Who's the lucky soontobedead soninlaw?
535,Riggs.
536,Who?
537,Sergeant Lee Butters.
538,Oh. Oh. This just gets better and better!
539,No wonder he sucks up to Rog.
540,"Brings him apples, blankets, coffee...."
541,"Okay, okay. Not a word."
542,"I'm telling you, nothing."
543,You kidding? l won't tell. He'd shoot me just for being the messenger.
544,He's my best friend. lt'd be wrong to mess with him. I promise. I won't.
545,Promise.
546,"LORNA: We don't have to discuss boys' names, period, because we're having a girl."
547,Okay. Piadora.
548,l like Piadora. That's sweet.
549,Yeah?
550,KNOCKlNG Can't live with that.
551,l love that name.
552,We're talking kids' names.
553,Has Rianne picked any out?
554,Need all the help we can get.
555,We don't want to double up.
556,"Oscar for the boy, Loreen if it's a girl."
557,I like Lee Butter.
558,Better! l like it better.
559,Don't get me started.
560,LORNA: I like those names.
561,MURTAUGH: Captain wants to see us downtown.
562,Trish'll be right down.
563,Have fun shopping for the baby.
564,"RIGGS: Byebye, honey."
565,Yeah.
566,Who had the sleepover?
567,Just airing out camping gear.
568,We're out of here.
569,Wow. Something smells good.
570,LORNA: Really good!
571,Trish has food on the stove.
572,We're out of here.
573,That smells like Chinese food.
574,MURTAUGH: Chinese food?
575,She's into Chinese cooking.
576,RIGGS: I gotta see this. Can l taste?
577,l love Chinese food.
578,"MURTAUGH: Hold it! Please, Lorna."
579,Please.
580,There's a Chinese person in the kitchen.
581,I saw him.
582,A couple of Chinese people.
583,Actually a whole family.
584,Large family.
585,"Oh. Hey, guys! What's up?"
586,Hey.
587,Hello.
588,MURTAUGH: Yeah.
589,lt does smell good.
590,Great.
591,They were hiding in the lifeboat.
592,They were?
593,"MURTAUGH: With what the lNS guy said, I had to do something."
594,So you brought them home.
595,lt took two trips.
596,Really?
597,They fit in the station wagon?
598,"That's Ping with his grandfather, Hong."
599,He's head of the family.
600,Speaks pretty good English.
601,"Hong, this is my partner, Martin Riggs, and Lorna."
602,Wife?
603,No.
604,"Rog, can l speak to you?"
605,"CARRlE: Lorna, this is the best breakfast."
606,I'm hungry. l'd love some.
607,Are you out of your mind? This is illegal.
608,"As in, ""against the law."" You'll bring a shitstorm down on you."
609,Just hold on!
610,Just wait a frigging minute!
611,"The way l see it, those are slave ships out there."
612,"And l'm freeing slaves, I'm freeing slaves..."
613,...like no one did for my ancestors. Okay?
614,"Riggs, it's my chance to do something and do it right."
615,Why didn't you say so?
616,This is not gonna be boring.
617,Need any help?
618,Okay.
619,Where is he?
620,"Hey, Daddy."
621,"What is it this time, food or money?"
622,Food and money.
623,Money.
624,I see you more than when you lived here.
625,We're independent now.
626,"Okay, okay. What's the money for?"
627,"Hookers, drugs Contraceptives."
628,Can you believe they talk to their father like this?
629,Better than their parole officer.
630,CARRlE: lt costs more to go to school now.
631,"Me first, me first."
632,I get the tuition bills.
633,And the grades too.
634,Consider this a down payment on a future asschewing.
635,Get out of here and go to school.
636,I wanna see some grades.
637,I see the tuition.
638,I want to see some grades!
639,I want more cluck for my buck.
640,NICK: Thanks for the money.
641,"Oh, boy."
642,l'm tired.
643,"Me, l can't win."
644,Boy!
645,Did we get a raise and nobody told me about it?
646,"Heh, heh. I got to get to the bank."
647,How can you when you're taken to the cleaners all the time?
648,Yeah.
649,"Hey, guys."
650,"Hey, Trish."
651,"Hey, babe."
652,Those the kids leaving?
653,Yes. And we're broke.
654,Is Lorna here?
655,"Yeah. She's in the kitchen, probably on her third breakfast."
656,I remember those days.
657,"Oh, Martin, l'm sorry."
658,l love it when you do that.
659,You look terrific.
660,Thank you.
661,Wait till she starts trying to raise that baby by herself.
662,"Daddy, l'll be fine."
663,Move back in and Grandpa Rog will be up all night with the baby.
664,Better than her marrying the wrong guy.
665,"Well, you know, a cop or something."
666,True.
667,"Come on, guys. See you."
668,l should say goodbye.
669,"TRlSH: Hey, Lorna."
670,MURTAUGH: Hurry up.
671,"RIGGS: Oh, yeah. Stuffing your face."
672,Stop kissing me. Try that.
673,You stay away from my girl.
674,I'm not joking.
675,Stay away from my girl.
676,Joking.
677,Bye! Got the baby beeper?
678,RIGGS: Yeah.
679,l know.
680,lt's your fault.
681,It's your fault.
682,All the chicken shit.
683,Flapping all over the place.
684,"All right, everybody!"
685,"It's been a year almost already, okay?"
686,This shit ain't funny no more!
687,All right? Enough is enough!
688,Please! Enough.
689,I'm the one that gets it in the neck. Can we exercise a little maturity around here?
690,"If l find who's doing this, I'll kick his ass."
691,What asshole is doing this?
692,"Riggs, l catch that asshole who put my picture up, that's it!"
693,That's it.
694,RIGGS: Cut their balls off.
695,Captain.
696,"Hey, captain."
697,MURPHY: I look out expecting to see all the old faces.
698,"Instead, l see a bunch of kids whose names I barely remember."
699,Will you sit down?
700,We're dinosaurs headed for extinction.
701,Speak for yourself.
702,"We're making way for the new police: Guys with guns and psychology degrees, like Butters out there."
703,Biter has a psychology degree?
704,More like a psycho degree.
705,"Hell, I got nothing against it."
706,Times have got to change.
707,I once got shot by a hotrodder with a zip gun.
708,That's how far back I go.
709,You wanted to see us about something?
710,Some things don't change.
711,Here we go.
712,MURPHY: The department lost its insurance.
713,"All the damage you've done, they can't get a new one..."
714,...while you two guys are still running around.
715,They can't fire you either.
716,So they're promoting you.
717,Heh.
718,Eh.
719,Lieutenant.
720,MURPHY: There's no open lieutenant spots.
721,"So the chief used his special privilege, he's making you captains."
722,Better.
723,Captain.
724,Time was when this would send me over the falls. I'm getting old.
725,"So, what the hell we do now?"
726,"I don't know, captain shit."
727,Hang out.
728,MURTAUGH: Take long lunches.
729,"Yell, ""Riggs, Murtaugh, I'm the captain."" MURTAUGH: ""Chief's shitting bricks, man."" You finished? You finished?"
730,Think you can stay off the streets and out of trouble?
731,Absolutely.
732,Captain Riggs.
733,Captain Murtaugh.
734,"LAUGHlNG RIGGS: All right, hey."
735,"Hey, this is MURPHY: Hey."
736,You want your badges? Let me see those sergeant badges. Give me those.
737,Throw them over here.
738,RIGGS: Never liked it.
739,Here.
740,Give me those.
741,This is one of the most painful fucking experiences of my life.
742,Now get out of here.
743,"Thank you, captain."
744,"Thank you, captain."
745,"Thank you, captain."
746,"Captain, after you."
747,"After you, captain."
748,"Enough with the ""captain"" shit."
749,Get out of here.
750,"After you, captain, l insist!"
751,"""O Captain! My Captain!"" Captains outrageous!"
752,News travels fast.
753,Get a break from real police work.
754,"Play golf, tennis...."
755,"SINGlNG They got brown rings ALL: Around their noses Now that you're captains, come up in the chopper for a ride."
756,Not for me.
757,RIGGS: l'll take a rain check.
758,"lf you change your mind, call us."
759,He's downtoearth kind of guy.
760,Aw.
761,I'm sorry.
762,"Can we knock this shit off, please?"
763,This is your captain speaking.
764,"Can we knock it off, please? Okay?"
765,Jesus.
766,"The man's got feelings, you know?"
767,"PEOPLE LAUGHlNG BUTTERS: Hey, congratulations. Look at you."
768,Captain Murtaugh.
769,"I don't really know how to say this, but you really inspire me."
770,Keep it up.
771,"RIGGS: How's it going, Burton?"
772,"lt's Butters, captain."
773,Yeah. I'll remember that.
774,Kid really likes you.
775,l wish he'd cut that shit out.
776,He likes me?
777,Likes me?
778,What?
779,"No. You don't think he likes me, likes me, likes me..."
780,...likes me like that?
781,Oh.
782,"This is not the military, it's the police force."
783,The millennium's creeping up on us.
