,dialog
726,as the contracts were in French and he didn't speak a word.
727,And when we stopped at Vinkovci...
728,"I struck up a chat with the colored doctor, Arbuthnot."
729,"And we had a couple of drinks, stretched our legs."
730,He had some...
731,odd opinions about Stalin I had to turn around.
732,"I don't hold a man's race against him, but I don't often take to Britishers."
733,When did your party end?
734,He left just after 2:00.
735,Did you know of any specific enemies Ratchett might have had?
736,Gosh.
737,Pick a number.
738,He confided he had been threatened?
739,He got a couple of nasty letters.
740,I have them if you like.
741,"Some, anyway."
742,He tore up the rest.
743,Threw them into the fire.
744,That's them.
745,"Merci, Mr. MacQueen."
746,"Uh, thank you."
747,"If we have any further questions, we will call for you again."
748,Have you considered the Latin man?
749,Marquez. Hell of a guy.
750,"And, well, you know, his kind..."
751,"they don't have the same distaste for murder, historically speaking."
752,You said you don't hold a man's race against him.
753,I suppose...
754,depends on the race.
755,And he was doing so well.
756,You think it's MacQueen?
757,Too early to say.
758,"I admit, I cannot see him stabbing a man twelve times in a frenzy."
759,"Not sober, anyway."
760,Who did it then?
761,I do not know yet.
762,It is time we ask.
763,Ask who?
764,The victim.
765,"He has twelve stab wounds and, as Arbuthnot said, they are patternless."
766,If the doctor is guilty...
767,he certainly did not let it influence his responsibilities.
768,"Hey, the watch."
769,Stopped at 1:15.
770,Now that agrees with the doctor on the time of death.
771,"Hmm. It is possible, yes. Certainly possible."
772,I don't quite understand.
773,"I do not understand, myself."
774,I understand nothing at all.
775,If you look at these two wounds...
776,"they are powerful and deep, and yet there is little blood."
777,But this was a frenzied attack.
778,Lashing here and there.
779,"No pattern at all, just extreme violence."
780,"And during all this, our victim, vigorous and anxious and full of coffee..."
781,merely lies still and accepts death without struggle...
782,when he also has here...
783,the means by which he might defend himself.
784,For you.
785,"Now, let us see here."
786,Barbital. The Mickey slipped.
787,Drugged him so he couldn't use this.
788,"And later around here, a lady's handkerchief."
789,"An objet de luxe, handmade."
790,"Boom, two hundred francs in Paris."
791,"And she even has an initial, ""H."" And our little friend, the pipe cleaner."
792,Another clue.
793,"Yes, a riot of clues dropped most conveniently."
794,"Yet only one appears, however, to be perhaps genuine."
795,And maybe this ashtray provides the accidental breadcrumb.
796,A charred fragment of a note.
797,"An attempt, perhaps, to burn evidence."
798,"Merci, monsieur."
799,"We may borrow your equipment, yes?"
800,Thank you.
801,"Merci, merci."
802,"Now, I prefer to understand..."
803,why a clue is left rather than what the object is.
804,"We seek the truth from within, not without."
805,"In this case, however, I may welcome a little scientific assistance."
806,You will adjust the flame.
807,It's just another one of those nasty letters.
808,"You are mistaken, mon ami."
809,This one has a secret to tell.
810,Look.
811,"""As a strong blood is on hand, you will die."" What does this mean?"
812,"Come with me, Bouc."
813,Let us fill in the gaps.
814,This was never a beachside puzzle.
815,I know the dead man's real name.
816,"It is not Ratchett, but Cassetti."
817,I know that name.
818,Then you will also know the name Armstrong.
819,The Armstrong case?
820,The story shocked the world.
821,Two years ago...
822,"the renowned pilot, Colonel John Armstrong..."
823,"and his wife, Sonia, woke to find their only child, little Daisy..."
824,taken from her crib as she slept.
825,Desperate...
826,the Armstrongs paid the ransom.
827,"But soon after, Daisy was found murdered by..."
828,"Ratchett, who was Cassetti."
829,Sonia Armstrong was with child when she received the news.
830,The shock sent her into premature labor.
831,Neither she nor her baby survived.
832,"How do you know this, Poirot?"
833,Because John Armstrong told me so himself.
834,He wrote to me to ask me for my help.
835,By the time I received his letter...
836,it was too late.
837,He was found dead of a gunshot wound.
838,Selfinflicted.
839,"""Daisy Armstrong's blood is on your hands."
840,"""You will die for it."" Indeed, you did."
841,Monsieur Poirot?
842,"Yes, Michel."
843,Mrs. Hubbard wants to speak to you.
844,I held her as best as I could.
845,"Ah, Mrs. Hubbard, I'm sorry to have kept you."
846,You have a head full of steam and a mouth full of words.
847,"You're goddamn right, I do."
848,What I have been trying...
849,to tell you all day.
850,The murderer was in my compartment last night.
851,I thought I'd be killed.
852,Turns out I might have been...
853,only he got Ratchett instead.
854,"I woke up in the dark, and I knew there was a man in my room."
855,You are certain it was a man?
856,I know what it feels like to have a man in my bedroom.
857,"I told your conductor, and he wouldn't believe me."
858,"I said, ""Check the communication door ""between my room and Ratchett's."
859,"""He must have left through there."" Sure enough, it was unbolted."
860,I know I locked it...
861,after what Ratchett said.
862,He made a rather overt overture.
863,Have you perhaps...
864,heard of the Armstrong kidnapping?
865,You couldn't avoid it.
866,Morbid stuff.
867,"The child's murderer, Cassetti..."
868,died last night.
869,Ratchett was the man.
870,"I told you, I knew he was a rotten one."
871,You do believe me...
872,about the man in my room?
873,I'm aware you think I'm a silly woman.
874,But I have proof it's true.
875,It is from the uniform...
876,of an Orient Express conductor...
877,but it might have fallen from Michel's when he was in your room.
878,I'm not missing any.
879,"I found it at the foot of my bed, on the cover..."
880,right where I slept.
881,What do you call that?
882,"I call it evidence. Thank you so much, Mrs. Hubbard."
883,Have you ever been to America?
884,Once.
885,"Years ago, briefly."
886,For what purpose?
887,To confirm a suspicion.
888,Which was?
889,That I wouldn't like it.
890,I was offered a post in Boston.
891,"Saw Boston, went straight back to London."
892,Is that where Ratchett was from?
893,Boston?
894,I can't says I know.
895,It wouldn't be proper...
896,to ask.
897,Carry on.
898,I last saw...
899,Mr. Ratchett at nine o'clock.
900,I brought his coffee and hung up his clothes.
901,"You have a toothache, I think."
902,I've got an extraction booked in London this week.
903,Mr. Ratchett insisted on not putting it off any longer.
904,He said he was tired of hearing my suppressed groans.
905,This sympathetic Ratchett...
906,was it his usual practice to drink coffee at night?
907,Not at all. But he'd been very agitated lately.
908,"Said he wanted to stay alert, especially so last night."
909,He found a letter in his compartment.
910,Please tell me you didn't do this.
911,"If I were to leave something unpleasant on your pillow, sir..."
912,it would not be a letter.
913,Coffee.
914,"Surely, such a..."
915,proper and precise valet...
916,would never speak to his master as you did?
917,Unless he knew his career was coming to a sudden...
918,end.
919,"No mere toothache, I think."
920,The lungs?
921,The thyroid.
922,Spread now to stomach.
923,"Same as got my father, five years younger."
924,Months at best.
925,"""Inoperable, I'm afraid,"" said the doctor."
926,"And suddenly, I wasn't... afraid."
927,I would only do what I wanted from here on.
928,I speak my mind now.
929,The coffee.
930,It appears that his cup was laced with barbital.
931,"You, of course, will tell me that you did not put it in there."
932,Of course I didn't.
933,When and from where did you procure the coffee and the cups?
934,"In the kitchen, sir."
935,"I ordered it at dinner to be ready at 9:00, and so it was."
936,Anybody could have got a hold of it before me.
937,Merci.
938,Mr. Masterman.
939,I'm sorry about the toothache.
940,Merci.
941,I love the little cakes.
942,"So, Miss Pilar Estravados, you are a missionary..."
943,"but you trained as a nurse before you changed professions, yes?"
944,I owed it to God.
945,You owed Him a debt?
946,There were...
947,indulgent times in my life...
948,when I took more than I gave.
949,Gerhard Hardman.
950,Professor of engineering.
951,It is science that will win back for Germany her pride.
952, Biniamino Marquez.
953, Mr. Marquez.
954,"Listen, I wanna be clear of any association with the crime..."
955,so please ask me anything.
956,Anything. I never lie anymore.
957,Did you leave your compartment at all last night?
958,"Only once, to get an aspirin."
959,Mrs. Hubbard offered me something earlier.
960,"I declined at first, but when I couldn't rest..."
961,I went to ask for it.
962,My conference is in Turin.
963,"I am the only Austrian to present, which means without me..."
964,the talks will be substandard.
965,"Then I escaped prison, and I bribed myself into the US..."
966,where I swore never to lie or steal again.
967,"You see, my friends, because when people trust you, they buy more."
968,The Italians are cows.
969,"The Spaniards, sheep."
970,The Belgians...
971,"I come to my room, which I share with the unhappy English butler."
972,A fish. He groans a lot.
973,But I'm sure he saw me sleep all night until morning.
974,I should say...
975,in case it is relevant...
976,there was an embarrassing moment.
977,When I went to see Mrs. Hubbard...
978,"first, I opened the wrong door."
979,"Oh, sorry."
980,What time was this?
981,That must have been about...
982,Don't be sorry.
983,...twenty minutes to 11:00.
984,This is interesting.
985,"As far as it is known, you are the last person to see Ratchett alive."
986,Your business?
987,Automobiles.
988,I have three showrooms.
989,I come to America with nothing. And now...
990,"If what you say is true, Miss Debenham will confirm it."
991,But it is true.
992,I would not lie.
993,May it be possible that Miss Debenham left your compartment without you noticing?
994,No. I sleep very lightly.
995,The slightest sound and I bolt upright.
996,I was surprised once.
997,Never again.
998,"No, I didn't say I was a chauffeur."
999,The photographs that spilled out of your luggage...
1000,there was a beautiful one with a little boy wearing a chauffeur's hat...
1001,visiting his papa at work.
1002,Who did you chauffeur?
1003,"Miss Estravados, why do your hands have the calluses of a boxer?"
1004,I do my work in dangerous cities...
1005,where I cannot be governed by fear.
1006,I trained to fight.
1007,But you do not trust your god anymore...
1008,since your surprise?
1009,"No, in case He is busy."
1010,God is always busy.
1011,It's Masterman.
1012,A man dying is a man with nothing to lose.
1013,"Bravo, Bouc. Except for the problem of Mr. Marquez..."
1014,"who has now confirmed that his bunkmate, Masterman..."
1015,was reading in his bed at the time of death.
1016,"If it were easy, I would not be famous. Next."
1017,Miss Debenham...
1018,you do not mind to brace the air?
1019,"For you, we have the picnic."
1020,While you made my roommate suffer cramped quarters.
1021,I see.
1022,Choose the best location to extract the truth from each suspect.
1023,"Put her offbalance and me, freeze."
1024,Clever.
1025,"Will you write down your full name and address, please?"
1026,"A pale mauve, by the way."
1027,Miss Estravados told me you asked the color of her dressing gown.
1028,Merci.
1029,"""Mary Hermione Debenham."" Do you ever go by Hermione?"
1030,"A constant Mary, when I'm not employed as Miss Debenham."
1031,Lefthanded.
1032,"Unusual, I know."
1033,You mustn't have your theory fixed if you're testing my handwriting.
1034,What did you think of the dead man?
1035,"Uh, I can't say I did think about him."
1036,I don't quite see the point of your question.
1037,"Oh, forgive me, mademoiselle, my little originalities."
1038,Human nature is perverse in its complexity.
1039,"To plumb it, it takes the right tools."
1040,"These are toys, not tools, Hercule."
1041,I prefer you put them away.
1042,The direct method? Parfait.
1043,You knew the doctor before traveling?
1044,Dr. Arbuthnot?
1045,No.
1046,But such instant attraction?
1047,We are not in America...
1048,Miss Debenham.
1049,There are no laws against what you may feel.
1050,"Nor are there laws against silence, of which..."
1051,I hold my...
1052,I've never been to America.
1053,Perhaps I may ask about some...
1054,words I overheard?
1055,"You and the stranger, Arbuthnot, are closer than strangers might be."
1056,You said...
1057,"""Not now. When we are done."
1058,"Then no one can touch us."" What did you mean?"
1059,You think I meant murder?
1060,"To a man with a hammer, every problem is a nail."
1061,You live crime.
1062,You see evil every day.
1063,Not so.
1064,I see enough crime to know that the criminal act is the anomaly.
1065,I believe it takes a fracture of the soul...
1066,to murder another human being.
1067,"I ask again, what did you mean?"
1068,As we established...
1069,there are no laws against my silence.
1070,Very well.
1071,"And afterwards, Princess Dragomiroff?"
1072,"After dinner, I came to bed."
1073,"God blessed me with long life, but cursed me with a bad back to make it miserable."
1074,About a quarter to 1:00...
1075,I called for Fräulein Schmidt.
1076,Mmmhmm.
1077,She massaged me...
1078,and read to me for a while.
1079, Then I sleep.
1080, Mmmhmm.
1081,Were you ever acquainted...
1082,with a family by the name of Armstrong?
1083,They endured an unspeakable tragedy.
1084,I was an admirer of Sonia Armstrong's mother...
1085,"Linda Arden, the actress."
1086,A onceacentury talent.
1087,Miss Arden was to turn to directing.
1088,She would have become the first woman titan of Broadway...
1089,were it not for the tragedy.
1090,"And this Linda Arden, she is dead?"
1091,She might as well be.
1092,She no longer leaves her home.
1093,Daisy was my goddaughter.
1094,She was a...
1095,"I don't see how this relates to our troubles, Detective."
1096,"The man killed last night, his true name was Cassetti."
1097,The man who murdered little Daisy Armstrong.
1098,I see.
1099,"I admit I know this family, and now this man is dead."
1100,The coincidence...
1101,must seem unbearable.
1102,You may be permitted a coincidence.
1103,I must now ask a few questions of your Fräulein Schmidt.
1104,No. There is no need.
1105,I can answer to her character.
1106,"Even still, if you will allow."
1107,Fraulein. Answer please in German.
1108,But her Excellency cannot comprehend me.
1109,That is the point.
1110,This is yours? H for Hildegarde?
1111,It is too fine for me.
1112,This is the truth about last night?
1113,"As she said. She sent the conductor for me, then I returned to bed."
1114,Did you see anyone when you returned?
1115,Only the other conductor.
1116,"""The other conductor."" You mean Michel?"
1117,No. A different one than had awoken me.
1118,Please come with me.
1119,Are you sure you did not see him?
1120,I'm certain.
1121,The other conductor was a small man with a short beard.
1122,"Fräulein, there is no other conductor."
1123,I know what I saw.
1124,I remember because his voice was high and the uniform was the same exactly.
1125,"Though, I suspect, missing one button."
1126,"Sir, I need your passkey immediately."
1127,We need to find a uniform and a red kimono.
1128,"Thousands of photographs, endless pairs of socks..."
1129,dressing gowns in every color but red...
1130,and still no contraband conductor's uniform.
1131,Have we checked all the passengers' luggage?
1132,"All except for the Count and Countess Andrenyi, monsieur."
1133,It is forbidden to search their suitcases.
1134,They travel under diplomatic visas.
1135,Where else could it be?
1136,There is one last suitcase we have not checked.
1137,My own.
1138,The killer is mocking me.
1139,Good. His first mistake.
1140,And as the night must follow the day...
1141,"Pardon, mademoiselle."
1142,"No, it's not mine."
1143,I told you of the conductor.
1144,Why would I tell you if it was me?
1145,You would not...
1146,which makes your compartment the ideal choice to hide it.
1147,"Voilà, the button."
1148,And if a conductor's uniform...
1149,why not a conductor's passkey?
1150,Now we know how the killer magically passed through locked doors.
1151,Bourbon.
1152,MacQueen.
1153,Now what are we looking for now?
1154,MacQueen also had a ledger.
1155,All his dealings with Ratchett.
1156,"Where is it, hmm?"
1157,Poirot?
1158,"Bouc, keep everyone inside!"
1159,Monsieur!
1160,Please stop!
1161,Monsieur!
1162,Monsieur!
1163,Please stay where you are.
1164,"Thank you, gentlemen."
1165,Thank you.
1166,"So, it was MacQueen?"
1167,You have your man?
1168,"Pardonnezmoi, madame."
1169,How could he?
1170,I didn't kill him!
1171,You tried to burn Ratchett's accounts...
1172,but they are still legible in places.
1173,The maths do not tally...
1174,because you have been stealing from him.
1175,It is full of the...
1176, What is the English word?
1177, The chocolat?
1178,Fudge?
1179,Fudge!
1180,It is full of the fudge!
1181,You stole from him!
1182,You thought you would be found out.
1183,That is why you killed him!
1184,Yeah.
1185,"Yeah, you're damn right I stole from him."
1186,Thousands.
1187,I knew his money wasn't honest.
1188,What did it matter if I skimmed some off the top?
1189,But let me ask you a question.
1190,Why would I slaughter my cash cow?
1191,I didn't do it.
1192, I didn't kill him!
1193, He didn't.
1194,He didn't.
1195,"I expect his alibi revolves around me, drinking till the early hours."
1196,"Well, it's true."
1197,"I saw him having whiskey, and remarked on the lesser quality of American liquor."
1198,"He offered me a tipple to change my mind, then another."
1199,We got to arguing politics.
1200,He had some...
1201,tomfool opinions on Stalin I had to correct. But the man knows his spirits.
1202,"A word, please, monsieur."
1203,You can confirm you were with him all night?
1204,"We smoked and spoke till nearly 2:00, yes."
1205,"Ah, such chums, him with his cigarettes, and you..."
1206,"Yes, you are the only man on the train who smokes a pipe."
1207,"May I see your pipe and your tobacco, please?"
1208,Of course.
1209,"And you, Dr. Arbuthnot, were traveling from India, I believe. Yes?"
1210,You're interviewing me now?
1211,Mmmhmm.
1212,Were you ever in Ratchett's compartment before he was killed?
1213,Certainly not.
1214,"But this is one of your pipe cleaners, n'estce pas?"
1215,"If you found that in the dead man's cabin, look elsewhere."
1216,"I am a doctor, sir."
1217,I heal people.
1218,I do not hurt them.
1219,"About this, see, you must have worked very hard to become a doctor."
1220,Not many of your race are allowed the opportunity.
1221,Middlesex Medical College permits one per class.
1222,I had the honor in '24.
1223,I was a sniper in my tour.
1224,A sharpshooter.
1225,Saved more than a few officers.
1226,"The more grateful, recognized a fair mind with a steady hand..."
1227,and supported my education.
1228,I take their generosity as a debt.
1229,Did you know a Colonel Armstrong?
1230,Might have known two or three Armstrongs.
1231,Tommy in the 60th...
1232,Selby Armstrong...
1233,"No, I meant Colonel John Armstrong."
1234,"He had an American wife, and his child was kidnapped and killed."
1235,Oh.
1236,Never came across the fellow.
1237,When did you first meet Miss Debenham?
1238,We met when we shared the railway convoy car from Kirkuk to Nissibin.
1239,"She claims otherwise, and she has made herself problematically suspicious."
1240,Excusezmoi.
1241,Mary is a lady.
1242,Leave her out of this.
1243,I can vouch for her character.
1244,As you vouched for MacQueen's time?
1245,You won't listen to reason.
1246,Never.
1247,You are lucky.
1248,The good doctor insists he did not let you out of his sight.
1249,See? There.
1250,Couldn't have done it.
1251,"Yes, you could."
1252,Ratchett took a sleeping draught each evening.
1253,"You could add barbital, easily access that drug."
1254,Do the same with one of the doctor's many drinks...
1255,and the chance to kill him is clear.
1256,Why would I do any of that?
1257,We have established your motive.
1258,Perhaps I will suggest a different one.
1259,"A different reason, a more personal reason."
1260,"""A lawyer by education, not by disposition."" Why did you pursue the law, I wonder?"
1261,"Was it to appease a much loved, but demanding father..."
1262,one who himself had made a great success in the same field...
1263,and then lost his position?
1264,"There was a renowned MacQueen, was there not?"
1265,The district attorney for the state of New Jersey...
1266,responsible for the prosecution of the Armstrong case.
1267,They didn't have a suspect.
1268,My dad was pressured to go after this poor French woman...
1269,"a maid with a weak alibi, Susanne."
1270,He hung his whole case on her.
1271,She killed herself.
1272,She was innocent.
1273,"By the time the evidence lead to Cassetti, oh, he was long gone."
1274,They tore my old man apart.
1275,I couldn't do anything for him.
1276,And yet you claim that you did not know Ratchett was Cassetti?
1277,"No, no."
1278,But you found him.
1279,No.
1280,You found him.
1281,You bled him dry...
1282,No.
1283,"in order to settle your father's debts, and then finally, to settle the score."
1284,"No, no, no."
1285,No. It wasn't...
1286,It wasn't like that.
1287,It's not the way...
1288,Someone kicked in the door...
1289,Doctor!
1290,covered my face.
1291,"All right, this needs to come out now."
1292,I want my bag.
1293,Of course.
1294,It's in my compartment.
1295,There will be no fingerprints.
1296,The killer was disposing of the murder weapon.
1297,It'sthere!
1298,The killer didn't hit a lung or artery.
1299,She's lucky to be alive.
1300,You all are.
1301,"Yeah, some genius!"
1302,Why haven't you solved this case?
1303,You must give the man some time.
1304,"Yeah, well..."
1305,I can't give that much more.
1306,I don't have any blood left.
1307,Yeah.
1308,"Accosting Mr. MacQueen, and the real killer is right here."
1309,One of you people.
1310,I don't know who you are.
1311,I said nothing.
1312,"Please, leave me alone."
1313,Play something.
1314,"My friends, the tracks will be cleared by morning."
1315,"Please, return to your rooms."
1316,I'm sleeping here...
1317,where everyone can see me and I can see everyone.
1318,You should all do the same. Conserve heat.
1319,"Remain in the open, safely in view, until morning."
1320,A killer will never hesitate to kill again.
1321,I will convey the same message to the Andrenyis...
1322,diplomatic immunity or not.
1323,"If I may, I will look at your passports."
1324,You know that I must talk with her.
1325,"By the way, there is a grease spot on your wife's name."
1326,You might want to look at that.
1327,Elena is not well.
1328,"If you do not permit me, your reluctance will be noted to the Yugoslav Police..."
1329,and I have no doubt that they will arrest both you and...
1330,How dare you!
1331,Darling!
1332,Darling.
1333,"You are funnylooking, monsieur Poirot."
1334,Are all detectives so funnylooking?
1335,"I am sorry to wake you, Madame la Comtesse."
1336,Hmm.
1337,I am always awake at night.
1338,"In the day, I sleep."
1339,"Some fear darkness, but I cannot stand the light."
1340,You are always under the influence of...
1341,Barbital.
1342,"Barbital, barbital."
1343,I take oceans of it.
1344,"Oh, there's no use in a lie, love."
1345,He can see right through us.
1346,I cannot go outside without it.
1347,I cannot sleep without it.
1348,I take it against my fears.
1349,What are you afraid of?
1350,Everything.
1351,Your passport has your maiden name as Goldenberg.
1352,"Jewish, yes?"
1353,Not so Jewish.
1354,My middle name isn't Maria.
1355,And you are a dancer like your husband?
1356,"No, not like my husband."
1357,Corps de ballet.
1358,He is touched by angels.
1359,I have been shoved by passion and hard work to become adequate.
1360,"Excuse me, I must lie down again."
1361,Is this your only dressing gown?
1362,"No, I have another."
1363,Corncolored chiffon.
1364,I like speaking to detectives.
1365,You never know what they're going to ask you next.
1366,I'm particularly good at capitals.
1367,My governess was a stickler for geography.
1368,Are you satisfied?
1369,I am always satisfied when I uncover a liar.
1370,"Madame, your name is not Elena. It is Helena."
1371,Despite your clumsy attempts to change it here and on your luggage.
1372,My husband heard of a piece of evidence found...
1373,"a handkerchief embroidered with an ""H,"" and didn't want my ""H"" involved."
1374,So we changed it.
1375,The luggage and the passport.
1376,It's no crime to want to be distant from trouble.
1377,"Yet, here is trouble."
1378,A curious detail about the Armstrong tragedy at the heart of this case...
1379,is how many people were wounded by it.
1380,The younger sister.
1381,The actress mother...
1382,"stage name, Linda Arden."
1383,"I suppose she, too, was of Jewish ancestry..."
1384,as who is most likely to take a stage name?
1385,Is it too far to suggest...
1386,her original name was Goldenberg?
1387,"Especially when we find a young woman, the same age..."
1388,as her surviving daughter...
1389,living in a world of fear?
1390,The sister of Sonia Armstrong.
1391,Get out!
1392,I hear noises and I run.
1393,"Just in time, yes?"
1394,You must now believe the count and countess are the killers.
1395,The count is protective.
1396,The countess would no sooner kill a bedroom spider.
1397,And you may desist with this charade.
1398,"You are neither an Austrian, nor a German, nor a professor."
1399,But a good imitation.
1400,Was it based on someone you know?
1401,A local butcher where I grew up was a Kraut.
1402,"Good man, great accent."
1403,What was it?
