,dialog
1404,"You said ""Turin..."" the emphasis on the wrong syllable for a proud and proper Teuton."
1405,"""Tureen."" You are one sharp knife, I give you that."
1406,Herr Professor Gerhard Hardman...
1407,is my cover.
1408,I'm sorry about the colored folks cracks.
1409,"Hell, I'm half a Heeb myself."
1410,Cyrus Bethman Hardman.
1411,You are a Pinkerton detective?
1412,"I was in Stamboul, coming back from a job, when the office cabled."
1413,"Ratchett asked for a man to tail him, offering triple time."
1414,Lucky me being nearby.
1415,"He told me to look out for a small, dark man with a high voice."
1416,I watched that hall...
1417,all night through a crack in my door.
1418,Any thug...
1419,had to go by me first.
1420,I'll take my oath on it.
1421,And would you also take your oath...
1422,on your thirty years as a Pinkerton Detective...
1423,or would you lie to me again...
1424,"and deny that you were, in fact, a policeman first?"
1425,"Your gun, the checkered grip, the blue finish..."
1426,produced for the Police Positive edition.
1427,It appears there are no end to the lies manufactured just for me.
1428,"You can leave your gun as you go, Professor."
1429,From the position of his cabin...
1430,it would have been impossible to miss.
1431,Unless Ratchett's door was open...
1432,as Pilar Estravados claims she opened it.
1433,"In which case, someone could have been..."
1434,masked from his view.
1435,My darling Katherine.
1436,This is an abominable crime...
1437,"and I am stuck, ma Katherine."
1438,I cannot find the crack in the wall.
1439,Why does one of them elude me?
1440,I have always been...
1441,so sure.
1442,Too sure.
1443,"But now, I am very humble."
1444,"And I say, like a little child..."
1445,I do not know.
1446,"I am afraid, ma Katherine."
1447,"My apologies, ladies and gentlemen."
1448,It is not safe on board whilst the engine is put back on the tracks.
1449,We are to wait in the tunnel.
1450,Thank you.
1451,Where are they taking the dogs?
1452,They'll be happy.
1453,That's not right.
1454,"Just to stretch their legs, it's good."
1455,"No, that's not right."
1456,It's freezing!
1457,Are we stuck?
1458,You asked for me?
1459,Another interrogation?
1460,"Oh, no. I enjoy your company."
1461,"Merci, Bouc."
1462,"Uh, please."
1463,I have a list of ten questions I am no nearer to answering...
1464,and the train is about to leave.
1465,You have a clear mind...
1466,and I thought that you might produce an insight. Please.
1467,Hmm.
1468,"""The handkerchief."
1469,The pipe cleaner.
1470,"""The scarlet kimono."
1471,The uniform.
1472,"""The time on the watch."
1473,"""Was he murdered then?"
1474,Earlier or later?
1475,"""By one person or more?"
1476,"""Which of them?"" Sorry, I can't help you."
1477,Uh... Merci.
1478,Perhaps there is an eleventh question you don't know to ask yet...
1479,that will give you the answer to the rest.
1480,Perhaps.
1481,"I could point an easy finger at the, uh, Countess Andrenyi."
1482,I discovered she was Sonia Armstrong's sister.
1483,Are you certain?
1484,Yes.
1485,I suspect she may perhaps be innocent.
1486,Perhaps.
1487,But so many people have lied to me on this train and do not seem to mind.
1488,You yourself did so effortlessly.
1489,Me?
1490,You told me you had never been to America.
1491,You also concealed the fact that at the time of the tragedy...
1492,you were living in the Armstrong household...
1493,as governess to their daughter.
1494,And you know this.
1495,I have my living to get.
1496,A girl detained in connection to a murder case...
1497,no decent class family would engage me.
1498,"Miss Debenham, you planned Ratchett's murder."
1499,And then you sent for the countess to witness it.
1500,"If she saw him dead, the Helena you knew might return."
1501,"You waited for your roommate to sleep, but she did not."
1502,You drugged her.
1503,But the barbital only gave her a headache.
1504,"She begged for an aspirin when the train stopped, when the conductor was on the station..."
1505,when the coast was clear at last...
1506,"when you were allowed to enter Ratchett's compartment, unseen."
1507,You loved Daisy Armstrong.
1508,You killed Cassetti.
1509,Cassetti was a pig.
1510,He deserved to die.
1511,She didn't kill him.
1512,I did.
1513,"Mary, go."
1514,I can't let you take the blame...
1515,for what I did alone.
1516,"Mary, please, go."
1517,"John Armstrong was my best friend, my commander."
1518,He believed in me.
1519,"He sent me to medical school, gave me a future."
1520,Cassetti destroyed him.
1521,"In grief, I found Mary."
1522,Then I found Ratchett.
1523,"Our plan was to reveal him to the police, that's what you heard."
1524,But when I saw his face...
1525,I knew he didn't deserve a trial.
1526,"So, you drugged MacQueen."
1527,You changed the time on the watch...
1528,so that you could lie about the time of death.
1529,I couldn't let Mary be accused.
1530,Or MacQueen.
1531,"My sins are mine to pay for, alone."
1532,I'm a soldier.
1533,A soldier kills to protect.
1534,"And now, Mr. Poirot, I must protect myself from you."
1535,Why aren't you dead yet?
1536,Poirot?
1537,"Gentlemen, stop!"
1538,"Sir, we need to get all the passengers back on the train."
1539,You will retire...
1540,away from the train...
1541,until I tell you to return.
1542,You tell your lies...
1543,and you think no one will know.
1544,But there are two people who will know.
1545,"Yes, two people."
1546,Your God...
1547,and Hercule Poirot.
1548,It is time to solve this case.
1549,Dr. Arbuthnot asked me why I was not yet dead.
1550,"He knew, of course, the answer."
1551,A sharpshooter who does not kill at close range?
1552,Your shot was not a mistake.
1553,It was a surgery.
1554,You could not kill me because you are no killer.
1555,None of you are killers.
1556,"And yet, someone must be."
1557,There are two possible solutions to this crime.
1558,"One difficult, because it fits with most but not all of the facts..."
1559,and one more...
1560,complex.
1561,The first solution.
1562,Ratchett had enemies.
1563,A rogue Mafioso steals onto the train at Vinkovci...
1564,as MacQueen and Arbuthnot take the air.
1565,"Equipped with a uniform and a passkey, he stabs Ratchett."
1566,"He leaves through Mrs. Hubbard's compartment, and makes his escape."
1567,No.
1568,"No, no, no. It doesn't work."
1569,"Why hide the uniform, hmm?"
1570,Who drugs Ratchett?
1571,Or stabs Mrs. Hubbard?
1572,"Damn it, man!"
1573,"So I ask, who stands to benefit?"
1574,This crime is the murdering of a murderer.
1575,"The benefit is, perhaps..."
1576,"to the spirit, an ease of suffering."
1577,To quiet a shouting voice in the head that prevents sleep.
1578,There is a murderer among us.
1579,So...
1580,"We have Dr. Arbuthnot, a dedicated, grateful friend to Colonel Armstrong."
1581,"He meets and finds solace in the company of the governess, Mary Debenham..."
1582,who is almost like a mother to the little girl.
1583,"And so close to Mrs. Armstrong's young sister, Helena Goldenberg..."
1584,married to a powerful man no stranger to rage and violence.
1585,We travel also with Daisy's godmother...
1586,to whom belongs...
1587,the monogrammed handkerchief found at the scene of the crime.
1588,"The letter ""H"" in the Russian alphabet, of course, pronounced ""N."" Natalia Dragomiroff."
1589,And her devoted maid with a chef's eye?
1590,Who was she before her current employ?
1591,Might I suggest the Armstrongs' cook?
1592,But we are not yet done.
1593,The nurse in charge of Daisy...
1594,her newfound religious zeal born of guilt at allowing her charge...
1595,to be abducted.
1596,"It was you, was it not..."
1597,in her room the night when Ratchett came in through the window?
1598,Did you have a glass of wine too many with your supper that night?
1599,Have you blamed yourself ever since...
1600,for not being alert to stop him?
1601,She knew nothing but kindness...
1602,"and love, until..."
1603,until I...
1604,"No need to divine with me, sir."
1605,I was Colonel Armstrong's batman in the war.
1606,"And afterwards, his valet in New York."
1607,As fine a man as God ever made.
1608,Would his chauffeur agree?
1609,"Was it a bank loan, secured by Armstrong, allows him to build his automobile empire?"
1610,He's indebted for life.
1611,Who else can we count?
1612,"What of the Pinkerton detective, once a police officer..."
1613,assigned to the Armstrong case?
1614,"And he becomes attached to someone, for there is another, uncelebrated victim."
1615,You fell in love with the maid before she was falsely accused.
1616,You quit the police when you witnessed...
1617,the travesty ofjustice...
1618,when MacQueen's father insisted on her arrest.
1619,When she took her own life.
1620,"No! No, no!"
1621,Susanne was so gentle.
1622,And she fell for me.
1623,Old and already getting grey.
1624,I told her she could do better...
1625,but there she was...
1626,on time for every date.
1627,Why else is a train...
1628,so full in the dead of winter?
1629,Why the inconsistent wounds?
1630,Why the abundance of evidence? Why...?
1631,Why the conductor?
1632,Pierre Michel of Avignon...
1633,who lost his sister...
1634,the accused maid...
1635,Susanne Michel.
1636,Only one soul can claim to have lost more than any of you.
1637,The tragic Linda Arden...
1638,mother of Sonia...
1639,grandmother of Daisy.
1640,Retired from the stage...
1641,but for one final performance.
1642,You're an awfully clever man.
1643,A murder should have one victim.
1644,When Ratchett kills Daisy Armstrong...
1645,"a dozen lives are broken, deformed, ended."
1646,They demand justice!
1647,"Of all these wounded souls, we must finally answer..."
1648,who among them is a killer?
1649,Who takes up the knife?
1650,The answer is...
1651,No single one of you could have done it.
1652,Nor any pair.
1653,It can only have been done...
1654,by all of you.
1655,Together.
1656,Together.
1657,Even when the avalanche changes everything...
1658,"as does the detective, plans must change."
1659,"The kimono, the uniform."
1660,"A remarkable improvisation, the doctor who knows how to wound without killing."
1661,Each has their part to play.
1662,Do it.
1663,It was my plan.
1664,I recruited them.
1665,I had Hardman track down Cassetti.
1666,"I sent MacQueen to work for him, and then Masterman."
1667,MacQueen could arrange he travel on the day that Michel was on duty.
1668,Mr. Ratchett?
1669,It's nothing.
1670,"Bien, monsieur."
1671,Good night.
1672,And so it is done.
1673,For the death of the innocent.
1674,A life for a life.
1675,Revenge.
1676,No one should hang for this but me.
1677,It was my plan!
1678,"Tell the police it was me, alone."
1679,There's no life left in me anymore.
1680,They have a chance now.
1681,"Helena, I pray..."
1682,has a chance.
1683,They can...
1684,go live...
1685,find some joy...
1686,somewhere.
1687,Let it end with me.
1688,They're not killers.
1689,They're good people.
1690,They can be good again.
1691,"There was right, there was wrong."
1692,Now there is you.
1693,I cannot judge this.
1694,You must decide.
1695,You wish to go free without punishment for your crime...
1696,then you must only commit one more.
1697,I will not stop you.
1698,You can't let them kill you.
1699,"You give my body to the lake, and you walk away innocent at the station."
1700,You must silence me.
1701,Bouc can lie.
1702,I cannot.
1703,Do it! One of you!
1704,Don't.
1705,I already died with Daisy.
1706,No!
1707,You said your role was to find justice.
1708,What is justice here?
1709,"Sometimes, the law of man is not enough."
1710,Where does conscience lie?
1711,Buried with Daisy.
1712,My dear Colonel Armstrong.
1713,"Finally, I can answer your letter..."
1714,at least with the thoughts in my head and the feeling in my heart...
1715,"that somewhere, you can hear me."
1716,"I have now discovered the truth of the case, and it is..."
1717,profoundly disturbing.
1718,I have seen the fracture of the human soul.
1719,"So many broken lives, so much pain and anger..."
1720,giving way to the poison of deep grief...
1721,until one crime became many.
1722,I have always wanted to believe that man is rational and civilized.
1723,My very existence depends upon this hope...
1724,upon order and method and the little gray cells.
1725,"But now, perhaps, I am asked..."
1726,"to listen, instead..."
1727,to my heart.
1728,Ladies and gentlemen...
1729,I have understood in this case that the scales of justice...
1730,cannot always be evenly weighed.
1731,"And I must learn, for once..."
1732,to live with the imbalance.
1733,There are no killers here.
1734,Only people who deserve a chance to heal.
1735,The police have accepted my first solution to the crime...
1736,the lone assassin who made his escape.
1737,I will leave the train here to conclude formalities.
1738,You are all free to go.
1739,And may you find your peace with this.
1740,May we all.
1741,Hello.
1742,I'm looking for a Mr. Poirot.
1743,He's needed on a very urgent matter.
1744,Ah. He is on holiday.
1745,"The, uh, Kassner case again?"
1746,"No, sir, far worse."
1747,I have to take him to Egypt straight away.
1748,"There's been a murder, sir, right on the bloody Nile."
1749,Are you the detective?
1750,Yes.
1751,I am the detective.
1752,Could you please straighten your tie?
1753,I will see you at the car.
1754,"Here you are, sir."
1755,Merci.
1756,Allonsy.
