,dialog
0,Shh.
1,♪♪ NARRATOR: Royal Tenenbaum bought the house on Archer Avenue in the winter of his 35th year.
2,"(instrumental ""Hey Jude"" plays) Over the next decade he and his wife had three children and then they separated."
3,Are you getting divorced?
4,"At the moment, no..."
5,but... it doesn't look good.
6,Do you still love us?
7,Of course I do.
8,Do you still love Mom?
9,"Yes, very much, but your mother's asked me to leave and I must respect her position on the matter."
10,Is it our fault?
11,No.
12,"Obviously, we made certain sacrifices as a result of having children, but, uh..."
13,"no, Lord, no."
14,Then why'd she ask you to leave?
15,I don't really know anymore.
16,"Maybe, uh, I wasn't as true to her as I could've been."
17,"Well, she said..."
18,"Let's just drop it shall we, uh, Chassie?"
19,NARRATOR: They were never legally divorced.
20,"Thank you, Pagoda."
21,NARRATOR: Etheline Tenenbaum kept the house and raised the children and their education was her highest priority.
22,"Yes, I'll hold, please."
23,Thank you.
24,I need $187.
25,Write yourself a check.
26,Bene. Si.
27,Grazie mille.
28,NARRATOR: She wrote a book on the subject.
29,"Chas, Chas!"
30,Richie!
31,"Uh, the gentleman in the blue cardigan, please."
32,Thank you. I have a twopart question.
33,Go ahead.
34,"NARRATOR: Chas Tenenbaum had, since elementary school taken most of his meals in his room standing up at his desk with a cup of coffee to save time."
35,"In the sixth grade, he went into business breeding Dalmatian mice which he sold to a pet shop in Little Tokyo."
36,He started buying real estate in his early teens and seemed to have an almost preternatural understanding of international finance.
37,He negotiated the purchase of his father's summer house on Eagle's Island.
38,"ROYAL: Hold it, Chassie."
39,Hold it right there.
40,What are you doing?
41,You're on my team.
42,There are no teams.
43,NARRATOR: The BB was still lodged between two knuckles in Chas's left hand.
44,Margot Tenenbaum was adopted at age two.
45,Her father had always noted this when introducing her.
46,This is my adopted daughter Margot Tenenbaum.
47,"NARRATOR: She was a playwright, and won a Braverman Grant of $50,000 in the ninth grade."
48,She and her brother Richie ran away from home one winter and camped out in the African wing of the public archives.
49,"Hi, Eli."
50,"You said I could run away, too."
51,"No, I didn't, and don't tell anyone you saw us."
52,NARRATOR: They shared a sleeping bag and survived on crackers and root beer.
53,Four years later Margot disappeared alone for two weeks and came back with half a finger missing.
54,Richie Tenenbaum had been a champion tennis player since the third grade.
55,"Do you copy, Anonymous?"
56,NARRATOR: He turned pro at 17 and won the U.S. Nationals three years in a row.
57,He kept a studio in the corner of the ballroom but had failed to develop as a painter.
58,Up... up...
59,right...
60,perfect.
61,Pagoda?
62,NARRATOR: On weekends Royal took him on outings around the city.
63,Put it out there.
64,NARRATOR: These invitations were never extended to anyone else.
65,"Richie's best friend, Eli Cash, lived with his aunt in the building across the street."
66,"He was a regular fixture at family gatherings holidays, mornings before school, and most afternoons."
67,The three Tenenbaum children performed Margot's first play on the night of her 11th birthday.
68,They had agreed to invite their father to the party.
69,"What'd you think, Dad?"
70,Mmm... didn't seem believable to me.
71,Why are you wearing pajamas?
72,Do you live here?
73,He has permission to sleep over.
74,"Well, did you at least think the characters were welldeveloped?"
75,What characters?
76,"This is a bunch of little kids, uh dressed up in animal costumes."
77,"Good night, everyone."
78,"Well, sweetie..."
79,don't be mad at me.
80,That's just one man's opinion.
81,CHILDREN: ♪ Happy birthday to you ♪ ♪ Happy birthday to you... ♪ NARRATOR: He had not been invited to any of their parties since.
82,"In fact, virtually all memory of the brilliance of the young Tenenbaums had been erased by two decades of betrayal, failure, and disaster."
83,"Go, Mordecai."
84,"♪ Na, na, na ♪ ♪ Nananana ♪ ♪ Hey, Jude ♪ ♪ Na, na, na ♪ ♪ Nananana... ♪ I've been instructed to refuse any further charges on your room account and to direct you, in writing to please vacate the premises by the end of the month."
85,What about SingSang?
86,I owe her $100.
87,NARRATOR: Royal had lived in the Lindbergh Palace Hotel for 22 years.
88,Can you pay her in cash?
89,Uhuh.
90,NARRATOR: He was a prominent litigator until the mid '80s when he was disbarred and briefly imprisoned.
91,No one in his family had spoken to him in three years.
92,"Read it back to me so far, Pietro."
93,New paragraph.
94,NARRATOR: Richie had retired from professional tennis at 26.
95,His last match had been widely discussed in the media.
96,"(tennis ball hits racquet, bounces on court) ""Your friend Richie."" End of letter."
97,"NARRATOR: For the past year, he had been traveling alone on an ocean liner called the Cote d'lvoire and had seen both poles, five oceans the Amazon and the Nile."
98,"""The crickets and the rust beetles scuttled ""among the nettles of the sage thicket."
99,"""'Vamanos, amigos,' he whispered ""and threw the bustedleather flint craw ""over the loose weave of the saddle cock and they rode on in the friscalating dusk light."" NARRATOR: Eli was an assistant professor of English literature at Brooks College."
100,The recent publication of his second novel...
101,"(horses galloping, gunfire, shouting) ...had earned him a sudden, unexpected literary celebrity."
102,"Well, everyone knows Custer died at Little Bighorn."
103,What this book presupposes is...
104,maybe he didn't.
105,Let me ask you something.
106,Why would a review make the point of saying someone's not a genius?
107,You think I'm especially not a genius?
108,I know w...
109,"You didn't even have to think about it, did you?"
110,"Well, I just don't use that word lightly."
111,"I have to go, Eli."
112,MAN: Margot?
113,Uhhuh.
114,"May I come in, please?"
115,"How are you, my darling?"
116,NARRATOR: Margo was married to the writer and neurologist Raleigh St. Clair.
117,"I'm fine, thank you."
118,You need to eat something.
119,May I make you dinner?
120,"No, thank you."
121,NARRATOR: She was known for her extreme secrecy.
122,"For example, none of the Tenenbaums knew she was a smoker, which she had been since the age of 12."
123,Nor were they aware of her first marriage and divorce to a recording artist in Jamaica.
124,"She kept a private studio in Mockingbird Heights under the name ""Helen Scott."" She had not completed a play in seven years."
125,of Dudley Heinsbergen.
126,"All right, Dudley make yours like mine."
127,"NARRATOR: Raleigh's next book was on the subject of a condition he called ""Heinsbergen Syndrome."" Where's that red one going to go?"
128,Done.
129,Good.
130,Very good.
131,My goodness.
132,How interesting. How bizarre.
133,"Dudley suffers from a rare disorder combining symptoms of amnesia, dyslexia and color blindness."
134,He has a highly acute sense of hearing.
135,There is also evidence of...
136,"I'm not color blind, am I?"
137,I'm afraid you are.
138,"Ari, fire alarm! Let's go!"
139,Out you go!
140,Let's go!
141,"Uzi, emergency! Let's go!"
142,Uzi... what did I just say?!
143,Look alive!
144,Fire!
145,NARRATOR: Chas's wife Rachael was killed in a plane crash the previous summer.
146,What about Buckley?
147,It's too late. You forgot him.
148,Buckley! Buckley!
149,No elevator! There's a fire.
150,"Go, go!"
151,"Go, go, go, go, go!"
152,"Go, go, go, go, go!"
153,"NARRATOR: Chas and their two sons, Ari and Uzi were also on the flight and survived as did their dog who was discovered in his cage several thousand yards from the crash site."
154,"Four minutes, 48 seconds."
155,"We're all dead, burnt to a crisp."
156,NARRATOR: Over the last six months he had become increasingly concerned with their safety.
157,We left Buckley.
158,It doesn't matter.
159,NARRATOR: Etheline became an archaeologist and had overseen excavations for the Department of Housing and the Transit Authority.
160,Apropos of my question regarding I40 slash I9 adjustments...
161,um...
162,"NARRATOR: She taught a bridge class twice a week with her friend and business manager, Henry Sherman."
163,It would probably be advantageous for your marital status to be legally established as single in light of the circumstances.
164,What do you mean?
165,I mean for tax purposes.
166,But I thought...
167, Etheline...
168, Yes?
169,Will you marry me?
170,I...
171,"I love you, uh..."
172,Did you already know that?
173,"No, I didn't."
174,Since her separation from her husband she had had many suitors...
175,...but had not considered a single one until this moment.
176,"This isn't really a tax issue, is it?"
177,"That's true, uh..."
178,I don't know why I put it that way.
179,"Let me think about it, Henry."
180,Hello. Please tell Mr. Royal this is the Pagoda.
181,Lobby.
182,"Thank you, Dusty."
183,You're welcome.
184,"Good morning, Jerry."
185,Hmm...
186,"Oh, there's a call for you, Mr. Tenenbaum."
187,"Who is it, Frederick?"
188,A Mr. Pagoda.
189,What do you got?
190,The black man asked her to be his wife.
191,No shit?
192,What did Ethel say?
193,She think about it.
194,"I don't like the sound of this one damn bit, Pagoda."
195,I mean... Lord knows I've had my share of infidelities but she's still my wife.
196,"And no damn twobit, chartered accountant is going to change that."
197,Hi.
198,"Hey, Pagoda, give us a hand, huh?"
199,Chas?
200,What's going on?
201,We got locked out of our apartment.
202,Did you call a locksmith?
203,Uhhuh.
204,"Well, I don't understand."
205,Did you pack your bags before you got locked out or how did you?
206,It's not safe over there.
207,Excuse me for a moment.
208,What are you talking about?
209,The apartment.
210,I have to get some new sprinklers and a backup security system installed.
211,"But there are no sprinklers here, either."
212,"Well, we might have to do something about that, too."
213,Okay.
214,"Isn't this fun, huh?"
215,Isn't this great?
216,Feels like we're camping.
217,When are we going home?
218,Huh?
219,"Hey, look at this."
220,"Pretty cool, huh?"
221,♪ Who am I supposed to be? ♪ Who put that in here?
222,♪... Look at me ♪ ♪ What am I supposed to be? ♪ Okay.
223,"Well, I will see you boys in the morning."
224, Good night.
225, Good night.
226,Good night.
227,♪ Look at me ♪ You know what?
228,I think I'm going to sleep in here with you.
229,That way...
230,...we can all be together.
231,"♪ Oh, my love ♪ ♪ Oh. ♪ What kind of side effects can be expected?"
232,"Well, there are a number of possibilities."
233,Severe nausea and dizziness are standard.
234,A certain percentage of patients may also experience seizure.
235,"You mean, like flopping around on the floor and everything?"
236,In some cases.
237,"You have a visitor, my darling."
238,MARGOT: Who is it?
239,"It's me, sweetie."
240,"Raleigh says you've been spending six hours a day locked in here, watching television and soaking in the tub."
241,I doubt that.
242,"I don't think that's very healthy, do you?"
243,Nor do I think it's very intelligent to keep an electrical gadget on the edge of the bathtub.
244,I tie it to the radiator.
245,"Well, it can't be very good for your eyes, anyway."
246,Chas came home.
247,What do you mean?
248,He and Ari and Uzi are going to stay with me for a little while.
249,Why are they allowed to do that?
250,I don't know exactly but I think he's been very depressed.
251,So am I.
252,"So are you, what?"
253,But why is this necessary?
254,"'Cause I'm in a rut, and I need a change."
255,Hang on.
256,"(Vince Guaraldi Trio's ""Christmas Time is Here"" playing) ETHELINE: Taxi!"
257,That cab has a dent in it.
258,"You don't love me anymore, do you?"
259,"I do, kind of."
260,I can't explain it right now.
261,"Another dent here, and another dent here."
262,"I'll call you, okay?"
263,♪ ♪ Hello.
264,Hello?
265,"Hello, beautiful."
266,Got a minute?
267,What are you doing here?
268,"Uh, I need a favor."
269,I want to spend some time with you and the children.
270,Are you crazy?
271,"Well, wait a minute, damn it!"
272,Stop following me.
273,"Well, I want my family back."
274,"Well, you can't have it."
275,"I'm sorry for you, but it's too late."
276,"Well, listen..."
277,"Baby, I'm dying."
278,"Yeah, I'mI'm sick as a dog."
279,I'll be dead in six weeks.
280,I'm dying.
281,What are you talking about?
282,What's happening?
283,"Oh, I'm sorry."
284,I didn't know.
285,": Well, what'd they say?"
286,What is the prognosis?
287,"Take it easy, Ethel."
288,"Now, holdhold on, baby, hold on."
289,"Hold on, okay?"
290,"Ethel, hold on, hold on."
291,Where is the doctor?
292,"Don't... Well, just..."
293,WWait a second now.
294,Wait a second.
295,"Okay, uh, listen, I'm not dying..."
296,but I need some time.
297,"A month or so, okay?"
298,I want us...
299,I want us toto...
300,What's wrong with you?!
301,Damn!
302,Ethel.
303,Are you crazy?!
304,"Ethel, baby..."
305,I am dying.
306,Are you or aren't you?
307,What? Dying?
308,Yeah.
309,Have you told your children?
310,More or less.
311,And are they all right?
312,It's hard to say.
313,Who's your father?
314,His name is Royal Tenenbaum.
315,You told us he was already dead.
316,"Yeah, well, now he's really dying."
317, Ready.
318, Print it.
319,"I am very sorry, Margo."
320,That's okay.
321,"We're not actually related, anyway."
322,True.
323,"I'd like to send a response, please."
324,"MAN: Yes, sir, go ahead."
325,Dear Mom: I received your message.
326,I'm coming home as soon as possible.
327,Who do I see about that?
328,NARRATOR: The ship's porter arranged for Richie to disembark at Halifax and transfer to a thirdclass state room on board the Queen Helena destined for the Eastern seaboard.
329,His trunks would not arrive for another 11 days.
330,"Hey, Baumer."
331,Do you mind if we get a picture with you?
332,Not at all.
333,NARRATOR: He had made a request for his usual escort the one from his days on the circuit to meet him at the pier by way of the Green Line bus.
334,Hi.
335,"NARRATOR: As always, she was late."
336,"♪ I've been out walking ♪ ♪ I don't do too much talking these days ♪ ♪ These days ♪ ♪ These days I seem to think a lot ♪ ♪ About the things that I forgot to do... ♪ ♪ And other times, I... ♪ Stand up straight."
337,Let me get a look at you.
338,What's so funny?
339,"Well, it's nice to see you, too."
340,"NARRATOR: That night, Etheline found all of her children living together under the same roof for the first time in 17 years."
341,Where's your dad?
342,"NARRATOR: The next morning, Richie woke at dawn."
343,"He had decided birds should not be kept in cages fed Mordecai three sardines, and set him free."
344,"I've missed the hell out of you, my darlings."
345,"Well, you know that, though, don't you?"
346,I hear you're dying.
347,So they tell me.
348,I'm sorry.
349,"Well, I've had a good run."
350,"You don't look so sick, Dad."
351,Thank you.
352,What have you got?
353,I've got a pretty bad case of cancer.
354,: How long you going to last?
355,Not long.
356,"A month, a year?"
357,About six weeks.
358,Let me get to the point.
359,The three of you and your mother are all I've got and I love you more than anything.
360,CHAS: Hoho!
361, Hoho.
362," Chas, let me finish here."
363,"Now, I've got six weeks to set things right with you and I aim to do it."
364,Will you give me a chance?
365,No.
366,You speak for everyone?
367,I speak for myself.
368,"Well, you've made your views known."
369,Let somebody else do some of the talking now.
370,What do you propose to do?
371,"I can't say, really."
372,"Um, make up for lost time, I suppose."
373,"First thing I want to do is take you out to see your grandmother, at some point."
374,I haven't been out there since I was six.
375,I haven't been out there at all.
376,I was never invited.
377,"Well, she wasn't your real grandmother and I never knew how much interest you had, uh, sweetie."
378,"Anyway, you're invited now."
379,Thanks.
380,"RICHIE: You know, Rachael's buried out there, too."
381,Who?
382,My wife.
383,"Oh, that's right, isn't it?"
384,"Well, we'll have to swing by her grave, too."
385,"Uh, I'll be right back."
386,Chas.
387,Can I see my grandsons?
388,Why?
389,Because I finally want to meet them.
390,Don't give me that guff.
391,I think we'll pass.
392,Pagoda...
393,where's my Havelina?
394,"I'll say goodnight to you now, children."
395,Dad.
396,"Thank you, my sweet boy."
397,I'll contact you in the next 12 hours with further instructions.
398,Look at that old grizzly bear.
399,"Hello, Ethel."
400,"Good evening, sir."
401,"Hold the cab, will you, driver?"
402,"Royal, this is Henry Sherman."
403,"Hey, lay it on me, man."
404,How do you do?
405,Not too well. I'm dying.
406,(upbeat music playing on radio) How's Richie?
407,I don't know.
408,I can't tell.
409,"Yeah, me neither."
410,He wrote me a letter.
411,He says he's in love with you.
412,What are you talking about?
413,That's what he said.
414,I don't know how we're supposed to take it.
415,Hang on.
416,(male vocalist singing on radio) MAN: Hello.
417,"Sugar, it's Eli."
418,"Hey, baby, give me a second."
419,"What are we doing, Eli?"
420,"Oh, I just got to pick something up."
421,"Don't repeat that, by the way."
422,About Richie.
423,"It was told to me in confidence, and, you know..."
424,Good.
425,Now just remove the loose soil and note the decomposition levels.
426,I'm sorry to interrupt your work.
427,Don't be silly.
428,Come on.
429,I just want to apologize for the other day when I proposed to you.
430,Why?
431,I thought it was very sweet.
432,I know I'm not as accomplished as some of the men you've been involved with.
433,"Uh, Franklin Benedict, General Cartwright, and your exhusband."
434,"Oh, that's ridiculous."
435,"But, but, I feel..."
436,I can offer just as much as them.
437,"I know I went about it backwards, but..."
438,"Henry, I have no interest in Franklin Benedict or Doug Cartwright  I never did  and as far as Royal's concerned, he's the most..."
439,Henry?
440,"Henry, are you all right?"
441,"Yeah, I'm fine."
442,I'm fine.
443,"Anyway, let me know when you make up your mind."
444,"Henry, wait a second."
445,"I'm sorry, I'm very nervous."
446,ThThat's okay.
447,"Oh, thank you."
448,Why are you so nervous?
449,"Well, to tell you the truth I haven't slept with a man in 18 years."
450,"♪ Dahdahdum ♪ ♪ Dahdah, dahdah, dah, dahdum ♪ ♪ Dahdah, dahdahdah ♪    ♪ Dahdah, dahdah, dah... ♪ ♪ Ladahdahdahdah, dahdah... ♪ ♪ Lahdahdahdahdah, dahdah... ♪ ♪ Dahdah, dahdahdahdah... ♪ ♪ Dah, dahdahdah, dah, dee... ♪ ♪ Dah, dahdahdahdah, dahdahdah... ♪ ♪ Dahdah, dahdah... ♪ That's a hell of an old hound dog you got there."
451,What's he go by?
452,Buckley.
453,"Buckley, sit."
454,You know who I am?
455,I'm Royal.
456,Have you heard of me?
457,I'm very sorry for your loss.
458,Your mother was a terribly attractive woman.
459,Thank you.
460,Which one are you?
461,Ari.
462,"Uzi, I'm your granddad."
463,Hello.
464,I'm sorry we haven't gotten to know each other.
465,I don't get invited around very much.
466,"What do you think of that, by the way?"
467,"Oh, you..."
468,you don't have to say anything.
469,"It's kind of a ""fuck you"" to the old man, I guess."
470,How's your daddy?
471,Fine.
472,"You think so, huh?"
473,How often has he got you working out?
474,Do me a favor.
475,Tell him you want to meet me.
476,But we just met.
477,"No, we didn't."
478,"Look, I'd like us to have a relationship but we have to pull some strings to make it happen."
479,"Now, here's what you tell him."
480,You say...
481,"ARI: Well, I bet Mom would have wanted us to meet him before he died."
482,Wouldn't she?
483,Don't you think?
484,"She was a tough old broad, wasn't she?"
485,I wouldn't know.
486,Excuse me.
487,Come on.
488,"Oh, that's right."
489,"We've got another body buried here, haven't we?"
490,"Uh, hold on."
491,Take some of these.
492,Come on.
493,"So what do you think of this big, old black buck moving in up there?"
494,Who?
495,Henry Sherman.
496,You know him?
497,Yeah.
498,Is he worth a damn?
499,I believe so.
500,What happened to your finger?
501,"Uzi, shh."
502,"It's okay, I'll tell you."
503,I'm adopted. Did you know that?
504,"Well, I am."
505,"When I was 14, I went to find my real family."
506,They live in Indiana.
507,"All right, now, just set one of them hickory trunks right up top there, sister Maggie."
508,Did you try to sew it back on?
509,Wasn't worth it.
510,Hell of a damn grave.
511,Wish it were mine.
512,"It's a shame, isn't it?"
513,What?
514,"Well, you probably had another good two or three years of competitive play in you."
515,Probably.
516,"I had a lot riding on that match, you know."
517,Financially and personally.
518,"Why did you choke out there that day, Baumer?"
519,TENNIS ANNOUNCER: Mr. Gandhi leads 4015.
520,COMMENTATOR: That's 72 unforced errors for Richie Tenenbaum.
521,He's playing the worst tennis of his life.
522,"What's he feeling right now, Tex Hayward?"
523,"HAYWARD: I don't know, Jim."
524,There's obviously something wrong with him.
525,"He's taken off his shoes and one of his socks and... actually, I think he's crying."
526,COMMENTATOR: I think you're right.
527,"Who's he looking at in the friends' box, Tex?"
528,"HAYWARD: That's his sister, Margot and her new husband, Raleigh St. Clair."
529,"They were just married yesterday, Jim."
530,"COMMENTATOR: Oh, yes."
531,COMMENTATOR: I've never seen anything like this.
532,HAYWARD: Neither have I.
533,Strange day out here at Windswept Fields.
534,"I kind of disappeared after that, didn't I?"
535,Yeah.
536,But I understood.
537,I know you're not very good with disappointment.
538,"You still got that little BB in your hand, Chassie?"
539,Why did you shoot me?
540,"It was the object of the game, wasn't it?"
541,No.
542,We were on the same team.
543,Were we?
544,Well... you sued me.
545,Twice. Got me disbarred.
546,"I don't hold it against you, do I?"
547,And how is it possible for Mr. Tenenbaum to withdraw these funds without your written authorization?
548,"Objection, Your Honor."
549,"Damn it, I..."
550,"Why don't you leave the objections to me, Royal?"
551,Because I started the corporation when I was a minor.
552,"So, my father was the primary signatory on most of my accounts."
553,He also stole bonds out of my safety deposit box when I was 14.
554,You think you could start forgiving me?
555,Why should I?
556,Because you're hurting me.
557,Come on.
558,Were you in prison?
559,Kind of.
560,Minimum security.
561,I got jacked by the IRS.
562,Should we split?
563,"Yes, sir."
564,"No, call me Mr. Tenenbaum."
565,Okay.
566,"No, I'm kidding; call me Pappy."
567,Okay.
568,"Come on, let's shag ass."
569,"Well, just let me know if you need somebody to talk to, okay?"
570,I like Raleigh very much.
571,"I know he's a lot older than you are and you two are having some problems but... anyway, maybe I can help."
572,Okay. Thanks.
573,"Hey, Baumer! All right!"
574,All right! Ha!
575,"Oh, shit! Oh, Jesus."
576,"By the way, I heard about that letter you sent to Eli."
577,You dropped some cigarettes.
578,Those aren't mine.
579,They just fell out of your pocket.
580,"Oh, my Lord, look at you."
581,Come in.
582,Did you tell Margot about that letter I wrote to you?
583,Why? Did she mention it?
584,"Yes, I did."
585,"Why would she have repeated that, I wonder?"
586,"Well, I would ask you the same question."
587,Rightly so.
588,What'd you say?
589,Hmm?
590,What?
591,I didn't say anything.
592,When? Right now?
593,I'm sorry; don't listen to me.
594,I'm on mescaline.
595,I've been spaced out all day.
596,Did you say you're on mescaline?
597,"I did, indeed."
598,Very much so.
599,"How often do you, uh?"
600,"I'm worried about you, Richie."
601,Why?
602,"Well, actually, Margot is, for some reason."
603,But I did find it odd when you said you were in love with her.
604,"She's married, you know."
605,Yeah.
606,And she's your sister.
607,Adopted.
608,Where are my encyclopedias?
609,They've been placed in storage.
610,"Well, damn you."
611,You're taking my encyclopedias.
612, Ththis is humiliating.
613, I'm sorry.
614,Would you like to make a complaint in writing?
615,Where am I supposed to go?
616,You're turning me into a damn hobo.
617,I'd be happy to make a reservation for you  at another hotel.
618, You son of a bitch.
619,Frederick.
620,"Hello there, Dusty."
621,Hello.
622,Could you spot me a quarter?
623,Of course.
624,Richie? Hi.
625,It's your dad.
626,I think he's very lonely...
627,Ionelier than he lets on maybe lonelier than he even realizes.
628,Have you spoken to him about this?
629,"Briefly, and he agreed that we..."
630,"I'm sorry, maybe I'm a little confused here."
631,What are you suggesting?
632,That he come here and stay in my room.
633,Are you out of your mind?
634,"No, I'm not."
635,"Anyway, I think that he'd be much more comfortable here than he would..."
636,Who gives a shit?
637,I do.
638,You poor sucker.
639,"You poor, washedup papa's boy."
640,"SHERMAN: All right, let's not get out of hand."
641,"Please, don't get in the middle of this, Mr. Sherman."
642,This is a family matter.
643,Don't talk to him like that.
644, Call me Henry.
645, I prefer Mr. Sherman.
646,Call him Henry.
647,Why? I don't know him that well.
648,You've known him for ten years.
649,"As your accountant, Mr. Sherman, yes."
650,Where are you going to sleep?
651,I'm just going to camp out upstairs.
652,We brought our sleeping bag...
653,Uzi!
654,"ARI: We don't mind, Dad."
655,We like him.
656,"UZl: Who, Pappy?"
657,"""Pappy""?"
658,He can sleep in the room above us.
659,"Ari, it's not your decision."
660,Nor is it yours.
661,"Well, he's already up there."
662,What?!
