,dialog
0,Subtitles by explosiveskull I got him.
1,"Please, let go!"
2,Please!
3,Please!
4,"Please, please, please, please don't do this."
5,Please!
6,No!
7,"Please, don't!"
8,"No, no, please ."
9,"No, no!"
10,"The gray wolf is a rare sight to see in the wild, their numbers are decreasing, but it is still one of the most elegant predators in the world."
11,"As a predator, the gray wolf is known for its unmatched ferocity."
12,"In seconds, the wolf can go from a calm state to a vicious beast, it won't rest until it's overcome its opponent."
13,"How you doin', bud?"
14, Like a million bucks.
15,Where's Mom and Reese?
16,"They went home a few hours ago, they wanted to be here when you woke up, but Mom had an appointment this morning."
17,"Morning, Kyle."
18,Glad to see you're awake.
19,"How's he doing, doc?"
20,"Well, let's find out."
21,Everything's as we expected.
22,So how long do I have to be in here?
23,"We still have to run a few tests, so we'll have to wait and see."
24,"I'm sorry, I wish I had better news to give you."
25," Yeah, me too."
26,I wanna get out of here for a while.
27,"Kyle, are you gonna be okay?"
28,"I'll be all right, tell everyone I was okay."
29,I'll walk you out.
30,I take it you got my message?
31,Yeah.
32,Your wife?
33,I thought it best that I knew what was going on before I told her.
34,All right.
35,"We've been able to make some progress, but it's still getting worse."
36,What are our options?
37, That's what I wanted to talk to you and your wife about.
38,Kyle is past the point of traditional treatments.
39,"There is, however, an experimental drug we can try."
40,So what's the catch?
41,Your insurance.
42,Insurance?
43,They're gonna cover this.
44,I'm sorry.
45,You're gonna tell me where you got this right now.
46,"Mom, don't worry about it."
47,What's going on?
48,Look at what I found in Reese's room.
49,"Reese, you tell me where you got this right now."
50,"I, I've been saving it up."
51,Don't lie to me.
52,"You stole it, didn't you?"
53,"No, Mom, I didn't steal it."
54,Then how did you get this much money?
55,"Don't look at your dad for help, just answer the question."
56,"Kate, I gave him the money, okay?"
57,What?
58,He said he needed it.
59,I gave it to him.
60,"You really don't take anything seriously, do you?"
61,"Oh, look, Kate."
62,"I'm sorry, Dad."
63,You can take the money back.
64,"No, that's okay, you're keeping that money."
65,Kate.
66,Kate.
67,"Look, I know I should've  told you about the money."
68,You shouldn't have gave it to him in the first place.
69,"Dean, what were you thinking?"
70,That our son deserves to have a little extra.
71,You know we never do.
72,I had a little extra cash.
73,"No, he wanted it, he didn't need it."
74,Do you have any idea what he's gonna spend that much money on?
75,No.
76,"Kyle is in the hospital, we can barely afford to put food on our table, and you just give away money like that?"
77,I had a little extra.
78,There is no such thing as extra for us right now.
79,You can't give away money that we don't have.
80,"If you do have extra money, that goes to stuff we need around here."
81,You're gonna take it all back.
82,Why are you being such a...
83,"What, a bitch?"
84,I didn't say that.
85,"Well, I am a bitch."
86,"And let me tell you something, I have to be a bitch to keep this family together."
87,"You think I wanted to raise my kids this way, having to fight and scrounge for every last dollar?"
88,"And in the face of it all we can be thrown out on the street, I find out my husband isn't supporting me or this family."
89,I'm doing the best I can to support us!
90,Clearly you're doing the best you can!
91,You know this is gonna crush him.
92,I know.
93,I didn't say he didn't deserve it.
94,We just cannot afford it right now.
95,We're still a couple hundred dollars short this month.
96,"If you give me that, you can get him whatever you want."
97,Reese.
98,I'm gonna have to hold on to that money.
99,Knew Mom would screw this up!
100,Reese!
101,Come out!
102,How's it goin' man?
103,So what you got for me?
104,So I have a helmet.
105,All right.
106,Let's check it out.
107,"Yeah, it's in good condition, I mean."
108,Yeah.
109,I'll give you 150 for it.
110,Really?
111,Yeah.
112,This is an authentic army helmet.
113,"Yeah, where'd you get it?"
114,It was my brother's.
115,"Okay, did he ever make it overseas?"
116,They all go overseas at some point.
117,"Yeah, did he make it back?"
118,I need $300 for the helmet.
119,"Yeah, uh, listen man, do you know of any army surplus stores around here?"
120,No.
121,"All right then, that makes the buyer's market, I'm the buyer, I'm saying you're only gettin' 150 for this."
122,"All right, Dean, Charlie's on vacation this week, so I want you to work the game tonight."
123,"Now they've got the entire service themselves, you know the rules, don't speak unless spoken to, and don't make eye contact."
124,You got it?
125,"You better, Dean."
126,"I shouldn't have to tell you this, but if you screw up out there, you're gone."
127,"So, I'm at the office today, fired us some prick."
128,He's not going down without a fight.
129,Nice.
130,"So did he scream, or just yell?"
131,"No, he was kinda weird about it."
132,"I called him into the office, break the news, and he's just standing there, not saying a damn thing, like a statue."
133,So what you do next?
134,"Well, the guy goes the leave and he turns to me and asks me how I sleep at night."
135,"I said, look, I'm runnin' a business here, I'm not a charity."
136,"I bet he didn't like that, did he?"
137,"No, , he didn't."
138,"So I said, look, you did a good job here, but the economy is not what it used to be."
139,"Then he has the nerve to talk to me about how much I'm makin', in my own damn  company."
140,"I give him a little bit of free advice, I said, look, nobody's gonna take care you but yourself, it don't matter if you're making a mil a year or six bucks an hour."
141,Gotta do what you gotta do to survive.
142,"Have a good night, Dean."
143,Price is 200.
144,I just sold this to you for 150 earlier today.
145,"Yeah, you sold it to me, you didn't pawn it, and that means that I say the price to get it back is 200."
146,"This is the last thing I have of my brother's, he died in Iraq, 2008."
147,It's touching.
148,Price is still 200.
149,Fine.
150,Keep it.
151,"Reese, Reese."
152,"   Yeah, Dad?"
153,"Hey, bud."
154,Got this back for ya.
155,But what about Mom?
156,Just don't let her catch you.
157,Okay.
158,Okay?
159,"You know she loves you, right?"
160,I know.
161,Okay.
162,Sleep tight.
163,Hey.
164,Got some money.
165,"Yeah, I'll just leave it over to my window."
166,Cool.
167,Where'd you get all this money?
168,Work.
169,How'd you get this much from work?
170,You really wanna fight about something else?
171,"No, I don't wanna fight at all, I just, I just wanna know what we're doing here."
172,Taking it day by day.
173,Like we always have.
174,"You can see where that's gotten us, Dean."
175,I don't want our kids to grow up in trailers for the rest of their lives.
176,"Look, I don't want our kids to grow up in trailers either, but I'm doing the best I can."
177,Are you?
178,Are you really doing the best you can?
179,Well what exactly is it that you've been doing?
180,What?
181,Do you think there's jobs out there that'll pay good money for a guy like me?
182,"I've looked, there's nothing there."
183,"Well, I'll just add up to the list of things that you can't do."
184,Just stop!
185,"Getting fired from your last job, working in a bar, washing out of the army."
186,   Shut the hell up!
187,I'm tired of you always starting the shit!
188,Fine!
189,"I went to the army and washed out, I couldn't even make it through basic boot camp."
190,I'm a loser!
191,I'm a piece of shit loser!
192,"That's what you wanted to hear, right?"
193,"Oh, oh Reese, oh God!"
194,Let me see.
195,"Oh, you're gonna need stitches, come here, come here, let's go."
196,Let's get your shoes.
197,Should go in here.
198,You can't leave.
199,Yeah.
200,Aw.
201,"   Check it out, bro."
202,"Woah, bet there was a lot of blood."
203,"Yeah, I did get 15 stitches."
204,"Didn't cry, did ya?"
205,Of course not.
206,"Hey, I have something for you."
207,What?
208,"Oh, thanks bro, where'd you get it?"
209,From one of the kids down the street.
210,I finally had enough money for it.
211,Where'd you get the money for it?
212,I have my tricks.
213,Dad?
214,Yeah.
215,Just don't tell him.
216,Okay.
217,"Hey, so where's Dad?"
218,"Well, he's back at the house."
219,Will he be coming tonight?
220,"Um, I don't think so."
221,I'm sorry that I hurt my foot.
222,"Hey, you know that we can't afford this kind of stuff?"
223,Hey!
224,"Hey, don't talk like that."
225,It's not your fault.
226,It's nobody's fault.
227,Just life sometimes and it does not mean that I don't love you or your dad.
228,It just means you need to try a little harder.
229,"Everything is gonna be okay, I promise."
230,"So, is that what the money was for?"
231,"If you want, I'll just give it right back."
232,No way!
233,Got any songs on it yet?
234,"No, not yet."
235,I think that we can download some for free on the Internet.
236,"Cool, what are we gonna download first?"
237,"I don't know, let's find out."
238,"Yeah, I'm seeing some old ones."
239,Nice.
240,"Old, hey, what do you mean, old?"
241,"Ah, oh, I mean the ones that were, you listened to."
242,"Thanks, yeah!  I'm just joking, Mom."
243,"Good morning, Dad."
244, Okay.
245," Hi, bud."
246,Good night.
247,Hey.
248,Hi.
249,I'm sorry about...
250,"No, look, me too."
251,"Kate, I have something I need to tell you."
252,"What is it, Dean?"
253,"Apparently the insurance for Kyle's medical bills are just, they're not gonna cover him anymore."
254,They're all gonna fall on us.
255,What do you mean?
256,We can't afford that.
257,They have to cover him!
258,"I'm not sure, but we're gonna figure this out."
259,"Look, I will do whatever it takes, we're not gonna let our son die."
260,I don't know what to do.
261,"Kate, look, Kate, look, I love you, I have always loved you, I'm not gonna let this tear our family apart."
262," Just have faith and believe, and we will get through this."
263,Okay?
264,"I love you, Kate."
265,"I love you, too."
266,"Been a long night, guys."
267,I'm all in.
268,"Well, I'm out."
269,"I'll call you on it, see what you got."
270,Dean.
271,You need to empty your pockets for me.
272,Get in the car.
273,No.
274,Wasn't a question.
275,Come with me.
276,He doesn't like to be kept waiting.
277,Drink?
278,I like to make my guests their drink personal.
279,So what's it gonna be?
280,You the guy that busted me at the bar?
281,Didn't take a bunch of rich pricks to notice you've taken a few hundred dollars are down in the .
282,"Name is Sam, by the way."
283,You're Dean.
284,How'd you know my name?
285,I know everything about you.
286,"Wasn't hard to figure out, really."
287,"Now Dean, don't make me ask again."
288,I'm good.
289,What's the best drink you've ever had in life?
290,"Really, I'm fine."
291,"Tell you what, give you something I know you've never had before."
292,It's called Louis XIII .
293," Bet you never even heard of this stuff before, haven't you?"
294,No.
295,Didn't think so (drink splashes in glass).
296,This glass here (glass thuds on table) probably cost more than you make in a month.
297,"This bottle alone, 75,013."
298,Damn good stuff.
299,"Wouldn't want to waste a drink from a $13,000 bottle, would you?"
300,"Tell me, Dean, why are you here?"
301,You tell me.
302,I think you know exactly why you're here.
303,"Well, at first I thought you brought me here to kill me."
304, Let's not get too far ahead of ourselves.
305,Have a couple of questions for you.
306,Why'd you do it?
307,I don't owe you anything.
308,"No, I think you do."
309,"Well if you have me so figured out, it should be easy."
310,"A sick kid in the hospital, another kid and a wife at home, in this economy."
311,Hear that.
312,This nation's been hurting.
313,Lord knows I had to cut back.
314,"I could sense it in you the first time I saw you, could see the desperation."
315,"See, I like a desperate man."
316,"Most men are predictable, but the desperate man, you never can tell how he's gonna act."
317,"Well, it's not like I have piles of money laying around like some people."
318,I have real life problems to deal with.
319,"There's nothing special about you or your problems, Dean."
320,"Well if there's nothing special about me, I guess I'll be on my way."
321,I brought in (glass thuds on table) for a reason.
322,Like to offer you a job.
323,What kind of a job?
324,More of an opportunity.
325,Sit back down.
326,"See, I belong to a select group of people, I've traveled all over the world, I've hunted some of the most exotic animals in existence."
327,"My offer to you is as follows, I'll take you into the wilderness for seven days, from the first sunrise to the last sunset, I will hunt you."
328,"You'll be permitted to defend yourself, but you won't receive any assistance."
329,"On the eighth day, I'll transfer one million dollars into the bank account of your choosing, whether you're alive or dead."
330, You're sick.
331,"What, it's not enough to have all of this money, you've got to play God?"
332,Is that it?
333,"I'm just a hunter, trying to hunt the ultimate game."
334,I'm not gonna stick around to listen to this sickening speech anymore.
335,Think about it .
336,I'm offering you enough money to change your life forever.
337,That's what I don't get about you people.
338,You get every opportunity in the world and you're just too stupid to take it.
339,"Go home, Dean, look at your kids, your wife, and know that no matter how hard you work, the best life that you're gonna be able to create for them is the same sad pathetic one you're living now."
340,You think about that.
341,I'll be seeing you soon!
342,Dean.
343,Take this card.
344,In case you change your mind.
345,The men outside will take you anywhere you wanna go.
346,He always gets what he wants.
347,Always.
348,Hey!
349,Hey!
350,Hey!
351,What the hell are you doing?
352,"Oh, what, like you didn't think I'd find out?"
353,"Kate, wait, look, I can fix this, you just have to give me some time."
354,"Dean, I don't care, I don't care where you've been all night and I don't care what you have to say."
355,I'm done!
356,"Kate, you can't do this to me, I can't lose you and the kids."
357,Please!
358,"Well, I can't keep being the only person who takes care of this family."
359,"Kate, give me a chance, I can make this right."
360,Please.
361,"Fine, but you better fix this, Dean, you better make it right, you better start taking care of this family, because if you don't, I will find someone who will ."
362,Kate.
363,What?
364,Should I get someone to interpret that for you?
365,"No, just one thing."
366,What is it?
367,I want cash.
368,Whatever works for you.
369,All right.
370,Welcome to the hunt .
371,What?
372,You thought I was gonna be alone?
373,"A thing you have to remember about this hunt, I can use any means necessary to kill you."
374,"A few minutes before sunup, Dean."
375,I suggest you start running.
376,"All right, boys, I got him."
377,He's heading east towards the river.
378,"Making this too easy on us, Dean!"
379,"Right, go."
380,"Go find him, right?"
381,"Go find him, go on!"
382, What the hell happened here?
383, Quiet!
384,Damn .
385,"Jason, come in."
386, This is Jason.
387,We heard a shot.
388,Did you get him?
389,"Negative, he's heading east, I'm going after him."
390, Copy that.
391,Found something you're gonna wanna check out first.
392,You think this is where they got in?
393,"Yeah, one probably came over to to that tree looking for food, and these grounds are empty."
394,The guards didn't stop him coming in?
395,"Its job to keep stuff from getting out, not from getting in."
396,What are we gonna do about it?
397,What you all so worried about?
398,This adds more fun to the game.
399,That's right.
400,Part of the hunt now.
401,All right.
402,Oh.
403,Damn.
404,Just missed him.
405,Couldn't gone too far.
406,Any sign of him?
407,"Nah, I looked all around, couldn't find any tracks."
408,You did?
409,Guess that means I've better check it out.
410,"What, you think I can't track?"
411,I know you can.
412,"Anyway, looks like we're getting close."
413,Got some food.
414,"Yeah, we shouldn't let that out."
415,"It's all right, I like 'em when they get a little food in 'em, makes 'em more fun to hunt."
416,"It's getting late, let's go and eat here."
417,"All right, I'm with Carl."
418,"So what are we doing tonight, steak or lobster?"
419,"We might've underestimated this one, Sam."
420,How so?
421,"We've been hunting this guy for two days, and he's still breathing."
422,"   Let me ask you something, besides this, what's the best animal to hunt?"
423,Best?
424,One should say most difficult.
425,"Land, it's a lion, not too long ago,  weren't difficult."
426,"Rhino, believe it or not."
427,"They're easy enough to track down, but once they start to charge, they don't stop until it's over."
428,"Elephant, same with the rhino, they're easy enough to track down, but that's one smart animal."
429,What's the one thing those animals have in common?
430,"Desperation, the most dangerous time to approach an animal is when they're down, that's when they're the most desperate."
431,"You asked me why I chose this man, he lives in desperation, combine that with his military training, you have one hell of a hunter."
432,"Ah, is anyone home?"
433,I need help.
434, Hello!
435,Hello?
436, Is anyone home?
437,I need help.
438,Hello?
439,Woo!
440,"Ah, let's go!"
441,"Come on, come on I got him!"
442,Come on!
443,Come on!
444,Come on!
445,Come on!
446,Hey!
447,Woo hoo!
448,I got him.
449,Please!
450, Hell yeah!
451, Let me go!
452, Please!
453, Nice shot!
454,"Don't, no!"
455,"Please, please!"
456,No!
457,No!
458,Okay!
459,Please!
460,Guys.
461,Why don't we just call somebody and have him taken out?
462,"We already have, they won't be here for a few days."
463,I'm not willing to wait that long.
464,"I'm saying no, it's going to be getting dark soon, we should eat first before we go out there."
465,"You two don't have the slightest clue of what's going on here, do you?"
466,"Dean has evidence, actual video evidence of what goes on out here."
467,So what?
468,He goes to the cops and the organization will take care of it.
469,"Oh, they'll take care of it."
470,Then they'll care of us.
471,"You know the rules, anything gets out, we're responsible."
472,So shut the hell up and get ready.
473,We're going now.
474,Stop!
475,Are you with them?
476,You gotta help me.
477,There's people in here trying to kill me.
478,Return to the hunting grounds.
479,Get back!
480,"Hunting party, come in ."
481,"Hunting party, over."
482,.
483,Think it's him?
484,Has to be.
485,"Think he tried to get through, they must've stopped him."
486,Right.
487,I think we should go back to the cabin.
488,We're huntin' through the night.
489,How the hell we're supposed to follow footprints at night?
490,"Guys, check this out."
491,Woo!
492,Woo!
493,"You find him, don't hesitate to shoot."
494,"Keep in mind, we need to bring him back alive."
495,Won't the guards get suspicious if we don't kill him?
496,"Oh, we're gonna kill him, all right, we gotta get those DVDs back first."
497,"Besides, they don't care, they're just here to keep the hunt going."
498,"All right , let's get this son of a bitch."
499,Help!
500,Son of a bitch!
501,♪ I am I'm gonna kill you!
502,God damn head off!
503,"♪ Every time you think you're gone ♪ Wake up ♪ Livin' Help, please."
504,I can get you out of this.
505,"♪ So wake up ♪ Wake up ♪ People ♪ Have a twisted frame ♪ Every time defeat their pride ♪ And wake up Come on, Dean."
506,See you in the hunt.
507,♪ Wake up ♪ Wake up Look.
508,Right by the guidance!
509,♪ You'll have ♪ Trying to beat them ♪ Swallow their pets ♪ Like never fed ♪ It's all in your head ♪ It's all in your head Luke.
510,Luke?
511,Luke?
512,Did you get him?
513,No.
514,Jesus Christ.
515,You all right?
516,What do you think?
517,We were ambushed.
518,Where's your gun?
519,Shit.
520,You guys gotta kill this son of a bitch.
521,Don't worry about that.
522,It's only a matter of time.
523,So how'd he do this to you?
524,"Don't know, (breathes heavily) followed the trail of blood, I thought he was wounded."
525,"Good night, we'll go after him in the morning."
526,I'll call someone to pick you up tonight.
527,Let's get Tyler to the car.
528,Come on.
529,Shit.
530,Damn it!
531,"Sam, I found something."
532,Think it's a trap?
533,"Oh, I know it is."
534,But we don't have a choice.
535,We could just leave him.
536,Thomas?
537,Just let him die out here like Luke?
538,"Dean's got him, he's probably dead anyway."
539,"Either way, we still have to find Dean."
540,What's the plan?
541,He's hiding in the area somewhere.
542,What kind of weapons does he have left?
543,Not sure.
544,A few knives and at least one rifle.
545,Probably a few grenades.
546,All right.
547,"I'm gonna go into the cave, you keep watch out here."
548,I've got it.
549,If you see anything at all.
550,I'm not gonna let him bury you in there.
551,Thomas.
552,"Sam, I'm over here."
553,Where is he?
554,Don't know.
555,"Dragged me here last night, I didn't see anything since."
556,Jason?
557,"A second, don't leave me here."
558,Don't leave me here .
559,Jason?
560,Jason?
561,"What, were you just gonna leave me down there?"
562,Jason's dead.
563,Jesus.
564,We've gotta go.
565,Can you move?
566,"Yeah, I think so."
567,"Ah, shit."
568,We've gotta move.
569,"Samuel, Samuel, don't leave me!"
570,"Samuel, Samuel ."
571,Who's the desperate one now?
572,"This is my verse now, Samuel!"
573,"Morning, Dean!"
574,"Don't know where you are, but I know you can hear this."
575,"Gotta say, Dean, I'm impressed by what you did yesterday."
576,"Knew this hunt was gonna be different, but I never could've imagined it was gonna be this exciting."
577,"In fact, thought I'd bring someone along to make it even better."
578,"Dean, who the hell is this?"
579,"You don't make a deal with the devil, Dean, and not expect him to collect what's due."
580,Say hello.
581,"Dean, they've got me and Reese."
582,I think you get the picture.
583,"Imma make this real easy on you, Dean."
584,You got 10 seconds.
585,Dean.
586,"One, two, three, four, five, six, seven, eight, nine, No!"
587,"Copy that, ."
588,"That's right, she's still alive."
589,"She'll stay that way, as long as I get what I want."
590,"Doing good, Dean."
591,Further than I ever thought you'd make it.
592,Where's my family?
593,"Like I said before, they're safe."
594,Whether or not they stay that way is entirely up to you.
595,"You have something I want, something you stole from me."
596,Where is it?
597,My family first .
598,You think you're in a position to be making demands?
599,"Okay, see what your wife has to say about this..."
600,"No wait, no wait."
601,"Please, I'll show you, just don't hurt her, please."
602,Where?
603,"It's in the mountains, I'll show you."
604,So we have an agreement then?
605,Yes!
606,"Swear to it, Dean."
607,"Yes, I swear on my life."
608,"I'll show you, just please don't hurt them."
609,"That wasn't so hard after all, was it?"
610,"Funny, isn't it?"
611,Only thing you love the most ends up hurting in the end.
612,"I'll take you to the DVDs, you'll let 'em go, right?"
613,Right.
614,And that's it.
615,That's it?
616,"Don't your remember, Dean?"
617,We had a contract.
618,"I have two, well, a day and a half left."
619,This has gone too far.
620,There is no too far.
621,"Shoulda paid attention, Dean."
622,There are no rules in the hunt.
623,You got me.
624,I'm dead already!
625,True enough.
626,I guess I'll just have to take my time.
627,"Admit it, Dean, you've been going there for a while."
628,Expect you to make it this long.
629,"See, I'm a man that like to play with fire."
630,But ultimately...
631,"No, please."
632,Just like having control.
633,"No, no ."
634,"No, no, no !"
635,"About that time, isn't it?"
636,Wouldn't want you to run off again.
637,"Well, let's go."
638,I can't.
639,"Fine, where is it?"
640,Up there on the ridge.
641,"All right, you stay here, you're with me."
642,Check it out.
643,"You can't hide from me now, Dean."
644,Find you wherever you go.
645,"You can't run forever, Dean!"
646,End of the line!
647,"Been fun, time to wrap this up."
648,Got a date with your wife and son later.
649,It's offset.
650,The jig's over.
651,You win!
652,Will master be joining us?
653,My wife and son.
654,Back at the house.
655,Would you like to count it?
656,"Yes, I do."
657,As you wish.
658,Bring some over your drinking.
659,Can I get you anything else?
660,"That'll be it, for now."
661,What are they doing with the mansion?
662,"They're selling it, it's in accordance with master's will."
663,For how much?
664,I'm not sure.
665,You go find that out.
666,And my wife and kids.
667,"   Dean, if you're reading this that means you've survived the hunt."
668,I'm glad you're still alive.
669,"Money is important, Dean, but it can't buy everything."
670,"It won't bring my son back to me, or change the fact that he died, alone and scared."
671,And it will never let me trust you again.
672,"You can tell yourself you did it for us, but that's a lie."
673,We both know you did it for yourself.
674,"Our family is gone, Dean, you sold us for a million dollars."
675,I hope it was worth it.
