,dialog
1355,"I don't think you're an asshole, Royal."
1356,I just think you're kind of a son of a bitch.
1357,"Well, I really appreciate that."
1358,"Could you let us in your backyard, ma'am?"
1359,We've got a couple boys back there.
1360,I think you may have broken an ankle.
1361,"Well, that's not terribly serious, is it?"
1362,Do you have an alternate?
1363,No.
1364,Ready?
1365,Are there priests on call?
1366,"Why don't you bring the car around, Anwar."
1367,"At which point, I apparently lost control of the vehicle smashed it into the house, and killed that poor dog."
1368,You're Eli Cash.
1369,"Yes indeed, I am."
1370,I love your work.
1371,"Oh, how sweet of you to say."
1372,DISPATCHER ...
1373,ROYAL: I think he's part mutt.
1374,What kind of papers do you have for him?
1375,"Spark Plug, sit, sit."
1376,Good boy.
1377,Put this on.
1378,"What's so funny, Dudley?"
1379,You look great.
1380,DUSTY: Can you see out of it?
1381,Not really.
1382,Uhhuh. Minor corneal damage.
1383,Page me if it spreads to the other eye.
1384,Who do I make it out to?
1385,Alex? Okay.
1386,"But these aren't structurebearing elements, Dad."
1387,It doesn't matter.
1388,It's still best to file another force majeure and recoup the deductible.
1389,(background radio communication) You boys come up here with me.
1390,But Buckley's still under there.
1391,"I know, but there's nothing we can do for him at the moment."
1392,: Come on.
1393,I got you a new dog for the boys.
1394,I just bought him.
1395,You did?
1396,"Sorry I let you down, Chas."
1397,All of you.
1398,I been trying to make it up to you.
1399,What's his name?
1400,Spark Plug.
1401,Thank you.
1402,You're welcome.
1403,"I've had a rough year, Dad."
1404,"I know you have, Chassie."
1405,Hey.
1406,"RICHIE: See, now he has more white feathers on his neck."
1407,I wonder what happened to him?
1408,I don't know.
1409,Sometimes if a person has a traumatic experience their hair turns white.
1410,"Well, I'm sure he'll get over it."
1411,This was one of my first hiding places.
1412,How old do you think those are?
1413,I'd say about ten years.
1414,Come here.
1415,(gentle melody plays on acoustic guitar) NARRATOR: Royal dug a hole for Buckley behind the garden shed and buried him in a canvas duffel bag.
1416,"All right, boys."
1417,Say a prayer.
1418,Dear Heavenly Father...
1419,I do.
1420,Etheline and Henry were married in judge's chambers.
1421,Margot's new play was produced at the Cavendish Theatre.
1422,"This is my adopted daughter, Elaine Levinson."
1423,It ran for just under two weeks and received mixed reviews.
1424,"Yes, can the boy tell time?"
1425,"Oh, my Lord, no."
1426,No. No.
1427,Raleigh and Dudley went on a lecture tour to 11 universities in the promotion of their new book.
1428,Eli checked himself into a rehabilitation hospital in North Dakota.
1429,"Oh, hey, this is my sponsor, Runs With Two Horses."
1430,Wind's blowing up a gale today.
1431,This is the grip that Rod Laver used.
1432,Are you familiar with Laver?
1433,Richie started a program teaching competitive tennis to eightto12 year olds at the 375th Street Y.
1434,Game. Change sides.
1435,"(hooting, hollering, and laughing) Royal had a heart attack at the age of 68."
1436,Chas rode with him in the ambulance and was the only witness to his father's death.
1437,"In his will, he stipulated that his funeral take place at dusk."
1438,Among the few possessions he left to his heirs was a set of Encyclopedia Britannica in storage at the Lindbergh Palace Hotel under the names Ari and Uzi Tenenbaum.
1439,No one spoke at the funeral and Father Petersen's leg had not yet mended...
1440,but it was agreed among them that Royal would have found the event to be most satisfactory.
1441,Fire!
