,dialog
0,I confess.
1,I confess to almighty God. To blessed Mary ever Virgin. To blessed Michael the archangel.
2,"To Blessed John the Baptist. To the Holy Apostles, Peter and Paul."
3,"And to all the Saints. I have sinned exceedingly, through thoughts, words, and deeds. Through my faults."
4,Through my faults. Through my most grievous faults.
5,"Therefore I beseech blessed Mary, evervirgin."
6,"Blessed Michael the archangel Blessed John the baptist And to the Holy Apostles, Peter and Paul and all the saints."
7,To pray for me to the Lord our God.
8,Amen.
9,Amen.
10,"In honor of the Father, the son and the holy spirit."
11,"Music And if it doesn't look proper for a person who is yellow or Chinese to be walking around the Murphy or Jones or Johnson or Bunch or Powell, I think it would be just as improper for a black person or the socalled Negro in this country as we're thought by the Honorable Elijah Muhammad to walk around with these names and therefore he teaches us that during slavery the same slave master who owned us put his last name on us to denote that we were his property. So when you see a Negro today who's named Johnson, if you go back in his history you'll find that he was once his grandfather or one of his forefathers was owned by a White man who was named Johnson. If his name was Bunch, his grandfather was owned..."
12,.. I get the point ...by a white man that was named Bunch.
13,Would you mind telling me what your father's last name was?
14,My father didn't know his last name.
15,My father got his last name from his grandfather and his grandfather got it from his grandfather who got it from the Slave Master The real names of our people were destroyed during slavery...
16,Radio shuts off Is that you Jamie?
17,"No son, it's me I brought you some new towels."
18,I'll be out in a second.
19,Shower turns off Jay! You are no longer a little boy.
20,Yes Daddy G.
21,And I'd appreciate it if you knock next time.
22,We are in the house of the lord.
23,We ought to have a level of decency Decency? That's ripe and rich coming from you...
24,How many bottles does that make for the night?
25,"Best get dressed, boy. The boys are here."
26,Door Knock What?
27,"Oh shit! Jesus, I'm sorry Big Brother, I shouldn't have even entered."
28,Jaime?
29,...I'm sorry.
30,...Jaime?
31,I'm so stupid.. stupid.. stupid JAIME!
32,What's the matter with you?
33,"Okay, this... this whole thing is new to me."
34,And you'll be fine.
35,If only I was half the leader you are.
36,Don't ever let me hear you call yourself stupid again.
37,Yes...
38,Yes.
39,clears throat The presentation tonight for the new candidates...
40,It's got my head all wrapped up.
41,And you'll be fine.
42,What is it?
43,...Nothing it's... it's...
44,"No, first it's nothing and then it turns into something."
45,What is it Jaime? You need to spit it out.
46,...He's terrifying Who?
47,You know...
48,You'll learn to love him.
49,Is there anything else?
50,I can't quite remember and I should because we've been studying this for so long.
51,How many Hail Mary's should I do around the rosary again?
52,"Like, I tried to pray tonight and... I forgot."
53,...and I didn't even know to ask Pete because you know he would have just looked at me.
54,Jaime.
55,because you know he would have just looked at me.
56,and think that I was crazy and laugh.
57,Jaime.
58,and think that I was crazy and laugh.
59,...and everybody's always laughing and I don't feel like myself anymore.
60,JAMIE!
61,...and everybody's always laughing and I don't feel like myself anymore.
62,"You're nervous, have a drink."
63,No.... I couldn't. I couldn't We are not supposed to indulge in the pleasures of the bottle.
64,Says who?
65,It's ungodly.
66,"Believe me you, he's not watching."
67,Drink it.
68,"Jamie, drink it."
69,Coughing Better?
70,No Another And you'll feel better Drink...
71,Now?
72,Much better.
73,Good.
74,As you were. I'll be downstairs in ten minutes.
75,I'm with your spirit I'm with your spirit Beeping Welcome to the House Invictus you may call me Daddy G.
76,I don't know where you come from.
77,I don't know what you've done.
78,But you're right where you need to be.
79,There's only one rule to surviving The House Invictus.
80,Get the bear. Don't let the bear get you.
81,Door shuts They're here.
82,How many?
83,Ten.
84,The newspaper?
85,Yes?
86,Anything interesting?
87,"No, a little government, politics..."
88,Things of that nature. Nothing that concerns any of you.
89,Good to meet all of you. My name is Jay. President of The House Invictus.
90,"To my right is Pete, Vice President and to my left is Jaime, Chair of Events."
91,... And That's Daddy G the old butler.
92,"Now, we are very happy to have you this evening."
93,Let's take a walk.
94,Now this house was built in 1619.
95,"Brickbybrick, young men just like yourself."
96,"Agile, able, strong with their bare hand."
97,It holds the power of history and it has a very peculiar sense of knowing everything about everyone who walks inside of it.
98,If you are selected you must continue this legacy of tradition.
99,"Tradition is important, but what's more important than tradition, is property."
100,This property sits on on an acreage of about a thousand.
101,We hope it's not too intimidating.
102,"In the summers we host golf and garden parties but the winters, obviously not much happens Follow me."
103,Now this next part of the house is my personal favorite.
104,It's where all the real magic happens.
105,"Please come in, gentlemen."
106,"Now you see our founding fathers created a unique organization of excellent and supremely talented black men like yourselves. If you would like to know more information about all ten of them, you can find it here in this manual. Pete?"
107,Jamie.
108,Please take one gentleman and pass it to the next.
109,"Now if you refer to the back of your books what you'll find is history and that's exactly what you all are here tonight to do. Create history for yourselves and your family by presumably joining this house. Now we would like to get to know every last one of you so Daddy G will serve tea in the main living room, followed by dinner. You will have time to freshen up and have a change of clothes. Are there any questions?"
110,When will we find out if we make it? Yeah we all really want to know.... We're dying to know. You'll find out by the end of the night. Are there any more questions?
111,Good....
112,Music Plays Chatter This is it fellas. Look at all this.... So this is how the other one percent is living.
113,Right. The good life!
114,"The Invictus life! ... Legend has it, those who walk these halls become someone. Which makes sense, why i'm here."
115,Damn!
116,"Man, I can't wait to be part of all this.... Let's go!"
117,To The Invictus...
118,To the Invictus!
119,Music Plays Those fucking athletes..
120,"Damn, they're everywhere."
121,They're like fucking roaches.
122,All over campus.
123,laughs Literally...
124,I bet you they got cameras in that bull watching us.
125,They probably do.
126,"laughs Damn, this is good."
127,I ain't never seen niggas so bougie before.
128,"For real, biscuits and crumpets and tea and shit.. They even get their own butler and everything... Shit, that ain't nothing but a house nigga."
129,"You're going to hell. Shit, you going straight with me."
130,"...Shut up nigga. I'm Barry by the way, ...Sophomore."
131,"Jamaal, Freshman... basketball player, advertising major."
132,"Theodore, Premed.. Biochem, Freshman."
133,I'm Tommy.
134,I'm on the....
135,Yeah yeah yeah yeah yeah..
136,We all know. The Baseball legend. Wat's up?
137,Yeah yeah yeah yeah yeah..
138,Kinesiology Major.
139,I'm a junior.
140,"Man, you're not gonna need that."
141,"You're going straight to the league. True, but you never know I may need something to fall back on."
142,Okay modest nigga.
143,You play any sports man?
144,"Yea, I play a little football Oh yeah?.. Yeah, safety but that was last year though."
145,"Yea, I play a little football For Smith?... Nah, small school out in Texas. You probably never even heard of it."
146,Texas?
147,Mhmmm...
148,You're a long way away from home.
149,I guess you could say so.
150,You're a long way away from home.
151,"So what, you transferred?"
152,"Yeah, transferred in the last year."
153,So... what happened with football? You get injured or something?
154,Nah. it's just... I stopped being the slave to the White Man.
155,Okay.
156,Evening gents!
157,I come bearing gifts.
158,Ten strings of pearls for ten extraordinarily wonderful young men.
159,Please wear these throughout the evening.
160,I'm with your spirit....
161,What the fuck just happened?
162,Feel like I just got molested or some shit man.
163,Well you know what they say: Can't make it through life without sucking a little bit of dick.
164,Yo.. what the fuck?
165,That's for baseball players...
166,"No. Not me personally, but it's the truth."
167,Listen I don't know about y'all but I damn sure won't be sucking any dick tonight!
168,"No, thank you!"
169,"Yea, fuck that!"
170,Hey... Ya'll know that nigga over there?
171,Who?
172,The African nigga in the corner who keeps looking over here.
173,The ugly ass nigga?
174,"Yea, him with the big ass nose."
175,The ugly ass nigga?
176,"Oh, that's Jide. He's cool man. Don't worry about him."
177,How you know he's African?
178,C'mon nigga!
179,"How do you know him, man?"
180,"Shit, we've got a class together."
181,...Oh yeah?
182,Watch this.
183,What you about to do?
184,Just watch man.
185,sigh Chill man.
186,"Hey yo, KUNTA!"
187,Kunta Kinte!
188,Oya!
189,"Clicking sounds Laughter Yo man, lighten up. I'm just fucking with you."
190,It's not funny.
191,Don't take it personal. It's just a joke.
192,"I'm not taking it personally... Kunta Kinte is here, right?"
193,Clicking sounds The real joke if you ask me is that lousy shit you call a GPA Background chatter What? oh you don't remember me do you?
194,"That's right, I tutored your ass in biology last semester."
195,"Oh, is that so?"
196,Yeah that's right Jamaal.
197,"Well... if you're so smart, why don't you come tutor these balls?"
198,Background chatter Yea that's what I thought Kunta.
199,That's enough man... You ain't have to go there.
200,Yea that's what I thought Kunta.
201,Who the fuck are you?
202,You're sad bro.
203,"Oh, why don't you go with your friend then."
204,Don't hurt yourself looking for something that's not there.
205,"Oh, why don't you go with your friend then."
206,"Why don't you tell that to your girlfriend, Who comes to me whenever she wants to get fucked by a real man."
207,Fuck you!
208,No... thanks I only fuck women.
209,Right...
210,Especially the type too drunk and high to remember shit.
211,What'd you say?
212,You heard exactly what I said.
213,"No, I didn't hear you. So please, say it again."
214,No need to. It's not like you're gonna listen.
215,Just like how you don't listen when she's yelling no.
216,You think you're hard homeboy?
217,I'm not scared of you!
218,What's up then? Make a move.
219,Chill... chill... chill.. walk away!
220,Walk away man. Walk away! Walk away!
221,Chill... chill... chill.. walk away!
222,Walk away!
223,Chill... chill... chill.. walk away!
224,Don't let this Fraternity shit get to your head man.
225,You good?
226,Oh yea.
227,"Man, shit man!"
228,This is not a Fraternity!
229,This is an organization for young Black Professional men.
230,Something the two of you.... wouldn't know.
231,Excuse me?
232,"You know what, it's always the same shit with y'all."
233,Y'all?...
234,"Yeah, all y'all fucking athletes."
235,"You get the women, you get the money.. fame, glory. Everything comes so fucking easy to y'all."
236,"Now, this?... c'mon now."
237,You get every fucking thing!
238,"Shit, I didn't ask to be invited to this. Okay, nigga?"
239,I got the same invite just like everybody in here.
240,Matthias McCormick!
241,My man... I'm not your nigga.
242,Mathias McCormick... my name is not nigga man.
243,Yeah nigga... I know who the fuck you are Matthew.
244,Matthias...
245,C'mon. fix your mouth to say it... Matthias!
246,Ok. Ma. Ma. Ma... I don't give a damn!
247,Matthias McCormick.
248,There you go!
249,There you go...
250,"Sophomore, from South Carolina."
251,"Government major, PoliSci minor. Prelaw."
252,Vice President of the National Black Pre Law Society.
253,President of the bitchass nigga Society Laughter and acting Vice President of The Society of hatingassniggas.
254,Laughter Background chatter Did I leave something out?
255,Clapping Let's give the young jock a hand shall we...
256,Well if you know so much about me then you'd know that I'm a legacy child of The House Invictus.
257,And it's a 3.98...
258,Nigga please.
259,The only reason why you're here is because these niggas feel sorry for you.
260,Background Chatter The only reason why you're here is because these niggas feel sorry for you.
261,The only reason why you're here is because these niggas feel sorry for you.
262,"Yea, see you don't know shit about me."
263,The only reason why you're here is because these niggas feel sorry for you.
264,"Yea, see you don't know shit about me."
265,Perhaps not... Perhaps not...
266,but answer me this.
267,Perhaps not... Perhaps not...
268,What's that?
269,Was it your father or your uncle who was a member of The House Invictus?
270,Maybe I'll find it in the manual.
271,Yeah... yeah.
272,"What you're not gonna do, you're not gonna talk about my father."
273,Oh...
274,Shit.
275,That's right...
276,It was your father...
277,Well until he hung himself.
278,"Background chatter Isn't that right, nigga?"
279,"At least, I knew my father..."
280,Nigga...
281,"Loud Punch Laughter Man, you hit like a bitch!"
282,Loud Punches Background Chatter Grunting Loud Punches Fuck off me Nigga!
283,Whistle Sound Get the fuck off him.
284,What the fuck is wrong with you? What the fuck is wrong with all of you?
285,We don't fight like barbaric savages!
286,I'm sorry...
287,You be sorry for yourself...
288,All of you!!
289,Get up Matthias.
290,"I said, get the fuck up!!"
291,Big Brother...
292,What?
293,I don't think he's breathing.
294,"Matthias, wake up."
295,Get up Matthias!
296,"Matthias, wake up."
297,"Matthias, wake up!!!"
298,"Jaime, go get an ambulance."
299,Get everybody the fuck out of here!!
300,Get out!
301,Get the fuck out!
302,Give him some space...
303,Back up!
304,Get an ambulance!
305,Get an ambulance!!!
306,Back them the fuck up!!
307,"Light flickers Doors slam shut Oh, no... no... no..."
308,You can't leave before dinner...
309,Door slams shut Music Music Music Music Music Music Music Music Door slams shut Raindrops Humming Let us pray.
310,Shouldn't we wait for Brother Jay?
311,One of these days Jaime. One of these days...
312,You are going to have to get your head out of his ass.
313,I'm just trying to follow orders.
314,Order?... What fucking order?
315,When was the last time you saw any order around this place?
316,There's no need for that. I'm just saying.
317,You just sit there and don't you worry your pretty little face about a thing.
318,You are making our brothers feel uncomfortable.
319,Brothers....
320,What do you know about brotherhood?
321,You barely made it in here. Do not get too comfortable.
322,Bow your heads..
323,Bow your fucking heads!!
324,For this food which we are about to receive from your bounty Oh Lord we are thankful.
325,Amen...
326,Amen!
327,Amen!!!
328,Dig in.
329,"Well, eat. Don't just look at me like morons."
330,"Enjoy the gravy, it's delicious."
331,Try it.
332,Wine pours Mhmmm...
333,"Really good Daddy G, as always."
334,Why thank you very much Master Jaime.
335,Jide!
336,Yes.
337,"Yes, Big Brother..."
338,"Yes, Big Brother."
339,Who amongst you and your brothers is the weakest.
340,Is it you?
341,No...
342,So you're the strongest?
343,I didn't...
344,that's not what I said.
345,"So, who is it then?"
346,Is it Drew?
347,Is it Sam?
348,Who is it?
349,Is it Jamaal?
350,I don't... know Is it Tommy? Is it Johnny?
351,I don't know..
352,Is it young Theodore over here?
353,Who is it?
354,I don't know!!
355,Okay... I don't know...
356,I don't know.
357,"You're all fucking weak, like little pups, squirming at the breast of your dying mother."
358,This gravy is fucking delicious.
359,Don't you think it's fucking delicious Tommy?
360,You don't like gravy Mr. Jenkins?
361,No?
362,"Oh, c'mon Tommy!"
363,Laughter C'mon guys. The gravy can't be that bad.
364,Eat up! There's a storm coming.
365,You're going to need all of your strength.
366,Music intensifies Barrington.
367,Barrington...
368,Barrington...
369,Barrington!
370,"Yes, father Yes..."
371,Two words you wish you could have spoken but you couldn't because he wasn't there.
372,Papa wasn't there.
373,He left you and your poor black mother for a white woman.
374,"And you forgotten, yet you craved for his affection."
375,So badly you desired his love.
376,A man who wanted nothing to do with you.
377,"But, i'm here..."
378,I can make you feel...
379,good.
380,"Every fiber of your soul, every inch of your body, from your shoulders to your arms, to your back Straight..."
381,Broad...
382,And your hands...
383,The hands that killed Matthias.
384,That make you feel good?
385,His face...
386,Broken.
387,Beaten to a pulp!
388,"That make you feel like a man, Barrington?"
389,You think that's power?
390,You mistake power for violence.
391,Violence is recklessness.
392,But power is control!
393,"You see, I am a man Barry."
394,I am a real... A real man.
395,I understand control.
396,I understand the resilience it takes to deal with...
397,Years and years...
398,the will to overcome recklesness.
399,You are a boy!!!
400,You're a boy that never knew his father.
401,That's not power Barry.
402,That's confusion.
403,But I can make you feel...
404,good.
405,You're lost.
406,"Loud cries Music Muffled cries Music Muffled cries Raindrops Yes, I know everyone is sad because of what happened tonight. But there's no need for all of that sad shit."
407,Mathias is with the Lord now.
408,He's in a much better place.
409,We should all be so lucky.
410,Where is he?
411,He'll be buried tonight.
412,Not him.
413,...Barry.
414,Any particular reason for your interest?
415,He's one of us and he's...
416,Disappeared.
417,So we should know what's happened to him.
418,You want to know?
419,Yes...
420,Oh you guys really want to know?
421,Yes!
422,"Well, if you must know, Barrington is being held in solitary confinement. He's in deep penance, repenting for his sins."
423,The majority of which you helped him commit.
424,He didn't mean to kill him...
425,And you know that because?
426,You're all of a sudden God?
427,I'm not. I just think that...
428,Shut up!
429,...You're not the gatekeeper of good and bad.
430,"No, I'm not the gate keeper."
431,I'm the fucking wolf that strikes the Shepherd and this is no longer fucking Bethlehem.
432,"So, you're calling us sheep?"
433,"Clapping Yes, finally!"
434,Someone who's thinking with their brain.
435,That's exactly what you are... sheep.
436,"Where I say you go, you go."
437,I'm nobody's sheep.
438,Oh yes you are.
439,You came here. All of you came here to be led...
440,"And me, no stranger to kindness and my brothers..."
441,We decided to keep you.
442,This feels good to you?
443,This...?
444,"Hospitality, kindness, compassion..."
445,There's no compassion behind any of this.
446,Taking in the morally corrupt and absolving them of their transgressions?
447,Transgressions...?
448,Oh c'mon I'm a beacon of compassion!
449,Wouldn't you say so young Theodore?
450,"You should be more like your brother, Theodore."
451,"Speaking of transgressions, Jamaal?"
452,"You know all to well about transgressions, don't you?"
453,What was her name?
454,Sarah...?
455,Annabelle?
456,Annabelle.. Sarah...?
457,Was it the two?
458,What was her name?
459,Sarah...
460,"It was Sarah, wasn't it?"
461,Young Sarah...
462,"You did like her, didn't you?"
463,Yes. You do you have a thing for young girls.
464,"You enjoyed watching her, didn't you?"
465,Through her window in the morning when she was getting ready.
466,Following her to school...
467,"You enjoyed the smell of coconuts, don't you?"
468,She did like the particular perfume.
469,A coconut scented perfume...
470,What the fuck is this place?
471,...Language!
472,"Do you always ask this many questions, Mr. Daniels?"
473,Only at dinner.
474,A sharpshooter!
475,"I'm not easily impressed, especially by your kind."
476,You care for a proposition?
477,My kind?
478,You care for a proposition?
479,No!
480,"Here, I'll tell you anyway."
481,You ask one more question and I'll kill you.
482,Or you ask no more questions and you allow us to enjoy this nice meal and i'll think about maybe keeping alive until the next round.
483,How does that sound?
484,Door opens Up...
485,Up!
486,Greetings Big Brother.
487,Clears throat Greetings Big Brother!
488,I'm so sorry we tried to wait for you Big Brother. We really did.
489,I promise...
490,It's quite all right Jaime.
491,It's quite all right.
492,The other hand brother. You're never right in the eyes of Big Brother...
493,Remember that.
494,Loud thuds This gravy is really fucking delicious!
495,Whistling Loud cries Evening Gentlemen!
496,How are we doing?
497,"Told you that gravy was fucking delicious, didn't I?"
498,It was lovely.
499,My word is as good as it comes!
500,It's like a bond.
501,"Now, earlier this evening, I had a conversation with the Lord up there."
502,He said to me... Peter! look down on your lowly subjects and bring them into salvation.
503,Save them he said.
504,"Now, since you Johnny are the smartest one, you're gonna help me with this!"
505,Let's go!
506,you're gonna help me with this!
507,you're gonna help me with this!
508,Let's go!
509,you're gonna help me with this!
510,Loud cries Face your brothers. Look at them!
511,Look at them...
512,Look at them!!
513,Lift your head up and look at them.
514,"Now, I need you to give me a name."
515,Which one would be the first one of your brothers that you'd like to save?
516,What is the first name of the brother that you'd like to save?
517,Loud cries I...
518,You don't know?
519,I don't know!
520,Look at them!
521,You don't want to do the Lord's work?
522,You don't want to do the Lord's work?
523,Who will it be? Will it be Drew?
524,"Will it be Drew, perhaps?"
525,Will it be Drew?... Drew the womanizer?
526,"Or... perhaps, Theodore?"
527,"Young, innocent, sweet Brother Theodore!"
528,Who will it be?
529,Theodore!
530,"Precious, young Theodore. So shy and innocent."
531,Brother Theodore! How are you doing tonight?
532,You want to stay alive don't you? You want to live don't you?
533,Yes Big Brother!
534,You want to live?
535,Yes!
536,Beg! Beg him for your life!
537,Beg him! Look at him and beg!
538,Save me.
539,Save him!
540,Save me... Save me...
541,Save me..
542,Save him!!!
543,Save me!!!
544,Save him!!!
545,"He wants to be saved. Will you save him, Johnny?"
546,Save me...
547,Will you save him tonight?
548,"Johnny, will you save him?"
549,I don't know...
550,You don't know?
551,I don't know!
552,"What's there to know, its simple! You either want to save him, or you don't!"
553,Do you want to fucking save him?
554,Loud cries I don't think he wants to save you. I don't think he wants you...
555,I don't think he wants to save you!!
556,Beg him some more. Beg him for your life!
557,I don't want to die!
558,He doesn't want to die Jonathan. He doesn't want to die! Will you save his life..
559,Please!!!
560,Don't you have an ounce of kindness left in you?
561,Save him! Will you save him?
562,Who will it be?
563,What's it going to be?
564,Give me a name!
565,Give me a fucking name now!
566,Will you not save your brother?
567,Loud cries What will it be?
568,Give me a name!
569,Give me the fucking name!
570,Give me the fucking name!
571,......Ji..Jide..Jide.
572,What was that?
573,Jide!
574,Jide?
575,Jide.
576,Jide?
577,Oh that's an interesting turn of event isn't it Theodore?
578,"You, Theodore! Your time hasn't com yet. Get back in line. Get back in line!"
579,Get back in line!
580,"Young Jide, sir. Your time has come today!"
581,Loud cries it seems that the lord has found favor on you.
582,Get up!
583,Get up!
584,Loud cries You have been chosen by Johnny to be saved.
585,Look at that! I'll have mercy on you.
586,I have mercy on you. The Lord has found mercy on you!
587,I'm going to untie you.
588,"Now, today is not your day. the Lord has decided to give you another day to live, and die another day."
589,"Now, go! See over there? That's home!"
590,"I need you to run towards it, and do not look back!"
591,Go!
592,Go!
593,Run!
594,Run!
595,Music intensifies Gunshot Loud cries Did y'all see that?
596,What's the next name Johnny?
597,You're sick!
598,I'm sick?
599,Drew!!!
600,"Your brother here seems to think I'm sick... twisted... confused... But that's not the case is it though, Drew?"
601,Is it?
602,"He's wrong. I'm not confused. I'm not sick, am I?"
603,I just want to go home...
604,You want to go home?
605,Yes!
606,Why? We've just started with this game.
607,Isn't this fun for you?
608,No!
609,Isn't this fun?
610,"Loud cries Look, do you want to be next?"
611,No!
612,You don't want to be next?
613,No!
614,Home is that way. Don't you want to go home?
615,Loud cries Do you...
616,You don't want to go home?
617,No...
618,Good! 'cause I just started having fun with you!
619,Johnny!
620,Give me a name!
621,Give me a name!
622,What's gonna be the next name Johnny?
623,Tell me. What's the next name?
624,What's gonna be the next name Johnny?
625,I don't want to kill anybody.
626,You don't want to kill anybody?
627,"Now, let me tell you a story. Now, let me tell you what happens to disobedient boys."
628,I once had this toy. This toy that I loved. It was this green army man with these black boots on.
629,"Now, let me tell you a story. Now, let me tell you what happens to disobedient boys."
630,I named him Donald. I loved Donald. He was my favorite toy.
