,dialog
631,"Now, I really enjoyed playing with him because when I came back from school, after all the kids used to bully me..."
632,I don't know why they fucking bullied me...
633,"I don't even really know. But when I came home, he used to make me feel good."
634,He used to make me feel happy.
635,"I don't even really know. But when I came home, he used to make me feel good."
636,"So one day, I'm on my way home from school, and I'm just thinking about Donald."
637,All I'm thinking about is Donald... Donald... Donald!
638,Donald is gonna make me feel better.
639,"I get home, and I see Patrick playing with him in the garden. Patrick was my brother."
640,"You see, my parents."
641,"They had this thing for the names 'P' There was me Pete, there was Patrick, there was Precious!"
642,Precious!
643,Precious... she was my precious little sister.
644,But this isn't about Precious! This is about Patrick!
645,"I come home, I go to the garden and I see Patrick playing with Donald. And I run over and I say: Patrick, please stop playing with him, otherwise I'm gonna have to kill you."
646,Of course I don't mean it. I don't fucking mean it. I don't want to kill him. He's my brother.
647,Why in the fuck would I want to kill my brother?
648,"And then I tell him: Stop playing with him. Does he listen?... No, he keeps throwing him up and down..."
649,...and up and down.
650,and up and down!
651,He lands in the dirt. He's muddy. He's fucking muddy now.
652,So I run in the kitchen. I get my mom's favorite knife.
653,She's got this six inch long blade. And I come back in the garden and do you know what I do?
654,I stab Patrick repeatedly...
655,Over and over again...
656,Over and over again!
657,Over and over and over again...
658,Do you not see what happens to disobedient little boys?
659,Huh?
660,Do you see?
661,"You don't want that, do you?"
662,No...
663,so what I'll need from you now is a fucking name...
664,Give me the fucking name of the person you want to save!
665,...Phil Phil...?
666,Phillip! your time has come to be called upon to the Lord today...
667,Loud cries now...
668,"Johnny, what's it going to be?"
669,Who's the next name brother of yours that you'd like to save?
670,Pick wisely.
671,Give me a name now...
672,Choose wisely. Who will it be?
673,Sam...
674,Sam!
675,Samuel!
676,You have been chosen. May the Lord be with you now and forever more.
677,Gunshot Manic laughter This is fucking fun! Aren't you guys having fucking fun? This is fucking amazing!
678,"Johnny, aren't you having fun?"
679,I know you guys are having fun.
680,You're doing so well. You're nothing like Patrick at all. You're nothing like Patrick Patrick wouldn't have given me any names.
681,"Now, we just need one more name from you. You're doing really great Johnny."
682,"Now, give us the last name. Give us on more name. Who will it be?"
683,One of your brothers...
684,Who will it be?
685,Jamaal...
686,Jamaal?
687,Laughter You had that one locked and loaded. Didn't you?
688,Laughter Come here. You ain't done yet...
689,"Now... because you've been so good, I'm gonna do you one better."
690,Muffled cries Take this...
691,Take this...
692,Hold this. Hold it... Hold it!
693,"Feel it. Feels good, doesn't it?"
694,Hold it! Hold on to it!
695,No!!!
696,Shut up!
697,"Johnny, you can do this. It shouldn't be so difficult to do the Lord's work."
698,No!!! No!!!
699,It shouldn't be a problem at all.
700,No!
701,"This guy plays with little girls. You have a sister, don't you Johnny?"
702,"You have a sister, yea?"
703,How would you feel if you found out that this guy...
704,That this guy Jamaal was looking at your sister through the window everyday for six months!
705,Six Months!!
706,Loud cries You wouldn't like that... would you?
707,"C'mon, you can do it."
708,Stay steady...
709,Look at me!
710,Look at me Johnny.
711,Look at me.
712,Look at me!
713,Look at me!!!
714,Imagine him... watching her through the window.
715,Following her...
716,Sniffing her hair!
717,What the fuck is the matter with that guy?
718,What would you do?
719,I'm so sorry...
720,Johnny. Please! No..no..no..no..no Gunshot Manic laughter Music Music Door opens Drink pours You need help with that?
721,You know comprehension wasn't one of your strong suits.
722,What the hell is this?
723,What do you know about this?
724,We're gonna play this game again Peter?
725,Game... what game?
726,Jaime...
727,Yes brother.
728,Give us the room.
729,Clears throat No...
730,What?
731,"I said, I'm not leaving. Whatever you have to say to Pete ,you can say it to me."
732,You're beginning to corrupt him.
733,Someone has to help him. He's fucking lost.
734,You used to be just like him... Don't forget that.
735,"Yea, you won't let me."
736,You're so proud of yourself.
737,What's there to be ashamed of?
738,You relish in their anguish and you delight in their pain.
739,I'm doing the Lord's work.
740,There's not a single godly bone in your body Peter.
741,Oh... and you?
742,Me?
743,C'mon!
744,C'mon Jay! There's no need for this performance.
745,I'm trying to save them.
746,...With your misguided science?
747,I don't have their blood on my hands.
748,No... not on your hands.
749,Clears throat You think you're better than me.
750,"On the contrary you and me, we are cut from the same cloth brother."
751,No...
752,"I give life, you take it away."
753,You don't give a goddamn thing.
754,I have given you everything you own.
755,Everything you own I have given to you.
756,I molded you... I created you...
757,I give and I give and you take and you take...
758,You don't give a goddamn thing Jay!
759,You don't give a goddamn thing!
760,You don't give me a goddamn thing Jay!
761,Music Remember all those years ago?
762,We were boys then...
763,Outside on the fields looking for sticks to use as swords.
764,And we would fight until the sun went down.
765,Inseparable...
766,Both of us.
767,What happened to us?
768,I became my own man...
769,No...
770,You became a monster!
771,I became what you made me Jay.
772,I became a reflection of you.
773,You're nothing like me.
774,I became exactly what you molded me to be.
775,You look nothing like me.
776,You're delusional...
777,You're uneasy.
778,You're threatened.
779,Because I dont...
780,"Because I don't obey everything you say, like some.."
781,Stop it!
782,You leave him out of this.
783,You know he doesn't deserve your loyalty.
784,Stop it.
785,You know he doesn't deserve your loyalty.
786,He's nothing without you.
787,Stop it... stop it... stop it...
788,"No, Peter. You are nothing without me..."
789,Stop it!!!
790,Music How long have you been standing there?
791,Long enough to smell your shit.
792,Sniffing Back on the bottle I see...
793,I see right through you.
794,That makes two of us.
795,"You're emotional, you need rest."
796,Slurping Your true age is starting to show.
797,Brother Jay...
798,No. leave him. Let him go. He's a wasted man What is the matter with your hand?
799,Isn't there someplace you have to be?
800,Oh...
801,Jamie...
802,You're my only good son.
803,I don't understand.
804,What don't you understand son?
805,All of this.
806,Don't be upset. How about a treat?
807,I don't need a treat...
808,Clears throat Besides it's past dinner time.
809,I'm not allowed to have anything past dinner.
810,Says who?
811,I'm not allowed to have anything past dinner.
812,"Well, then it's a good thing that he isn't here."
813,You are your own man Jamie.
814,What will you have?
815,Chocolates... cookies... candy...?
816,Perhaps all of the above.
817,They all look so good.
818,Whatever you want!
819,No... I...
820,I couldn't...
821,Brother Jay always says not to allow myself the punishment of gluttony.
822,I insist.
823,"Yes, anything for my favorite boy."
824,I'm proud of you today son. You did good There's much work left to be done.
825,What do you say?
826,That's a good boy.
827,Music Loud breathing Barry...
828,Johnny.
829,Barry....
830,Barry can you hear us?
831,What the fuck happened to you?
832,You don't...
833,You don't want to know.
834,What's that on your face?
835,Is that chocolate?
836,Yes...
837,You know the rules Jamie.
838,You're not supposed to eat that shit past bedtime.
839,What's that in your hands?
840,It's nothing...
841,You know the rules. None of that past bedtime.
842,None of it.
843,Why do I have to do everything you tell me to do?
844,I'm sorry.
845,I didn't mean that...
846,I told him not to...
847,I told him that you'd be mad but he insisted.
848,No Jamie...
849,I...
850,I gotta get out of here.
851,Where are you going?
852,For a walk..
853,Another?...
854,What's the matter with you?
855,You look troubled No Jamie..
856,Just...
857,You go.
858,Let me come with you.
859,No!
860,You go to bed.
861,Chocolate?
862,I'm sorry.
863,Shit...
864,I didn't mean to give you such a shock.
865,What the fuck is this?
866,What the fuck is this Jay? you know about this?
867,Get off of me.
868,What the fuck is this? Answer me man!
869,Why don't you go ask...
870,Your daddy?
871,Music Music Music Music Music Music Music Music Why the fuck did you bring me here?
872,What do you want?
873,You want to be President? Is that it?
874,You want to wear the crown?
875,I don't care about no crown.
876,Huh?
877,What do you want?
878,I want answers!
879,Why are we here? What is this place?
880,This place...?
881,"There's religion and then, there's science."
882,This place is science.
883,You can't understand what you can't see Peter.
884,I can see clearly!
885,I can see very clearly. Look at you!
886,You're a fucking mess.
887,You want to embarrass me?
888,You don't need no fucking help embarrassing yourself.
889,Look at you. You're a mess.
890,You're a fucking drunk mess.
891,Why the fuck are we here Jay?
892,In it's minute form. Look at you. You're reduced to nothing Don't laugh at me.
893,Nothing!
894,Don't laugh at me!!!
895,Don't you laugh at me!
896,Why did you bring me here?
897,Where are we?
898,Fuck!
899,Focus Jay!
900,Fucking focus!!!
901,What is this place?
902,Peter...
903,Peter!
904,Don't touch me!
905,I need you to help me brother I'm not your fucking brother.
906,I need you to help me.
907,I'm not your brother.
908,I'm sorry.
909,I never should have brought you here.
910,You shouldnt!
911,I didn't mean to...
912,All those years...
913,In the fields Peter.
914,Shut up about those fields!
915,Why the fuck are we here?
916,What is this place?
917,How do we get out?
918,It's not me...
919,It's him...
920,Fuck!
921,He did it!
922,"He did it to you, he did it to me, to all of us."
923,He raped all of us.
924,That was his science.
925,Science?
926,Do you remember.....
927,These fields.
928,Laughter You're delusional!
929,You're gonna shoot me?
930,Shut up Jay!
931,Do it..
932,You won't change anything!
933,Shut up !
934,Shut up Jay!
935,You can't fix anything!
936,Shut up Jay!
937,Do it. You've never been able to Peter.
938,Laughter You've always gotten somebody else to do it...
939,You don't have the balls to do it.
940,Laughter Do it!
941,Do it!!!
942,Gunshot Fuck you Jay!
943,Fuck you!
944,I'll see you in hell.
945,Door opens No... no...
946,Get up!
947,Get up!
948,Get out!
949,Take your jacket and get out.
950,Take your jacket and get out.
951,Music Take your jacket and get out!
952,Get out!
953,Get out.
954,Get out!
955,Get out!
956,Get out!!!
957,"Whispers Out of the night that covers me, black as the pit from pole to pole."
958,"I thank whatever God's may be for my unconquerable soul, in the fell clutch of circumstance I have not winced nor cried aloud."
959,"Under the bludgeonings of chance my head is bloodied but unbowed, beyond this place of wrath and tears looms but the horror of the shade and yet the Menace of the years finds and shall find me unafraid."
960,It matters not how straight the gate. How charged with punishments the scroll..
961,"I am the master of my fate, I am the captain of my soul."
962,Barry...?
963,Loud punch Gunshot You'll always be a boy...
964,C'mon man!
965,Music Gunshot Gunshot Gunshot Gunshot Bone crack Background chatter Gunshot Music Loud thud Gunshot Gunshot Gunshot Music I gave you life and you waste it away....
966,Music I confess Music I confess to almighty God.
967,To blessed Mary evervirgin.
968,To blessed Michael the Archangel.
969,To Blessed John the Baptist.
970,To the Holy Apostles Peter and Paul.
971,"And to all the saints I've sinned exceedingly in thought, word, and deed."
972,"Through my fault, through my fault."
973,Through my most grievous fault.
974,Therefore I beseech blessed Mary evervirgin.
975,Blessed Michael the Archangel.
976,Blessed John the Baptist.
977,The the Holy Apostles Peter and Paul.
978,And to all the saints to pray for me to the Lord our God.
979,Amen.
980,Amen!
981,In honor... of the Father the Son and the Holy Spirit.
982,Daddy..?
983,Yes my child?
984,Where's Jamie?
985,Knocking at the gates of hell He didn't make it this time.
986,Welcome to The House Invictus.
987,You may call me Daddy G.
988,I don't know where you come from.
989,I don't know what you've done.
990,But just know that you're right where you need to be.
991,There's only one rule to surviving The House Invictus.
992,Get the bear... Don't let the bear get you.
