,dialog
0,We come in peace for cats and mice everywhere.
1,"Hey, how you doing? Good to see you."
2,Thanks for coming out.
3,Itchy ... Itchy ...
4,Boring!
5,"Dad, we can't see the movie."
6,I can't believe we're paying to see something we get on TV for free.
7,"If you ask me, everybody in this theater is a giant sucker."
8,Especially you.
9,Especially you.
10,Movie on the big screen!
11,Excuse me. My heinie is dipping.
12,"All right, well, thanks a lot for coming."
13,We've been playing for three and a half hours.
14,Now we'd like just a minute of your time to say something about the environment.
15, You suck!
16, Shut up and play!
17, Preachy!
18, We're not being preachy.
19,"But the pollution in your lake, it's dissolving our barge."
20,I thought they touched on a vital issue.
21,I beg to differ.
22,"Gentlemen, it's been an honor playing with you tonight."
23,For the latest rock band to die in our town ...
24,"Lord, hear our prayer."
25,"Lord, hear our prayer."
26,I hate being late.
27,"Well, I hate going."
28,Why can't I worship the Lord in my own way ...
29,by praying like hell on my deathbed?
30,"Homer, they can hear you inside."
31,Relax. Those pious morons are too busy talking to their phonybaloney God.
32,How you doing? Peace be with you.
33,Praise Jebus.
34,Today I'd like to try something a little different.
35,I'm going to call on one of you!
36,"Now, the word of God dwells within everyone."
37,I want you to let that word out.
38,Let your spirit ...
39,"What is it, Ned?"
40,The good Lord is telling me to confess to something.
41,"Gay, gay, gay."
42,An immodest sense of pride in our community.
43,Somebody else?
44,Let the Lord's light shine upon you.
45,Feel the spirit.
46,Let it out!
47,"Horrible, horrible things are going to happen!"
48,And they're gonna happen to you!
49,And you! And you! And you.
50,"Whoa, nelly!"
51,"People of Springfield, heed this warning: Twisted tail!"
52,A thousand eyes!
53,Trapped forever!
54,"Dad, do something!"
55,This book doesn't have any answers!
56,Beware! Beware! Time is short!
57,Believe me! Believe me!
58,Thanks for listening.
59,"Okay, who wants waffles?"
60,"I do, I do, I do!"
61,Wait a minute. What about Grampa?
62, I want syrup!
63, I want strawberries!
64,Something happened to that man.
65,I'll tell you what happened to him.
66,A certain someone had a senior moment.
67,"But that's okay, because we love him and we got a free rug out of it."
68,What is the point of going to church every Sunday ...
69,"when if someone we love has a genuine religious experience, we ignore it?"
70,"Right, Grampa?"
71,I want bananas on my waffles.
72,I rest my case.
73,I'm not dropping this.
74,Wait a minute.
75,I'm still in the car.
76,"Oh, right."
77,"""Take out hornets' nest."" Check. ""Fix sinkhole."" Check."
78,"""Reshingle roof""?"
79,Steady.
80,Steady.
81,"Why, you little ...!"
82,I'll teach you to laugh at something that's funny!
83,"You know, we are on the roof."
84,We could have some fun.
85,What kind of fun?
86,How about a dare contest?
87,That sounds fun.
88,I dare you to ...
89,climb the TV antenna!
90, Piece of cake.
91, Earthquake!
92,Aftershock!
93,"Homer, I don't mean to be a Nervous Pervis ..."
94,"but if he falls, couldn't that make your boy a paraplegearino?"
95,"Shut up, Flanders."
96," Yeah, shut up, Flanders."
97," Well said, boy."
98,Steady. Steady.
99,Steady ...
100,Hello. Sorry to bother you on a Sunday ...
101,but I'm sure you're as worried about the pollution in Lake Springfield as I am.
102,Lake Springfield has higher levels of mercury than ev ...
103,"Why, it's the little girl who saved my cat."
104,Lake Springfield is ...
105,"Come on over, Lisa."
106,You can canvass me as long as you want.
107,"Milhouse, you don't care about the environment."
108,Hey. I am very passionate about the planet.
109,Say global warming is a myth.
110,It's a myth!
111,Further study is needed!
112,That's for selling out your beliefs.
113,"Oh, poor Milhouse."
114,Dream coming true.
115,Are you aware that a leaky faucet can waste over ...?
116,Two thousand gallons a year.
117, Turning off lights can save ...
118, Enough energy to power Pittsburgh.
119,And if we kept our thermostats at 68 in winter ...
120,We'd be free from our dependency on foreign oil in 17 years.
121,I'm Colin.
122,I haven't seen you at school.
123,Moved from Ireland.
124,My dad's a musician.
125, Is he ...?
126, He's not Bono.
127," I just thought, because you're Irish and ..."
128, He's not Bono.
129,Do you play?
130,"Just piano, guitar, trumpet, drums and bass."
131,He's pure gold.
132,"For once in your life, be cool."
133,So is your name as pretty as your face?
134,You okay there?
135,Twisted tail! A thousand eyes!
136,Trapped forever!
137,What could that be?
138,I believe it's the sound the Green Lantern made ...
139,when Sinestro threw him into a vat of acid.
140,Yeah. Thanks for coming over.
141,Thanks for giving me your pregnancy pants.
142,Never known comfort like this.
143,Why did I suggest this?
144,"All right, boy, time for the ultimate dare."
145,I dare you to skateboard to Krusty Burger and back ...
146,naked.
147, How naked?
148, Fourth base.
149,Girls might see my doodle.
150,"Oh, I see. Then I hereby declare you chicken for life."
151,"Every morning, you'll wake up to ""Good morning, chicken""."
152,"At your wedding, I'll sing: I like men now."
153,Don't look where I'm pointing!
154,Stop in the name of American squeamishness!
155,"Boys, before we eat, don't forget to thank the Lord for this bountiful ..."
156,Penis?!
157, Bountiful penis.
158, Bountiful penis.
159,Amen.
160,"Listen, kid, nobody likes wearing clothes in public, but, you know, it's the law."
161,Lunchtime!
162,You can't just leave me out here.
163,"Don't worry, we found a friend for you to play with."
164,"Nelson, honey, where have you been?"
165, Dad!
166," What seems to be the problem, officers?"
167,Tell him you dared me to do it.
168,"If that's true, then you should be taking the rap here, not your son."
169,And what happens to me if it's my fault?
170,You'll have to attend a onehour parenting class.
171,It was all his idea!
172,"He's out of control, I tell you!"
173,I'm at my wits' end.
174,It's so ...
175,"See you in court, kid."
176,"Okay, son, let's get some lunch."
177,Did you at least bring my clothes?
178,"Shirt, socks, everything you need."
179, You didn't bring my pants.
180," Who am I, Tommy Bahama?"
181,This is the worst day of my life.
182,The worst day of your life so far.
183," Say, Bart?"
184," What do you want, Flanders?"
185,"If you need pants, I carry an extra pair."
186,"You know how boys are, always praying through the knees."
187,Why are you helping me?
188,I'm not your kid.
189,We're neighbors. I'm sure your father would do the same for my boys.
190,Thank you.
191," Hey, what's with you?"
192, You really wanna know?
193,Of course I do.
194,What kind of a father wouldn't care about ...?
195,A pig wearing a hat!
196,Action.
197,"Hey, hey! It's your old pal Krusty, for my new pork sandwich, the Klogger."
198,"If you can find a greasier sandwich, you're in Mexico!"
199,And we're clear.
200,"Perfect. Cut, print, kill the pig."
201,What ...?! You can't kill him if he's wearing people clothes!
202,You're coming home with me.
203,"""A thousand eyes."" What could that be?"
204,I'm pretty sure a thousand is a number.
205,"Hey, Marge. Isn't it great being married to someone who's recklessly impulsive?"
206,"Actually, it's aged me horribly."
207,Then say hello to the newest Simpson.
208,Homer!
209,I believe what happened in church was a warning about precisely this.
210,"Please, get rid of that pig."
211,"Oh, you're gonna love him."
212,"Look, he does an impression of you."
213,You nailed her.
214,He also does me.
215,You smiled. I'm off the hook.
216,"Oh, you have so many looks."
217,So that's what snug is.
218,Who's a good pig?
219,Who's a good pig?
220,"Rough day, huh, son?"
221,"You don't know what rough is, sister."
222,"Bart, you know, whenever my boys bake up a batch of frownies ..."
223,I take them fishing.
224,Does your dad ever take you fishing?
225,"Dad, it's not fair to use a bug zapper to catch the fish."
226,"If you love fish like I do, you want them to die with dignity."
227,I think I have a nibble.
228,I think fishing might be more fun with you.
229,"Oh, great. Now, how about I fix you some cocoa?"
230,No way. Cocoa's for wusses.
231,"Well, sir, if you change your mind, it's on the windowsill."
232,"Oh, my God."
233,"Oh, wait. I didn't tell you the best part. He loves the environment."
234,"Oh, wait! I still didn't tell you the best part. He's got an Irish brogue."
235,"No, no, wait!"
236,I still didn't tell you the best part.
237,He's not imaginary!
238,"Oh, honey, that's great."
239,But the very best thing is that he listens to you.
240,Because nothing means more than for a man to ...
241,How did the pig tracks get on the ceiling?
242,"SpiderPig, SpiderPig Does whatever a SpiderPig does Can he swing from a web?"
243,"No, he can 't, he's a pig Look out He is the SpiderPig Are we having fun yet?"
244,We are now. You've got a bite.
245,"Whoa, mama!"
246,"Oh, no, my good pole!"
247,You're not strangling me.
248,What the ...?
249,Strangling's only good for ...
250,"Well, it's not good for anything."
251,The only time you should lay hands on a boy ...
252,is to give him a good pat on the back.
253,"Hey, what the hell are you ...?"
254,One more time.
255,"Honey, I'm home."
256,"We are at the tipping point, people."
257,If we don't do something now ...
258,"I'm sorry, I lost my train of thought."
259,Isn't he dreamy?
260,Agreed.
261,"Okay, so here's the bottom line: If we don't change our ways right now ..."
262,pollution in Lake Springfield will be at this level.
263,That's not so bad.
264,"No, the lift is stuck."
265,Am I getting through to anyone?
266,"Hell, yeah."
267,We need a new one of those things.
268,"All in favor of a new scissor lift, say ""aye""."
269, Aye.
270, No!
271,This lake is just one piece of trash away from a toxic nightmare.
272,But I knew you wouldn't listen.
273,So I took the liberty of pouring water from the lake in all your drinking glasses.
274,This is why we should hate kids.
275,"This is serious, people."
276,No more dumping in the lake.
277,I hereby declare a state of emergency.
278,Code black.
279,Black? That's the worst color there is.
280," No offense there, Carl."
281, I get it all the time.
282,"Sorry, sorry."
283,No dumping in the lake.
284,Fine. I will put my yard trimmings in a car compactor.
285,"Chief, I think there was a dead body in there."
286,"I thought that too, until he said ""yard trimmings""."
287,"You gotta learn to listen, Lou."
288,Let us now make sure this barrier is completely idiotproof.
289, Cletus.
290, Yessum?
291,Try to dump something in the lake.
292,Okay.
293,I can't. I simply can't.
294, Brilliant.
295, Very effective.
296,Don't get any ideas.
297,"Maybe we should kiss, just to break the tension."
298,What's going on here?
299,Nothing. Nothing.
300,I'm not sure that pig should be in the house.
301,"And by the way, what are you doing with his leavings?"
302,Don't worry.
303,I've devised a most elegant solution.
304,It's leaking.
305,"It's not leaking, it's overflowing."
306,He filled up the whole silo in just two days?
307,"Well, I helped."
308,"Homer, stop! Stop. I know it's easy for your mind to wander ..."
309,but I want you to really concentrate on me.
310,I can't escape the feeling that this is the crisis Grampa warned us about.
311,You have to dispose of that waste properly.
312,"Okay, Marge. I will."
313,You can take SpiderPig with you.
314,"He's not SpiderPig anymore, he's Harry Plopper."
315,Hello.
316,"Homer, you gotta get over here."
317,"Health inspector shut down the doughnut store, they're giving out free doughnuts!"
318,"Oh, my God, oh, my God!"
319,I just got one thing I gotta do first.
320,"Well, you better hurry."
321,They're going fast.
322,"Whoa, that was close."
323,Evil!
324,"Drive, drive, drive!"
325,"Oh, right."
326,"Look at that. You can see the four states that border Springfield: Ohio, Nevada, Maine and Kentucky."
327,"Oh, yeah."
328,"And if you look real close, you can almost ..."
329,"Well, this certainly seems odd ..."
330,but who am I to question the work of the Almighty?
331,"We thank you, Lord, for this mighty fine intelligent design."
332,Good job.
333,"Jabbity, jabbity, jab, jab, jab!"
334,Hey! Jab one more eye and it's a federal crime.
335, Who are you?
336, Environmental Protection Agency.
337,"Russ Cargill, head of the EPA, here to see the president."
338,Mr. President.
339,"Ja, that is me."
340,Pollution in Springfield has reached crisis levels.
341,"I hate this job. Everything's ""crisis"" this and ""end of the world"" that."
342,Nobody opens with a joke.
343,I miss Danny De Vito.
344,"You want a joke, huh?"
345,Stop me if you've heard this one.
346,Look at those angry eyes and giant teeth.
347,It's like Christmas at the Kennedy compound.
348,"You know, sir, when you made me head of the EPA ..."
349,you appointed one of the most successful men in America ...
350,to the least successful agency in government.
351,And why did I take the job?
352,Because I'm a rich man who wanted to give something back.
353,"Not the money, but something."
354,So here is our chance to kick some ass for Mother Earth.
355, I'm listening.
356," Well, I've narrowed your choices down ..."
357,to five unthinkable options.
358,Each will cause untold misery ...
359,I pick number three.
360,You don't wanna read them first?
361,"I was elected to lead, not to read."
362,Number three!
363,We're being sealed in a dome!
364,What do I do?
365,I don't know what to do!
366,"If I stay, I'm trapped."
367,"If I leave, I'm alone."
368,"Oh, God. In, out, in, out!"
369,I never saw Venice.
370,"""Trapped forever."" It's all come true."
371,That crazy old man in church was right.
372,Dome!
373,"All right, men, open fire."
374,Who's hurt? Raise your hands.
375,Without the attitude.
376,"People, people."
377,I have an important announcement.
378,I have just perfected an acidfiring superdrill ...
379,which can cut through anything.
380," Hey, that's cool."
381,It's right there.
382,Just outside of the dome.
383,What ruthless madmen could have done this to us?
384,The United States government.
385,My name is Russ Cargill and I'm head of the EPA.
386,The what?
387, Environmental Protection Agency.
388, Come again?
389,"Look, I'm a man on a big TV."
390,Just listen.
391, Springfield has become ...
392, Springfield!
393, The most polluted city in the history of the planet.
394,Drama queen!
395,To keep your poisons from spreading ...
396,your government has sealed you in this dome.
397,It's the last thing we wanted to do.
398,"I own the company that makes the dome, but that's beside the point."
399,You mean we're trapped like rats?
400,"No, rats can 't be trapped this easily."
401,You're trapped like carrots.
402,Wait. We couldn't be more polluted.
403,Everyone stopped dumping in the lake.
404,Apparently someone didn't get the message.
405,Act natural.
406,"Hey, buddy, sooner or later, people are gonna discover this."
407,Don 't worry about that. We found a way to take you off the map.
408,Coming up on your right: Nothing.
409,"This is Kent Brockman, reporting to you on a crisis so serious ..."
410,it has its own name and theme music.
411,The dome has put an end to life as we know it.
412,The town is running low on supplies of everything from gasoline to Botox.
413,"Moment, please."
414,"Now, as always, we end our news on ""The Lighter Side""."
415,It's the time of year when the swallows return to Springfield.
416,I think the thing I miss most is a simple summer breeze.
417,Maggie?
418,"We've got dome wax, dome polish, dome freshener, all your dome needs ..."
419,"at Dome Depot, located at the 105 and the dome."
420,Dome Depot!
421,Maggie got out! Maggie got out!
422,"Maggie was right there, just outside the dome."
423,"Marge, she's right here."
424,This dome can play tricks on you.
425,You just have to keep calm and ...
426,"Oh, my God."
427,I'm out of the dome.
428,Fresh air! Freedom!
429,I'll write you. Lead good lives!
430,"Good evening, this is Kent Brockman."
431,Efforts to find out whose selfish crime ...
432,caused our entrapment have been fruitless.
433,Until moments ago!
434,A shocking discovery has been made here at Lake Springfield.
435,That could be anybody's pigcrap silo.
436,"Homer, it was you."
437,You singlehandedly killed this town.
438,I know. It's weird.
439,"Just a reminder, this station does not endorse vigilante justice."
440,Unless it gets results.
441,Which it will.
442,You didn't listen to me after I warned you.
443,"Don't worry, nobody watches this stupid show."
444,What's that ominous glow in the distance?
445,Kill! Kill! Kill!
446,"Marge, look. Those idiots don't even know where we live."
447,Kill! Kill! Kill!
448,We want Homer! We want Homer!
449,You monster. You monster!
450,Did you see the news?
451,"Honey, come on, we have bigger problems."
452,But I'm so angry.
453,You're a woman.
454,You can hold on to it forever.
455,Okay.
456,"Homer, you have to go out there, face that mob ..."
457,and apologize for what you did.
458,"I would, but I'm afraid if I open the door, they'll take all of you."
459,"No, we won't. We just want Homer!"
460,"Well, maybe not you, but they'll kill Grampa."
461,I'm part of the mob!
462,Teeny! Take out the baby.
463,"Here, let me get that for you."
464,Stay back. I got a chain saw.
465,Bart!
466,Crawl across. Hurry.
467,"But if they see you helping us, they'll kill you."
468,I'm sure your father would do the same for ...
469,"Point taken. Now, hustle your bustles."
470,Archers.
471,I'm using a red arrow so I know who I kill.
472,"No, Plopper."
473,"If you push that, Daddy will die."
474,"Hey, my luck's beginning to turn."
475,Wait! There's something I have to get.
476, What'd you get?
477, Our wedding video.
478, We have a wedding video?
479, Torch his gas tank!
480,We lost them.
481,Up here.
482,Get them! Get them!
483,Little help?
484,"You know, the word ""apology"" ..."
485,"is tossed around a lot these days, but when it comes from in here ..."
486,"Mom, what are we gonna do?"
487,"Maggie, not now."
488,We'll play later.
489,"The sinkhole. Follow me, kids!"
490, Geronimo!
491, Sacajawea!
492,"So long, losers!"
493,The top of his head is still showing.
494,Claw at it!
495,"Well, they're China's problem now."
496,Colin!
497,I can't hear you!
498,"I never thought my life would have an absolutely perfect moment, but this is ..."
499,Lisa's got a boyfriend that she'll never see again!
500, Perfect.
501, What do we do?
502, Now we run.
503,"I'm afraid we lost them, sir."
504,Damn it!
505,"Well, then, you find them and you get them back in the dome."
506,And so nobody else gets out ...
507,I want roving death squads around the perimeter 24/7.
508,"I want 10,000 tough guys ..."
509,"and I want 10,000 soft guys to make the tough guys look tougher."
510,"And here's how I want them arranged: Tough, tough, soft, tough ..."
511,"soft, soft, tough, tough, soft, soft, tough, soft."
512,"Sir, I'm afraid you've gone mad with power."
513,Of course. Ever try going mad without power? It's boring. No one listens to you.
514," Bart, are you drinking whiskey?"
515, I'm troubled.
516, Bart.
517," I promise, I'll stop tomorrow."
518,You'll stop right now.
519,"You come back here, little man."
520,"I miss Flanders. There, I said it!"
521, Where's your father?
522, He went out.
523,Let's quickly rebuild our lives while he's gone.
524,"Hey, guys?"
525,"What's the secret knock, again?"
526,"Look, I know I screwed up."
527,This is big.
528,It's huge! We're homeless!
529,Our friends wanna kill us!
530,Before we can even stay in the same room with you ...
531,I need to know what was going through your mind ...
532,when you didn't listen to me ...
533,and dumped that silo in the lake.
534,Homer!
535,"I don't know what to tell you, Marge."
536,I don't think about things.
537,I respect people who do ...
538,but I just try to make the days not hurt until I get to crawl in next to you again.
539,"I mean, oh."
540,"Look, I'm really sorry."
541,But I'm more than just sorry ...
542,I'm prepared with a solution.
543,I've always been afraid I'd screw up our lives so badly we'd need a backup plan.
544,And that plan is right here!
545,No.
546,Nope.
547,Bingo.
548,Bear with me.
549,Alaska?
550,Alaska. A place where you can't be too fat or too drunk.
551,"Where no one says things like: ""Let's see your high school equivalency certificate."" I don't know, Homie."
552,I'm not saying it right.
553,"Look, the thing is, I can't start a new life alone."
554,And I've really come to like you guys.
555,I just don't see it.
556,"Marge, in every marriage, you get one chance to say: ""I need you to do this with me."" And there's only one answer when somebody says that."
557,"Okay, Homie, I'm with you."
558,"Thank you, my sweetheart."
559, Mom?
560," Yes, honey?"
561,You just bought another load of crap ...
562,from the world's fattest fertilizer salesman.
563,You'll pay for ruining this golden family moment!
564,Homer!
565,How are we supposed to get to Alaska without any money?
566,"All right, son. If you don't believe in me, believe in America."
567,America. Where any man can make quick money with no questions asked.
568,Step right up and win my truck!
569,All you have to do is conquer the Ball of Death.
570, What's the catch?
571, No catch.
572,Just ride the motorcycle all the way around just one time.
573,Three tries for $ 10.
574," Marge, how much money do we have?"
575, Ten dollars.
576,That counts as a try.
577,That's two.
578,And that's three.
579,"Here's what I'll do, because I like seeing you hurt yourself: I'll give you one on the house."
580, You're the best.
581, Dad!
582,"When you get to the top, don't slow down, speed up!"
583, But that's when it's the scariest.
584, Just do it!
585,Yes!
586,"Yay, Dad!"
587,I'll take that truck now.
588,"Oh, man."
589,My wives are gonna kill me.
590,"Next stop, Alaska!"
591,Day 37 under the dome.
592,We are facing intermittent power failures which ...
593,"Okay, very funny."
594,I'm gonna turn the lights off again.
595,"When they come back on, I want all my booze back the way it was."
596,"Yeah, okay. Okay."
597,"I'm very proud of you, Bart."
598,Over 24 hours sober.
599," You are, aren't you?"
600, I'll prove it.
601,"We're giving your father another chance, and we owe it to him to ..."
602," Oh, my God."
603, Can I help you?
604,We need diapers.
605, Okay.
606," No. No, we don't. We don't."
607, Ladies' razorblades.
608, Right.
609,"No! No. No, we don't."
610,"I forgot, we're European."
611,Just give us beef jerky.
612,Lots and lots of beef jerky.
613,That's right. That's what we need.
614,That's all we came in for.
615,Sure.
616,"Oh, my God. There they are!"
617,"So you want some of my electricity, do you?"
618,"Well, for once, the rich white man is in control."
619,I have two buttons behind this desk.
620,"One will supply your town with power, the other releases the hounds."
621,Reach me. Make me your brother.
622,The hospital's generator is about to give out.
623,Lives will be lost.
624,"""Lives lost."" Go on."
625,"We got a convict we were gonna fry tomorrow, but now we can't."
626,Tempting. Tempting.
627,"Look, all our reasons mean nothing."
628,Just look into your heart and you'll find the answer.
629, First door on the right.
630, Thank you.
631,What ...? This isn't the way I pictured Alaska at all!
632,"Oh, that's better."
633,Homer!
634,"Well, at least my poster didn't get torn."
635,"Welcome to Alaska. Here's $ 1,000."
636,"Well, it's about time! But why?"
637,"We pay every resident $ 1,000 ..."
638,to allow oil companies to ravage our state's natural beauty.
639,I'm home!
640,"Oh, thanks."
641,"What are you doing, Bart?"
642,Just passing the time.
643,"My boy loves Alaska so much, he's applauding it."
644," Lisa, why aren't you clapping?"
645," But, Dad ..."
646,Clap for Alaska!
647,"Well, Marge, we're separated from the kids by a wall of snow."
648,All my dreams are coming true.
649,We're going to need more birds.
650,Day 93 under the dome.
651,With necessities growing dangerously low ...
652,who knows what spark will set off this powder keg?
653, Let's discuss Tuesdays with Morrie.
654, Again?
655,"If we don't get a new book, I'm going to puke."
656,You're the five people I'm going to meet in hell!
657,We're out of coffee!
658,I can't take another minute in this dome!
659,Take that.
660,"Oh, no! Blowback!"
661,Look what they're doing to our dome.
662,"You know what that is, sir?"
663, A crack?
664, Exactly.
665,"People got out of the dome before, they're gonna get out again."
666,"When they do, there's gonna be hearings, investigations ..."
667,I'll have to go back to making family comedies.
668,"Don't worry, I have a solution for you, sir."
669,"In fact, I have five solutions."
670,You don't have to read them.
671,You'll have deniability.
672,I'll take care of it.
673,You know nothing.
674,No. I need to know what I'm approving.
675,"Absolutely. But on the other hand, knowing things is overrated."
676,Anyone can pick something when they know what it is.
677,It takes real leadership to pick something you're clueless about.
678," Okay, I pick three."
679, Try again.
680, One. Five?
681, Go higher. Too high.
682, Three?
683, You said three.
684, Six? Two?
685, There is no six. Double it.
686, Four!
687," As you wish, sir."
688,Are you tired of the same old Grand Canyon?
689,"Here we are, kids, the Grand Canyon."
690,It's so old and boring.
691,I want a new one. Now!
692,Hello. I'm Tom Hanks.
693,The U.S. Government has lost its credibility ...
694,so it's borrowing some of mine.
695,"Tousle my hair, Mr. Hanks."
696,"Sure thing, son."
697,"Now, I'm pleased to tell you all about the New Grand Canyon."
698,This weekend. East of Shelbyville and south of Capitol City.
