,dialog
0,"Oh, whoa."
1,Easy.
2,Saw some turkeys on the way here.
3,Crossed right in front of me like I wasn't even there.
4, How rude of them.
5, That's what happens.
6,You spend six days a week working in the mines and stupid birds start to think they own these woods.
7,When's the tour leave?
8,Couple hours.
9,"Well, let's go."
10,"Hey, whoa, whoa, whoa!"
11," Hey, whoa. You're okay."
12,You're okay. You're safe. You're safe.
13,It's okay. You're here with me.
14,You're with me.
15,"Okay, okay."
16,I'm sorry.
17,"Oh, we... We should..."
18,We should go.
19,Are you coming to the train station?
20,I think you have enough people saying goodbye without me there.
21,Only a few I actually care about.
22,It might be easier if I didn't.
23,It's only a few weeks.
24,I'll be back before the snow melts.
25,"Yeah, a lot can happen in a few weeks."
26,Are we gonna do this again?
27,"Gale, it was an act."
28,"Yeah, it was a good one."
29,I did what I had to do to survive.
30,"If I didn't, I'd be dead."
31,I had to do that.
32,At least once.
33,Haymitch!
34,Haymitch!
35,"Haymitch, wake up. lt's Tour Day."
36,Haymitch.
37,What are you doing?
38,Cameras are gonna be here in an hour.
39,"If you wanted to be babied, you should've asked Peeta."
40,Asked me what?
41,Asked you to wake me without giving me pneumonia.
42,You are a strangely dislikeable person.
43,But you do have your virtues.
44,"Would you like some bread, Katniss?"
45,"No, I ate at the Hob, but thank you."
46,You're welcome.
47,Brr.
48,You two have a lot of warming up to do before show time.
49,"Which is in an hour, so take a bath, Haymitch."
50,I just did.
51,"Did you have a good walk, dear?"
52, Walk? I was just out...
53, We have visitors.
54,"Miss Everdeen. This way, please."
55,Such bravery.
56,Such spirit.
57,Such...
58,Contempt.
59,President Snow.
60,What an honor.
61,"My dear, I think we can make this so much simpler if we agree not to lie to each other."
62,What do you think?
63,"Yes, I think that would save time."
64,"Sit down, please."
65,"I have a problem, Miss Everdeen."
66,A problem that began the moment you revealed those poison berries in the arena.
67,"If that Head Gamemaker, Seneca Crane, had had any brains at all, he would have blown you to bits then and there."
68,But here you are.
69,I expect you can guess where he is.
70,"Yes, I think so."
71,"After that fiasco, there was nothing left to do but to let you play out your little scenario."
72,And you were very good.
73,"That whole lovecrazed, besotted schoolgirl routine."
74,Impressive. Truly.
75,You convinced the people in The Capitol.
76,"Unfortunately, not everyone in the districts fell for it."
77,"I mean, you can't know this, but in several of them, people viewed your little trick with the berries as an act of defiance."
78,Not as an act of love.
79,"And if a girl from District 1 2 of all places can defy The Capitol and walk away unharmed, what is to prevent them from doing the same?"
80,"What is to prevent, say, an uprising?"
81,That can lead to revolution.
82,"And then, in a fraction of time, the whole system collapses."
83,"It must be a fragile system, if it can be brought down by just a few berries."
84,"Yes, it is, indeed."
85,But not in the way you imagine it.
86,How should I imagine?
87,You should imagine thousands upon thousands of your people dead.
88,This town of yours reduced to ashes.
89,Imagine it gone.
90,"Made radioactive. Buried under dirt as if it had never existed, like District 1 3."
91,"You fought very hard in The Games, Miss Everdeen."
92,But they were games.
93,Would you like to be in a real war?
94,No.
95,Good. Neither would I.
96,Did your mother make these?
97,Peeta.
98,Oh. He's a lovely boy.
99,Tell me.
100,At what point did he realize the depth of your indifference towards him?
101, I’m not indifferent.
102, Don't lie!
103,You promised.
104,Why don't you just kill me now?
105,I don't want to kill you.
106,I want us to be friends.
107,"But if not friends, then allies."
108,What do I need to do?
109,"When you and Peeta are on tour, you need to smile. You need to be grateful."
110,"But, above all, you need to be madly, preparedtoenditall in love."
111,You think you can manage that?
112,Yes.
113,"Yes, what?"
114,I'll convince them.
115,No.
116,Convince me.
117,"For you, Miss Everdeen."
118,Do convince me.
119,For the sake of your loved ones.
120,Stop.
121,Take it all in.
122,This is sacred ground.
123,History was made here.
124,Oh.
125,You'll get used to the smell.
126, Hmm.
127,Hello!
128,Oh!
129,There she is. My greatest triumph!
130,Our little superstar.
131,"Sweetie, we've missed you."
132,What a cute little house.
133,"So quaint, isn't it?"
134,"Of course, you've heard about Cinna?"
135,What happened to Cinna?
136,"Oh, dear, he's a fashion star."
137,You're his muse.
138,Everyone in The Capitol's wearing him.
139,Everyone.
140, Everyone.
141," Well, not everyone."
142,Oh!
143,Cinna!
144,Katniss?
145,"Katniss, is this your sister?"
146,"Oh, sweetie!"
147,Are you okay?
148,"Oh, just adorable!"
149, Yeah.
150, Ready to work?
151, Yeah.
152, All right. Good.
153,Welcome!
154,"Last year, the 74th Hunger Games brought us the greatest love story of our time."
155,"Two brave young people, against all odds chose to die rather than to lose each other."
156,"As a nation, we shared their agony."
157,But we had so little time to revel in their joy.
158,It's time!
159,"She's done, she's lovely."
160,We must feed the monster.
161,All right now.
162,Let's go to District 12 and find our starcrossed lovers!
163,You're excited. You're in love.
164,"Big smiles for the camera in three, two, one."
165,There she is! Katniss Everdeen!
166,The Girl on Fire.
167,And there he is! Peeta Mellark!
168,The Baker's Boy.
169, Ooh.
170,"Uhoh. Whoa, oh."
171,Trouble in paradise.
172,I hope they're all right.
173, Um...
174, Ahem.
175,Anyone at home?
176,Should we come back later?
177,"Sorry, Caesar."
178,"Oh, please. lt's all right. lt's your day."
179,It's your day. So how's it going?
180,We're good.
181,"That's it? That's all we get? ""We're good""?"
182,So taciturn all of a sudden.
183,"Peeta, give me some details!"
184,"Yeah, things are, uh..."
185,Things are great here in 1 2.
186,"Thanks to the generosity of The Capitol, we've never been closer."
187," 25 yards, to be exact."
188,Fantastic!
189,We'll be checking in with both of you throughout the Victory Tour.
190,"Thank you so much, Katniss Everdeen and Peeta Mellark!"
191, Wonderful!
192,Everybody in motion. We are out of here in 1 0.
193,That was nice acting.
194,"You, too."
195,Almost thought that kiss was real.
196,"Come along, children, we are on a schedule."
197,The train awaits!
198,"Fabulous food, fabulous wine, the massages, spa treatments. I told them nothing but the best for my two Victors."
199,"It all needs to be, uh..."
200,Fabulous?
201,Exactly.
202,"Now, the schedule is a bit of a bear."
203,"But it's mostly parties, celebrations, adoring fans to greet you at every stop along the way, and then we wrap it up in The Capitol."
204,"All you need to do is give a few speeches, wave to the crowds, and enjoy your time in the spotlight."
205,You've earned it.
206,What did you say?
207,Katniss.
208,"I said, ""Enjoy it, Katniss, you've earned it."" By killing people."
209,Young lady...
210,I’m really not in the mood for a lecture.
211,I'll apologize to Effie later.
212,I thought you were Haymitch.
213,You don't have to apologize to anybody.
214,Including me.
215,I know it's not fair of me to hold you to things you said in The Games.
216,You saved us. I know that.
217,"But I can't go on acting for the cameras, and then just ignoring each other in real life."
218,"So if you can stop looking at me like I’m wounded, then I can quit acting like it."
219,And then maybe we have a shot at being friends.
220,I've never been very good at friends.
221,"For starters, it does help when you know the person."
222,I hardly know anything about you except that you're stubborn and good with a bow.
223,That about sums me up.
224,"No, there's more than that, you just don't want to tell me."
225,"It's like I said, I'm..."
226,"See, Katniss, the way the whole friend thing works is you have to tell each other the deep stuff."
227, The deep stuff?
228, Yeah.
229,Uhoh. Like what?
230,"Like, uh..."
231,What's your favorite color?
232,"Well, now you've stepped over the line."
233,"Seriously, though, what is it?"
234,Green.
235,What's yours?
236,Orange.
237,Like Effie's hair?
238,No.
239,Not that orange.
240,"More, uh... More like a sunset kind of orange."
241,Did you see that?
242,What?
243,Whoa.
244,"Well, I never."
245,This is not very festive.
246,The mayor will make some introductory remarks.
247,And then you just have to say a few words.
248,"It's customary, of course, to give a brief eulogy to the district's fallen Tributes."
249,"For 1 1, that's Thresh and Rue."
250,Here are the speeches.
251,I can do the talking if you want.
252,Thank you.
253,"Ladies and gentlemen, the Victors of the 74th Hunger Games."
254,Katniss Everdeen and Peeta Mellark!
255,"Smile, smile, smile, smile."
256,Stand up straight. You're on camera.
257,Thank you.
258,We're honored to be here with you today.
259,And to be with the families of your fallen Tributes.
260,He put down the cards.
261, Though they fought...
262, ...and lived with honor...
263, Why do I bother?
264,"And dignity until the end, both Thresh and Rue were so young."
265,But our lives aren't just measured in years.
266,They're measured in the lives of people we touch around us.
267,"For myself, for Katniss, we know that without Rue and without Thresh, we wouldn't be standing here today."
268,"So in recognition of that, knowing that it in no way can make up for your loss, we'd like to donate one month of our winnings to the families of the Tributes, every year, for the rest of our lives."
269,"Oh, shit."
270,Can he do that?
271,He can't. But he did.
272,Why doesn't he just stick to the cards?
273,Thank you.
274,I just wanted to say that I didn't know Thresh.
275,I only spoke to him once.
276,"He could have killed me, but instead he showed me mercy."
277,That's a debt l'll never be able to repay.
278,I did know Rue.
279,"She wasn't just my ally, she was my friend."
280,I see her in the flowers that grow in the meadow by my house.
281,I hear her in a Mockingjay song.
282,I see her in my sister Prim.
283,"She was too young, too gentle."
284,And I couldn't save her.
285,I'm sorry.
286,No! No!
287,Wait! Wait!
288,No! Leave him alone! Leave him alone!
289,No! Let me go! Please leave him alone!
290,No!
291,"You! No, no, no!"
292, Come here! Stop it!
293,Stop it! Stop!
294, What did I do?
295,Come on.
296,Shut up.
297,"In all my years, I’ve never seen..."
298,You two have a very simple task.
299,I never meant for anyone to get killed.
300,He has to know that.
301,What are you talking about?
302,Who has to know what?
303,Snow. He came to see me.
304,He's worried about rebellion in the districts.
305,He thinks that they don't believe our love story.
306,So he wants you to make them believe it?
307, To calm things down.
308," You know, Katniss, you should told me that before I went out there, and tried to give these people the money."
309,I'm sorry. I didn't know what to do.
310,He threatened to kill my family.
311,"Well, I have family, too."
312,Okay? People that I need to protect.
313,What about them? Who protects them?
314,"Katniss, what were you thinking?"
315,I was thinking about Rue.
316,"Haymitch, please..."
317,"Please, just help me get through this trip."
318,"Please, just help us get through this."
319,"This trip? Girl, wake up."
320,This trip doesn't end when you get back home.
321,You never get off this train.
322,You two are mentors now.
323,"That means that every year, they're gonna drag you out, and broadcast the details of your romance."
324,"Every year, your private life becomes theirs."
325,"From now on, your job is to be a distraction."
326,So people forget what the real problems are.
327, So what do we do?
328, You're gonna smile.
329,You're gonna read the cards that Effie gives you.
330,And you're gonna live happily ever after.
331,Think you can do that?
332,Huh?
333,Yeah?
334,Come here.
335,You're gonna be okay. I promise.
336,Katniss and I want to share with you our victory.
337,And our gratitude to The Capitol for bringing us together.
338,"It was the bond of love, forged in the crucible of The Games that was our greatest prize."
339,For it is love and true love that allows us all to bear our hardships.
340,That mends the heart and banishes loneliness and gives meaning to our lives.
341,We also want to share with you the sorrows of your losses.
342,The Tributes of this...
343,The Tributes of this district were brave and noble warriors.
344,They brought honor to their families and pride to their people.
345,"We are all of us united, both victors and vanquished, in serving a common purpose."
346,Thank you.
347,"One day, I’m gonna volunteer."
348,Just like you did.
349,It was just a dream. I’m sorry.
350,"It's okay. I get 'em, too."
351,Goodnight.
352,Peeta.
353,Will you stay with me?
354,Yeah.
355,Always.
356,"We are all of us united, both victors and vanquished, in serving a common purpose."
357,The power and glory  of The Capitol.
358, Put down the cards!
359,Tell us what you really think!
360,Panem today. Panem tomorrow.
361,Panem forever.
362,"Your hair looks lovely, darling."
363,When did you start wearing it like that?
364,"Everyone at school wears it like this now, Grandpa."
365,Snow is watching us.
366,"If he wants you to pacify the districts, I promise you, he's not happy."
367,"Instead of being in love, you two sound like you're reciting from a drilling manual."
368,You try reading that stuff that Effie writes us.
369,Tell that to President Snow when you see him two days from now.
370,I'm open to suggestions.
371,We could get married.
372,That's not helping.
373,I'm serious.
374,"If, like you said, we're on this train forever, it's gonna happen eventually."
375,Why not now?
376,It does make a statement.
377,I'll give you that.
378,"Yeah, sure. Let's do it."
379,"Just when you thought things couldn't get more exciting going into a very special Quarter Quell, our two lethal lovers..."
380,My favorite expression.
381,From District 1 2 have surprised us with a new twist in their love affair.
382,Let's take a look.
383, Aw...
384,A fairy tale ending for two starcrossed lovers.
385,That's beautiful. Beautiful.
386,"And then tonight, the tour that began in the hollows of District 12 will end where?"
387,The Presidential Palace.
388,The party of the year.
389,Eyes bright. Chins up. Smiles on.
390,"I'm talking to you, Katniss."
391,"Now, there'll be photographers. interviews."
392,Everyone will be here to celebrate you.
393,My Victors.
394,"Breathe it all in, children."
395,This is all for you.
396,It's cozy.
397,Attitude.
398,"Come, come."
399,Come along.
400,"Excuse us, excuse us."
401,"Come, come."
402,Hold hands.
403,And the library. All mahogany.
404,"Hello, hello!"
405,"Not yet, not yet. No, no, no."
406,"Ooh, curtains!"
407,Everybody who's anybody is here.
408,And they all want to meet you.
409,Flavius! Octavia!
410,Try one of these. They are divine.
411,"No, I can't eat another thing."
412, Here.
413, What's this?
414,It's for when you're full.
415,It makes you sick.
416,So you can go on eating.
417,How else could you taste everything?
418,I think it's time for a dance.
419,Katniss?
420,People are starving in 1 2.
421,"Here, they're just throwing it up to stuff more in."
422,Katniss? Peeta.
423,This is Plutarch Heavensbee.
424,Head Gamemaker.
425,Successor to Seneca Crane.
426,That's a tough act to follow.
427,Peeta!
428,May I?
429,Please.
430,So how do you like the party?
431,It's a little overwhelming.
432,It's appalling.
433,"Still, if you abandon your moral judgment, it can be fun."
434,So are you having fun?
435,I'm the Head Gamemaker. Fun is my job.
436,Thought that was what happened to Seneca Crane. Too much fun.
437,Seneca decided to quit breathing.
438,Decided.
439,It was that or poison berries.
440,Being Head Gamemaker has never been the most secure job in the world.
441,Then why are you here?
442,Same reason as you. I volunteered.
443,Why?
444,Ambition.
445,The chance to make The Games mean something.
446,The Games don't mean anything.
447,They only mean to scare us.
448,"Well, maybe it was you who inspired me to come back."
449,Ah!
450,The Presidential welcome.
451,I'm sure we'll meet again.
452,"Katniss, come. The President awaits."
453,You think we convinced him?
454,I'm not sure what else we can do.
455,"Tonight, on this, the last day of their tour, I want to welcome our two Victors."
456,Two young people who embody our ideals of strength and valor.
457,"And I, personally, want to congratulate them on the announcement of their engagement."
458,Your love has inspired us.
459,And I know it will go on inspiring us every day for as long as you may live.
460,Look at them.
461,She's not who they think she is.
462,She's not a leader.
463,She just wants to save her own skin.
464,It's as simple as that.
465,I think that's true.
466,But she's become a beacon of hope for the rebellion.
467,And she has to be eliminated.
468,I agree she should die.
469,But in the right way.
470,At the right time.
471,It's moves and countermoves.
472,And it's all we gotta look at.
473,Katniss Everdeen is a symbol.
474,Their Mockingjay.
475,They think she's one of them.
476,We need to show that she's one of us.
477,We don't need to destroy her.
478,Just the image.
479,Then we let the people do the rest.
480,What do you propose?
481,Shut down the black markets.
482,Take away what little they have.
483,Then double the amount of floggings and executions.
484,Put them on TV. Broadcast them live.
485,Sow fear. More fear.
486,It won't work. Fear does not work as long as they have hope.
487,And Katniss Everdeen is giving them hope.
488,She's engaged.
489,Make everything about that.
490,What kinda dress is she gonna wear?
491,Floggings.
492,What's the cake gonna look like?
493,Executions.
494,Who's gonna be there? Fear.
495,Blanket coverage. Shove it in their faces.
496,Show them that she is one of us now.
497,"They're gonna hate her so much, they might just kill her for you."
498,Brilliant.
499,When did you...
500,We need to talk.
501,Where are we gonna run away?
502,Into the woods. Like we always talked about.
503,"If we leave right now, we can be far away from here by tonight."
504,"Yeah, who's ""we""?"
505,"You, me and your fiance?"
506,It's not just me and Peeta anymore.
507,Snow threatened to have you killed.
508,Anyone else?
509,"Well, he didn't exactly give me a copy of the list but a good guess, it includes both of our families."
510,Unless what? You and Peeta get married?
511,Unless nothing now.
512,"Gale, we can do it."
513,You said yourself that we could do it the morning of the Reaping.
514,What do you say now?
515,Do you love me?
516,"Gale, you know how I feel about you."
517,But I can't think about anyone that way right now.
518,"The only thing that I can think about every day, every waking moment since the Reaping, is how afraid I am."
519,There's no room for anything else.
520,"But maybe, if we got away from here, if we went somewhere safe, it could be different."
521,I could be different.
522,You think maybe the President's bluffing?
523,He's not bluffing.
524,Not with what's going on in the districts.
525,What do you mean?
526,What did you see?
527,"There were people fighting in the streets, and fires, and Peacekeepers were gunning them down, but the people were..."
528,What? The people were what?
529,They were fighting back.
530,It's happening.
531,It's finally happening.
532,I should've just eaten the berries in the arena and died like I was supposed to.
533,Then everything would be back to normal and everyone would be safe.
534,Safe for what?
535,To starve? Work like slaves?
536,Send their kids to the Reaping?
537,"You haven't hurt people, Katniss."
538,You've given them an opportunity.
539,They just have to be brave enough to take it.
540,There's already talk in the mines.
541,People wanna fight.
542,"We have to go, Gale, before they kill us."
543,They will kill us.
544,What about the other families? Huh?
545,The ones who stay. What happens to them?
546,"People are looking to you, Katniss."
547,I don't want anyone looking to me.
548,I can't help them.
549,You do what you want.
550,I'm staying here.
551,"Commander Thread, welcome to District 1 2."
552,Let's get to work.
553, Let's go! Keep moving!
554, Stay close!
555,Find and clear.
556,Burn all contraband.
557,Let me go!
558,Ripper!
559,My eye!
560,I'm gonna get you out of here.
561,No!
562,Leave her be! Stop!
563,No!
564,In the square.
565,Here.
566," Yeah, hold that on there."
567,No!
568,No! No! Stop!
569,Katniss!
570,It's okay.
571,Just go. lt's okay.
572,Move.
573,You want another?
574,Go ahead.
575," Whoa, whoa, whoa!"
576, Get out of my way!
577,"No, you don't want to shoot her."
578,How about I shoot both of you?
579,"Look, Commander, you're new here."
580,"Trust me, I’m trying to help you."
581,I'm Haymitch.
582,You recognize her? Katniss Everdeen.
583,Darling of The Capitol.
584,She interfered with a Peacekeeper.
585,I never said she was smart.
586,"Look, you already got a couple of lashes in, right?"
587,That's not good enough. She's an agitator.
588,"Easy, easy."
589,Look...
590,You're sure Snow wants three dead Victors here?
591,Because that's what we're looking at.
592,It's bad enough that you marked up her face on the eve of the big wedding.
593,"Let it go. And we will, too."
594,All right.
595,Okay.
596,"But next time, it's the firing squad."
597,Excellent idea.
598,I don't care who she is.
599,Clear the square!
600,You're all under curfew.
601,Anyone out after dark will be shot on sight.
602,Get 'em outta here.
603,It's Gale.
604,Get him here.
605,Here we go.
606," Really easy. Up, up."
607,Okay.
608, Okay. Thanks.
609,New head Peacekeeper.
610,Not entirely peaceful.
611,Missed your eye. Doesn't need stitches.
612,Make a snow coat.
613,"Peeta, get the snow. l'll grind the herbs."
614,What is that? That's hurting him.
615,He needs morphling.
616,It's okay.
617,Mom. No. l'll do it.
618,"Oh, God."
619,"Hold him, please."
620, That's better.
621,"Hey, Catnip."
622,Hey.
623,Thought you'd be gone by now.
624,I'm not going anywhere.
625,I'm gonna stay right here.
626,Cause all kinds of trouble.
627,"Me, too."
628,Hey.
629,You wanna get some rest?
630,I can look after him for a while.
631,I'm gonna go get him more snow.
632,Hey.
633,How's your eye?
634,It's not my eye that's bothering me.
635,How can we live like this?
636,How can anybody live like this?
637,"It's not living, but.."
638,"Since the last Games, something is different."
639,I can see it.
640,What can you see?
641,Hope.
642,You understand that whatever I do comes back to you and Mom.
643,I don't want you to get hurt.
644,You don't have to protect me. 0r Mom.
645,We're with you.
646,I love you.
647,"I love you, too."
648,The broadcast cut out here.
649,Before any of the excitement happened.
650,How many people saw it?
651,"Hard to say. There was a five second delay, but it happened fast."
652,"If you cannot contain Katniss Everdeen, then I will have to terminate her."
653,I understand that.
654,And not just her.
655,Her entire species has to be eliminated.
656,"Her species, sir?"
657,The other Victors.
658,"Now, because of her, they all pose a threat."
659,"Because of her, they all think they're invincible."
660,"Whatever game you think you're playing, those out there are not playing it with you."
661,There's a way we can still win.
662,"It's what we Gamemakers like to call ""a wrinkle."" Ladies and gentlemen, this is the 75th year of The Hunger Games."
663,"And it was written in the charter of The Games that every 25 years, there would be a Quarter Quell to keep fresh for each new generation the memory of those who died in the uprising against The Capitol."
664,Each Quarter Quell is distinguished by Games of a special significance.
665,"And now on this, the 75th anniversary of our defeat of the rebellion, we celebrate the 3rd Quarter Quell as a reminder that even the strongest cannot overcome the power of The Capitol."
666,"On this, the 3rd Quarter Quell Games, the male and female Tributes are to be reaped from the existing pool of Victors in each district."
667,No!
668,Who does he mean?
669,Victors shall present themselves on Reaping Day  regardless of age...
670, Katniss...
671,state of health  or situation.
672,No.
673,Peeta.
674,Ah. There she is.
675,"Finally did the math, huh?"
676,"And you've come to, what?"
677,Ask me to... Die?
678,I'm here to drink.
679,Oh.
680,"Finally, something I can help you with."
681,What's it say that Peeta was here 45 minutes ago begging to save your life and you only just now show up?
682,It means we have to save him.
683,You could live 1 00 lifetimes and never deserve that boy.
684,"Come on, Haymitch."
685,Nobody decent ever wins The Games.
686,Nobody ever wins The Games. Period.
687,There are survivors.
688,There's no winners.
689,Peeta has to survive.
690,We have to do whatever it takes to save him.
691,"All right, if..."
692,"If they call his name, l'll volunteer in his place."
693,"Haymitch, thank you."
694,"But they call my name and Peeta volunteers, there's nothing I can do."
695,You can help him in the arena.
696,Like you did for me.
697,Ah...
698,I think these Games are gonna be different.
699,I don't care. Do whatever you can.
700,Peeta lives. Not me.
701,Promise me.
702,Okay.
703,We should've gone when you said.
704,Welcome.
705,Welcome.
706,As we celebrate the 75th anniversary and 3rd Quarter Quell of The Hunger Games.
707,"As always, ladies first."
708,"The female Tribute from District 1 2, Katniss Everdeen."
709,Wonderful.
710,And now for the men.
711,The male Tribute from District 1 2.
