,dialog
699,That's where Springfield is!
700,It's nowhere near where anything is or ever was.
701,"This is Tom Hanks, saying: If you're going to pick a government to trust, why not this one?"
702,Did you see that?
703,"Yes, they're going to destroy Springfield."
704,But we're going to stop them.
705,"Homie, get your clothes on. Homie?"
706,I'm happy here. Screw Springfield!
707,I can't believe you'd say something so selfish.
708,"Marge, those people chased us with pitchforks and torches."
709,Torches! At 4 in the afternoon!
710, It was 7 at night.
711, It was during Access Hollywood.
712,Which is on at 4 and 7.
713,"Dad, how can you turn your back on everyone who loved us?"
714,Flanders helped when we were in trouble.
715,Who cares what he did?
716,He's not your father.
717,I wish he was.
718,You don't mean that.
719,You worship me.
720,"Oh, yeah?"
721,Look what I did to your picture.
722,Look at it.
723,Howdillydoodilly.
724,Howdillydoodilly.
725,"Why, you little ...!"
726,I'll strangleangle you!
727,Diddilydiddily.
728,"Bart, stop it! Leave this to me."
729,Homer ...
730,"in every marriage, you get one chance to say: ""I need you to do this with me."" That is the stupidest thing I've ever heard."
731,Homer Simpson!
732,We're saving Springfield!
733,"Listen to me, all of you."
734,We are staying.
735,We have a great life in Alaska ...
736,and we're never going back to America again.
737,I have spoken!
738,"Well, I guess I've let her worry about me long enough."
739,Marge? Kids?
740,"Okay, here goes."
741,Homer ...
742,I've always stood up for you.
743,When people point out your flaws ...
744,"I always say: ""Well, sometimes you have to stand back to appreciate a work of art."" Way back."
745,"Lately, what's keeping us together ..."
746,is my ability to overlook everything you do.
747,And I overlook these things because ...
748,Because?
749,"Well, that's the thing."
750,I just don 't know how to finish that sentence anymore.
751,So I'm leaving with the kids to help Springfield ...
752,and we're never coming back.
753,And to prove to myself that this is the end ...
754,I taped this over our wedding video.
755,"Goodbye, Homie."
756,I love you.
757,Marge? Kids?
758," So, Mom, what's our plan?"
759, What are you doing up there?
760,Looking through people's luggage.
761,I'm the mascot of an evil corporation.
762,Get down from there.
763,We have to keep a low profile ...
764,till we get to Seattle to tell the world of the plot to destroy Springfield.
765,I don't know if you guys should be talking so loud.
766,"Oh, Lisa, it's not like the government is listening to everybody's conversation."
767,"Hi, I'm calling about your Meat Lover's pizza."
768,"I like meat, but I don 't know if I'm ready to love again."
769, You hang up first.
770," No, you hang up first."
771,Okay.
772,She hung up on me!
773,But we're fugitives. We should just lay low till we get to Seattle.
774,"Hey, everybody, I found one!"
775,The government actually found someone we're looking for!
776,"Yeah, baby, yeah!"
777,Homer Simpson ...
778,do you know why you are here?
779,Because my family cares more about other people than they do about me.
780,Drink this liquid.
781,"More, please."
782,Now we will cleanse your spirit ...
783,by the ancient Inuit art of throat singing.
784,Throat singing?
785,How long are we doing this?
786, Until you have an epiphany.
787, Okay.
788, Until you have an epiphany.
789, Okay.
790,What's an epiphany?
791,Sudden realization of great truth.
792,Okay.
793,"SpiderPig, SpiderPig Does whatever a SpiderPig does Look out!"
794,He's a SpiderPig Unless you have an epiphany ...
795,you will spend the remainder of your days alone.
796,"Epiphany, epiphany, epiphany."
797,Bananas are an excellent source of potassium.
798,Americans will never embrace soccer?
799,More than two shakes and it's playing with yourself?
800,"Hey, what are you doing?"
801,"Oh, do whatever you want to me."
802,I don't care about myself anymore.
803,Because ...?
804,Because other people are just as important as me.
805,"Without them, I'm nothing."
806,In order to save myself ...
807,I have to save Springfield!
808,That's it! Isn't it?
809,That was the most incredible experience of my life.
810,"And now to find my family, save my town and drop 10 pounds!"
811,"Thank you, boob lady."
812,"This is it, kids. Seattle."
813,Russ Cargill!
814,Do you think he saw us?
815,"Yes, I did."
816,Run! Run!
817,Run! Run!
818,Run! Run!
819,Jump! Jump!
820,Land! Land!
821,Rest! Rest!
822,Run! Run!
823,"Now, I know we've had a rough day ..."
824,but I'm sure we can put all that behind us and ...
825,That's my whipping arm!
826,Why does everything I whip leave me?
827,Must keep going. Must keep going.
828,"No, I can't. I can't keep going."
829,"Yes, you can."
830,"No, I can't!"
831,"Oh, shut up!"
832,You shut up.
833,"No, you. No, you."
834,"No, you. Oh, real mature."
835,How could you say that?
836,"Oh, what's the point?"
837,It's hopeless.
838,"Don't give up, Homer."
839,You are closer than you think.
840,But which way do I go?
841,Much obliged.
842,Tenhut!
843,Lisa! Knock off that racket.
844,Lisa!
845,They captured my family.
846,What do I do? What do I do?
847,"There's something strange about that ""sop"" sign."
848, Did you hear something?
849, Probably just a moth.
850,I hope it's okay.
851,"Look, we can't keep stopping at every ""sop"", ""yeld"" or ""one vay"" sign."
852,Just move on.
853,Let us out! Let us out!
854,Stop that.
855,You'll scratch your shackles.
856,I hope I do.
857,"Oh, way to go, Bart."
858,You stink.
859,"No, you stink."
860,Springfield.
861,"I can't believe it, but it got even crappier."
862,"Oh, man."
863,"Oh, hi, Midge."
864,"Moe, what happened?"
865,"With the town sealed off from the rest of the world, things got a little nutty here."
866,Why are you dressed like that?
867,"Well, I don't like to brag, but I am now the emperor of Springfield."
868,"No, you're not!"
869,"Yes, I am!"
870,"Okay. Hail, emperor."
871,"Attention, Springfield."
872,Your government realized that putting you inside this dome was a terrible mistake.
873,"Therefore, we're commencing with Operation Soaring Eagle."
874,Which involves killing you all.
875,"As I speak, we're lowering a small but powerful bomb into your midst."
876,"Despite everything, I miss your father."
877,Me too.
878,"His big, fat ass could shield us all."
879,Tenhut!
880,At ease. I'm General Marriott Suites ...
881,and I have an urgent note from the president.
882,It says to release this town immediately.
883,Why is it written on a leaf?
884,Perfect.
885,Now Homer Simpson's gonna show he has cojones!
886,"Mom, I've gotta go find Colin."
887,"Not now, sweetie."
888,Doomsday is family time.
889,"Hey. If one of us distracts Cargill, the rest of us can climb up that thing."
890,Who'd be dumb enough to stay behind while we escape with our lives?
891,My time to shine.
892,"Hey, Mr. Big TV Man, lookie here!"
893,What do you want?
894,Look what I can do with my thumb.
895,You wanna know how I do it?
896,Four generations of inbreeding?
897,I can smell fresh air.
898,I can hear birds.
899,I taste freedom.
900,Excuse me!
901,Watch out! Coming through!
902,I was tricked by an idiot.
903,"Hey, I know how you feel. I was beat in tictactoe by a chicken."
904,Goodbye.
905,Homer do good?
906,"Actually, you doomed us all."
907,"Again. Nice knowing you, Homer."
908,But I ...
909,I can't do anything right.
910,Get out of here!
911,I've spent my entire life doing nothing but collecting comic books.
912,And now there's only time to say: Life well spent!
913,"Okay, boys. When you meet Jesus, be sure to call him Mr. Christ."
914,Will Buddha be there too?
915,No.
916," Hey, Flanders."
917, Bart.
918,How good to see you.
919,And how terrible you're here.
920,Thanks.
921,Listen. I was just wondering if ...
922,before I died ...
923,I could pretend I had a father who ...
924,cared for me.
925,"Come here, son."
926,There's always room for one more in the Flanders clan.
927,"Come on, bombdisarming robot."
928,You're our last hope.
929,Red wire. Blue wire.
930,Black is usually the ground.
931,So much pressure.
932,Pressure!
933,"He'd been talking about it, but I didn't take him seriously."
934,Marge.
935,Marge! Marge!
936,"Oh, no, the ""epiphatree""!"
937,"Hey, I tried my best."
938,What am I supposed to do?
939,But how am I supposed to get up there?
940,Here. Buy yourself something nice.
941,Homer? What the hell are you doing now?
942,Risking my life to save people I hate ...
943,for reasons I don't quite understand. Gotta go!
944,"But first, one stop."
945,Bart? Son?
946,You think you could find it in your heart ...
947,to give your foolish old man one more chance?
948,"Oh, I don't know."
949,"It seems to me, son, that your father's saying that ..."
950,he wants to spend his last minute with you.
951,No. I can't do it.
952,I want a father who's the same in the morning as he is at night.
953,What's that word?
954, Consistency.
955, Consistency.
956,"Thanks, losers."
957,"Sorry, Homer."
958,I'll let you hold the bomb.
959,The man knows me.
960,I wish Homer was my father.
961,And I wish you didn't have the devil's curly hair.
962,I've been taking your crap all my life!
963,This feels good. No wonder you do it.
964,"Okay, you've only got one shot to throw that bomb through the hole."
965,"Dad, in case I miss ..."
966,I'm sorry I said I wished you weren't my father.
967,"I don't blame you, son."
968,I wasn't much of a father.
969,Maybe it starts with the way my dad raised me.
970,"Yes. It's clear to me. It's just been one long, unbroken cycle of ..."
971,Somebody throw the goddamn bomb!
972,What? What's going on?
973,"We did it, boy!"
974,Dad?
975,It's amazing no one was hurt.
976,"Bye, everybody."
977,"Now, that was a great fatherson activity."
978,"Hello, Homer."
979,"So we meet at last, whoever you are."
980,There's two things they don't teach you at Harvard Business School.
981,"How to cope with defeat, and how to handle a shotgun."
982,I'm going to do both right now.
983,Wait! If you kill my dad ...
984,you'll never know where the treasure is buried.
985,What treasure?
986,The Treasure of Imawiener.
987,I'm a wiener?
988,Classic.
989,"Well, always leave them laughing."
990,"Goodbye, sir."
991,Maggie! What a great little accident you turned out to be.
992,Colin? Colin!
993,Lisa? Colin's dead.
994,"But his last words were: ""Milhouse, take care of Lisa."
995,"Hold her hand."" I got her all warmed up for you."
996,Colin. Hi.
997," Hey, you wanna go ...?"
998, Clean up the lake?
999,"Well, I was gonna say get some ice cream, but okay."
1000,I like ice cream.
1001,Kind of sweaty. Sorry.
1002,Boy! You survived! How?
1003,I did things no dog should do.
1004,They will haunt me forever.
1005,I love you too.
1006,Best kiss of my life.
1007,Best kiss of your life so far.
1008,Steady.
1009,Steady.
1010,Steady.
1011,Dad?
1012,"Thanks, boy."
1013,Steady.
1014,"They've taken everything, sir."
1015,"Smithers, I don't believe in suicide ..."
1016,"but if you'd like to try it, it might cheer me up to watch."
1017,"This is Tom Hanks, saying: If you see me in person, please, leave me be."
1018,"SpiderPig, SpiderPig Does whatever a SpiderPig does Can he swing from a web?"
1019,"No, he can 't, he's a pig Look out!"
1020,He is a SpiderPig Look out!
1021,"He is a SpiderPig Come on, Dad, let's go. I've been holding it since they put the dome over the town."
1022,You can wait. A lot of people worked really hard on this film ...
1023,and all they ask is for you to memorize their names.
1024,"Well, I wanna make sure no animals were harmed ..."
1025,during the filming of this movie.
1026,Okay.
1027,Floor popcorn.
1028,"Wait, wait, wait! It looks like Maggie has something to say."
1029,"Oh, my God. Her first word."
1030,Sequel?
1031,"Springfield doesn't have an anthem We thought we had one But we don 't We paid a short guy to write it But we never saw him again The tune we stole from the French There's a few things they do well Like making love, wine and cheese Like Roqueforts, Camemberts and Bries Springfield, we're going to die Springfield, I'm scared, goodbye Assistant manager isn't all it's cracked up to be."
1032,Four years of film school for this?
