,dialog
1931,What should happen? What would be fair?
1932,Objection.
1933,Do you think they deserve to die?
1934,"Now, Mr. Buckley Carl Lee don't answer that!"
1935,"Yes, they deserved to die and I hope they burn in hell!"
1936,"CROWD SHOUTING GAVEL BANGING I have nothing further, Your Honor."
1937,NOOSE: Summations begin tomorrow.
1938,Court adjourned.
1939,"Jake, they found Roark."
1940,WHISPERING Ellen....
1941,Hmm.
1942,Ellen.
1943,So...
1944,"...this is what I had to do to get you to call me ""Ellen""?"
1945,I'm so sorry.
1946,This is all my fault.
1947,No.
1948,"Don't sweat it, really."
1949,They didn't They didn't hurt anything that won't heal.
1950,Nothing.
1951,"Besides, um, Dr., uh..."
1952,...What'sHisName said I'll be out in a couple days...
1953,...so I'm fine.
1954,How'd we do?
1955,Bass turned out to be a felon.
1956,Carl Lee got trapped on the stand by Buckley.
1957,"People been terrorized, Roark."
1958,Beaten.
1959,Killed. It It's not worth it. It's not.
1960,It's only not worth it if Carl Lee goes to the gas chamber.
1961,"Listen, this case is not over until the summation."
1962,Remember that.
1963,Okay?
1964,And you've got one big fat chance...
1965,...to reinvent yourself.
1966,To make that jury see this whole case This whole case through your eyes.
1967,And they're good eyes.
1968,"Now, get out of here, go to work."
1969,I'll keep in touch with you.
1970,"No, you won't."
1971,Big liar.
1972,"Win or lose, Roark..."
1973,...we make one hell of a team.
1974,We might have.
1975,We really might have.
1976,"You really want to kiss me right now, don't you?"
1977,"Yes, I do."
1978,Undecided?
1979,Guilty?
1980,"MAX GROWLS FOOTSTEPS APPROACHING CARLA: Hey, Max. Hey."
1981,Where's Hannah?
1982,I left her at Mother and Daddy's.
1983,How did you get here?
1984,Drove.
1985,In the storm?
1986,"Got something to say, it needs to be said in person."
1987,"The truth is, I've been blaming you for all that's happened."
1988,But it's not your fault.
1989,You didn't kill those boys.
1990,You were trying to make things right.
1991,I know that now.
1992,I thought you took this case because you wanted to prove...
1993,...what a bigtime lawyer you were.
1994,But I was wrong.
1995,You took this case because...
1996,...if those boys...
1997,...had hurt Hannah the way that they hurt Tonya...
1998,...you would've killed them yourself.
1999,MOUTHS Baby.
2000,"Baby, come here."
2001,Come here.
2002,"I love you, Jake."
2003,JAKE: I thought I was gonna lose you.
2004,"JAKE CLEARS THROAT We're gonna lose this case, Carl Lee."
2005,There are no points of law to argue here.
2006,I wanna cop a plea.
2007,Maybe Buckley will cop us...
2008,...a seconddegree murder and we can get you just life in prison.
2009,"Jake, I I can't do no life in prison."
2010,You gotta get me off.
2011,"Man, if it was you on trial It's not me."
2012,"We're not the same, Carl Lee."
2013,The jury has to identify with the defendant.
2014,"They see you, they see a yard worker."
2015,"They see me, they see an attorney."
2016,I live in town. You live on the hill.
2017,"Oh, you white and I'm black."
2018,"See, Jake?"
2019,You think just like them.
2020,That's why I picked you.
2021,"You're one of them, don't you see?"
2022,"You think you ain't, because you eat in Claude's..."
2023,"...and you're out there trying to get me off on TV, talking about black and white."
2024,But the fact is...
2025,...you're just like all the rest of them.
2026,"When you look at me, you don't see a man."
2027,You see a black man.
2028,"Carl Lee, I am your friend."
2029,"We ain't no friends, Jake."
2030,We're on different sides of the line.
2031,I ain't never seen you in my part of town.
2032,I bet you don't even know where I live.
2033,"Our daughters, Jake, they ain't never gonna play together."
2034,"Now, what are you talking about?"
2035,America is a war...
2036,...and you are on the other side.
2037,How a black man ever gonna get a fair trial...
2038,...with the enemy on the bench and the jury box?
2039,My life in white hands.
2040,"You, Jake."
2041,That's how.
2042,You my secret weapon because you're one of the bad guys.
2043,"You don't mean to be, but you are."
2044,It's how you was raised.
2045,"Nigger, Negro, black, AfricanAmerican."
2046,No matter how you see me...
2047,...you see me as different.
2048,You see me like that jury sees me.
2049,You are them.
2050,"Now, throw out your points of law, Jake."
2051,If you was on that jury...
2052,...what would it take to convince you to set me free?
2053,That's how you'll save my ass.
2054,That's how you'll save us both.
2055,RUFUS: Is Carl Lee Hailey insane?
2056,It's a notion so outrageous...
2057,...the only witness the defense could produce to support it...
2058,...was a convicted felon.
2059,No. Carl Lee Hailey is not insane.
2060,This is a man who is a confessed murderer.
2061,This is a man who admitted on this stand...
2062,...to carrying out the sentences he believed the alleged rapists...
2063,...of his daughter deserved.
2064,He's taken justice out of your hands.
2065,And put it in his own.
2066,"And with those hands, he took the lives of two young men."
2067,GUN CLATTERS We feel terrible over what happened to his daughter.
2068,But feeling terrible...
2069,...and knowing something is wrong does not give any of us...
2070,...a right to kill.
2071,"Ladies and gentlemen, your duty is clear."
2072,All in this courtroom know the truth.
2073,All in this state know the truth.
2074,"Now you need only find the courage to speak the words: ""Carl Lee Hailey is guilty."" Guilty. Guilty."
2075,"State rests, Your Honor."
2076,"Now, I had a great summation all worked out..."
2077,...full of some sharp lawyering.
2078,But I'm not going to read it.
2079,I'm here to apologize.
2080,"I am young, and I am inexperienced."
2081,But you cannot hold Carl Lee Hailey responsible...
2082,...for my shortcomings.
2083,"But you see, in all this legal maneuvering..."
2084,...something has gotten lost.
2085,And that something is the truth.
2086,"Now, it is incumbent upon us lawyers not to just talk about the truth..."
2087,"...but to actually seek it, to find it, to live it."
2088,My teacher taught me that.
2089,"Let's take Dr. Bass, for example."
2090,"Obviously, I would've never knowingly put a convicted felon on the stand."
2091,I hope you can believe that.
2092,But what is the truth?
2093,That That he's a disgraced liar?
2094,What if I told you...
2095,"...that the woman he was accused of raping was 17, he was 23..."
2096,"...that she later became his wife, bore his child..."
2097,...and is still married to the man?
2098,Does that make his testimony more or less true?
2099,What is it in us that seeks the truth?
2100,Is it our minds?
2101,Or is it our hearts?
2102,I set out to prove a black man could receive a fair trial in the South...
2103,...that we are all equal in the eyes of the law.
2104,That's not the truth.
2105,Because the eyes of the law are human eyes...
2106,"...yours and mine, and until we can see each other as equals..."
2107,...justice is never going to be evenhanded.
2108,It will remain nothing more than a reflection of our own prejudices.
2109,So until that day...
2110,...we have a duty under God to seek the truth...
2111,"...not with our eyes, and not with our minds..."
2112,...where fear and hate turn commonality into prejudice...
2113,...but with our hearts...
2114,...where we don't know better.
2115,I wanna tell you a story.
2116,And I ask you all to close your eyes...
2117,...while I tell you this story.
2118,I want you to listen to me.
2119,I want you to listen to yourselves.
2120,"Go ahead. Close your eyes, please."
2121,This is a story about a little girl...
2122,...walking home from the grocery store one sunny afternoon.
2123,I want you to picture this little girl.
2124,"Suddenly, a truck races up."
2125,Two men jump out and grab her.
2126,Drag her into a nearby field...
2127,...and they tie her up.
2128,And they rip her clothes from her body.
2129,Now they climb on.
2130,"First one, then the other."
2131,Raping her.
2132,Shattering everything innocent and pure with a vicious thrust...
2133,...in a fog of drunken breath and sweat.
2134,And when they're done...
2135,...after they've killed her tiny womb...
2136,...murdered any chance for her to bear children...
2137,...to have life beyond her own...
2138,...they decide to use her for target practice.
2139,So they start throwing full beer cans at her.
2140,They throw them so hard...
2141,...that it tears the flesh all the way to her bones.
2142,Then they urinate on her.
2143,Now comes the hanging.
2144,They have a rope.
2145,They tie a noose.
2146,Imagine the noose coiling tight around her neck...
2147,...and a sudden blinding jerk.
2148,She's pulled into the air and her feet and legs go kicking....
2149,They don't find the ground.
2150,The hanging branch...
2151,...isn't strong enough.
2152,It snaps and she falls...
2153,...back to the earth.
2154,So they pick her up...
2155,...throw her in the back of the truck...
2156,...drive out to Foggy Creek Bridge...
2157,...pitch her over the edge.
2158,And she drops some 30 feet down to the creek bottom below.
2159,Can you see her?
2160,Her raped...
2161,...beaten...
2162,...broken body...
2163,...soaked in their urine...
2164,...soaked in their semen...
2165,...soaked in her blood.
2166,Left to die.
2167,Can you see her?
2168,I want you to picture...
2169,...that little girl.
2170,Now imagine she's white.
2171,"The defense rests, Your Honor."
2172,Innocent! He's innocent!
2173,Innocent! He's innocent!
2174,Hailey's innocent!
2175,CROWD CHEERING KLAN JEERING He's innocent!
2176,NURSE: We won! We won!
2177,"Ellen, we won! Aren't you happy?"
2178,"Oh, my God, Ellen, you have to be happy."
2179,He's innocent. Carl Lee is innocent.
2180,GWEN: He's coming home.
2181,CARL LEE: Jake.
2182,That was....
2183,That was....
2184,"Hey, I'm one of the bad guys, remember?"
2185,Thank you.
2186,Thanks.
2187,CROWD CHATTERING SHERIFF: Freddie Lee Cobb!
2188,We got something to talk about.
2189,Hastings...
2190,...you belong over there with them.
2191,Get over.
2192,"Congratulations, counselor."
2193,Thank you.
2194,REPORTERS TALKING INDISTINCTLY MAN: You must be overwhelmed right now.
2195,MAN: Give me After you Yeah.
2196,CHATTERING Was I good or what?
2197,WOMAN: All right.
2198,GWEN: Oh. Hahaha.
2199,Here you go.
2200,Carl Lee. Look.
2201,CARL LEE: What?
2202,Well.
2203,Hello.
2204,CARLA: Hi.
2205,JAKE: Hi there.
2206,"Hannah, this is Miss Hailey."
2207,This is Hannah.
2208,Hi.
2209,"GWEN: Hi, Hannah. Ain't she so pretty."
2210,CARLA: Thank you.
2211,Brought you some peach cobbler.
2212,"GWEN: Oh, thank you."
2213,Come on in. Come in.
2214,Howdy.
2215,"Hannah, this is my daughter, Tonya."
2216,"Hi, Tonya."
2217,"Hi, nice to meet you, Hannah."
2218,Just thought our kids could play together.
