,dialog
0,"MAN 1: Yeah! Go, buddy, go!"
1,MEN LAUGHING MAN 2: That baby's going scared. Hahaha.
2,MAN 1: Whoo! Yeah!
3,"Hell, yeah!"
4,"Excited, yeah?"
5,"Go, baby! Ooh!"
6,MAN 1: Yeah!
7,"MEN CHATTERING I don't wanna do nothing TIRES SKIDDING AND MEN LAUGHING We got her, bro. Here we go."
8,BILLY RAY: Give me one.
9,"Get them, get them, get them."
10,"Hey, boys!"
11,How y'all doing today?
12,What are you looking at?
13,You wanna get shot?
14,You wanna get shot? Woohoo!
15,"PETE: Go, baby!"
16,Got it!
17,Pearl Harbor! Pearl Harbor!
18,PETE AND BILLY RAY LAUGHING PETE: Hey!
19,And here's another one.
20,"Watch this, Billy Ray!"
21,Hundred points!
22,Yeah!
23,"It's a beautiful day, isn't it?"
24,TONYA: Uhhuh.
25,"BOTTLE BREAKS Bye, Tonya."
26,TONYA: Bye.
27,"BILLY RAY: Clean up that mess, boy."
28,"Pete, hungry?"
29,Huh?
30,Hey. Hahaha.
31,"Oh, you're not having anything?"
32,"Yeah, I'm having them."
33,"Course, it's shit."
34,"JAKE: Bye, girls."
35,"WOMAN & GIRL: Bye, Daddy."
36,"JAKE: Let's go, Max."
37,"Get in the house, pup. Harry Rex."
38,"All those weekends, fishing, drinking, lounging..."
39,...opportunities lost to doityourself house renovations.
40,"Tragic, just tragic, Jake."
41,Yeah.
42,"Makes Carla happy, my man."
43,Spent four marriages trying to figure out what makes women happy.
44,You have spent four marriages...
45,"...trying to figure out what makes you happy, who you kidding?"
46,"Oh, yeah. Maybe that's it."
47,"Yeah, maybe."
48,Swiggy?
49,"Lord, please let my car be fixed today."
50,"HARRY REX: Oh, dear."
51,"Hey, who's that?"
52,She looks a little young.
53,Hold this.
54,What are you gonna do?
55,"You know how I say if they're old enough to crawl, they're in the right position."
56,What are you gonna do?
57,What are you gonna do? You crazy.
58,PETE: Whoo! Yeah! Fifty points!
59,BILLY RAY: Hahaha.
60,"PETE: Yeah, you good, boy."
61,TONYA SCREAMS BILLY RAY: Shut up!
62,TONYA: Daddy!
63,BILLY RAY: Hey!
64,Shut up.
65,TONYA: Daddy!
66,Shut up.
67,I'll kill you.
68,PETE: My turn.
69,TONYA CRYING: Daddy!
70,PETE: Shut up.
71,TONYA: Daddy.
72,TONYA SCREAMS PETE: Yeah.
73,CHILDREN: Mom! Mama!
74,Mom! Mama!
75,Mom!
76,Mama!
77,Mom.
78,CHILDREN SPEAKING INDISTINCTLY What is this?
79,CHILDREN IN UNISON: Groceries.
80,Y'all didn't see her?
81,"CHILDREN: No, ma'am."
82,Carl Lee! Stop!
83,You got a call from your wife!
84,What? What?
85,"INAUDIBLE DIALOGUE JAKE HUMMING JAKE: How many appointments do we have today, Ethel?"
86,ETHEL: Not a one.
87,But it is the 1st of the month again and guess what.
88,The checks are pouring in and we have enough money to pay all our past debts.
89,That'll be your last drink.
90,"Just keep us no more than one month behind on any vendor, please."
91,"Why, you have been drinking."
92,Two months.
93,"Well, these are the most delinquent."
94,The rent's in there.
95,"I appreciate the practice, capitán, I do, but you could've left me a couple of clients."
96,"GWEN CRYING: Baby, here's Daddy."
97,"Oh, no."
98,"I'm here, baby. Daddy's here."
99,"TONYA: Daddy, I'm sorry I dropped the groceries."
100,"That's all right, baby. It's all right, baby."
101,"I'm sorry, Daddy."
102,CARL LEE: That's all right.
103,Look at this.
104,SHERIFF: Billy Ray?
105,"Sorry, sir, but we don't allow no AfricanAmericans in here. Ha, ha."
106,"Billy Ray Cobb, you and Mr. Willard need to come with me."
107,"Hell, no. I ain't moving."
108,You know that little girl you took for a ride?
109,BILLY RAY: Mm.
110,What little girl?
111,I got bad news for you. She didn't die.
112,So unless there's another redneck asshole got a soupedup yellow pickup...
113,"...with a Confederate flag in the windshield Blue gums, why don't you take your black ass out of here and grab a branch."
114,Unless you got an explanation for what this was doing in the bed of your truck...
115,"...you're going to jail. Now, get up."
116,"You can go to hell, nigger."
117,Unh! Goddamn!
118,MAN: Hey!
119,"BILLY RAY GRUNTING Now, you earned the right to remain silent."
120,"Here you go, just the way you like them."
121,Thank you.
122,"Dell, sugar, today I'm gonna have DELL: Go to hell, Harry."
123,"On second thought, I'm just gonna watch baby eat his."
124,I am not the one who handled her divorce.
125,Can't she see I'm shriveling away here?
126,I'm shriveling.
127,"Say, Jake?"
128,"Yeah, what's up, Dwayne?"
129,Didn't you defend Billy Ray Cobb few years back?
130,What kind of case was it?
131,Caught him selling dope.
132,Spent time in Parchman.
133,Got out last year.
134,"No, I think some Memphis lawyer handled that."
135,Why do you ask?
136,"Well, we picked him up for rape."
137,Him and Pete Willard.
138,Who'd they rape?
139,You know Carl Lee Hailey?
140,"Sure, I defended his brother Lester."
141,It was his little girl.
142,Little Tonya?
143,Yeah.
144,How old is she?
145,She's 10.
146,"Mr. Willard, I'm Sheriff Ozzie Walls."
147,My mama voted for you.
148,I seen you play for the Rams.
149,"Way I figure, a nigger sheriff's okay, been on TV and all."
150,No offense.
151,SHERIFF: What's your full name?
152,James Lewis Willard.
153,"Four, which is a difference of 110.60."
154,FOOTSTEPS APPROACHING Who's there?
155,Carl Lee.
156,How is she?
157,CARL LEE: She holding on.
158,"Doctor says she ain't out of the woods yet, though."
159,"They worked her over something good, Jake."
160,You remember them four white boys raped that little black girl in the Delta last year?
161,Yeah.
162,"They, uh...."
163,"They got off, didn't they?"
164,Yeah.
165,Jake....
166,"I was in a jam, you'd help me out, wouldn't you?"
167,"Sure, Carl Lee."
168,What kind of jam you talking about?
169,"You got a daughter, Jake."
170,What would you do?
171,"Dream some good dreams, baby girl."
172,"Good night, Daddy."
173,"WHISPERS Night, baby."
174,Is she asleep?
175,Yeah.
176,Is she the sweetest thing?
177,"Yeah, she is."
178,Next to you.
179,"Tell you what, I look at her, though, and I cannot help but think about little Tonya."
180,Don't.
181,Don't do that to yourself.
182,Yeah.
183,Something else wrong?
184,Tonya's father...
185,...Carl Lee Hailey...
186,...came by the office today.
187,"Man's heart is torn wide open, baby."
188,"I don't know, but..."
189,...sounded to me like he was thinking about doing something.
190,Like what?
191,Something like maybe killing those two boys.
192,Was he serious?
193,I don't know. I don't know.
194,"It could've been just the hurt talking, you know?"
195,But when you think that it's possible that those two animals could...
196,...go free...
197,...and be walking the streets....
198,I....
199,I don't know.
200,"After what that man has been through, he's probably capable of anything."
201,Somebody should do something.
202,You should call Sheriff Walls.
203,Yeah.
204,To release the owner from assessment.
205,I hope I'm having a heart attack because then I'd get to sue you.
206,"Don't stand on ceremony, come on in."
207,What? No clients?
208,"Just waiting to pick yours up on appeal, Harry."
209,"And you, are you on vacation?"
210,"Fortunately for me, my lovely..."
211,...divorce doesn't go on vacation.
212,However...
213,"...not even the richest, most ridiculous settlement I ever bring in..."
214,...is gonna be as satisfying as watching those two hyenas...
215,...across the street get what's coming to them.
216,"Oh, dear."
217,"You know I'm a fool for those, um, Germantype convertibles."
218,"CHUCKLES Come on, lover boy, let's get to court."
219,Lucien thinks the two hyenas just might get off.
220,You saw Lucien?
221,When? Where?
222,How is he?
223,Has he been eating any better?
224,Just curious.
225,"Um, Miss Ethel..."
226,"...refresh my recollection, how long were you and Lucien together for exactly?"
227,We were never together.
228,I was his secretary for 20 years.
229,"Come on, old girl."
230,"You can tell us, you know."
231,He was your boyfriend.
232,"I am an upstanding, Godfearing, respectable Southern woman..."
233,...with unimpeachable morals who has been happily married for 27 years.
234,And I have never had or ever will have any boyfriend.
235,And if I did...
236,...it certainly would not be that old pickled scoundrel Lucien Wilbanks.
237,"DOOR SLAMS She did him. Oh, yeah, a lot."
238,"DWAYNE: All right, Billy Ray, step on back."
239,Come on out. Willard.
240,"All right, boys, today's your big day."
241,We're gonna take a trip to the courthouse.
242,The judge is gonna set your bail.
243,"Then we're gonna come back here, all nice and peacefullike."
244,"I get any trouble out of you, I'm going to integrate this jail."
245,"INAUDIBLE DIALOGUE HANNAH: Mama, Daddy's home!"
246,Daddy's home!
247,"CARLA: Hannah girl, let's go inside for a minute."
248,Give Daddy some time to himself.
249,"Let's Let's find a book, okay?"
250,HANNAH: I wanna see Daddy.
251,CARLA: Honey?
252,Jake? Jake? Are you hurt?
253,"Jake, what happened to you?"
254,"Jake, honey, are you okay?"
255,What happened to you?
256,What is this? What is going on with you?
257,What happened?
258,"Jake, baby."
259,What happened?
260,"SIRENS WAILING CRYING Okay, okay."
261,"See you, Gwen."
262,WOMAN: Is the sheriff gonna make a statement?
263,"HASTINGS: He might, he might not. I don't know."
264,MAN: Is it firstdegree murder?
265,HASTINGS: I'm not sure yet.
266,WOMAN: What happened?
267,Can you tell us something?
268,"MAN: Sheriff, will you give us a statement."
269,I got no comment. No comment.
270,"Hey. Hey, Jake."
271,"Hey, Jake, Carl Lee said you'd be coming."
272,"WOMAN: Sir, are you an attorney?"
273,MAN: Are you an attorney?
274,"Now, I'll make a statement."
275,I want y'all to get these vans out of here.
276,"WOMAN: Sir, we've gotta get something for our newscast."
277,"DOOR LOCKING Didn't think I'd do it, did you?"
278,How you holding up?
279,I ain't had nothing against them boys till they messed with my baby.
280,"And I feel sorry for their mamas and their daddies, but..."
281,...I ain't sorry for what I done.
282,How's Looney?
283,You blew his knee right off his leg.
284,Doctors are still with him.
285,What's gonna happen to me now?
286,There's gonna be a preliminary hearing.
287,Probably tomorrow.
288,"After that, Buckley will push for a fast trial."
289,Who's Buckley?
290,Rufus Buckley.
291,District attorney.
292,"He's mean, he's ambitious, and he's gonna eat this up because of the publicity."
293,"But you've done beat him, ain't you?"
294,Yeah.
295,Not in a murder case.
296,Think I can win?
297,"All depends on the jury, Carl Lee."
298,"Pick the right jury, and you walk."
299,DA picks the jury...
300,...and you get the gas.
301,"Well, how much?"
302,How much a case like this cost?
303,Probably 50 grand.
304,SIGHS I can pay maybe 10.
305,"CARL LEE SIGHS Well, not a lot of white lawyers would've took my brother Lester's case."
306,You did and got him off.
307,I figure there's a lot of people out there tired of all the raping and killing.
308,They'd be sympathetic to a man who took the law into his own hands...
309,...even if he is black.
310,"You said you'd help me out if I was in a jam, Jake."
311,"Well, I'm in one now."
312,What you say?
313,"MAN: What can you tell us, sheriff?"
314,WOMAN: Can you tell us what happened?
315,Are you with the police department?
316,"No, I am a lawyer."
317,Are you Carl Lee Hailey's attorney?
318,"Sir, are you Mr. Hailey's attorney?"
319,"Yes, I am."
320,"What's your name, sir?"
321,Brigance. Jake Brigance.
322,That's with one G.
323,MAN: Hailey's hired an attorney.
324,Jake Brigance.
325,RUFUS CHUCKLING And today ain't even my birthday.
326,Brigance couldn't tie his own tie without that old drunk Wilbanks.
327,Telling the press he never lost a murder case.
328,"Well, he's never tried one against me, has he?"
329,What time's the preliminary?
330,Tomorrow at 3.
331,Judge Omar Noose presiding.
332,"Oh, I was wrong. It is my birthday."
333,"All right. First things first, Brigance will file for a change of venue."
334,Guy would be a fool if he didn't.
335,Why's that?
336,Why?
337,"Should we tell our young, uninformed law clerk..."
338,...the reality of jurisprudence in this county?
339,"Evelyn, get me the state file on race statistics."
340,"You see, Taylor, it's quite simple."
341,"This county's 26, 30percent black, give or take."
342,"Almost every other county is 40, 45, in some cases 70percent black."
343,Blacks are more sympathetic to other blacks.
344,"If he gets it moved, he has a greater chance of color in the jury."
345,We know what that means.
346,"But if the trial stays here, it's an allwhite jury for sure."
347,"Now, Taylor, this is for you..."
348,...to integrate your brain with before 3:00 tomorrow.
349,TAYLOR: Yes.
350,He means without blacks on the jury...
351,...Hailey hasn't got a chance in hell.
352,"RUFUS: All right, Noose is up for reelect?"
353,"Yeah, November."
354,Reach out to our friends in the legislature.
355,Have them call on Noose. We're gonna help him decide to keep this case in Canton.
356,"Also, send a case of whatever it is he's drinking these days to Lucien Wilbanks."
357,I believe that's Dewars.
358,Keep that old drunk on the sidelines.
359,"Yeah, get me Sam."
360,"RUFUS: And, gentlemen?"
361,No mistakes.
362,This is the one we've been waiting for.
363,LUCIEN: Justifiable homicide will never hold up.
364,JAKE: Then my only chance is to find a shrink who'll testify...
365,...Carl Lee was insane at the time of the murders.
366,"Well, I might know a man who owes me a favor."
367,You'll file for change of venue.
368,Of course.
369,Judge Noose denies it...
370,...then you'll get an allwhite jury and you'll lose.
371,Thank you for the encouragement.
372,"Well, bear in mind that Mr. Hailey is as guilty as sin under our legal system."
373,"It does not permit vigilante violence, and he took the law into his own hands."
374,He murdered two people.
375,Two people who had raped his 10yearold daughter.
376,You know...
377,...you can win this case...
378,...and justice will prevail.
379,But lose...
380,...and justice will also prevail.
381,"Now, that's a strange case."
382,Yeah.
383,I could use your help.
384,"The sons of bitches decertified me, Jake."
385,I swore I will never enter another courtroom ever.
386,"Lucien, you're the best lawyer I've ever seen."
387,"Now, I know how much it hurt when they took your license away..."
388,...but they can't take your mind unless you let them.
389,Good speech.
390,"Well, I had a good teacher."
391,"Now, you remember when I came to you out of law school?"
392,In a ridiculous blue suit.
393,Yeah.
394,"Now, you sat me down and you said to me, ""Young man, I cannot promise you riches."
395,What I can offer you is a chance to save the world...
396,"...one case at a time."" Well, I'm saying the same words back to you right now."
397,"How about it, Lucien?"
398,MINISTER: The Lord is my shepherd.
399,I shall not want.
400,He maketh me to lie down in green pastures.
401,He leadeth me beside still waters.
402,"Yea, though I walk through the valley of the shadow of death..."
403,"...I will fear no evil, for thou art with me."
404,Thy rod and thy staff comfort me.
405,Thou preparest a table before me....
406,"Sure am sorry about your brother, Freddie."
407,Old Willard too.
408,"Good boys, both."
409,"Ten years ago, that nigger would be hanging by the end of a rope..."
410,...with his balls in his mouth.
411,You tell me what's wrong with this country.
412,Klan would know what to do.
413,"My granddaddy, he was Klan."
414,Ain't no Klan around here for years.
415,"Oh, there's still some boys around."
416,Them skinheads who want to blow up the government?
417,"No, sir. Good Godfearing Klan."
418,"I got a friend, used to be active."
419,I could give him a call.
420,"You do that, Winston."
421,You tell them boys we need some Klan down here in Canton.
422,I mean right quick.
423,"CARLA: Hurry up, honey."
424,"JAKE: Coming, coming, coming."
425,MAN ON TV: Something you can tell us?
426,WOMAN ON TV: What did Carl Lee tell you?
427,JAKE: There's Ozzie.
428,To our family's television debut.
429,To the big time.
430,I cannot believe he didn't take you seriously when you warned him.
431,"Well, baby, you know, some folks think those boys got what they deserved."
432,"Here, sweet pea. Carl Lee Hailey may very well spend his life in prison."
433,That is nothing his family deserves.
434,Yeah.
435,You did call Ozzie Lookit here. Look who's CARLA: Daddy's on TV.
436,I intend to show the men and women of the South to look past color and see the truth.
437,"That here in the South In the new South, justice is and will be colorblind."
438,"PHONE RINGING Impressive. Honey, that was really good."
439,Hmm?
440,Isn't Daddy smart?
441,HANNAH: Mmhm.
442,Yeah. Brigance.
443,Mmhm.
444,That was great.
445,"Yeah. No, we just saw it."
446,"All right, Harry Rex. Yeah."
447,"Baby, I'm proud of you."
448,"PHONE RINGS Good stuff, huh?"
449,Mmhm.
450,You hear this?
451,Put it on speakerphone.
452,Don't be gross.
453,Ahem. F. Lee Bailey's office.
454,MAN OVER PHONE: Brigance.
455,"You niggerloving sonofabitch, you won't live if the nigger walks."
456,"Hey, hey. Hey."
457,WOMAN: Do you have any sympathy for the defense?
458,"Well, of course I do, Stephanie."
459,"You're a mother, I'm a father."
460,We all have families. Who wouldn't?
461,Don't presume the district attorney is insensitive.
462,But the people of the state of Mississippi...
463,...entrusted this office to uphold the law of the land.
464,Our society cannot condone men who take the law into their own hands.
465,No matter the circumstance.
466,"If you get a conviction, will you ask for the gas chamber?"
467,"Yes, I will seek the death penalty for Mr. Hailey."
468,WOMAN: What do you think of Mr. Brigance?
469,Isn’t that boy still in law school?
470,"Say hey to your husband for me, Kim."
471,That's all.
472,"REPORTERS CHATTERING Hey, Cora Mae, don't you worry."
473,"Hey, Wayne, how are you?"
474,MAN: Good luck.
475,"You plead him guilty today, I'll ask for life."
476,"Otherwise, he dies."
477,"You drop your case now, and I won't bury you before the entire county, Rufus."
478,All rise.
479,Court is in session.
480,The Honorable Omar Noose presiding.
481,"Good afternoon, citizens."
482,Be seated.
483,Counsel.
484,"And you, sir."
485,Are you Carl Lee Hailey?
486,"Yes, sir."
487,"Uh, Mr. Hailey, I am holding a copy of an indictment returned..."
488,"...by the grand jury of Mississippi presenting that: ""Carl Lee Hailey did murder Billy Ray Cobb, a human being..."
489,"...and James Lewis Willard, a human being..."
490,"...and did attempt to kill Dwayne Looney, a peace officer..."
491,"...against the peace and dignity of the state of Mississippi."" Now, do you understand the charges against you?"
492,"Yes, sir."
493,How do you wish to plead?
494,"Not guilty, Your Honor."
495,"The defense enters a plea of not guilty by reason of insanity, Your Honor."
496,Your trial is set for July 22.
497,All pretrial motions and matters should be filed no later than July 8.
498,Is there anything further?
499,RUFUS: Yes.
500,"Your Honor, in response to the insanity plea..."
501,...the state requests the defendant be examined by its own doctors.
502,Request granted.
503,"Additionally, the state opposes any request for bail."
504,"Your Honor, we haven't yet asked for bail."
505,"Now, Governor Buckley cannot oppose a request until one is made."
506,He should've learned that in law school.
507,"Your Honor, even Mr. Brigance's meager legal experience..."
508,...should've taught him two things.
509,"One, I have not been elected governor yet."
510,"And number two, he is required to request bail."
511,The state opposes any such request.
512,"In the future, why don't we just wait till he makes the request, huh?"
513,"JAKE: Thank you, Your Honor."
514,"Your Honor, we would like to request bail."
515,Denied.
516,I have never allowed bail in a capitalmurder case...
517,...and don't feel that an exception is called for today.
518,Good enough.
519,We will be filing for a change of venue.
520,I anticipated this.
521,"Let me save you some time, Mr. Brigance."
522,Your motion is denied.
523,"JAKE: Your Honor, we have not yet filed."
524,"We are simply indicating our intent to file in writing by letting you I said, request denied."
525,Your Honor...
526,...how can you summarily deny this request?
527,It is quite clear that Carl Lee Hailey cannot receive a fair trial here.
528,"Now, we feel That's enough. Sidebar."
529,"Your Honor, we have a right Mr. Brigance."
530,I will not tolerate grandstanding in my courtroom.
531,QUIETLY Get back to work.
532,"Excellent technique, counselor."
533,Your Honor.
534,We feel it would be remiss not to tell you that in State v. Johnson...
535,...and State v. Fisher...
536,...both in 1985...
537,...failure to properly consider a change of venue...
538,...has been a reversible decision on appeal to the state supreme court.
539,No.... No trial judge likes his rulings overturned.
540,I guess you get to submit that brief after all.
541,Have it on my desk by Tuesday morning.
542,"Mr. Hailey, you are hereby ordered..."
543,...to remain in custody of the Madison County sheriff until trial.
544,Dismissed.
545,Find me that state doctor.
546,What's his name? Rodeheaver.
547,Get him down here to interview Hailey.
548,"Since he's not able to afford a real one, find who Brigance is using for a shrink."
549,I want him discredited.
550,You want professional or personal dirt?
551,I don't wanna know how.
552,Get me enough to shatter him.
553,We can do that. Taylor.
554,"This is $900, Carl Lee."
555,We said a thousand down.
556,My kids gotta eat.
557,Mine too.
558,"All right, when do I get the rest?"
559,"Them folks over at the bank, they won't loan me no money on my house."
560,Why not? Your house is almost paid for.
561,You borrowed on it before for Lester's trial.
562,Said I wasn't in jail before.
563,"Said to Gwen, how am I gonna pay sitting on death row?"
564,And I lost my job at the mill.
565,They called Gwen.
566,"Worked 20 years, I'm out five days and they fired me."
567,"Carl Lee, I can't try a capitalmurder case for $900."
568,"Carl Lee, I need to live."
569,"Me too, Jake."
570,I need to live too.
571,JAKE HUMMING Nice night.
572,"Finder of precedents, mystery woman of the courthouse."
573,ELLEN: Yup. Care for a beer?
574,I assume that's the infamous changeofvenue motion under your arm.
575,Mmhm.
576,Ellen Roark. ROARK.
577,"That's Roark in Boston, but it seems to be Roark in Mississippi."
578,"Boston, huh?"
579,"Yup, I was born there."
580,My father's the notorious Sheldon Roark.
581,"Attorney to the stars, yes."
582,Duly impressed.
583,"What brings you to Mississippi, Roark?"
584,Slumming?
585,"No, law school at Ole Miss."
586,It's a.... It's a family tradition.
587,Mom was a sweet little sorority girl there till Dad Till Dad married her.
588,I married a sweet little sorority girl from Ole Miss myself.
589,"Well, they have an excellent selection."
590,"Yes, they do."
591,"Now, really, what brings you to Canton?"
592,I'm not believing they don't have cars to sit on on campus.
593,Carl Lee Hailey.
594,Really like to help you with the trial.
595,"Now, what makes you think I need help?"
596,You're trying one of the largest murder cases...
597,...these parts have seen and you work alone.
598,"You have no paralegals, no clerks, researchers..."
599,...nor can you afford to hire any...
600,...so if Noose doesn't accept that motion under your arm...
601,...you go to trial in less than a month.
602,"Trust me, you need help."
603,"Now, how do you know this?"
604,"Well, I'm an excellent researcher."
605,I see that.
606,"Look, I've played gofer..."
607,"...for 7 capitalmurder cases, I've witnessed 2 executions..."
608,"...I have written briefs for the ACLU, I'm top 5 percent of my class..."
609,"...editor of the law review, I'm published, I'm young."
610,And when I graduate...
611,...I intend to spend a glorious career stomping out the death penalty.
612,"Let's see, what else?"
613,"Oh, genius runs in my family."
614,You'll get me on the way up...
615,"...and I really think, you know, now is a good time to, you know, grab me."
616,Mmhm.
617,Is there anything else I should know?
618,"Uh, let's see, anything else?"
619,"Oh, my father's filthy rich, so I'll work for free."
620,What do you think?
621,I think I'll drop this brief off in Noose's night slot.
622,Go home and see my family.
623,"Thank you, Roark, but I can handle the case myself."
624,Uh....
625,You might wanna look at these precedents.
626,Look at State v. Cooper and State v. Roundtree.
627,"Both revenge killers, both acquitted."
628,You'll change your mind.
629,See you.
630,MAN: Get out. Come on.
631,Wait.
632,Come on.
633,"Mr. Cobb, this is Stump Sisson, grand dragon of Mississippi."
634,He heard you were looking to see us.
635,"You were right to call us, Mr. Cobb."
636,They say the Klan is dead.
637,Klan don't show up for a few years and people say the Klan is dead.
638,"Fact is, it just looks dead."
639,The Klan has always been right there...
640,...under the surface.
641,Just waiting for the opportunity to deliver God's justice.
642,I wanna help.
643,I wanna kill that nigger.
644,Niggers got plenty of protection nowadays.
645,They got the NAACP and the ACLU.
646,Even the federal government.
647,Hell.
648,White folks ain't got a chance.
649,Except the Klan.
650,I'm gonna tell you what.
651,You get five or six of your friends of similar thinking...
652,...and we'll initiate the Madison County Klavern.
653,Even make you leader.
654,"Now, you tell me..."
655,...who's that nigger's lawyer?
656,Local boy.
657,His name's Brigance.
658,He's got a pretty good reputation.
659,He got family?
660,"Yes, sir. He...."
661,He has a wife and a daughter.
662,Good.
663,"OFFICER OVER RADIO: Two, two."
664,What the hell is he doing here?
665,"SHERIFF: Now, calm down."
666,No.
667,"Come on, calm down."
668,Calm down.
669,BOY: He has no right after what he did.
670,"No, he's got no right, sheriff."
671,SHERIFF: Don't get your mom upset now.
672,Looney?
