,dialog
1292,"What I need from you, Roark Do tell."
1293,"is a way to discredit the state's shrink, Dr. Rodeheaver."
1294,Unless you discredit the shrink....
1295,Carl Lee does not have a chance. Ow.
1296,Mm.
1297,Sorry. Sissy.
1298,I think he's got a very good chance.
1299,There you go. I think you're gonna live.
1300,All right.
1301,Thanks. Whoo.
1302,Good butt.
1303,"JAKE CLEARS THROAT Ugh. So, uh...."
1304,What do you folks do around here to blow off steam...
1305,...besides trying to kill each other?
1306,You got discos or strip bars or malls or anything to go to?
1307,Stump's dead.
1308,"He's dead, Freddie."
1309,"Come on, Freddie. Let's go on home."
1310,It's all over.
1311,It ain't near over.
1312,How you doing? Good to see you.
1313,Excuse me.
1314,"Hey, I'll be right back."
1315,Here are your mud bugs.
1316,JAKE: Mmhm.
1317,"WAITRESS: There you go, darling."
1318,Anything else?
1319,"Yeah, a couple of dinner specials..."
1320,...and some fried dill pickles.
1321,"WAITRESS: You got it, honey."
1322,"Thank you, Sugar."
1323,That wasn't sexist at all.
1324,"Really, I never order my own food."
1325,I can't do another shot.
1326,"All right, fine, I'll take another shot."
1327,Just a splash.
1328,Just a splash.
1329,All right.
1330,To....
1331,To....
1332,Carl Lee Hailey.
1333,May our jury find that man loony as a proverbial fruitcake.
1334,"Hear, hear."
1335,No more.
1336,"So, um...."
1337,Do you think he was crazy when he did it?
1338,"No, he wasn't crazy."
1339,He told me he was gonna do it.
1340,I tried to tell myself he wasn't serious.
1341,I think I really wanted him to do it.
1342,I came home that night and I was looking at Hannah laying there...
1343,...looking how tender she is.
1344,All I could think about was all the monsters out there...
1345,...and any one of them can come steal her innocence.
1346,"Take her life, if they wanted."
1347,"Yeah, I wanted those boys dead."
1348,You're goddamn right I did.
1349,I guess I helped killed them.
1350,"So tomorrow, when we get in court..."
1351,...it's not just Carl Lee I'm trying to get off.
1352,"MEN SHOUTING INDISTINCTLY MAX BARKING FREDDIE: Burn in hell, Brigance!"
1353,KLANSMEN CHEER ELLEN: Good job.
1354,ELLEN SIGHS JAKE: Nice place How is it you'll drive an hour and half...
1355,"...outside of town to take me to dinner, but you have no problem..."
1356,...walking me into my motel room?
1357,"Well, with everything that's going on..."
1358,...I don't think we can be too careful.
1359,Just wanna make sure it's all safe in here.
1360,ELLEN: I'm not scared.
1361,"Oh, yes, I am."
1362,Of what?
1363,Of what's going to happen tomorrow.
1364,All the other cases I've worked on have only been paper defendants.
1365,"It's just I never knew the towns, and I never touched the lives or anything."
1366,So I don't know what it's like.
1367,JAKE SIGHS Tomorrow morning...
1368,...Buckley will try to kill Carl Lee Hailey.
1369,"Now, it's on us to stop him."
1370,Mmhm.
1371,"So tonight, go over the battle in your mind."
1372,"Argument, rebuttal, examination and cross. All of it."
1373,Mmhm.
1374,Remember something.
1375,Hmm.
1376,You are one of the good guys.
1377,Okay.
1378,And good guy has the spicy on her lip.
1379,Spicy.
1380,But still one of the good guys.
1381,I'm going home.
1382,"Lock the door behind me, Roark."
1383,I'll see you in the morning.
1384,"DOOR CLOSES OFFICER 1: It's gonna blow, sheriff. It's gonna blow."
1385,SIRENS WAILING OFFICERS SPEAKING INDISTINCTLY OVER RADIO OFFICER 2: Oz is right over there!
1386,"SHERIFF: Wait. Wait. Hold it, Jake. Hold it, Jake."
1387,JAKE: My dog's in there.
1388,Jake My dog's in there!
1389,Max!
1390,SHERIFF: Come on. Come on.
1391,Max!
1392,Max!
1393,It's too late.
1394,"OFFICERS SHOUTING INDISTINCTLY SOLDIERS IN UNISON: Move, move, move."
1395,"Hey, buddy."
1396,Seen my dog?
1397,Looking for my dog.
1398,"Max, come here, boy! Let's go!"
1399,"Come on, Max!"
1400,I booked you on the 9:15 to Gulfport.
1401,"Economy, of course."
1402,"Go see your wife and daughter, Jake."
1403,"What'd you do that for, Harry Rex?"
1404,We got trial in less than three hours.
1405,"Oh, come on."
1406,Noose would give you a continuance in a flash.
1407,NAACP boys be down here before lunch.
1408,Drooling.
1409,"Max, let's go, boy! Come on!"
1410,"Jake, listen to me."
1411,"Your marriage is on the rocks, you're about to have an affair."
1412,"Your career's in ruins if you're lucky, and if you're not, you're dead."
1413,"Don't get me wrong, my friend."
1414,"What you've put into this case, you even inspired me, and I'm I'm uninspirable."
1415,"Do everyone a favor, though."
1416,Drop the case.
1417,"No, I can't."
1418,I won't. I'm not gonna quit.
1419,"I quit now, and all this is for nothing. No."
1420,"Max, come on now."
1421,"Max, where are you? Come on, Max!"
1422,"Max is dead, and you're next."
1423,Walk away.
1424,"MAX BARKING Max. Come here, boy."
1425,"Come here. Come here, boy. Hahaha."
1426,Come here. Come here.
1427,"Who's got the goods, huh? Huh?"
1428,Pretrial strategy at my office in less than two hours...
1429,...and I expect to see your ass there.
1430,CROWD CHANTING: Free Carl Lee!
1431,Free Carl Lee! Free Carl Lee!
1432,Free Carl Lee! Free Carl Lee!
1433,Free Carl Lee!
1434,WOMAN: Fry Carl Lee.
1435,CROWD CHANTING: Free Carl Lee!
1436,KLAN CHANTING: Fry Carl Lee! Fry Carl Lee! Fry Carl Lee!
1437,CROWD: Free Carl Lee!
1438,Free Carl Lee! Free Carl Lee!
1439,KLAN CHANTING: Fry Carl Lee! Fry Carl Lee! Fry Carl Lee!
1440,Fry Carl Lee! Fry Carl Lee! Fry Carl Lee!
1441,"NOOSE: Now, Mr. Buckley, you may begin."
1442,"Thank you, Your Honor."
1443,Good morning.
1444,Good morning.
1445,"You are Cora Mae Cobb, the mother of Billy Ray Cobb the deceased, are you not?"
1446,"Yes, sir."
1447,And where were you when your son was murdered?
1448,I was right outside that door right there.
1449,Me and Freddie was waiting for his hearing.
1450,He was walking up the stairs...
1451,...in handcuffs.
1452,Can you tell us how old your son was at the time of his death?
1453,Twentythree.
1454,JAKE: You say your son was 23 when he died?
1455,Yes.
1456,"In those 23 years, Mrs. Cobb..."
1457,...how many other children did your son kidnap?
1458,"Objection, Your Honor! Objection!"
1459,"Sustained. You You are out of order, Mr. Brigance."
1460,Withdraw the question.
1461,The jury will disregard...
1462,...the last question from Mr. Brigance.
1463,"Mrs. Cobb, in your son's 23 years..."
1464,...how many other children did he rape?
1465,Mr. Brigance. In my chambers.
1466,Court will recess for lunch.
1467,GAVEL BANGS I don't get it.
1468,Why is he antagonizing the judge?
1469,He should've known Noose'd pull him into chambers.
1470,Of course he knew. Jake got to draw first blood and he knows that's more important.
1471,"Hello, Harry."
1472,"Hi, Rufie."
1473,"Sweetheart, come play on a winning team."
1474,"How's that impotence thing, Rufus?"
1475,"You're not being paid for the work you're doing, are you?"
1476,"No, sir."
1477,"Well, I guess Jake's paying you in other ways, then, isn't he?"
1478,LAUGHS Impotence?
1479,Yep. Girls talk.
1480,"Sheriff, if you would, will you please identify this weapon?"
1481,It's the weapon found at the scene.
1482,And were you able to identify any of the fingerprints found on this gun?
1483,Yes. The prints on the gun matched those of Carl Lee Hailey.
1484,RUFUS: You're sure?
1485,SHERIFF: Yes.
1486,"Your Honor, I'd like to enter this into evidence as Exhibit S18."
1487,We have no further use of this witness.
1488,JAKE: Sheriff Walls.
1489,Did you arrest Cobb and Willard?
1490,"Yes, I did."
1491,I arrested them for the rape...
1492,...and attempted murder of 10yearold Tonya Hailey.
1493,JAKE: And is it true that Pete Willard...
1494,...signed a written confession...
1495,...saying that he and Billy Ray Cobb did rape Tonya Hailey?
1496,"Objection. That's inadmissible, and Mr. Brigance knows it."
1497,"NOOSE: Mr. Brigance, I've spoken to you before."
1498,We are not trying the rape of Miss Hailey today...
1499,"...but the murder of two young men, and if you continue in this performance..."
1500,...I'll hold you in contempt.
1501,"Now, is that understood?"
1502,"Yes, sir."
1503,"I have no further questions, Your Honor."
1504,Yes.
1505,"You say something, sheriff?"
1506,"Yes, he did sign a confession."
1507,"Objection, Your Honor!"
1508,"NOOSE: Jurors, you will disregard the last remark of Sheriff Walls."
1509,Court is adjourned till tomorrow morning 9:00.
1510,I'm taking Bud back to Oxford.
1511,He always missed Oxford.
1512,"I don't know what to say, Ethel, I don't know."
1513,There's nothing you can say.
1514,I know you didn't want any of this to happen...
1515,...but it happened all the same.
1516,You wagered all our lives on this.
1517,"You just went ahead and did what you felt you had to do, no matter what the cost."
1518,Some folks think that's brave.
1519,"Not me, Jake."
1520,"Now, you may win..."
1521,...but I think we've all lost here.
1522,Would you help an old lady to her car?
1523,"You don't need any help, Ethel..."
1524,...but it would be my honor to escort you to your automobile.
1525,ELLEN GRUNTS Didn't like that one?
1526,Buckley is presenting his shrink tomorrow.
1527,I can't come up with one way to bring him down. Not one.
1528,"I keep asking myself, ""What would Jake do? What would my father do?"
1529,"What would Lucien do?"" That's your problem right there."
1530,"What you gotta ask yourself is, ""What would Harry Rex do?"" What would Harry Rex do?"
1531,Cheat.
1532,Cheat like crazy.
1533,"MAN 1: Yeah. Yeah, I did."
1534,I'll bring her around the side.
1535,Uhhuh.
1536,"MAN 2: Hey, Cheryl."
1537,Hi.
1538,WHISPERING So we gotta talk about it.
1539,"WHISPERING Now, wait a minute."
1540,The judge said absolutely not to discuss this case.
1541,That judge ain't stuck here away from his wife and kids.
1542,"The sooner we start talking about it, the sooner we can get home."
1543,I wanna get out of here just as much as anybody else.
1544,FOREMAN: Let's get on with it.
1545,Undecided?
1546,Four.
1547,Guilty?
1548,Seven.
1549,Not guilty?
1550,"That nigger's dead, y'all."
1551,"ELLEN: I know, I know. Folks in town just can't get enough of this trial."
1552,And that's why my editor said I needed to come down and interview Rodeheaver.
1553,I'm afraid Dr. Rodeheaver's in court today.
1554,Oh.
1555,If a pretty girl like you wants to be a reporter...
1556,...maybe she should do some better research?
1557,Yeah. Ha.
1558,"Well, um, you know what?"
1559,I don't I don't mind waiting...
1560,...because my paper really wants this interview...
1561,...so is he still in Room 369?
1562,I'll just go there.
1563,"No, dear. Wrong again. He's in 128."
1564,But he's gone all day.
1565,You can't see him today.
1566,You wanna come back to my office and we can schedule an appointment?
1567,You know what?
1568,I'll come back another time...
1569,"...when he's got time to talk, when things kind of die down."
1570,I appreciate it. Thank you.
1571,You can call me any time.
1572,Okay. Byebye.
1573,"Your Honor, the state calls Deputy Dwayne Looney."
1574,JAKE CLEARS THROAT RUFUS: Good morning.
1575,DWAYNE: Good morning.
1576,RUFUS: Would you please state your name for the record?
1577,DWAYNE: Deputy Dwayne Powell Looney.
1578,"RUFUS: Thank you, Deputy Looney."
1579,You were present at the murders of Billy Ray Cobb...
1580,"...and James Lewis Willard, were you not?"
1581,"DWAYNE: Yes, sir. I was."
1582,RUFUS: If you can remember...
1583,...describe how you were wounded for the members of the jury.
1584,"I think bullets bounced off the floor, caught me in the knee."
1585,And what happened to your leg?
1586,Doc cut it off.
1587,"And after the loss of your right leg, Detective Looney..."
1588,...are you still able to serve as a police officer?
1589,I'm able to perform....
1590,I'm able to perform a number of services.
1591,Did you get a good look at the man with the gun?
1592,"No, sir."
1593,"However, Mr. Hailey did personally apologize for his shooting me."
1594,Oh.
1595,So Mr. Hailey admitted shooting you.
1596,"Yes, sir."
1597,"RUFUS: I have no further questions, Your Honor."
1598,Mr. Brigance.
1599,"No questions, Your Honor."
1600,Wait a minute.
1601,"Uh, Mr. Buckley?"
1602,"Yes, Your Honor."
1603,The state would like to call Give me a moment to speak with my client.
1604,Take your time.
1605,Ask him if he thinks I ought to go to jail.
1606,"Carl Lee, they amputated his leg because you shot him."
1607,He's a witness for the prosecution.
1608,"You're my lawyer, ain't you?"
1609,Yeah.
1610,Ask him.
1611,"Your Honor, one question."
1612,"Make up your mind, Mr. Brigance."
1613,Deputy Looney.
1614,Do you think Carl Lee shooting you was intentional?
1615,"DWAYNE: No, sir."
1616,It was an accident.
1617,MOUTHS Ask him.
1618,Do you think he should be punished for shooting you?
1619,"No, sir."
1620,I hold no ill will toward the man.
1621,He did what I would've done.
1622,"What do you mean by that, Deputy Looney?"
1623,I mean I don't blame him for what he did.
1624,Those boys raped his little girl.
1625,"Objection, Your Honor. The witness's opinion on this matter is irrelevant."
1626,"Your Honor, I believe Deputy Looney has earned the right to speak here today."
1627,Overruled.
1628,Continue.
1629,"Go ahead, Dwayne."
1630,I got a little girl.
1631,"Somebody rapes her, he's a dead dog."
1632,I'll blow him away just like Carl Lee did.
1633,"Objection, Your Honor!"
1634,Do you think the jury should convict Carl Lee?
1635,"Don't answer that question, deputy."
1636,He's a hero. You turn him loose.
1637,NOOSE: Jury will disregard.
1638,Turn him loose!
1639,"Your Honor, you silence that witness!"
1640,Turn him loose!
1641,PEOPLE SHOUTING AND GAVEL BANGING WOMAN: No!
1642,People say whatever the hell they want in this courtroom!
1643,Quiet!
1644,Any more of that nonsense...
1645,...and you're all out of here.
1646,"NOOSE: Now, Mr. Buckley, you may begin."
1647,"RUFUS: Thank you, Your Honor."
1648,Would you please state your name and occupation for the members of the jury.
1649,"My name is Dr. Wilbert Rodeheaver, chair of Psychiatry..."
1650,...at Mississippi State University...
1651,...and clinical director of the Whitfield Facility for the Criminally Insane.
1652,"Thank you, doctor."
1653,Your credentials speak for themselves.
1654,"Now, doctor, can you please explain, as you do so eloquently in your book..."
1655,...the McNaughton Rule for the jury?
1656,RODEHEAVER: Certainly.
1657,The McNaughton Rule states...
1658,...that a person must be unable to tell right from wrong...
1659,...and/or be unaware of the consequences of his actions...
1660,...to be termed legally insane.
1661,"Now, did you examine Mr. Hailey?"
1662,"Yes. Mr. Hailey and I spoke about his childhood, his family..."
1663,...his experiences during the war.
1664,And the rape of his daughter?
1665,"RODEHEAVER: Yes, we spoke at length about the brutal rape of his daughter Tonya."
1666,RUFUS: What is your diagnosis of Mr. Hailey's mental condition...
1667,...on the day that he shot Billy Ray Cobb and James Lewis Willard?
1668,"At the time of the murders, his mental condition..."
1669,...was without any defects of any nature.
1670,Mr. Hailey was sane.
1671,"But wait a minute, doctor."
1672,"The defense contends Why, Mr. Brigance has gone to great effort to prove to this jury..."
1673,...that Mr. Hailey is a nutball.
1674,Is a slow coach.
1675,Or what's the clinical definition?
1676,Insane.
1677,Do you disagree?
1678,RODEHEAVER: Yes.
1679,Carl Lee Hailey knew very well what he was doing.
1680,He slaughtered those men in cold blood.
1681,"Thank you, doctor."
1682,"I have no further questions, Your Honor."
1683,"Buddy, where the hell is Roark?"
1684,I got no clue.
1685,"Crossexamination, Mr. Brigance?"
1686,"Your Honor, we would request a recess until No, we will not need a recess, Your Honor, but just a few moments."
1687,NOOSE: Mr. Brigance?
1688,When you and Lois Lane are ready....
1689,"WHISPERING INDISTINCTLY Just a few questions, Your Honor."
1690,"Doctor, who do you work for?"
1691,State of Mississippi.
1692,In your 11 years...
1693,...how many times have you testified where the insanity defense was used?
1694,This is my 46th trial.
1695,Fortysixth trial.
1696,"Well, of those 46 trials..."
1697,...how many times have you testified that the defendant was legally insane?
1698,"Objection, Your Honor!"
1699,The good doctor cannot be asked...
1700,...to recall all of his testimony at these previous trials. It's absurd.
1701,Overruled.
1702,"Thank you, Your Honor."
1703,I can't remember.
1704,"Could it be, doctor, the reason you can't remember..."
1705,...is that in 11 years and 46 trials...
1706,...you never have seen a defendant whom you have found insane?
1707,I can't recall at this time.
1708,Can you recall testifying at the trial of one Dan Baker?
1709,"Objection! Your Honor, this has nothing to do with the proceedings here."
1710,NOOSE: Overruled.
1711,"This.... This better be good, Mr. Brigance."
1712,"Thank you, Your Honor."
1713,I'll ask again. Can you recall testifying the trial of one Dan Baker?
1714,It's a rather brutal double homicide where you found the defendant legally sane?
1715,Yes.
1716,"A dissenting psychiatrist disagreed with you, doctor."
1717,And Mr. Baker was found insane and institutionalized.
1718,"Where is he currently, doctor?"
1719,At Whitfield.
1720,Who is the chief psychiatrist at Whitfield?
1721,I am.
1722,You are.
1723,Dr. Rodeheaver is the chief psychiatrist at Whitfield.
1724,"Now, help me make this clear to the jury, doctor."
1725,"In 1985, you testified that Dan Baker was legally sane."
1726,The jury disagreed with you.
1727,And Mr. Baker was found not guilty by reason of insanity.
1728,"Since that time, he has been a patient in your hospital, under your care..."
1729,...as a paranoid schizophrenic.
1730,"Is that correct, doctor?"
1731,Yes.
1732,Do you normally admit patients...
1733,...keep and treat them for 10 years if they're of sound mind and body?
1734,Of course not.
1735,Then it would be fair to say...
1736,...that you find insane people sane for the purposes of trial?
1737,"Objection, Your Honor!"
1738,This is argumentative!
1739,"Withdraw the question, Your Honor."
1740,No further questions.
1741,"QUIETLY Genius, Roark."
1742,PEOPLE CHATTERING WOMAN: Mr. Brigance! Mr. Brigance!
1743,JAKE: Yes. Yes.
1744,WOMAN: How do you expect to get a fair trial in Mississippi?
1745,GUNSHOT THEN PEOPLE SCREAMING AND SHOUTING JAKE: Get him!
1746,"Get an ambulance, get, get!"
1747,MAN: Come on.
1748,ELLEN: So is there any news on the guard who was shot?
1749,Ozzie says he's probably paralyzed.
1750,SIGHS Some stranger...
1751,...somebody's husband...
1752,...somebody's son...
1753,...put himself in harm's way...
1754,...for me.
1755,When I saw the blood...
1756,...I got so scared because I thought that was you.
1757,SIGHS Do you want me to stay?
1758,Yeah.
1759,I want you to stay.
1760,So you better go.
1761,Okay.
1762,"POLICE SIREN WAILING ELLEN MUTTERS INDISTINCTLY ELLEN: Oh, shit."
1763,"HASTINGS: Speed limit's 45, not 70, ma'am."
1764,"Haven't been drinking, have you?"
1765,I guess I just wasn't Let me ask you to get out of the car.
1766,Is that really necessary?
1767,Just get out of the car.
1768,Isn’t it usually customary to ask for a license and registration?
1769,ELLEN SCREAMING WINSTON: You bitch.
1770,ELLEN: No!
1771,HASTINGS: Get her in the car.
1772,ELLEN GRUNTING AND GROANING ELLEN: No! No!
1773,WINSTON: Come on.
1774,Get in there.
1775,Shut up!
1776,ELLEN GROANING AND WHIMPERING You can't blame a nigger for being a nigger...
1777,...no more than you can blame a dog for being a dog.
1778,But a whore like you...
1779,"...comingling with mongrels, betraying your own..."
1780,...that makes you worse than being a nigger.
1781,So I'll tell you what I'm gonna do.
1782,I'm gonna leave you tied up here naked.
1783,First it'll just be the bugs eating at you.
1784,"One day, maybe two."
1785,That sun's gonna be cooking you.
1786,But them animals?
1787,They're gonna pick up your stink.
1788,They're gonna come looking for something to eat.
1789,Carl Lee Hailey should've shot you too.
1790,"Come on, boys. Let's go."
1791,CAR APPROACHING WHIMPERS WHIMPERING No. No. No.
1792,No. No.
1793,MAN GRUNTING Shh. It's okay.
1794,ELLEN PANTING It's okay.
1795,It's okay now.
1796,It's okay.
1797,"NOOSE: Mr. Brigance, you may call your first witness."
1798,"JAKE: Yes, Your Honor."
1799,Defense calls Dr. Willard Tyrell Bass.
1800,"WHISPERS Buddy, have you seen Roark?"
1801,Not yet.
1802,"JAKE: Doctor, would you explain to the jury..."
1803,...the effect his daughter's rape had on Mr. Hailey's condition?
1804,Tonya's rape caused a relapse...
1805,...a temporary break with reality.
1806,"JAKE: But yesterday, a Dr. Rodeheaver..."
1807,...suggested that Mr. Hailey's act of calculation was...
1808,...the very definition of sanity.
1809,That's ridiculous.
1810,Many of the most famous schizophrenics are calculating.
1811,"John Hinckley, for example."
1812,Calculating.
1813,And legally insane.
1814,"All right, so, Dr. Bass, how would you diagnose Mr. Hailey..."
1815,...at the time of the murder?
1816,Mr. Hailey experienced a recurrence of a dissociative condition...
1817,...as a result of the trauma caused by the rape of his daughter.
1818,"Now, since Mr. Hailey was unaware of the reality of his actions..."
1819,...he could not tell right from wrong.
1820,Nor could he understand the consequences of his actions.
1821,"He was, therefore, legally insane."
1822,Could not tell right from wrong...
1823,...nor understand the consequences of his actions.
1824,"Therefore, legally, insane."
1825,"Thank you, Dr. Bass."
1826,"Your Honor, I have no further questions."
1827,Mr. Buckley?
1828,Mr. Buckley.
1829,Yes?
1830,Your witness.
1831,"Oh. I'm sorry, excuse me."
1832,"Thank you, Your Honor."
1833,Good morning.
1834,BASS: Good morning.
1835,"Dr. Bass, could you please state for the record your full name?"
1836,Willard Tyrell Bass.
1837,Tyrell Bass. That's a very unique name.
1838,"Now, doctor, have you ever been convicted of a felony?"
1839,"No, of course not."
1840,You're certain?
1841,Yes.
1842,RUFUS: As certain of that as you are of the testimony you've just given before this jury?
1843,BASS: Of course.
1844,So let me understand this now...
1845,...since you are under oath.
1846,"You're telling me, and this jury, that on October 17th, 1960..."
1847,...you were not convicted of statutory rape?
1848,"Objection, Your Honor!"
1849,Dr. Bass is not on trial here.
1850,This goes to the heart of the credibility of the witness.
1851,"Overruled. Continue, Mr. Buckley."
1852,RUFUS: Thank you.
1853,"Now, doctor..."
1854,...were you convicted of statutory rape?
1855,You got the wrong man.
1856,Really?
1857,I have some mighty interesting photographs of you...
1858,...taken with a female underage...
1859,"...in a motel by the Dallas Police Department on September 11th, 1960."
1860,Would you like to look at these images and see if they refresh your memory?
1861,"No, I didn't think so."
1862,"Your Honor, we would like to enter into evidence these court and police records..."
1863,"...showing that on September 15th, 1960, this man, one Tyrell Bass..."
1864,...pled guilty to statutory rape.
1865,"Now, doctor, I'm gonna ask you one last time..."
1866,...were you or were you not convicted of statutory rape?
1867,"Well, I can explain RUFUS: Not interested in your explanation."
1868,"Answer the question, yes or no."
1869,"Yes. Yes, I was."
1870,CROWD MURMURING That's enough.
1871,I have nothing further.
1872,"Redirect, Mr. Brigance?"
1873,"None, Your Honor."
1874,Court will recess one hour for lunch.
1875,"You told me you knew him, he was a credible witness."
1876,I didn't know. The record was expunged.
1877,Buckley really outdid himself this time.
1878,"Damn. Lucien, I was counting on you."
1879,And I can't win You wanted this case.
1880,"Well, you got it."
1881,"It isn't easy saving the world one case at a time, but you stick with it."
1882,You might just have a knack for it.
1883,Don't do what I did. Don't quit.
1884,"What are you talking about, quit?"
1885,"You're a hero, Lucien."
1886,"Oh, hero, my ass."
1887,Do you think the world needed me beating cops' heads on that picket line?
1888,"I was needed here, in that courtroom."
1889,And I let them push me.
1890,I gave them an excuse to kick me out...
1891,...and now I can never plead a case in there again.
1892,But you can.
1893,You're an attorney.
1894,Be proud.
1895,"Your job is to find justice, no matter how well she may hide herself from you."
1896,So you go on in there...
1897,...and you do your job.
1898,"Hurry up, now."
1899,They'll be starting without you.
1900,Come with me.
1901,"I can't, Jake."
1902,I love you...
1903,...but I can't.
1904,You know that.
1905,I'll never go in another courtroom again.
1906,"And I can't be you, Lucien."
1907,Don't be me.
1908,Be better than me.
1909,BAILIFF: All rise for the Honorable Judge Omar Noose.
1910,And how did you feel?
1911,"I felt, um...."
1912,I don't know.
1913,It was like I was outside myself...
1914,...watching myself.
1915,"All the while I kept hearing my baby say: ""I called for you, Daddy."
1916,"When them men was hurting me, I called for you over and over..."
1917,"...but you didn't never come."" Thank you, Mr. Hailey."
1918,"I have no further questions, Your Honor."
1919,You have an emergency phone call.
1920,NOOSE: Mr. Buckley.
1921,Mr. Hailey...
1922,...before you stepped outside yourself to watch yourself shoot Willard and Cobb...
1923,...were you aware that if convicted they might be freed in only 10 years?
1924,"Yes, I heard people say that. Yes, sir."
1925,Do you think men who kidnap a child should be free in 10 years?
1926,No.
1927,Think men who rape a child should be free?
1928,"CARL LEE: No, sir."
1929,Do you think two men who hang a child should be free in 10 years?
1930,No.
