,dialog
673,Dwayne?
674,I made Ozzie bring me.
675,"Shit, Dwayne, we We known each other since we was kids."
676,It's my fault.
677,No matter what gets said in court...
678,"...I knew what I was doing, and I sure didn't intend to hurt you..."
679,...but just them two boys.
680,I know it don't mean much now...
681,...but I'm sorry.
682,Some folks think that a black man cannot receive a fair trial in the South.
683,I intend to show the men and women of the South will look past color and see truth.
684,It sure is a nigger's world.
685,Not for long.
686,"FREDDIE: Boys, I am very proud to invite you to become soldiers..."
687,...in the war to protect our Christian homes and families.
688,To resurrect our country from the fires of racial degradation.
689,And to make white people the sole masters of our nation's destiny.
690,"What I'm saying, fellas..."
691,...it's time for the nigger to pay.
692,Something wrong with your telephone?
693,"No, we just had the number changed."
694,That's what the operator said.
695,To an unlisted number.
696,Yeah.
697,I'm sorry you had to come all the way up here.
698,"I should've called you, but this case This case has us all worried sick about you all, Jake."
699,And you know this thing could get ugly.
700,And dangerous.
701,"Jake, he shot them in cold blood."
702,"They raped and almost murdered his daughter, Sarah."
703,What if the same thing happened to Hannah?
704,WOMAN 1: Brigance! Mr. Brigance! Mr. Brigance!
705,May we ask a few questions?
706,WOMAN 2: Can we get a quote?
707,Mr. Brigance.
708,Excuse me a second.
709,I'm going to go take a few questions.
710,"Jake, this isn't the time."
711,This is really good for Carl Lee.
712,I'll be right back.
713,Thank y'all for coming.
714,REPORTERS CHATTERING I guess we'll have to read about it in the papers.
715,CHOIR SINGING GOSPEL SONG CHOIR STOPS SINGING Praise Jesus!
716,CONGREGATION CHEERING ISAIAH: Reverend Agee?
717,AGEE: Yes.
718,I'm Isaiah Street.
719,"Well, it's an honor to meet you, Reverend."
720,I saw you march with Dr. King.
721,"Well, well. The struggle continues today here in Canton."
722,Carl Lee Hailey's on trial because he's black.
723,No other reason.
724,These people are with the NAACP.
725,Oh?
726,Reverend Agee.
727,How do you do?
728,How do you do?
729,"Reverend Agee, the black community's concerned that Mr. Hailey's attorney..."
730,...is not sensitive to the needs of the movement.
731,The NAACP wishes to provide him with a new lawyer.
732,We need to raise funds to support Carl Lee Hailey.
733,"I don't know, Reverend."
734,Time's awfully tight here.
735,"Obviously, we would expect you to take..."
736,...a modest administration fee for your troubles.
737,SISSON: Your loyalty has been forged in a baptism of fire.
738,"Rise, knights of the Ku Klux Klan..."
739,...and let your brethren never regret...
740,...they believed you worthy of fellowship.
741,Welcome to the Klan.
742,MAN: I need to talk to Jake Brigance.
743,He's not in. May I ask who's calling?
744,"MAN: Uh, well Mickey Mouse."
745,Who?
746,MAN OVER PHONE: Mickey Mouse.
747,Get out right now.
748,Who is this?
749,MAN OVER PHONE: Get your daughter out of the house right now.
750,HANNAH: Mommy!
751,Hannah?
752,HANNAH: Mommy!
753,"CARLA: Hannah? What is it? Oh, my God!"
754,"Max! Max, come on!"
755,Fire! Aah!
756,MAX BARKING FIREFIGHTERS CHATTERING It's a good thing Hastings was nearby and got here fast.
757,The whole place could've burned down.
758,"Yeah, I appreciate it."
759,"Take care, man."
760,See you in the morning.
761,"She asleep, baby?"
762,"The Ku Klux Klan is burning crosses on our lawn, Jake."
763,"Baby, there's been no Klan around here for years, okay?"
764,This is just a couple of dorks with too much time on their hands and too many beers.
765,I'm sorry.
766,About what?
767,That you weren't home when someone practically burned our house down?
768,That you missed supper and didn't even bother to call?
769,That lately you've become more interested in getting on the news...
770,...than what's going on with your family?
771,Or that Hannah comes home bawling because of kids calling her a niggerlover?
772,"What exactly are you sorry about, Jake?"
773,Remember the other night?
774,I told you Carl Lee came by the office?
775,Remember what we talked about then?
776,About me calling Ozzie?
777,"You never called him, did you?"
778,You never called Sheriff Walls?
779,"I didn't call him, baby."
780,"Lord have mercy, Jake, you had a responsibility."
781,Carl Lee chose you.
782,He told you what he was thinking.
783,"He told me what he was thinking, but I didn't know Jake Tyler Brigance, we agreed, you were gonna call the sheriff."
784,Now look at everything that has happened.
785,"I am sorry to tell you this, darling, but those two boys are in the ground..."
786,...and you were in a position to prevent every bit of this.
787,HANNAH: Mama?
788,Are you and Daddy fighting?
789,"No, baby. Come here."
790,"Come here, baby. Come here."
791,"Mommy's just upset because some silly man played a real bad joke, okay?"
792,There's nothing to worry about.
793,"Nothing at all, okay?"
794,What that Memphis doctor say about her?
795,She's doing good.
796,Her jaw is healing.
797,"She can't run and jump yet, but it won't be long."
798,How about the other?
799,There was too much damage.
800,She ain't gonna never have kids.
801,"You know, I think about them two boys."
802,"Dead, buried..."
803,...probably starting to rot.
804,And I remember them walking in court...
805,"...one proud, the other scared."
806,I remember how they fell.
807,"One on top of the other, and screaming and squirming and not going nowhere."
808,"God help me, Gwen, but..."
809,...that's the only thought gives me comfort.
810,They took up a collection for us at church Sunday night.
811,Some kind of defense fund.
812,Reverend Agee gave a good service.
813,"We need some money around the house, Carl Lee, for groceries and bills."
814,How much you got?
815,SIGHS Less than 50.
816,I'll think of something.
817,How you think you going to get some money while you stuck here in jail?
818,"Trust me, Gwen."
819,I just get scared.
820,Look here.
821,Tell me exactly what Reverend Agee said when he passed around the collection plate.
822,I don't care.
823,We are dealing with life and death here.
824,I'm gonna have to talk to my supervisor.
825,"Well, you go talk. Get out of here."
826,"JAKE: Morning, John."
827,How are things at the electric company?
828,The electric company. That is the second time this week I've had to hold him off.
829,How much do we owe?
830,Two thousand dollars.
831,How much do we have?
832,One hundred dollars.
833,"Now, look, this week nothing, nothing has come in at all. Look."
834,What about Buck Britt's retainer?
835,There's 2 grand.
836,That check bounced.
837,"What do you mean, bounced?"
838,"It bounced, Jake."
839,It's been sitting on your desk for a week.
840,Not that you'd notice.
841,"Since you took this case, you You stopped talking to your clients..."
842,"...you don't take your calls, you You're obsessed. That's what you are."
843,"You're obsessed, Jake."
844,"Boy, your obsession is going to break us."
845,"Hey, hey, hey."
846,"What's wrong, girl?"
847,We've been through hard times before.
848,"Oh, not like this, Jake."
849,Not like this.
850,We've been getting calls.
851,At home.
852,Threats.
853,You know Bud has survived two strokes.
854,I don't think he would survive a third.
855,Why didn't you tell me?
856,"Why, Jake?"
857,Would you drop the case?
858,PHONE RINGS Jake Brigance's office.
859,Until they cut the phones off.
860,"Oh, right."
861,Okay.
862,Right. That was Sheriff Walls.
863,You better get down to that jail.
864,"What's going on here, Carl Lee?"
865,I'm Isaiah Street.
866,Jake Brigance.
867,ISAIAH: Uhhuh. Uh....
868,I believe you know Reverend Agee.
869,Jake.
870,And this is Norman Reinfield.
871,I've seen your picture in the paper.
872,I assume these boys carry your briefcase.
873,Just a small part of my legal defense team.
874,"Pleasure, Mr. Brigance."
875,JAKE: Mmhm.
876,"If this is a party, boys, where's the chips and beer?"
877,"Otherwise, you being here seems a bit like illegal client solicitation."
878,With Carl Lee already having a lawyer and all.
879,"Well, now, just a minute, Jake."
880,Carl Lee invited us here.
881,ISAIAH: Mr. Brigance...
882,...let me be frank.
883,Mr. Hailey's case has farreaching ramifications.
884,Carl Lee's acquittal for the killings of two white men...
885,...would do more for black people in Mississippi...
886,...than any event since we integrated the schools.
887,"His conviction, on the other hand, will be a slap at us."
888,A symbol of deepseated racism.
889,Perhaps enough to ignite a nation.
890,See how important this case is?
891,"Enter Mr. Reinfield's death squad, right?"
892,"It's an unfortunate nickname, but apropos."
893,"My lawyers and I handle only capitalmurder cases, Mr. Hailey."
894,"Yeah, and of all your cases, Norman, how many are supposed to be lost..."
895,...so you can martyr the victim?
896,"Now, Mr. Brigance."
897,How much a defense like that cost?
898,Yeah.
899,"Would you say about 100,000?"
900,"We are prepared to accept Well, Carl Lee doesn't have $7000."
901,"Do you, Carl Lee?"
902,The NAACP has raised $5000 for Carl Lee's legal defense fund.
903,And we raised an additional $2000 from the local churches.
904,"CARL LEE: Let me ask you something, Reverend."
905,How much of that cash you offer my wife and kids?
906,"Well, that money is to go to pay for lawyers' fees and stuff like that."
907,"That ain't what you told the church, now, is it?"
908,You almost cried when you told them...
909,"...how my family might starve if they didn't donate all they could, didn't you?"
910,"Well, the money is for you and your family, Carl Lee..."
911,...but we thought it'd be better spent on your legal defense.
912,"Well, speaking of that defense fund..."
913,...can I use that for any lawyer I want?
914,"Well, it's not that simple, Carl Lee."
915,"Actually, it is that simple, Carl Lee."
916,Unless the NAACP wants to go on record as soliciting funds under false pretenses.
917,"ISAIAH: Listen, Carl Lee, we raised that money..."
918,"...for these men to get you out of here, not for this cracker to Now, hey, hey, hey."
919,"Hold on. Hold on right there, now."
920,"Let me just get this straight here, Reverend."
921,If you don't give my wife that cash...
922,...I'm gonna see to it everybody in this town knows you're a lying crook.
923,I'm sure your congregation will be interested to know...
924,...Gwen and the kids can't eat because you want in with the NAACP.
925,That's right.
926,By the time I get through with you...
927,...you won't be able to collect 2 cents in that collection plate on Sunday.
928,"We'll expect the check for the Hailey family this afternoon, Reverend Agee."
929,"Reverend Street, I sure do appreciate your fine work..."
930,...but I'm gonna take my chances with Jake here.
931,"Thanks for coming down, Mr. Reinfield."
932,"Uh, and we'll be expecting that check for Jake's legal services..."
933,...around the same time this afternoon.
934,"Good day, men."
935,MAN: Go.
936,Go.
937,Good.
938,"You set that whole thing up, didn't you?"
939,"Couldn't have did it without you, Jake."
940,"Make one hell of a team, Carl Lee."
941,"You out there, Jake. I'm in here."
942,We ain't no team.
943,HARRY REX: There's trouble.
944,"Oh, lookie there."
945,"No, here's trouble, Harry Rex."
946,SIGHS Hi. You are...?
947,"JAKE: Roark, meet Mr. Harry Rex Vonner..."
948,"...the most effective, connected, morally compromised lawyer in the country."
949,"Oh. Ellen Roark, brilliant law student."
950,Do with me as you will.
951,Looking forward to it.
952,Okay.
953,"Um, well, thought this might interest you."
954,"In all murder trials, it seems the insanity plea only makes up 1 percent overall."
955,And of the 1 percent of that that resulted in acquittal...
956,...success rested almost wholly on the On the defending psychiatrist regardless of the quality of the psychological testimony.
957,Yeah.
958,Shazam.
959,She is brilliant.
960,"""She."" That would be me?"
961,"Now, who else would she be?"
962,So she would be me.
963,She is saying that if I take this plea to trial...
964,...the verdict is going to hinge on whose shrink the jury finds more credible.
965,She would be correct.
966,She would.
967,So are you sure you don't need any help?
968,I do. I'm hiring. Right now. Me.
969,"Roark, I am sure that I don't need any help."
970,"Thank you, though."
971,Okay.
972,"I guess that would just have to be your loss, then, huh?"
973,"Nice to meet you, Morally Compromised."
974,Pleasure's all mine.
975,She.
976,Got to love the Lord for making things like that.
977,Sure you don't wanna at least take a peak at her résumé?
978,Not like you couldn't use the help.
979,"No, I don't want to look at her résumé, Harry Rex, because I have you."
980,You do?
981,"Yeah, buddy."
982,"This is your chance to put aside your shady sources, backalley deals..."
983,"...your greedy divorcées, and do some real law for a change."
984,"CHUCKLES Mr. Vonner, in short..."
985,...you now have the opportunity to work on a case that matters.
986,Let me get this straight.
987,"You want me to put aside my empty, soulless, shady..."
988,"...astonishingly lucrative, divorcée practice..."
989,"...come work with you on an unwinnable, bleedingheart, loseallmyfriends..."
990,...straighttothegaschamber case because it matters?
991,"That is a novel idea, I know."
992,"No way, never, presumptuous little shit."
993,"BELL RINGS Good night, y'all."
994,WOMAN OVER PHONE: Hello?
995,MAN: I need the sheriff.
996,WOMAN: He's sleeping now.
997,"MAN: Well, get him up."
998,WOMAN: Who is this?
999,MAN: Someone's gonna die tonight.
1000,MAN: Unh!
1001,SHERIFF: I got him!
1002,"JAKE: Get his ass, Ozzie!"
1003,SHERIFF: What's in the case?
1004,MAN GRUNTING JAKE: This thing's ticking.
1005,What's in the case?
1006,"I ain't saying, nigger."
1007,YELLING Family out of the house?
1008,Yeah.
1009,It's locked.
1010,Now I want you to open that.
1011,"YELLING Oh, man...."
1012,Defuse it.
1013,I'm gonna take you and this niggerlover to hell with Ain't nothing more dangerous in this world than a fool with a cause.
1014,Lay that thing back down there.
1015,Let's get the hell out of here.
1016,JAKE: Carla loves this house.
1017,"ALARM RINGING JAKE GRUNTS MAX BARKING MAN 1: How you doing, Stan?"
1018,"MAN 2: Hey, how you doing?"
1019,"JAKE: Come here, girl."
1020,Mwah.
1021,"HANNAH: Daddy, are you coming to Grandpa's too?"
1022,"Mmmm. Not this time, baby."
1023,Daddy's gotta stay here and work.
1024,"You and your mama have a good time, okay?"
1025,All right.
1026,All right. You be good.
1027,Go get your stuff down there.
1028,You said you'd withdraw if it got too dangerous.
1029,I know.
1030,"But I can't quit now, you know that."
1031,"Carl Lee Hailey's facing the gas chamber, baby. The man is counting on me."
1032,"I understand that, Jake."
1033,I want you to remember that we're counting on you too.
1034,What if something happens to you?
1035,"Nothing's gonna happen to me, baby."
1036,Come here.
1037,Give me a hug? Hmm?
1038,Everything's gonna be all right.
1039,"I'm gonna be fine, you're gonna be fine. Okay?"
1040,"Okay, babe?"
1041,I promise.
1042,Watch you don't make your wife promises you can't keep.
1043,Hannah?
1044,You ready?
1045,HANNAH: Uhhuh.
1046,WOMAN OVER PA: Last boarding call.
1047,MAID: Good afternoon.
1048,JAKE: Good afternoon.
1049,MAID: Come in.
1050,BUTLER: Good afternoon.
1051,JAKE: Good afternoon.
1052,BUTLER: You may come this way.
1053,The judge is upstairs.
1054,"JAKE: Thank you, sir."
1055,Judge Noose.
1056,Thanks for coming.
1057,Heard you had a little trouble last night.
1058,"Yes, sir."
1059,Makes you wonder about the sensibleness of taking this case.
1060,"This is a beautiful place you have here, judge."
1061,I'll get to the point.
1062,I've thoroughly reviewed your brief request in that change of venue.
1063,And I agree with you. I think it's impossible to find a fair and impartial jury in Canton.
1064,"In fact, I think it's impossible to find a fair and impartial jury anywhere in Mississippi."
1065,And as such...
1066,...a jury here would be...
1067,...as fair as a jury anywhere else.
1068,So I've decided to deny your request for a change of venue.
1069,"CLEARS THROAT Well, I guess that..."
1070,...gives me something to appeal.
1071,"Uh, actually, no."
1072,I spoke to Judge Dent...
1073,...and he led me to believe that the supreme court would uphold my ruling.
1074,"You certainly have covered your bases, judge."
1075,"Jake, you're a good lawyer."
1076,You're bright and ambitious. Talented.
1077,You could be somebody around here.
1078,You sure you wanna be known as the man that defended that murderer?
1079,Could be very unpopular.
1080,Talk to your client.
1081,He pleads guilty...
1082,...I'll recommend Buckley accept a plea of manslaughter.
1083,He'd be out in 20.
1084,Yeah. And how's his wife supposed to raise his family alone?
1085,Better than being a widow.
1086,Think about it.
1087,"Why toss away a promising career, hmm?"
1088,"Good day, judge."
1089,Thanks for coming.
1090,"JAKE: All right, Lucien."
1091,Where the hell is this guy?
1092,LUCIEN: Born alcoholic.
1093,But the man cannot hold his liquor.
1094,"Jake, allow me to present Dr. Willard Tyrell Bass."
1095,Expert witness for the defense.
1096,"W.T., this is Jake Brigance, my protégé."
1097,Dr. Bass.
1098,Are you kidding me?
1099,"No, relax."
1100,"When he's sober, he's terrific."
1101,"He has his license, his credentials are impeccable."
1102,Well?
1103,I need a drink.
1104,Three in the afternoon?
1105,"My, oh, my. What would your wife say?"
1106,"I am my own man, Lucien."
1107,I drink when I want.
1108,When did she leave town?
1109,JAKE: This morning.
1110,LUCIEN: Hahaha.
1111,DOG BARKING BUD: God! Unh!
1112,MEN GRUNTING ETHEL: Bud?
1113,"ETHEL YELLING AND GRUNTING Oh, my FREDDIE: That's enough."
1114,"ETHEL WHIMPERING Now, you tell your boss..."
1115,...next time people are gonna die.
1116,"ETHEL: Oh, Bud."
1117,"Oh, Bud."
1118,DOORBELL BUZZING ELLEN: Hi.
1119,Morning.
1120,GROANS Nice parking job. Late night?
1121,Yeah.
1122,Hmm.
1123,"So, um, here."
1124,"Oh, thank you."
1125,Your wife lets you sleep at the office?
1126,My wife left town.
1127,That's too bad.
1128,"So listen, I heard that Judge Noose turned down your change of venue."
1129,Yeah.
1130,I think it's time you let me take you out to breakfast.
1131,Lunch.
1132,CLAUDE: Quit playing with that food.
1133,"But, ladies, y'all come back."
1134,You need to finish that before Christmas.
1135,"Thank you, treasure."
1136,"Now, the other night, you said you're opposed to the death penalty."
1137,"Yes, sir."
1138,Why?
1139,You're not?
1140,Mmmm.
1141,"Actually, I'm very much in favor of it."
1142,I'd like to go back to hangings on the court lawn if we could.
1143,"You're kidding, right?"
1144,No.
1145,"The only problem with the death penalty, Roark, is that we do not use it enough."
1146,"Well, have you told your client Carl Lee Hailey this?"
1147,Carl Lee does not deserve the death penalty.
1148,The two men who raped his daughter did.
1149,How do you decide...
1150,...who dies and who doesn't?
1151,"Well, simple. Okay, you take the crime and you take the criminal."
1152,"Now, say a crack dealer guns down an undercover cop."
1153,"Well, you strap his ass to the chair, flip the switch."
1154,"For some reason, I thought you were a liberal."
1155,"Well, I am a liberal, Roark."
1156,What I am not is a cardcarrying ACLU radical.
1157,"I do not believe in forgiveness, nor in rehabilitation."
1158,I believe in safety. I believe in justice.
1159,"I see. Well, let me ask you something."
1160,Have you ever seen a man executed?
1161,Not that I recall.
1162,Then what I suggest you do...
1163,...is you go watch a man be executed.
1164,"You watch him die, watch him beg, watch him kick and spit the life out of him..."
1165,"...until he pisses and shits in his pants, until he's gone."
1166,"Then you come back here and sing this crap to me about justice Roark, spare me your Northern, liberal, crymeariver..."
1167,...wearetheonlyenlightenedones bullshit.
1168,"I'm so sorry, yes, you are the enlightened."
1169,"Yes, you are."
1170,And that's why you brought me to this black diner in this black neighborhood.
1171,So you can convince me you're this JFKmeetsJesusChrist white boy.
1172,Is that what it is?
1173,"Or because you're another repressed, hypocritical provincial..."
1174,...who maybe didn't want to be seen around town with a woman like myself?
1175,"Yes, you sure are enlightened."
1176,You know what?
1177,"I'm terribly sorry, I've made a mistake."
1178,I thought you were one of the good guys.
1179,"Thank you very much for your time, Mr. Brigance."
1180,WOMAN: Do it.
1181,ELLEN: I get a little worked up.
1182,"Guess that's not the best way to apply for a job, huh?"
1183,I don't want the jury to see those pictures of the dead rapists. Can we keep them out?
1184,No.
1185,It is vital that I admit the rape.
1186,I want the jury to know details.
1187,I'm gonna need briefs on both.
1188,"I don't like your politics, Roark, but you do have passion..."
1189,...and that's something Carl Lee needs right now...
1190,...and maybe so do I.
1191,Are you getting this?
1192,I'm writing it down.
1193,"RUFUS: All right, here's what we got. It's official."
1194,The trial of Carl Lee Hailey will be held in Canton.
1195,"Today, presiding Judge Noose issued ...in a sealed envelope."
1196,"Now, to prevent tampering..."
1197,...that list will be kept strictly confidential until jury selection begins on Wednesday.
1198,"No one, not even Mr. Brigance or myself..."
1199,...will know the identities of the potential jurors in this case.
1200,CHANTING Free Carl Lee!
1201,Free Carl Lee! Free Carl Lee!
1202,Free Carl Lee! Free Carl Lee!
1203,Free Carl Lee! Free Carl Lee!
1204,Free Carl Lee!
1205,"LUCIEN: Beautiful day, isn't it?"
1206,There he is.
1207,Any word on Bud?
1208,Ethel's still with him.
1209,"Thank you for coming, sir."
1210,"Well, well, well."
1211,The Pillsbury Doughboy.
1212,Still practicing exploitative law?
1213,Thought you were dead.
1214,I'm trying. Who do we have here?
1215,"Miss Roark, I would like to introduce to you Lucien Wilbanks, third white man in Mississippi to join the NAACP..."
1216,...permanently disbarred by the superior court...
1217,...for attacking police who busted a picket line in the EPSO oil strike.
1218,"It is a pleasure, Ms. Ark."
1219,"All right, everybody, jury selection begins this afternoon."
1220,"Now, to win this case, we need a sympathetic jury willing to acquit..."
1221,...and a jury that can use the insanity plea as an excuse to do so.
1222,I'm gonna need a drink.
1223,No drinking.
1224,"What do you mean, no drinking?"
1225,It's my building...
1226,"...built by my grandfather, leased to you for a reasonable rent..."
1227,...and I want a drink.
1228,"Ms. Ark, I have all the respect in the world for you."
1229,"I believe in your right to equal pay, equal work, to bear a child..."
1230,...or to abort one. I think you should be treated just like a man.
1231,And since you are a law clerk...
1232,...genderless in my eyes...
1233,...I think you should be the one to go buy the beer.
1234,"ERA shewoman, that would be an excellent activity for you this afternoon."
1235,Hey. No drinking. Not today.
1236,"Now, ahem, Noose selects this panel at random."
1237,"If we get too many bad candidates, we're sunk."
1238,Luck of the draw.
1239,What you need...
1240,...is young fathers who wanna do what Carl Lee Hailey did.
1241,Agreed. I think we need young men with families here.
1242,"Now, I would prefer no one over 50."
1243,"Less bigotry, as a rule, with youth."
1244,"So we stay away from women, rednecks and old men."
1245,"NOOSE: Uh, citizens, thank you."
1246,"Now, counsel, you each have Your Honor, the state challenges Jurors Number 6, 10 and 32."
1247,"Your Honor, the defense strikes Jurors 1, 4, 8 and 2."
1248,"Twentysix, 27, 28 and 31."
1249,"Your Honor, the defense also strikes Jurors 22 and 29."
1250,"Now that's it, then. Mr. Brigance, you're all out of challenges. We're done."
1251,"NOOSE: Jurors, you will be sequestered starting tonight."
1252,Opening statements begin tomorrow morning.
1253,GAVEL BANGS That's a jury of my peers?
1254,God bless America.
1255,My name is Stump Sisson...
1256,...and I'm proud to be a grand dragon...
1257,...for the Invisible Empire of the Ku Klux Klan.
1258,KLAN CHEERING AND CROWD YELLING What the hell?
1259,SISSON: And I'm here to say that the lawabiding white folks of Mississippi...
1260,"...are sick and tired of niggers stealing, raping, killing and getting away with it."
1261,"Ozzie, let's get them out of here."
1262,SISSON: We demand justice.
1263,We demand this nigger be convicted...
1264,...and his black ass sent to the gas chamber.
1265,Who you calling nigger?
1266,"You pointyheaded, whitefaced, nogood, wifebeating son of a whore!"
1267,"SISSON: Shut up, you wild animal!"
1268,WOMAN: Animal? You're the damn animal!
1269,SHERIFF: I'll drag your ass out of here!
1270,WOMAN: You're the damn animal!
1271,Unh!
1272,CROWD YELLING MAN: Come on!
1273,Come on!
1274,"Come here, come here!"
1275,"SISSON: That's right, go on!"
1276,SCREAMING SHERIFF: Hastings! Hastings! Hastings!
1277,MAN: What's going on?
1278,This is for Billy Ray.
1279,JAKE YELLS ELLEN: Open! Open the gate!
1280,HARRY REX: Open the gate!
1281,ELLEN: Turn around.
1282,ELLEN CLEARS THROAT I can't get to this.
1283,Just take off your pants.
1284,"Come on, Roark, do I look that easy?"
1285,Are you afraid I'm gonna see you in your underwear?
1286,"With Carla gone, the laundry's piling up."
1287,I'm not wearing any.
1288,"It's all right, I haven't worn any in years."
1289,"Look, I'm not gonna watch, I promise."
1290,"Now strip, please."
1291,All right. Fine. Batter up.
