,Unnamed: 0,dialog
0,0,just not like the old days.
1,1,It's not.
2,2,Guys then they had charisma.
3,3,Style.
4,4,Used to call it panache.
5,5,"So, still play the ponies, Merle?"
6,6, Merle Panache?
7,7," Yeah, look."
8,8,You walk into a room full of shooters.
9,9,And you're calm.
10,10,I mean you got ice water in your veins calm.
11,11,And you think.
12,12,You don't react.
13,13,You think.
14,14,You're always gonna have the advantage.
15,15,"Now, bear with me here."
16,16,"Most people that pull a gun, they have no intention of killing."
17,17,They don't even aim.
18,18,"They point, pull the trigger and turn away."
19,19,That's because killing is against the most fundamental of human responses.
20,20,"When the stress is on and the shit really hits the fan and you're facing down bad guys, that's what it comes down to."
21,21,Fundamentals.
22,22,Comes down to panache.
23,23,You go in there coldminded.
24,24,Age don't matter.
25,25,Numbers don't matter.
26,26,You kill 'em all.
27,27, Merle Hope you got a hot tip for me.
28,28, Carmelita.
29,29,Spanish Angel.
30,30,She's a twoyearold thoroughbred out of Shreveport.
31,31,She's running at Santa Ana on the 5th.
32,32,You bet her to win.
33,33, Carmelita?
34,34,No shit.
35,35,"See you around, Teddy."
36,36," You look after yourself, Merle."
37,37, Man More important things to talk about.
38,38,I've always got five digs here in Hawaii.
39,39,We'll start off by going to the beach.
40,40,"Hey, Jackie."
41,41,A luau.
42,42,Jackie has the best luau.
43,43,She grills fish and everything.
44,44, Woman Wait till you eat it.
45,45, Man What do you mean?
46,46,There's nothing wrong with that.
47,47,It's part of their culture.
48,48, Owen Geiger.
49,49,Remember me?
50,50, Fuck!
51,51,Let's go.
52,52,"Fuck, man!"
53,53, Ow.
54,54," Look, I'm sorry it had to come down to this, but you know why I'm here."
55,55,You're not supposed to be operating on this side of the river.
56,56,"Murdoch needs you to keep it in the barrio, East LA."
57,57,"It's business, he understands what you gotta do but if we have to tell you again, you might not walk away."
58,58,A word to the wise.
59,59,"Lay low for a while, all right?"
60,60,"In fact, a word to the wiser, disappear."
61,61,Do we have an understanding?
62,62,Do we have an understanding?
63,63," Yeah, yeah."
64,64,"It's understood, bro."
65,65, Stay hungry kid.
66,66, Very well could be the dog hears things.
67,67,Could be I heard the big man jawing on you.
68,68, I work for him.
69,69, Yeah.
70,70,That's as is.
71,71,"But that cracker from Carolina, he's not hot for you, Butcher."
72,72,Nah.
73,73,Word on the street is that he's sniffing at your pension plan.
74,74, That's a good line.
75,75,It's also horse shit.
76,76," Woman Merle was a one time gun man, A some time prize fighter."
77,77,A man who now preferred a drink over a fight.
78,78,He'd had more chances in life than most but failed to see any of them through.
79,79,People liked Merle.
80,80,They just felt he should have amounted to more.
81,81," Hmm, the long goodbye."
82,82,"Maybe it's for the best, Carmelita."
83,83,Maybe it's for the best at that.
84,84," Good morning, Merle."
85,85," Good morning, Jackie."
86,86,You look ravishing as always.
87,87, Your friends are in the back.
88,88, I know.
89,89,You got any of that liquid tarmac for me?
90,90," No cream, no sugar?"
91,91," Merle No cream, no sugar."
92,92, Look like you haven't slept.
93,93, Because I haven't.
94,94,There's no softer pillow than a clean conscious.
95,95,So said my grandmother Beatrice.
96,96, Do you think it's true?
97,97, What you talking about?
98,98,Do you think we have a sell by date?
99,99,"Just seemed like so much was possible once and then slowly, steadily, it all went away."
100,100, Oh baby.
101,101,I have this technique.
102,102,"It's a way to get rid of all the bad, dark, bleak things in your life."
103,103,Visualize it.
104,104,Look at it.
105,105,See it.
106,106,Turn it into a two dimensional photograph.
107,107,Light a match and burn it.
108,108,Vaporize it.
109,109,Just get rid of it.
110,110,I find that it helps some times.
111,111,You're still young baby.
112,112,Enjoy yourself.
113,113, I can only imagine dealing with a guilty conscious that a man with the nickname The Butcher might have.
114,114," Oh, come on."
115,115,It's a nickname they gave me when I was a fighter.
116,116,But those were the old days.
117,117,Nobody remembers that anymore.
118,118, If it isn't young Merle.
119,119," Good morning, Pearl."
120,120," Join us, why don't you."
121,121, I'll do that.
122,122, Is it true what they say about him?
123,123, What do you mean?
124,124, That he fought with a real bear.
125,125," Yeah, that's true."
126,126,But it was a long time ago.
127,127, It's been 35 years since I come to this country.
128,128,Had $18 in my pocket and a dream in my head.
129,129,Saw what I wanted to do and did it.
130,130,And pity the man who tried to get in my way.
131,131,Found some rough souls among you.
132,132,"And gave you all a damn good life now, didn't I?"
133,133,Well those that could keep a simple rule or two.
134,134,Like Eddie here.
135,135,Now you all know Eddie Hellstrom.
136,136,Eddie's been watching my club investments since he was old enough to chisel an angle.
137,137,He's a pushy goddamned kid and I like him.
138,138,First time he tried to hustle me he wanted to run the old strip joint on Rampart.
139,139,"He told me, ""You see that Bentley?"
140,140,"""You let me run this club ""you'll have one in three months."" I asked him if he'd like to go for a ride in the trunk of my Cadillac."
141,141,I liked the kid straight off.
142,142,So here we are.
143,143,We all know Molo the Shank's retiring so I'm handing his duties over to Eddie here.
144,144,"It's a big day for you, kid."
145,145," Thank you, Murdoch."
146,146, Congratulations.
147,147,"Gentlemen, pay your respects to the kid."
148,148,You'll probably be taking orders from him in a few years.
149,149, Murdoch.
150,150," Merle ""The Butcher"" Hench."
151,151,You run that beaner spic Geiger off my Santa Fe project?
152,152, I wanted to talk to you about him.
153,153,Think he's a good kid.
154,154,"Maybe, maybe he could run an angle for you?"
155,155, Run an angle?
156,156, Merle Maybe.
157,157, Really?
158,158,That's interesting.
159,159,"By the way, ever meet my cousin Maguire?"
160,160, Merle Mmmm.
161,161, Ah.
162,162,Come on.
163,163,"Now, Merle, last night somebody was around here."
164,164,Geiger and this faggot jungle bunny tried to rob Maguire's liquor store on Alvarado.
165,165,Now my cousin's a bad motherfucker.
166,166,Did seven to ten up in Pelican Bay for armed assault.
167,167,So he beat the living crap out of the wetback before burying him alive in Bakersfield.
168,168,"Now it's a long drive out to Bakersfield, and these stupid fucking crackheads start talking like a pair of balling bingo bitches all the way there."
169,169, Geiger?
170,170," Now I don't specifically blame you, Merle."
171,171,"This punk would've found a piece somewhere, but he used the heater you let him keep."
172,172, You give me a hand with this cocksucker?
173,173, Quit breaking my balls.
174,174,Can't you see I'm eating my candy over here?
175,175," Man Come on, get out."
176,176,Get up.
177,177,Come on.
178,178," What, you got nothing else to say tough guy?"
179,179,You got nothing to say now?
180,180,Huh?
181,181,Punk?
182,182, Merle I took his bullets.
183,183,Told him to stay away from downtown.
184,184, Are you out of your fucking mind?
185,185, What?
186,186, Are you so goddamned ignorant of human nature?
187,187,"What kind of fucking enforcer, what kind of soldier lets a twobit punk have his gun back after a beating?"
188,188,What the fuck is wrong with you?
189,189, You're right.
190,190,You're right.
191,191," I don't know what happened to you, Merle."
192,192,"Think about retiring, huh?"
193,193,You know you should invest in some kind of strip joint or a club.
194,194,Your friend Manny's got two of them nudie mag stores.
195,195,The old boy never has to lift a finger.
196,196, I know.
197,197, Living life like he's on the red neck Riviera.
198,198, You don't gotta worry about me.
199,199,I have investments.
200,200,Real estate.
201,201, Start thinking about your retirement.
202,202,Let the young bloods move up.
203,203,Let them take the risks.
204,204,Be smart.
205,205, Yeah.
206,206," Anyways, I got a deal might work for you."
207,207, Hm?
208,208," I gotta go to this fundraiser, Commissioner Scobyn."
209,209,Just got honored by the Jewish Retirement Community.
210,210,Merle the fucking Butcher.
211,211,My cottontailed ass.
212,212,See yous later boys.
213,213, Later Murdoch.
214,214," Murdoch Merle, I'll call ya."
215,215, Merle Okay.
216,216," Gentle touch for an old prizefighter, Merle."
217,217,You stroke that glass like a mother might hold a baby's hand.
218,218,Ever tell you I saw you fight.
219,219, No.
220,220," Plaza de la Raza, East Los Angeles."
221,221,Barrio club fight.
222,222, Right.
223,223," Professionally rated, as I recall."
224,224, Yes it was.
225,225, You could have used it as a dollar ticket fight.
226,226,Take the don'ts and pay the line!
227,227,Plastered that plucky wetback.
228,228,Took him apart like a rank amateur.
229,229,Thought I was watching the making of a star.
230,230,"Used a quick hook, that kinda twisted as it made contact."
231,231,Lifted the little finger on the inside.
232,232,"His face looked so goddamned bad afterward, even his own mother would be hard pressed to recognize him."
233,233,"That left hand of yours, that left hand of yours could decapitate a grown man."
234,234," Would have been March 23rd, 1979."
235,235,"Soldier De Santos, 15 to zero on the pro circuit."
236,236,He was supposed to be bad.
237,237,It was a hell of a night.
238,238," We still got Paris, right?"
239,239," Oh, yeah."
240,240," You're about three and a half into the hole now, Merle."
241,241,That's why I had to come out myself.
242,242,"You come up spades, that winds your ticket up to 19 big ones."
243,243,"Now, I've been brotherly and not clamped down."
244,244,Had to see if your luck turned tail.
245,245,"Hasn't, and I ain't got time to wait."
246,246,You gotta come good by Thursday.
247,247, Mmhm?
248,248, Or my associates take over.
249,249,That shiny car of yours has to be worth a couple of Gs.
250,250,Sell it.
251,251,"Get straight with me, Merle."
252,252,"You know I like you, we'll do business again."
253,253,"But pay me by Thursday, Merle, or we got a problem."
254,254,Catch my drift?
255,255, Mmhm.
256,256, There you go babe.
257,257," Oh, man."
258,258," Lost its flavor, honey?"
259,259," Oh yeah, but just you watch me Rose, I shall rise triumphant from these fucking ashes."
260,260, Man You know I got Maybe I'll just leave.
261,261, It's a 1969 Dodge Charger with a 440 magnum big block and original Super Bee 4speed.
262,262,"Only made a couple hundred like this so, the price was 21,000 in cash when you arrived."
263,263,"The price is still  You know, we're wasting each other's time."
264,264,My card.
265,265,No bites.
266,266,"You wanna shift the wheels, you know, you come by and see me."
267,267,I'll give you a fair nickel.
268,268,I appreciate that.
269,269,Plus I'd like to use my Rolex as collateral for the other 60.
270,270," Real Submariner, thick pearl face."
271,271,"I'll stake you for it, Merle."
272,272,"Word in your shell, like a brother, never ever gamble when you are desperate."
273,273,It's liable to affect your judgment.
274,274," You want me to go home, Pete?"
275,275,I'm a big boy and I feel lucky tonight.
276,276," You must call, Merle."
277,277, All in.
278,278," Too rich for me, Merle."
279,279,Your luck has beaten mine like a redheaded stepchild.
280,280,night's work bro.
281,281,I'll come back tomorrow.
282,282,"I like you, always been fair."
283,283,I'd hate to see you lose your shirt when your vein pans out.
284,284,A little luck often proves more deadly then a flat out loss.
285,285,Be careful what you do with that moolah.
286,286," I won't be back, Pete."
287,287,"I've seen good luck, I've seen bad luck."
288,288,I know the difference.
289,289, I understand why they call you The Butcher.
290,290," Nobody calls me that anymore, Pete."
291,291,All right?
292,292," Oh, no!"
293,293,"Jesus, Merle, they're with me."
294,294,Oh!
295,295,Sweet mother of mercy!
296,296,Who do you think is going to pay the hospital bills?
297,297," Larry, what are you doing here?"
298,298, Pete's security was on alert to call if you turned up.
299,299,We've been here since one o'clock this morning.
300,300,"It's just business with me, Merle, you know that."
301,301,"I've got a family to feed, it's just business."
302,302," Larry, I did not recognize your boys."
303,303,I wouldn't make them look so bad if I knew who they were.
304,304,"How's that ankle, pal?"
305,305," Look, you got him in the boiler room man."
306,306,Still got a couple of moves for an old man.
307,307," Let me take you boys for breakfast, come on Larry."
308,308, I don't feel like eating breakfast.
309,309, Suck it up.
310,310,Everybody likes breakfast.
311,311,Get in the car.
312,312,Here you go.
313,313,You all right?
314,314,Here you go.
315,315," We're square, Merle."
316,316,I gotta be straight with you.
317,317,I hadn't foreseen this.
318,318,I mean but then again I can be a cynical son of a bitch.
319,319,Comes with the territory one would suppose.
320,320,"I hear things, you know."
321,321,Haven't heard anything good about you.
322,322,I'd have put money on your not having a winning streak now.
323,323," There's a horse running this afternoon, Carmelita, I got a hunch."
324,324,I want you to bet the whole bundle on her to place.
325,325, Sounded like you said you want me to put the whole bundle on a horse called Carmelita.
326,326, Mmhmm.
327,327," We'll be back where we started you know that, Merle."
328,328, Only if I lose.
329,329,"She's 15 to 1, Larry."
330,330,A long shot.
331,331," 19,000 on Carmelita, to win, Merle."
332,332," That's not what I said, Larry."
333,333," Take it or leave it, Merle."
334,334,That's the only way I'm covering you.
335,335, I'll take it.
336,336, Carmelita?
337,337,"That's the skin dancer from Reseda, A nightclub canary and a hellroaring drunk."
338,338,Shacked up with Dennis Tull.
339,339,Seem to remember she rolled with you for a while.
340,340, I married her.
341,341, Oh.
342,342,"Well, I hope for your sakes the bitch don't fuck you again."
343,343,"Sentiment's a hell of a luxury, Merle."
344,344, Yes it is.
345,345," Hello there, stranger."
346,346, Hi.
347,347, That looked like a serious conversation.
348,348, You look ravishing today.
349,349,When are you going to run away with me?
350,350," Don't be so sure I'm picky about who it is rescues me from this place, Merle."
351,351,Just think about how you ask me.
352,352,There's always that chance I might say yes.
353,353, Hmm.
354,354," You know, they say that the arrival of coffee and tobacco in Europe signaled the start of the industrial revolution."
355,355, Mmm.
356,356, Stimulated the brain.
357,357,I fucking hate you can't smoke in these goddamned places anymore.
358,358, Good morning Eddie.
359,359,What can I do for you?
360,360," Why don't you like me, tough guy?"
361,361,"We're a lot alike, you and I."
362,362,I boxed out of the old prison gym in Lincoln Heights.
363,363,It was kind of like one of those undecorated East Coast sweatshops from the movies.
364,364," You know, where you work the weights and get that fucking rust shit on your hands afterward."
365,365,"In our line of work Eddie, we have excuses for all kinds of bad behavior."
366,366,But a man's a man.
367,367,How he carries himself is all I'm concerned about.
368,368,"I don't judge people Eddie, I just don't like you."
369,369," It's okay, in Kentucky, when we've wronged a man, we recognize his privilege to resent it."
370,370,It's because I got that kid to take a dive.
371,371,The Puerto Rican puncher from Boyle Heights.
372,372,See.
373,373,That's what made me.
374,374,"Yeah, that was it."
375,375,He lost his title and the right to fight.
376,376,"That got to you, didn't it?"
377,377, Maybe.
378,378," It's no wonder why you never made it in this game, Merle."
379,379,You got a soft touch.
380,380,That's the kiss of death in our racket.
381,381,You gotta have the ferocity to pick a fight over five bucks and not give up.
382,382,"You just don't get that, do you?"
383,383,Murdoch wants you to run an errand.
384,384,There's a redneck prick.
385,385,"A fucking dog hick dick, we deal with, Doyle."
386,386,He has a titty bar.
387,387,"City of Industry, Spearmint Rhino."
388,388,"We need you to go by, and pick up a payment."
389,389,"He wants somebody who can handle themselves, and will be on time."
390,390,Four o'clock this afternoon.
391,391,"No earlier, cause that's when the money, everything will be ready."
392,392,Are we understood?
393,393,Am I understood?
394,394," Spearmint Rhino, four o'clock."
395,395,Got it.
396,396, Take care then.
397,397, Hmm.
398,398," 1915, Model .45."
399,399,Normally I wouldn't recommend it for a concealed carry but it's all I can give you.
400,400,It'll buck like a turpentine mule.
401,401,"If you plan on firing it, I suggest you grip it like a politician making election hay, can't hold it too tightly."
402,402,"This one supposedly belonged to Cherokee Tom Threepersons out of El Paso, but I doubt it."
403,403,Not as easy an iron to hide as your Colt's but it'll shoot clover leaves at 15 paces.
404,404,Want to see your babies before you leave?
405,405, Love to.
406,406, Boy!
407,407,Get them two gold .45s.
408,408,The one I was talking to you about.
409,409,I look at them myself once in a while.
410,410,Tiffany and company couldn't do better.
411,411, I know.
412,412," I wouldn't dare shoot them, be afraid to use them."
413,413,You won't catch me playing with them.
414,414,You're safe with me.
415,415," Thank you, Naylor."
416,416,I really appreciate it.
417,417,I'll be back real soon.
418,418," Look, you end up using that six gun, just lose it."
419,419,Don't bring it back here.
420,420," Thanks, pal."
421,421," See ya later, Merle."
422,422,"(""Sex and Candy"" by Marcy Playground) * And I've had so much time * To sit and think about myself * * And then there she was * Like double cherry pie * Yeah, there she was * Like disco Superfly * I smell sex and candy here  Hello, doll face."
423,423, What can I get ya?
424,424, Get me a bourbon on the rocks.
425,425, That's $11.
426,426," Make it a coke, sister."
427,427, Woman You got it.
428,428,"* Devious stares in my direction * * Mama, this surely is a dream  You look like a man on a mission."
429,429,How about a private dance?
430,430,I've been fired and rehired three times for too much personal contact.
431,431,"Oh Jesus, mister."
432,432,* Hangin' 'round * Downtown by myself  Buy the lovely ladies a drink?
433,433," No drink, no dance."
434,434,But thank you both.
435,435, You can have us both if you'd like.
436,436, No thanks.
437,437, Woman Oh.
438,438,You're gonna leave us hanging just like that?
439,439, Just like that.
440,440,* Like disco lemonade * I smell sex and candy here  I'd like to see Mr. Doyle.
441,441,Is he here?
442,442, I'll see what I can do.
443,443,* Who's that casting  You walk into a place asking for a man like me and then demand money.
444,444,"You're looking to commit suicide the hard way, Mr. Hench."
445,445," I asked, I did not demand."
446,446, I'll tell you.
447,447,I know Eddie and Murdoch.
448,448,They've been trying to buy me out for years.
449,449,I won't sell because I don't want to.
450,450,I'm not ready to move on yet.
451,451,"I'm fairly connected myself, I know certain people."
452,452,I can make a phone call or two.
453,453,Believe me when I say these are grim characters.
454,454,I run an expensive establishment that's hardly ever full.
455,455,Do the math.
456,456,I have other dealings.
457,457, There's obviously been a misunderstanding.
458,458,If I can use a telephone I'll clear all of this right up.
459,459,Do you have a telephone?
460,460, Use this one.
461,461, I'd like a little privacy.
462,462," In that case, use the one in the men's room."
463,463,It's down the stairs and to your right.
464,464,You should get a cell phone.
465,465, That's what they tell me.
466,466,Excuse me.
467,467,Thank you very much.
468,468,He's not?
469,469,Okay.
470,470,"Uh, tell him I'll call him back this afternoon."
471,471,I'm at the Spearmint Rhino Club right now.
472,472,"Yeah, Doyle's."
473,473,"Okay, tell him Doyle will call him this afternoon as well, all right?"
474,474,Thanks.
475,475,Okay.
476,476,Bye.
477,477,"Naylor, could you have found a bigger gun?"
478,478,* You may think it's just a stupid thing * * I've hurt you again and again *  Eddie Whooo!
479,479,Oh!
480,480,There you are Merle.
481,481,Nice of you to join the party.
482,482, Get out of the way!
483,483, Man Move!
484,484,Get down!
485,485, Eddie Good idea to rob the place.
486,486,Too bad you get shot in the process.
487,487," I may not live long Eddie, but I'm living longer than you."
488,488," Man Go, go, go!"
489,489, Son of a bitch.
490,490," Don't know what's going on, Mr. Hench."
491,491, They tried to set me up.
492,492, I run a laundering operation.
493,493,"We clean dirty money, mob money."
494,494,Murdoch has messed with a hornets nest the size and fury of which he has no comprehension.
495,495,You tell that bucko he has just signed his own death certificate.
496,496,I'm letting you leave on account of I believe you didn't know what was gonna go on.
497,497,Now tapping that pathetic piece of white trash did me a favor but that's as far as it goes.
498,498,I'm not going to be able to stop the gentlemen who's money that is.
499,499,They will come after you.
500,500, I appreciate it.
501,501, Now you just consider this a head start on them.
502,502," Can't park your car here, sir."
503,503," I'm sorry officer, I thought this road went somewhere."
504,504, Well that's all right this time.
505,505,That's a goodlooking car.
506,506,All stock?
507,507, Just like I ordered it in 1969.
508,508,I only used original replacement parts.
509,509, I'll tell you what.
510,510,"They don't make them like this anymore, do they?"
511,511, They sure as hell don't.
512,512,"So, do you need to see my license?"
513,513, I don't think that's going to be necessary this time.
514,514,You just be careful.
515,515, I always try to be.
516,516,"Thanks, pal."
517,517, Officer Right on.
518,518," I've lost weight, who knew?"
519,519," You've got more than 3,000 here Merle."
520,520, Merle You betcha.
521,521," I'm not gonna see you again, am I?"
522,522,"Merle Hench, 190 grain for practice."
523,523,"You're loaded for bear, Merle, 240 grain, semijacketed factory hollow point, either you're knocking down a wall, or, well we know what you're loaded for, don't we?"
524,524,Too damned old for this.
525,525,I wish I was going with you. Merle.
526,526,I look in the mirror I see a 25yearold.
527,527,Everyone else sees a tired old man.
528,528,"I have asked no odds of any man, just waiting to die now."
529,529,I've seen them come and go.
530,530,"You lose the old .45, Merle?"
531,531, Most of it.
532,532, Naylor That's too bad.
533,533, All lost but one bullet.
534,534,That's stuck in a wall of a nudie bar in the City of Industry.
535,535,Got stuck in the wall after I blew a man's brains out.
536,536,I knew you'd appreciate that.
537,537, Uhhuh.
538,538,"There are very few men could beat you on the drop, Merle."
539,539,"One of the old timers, Merle."
540,540,One of the greats.
541,541,It was a genuine pleasure my friend.
542,542,"If you ever need anything, anything at all."
543,543,"You're going to do it, aren't ya, Merle Hench?"
544,544, What ya talking about?
545,545, You're gonna go out with a bang.
546,546, Shit happens.
547,547,"And Naylor, thanks for everything."
548,548, Naylor Yeah.
549,549, A failure.
550,550,An alsoran lemon flavored dud.
551,551,Merle Hench is a washout who doesn't have the balls or the brains for this kind of caper.
552,552,"You're clutching at straws to preserve your own bacon, Murdoch."
553,553,That's offensive to me.
554,554," You know the difference between you and me, Doyle?"
555,555,"It's not the number of men standing behind us at a given moment, but a bit of philosophy."
556,556,You see I've always believed that to keep what you own you can't be afraid to lose it.
557,557,Go all in with your chips otherwise everyone knows you're just a paper tiger.
558,558,You got quite a collection of shit here.
559,559,Personally I hate guns so I brought this for your collection.
560,560,Brush me and I release the spade which gives you three seconds of 40 year old fuse to clear the room or become mincemeat on the ceiling.
561,561,"Now fellas, I'd rather this conversation be private between me and Doyle."
562,562,But of course you're all welcome to stay.
563,563,"Now get the fuck out of the room, go on, get the fuck out!"
564,564,Get the fuck out of the room!
565,565,Now!
566,566, You're out of your fucking mind.
567,567," Oh, no, no, no, see, I just made my peace with the lord."
568,568,I've been to church regular to ask His forgiveness.
569,569,Lived my whole life knowing He might call me at anytime and ask me to answer.
570,570,"Now how about you, Doyle?"
571,571,Think you're sitting good with him?
572,572," I'm not your problem, Murdoch."
573,573,You know as well as I do that that money belongs to a select group of Nevada gentleman.
574,574,A company famous for possessing a severely humorless disposition.
575,575,"Now, Eddie Hellstrom is your boy and that means you will be the first person they come after."
576,576,"You are the one who is going to be accountable for this, chief."
577,577, I can see how Eddie caught you with your pants around your ankles.
