,Unnamed: 0,dialog
669,669,Wait. You might be able to improvise that tracker...
670,670,if you modify the diffraction units on one of your regulators.
671,671, That could work.
672,672, I don't know what that means.
673,673,Thank you. Thank you.
674,674,"But, Doctor, campus police says they ID'd both Pym and Van Dyne."
675,675,"I don't know what to tell you, Agent."
676,676,I haven't talked to Hank in 30 years.
677,677,I can assure you I'm the last person he would want to visit.
678,678,"Oh, come on, you expect us to..."
679,679,"Hey, hey."
680,680,Why is that?
681,681,Simple.
682,682,We hate each other's guts.
683,683,So I'm a terrible partner?
684,684,"Foster, he hasn't had one good idea in his unremarkable career."
685,685,"But his idea about the diffractors could work, right?"
686,686,"Fine, one decent idea."
687,687,"Except, I eliminated the diffractors when I upgraded the suits."
688,688,"So, if we had an old suit, we might be able to track down the lab?"
689,689,"Yes, but we don't."
690,690, What if we did?
691,691, What do you mean?
692,692,I mean...
693,693,life's funny.
694,694,"Oh, my God."
695,695,You didn't destroy the suit.
696,696,What?
697,697,"Well, it was your life's work, Hank."
698,698,I couldn't destroy that.
699,699,"Before I turned myself in, I shrunk it down and mailed it to Luis."
700,700,You sent my suit through the mail?
701,701,"Hey, the postal service is very reliable."
702,702,"You know, they do tracking numbers now. Like UPS."
703,703,Where is it?
704,704,"It's in a very safe place, all right? Don't worry."
705,705,"What, the trophy?"
706,706,"No, it's not here."
707,707,What do you mean it's not there? Where could it be?
708,708,I looked everywhere.
709,709,It's not here.
710,710,"Hey, get away from the plant."
711,711,But I put it back after Cassie and I...
712,712,Showandtell.
713,713,Scotty?
714,714,"No, stop!"
715,715,"Well, the good news is I know where it is."
716,716,Whenever you go back to school...
717,717,isn't everything supposed to look so much smaller?
718,718,This place seems huge.
719,719,What is it?
720,720,It's the new regulator.
721,721,"Hank, what's going on with this suit?"
722,722,How much of a work in progress is this?
723,723,Uhoh.
724,724,"No, no, no."
725,725,Oh.
726,726,"What are you, laughing?"
727,727,"Please, could you just..."
728,728,"Okay, okay."
729,729,What do you see?
730,730,The sizing coils are malfunctioning.
731,731,Just let me...
732,732,Ow!
733,733, Sorry.
734,734, It's all right.
735,735,Okay. All right.
736,736,Try that.
737,737,Sorry.
738,738,What?
739,739,Awesome.
740,740,If only Cap could see you now.
741,741,Hilarious.
742,742,What are we gonna do?
743,743,Hey!
744,744,Where's your hall pass?
745,745,"Hey, I'm talking to you."
746,746,Hey!
747,747,Hey. Eh...
748,748,You can do it.
749,749,You almost got it.
750,750,"Oh, peanut."
751,751,"Okay, let's go."
752,752,"Hiya, champ, how was school today?"
753,753,"All right, get your jokes out now."
754,754,Can you fix the suit?
755,755,So cranky.
756,756,You want a juice box and some string cheese?
757,757,Do you really have that?
758,758,Let's see if Foster was right.
759,759,This has gotta be the lab.
760,760,Let's go get it.
761,761,Yeah.
762,762,This seems right.
763,763,"Look at us, teaming up twice in one day."
764,764,"Makes you think, huh?"
765,765,About what?
766,766,Germany.
767,767,What do you mean?
768,768,"We were working together, training together..."
769,769,and other stuffing together.
770,770,"If I had asked you, would you have come?"
771,771,I guess we'll never know.
772,772,But I do know one thing.
773,773,What?
774,774,"If I had, you'd have never been caught."
775,775,"Hey, Scott."
776,776,You think you can stop daydreaming about my daughter long enough to get my lab?
777,777," Yes, sir."
778,778, Thank you.
779,779,"Okay, you're transmitting."
780,780,What took you so long?
781,781,"Sorry, I had to come up with a name for my ant."
782,782,I'm thinking Ulysses S. GrAnt.
783,783,You like it?
784,784,Hilarious.
785,785,I'm not getting anything on the monitors.
786,786,There's some kind of electronic disturbance.
787,787,Be careful.
788,788,"You know me, Hank."
789,789,I'm always careful... Whoa!
790,790,It's okay.
791,791,It's just the suit.
792,792, How do you know?
793,793, Look.
794,794,That's Ghost?
795,795,What is she doing?
796,796,Do you think that suit is how she goes through walls and stuff?
797,797,Let's just get outta here before she wakes up.
798,798,"Hope, look! There's the lab."
799,799,"Now, we're sure this is our shrunken building and not somebody else's, right?"
800,800,"Just take it, Scott."
801,801,"Come on, we gotta be fast."
802,802,I'll get it.
803,803,"Oh, shit..."
804,804,Hope. Hope! Hank.
805,805,Guys.
806,806,I don't think they can hear you.
807,807,Hi.
808,808,I'm Ava.
809,809,Scott.
810,810,"So, you don't need the suit..."
811,811,to go through things.
812,812,No.
813,813,It just helps me control it.
814,814,"And the pain, supposedly."
815,815,"You're not gonna reach into my chest and crush my heart, are you?"
816,816,You're funny.
817,817,"I'm not gonna hurt you, Scott, unless I have to."
818,818,I need...
819,819,what's in your head.
820,820,"Let's wake up the rest of the gang and get this over with, shall we?"
821,821,Get up!
822,822,Come on!
823,823,Dad?
824,824,Don't ever touch him again.
825,825,"Now, now, Hope..."
826,826,"I think I'm being rather gentle with your father, all things considered."
827,827,What the hell are you talking about?
828,828,Another casualty of Hank Pym's ego.
829,829,Bill.
830,830,What have you done?
831,831,"It's what you've done, Dr. Pym."
832,832,You're with her?
833,833,"Oh, man."
834,834,I thought you were cool.
835,835,What the hell is going on here?
836,836,I doubt Hank has ever mentioned my father.
837,837,Why would he?
838,838,Elihas Starr.
839,839,They were colleagues at S.H.I.E.L.D.
840,840,Quantum research.
841,841,Until my father dare disagree with the great Hank Pym.
842,842,You had him fired.
843,843,"Oh, and discredited for good measure."
844,844,My father tried to continue his research on his own.
845,845,"Desperate to restore his name, so he took risks."
846,846,"No, no, no!"
847,847,Too many.
848,848,Until something went wrong.
849,849,He told us to run.
850,850,"Elihas, what's happening?"
851,851,Just go. Go!
852,852,Daddy! Daddy!
853,853,I could tell he was scared.
854,854,Daddy!
855,855,"Ava, no!"
856,856,I didn't want him to be alone.
857,857,No! No!
858,858,"When I woke up, my parents were dead."
859,859,I wasn't so lucky.
860,860,"They call it ""molecular disequilibrium."" A rather dull name, I think."
861,861,Doesn't quite do justice to what it means.
862,862,Every cell in my body is torn apart...
863,863,and stitched back together.
864,864,Over and over.
865,865,Every day.
866,866,I was still at S.H.I.E.L.D.
867,867,when I got the call about a quantum anomaly in Argentina.
868,868,"Hello, Ava."
869,869,My name's Bill.
870,870,I was a friend of your father's.
871,871,I brought you something.
872,872,It's all right.
873,873,Try again.
874,874,That's it.
875,875,Dr. Foster did his best to keep me safe.
876,876,But others at S.H.I.E.L.D.
877,877,saw an opportunity in my affliction.
878,878,"They built me a containment suit, so I could control my phasing."
879,879,And trained me to be a stealth operative.
880,880,They weaponized me.
881,881,I stole for them.
882,882,Spied for them.
883,883,Killed for them.
884,884,And in exchange for my soul...
885,885,they were going to cure me.
886,886,They lied.
887,887,"When S.H.I.E.L.D. collapsed, I took Ava in."
888,888,"I built the chamber to slow her decay, but her condition was progressive."
889,889,I didn't know how to cure it.
890,890,"She wanted to kill you, Hank, but I told her no..."
891,891,and that she should watch you instead.
892,892,"And sure enough, she discovered that you were building the tunnel."
893,893,"Then, she told me about Lang."
894,894,"And the message from Janet inside his head, that's when I..."
895,895,Christ's sake!
896,896,That's me. I'm sorry.
897,897,"Look, can you tell me who's texting me?"
898,898,"""Cassie, 911."" That's my daughter."
899,899,I need to text her back.
900,900,"No, that's not happening."
901,901,"What, it's 911."
902,902,That means it's an emergency.
903,903,"You're not making demands here, Lang."
904,904,You're not appreciating the gravity of the...
905,905,"Okay, look, she's trying to video chat me now."
906,906,Something might be wrong.
907,907,Let me talk to her. Please.
908,908,"Cassie, are you okay?"
909,909,What's the emergency?
910,910,I can't find my soccer shoes.
911,911,What?
912,912,I have a game tomorrow.
913,913,"Hey, Scott, I know that they're there."
914,914,Can you just walk the phone around the house?
915,915,"No, I can't do that right now."
916,916, Why not?
917,917, Because I'm sick.
918,918,"Hey, can you just maybe look around later then and call me back?"
919,919,Please? Thank you.
920,920,"Bye, Daddy!"
921,921," Bye, peanut!"
922,922, Feel better!
923,923,"Feel better, buddy!"
924,924,I'm sorry.
925,925,It said emergency.
926,926,"Ava, I want to help you."
927,927,She doesn't need your help.
928,928,I know how to save her.
929,929,"Oh, really? How?"
930,930,Janet.
931,931,"For the last 30 years, she's been down there absorbing quantum energy."
932,932,We can extract that energy.
933,933,We can use it to repair Ava's molecular structure...
934,934,Extract it?
935,935, Yes.
936,936, Are you insane?
937,937,That would rip Janet apart.
938,938,You don't know that.
939,939,I'm gonna fire up your tunnel.
940,940,"When Janet's location pops into Lang's head, he's gonna give it to me..."
941,941,or I'm gonna turn him over to the FBI.
942,942,What?
943,943,You are gonna stay here...
944,944,just in case I need your help.
945,945,Like hell I would help you!
946,946,You'll do whatever I say.
947,947,You're gonna kill Janet!
948,948,"I'd be more worried about yourself, Hank."
949,949,"Goddamn it, Bill!"
950,950, Dad?
951,951," Calm down, Hank."
952,952,So help me God...
953,953,The pills.
954,954,It's his heart!
955,955,He needs his pills.
956,956,"Please, Dr. Foster."
957,957,They're in the tin. Please.
958,958,He could die!
959,959,Come on!
960,960,Help him!
961,961,"Dad, just hang on, all right?"
962,962,Just keep breathing.
963,963,Stay calm.
964,964,"Help him, man! Come on!"
965,965,The Altoid tin!
966,966,Wait!
967,967,"Thanks, guys."
968,968,Hank!
969,969,Bill is filling that girl's head with lies.
970,970,Elihas Starr was a traitor.
971,971,He stole my plans.
972,972,"Now, bring it down."
973,973,"All right, lock it in."
974,974,"No, no, no."
975,975,The bolt is on the other side.
976,976,"Tighten that one down, then bring it down one notch."
977,977,Good job.
978,978,It'll work.
979,979,"Foster, he could have fried the entire system."
980,980,"Look, we'll adjust the relays while you go reprogram the settings, all right?"
981,981,It's going to be fine.
982,982,"So, this is it."
983,983,Yeah. You'd think with all this time to prepare I'd be more ready.
984,984,"Oh, going subatomic isn't something you can prepare for."
985,985,It kind of melts your mind.
986,986,I mean seeing my mom again.
987,987,Oh.
988,988,What if she's a completely different person?
989,989,"Yeah, like, uh, George Washington."
990,990,"I'm serious, Scott."
991,991,Or George Jefferson.
992,992,What if she's forgotten about me?
993,993,When I was in prison...
994,994,the only thing that got me through was Cassie.
995,995,I could have been locked up for 100 years...
996,996,I never would have forgotten her.
997,997,I know your mom is counting the minutes until she can see you again.
998,998,Thank you.
999,999,Hey.
1000,1000,We got a big problem.
1001,1001,You forgot the motion sensor lights on the back of the building.
1002,1002,"Oh, no."
1003,1003,"And they're on the proposal, and Karapetyan asked for them specifically."
1004,1004,"Uh, yeah, look, it's been a little crazy."
1005,1005,"Look, maybe I could stop by tomorrow, take a look at it."
1006,1006,"No. No, no, no, no."
1007,1007,The meeting is first thing in the morning.
1008,1008,You gotta come right now and fix it.
1009,1009,"I can't. I wish I could, but I can't leave."
1010,1010,"You know what, I'm coming to you."
1011,1011,I'll just bring the plans.
1012,1012,They're on the laptop.
1013,1013,And you can fix them there.
1014,1014,"Just tell me where you are, okay?"
1015,1015,It's complicated.
1016,1016,What do you mean it's complicated?
1017,1017,"As you can see, sir, this system is state of the art."
1018,1018,"Security of tomorrow, today."
1019,1019,"Oh, that's so good!"
1020,1020,"And I love the leanin, bro."
1021,1021,Keep practicin'.
1022,1022,"Hey, I just gotta drive up to Scotty's, so we can fix the plans."
1023,1023,"But don't worry, I'll be back in plenty of time."
1024,1024, As you can see...
1025,1025," Oh, oh, oh!"
1026,1026,Tell me you got the van washed for tomorrow morning.
1027,1027,"Down to the undercarriage, baby."
1028,1028,You sprung for the undercarriage wash?
1029,1029,"Well, you said get the works."
1030,1030,"That's a scam, bro. We live in California, not Minnesota."
1031,1031,He's right.
1032,1032,"The undercarriage wash, that's for cleaning off road salt..."
1033,1033,laid down in our more snowladen sister states.
1034,1034,"Who are you, and why do you know so much about car wash protocol?"
1035,1035,"Well, my name is Sonny Burch."
1036,1036,"And I do my research, Luis."
1037,1037,"To wit, I have learned from a friend of mine..."
1038,1038,at the FBI that you are a known associate of Scott Lang...
1039,1039,"a known associate of Hank Pym, who I've also learned..."
1040,1040,has a portable shrinking laboratory...
1041,1041,filled with all kinds of juicy tech.
1042,1042,And you're gonna tell me where it is.
1043,1043,"Well, I hate to break it to you, but I don't know what you're talking about."
1044,1044,"Well, I sense a resistance in you, Luis."
1045,1045,And I have promised results to some dangerous people.
1046,1046,"So, I'm gonna introduce you to my good friend, Uzman."
1047,1047,Now...
1048,1048,Uzman is a master at extracting information from the unwilling...
1049,1049,through psychoactive means.
1050,1050,"Oh, is that truth serum?"
1051,1051,There's no such thing as truth serum.
1052,1052,That's just nonsense from TV.
1053,1053,"Well, what is it then?"
1054,1054,It's a little concoction that he's been perfecting since his days with the S.I.S.
1055,1055,It makes you suggestible and highly responsive.
1056,1056,"Well, dude, that's truth serum."
1057,1057,"No, it's not."
1058,1058,"No offensing, but they sound like truth serum to me."
1059,1059, Right?
1060,1060, It's not a truth serum.
1061,1061,"Okay. Hey, I believe you."
1062,1062,It's not a truth serum.
1063,1063,"I mean, if it walk like duck and talk like ducks..."
1064,1064,The truth serum.
1065,1065,"Well, I have a lot of allergies..."
1066,1066,so you might wanna think about that.
1067,1067,We've got to get that lab back.
1068,1068,What?
1069,1069,The chamber and the suit are barely helping anymore.
1070,1070,How long have I got?
1071,1071,"A couple of weeks, maybe."
1072,1072,"Well, then we'll make them bring the lab back."
1073,1073,How?
1074,1074,"Lang. He has a daughter, right?"
1075,1075,You can't mean that.
1076,1076,Ava!
1077,1077,I tolerate a lot of the things you do out there...
1078,1078,but I won't be a part of anything like that.
1079,1079,"You're not the one who's about to fade away into nothing, Bill."
1080,1080,I am!
1081,1081,You said you could fix me!
1082,1082,You promised.
1083,1083,I know. I will.
1084,1084,But not like that.
1085,1085,You lay one finger on that little girl...
1086,1086,I won't help you.
1087,1087,And we're done.
1088,1088,Fine.
1089,1089,There are other options.
1090,1090,You know what? You're right.
1091,1091,This isn't truth serum.
1092,1092,Because I don't feel anything.
1093,1093,That was a lie.
1094,1094,I do feel something.
1095,1095,This is truth serum!
1096,1096,There's no such thing!
1097,1097,Okay.
1098,1098,"Okay, okay."
1099,1099,"Now, I'm gonna make this real easy for you, Luis."
1100,1100,Okay.
1101,1101,Where is Scott Lang?
1102,1102,"Well, see, that's complicated."
1103,1103,"Because when I first met Scotty, he was in a bad place."
1104,1104,And I'm not talkin' about cell block D.
1105,1105,"His wife had just filed for divorce, and I was, like..."
1106,1106,"""Damn, homie. She dumped you when you're on lockup?"" And he was, like, ""Yeah, I know."
1107,1107,"""I thought I was gonna be with her forever..."
1108,1108,"""but now I'm all alone."" And I was, like, ""Damn, homie."
1109,1109,You know what?
1110,1110,"""You gotta chin up, because you'll find a new partner."
1111,1111,"""But you know what? I'm Luis."" And he says, ""You know what? I'm Scotty, ""and we're gonna be best friends."" Okay, hold on, hold on."
1112,1112,I like a good story as much as the next person...
1113,1113,but what in the hell does this have to do with where Scott Lang is?
1114,1114,I'm getting there.
1115,1115,I'm getting there.
1116,1116,"You put a dime in him, you gotta let the whole song play out."
1117,1117,He like human jukebox.
1118,1118,"Oh, my abuelita had a jukebox in the restaurant!"
1119,1119,"Yeah, only played Morrissey."
1120,1120,"And if anybody ever complained, she'd be like..."
1121,1121,"You know, Chicanos, we call him ""Moz."" Then, ¡adios!"
1122,1122,What can I say?
1123,1123,"We relate to his melancholy ballads, you know?"
1124,1124, Lang!
1125,1125," Right, right, right."
1126,1126,"So, anyway, Scotty gets out of jail, and he starts working for Hank."
1127,1127,That's when he met Hope.
1128,1128,"And Hope's all, like..."
1129,1129,"""I want nothing to do with you."
1130,1130,"""Look at my hairdo, I'm all business."" And then Scotty's, like, ""You know what, girl?"
1131,1131,My heart is all broken.
1132,1132,"""And I'll probably never find love again, ""but damn if I want to kiss you!"" But then you fast forward and they're all into each other, right?"
1133,1133,"And then Scotty's, like, ""You know what?"
1134,1134,I can't tell you this...
1135,1135,"""but I'm gonna go trash an airport with Captain America."" And then she said, ""I can't believe you split like that!"
1136,1136,"""Smell you later, dummy."" So, Scotty goes on house arrest."
1137,1137,"And he won't admit it, but his heart is all, like..."
1138,1138,"""Damn! I thought Hope coulda been ""my new true partner, but I blew it!"" But fate brought 'em back together."
1139,1139,And then Hope's heart is all...
1140,1140,"""I'm worried that I can't trust him..."
1141,1141,"""and he's gonna screw up again, and ruin everything!"" And then my heart is all, like..."
1142,1142,"""That fancy raspberry filling represents the company's red ""and we're days away from going out of business. Oh!"" ""Out of business""?"
1143,1143,"""Days away""?"
1144,1144,Damn truth serum!
1145,1145,I was trying to protect you guys. I swear to God.
1146,1146,"I was trying to be a good boss, but we're broke!"
1147,1147,And the Karapetyan's our last hope.
1148,1148,"And if we don't show up, we're done!"
1149,1149,That's terrible bossing!
1150,1150,"Damn, bro!"
1151,1151, That's on me! That's on me!
1152,1152, Hey!
1153,1153,Enough.
1154,1154,I'm gonna ask you one more time.
1155,1155,Where is Scott Lang?
1156,1156,"I've been trying to tell you, he's in a tricky spot, emotionally speaking."
1157,1157,Emotionally speaking.
1158,1158,"Well, where is Scott Lang, literally speaking!"
1159,1159,Oh! The woods.
1160,1160,The woods?
1161,1161,Baba Yaga!
1162,1162,"What do you mean, ""the woods""?"
1163,1163,"The Muir Woods, the second fire road off the Panoramic Highway!"
1164,1164,For God's sake!
1165,1165,"♪ Baba Yaga, come at night ♪ Little children, sleepy tight ♪ Damn it!"
1166,1166,If that freak gets Pym's tech...
1167,1167,I'm never gonna see it.
1168,1168,"So, what do we do now?"
1169,1169,It's easier to steal it from the Feds than from the boogeyman.
1170,1170,"Hey, it's me. How'd you like to get a promotion?"
1171,1171,"I got the location on Pym, Van Dyne and Lang."
1172,1172,"But you gonna have to take 'em down now, because they ain't gonna be there for long."
1173,1173,"And when you do, you gonna get me that lab."
1174,1174,Understood.
1175,1175,"Good news, gentlemen."
1176,1176,Feds are gonna do the hard work for us.
1177,1177,What are you lookin' at?
1178,1178,Change my tires!
1179,1179,Right.
1180,1180, Sir.
1181,1181, Can you knock?
1182,1182,"Sorry, sir."
1183,1183,"Uh, but I just got a lead."
1184,1184,"Ooh, I love leads."
1185,1185,System's in the green.
1186,1186,Priming the coils.
1187,1187,Full charge.
1188,1188,As soon as the tunnel's open...
1189,1189,let us know if you get anything that could be a part of her message.
1190,1190,"Yeah, yeah. I will."
1191,1191,"Okay, then."
1192,1192,Here it goes.
1193,1193,We did it!
1194,1194,You got anything?
1195,1195,Nothin'.
1196,1196,"Well, just give it a minute, because it could..."
1197,1197,No.
1198,1198,"No, no, no, no!"
1199,1199,What's happening?
1200,1200,It's shutting down.
1201,1201,Maybe our vectors are off.
1202,1202,"We've gone over them a million times, I know they're right!"
1203,1203,Then what else could it be?
1204,1204,I don't know!
1205,1205," Scott, what are you doing?"
1206,1206," Scott, get away from that!"
1207,1207,"Scott, you can't..."
1208,1208,"I'm sorry, I don't know how much time I have."
1209,1209,I need to fix the algorithm.
1210,1210,"Trust me, after 30 years down here..."
1211,1211,I've thought about it a lot.
1212,1212,Janet?
1213,1213,"Hi, honey."
1214,1214,Jellybean.
1215,1215,Mom?
1216,1216,It's not the reunion I'd imagined.
1217,1217,It's all so rushed.
1218,1218,You two have done such great work.
1219,1219,You just need a little...
1220,1220,nudge.
1221,1221,"Janet, how is this possible?"
1222,1222,It wasn't a message you put in Scott's head.
1223,1223,It was an antenna.
1224,1224,Clever girl.
1225,1225,I'm so proud of you.
1226,1226,"Honey, tell us where you are."
1227,1227,Tell us how to find you.
1228,1228,"No, the probability fields are too complex."
1229,1229,That's why I needed to talk to you.
1230,1230,You have to follow my voice.
1231,1231,Of course!
1232,1232,Like tracing a call back to its source!
1233,1233,I'm tracking your signal using subatomic frequencies...
1234,1234,between point two and point nine.
1235,1235,I'd narrow it to four and six.
1236,1236,That's too tight.
1237,1237,We could miss you.
1238,1238,Look at us squabbling again.
1239,1239,"Fine. All right, between three and seven."
1240,1240,"Our first fight in decades, and it's over just like that."
1241,1241,Bullseye.
1242,1242,Source lock.
1243,1243,It's you.
1244,1244,We got it!
1245,1245,You have to meet me at these exact coordinates.
1246,1246,"In the wasteland, beyond the quantum void."
1247,1247,"It's very dangerous, especially on the human mind, so be careful."
1248,1248,Time and space work very differently down here.
1249,1249,You have two hours.
1250,1250,"After that, the probability fields will shift..."
1251,1251,and it'll be another century before they align like this again.
1252,1252,We'll find you.
1253,1253,"I know you will, Jellybean."
1254,1254,Nope.
1255,1255,Nothing. I got nothing.
1256,1256,No sign of Janet.
1257,1257,Perfect.
1258,1258,How did we get up here?
1259,1259,"All right, first you're gonna see all kinds of lights..."
1260,1260,and it's gonna get really trippy...
1261,1261,but then it's gonna turn black and silent. Really silent.
1262,1262,"Scott, I'll be fine."
1263,1263,I'm just saying because I've been down there.
1264,1264,"Yeah, so you've mentioned."
1265,1265,"Um, sorry."
1266,1266,I have to take this.
1267,1267,"Hey, man, you coming?"
1268,1268,"No, I'm not, but you know what? Ghost is."
1269,1269,"And you know what? The Feds, they know where you are."
1270,1270, What?
1271,1271," I'm sorry, I'm sorry."
1272,1272,"Uh, they gave me some truth serum."
1273,1273,And then all of a sudden I started talkin' all honestly.
1274,1274,"Like, I hate the way that you load the dishwasher."
1275,1275,"I hate it, I hate it."
1276,1276, Uh...
1277,1277, But you need to go home...
1278,1278,because the Feds are probably going there now!
1279,1279,And by the way...
1280,1280,who puts the plates on the top rack? They don't go there!
1281,1281,I feel like such a jerk.
1282,1282,You're gonna be really mad.
1283,1283,We gotta go now.
1284,1284,What?
1285,1285,Ghost knows where we are.
1286,1286,So does the FBI.
1287,1287,How?
1288,1288, I told Luis where we are.
1289,1289, You what?
1290,1290,I told him to come here so I could help him with the Karapetyan proposal.
1291,1291,"Oh, my God!"
1292,1292,"Look, we need to land that account."
1293,1293,"Otherwise, we lose the business!"
1294,1294,Do you know hard it is for excons to find work these days?
1295,1295,"Jesus, Scott!"
1296,1296,the aperture!
1297,1297,You have to depolarize the coils first!
1298,1298,I know!
1299,1299,I'm really sorry...
1300,1300,"but the, um, FBI is coming to my place so..."
1301,1301,I have to go.
1302,1302,Can I borrow the suit?
1303,1303,Gyroscopic stabilizers.
1304,1304,Powering on.
1305,1305,I'm just gonna borrow the suit.
1306,1306,I'll come back.
1307,1307,Just tell me where you'll be.
1308,1308, Don't bother.
1309,1309, What?
1310,1310,"We'll come and get the suit from you, as soon as we've found my mom."
1311,1311, Hope...
1312,1312," Scott, just go!"
1313,1313, Scott?
1314,1314, Daddy?
1315,1315,"It's us, buddy!"
1316,1316,We're here for Cassie's shoes!
1317,1317,He must be resting.
1318,1318,"Honey, why don't you go upstairs and look under your bed?"
1319,1319,"Daddy, you upstairs?"
1320,1320,Daddy?
1321,1321,What the...
1322,1322,He really lives like a pig these days.
1323,1323,Daddy?
1324,1324,Spread out!
1325,1325,Again?
1326,1326,You people have no shame!
1327,1327,The monitor says that he's in the bathroom.
