,Unnamed: 0,dialog
1098,1098,"For the first time in his life he understood the true meaning of the expressions, ""horns of a dilemma"" and ""between a rock and a hard place."" Although the concept of ""paying through the nose"" had always tormented him."
1099,1099,How does the money get in the nose in the first place?
1100,1100,"Once in, is it pulled out by hand or is a sneeze involved?"
1101,1101,And who would accept such a transaction?
1102,1102,"Burning questions all, but he had bigger fish to fry."
1103,1103,What do you have to think about?
1104,1104,I'm here.
1105,1105,I'm in love with you and she's not even available.
1106,1106,I could be.
1107,1107,"Yes, for $500,000 which you don't have."
1108,1108,A small obstacle for a great man.
1109,1109,A small obstacle for a great life.
1110,1110,I need money.
1111,1111,"oh, no!"
1112,1112,Good. that's exactly the reaction I want.
1113,1113,I want the reader to be surprised.
1114,1114,Do you want the reader to hit you over the head with the book?
1115,1115,Think like a writer.
1116,1116,There's more to play with here.
1117,1117,Where does he get the money?
1118,1118,You got the ticking clock with Shaw's proposal and you still don't know who he's going to wind up with.
1119,1119,"If he makes a play for polina and loses, Anna would have to be an idiot to take him back."
1120,1120,I don't know.
1121,1121,"The human heart, it's an ethereal web of contradicting emotions. Hmm, impossible to decipher in all its complexity."
1122,1122,"Yeah, an idiot."
1123,1123,"Ok, good. Can we, uh..."
1124,1124,"Although his feelings for Anna were undeniable, his feelings for polina were slightly more undeniable."
1125,1125,"♪Band playing in the course of the summer on Saint Charles, he had made many acquaintances, some more savory than others."
1126,1126,Do you dance the flamenco?
1127,1127,"Well, I, uh..."
1128,1128,Because real men dance the flamenco.
1129,1129,Are we loaning money to a real man?
1130,1130,"I have been known to flick a castanet on occasion, yeah."
1131,1131,prove it!
1132,1132,"Shoes squeaking Stay with me, boys."
1133,1133,He's good.
1134,1134,The interest is 200 percent.
1135,1135,"We give you $5,000."
1136,1136,"In one year, you pay us $15,000."
1137,1137,That's outrageous!
1138,1138,Senoyou are a desperate man.
1139,1139,You're dancing the flamenco to get money.
1140,1140,This is not a strong bargaining position.
1141,1141,I can't!
1142,1142,You're thieves.
1143,1143,Take it or leave it.
1144,1144,"Ok, 200 percent."
1145,1145,Fine.
1146,1146,You pay us back in one year or we kill you.
1147,1147,"I have $5,000."
1148,1148,Will the casino remove its limit for me tonight?
1149,1149,"Whispering As you wish, monsieur."
1150,1150,"Speaking French Place your bets, ladies and gentlemen."
1151,1151,"for Adam, the moment had come."
1152,1152,"He knew this time it would be different, and it was."
1153,1153,Croupier speaking French Yes!
1154,1154,People cheering Yeah!
1155,1155,People cheering Croupier speaking French People cheering Croupier speaking French All chattering Whispering The management has asked me whether you might be willing to retire for the evening?
1156,1156,One more bet.
1157,1157,"My entire stake, $320,000, on black."
1158,1158,All exclaiming Ok.
1159,1159,Very wellmonsieur.
1160,1160,one more win and polina would be his.
1161,1161,There are times in life when for no apparent reason an unexplained sense of wellbeing comes over you.
1162,1162,You're at one with the universe.
1163,1163,"You know exactly who you are, and your place in the world is secure."
1164,1164,"For Adam, that sense of ultimate bliss was destroyed by 2 words."
1165,1165,"Croupier speaking French just like that, it was all gone."
1166,1166,"His money, his future with polina, and Adam was convinced, his life."
1167,1167,People chattering Kettle whistling Please don't tell me he's gonna go running back to Anna.
1168,1168,I don't know.
1169,1169,"Again, you don't know."
1170,1170,Knocking on door I'll get it.
1171,1171,who the hell could that be?
1172,1172,It's a lady.
1173,1173,"Speaking Spanish I hope we're not disturbing you, baby."
1174,1174,"As a matter of fact, you are."
1175,1175,Oh!
1176,1176,It's a figure of speech.
1177,1177,"How are you doing, boys?"
1178,1178,I like those shirts.
1179,1179,You've got a bat.
1180,1180,We're here for a reminder.
1181,1181,Wait a second.
1182,1182,I got one more day.
1183,1183,I'm almost done.
1184,1184,"Nono, it's good."
1185,1185,We help you to finish.
1186,1186,What are you doing?
1187,1187,Gasping Jesus!
1188,1188,Gasping No distractions.
1189,1189,"Come on, that's my t.V.!"
1190,1190,Whatwhat are you guys speaking Spanish This is...
1191,1191,It's good.
1192,1192,You finish the book.
1193,1193,You get the money.
1194,1194,You buy a flat screen.
1195,1195,"Better picture, man."
1196,1196,Not 25.
1197,1197,"Speaking Spanish Bye, lady."
1198,1198,"Oh, my god."
1199,1199,Are you ok?
1200,1200,"Oh, my god!"
1201,1201,Are you all right?
1202,1202,"Oh, my god!"
1203,1203,Should we call the cops?
1204,1204,Ii don't think that's a very good idea.
1205,1205,Llet's just finish the book.
1206,1206,They'll get their money.
1207,1207,Everything will be fine.
1208,1208,wait a minute.
1209,1209,"Those are the flamenco dancers, aren't they?"
1210,1210,You borrowed money to gamble?
1211,1211,Are you out of your mind?
1212,1212,"Yeah, at the time, yes."
1213,1213,So is everything in this book true?
1214,1214,"No. I mean, there are things I take from real life that work for the story."
1215,1215,Who else is gonna show up? Do you have some sick grandmother who'll come rolling in here and drop dead?
1216,1216,No.
1217,1217,is there really a polina?
1218,1218,"Look, Emma, the next time dimwit and lowboy come back here, they're not just gonna be smashing telephones and t.V.'S, you know."
1219,1219,"So, please, letlet's just try and finish."
1220,1220,"There are banks, you know."
1221,1221,"Yes, I know."
1222,1222,"If you want to take a break, I understand."
1223,1223,"No, I'm fine."
1224,1224,Ok.
1225,1225,You're the one they want to kill.
1226,1226,Way to bounce back.
1227,1227,Here we go.
1228,1228,As Adam walked to... no.
1229,1229,"As Adam wandered the streets of Saint Charles like a man who had not only lost all his money, but all sense of who he was..."
1230,1230,"He found himself lying under the boardwalk, next to an old seagull."
1231,1231,He stared vacantly into the gull's eyes and finally drifted off...
1232,1232,Grunts Alex?
1233,1233,Alex?
1234,1234,How you doing?
1235,1235,Were you sleeping or just thinking?
1236,1236,I was sleepthinking.
1237,1237,Maybe we should take a break.
1238,1238,No. we've got to keep going.
1239,1239,"Alex, if we just get a couple hours of sleep, then we can make the final push."
1240,1240,Ok. 2 hours.
1241,1241,I'm gonna sleep here on the couch.
1242,1242,You take the bed.
1243,1243,Set the alarm while you're up there.
1244,1244,"No, you should sleep in the bed."
1245,1245,I'll be fine on the couch.
1246,1246,Look at you. You can't get any rest like that.
1247,1247,"Well, neither would you, so..."
1248,1248,"All right, we'll both sleep in the bed."
1249,1249,You sure?
1250,1250,Yeah.
1251,1251,Ok.
1252,1252,So you want to sleep together.
1253,1253,You're right.
1254,1254,You should sleep on the couch.
1255,1255,"No, I'm saying it's a rarely used meaning of the term ""sleep together"" where there's actual sleep involved with snoring, rem cycles and all that."
1256,1256,That's all I meant.
1257,1257,I'm setting the alarm.
1258,1258,Good night.
1259,1259,Can you say good night if you're only sleeping for 2 hours?
1260,1260,Good night.
1261,1261,Apparently you can.
1262,1262,Sighs Good night.
1263,1263,"Exhales So, what's his name?"
1264,1264,What?
1265,1265,What's his name?
1266,1266,Who?
1267,1267,Your fiance.
1268,1268,I thought we were trying to get some sleep.
1269,1269,I just want to know what his name is.
1270,1270,It's art.
1271,1271,Art greco.
1272,1272,Art greco?
1273,1273,Mmmhmm.
1274,1274,"Art greco, the discount dentist?"
1275,1275,What?
1276,1276,The guy on all the buses?
1277,1277,Oh.
1278,1278,Yeah.
1279,1279,Yeah.
1280,1280,huh.
1281,1281,He must be good because you've got excellent teeth.
1282,1282,Alex.
1283,1283,Wait a minute. I mean...
1284,1284,Maybe I'm being presumptuous here.
1285,1285,"I mean, just because he's your fiance and a dentist doesn't automatically make him your dentist."
1286,1286,Maybe it's one of those conflict of interest things like a doctor that won't operate on his own family.
1287,1287,"On the other hand, drilling a tooth isn't exactly surgery, although they do call it oral surgery. So, I suppose all right, I lied!"
1288,1288,"I don't have a boyfriend, i don't have a fiance."
1289,1289,I'm not getting married.
1290,1290,But art greco is your dentist.
1291,1291,I'm sorry.
1292,1292,"But if you met you the way I met you, what would you have done?"
1293,1293,I probably would have turned around and walked out.
1294,1294,"I'm glad you didn't, though."
1295,1295,"Me, too."
1296,1296,I'm also glad you don't have a boyfriend.
1297,1297,"Me, too."
1298,1298,Birds chirping he awoke early the next morning to find the seagull sitting on his chest.
1299,1299,"As the early morning mist on the beach and the one in his mind started to clear, his thoughts turned once more to polina."
1300,1300,Alex.
1301,1301,Yes?
1302,1302,Is there a polina?
1303,1303,What do you mean?
1304,1304,In real life.
1305,1305,"Sighing No. not really, you know."
1306,1306,She's an amalgam.
1307,1307,An amalgam?
1308,1308,Yeah. she's a combination of a lot of women I've known.
1309,1309,You've been with a lot of women like her?
1310,1310,"No. you know, you meet people like that."
1311,1311,They run in a fast crowd.
1312,1312,You've been in these fast crowds?
1313,1313,No. you know what I mean. You...
1314,1314,You read about them.
1315,1315,They're always running off to be with that guy on a boat or this guy on a private plane.
1316,1316,And...
1317,1317,She's an amalgam.
1318,1318,Adam went to find polina hoping against hope there was still a chance for him.
1319,1319,How much did you lose?
1320,1320,Everything.
1321,1321,but I can win it back.
1322,1322,Would you be a dear and hand me that pumice stone?
1323,1323,Look...
1324,1324,"Ahem. polina, I know it's a cliche..."
1325,1325,"Clearing throat A cliche to say that the best things in life are free and that money can't buy love, but that's how they become cliches, because they're true."
1326,1326,"Ii mean, shouldn't love trump everything?"
1327,1327,If only we lived in a world of shoulds.
1328,1328,We can.
1329,1329,"No, we should."
1330,1330,But we can't.
1331,1331,Polina.
1332,1332,Please don't deny yourself real happiness.
1333,1333,I'll try not to.
1334,1334,Could you hand me that robe over there?
1335,1335,Sighing Oh!
1336,1336,"Adam, there were times i just adored you."
1337,1337,"with the vacation coming to a close and with the pieces of his heart scattered by the summer winds of Saint Charles, Adam sought solace in the one person who had always been there for him."
1338,1338,She was a modern woman.
1339,1339,She would understand if he spoke from his heart.
1340,1340,He was certain she would take him back.
1341,1341,I don't suppose there's any chance you might no.
1342,1342,Because I went off yeah.
1343,1343,So even if I was to come no.
1344,1344,Because I've shown myself to be exactly.
1345,1345,Ok. so I'll just go yeah.
1346,1346,"Ship horn blowing People chattering for the first time in his life he truly understood the expression: ""Hell hath no fury like a woman scorned."" Not to mention, ""never bite off more than you can chew."" ""Paying through the nose,"" on the other hand, continued to present problems."
1347,1347,Horn blowing The end.
1348,1348,He ends up alone.
1349,1349,You think it's too sad?
1350,1350,It's the only way it can be.
1351,1351,"He obviously never had a chance with polina, and Anna, who was a real possible, as soon as he felt himself getting close to her, he ran for the hills."
1352,1352,It's a classic case of fear of intimacy.
1353,1353,Yeah.
1354,1354,"Your other book was about that, too, wasn't it?"
1355,1355,"No, that was about fear of commitment."
1356,1356,Oh.
1357,1357,Yeah. right.
1358,1358,Ok.
1359,1359,"Well, it's a funny book."
1360,1360,And it's sad.
1361,1361,"And it makes me feel for everyone in it, and you did it in You should feel very good."
1362,1362,Yeah.
1363,1363,"so, where are you going?"
1364,1364,I have 3 days of transcription to do.
1365,1365,We only have 6 hours until the Cuban invasion.
1366,1366,Do you really think it's good?
1367,1367,I think it's very good.
1368,1368,"Thank you, Emma."
1369,1369,You're welcome.
1370,1370,Emma?
1371,1371,"Sighing I, uh..."
1372,1372,You know...
1373,1373,"I, uh..."
1374,1374,"I ""uh"" you, too."
1375,1375,Bye.
1376,1376,"Hey, taxi!"
1377,1377,Hey!
1378,1378,"Merci, monsieur."
1379,1379,Keep the change.
1380,1380,No.
1381,1381,Ringing Hello.
1382,1382,Static crackling Hello?
1383,1383,Polina?
1384,1384,Hi.
1385,1385,Hi.
1386,1386,Clears throat You look good.
1387,1387,"You, too."
1388,1388,Mmm.
1389,1389,"So, how you been?"
1390,1390,Chuckles I left John.
1391,1391,Really?
1392,1392,Sighs What can I say?
1393,1393,I shouldn't have gone with him in the first place.
1394,1394,"No, you were looking out for your children."
1395,1395,That's my problem.
1396,1396,I never think of my own happiness.
1397,1397,"You should have knocked me out, tied me up."
1398,1398,Taken me away with you.
1399,1399,Thank you.
1400,1400,"Deep down, I always knew you were the one."
1401,1401,People chattering Alex?
1402,1402,Alex?
1403,1403,Are you seeing anyone?
1404,1404,"When I saw you on that dock, you were like something out of a fairy tale."
1405,1405,"Mmm, Alex."
1406,1406,"No, really, i became intoxicated like somebody had slipped something into the air."
1407,1407,all done.
1408,1408,Emma?
1409,1409,"Uh, iii didn't know you'd be finished so soon."
1410,1410,"I mean, I was just on my way back."
1411,1411,"It's ok, I found you."
1412,1412,"Car honking Emma, this is polina."
1413,1413,"Polina, this is Emma."
1414,1414,She's my stenographer.
1415,1415,I just finished dictating my novel to her.
1416,1416,She did an amazing job.
1417,1417,I have to go.
1418,1418,"It was very nice to meet you, polina."
1419,1419,I've heard so much about you.
1420,1420,I'll be right back.
1421,1421,Ahem. Emma.
1422,1422,I didn't know she was coming.
1423,1423,"I thought she was don't, Alex!"
1424,1424,Please! 'cause you know what happens with these things.
1425,1425,"Somebody always says something to try to make the other person feel better, but it never does, so if you could just not say anything!"
1426,1426,Your stenographer?
1427,1427,You introduced me as your stenographer?
1428,1428,Iii didn't know what to say.
1429,1429,Ii didn't want to hurt either one of you.
1430,1430,"No, Alex."
1431,1431,Who you didn't want to hurt was you.
1432,1432,Emma.
1433,1433,Wait a sec.
1434,1434,You know what i can't figure out?
1435,1435,"What's it gonna be, sweetheart?"
1436,1436,"Yeah, one second."
1437,1437,"I can't figure out what's worse, having to know every single detail about your desperate love for some other woman or having to know that you obviously never came close to feeling the same way about me."
1438,1438,"Goodbye, Alex."
1439,1439,Bus pulling away She's not just your stenographer.
1440,1440,No.
1441,1441,Is she your girlfriend?
1442,1442,Not anymore.
1443,1443,Come with me tonight.
1444,1444,There's a darling little charity ball at the ritz.
1445,1445,"Landmines, I think."
1446,1446,"No, I don't think I can hey, it's perfect."
1447,1447,You finished your novel.
1448,1448,We can leave for Paris in the morning.
1449,1449,"It's beautiful this time of year, and the kids would love to see you."
1450,1450,I'll take you to giverny.
1451,1451,Have you ever seen the water lilies?
1452,1452,They're magical.
1453,1453,"Polina, have you ever done your own laundry?"
1454,1454,What?
1455,1455,Nothing.
1456,1456,you should have a gun to your head more often.
1457,1457,You like it?
1458,1458,You kidding me?
1459,1459,Usually an author falls on his ass with his 2nd effort.
1460,1460,This is terrific.
1461,1461,Ok!
1462,1462,Here you go.
1463,1463,Just like you requested.
1464,1464,"$25,000 made out to you and $100,000 made out to..."
1465,1465,"Now, is it ""Cuban mafia"" or ""the Cuban mafia""?"
1466,1466,"I'm kidding, cash."
1467,1467,So...
1468,1468,What do you think of the ending?
1469,1469,I like it. It's bittersweet.
1470,1470,Yeah.
1471,1471,"Dog barking Phone ringing hi, I can't come to the phone right now."
1472,1472,Please leave a message.
1473,1473,"Beeping Emma, it's me."
1474,1474,"If you're there, please pick up."
1475,1475,I'm not just calling to make you feel better.
1476,1476,I really need to talk to you.
1477,1477,Please give me a call.
1478,1478,Clicking Can we talk?
1479,1479,Oh!
1480,1480,Did the fact that you called with no response from me send any kind of signal to you?
1481,1481,"Yeah. I mean, I'm not an idiot."
1482,1482,"I figured you wanted to talk to me, but your machine was broken."
1483,1483,"Emma, wwait a second."
1484,1484,"Emma, wait."
1485,1485,"Look, I..."
1486,1486,I think I'm in love with you.
1487,1487,I think I couldn't care less.
1488,1488,"Emma, please, just He screwed up bigtime with his wife's cousin!"
1489,1489,I did not start this whole thing.
1490,1490,he tells one version.
1491,1491,She was telling me the whole time that my wife was cheating on me.
1492,1492,she tells another.
1493,1493,that's not how it happened.
1494,1494,"No. No, it's not."
1495,1495,Maybe my life is not so bad.
1496,1496,Phone ringing his wife hello?
1497,1497,Emma?
1498,1498,"Alex, if you keep this up I have your check."
1499,1499,I could bring it over if you want.
1500,1500,Because you worked so many extra hours I added in up send it to me.
1501,1501,I need to talk to you about the book.
1502,1502,No.
1503,1503,"Look, the ending is not right."
1504,1504,My editors think it's fine.
1505,1505,You're the only one i can talk to about it.
1506,1506,"I'm not gonna do this, Alex."
1507,1507,I think Adam should end up with Anna.
1508,1508,I don't think so.
1509,1509,There are some things that are nothing more than what they are.
1510,1510,They're not meant to last.
1511,1511,They take their place in your heart and make you a little smarter the next time.
1512,1512,Emma.
1513,1513,"If you care for me as much as you say you do, then please respect my feelings and let's move on with our lives, ok."
1514,1514,Ok?
1515,1515,Ok.
1516,1516,"Good night, Emma."
1517,1517,"Goodbye, Alex."
1518,1518,Phone clicks Dial tone buzzing People chattering Elevator bell dings Keyboard clicking Phone ringing Can I help you?
1519,1519,"Well, I'm here for a deposition."
1520,1520,Is there a Mr. Taylor?
1521,1521,"Ah, yes."
1522,1522,We've been expecting you.
1523,1523,If you could just take a seat.
1524,1524,Your stenographer is here.
1525,1525,"Yes, I'll tell her."
1526,1526,Someone will be with you in just a moment.
1527,1527,Door opening Good morning.
1528,1528,I'm Marty Van buren.
1529,1529,Won't you come in?
1530,1530,Yes.
1531,1531,Just follow me.
1532,1532,"Jenny, uh, could you get me that deposition on the McKinley case?"
1533,1533,Right away.
1534,1534,Great.
1535,1535,"Ok, why don't you just, uh, go in here and set up and, uh, Zack Taylor will be with you in a minute."
1536,1536,Thank you.
1537,1537,"People chattering Door opening Oh, Jesus!"
1538,1538,"Welcome to polk, Taylor, Fillmore, Pierce & Van buren."
1539,1539,I take it you met Marty.
1540,1540,What is this?
1541,1541,He's actually my publisher.
1542,1542,These are his offices.
1543,1543,"He charged me an arm and a leg for all the new lettering, but the roleplaying was free."
1544,1544,What do you want from me?
1545,1545,"I told you. I wanna change the ending of the book 'cause, you know, some people, they go right to the last page."
1546,1546,"So, it's important I think you should get someone else to do this."
1547,1547,"Look, there's no one else that I trust."
1548,1548,"You're the only one who'll know if it's real, if it's honest."
1549,1549,Alex.
1550,1550,It's only a couple of pages.
1551,1551,"Emma, please."
1552,1552,Oh.
1553,1553,Sighs Adam returned to andover filled with the dizzying emotions of the summer on Saint Charles.
1554,1554,Emotions that he hoped he could capture on paper.
1555,1555,"When his thoughts turned to polina, it was as if she were some kind of dream."
1556,1556,I can't do this.
1557,1557,"Please, Emma."
1558,1558,Just keep typing.
1559,1559,Please.
1560,1560,"He remembered her flawless skin, her dark, intense eyes, her captivating smile."
1561,1561,"Then one day, that dream walked back into his life."
1562,1562,Her beauty was still undeniable.
1563,1563,Why are you doing this to me?
1564,1564,Because I need you to understand.
1565,1565,"Just let me finish, Emma. Then you can walk out the door, and I swear I'll never bother you again."
1566,1566,"Her beauty was still undeniable, but it wasn't the same."
1567,1567,"As she spoke of her feelings for him, all he could think of was Anna."
1568,1568,"Sweet, caring, beautiful Anna, and how his own failings had driven her away."
1569,1569,Anna had become part of him.
1570,1570,He had fallen so completely in love with her that it was hopeless to think he could ever be with anyone else.
1571,1571,And so he said goodbye to polina and set off to win back the heart of his true love.
1572,1572,"Yes, polina had been a dream, like a creation from one of his stories, but Anna was real."
1573,1573,And for the first time in his life that felt more powerful than anything he could ever invent.
1574,1574,The end.
1575,1575,Nice last sentence.
1576,1576,"I'm just a writer, Emma."
1577,1577,I don't know what to do to show you how much I love you.
1578,1578,I only have words.
1579,1579,That's all I have.
1580,1580,Maybe I was wrong.
1581,1581,About what?
1582,1582,Maybe you can catch the rabbit.
