,Unnamed: 0,dialog
532,532,You want me to laughs Kill Shaw?
533,533,I owe him so much money.
534,534,"And if he lives, i will have to marry him."
535,535,Yes.
536,536,"Well, I'd kill him in a second, you understand."
537,537,"It's just that, uh, when you're a tutor, and people see the word ""murderer"" on your resume, sometimes they have a tough time getting past that."
538,538,"Laughing I'm teasing, of course."
539,539,"it was at this moment that Adam realized that all that stood between him and the perfection of polina's arms, was inexhaustible wealth."
540,540,What is it with guys like Adam?
541,541,What do you mean?
542,542,Do they really like being driven crazy by women like polina?
543,543,They're like lemmings running into the sea.
544,544,They can't wait to be drowning in their own misery.
545,545,"If they're not in agony, then it can't be love!"
546,546,Why do men want women like that?
547,547,Maybe you're not picturing polina the way I'm picturing her.
548,548,What?
549,549,"Gorgeous, exciting, incredibly sexy?"
550,550,Toilet flushing Maybe you are.
551,551,"Yeah, that's great for a weekend, but what do you think will happen in the long run?"
552,552,"What do you mean, like the next weekend?"
553,553,No. like when it's time for the first laundry.
554,554,I know. I know.
555,555,"In great romantic novels, there's no laundry."
556,556,There's people like ylva or Elsa to do it.
557,557,Maybe that's why i like them.
558,558,They can wash their own clothes.
559,559,"Sighs Ok, where were we?"
560,560,"oh, yes. Adam needs a fortune so he can live happily ever after with his true love."
561,561,who is it?
562,562,"Elsa, it's me, Adam."
563,563,"Oh, Mr. shipley, I'll be right there."
564,564,"Oh, I'm sorry."
565,565,Am I inconveniencing you?
566,566,"No, I was just washing mein hair."
567,567,Come in.
568,568,Won't you sit down?
569,569,I can't stay long.
570,570,Sit down!
571,571,All right.
572,572,I'll make you tea.
573,573,"oh, this is good."
574,574,"You're creating another triangle: Polina, Adam, Elsa."
575,575,"No, she's just someone he can talk to."
576,576,He feels comfortable with her.
577,577,"You know, now that she's German."
578,578,I hear there's a casino on the island.
579,579,Yeah?
580,580,The general goes there often with madame blanche.
581,581,Where is this casino?
582,582,"Right off the boardwalk, next to the regency."
583,583,"But, Mr. shipley, you're not thinking Elsa, do you believe in destiny?"
584,584,Destiny?
585,585,That a man and a woman are meant to be together?
586,586,Yeah.
587,587,But only if they are both ready.
588,588,"With love, one must be patient."
589,589,You must not eat the fruit until it is ripe.
590,590,The baby must crawl before he can walk.
591,591,The farmer must sow before he can reap.
592,592,"The butcher must kill before he can Elsa, you struck oil."
593,593,Stop drilling.
594,594,I'm talking about fate here.
595,595,"When feelings are so powerful, it's as if some force beyond your control is guiding you to someone who can make you happy beyond your wildest dreams."
596,596,"I never thought I could experience feelings such as these, until now."
597,597,I thought they only existed in story books.
598,598,But now I know it can be real.
599,599,It can?
600,600,"Yes, Elsa. Yes."
601,601,"Oh, Adam."
602,602,"And once I have money, my destiny, polina shall be mine."
603,603,oh!
604,604,Oh!
605,605,I am so sorry!
606,606,Maybe if you blow on it!
607,607,Will you ever forgive me?
608,608,why should she ask for forgiveness?
609,609,Are you kidding?
610,610,She poured scalding hot water on his crotch.
611,611,He led her on.
612,612,He made her think that he wanted her.
613,613,She misinterpreted.
614,614,"No, I don't think so."
615,615,"And don't tell me that Elsa winds up getting hurt, because that would be so unfair."
616,616,I don't know.
617,617,Can't always control what happens to characters.
618,618,Sometimes they take you to unexpected places.
619,619,People get hurt in books.
620,620,People get hurt in real life.
621,621,"Adam left a disappointed, but resilient Elsa, like a..."
622,622,"Adam left a disappointed, but resilient Elsa, like a man on a mission."
623,623,"A man on a mission with hot, wet balls."
624,624,Alex...
625,625,"Ok, lose the balls."
626,626,Adam entered the edifice that he hoped would transform his life.
627,627,$200 was all he had to his name.
628,628,It was enough to get him through the summer but certainly not enough to win a woman like polina.
629,629,"place your bets, ladies and gentlemen."
630,630,the atmosphere was intoxicating.
631,631,There was more money than he had ever seen in his life.
632,632,"Speaking French How do I, uh..."
633,633,"Merci, monsieur."
634,634,"Speaking French Place your bets, ladies and gentlemen."
635,635,Speaking French his heart beat like a drum.
636,636,He understood instantly that this wasn't just a game he would play for his amusement.
637,637,It meant a lifetime of love with polina.
638,638,"Every roll, every bounce of that little ivory ball would bring him one step closer to paradise."
639,639,zero! zero!
640,640,Zero? that's green.
641,641,I thought there was only red and black.
642,642,There's green?
643,643,"Oui, monsieur."
644,644,"So what is that, like a doover?"
645,645,"No, monsieur, you lost."
646,646,I lost?
647,647,You lost.
648,648,Adam would have to find another route to polina's heart.
649,649,And what is so wrong with poverty?
650,650,Ah! the voice of the common man.
651,651,"No, really."
652,652,Thethe proletariat are not as miserable as they're made out to be.
653,653,"Wealth does not make for happiness, Mr. Shaw."
654,654,It is love which sustains us.
655,655,The joy of family.
656,656,The wonders of nature!
657,657,The supreme pleasure of spending a life with someone devoted to you!
658,658,And no amount of money will ever give us these!
659,659,No amount!
660,660,I see you found the casino.
661,661,"Very interesting concept, Mr. shipley."
662,662,Poverty as an aphrodisiac.
663,663,All sniggering Pay no attention to him.
664,664,He's jealous of your purity.
665,665,"Yes, I long for insolvency."
666,666,"Oh, please, John."
667,667,"Claude speaking French Oui, Claude."
668,668,She's dead.
669,669,"""Grandmother is gone. Stop."
670,670,"""We have closed up the house. Stop."
671,671,Details to follow.
672,672,"Stop."" could it be?"
673,673,Money was no longer an obstacle?
674,674,Polina found herself with feelings she never knew she had.
675,675,"What she assumed would be the answer to all her problems, left her with unexpected sorrow."
676,676,Her grandmother had been a kind soul.
677,677,And polina was filled with the loss of the woman who had so often held her in her arms and comforted her with her warmth and wisdom.
678,678,Rain pattering That's beautiful.
679,679,You don't like it?
680,680,"No, I'm saying it's beautiful."
681,681,"Well, thank you."
682,682,You're welcome.
683,683,I think that about does it for today.
684,684,Ok.
685,685,"You know, you're not at all like you seemed at first."
686,686,How's that?
687,687,Well...
688,688,At first you seemed kind of like...
689,689,What?
690,690,"Well, kind of a mess."
691,691,A mess.
692,692,Yeah. you live like a slob.
693,693,You're a hypochondriac.
694,694,"You're extremely insecure, and you lie."
695,695,Thank you.
696,696,It's true.
697,697,But...
698,698,Somehow all those qualities combine to make something...
699,699,I don't know. Nice.
700,700,"I think your qualities combine nice, too."
701,701,What do you say we get an early start tomorrow?
702,702,"Ok, great. Early."
703,703,I'll see you tomorrow.
704,704,Ok.
705,705,Ohoh!
706,706,"Gasps Oh, my god!"
707,707,Wait! wait!
708,708,"All right, honey! It's all right. Take your time."
709,709,"Oh, my god!"
710,710,"Oh, my god!"
711,711,"Oh, my god!"
712,712,Knocking on door Hi!
713,713,You said you wanted to get an early start.
714,714,My alarm didn't go off.
715,715,What time is it?
716,716,No wonder it didn't go off.
717,717,What time did you get up?
718,718,Around 5:00.
719,719,I'm an early person.
720,720,"Some people are early people, other people are late people."
721,721,What kind of person would you say you are?
722,722,Are you moving in?
723,723,"No, I just bought some groceries for us, that's all."
724,724,For us?
725,725,"Well, for me, really."
726,726,"I can't keep working without eating something normal, but you're more than welcome to them."
727,727,"I mean, don't get me wrong."
728,728,I like fish sticks and cap'n crunch as much as the next guy.
729,729,"Sorry, I just got caught up oh, you don't have to apologize."
730,730,I understand.
731,731,You're a creative genius.
732,732,You shouldn't have to worry about things like food or eating.
733,733,Why don't you go take a shower and I'll make you some breakfast?
734,734,"No, no."
735,735,We don't have time.
736,736,We still need at least 150 pages.
737,737,We'll eat as we work.
738,738,Let's see what we have from yesterday.
739,739,Yesterday?
740,740,Yeah. let's go over yesterday and see where we are.
741,741,"You know, why don't we just keep going?"
742,742,"Like you said, we don't have a lot of time."
743,743,"If we keep going over and over what we've already done, then we won't get finished."
744,744,"""Adam walks through the casino ""and sees lots of people sitting around and doing stuff like playing roulette and drinking booze and yakking."" I thought that Adam..."
745,745,"""Adam liked polina, but he also knew she was kind of weird."
746,746,"""So, even though sometimes he thought it was love, all it really was that he was hot for her."" Well, Alex, it's true."
747,747,"No, it's not!"
748,748,He's madly in love with her from the first minute he sees her!
749,749,And where's what I wrote?
750,750,I was getting on the bus.
751,751,Sobs And there was rain and a huge puddle.
752,752,And my feet just tripped.
753,753,And it just spilled.
754,754,And I'm sorry.
755,755,And I tried.
756,756,I tried to fix it!
757,757,It's not your fault.
758,758,"Yeah, it is."
759,759,I'll fix it.
760,760,I've lost pages before.
761,761,It'll be ok.
762,762,It will?
763,763,"Yeah, it will be fine."
764,764,How many pages got wrecked?
765,765,Alarm ringing Sighs Time to get up.
766,766,"as polina mourned for her beloved grandmother and tended to family matters, Adam struggled to keep his feelings for polina in check."
767,767,Adam's friendship with Elsa continued to grow.
768,768,"Unaware of the deeper feelings she held for him, he regaled her with stories of the exciting life that he would share with polina."
769,769,Adam's passions continued to rage out of control.
770,770,"With his beloved Red Sox well out of contention for the American league pennant, baseball no longer provided a viable diversion."
771,771,Shaw was not to be underestimated.
772,772,"Despite the insubstantial mustache, he'd proven himself to be a formidable foe."
773,773,Adam knew that all too well.
774,774,He had to make his move. But when?
775,775,Can I?
776,776,"Yeah, sure. Go ahead."
777,777,I'm formulating.
778,778,I don't like tomato skins.
779,779,Who are you?
780,780,What?
781,781,We've been in this room for over 3 weeks.
782,782,"Aand besides the fact that you have an opinion for just about everything that I do, and a rather odd way of eating pizza, I don't know anything about you."
783,783,"Like, where are you from?"
784,784,What have you been doing with your life?
785,785,Do you have friends?
786,786,A boyfriend? Parents?
787,787,"It's my personal life, Alex."
788,788,I know. I know.
789,789,"And if you don't feel like sharing, i completely understand."
790,790,I live in Jamaica plain.
791,791,"Both my parents are dead, I think."
792,792,My mother died 6 years ago.
793,793,"My father left when we were very young, and I heard he drank himself to death."
794,794,"Like I said, if you don't feel like sharing..."
795,795,Did you mention whether or not you have a boyfriend?
796,796,I didn't.
797,797,Do you think you will mention it?
798,798,Maybe.
799,799,Do you think you'll mention it now?
800,800,I do have a boyfriend.
801,801,And I met him last year at a hockey game.
802,802,Oh.
803,803,"Now, is it serious or is it just one of those hockey romances?"
804,804,We're planning on getting married next June.
805,805,Oh.
806,806,"Well, I think I'm about done formulating."
807,807,Where was I?
808,808,"Uh, Adam was deciding when to make his move."
809,809,Yes.
810,810,Adam could wait no longer.
811,811,He felt like a kid who had just finished counting in hideandgoseek.
812,812,"It was now, ""ready or not, here I come."" Yet still, his overture must not appear insensitive or indelicate."
813,813,Moaning wait a minute. Wait a minute.
814,814,What are they doing?
815,815,what does it look like they're doing?
816,816,Just like that?
817,817,Why not?
818,818,Her grandmother just died.
819,819,Exactly.
820,820,She's looking for comfort.
821,821,I thought you said Adam was going to be sensitive to her.
822,822,You're right. I did.
823,823,I am so sorry that your grandmother died.
824,824,"Alex, it just isn't right like this."
825,825,Are you nuts?
826,826,It's fabulous like this.
827,827,"No, it's not."
828,828,"Yes, it is."
829,829,"No, it's not."
830,830,"Look, I'm the writer, ok?"
831,831,And I'm saying it is.
832,832,"And I'm the reader, ok?"
833,833,And I'm saying this is really bothering me.
834,834,"I'm trying very hard to like Adam, and you're making it extremely difficult."
835,835,You know what?
836,836,This isn't about Adam.
837,837,You've had it in for polina since the very beginning.
838,838,"Oh, please!"
839,839,You have.
840,840,I do not have it in for a fictional character.
841,841,Ok.
842,842,She's flighty. She's flirty.
843,843,She's a flawed character.
844,844,"Oh, of course! The 3 fluhs: Flighty, flirty and flawed."
845,845,"Yes. and clearly, if he's chasing after someone like her, he's sitting on some pretty major issues."
846,846,"Oh, really?"
847,847,She's the hottest girl on the island by a factor of 10!
848,848,"So, uh, maybe he's not the one with the issues."
849,849,What is that supposed to mean?
850,850,He's not the one who values propriety over passion.
851,851,Are you saying i don't believe in passion?
852,852,No.
853,853,"II'm sure you do, just so long as the laundry is done first."
854,854,Adam and polina tumbled passionately into bed.
855,855,Adam and polina tumbled passionately into bed.
856,856,"Oh, boy! Now you're talking!"
857,857,Moaning Moaning Thisthis is a great island!
858,858,What?
859,859,Whoo!
860,860,Adam groaning Yelling What?
861,861,Whoo!
862,862,Moaning Both sighing I'm exhausted.
863,863,I bet you are.
864,864,"Ok, so now what?"
865,865,What do you mean?
866,866,Grandmother is dead.
867,867,Everything's worked out for our lovebirds.
868,868,Polina has her money.
869,869,Adam has polina.
870,870,Shaw goes away.
871,871,Now what happens?
872,872,I have to vomit.
873,873,"Alex groaning You have no place to go from here, do you?"
874,874,You've written yourself into a corner.
875,875,Alex continues groaning You're supposed to put your head over the toilet.
876,876,"Yeah, iI've been vomiting since I was 6."
877,877,I believe I can handle it.
878,878,I think I'm dying.
879,879,You're not dying.
880,880,"No, really. I'm burning up."
881,881,I feel real bad.
882,882,Panting You're not that warm.
883,883,Why does everyone just tacitly accept thehandtotheforehead test as being medically reliable?
884,884,You're fine.
885,885,I've got a pain in my chest.
886,886,This could be serious.
887,887,Ok.
888,888,"Listen, if these symptoms persist and you really think you're having a heart attack, now this is important, I want you to call me immediately."
889,889,Because there's no point in my wasting bus fare if you're just going to be dead.
890,890,Have a nice evening.
891,891,"Door opening and closing so, what are you saying?"
892,892,You're still blocked?
893,893,totally.
894,894,"I mean, who said it better than you?"
895,895,Grandmother's dead.
896,896,Polina's got the money.
897,897,"Adam's got polina, and I've got nowhere to go."
898,898,"You're not going to vomit again, are you?"
899,899,I've got to get out of here.
900,900,Where are you going?
901,901,We don't have much time left.
902,902,Shouldn't we keep working?
903,903,This is working.
904,904,It is?
905,905,"Yeah. when I get stuck, i need to get my mind off things for a while."
906,906,"I need to look at birds, trees, people doing things like throwing frisbees, rollerblading, that kind of thing."
907,907,"Good. maybe once you clear your mind, you realize he should have never jumped into bed with her like that."
908,908,People chattering i wanted to be a writer for as long as I can remember.
909,909,My parents got divorced when I was 8.
910,910,I started writing stories as a place to put my feelings.
911,911,Ii found it was a lot easier to have characters say things than to say them myself.
912,912,That's the beauty of writing.
913,913,You can have things work out the way they never seem to in real life.
914,914,Sometimes things work out in life.
915,915,"Hey, I'm all for it."
916,916,Have you ever been married?
917,917,In real life? No.
918,918,Let me guess.
919,919,You just haven't met the right woman.
920,920,Exactly.
921,921,And I know what you're going to say: You have to be the right man in order to meet the right woman.
922,922,"But ii know in my heart that I am the right man, and I know that the perfect woman is out there."
923,923,"Someone who's smart, funny, and beautiful."
924,924,And here's the tricky part: Interested in me.
925,925,I know she's out there.
926,926,I just can't seem to...
927,927,It's like...
928,928,Ii feel like one of those greyhounds at the dog track.
929,929,"You know, chasing the mechanical rabbit?"
930,930,"I get so close, but I can never quite seem to catch it."
931,931,They never do.
932,932,I know.
933,933,Maybe you don't want to catch it.
934,934,♪ What did you say? ♪ ♪ I know I saw you singing ♪ ♪ my ears won't stop ringing ♪ ♪ long enough to hear those sweet words ♪ ♪ what did you say? ♪ ♪ All your love ♪ ♪ is a lost balloon ♪ ♪ rising up through ♪ ♪ the afternoon ♪ ♪ till it could fit on the head of a pin ♪ ♪ what did you say? ♪ ♪ I know I saw you singing ♪ I hope today helped.
935,935,It did.
936,936,Things are starting to percolate.
937,937,I had a great time.
938,938,"Me, too."
939,939,"Oh, this is it."
940,940,Oh.
941,941,Well...
942,942,♪ I just wanna hear those sweet words ♪ I got it! I got it!
943,943,What?
944,944,I never should have had the grandmother die.
945,945,This is great!
946,946,Thank you! Thank you!
947,947,I love you!
948,948,"You know what I mean, right?"
949,949,Yeah.
950,950,This is great.
951,951,Great.
952,952,All right.
953,953,I'll see you tomorrow.
954,954,The grandmother lives!
955,955,Look who is alive!
956,956,The telegram said you were gone.
957,957,"Well, of course I was gone."
958,958,"If I was not gone from there, how could I be here?"
959,959,Weren't you worried taking such an arduous trip considering your health?
960,960,My health is fine.
961,961,"Those stupid doctors, all idiots."
962,962,They should have their licenses revoked.
963,963,Every last one of them!
964,964,"First, they gave me a year to live, then it became 6 months."
965,965,Then less than a month.
966,966,"To listen to them, I'd be dead 10 minutes after I got here!"
967,967,Laughing what are you doing?
968,968,The dead grandmother's what got you stuck in the first place.
969,969,Now she's dead again?
970,970,No money at all?
971,971,"Oh, your mother had acquired one of the most extraordinary collections of rare perfumes in the history of France."
972,972,Worth a fortune.
973,973,"As you know, your mother, god rest her soul, made it to 90."
974,974,"Sadly, the perfumes did not."
975,975,What?
976,976,They all evaporated.
977,977,"The last of it, during her brief struggle with scurvy."
978,978,Your mother's fortune has evaporated?
979,979,Every penny of it?
980,980,She had scurvy?
981,981,"upon hearing grandmother's money had gone the way of all Chanel, Adam pondered his fate."
982,982,He was no fool.
983,983,"He was a tutor, for god's sake."
984,984,"He knew it was only a matter of time before polina would find herself once again in the arms of his rival, the odious John Shaw."
985,985,He pondered the engagement.
986,986,He pondered the wedding.
987,987,And then he pondered the wedding night.
988,988,It was at that point he realized maybe he should stop pondering.
989,989,Eldora!
990,990,"Speaking Spanish Oh, senor shipley, you must try to forget her."
991,991,"Here, have some paella."
992,992,"oh, whoa! Whoa!"
993,993,What?
994,994,eldora?
995,995,Eldora.
996,996,"Eldora, the Spanish au pair, who was Elsa, the German au pair, who was ylva, the Swedish au pair?"
997,997,Si.
998,998,"no. Alex, absolutely not."
999,999,"Even if eldora was the greatest character since Scarlet O'Hara, which quite frankly seems like a long shot, we don't have time to change everything."
1000,1000,"I know, but We have 3 days."
1001,1001,"I know, but something's missing."
1002,1002,Maybe he needs another obstacle to keep him from polina.
1003,1003,He's broke.
1004,1004,"She's marrying another man, and if you ask me, she doesn't even love him."
1005,1005,I think he has enough obstacles.
1006,1006,Wait. wait. I got it.
1007,1007,"It's not an obstacle, it's the 2nd triangle."
1008,1008,You were right about the 2nd triangle.
1009,1009,This can work.
1010,1010,And the changes will be easy.
1011,1011,"She's an American from Philadelphia, and her name is Anna."
1012,1012,"Hello, Adam."
1013,1013,What?
1014,1014,"You seem different today, Anna."
1015,1015,Did you do something to your hair?
1016,1016,"there was something in Anna's eyes that Adam, until now, blinded by his love for polina, hadn't seen."
1017,1017,"A deep sadness, combined with a quiet strength that made her seem incredibly beautiful."
1018,1018,are you sure you want to do this?
1019,1019,Absolutely.
1020,1020,"It's not very attractive, you know."
1021,1021,He's just rebounding.
1022,1022,"No, he's not."
1023,1023,Rebounding like a wild man.
1024,1024,What are you talking about?
1025,1025,This is the triangle heating up.
1026,1026,Anna has feelings for him.
1027,1027,He has feelings for her.
1028,1028,But he also has feelings for polina.
1029,1029,"This way, the reader doesn't know who he'll wind up with."
1030,1030,You hook them in.
1031,1031,Who does he end up with?
1032,1032,See? hooked.
1033,1033,What do you say we head into town?
1034,1034,I have to you don't have to do anything.
1035,1035,You're making stew.
1036,1036,That's why they call it stew.
1037,1037,You let it stew.
1038,1038,Come on. Live a little.
1039,1039,IiI'll buy you lunch.
1040,1040,Are you hungry?
1041,1041,Not really.
1042,1042,Perfect.
1043,1043,i don't have any money.
1044,1044,Sounds good.
1045,1045,How did you come to work for the delacroixs?
1046,1046,I answered an ad for a summer job I've been with them ever since.
1047,1047,"Summers in Saint Charles, winters in Switzerland, and the rest of the year in Paris."
1048,1048,It sounds exciting.
1049,1049,Yeah.
1050,1050,Now that didn't sound exciting.
1051,1051,"I'm living their life, not mine."
1052,1052,People chattering Maybe we can do something about that.
1053,1053,What?
1054,1054,"Now, I'm just spitballing here, but how about this?"
1055,1055,I like living my life.
1056,1056,while those of a more cynical nature might think that Adam was merely on the rebound...
1057,1057,cute.
1058,1058,...the truth is that he found comfort in Anna.
1059,1059,"And with each passing day, his feelings for her grew stronger."
1060,1060,It's so interesting watching this process unfold.
1061,1061,I didn't really understand what you meant when you said the characters would lead you.
1062,1062,But now it's so clear why Anna and Adam would end up together all this time.
1063,1063,They've been so close to each other without seeing what they had.
1064,1064,Who says they're gonna wind up together?
1065,1065,They're not?
1066,1066,I don't know.
1067,1067,How could they not end up together after they were so romantic?
1068,1068,That's exactly the point.
1069,1069,"See, if he's crazy about one, but only lukewarm about the other, where's your triangle?"
1070,1070,"But if he feels equally strong about both women, that's a real dilemma."
1071,1071,"Yeah, but then you have no."
1072,1072,Now we've got to stir things up a little.
1073,1073,"Shipley, how goes it, my good man?"
1074,1074,"We're certainly in a good mood today, old bean."
1075,1075,And why not?
1076,1076,"Tonight, I shall ask polina for her hand in marriage and by week's end, we'll be off to Paris to prepare for the wedding."
1077,1077,Tonight?
1078,1078,Congratulations.
1079,1079,And you're sure she'll accept?
1080,1080,"I have 500,000 reasons that say she will."
1081,1081,That's a lot of reasons.
1082,1082,The lovely polina has expensive tastes.
1083,1083,Adam thought he had gotten over polina.
1084,1084,But the imminence of her betrothal made one thing abundantly clear.
1085,1085,It was time to start pondering again.
1086,1086,How does one choose between 2 women that one loves so dearly?
1087,1087,One pulls one's head out of one's ass and realizes the obvious.
1088,1088,What we have is substantial.
1089,1089,"Birds chirping When you lie in bed at night, is that what you dream of, something substantial?"
1090,1090,"Or do you dream of glamour, excitement, a life of adventure?"
1091,1091,Dreams are often only that.
1092,1092,Excuse me?
1093,1093,I am just saying our love is based on something real.
1094,1094,"It's based on caring, understanding, mutual respect."
1095,1095,"You left out that you gave him the wildest, most passionate sex he's ever experienced."
1096,1096,"Oh, wait. That was me."
1097,1097,he was wracked with confusion.
