,Unnamed: 0,dialog
0,0,MAN ON TV: We now return to Sunday Golf on CBS.
1,1,"COMMENTATOR 1: And Nicholson here, trying to save par, and there's Nicholson's wife."
2,2,"God, is she hot."
3,3,COMMENTATOR 2: Look at that rack.
4,4,There's a downhill lie for you.
5,5,COMMENTATOR 1: They're just out there begging to be touched. Pleading.
6,6,How many golf balls do you think she can fit in her mouth?
7,7,"COMMENTATOR 2: I'd hit that one in the rough, if you know what I'm saying."
8,8,"COMMENTATOR 1: Who are you kidding, Greg?"
9,9,You'd pork her for a week and then get tired of her.
10,10,"COMMENTATOR 2: Yeah, you're right."
11,11,That's what I do.
12,12,That's my thing.
13,13,"But a hell of a week, though."
14,14,COMMENTATOR 1: Hell of a week.
15,15,"Oh, my God, the power's out."
16,16,What are we gonna do now?
17,17,"Well, we could light some candles and read."
18,18,"Yeah, right."
19,19,"Yeah, that'd be great."
20,20,"Yeah, read the inside of my butt."
21,21,We could tell stories.
22,22,"Hey, Dad, why don't you tell the story about when I was born?"
23,23,"Yeah, we got halfway home with the afterbirth, before we had to go back to the hospital and swap it out for Meg."
24,24,The end.
25,25,"Now, I got a better one."
26,26,"This is a story of love and loss, fathers and sons, and the foresight to retain international merchandising rights."
27,27,This is the story of Star Wars.
28,28,Let's begin with Part 4.
29,29,You hear that?
30,30,"Sounds like we're being boarded from the rear, and not the, ""Hey, take a deep breath, let's experiment,"" kind of boarded from the rear."
31,31,Could you hold on to this bag?
32,32,What if they come in a different door?
33,33,"Well, I guess we'd all just get up and go to that door then."
34,34,"Is it going to be like this all day, Jeff?"
35,35,"Hey, I'm just trying to contribute."
36,36,"Yeah, well contribute to pointing your gun at that door."
37,37,"Mark, why are you always way nicer to me when the other rebels aren't around?"
38,38,Damn! I was two days from retirement.
39,39,R2?
40,40,"Help me, ObiWan Kenobi."
41,41,You're my only hope.
42,42,"All right, now what do I click?"
43,43,"Click ""preferences."" Okay, I clicked ""preferences."" Now go to ""default media browser."" Okay, there's a little hourglass and it's not letting me do anything."
44,44,"It says ""buffering."" What is that?"
45,45,Just give it a minute.
46,46,All I'm trying to do is make an MPEG.
47,47,All I'm trying to do is tell you to wait a minute.
48,48,"Okay, relax."
49,49,"Now click ""import video file."" All right."
50,50,It's telling me I have to download RealPlayer 7.
51,51,You know what?
52,52,I'll just bring it to him myself.
53,53,There she is.
54,54,You still got that bag I gave you?
55,55,It's gonna be a long ride.
56,56,Hold your fire.
57,57,There's no life forms aboard.
58,58,Hold your fire?
59,59,"What, are we paying by the laser now?"
60,60,"You don't do the budget, Terry. I do."
61,61,"Hey, I'm gonna do some crosswords, but that doesn't mean I don't want to talk."
62,62,"Oh, yeah, yeah."
63,63,"My God, look at this mess."
64,64,"""Hey, Darth Vader's gonna be here, ""shall we maybe clean the place up?"
65,65,"""No, it's okay, he won't mind."" Well, well, Princess Leia."
66,66,Are you prepared to tell me what you've done with the stolen Death Star plans?
67,67,"All right, Lord Vader, you win."
68,68,I've hidden the plans in one of these Ooh! Ooh!
69,69,"Okay, okay, I'm feeling number 14, let's go with number 14."
70,70,Oh!
71,71,"It's okay, I'm just happy to be on TV."
72,72,"All right, take her away."
73,73,"Okay, here's another one."
74,74,Who would you rather do?
75,75,Jabba the Hutt right after a shower or a service droid?
76,76,My father was a service droid.
77,77,"Hey, where are you going?"
78,78,You can kiss the lower part of the back of the canister that is my body.
79,79,"Oh, man, this looks like the wrong neighborhood."
80,80,"Oh, boy, it's okay, R2, calm down, be cool."
81,81,I ain't done nothing to antagonize nobody.
82,82,"What, a droid can't walk down the desert no more?"
83,83,"I got rights, too."
84,84,Who's there?
85,85,"Any attack made by the rebels against this station would be a useless gesture, no matter what technical data they've obtained."
86,86,This station is now the ultimate power in the universe.
87,87,"That is fantastic, terrific work."
88,88,So no weaknesses at all?
89,89,No... No.
90,90,"You, uh..."
91,91,You hesitated there.
92,92,Is there something I should know?
93,93,"No, it's virtually indestructible, like 99.99%."
94,94,"Uh, okay, wouldn't be doing my job if I didn't ask, what's the 0.01?"
95,95,"Well, I mean, there's this little hole."
96,96,It was kind of an aesthetic choice by the architect.
97,97,"And if you shoot a laser into this hole, the station blows up."
98,98,"Whoa, whoa, whoa, whoa!"
99,99,"That sounds like a pretty big design flaw, then."
100,100,"No, no, the hole's only 2 meters across."
101,101,"Well, that's no bigger than a womp rat."
102,102,Exactly.
103,103,"And even to get within range of it, you have to skim along this whole trench."
104,104,It's not a big deal.
105,105,"Can't we board it up or, you know, put some plywood over it or something?"
106,106,"Well, that would look terrible."
107,107,"I mean, we gotta think about resale."
108,108,Resale? What are you talking about?
109,109,This property is right above Sunset.
110,110,The value is only gonna go up.
111,111,"Lord Vader, your inside references to the Los Angeles real estate market haven't given you the clairvoyance to turn a profit on that condo in Glendale."
112,112,Nor has it...
113,113,I find your lack of faith disturbing.
114,114,That property is in a prime location.
115,115,"Twenty minutes to the beach, There's nothing to do downtown."
116,116,Enough of this.
117,117,"Vader, release him."
118,118,As you wish.
119,119,"All right, so we're gonna plug up that hole?"
120,120,"Yeah, we can get it done tomorrow, if price is no object."
121,121,Uh...
122,122,We'll get estimates.
123,123,"Get estimates, yeah, yeah."
124,124,Someone was in the pod.
125,125,The tracks go off in this direction.
126,126,"Look, sir, droids."
127,127,"Look, a penny."
128,128,"Hey, thanks for the sex, early '90s printer."
129,129,"All right, bring him on out."
130,130,"Oh, God, it's 100 degrees out here."
131,131,"If I pass out, please note that I'm wearing a LifeCall bracelet, with all my insurance information."
132,132,BERU: Luke? Luke!
133,133,Luke!
134,134,What?
135,135,Tell Uncle Owen not to tell you that your father is Darth Vader.
136,136,"Aunt Beru, when are you guys going to let me join the Rebellion, like all my friends?"
137,137,"Oh, stop whining, Luke, and come have some blue milk."
138,138,"One of these days, I'm just gonna take off and join the Rebellion, whether you like it or not."
139,139,Over my burnt carcass.
140,140,"Hey, shut upa with the noisea."
141,141,"Hey, shut upa with the shut upa."
142,142,You shut upa with the shut upa.
143,143,Shut upa your face.
144,144,Nowa my doga wanna shut upa.
145,145,Why you no shut upa?
146,146,I'll makea you shut upa.
147,147,"You, too, shut upa."
148,148,"Hey, I poke outa my head."
149,149,"Some day, I'll get off this rock and fight the Empire."
150,150,"John Williams and the London Symphony Orchestra, everybody."
151,151,Now do the theme to The People's Court.
152,152,"Oh, this oil bath is gonna feel so good."
153,153,"Hey, you guys think that '90s printer looked clean, right?"
154,154,"Hey, there's something stuck in this R2 unit."
155,155,"Help me, ObiWan Kenobi."
156,156,You're my only hope.
157,157,"Help me, ObiWan Kenobi."
158,158,You're my only hope.
159,159,"Whoever she is, she sounds like she's in trouble."
160,160,Is there any more to this message?
161,161,Intergalactic Proton Powered Electrical Tentacled Advertising Droids.
162,162,Hi! I'm Darth Harrington of Darth Harrington's Intergalactic Proton Powered Electrical Tentacled Advertising Droids Emporium and Moon Base.
163,163,"Due to a garbled subspace transmission, I am currently overstocked on all Intergalactic Proton Powered Electrical Tentacled Advertising Droids and I am passing the savings on to you!"
164,164,"She said ""ObiOne"" Kenobi."
165,165,I wonder if she means old ObiWan Kenobi?
166,166,"Well, I guess I'll go bullseye some womp rats in my T16."
167,167,"My God, you shoot small animals for fun?"
168,168,"That's the first indicator of a serial killer, you freak."
169,169,There's two suns and no women.
170,170,What the hell am I supposed to do?
171,171,"Master Luke, he's gone, he's gone."
172,172,What?
173,173,"R2, he took off in the middle of the night, we gotta find him."
174,174,"Oh, what the phantom menace is that guy's problem?"
175,175,"Hey, mind if I turn on the radio?"
176,176,"DJ: WTAT, Tatooine's alltalk radio."
177,177,"HOST: My good friends, the liberal galactic media is at it again, they never stop."
178,178,Now they're trying to convince us that Hoth is melting.
179,179,"Well, that's crazy, just trying to scare us."
180,180,"And if that wasn't enough to get you mad, we now have news that Lando Calrissian has been made the chief administrator of the Bespin mining facility."
181,181,"Gee, I wonder how he got that job."
182,182,"Well, let me tell you how he got that job."
183,183,Affirmative action strikes again.
184,184,The time is 8:50.
185,185,"R2, what are you doing out here?"
186,186,He says there are several creatures approaching from the southeast.
187,187,That's not what I said.
188,188,I said there ain't a pack of menthols on this planet.
189,189,"Well, I see some bantha tracks, but I don't see any..."
190,190,"Wait a minute, they're Sand People, all right, I can see one of them now."
191,191,Who the hell are you?
192,192,One lucky son of a bitch.
193,193,"So, Luke, what brings your muscly arms out this way?"
194,194,"I'll show you, Mr. ObiWan."
195,195,"R2, play him the message."
196,196,"General Kenobi, many years ago you served my father in the Clone Wars."
197,197,"We need your help again. And, not to get too personal, but you owe us after that mess you got into back on Alderaan."
198,198,"And we paid to keep the families of those children quiet, so..."
199,199,"This is just, like, logistical stuff."
200,200,I'll check that later.
201,201,...Joey Lawrence haircut.
202,202,"So, I'll assume we can count on your help to get the Death Star plans to my father on Alderaan."
203,203,The plans are stored inside this R2 unit.
204,204,"Help me, ObiWan Kenobi, you're my only hope."
205,205,"All right now, what do I click?"
206,206,"Luke, you must learn the ways of the Force, and come with me to Alderaan."
207,207,What's the Force?
208,208,The Force is what gives a Jedi Knight his power.
209,209,"It surrounds us, it penetrates us."
210,210,Mmm...
211,211,"Here, check this out."
212,212,Wow! This is cool.
213,213,"Yeah, everyone in the neighborhood has one."
214,214,"Hey, why would you hang that up?"
215,215,It looks so tantalizing.
216,216,"You know, the Empire is gonna come looking for these droids."
217,217,"But if they find out who the Jawa sold them to, that could lead them back..."
218,218,Home!
219,219,"Luke, wait, it's too dangerous."
220,220,Get your fat space ass back here.
221,221,Uncle Owen?
222,222,Aunt Beru?
223,223,"Oh, my God!"
224,224,John Williams!
225,225,"Great, now we gotta do the rest of this thing with Danny Elfman."
226,226,HERBERT: Mos Eisley spaceport.
227,227,You will never find a more wretched hive of scum and villainy.
228,228,My sister ReginaD2 lives here.
229,229,Is she single?
230,230,She's a lezbot.
231,231,How are we gonna get in here?
232,232,We don't have any chicks with us.
233,233,It's way easier to get into these clubs if you have chicks in your group.
234,234,You ever notice that?
235,235,"No, I never have."
236,236,"Sorry, sir, private party tonight."
237,237,I'm a friend of Dave Navarro's.
238,238,You're a friend of Dave Navarro's.
239,239,You saw me here last week.
240,240,I seem like a cool dude.
241,241,I saw you here last week.
242,242,You seem like a cool dude.
243,243,Move along.
244,244,"Move along, move along."
245,245,(STAR WARS CANTINA MUSIC PLAYING) He doesn't like you.
246,246,Sorry.
247,247,I don't like you either.
248,248,You don't even know me.
249,249,You know what?
250,250,That's fair.
251,251,"I'm Pig Nose, and this is my brotherinlaw, Scott."
252,252,He's visiting from Hoth.
253,253,I don't know why they call it Hoth.
254,254,They should call it Coldth.
255,255,"Okay, settle down."
256,256,I'm up after the band.
257,257,Thank you.
258,258,We're the Cantina Band.
259,259,"If you have any requests, shout 'em out."
260,260,Play that same song.
261,261,"All right, same song, here we go."
262,262,"(STAR WARS CANTINA MUSIC PLAYING) Oh, no, Stormtroopers."
263,263,"Quick, R2, in here."
264,264,"This door's locked, move on to the next one."
265,265,"Well, maybe they're behind this door."
266,266,I just said it's locked.
267,267,"Well, can't you knock or something?"
268,268,Hello?
269,269,"Well, I guess whoever's in there won't be getting this giant check from Publishers Clearing House."
270,270,CLEVELAND: Publishers Clearing House!
271,271,QUAGMIRE: Shut up.
272,272,Did you hear something?
273,273,"I heard voices, but they've stopped, so I'm gonna assume there's no one in there."
274,274,"Hi, my sexy friend and I are looking for a ship to take us to Alderaan, and I'm willing to pay big money."
275,275,"Well, you've come to the right place."
276,276,"I'm Han Solo, captain of the Millennium Falcon and the only actor whose career isn't destroyed by this movie."
277,277,Is it a fast ship?
278,278,Are you kidding?
279,279,It's the ship that made the Kessel Run in less than 12 parsecs.
280,280,"Um, isn't a parsec a unit of distance, not time?"
281,281,"Chewie, take these guys to the ship and get her ready."
282,282,Always gargle before a takeoff.
283,283,"Wokka, wokka!"
284,284,"All right, let's go."
285,285,"Greedo, as a matter of fact, I was just going to see Jabba and tell him..."
286,286,"Well, what do you think?"
287,287,What a piece of junk!
288,288,"Thank you, this was my brother's."
289,289,He died of leukemia.
290,290,How do you feel now?
291,291,You got any strawberry milk in there?
292,292,"No, but she'll make If you want, I'll show you around, since no one's trying to stop the ship or blast us."
293,293,"Stop that ship, blast them."
294,294,"Oh, now I can't show you around."
295,295,"Quick, get in the ship."
296,296,Looks like we got Imperial Cruisers on our tail.
297,297,"Oh, look at that one on the left."
298,298,"Get off your cell phone, you are driving."
299,299,They're gaining on us.
300,300,"We'll be safe enough, once we make the jump to hyperspace."
301,301,"Besides, I know a few maneuvers."
302,302,We'll lose 'em.
303,303,That... That was your maneuver?
304,304,Moving slightly to the left?
305,305,"Well, I mean, we're not in the same place we were, huh?"
306,306,That ought to confuse 'em.
307,307,"Yeah, but you hardly did anything."
308,308,You just started listing lazily to the left.
309,309,I'm pretty sure they can keep up.
310,310,Where did they go?
311,311,There they are!
312,312,They're listing lazily to the left.
313,313,"Go left, left!"
314,314,"Boy, this guy knows some maneuvers."
315,315,"All right, strap yourselves in, I'm about to make the jump to light speed."
316,316,"Did he say ""strap in"" or ""strap on""?"
317,317,"Man, hyperspace always looks so freaky."
318,318,Governor Tarkin.
319,319,I recognized your foul stench as soon as I was brought onboard.
320,320,"Um, actually, that's me, I made a Darth doody."
321,321,I sithed my pants.
322,322,My diaper's gone over to the dark side.
323,323,"I got pages of these, I could go on."
324,324,"Princess Leia, we've chosen to test our Death Star planet blowerupper gun on your home planet of Alderaan."
325,325,No!
326,326,She said no.
327,327,Should we still do it?
328,328,Yeah.
329,329,"So, anyway, I says, ""Forget the dental plan, forget sick leave."
330,330,"""I just want a railing. You know, one railing right here."" Yeah, I know, I've almost fallen over that thing so many times."
331,331,"So, what did they say?"
332,332,"Get this, they said they're worried we'd be leaning all day."
333,333,They said that?
334,334,Yeah.
335,335,"Well, none of this will matter when we're famous singers."
336,336,"Good evening, Death Star."
337,337,Tonight a special report on the controversial attack on Alderaan.
338,338,"While some view the attack as unwarranted, the Empire has obtained proof that Alderaan was in possession of weapons of mass destruction."
339,339,"And now, let's go to our five day forecast."
340,340,"What's the weather like, Ollie?"
341,341,Space weather.
342,342,"Thanks, Ollie."
343,343,"Coming up, we'll give you the road closures for this week's Ewok Pride Parade."
344,344,Stay with us.
345,345,How am I doing?
346,346,Just keep your knees bent.
347,347,Imagine you're spreading butter on a big piece of bread.
348,348,That's it.
349,349,"Spread that butter, with the Force."
350,350,Ha! You guys seem like crazy morons to me.
351,351,"You don't believe in the Force, do you?"
352,352,"Oh, you mean that thing you just found out about, like, three hours ago, and are now judging me for not believing in it?"
353,353,Do you believe in anything?
354,354,"Uh, yeah. Didn't you see my Cabala bracelet?"
355,355,What's Cabala?
356,356,About $1 .75.
357,357,"Honestly, I have no idea."
358,358,I'm just a slave to trends.
359,359,What the hell?
360,360,"Oh, my God!"
361,361,We came out of hyperspace into an asteroid field.
362,362,Alderaan's been destroyed by the Empire.
363,363,"Maybe we should head for that small moon, that's clearly a small moon, and not anything else."
364,364,That's no moon.
365,365,It's a space station.
366,366,"Oh, crap."
367,367,They've got us in a tractor beam.
368,368,"Well, they're not going to get me without a fight."
369,369,You can't win.
370,370,But there are alternatives to fighting.
371,371,Like what?
372,372,Like getting the hell out of here!
373,373,"No, just kidding."
374,374,Can you imagine if I was like that?
375,375,"PETER: All right, just follow my lead and act real cool."
376,376,"All right, I'm gonna go knock out that tractor beam."
377,377,And we'll go rescue the princess.
378,378,"You know, Luke, this may be the last time we see each other."
379,379,So there's something I want you to know.
380,380,"(SINGING) Now I've had the time of my life And I owe it all to you I've been waiting for so long Now I've finally found someone To stand by me So we take each other's hand 'Cause we seem to understand the urgency Just remember You're the one thing I can't get enough of So I'll tell you something This could be love because I've had the time of my life No, I never felt this way before Yes, I swear it's the truth And I owe it all to you Holy shit!"
381,381,You ain't never gonna believe what I just seen.
382,382,Tyra Banks?
383,383,"See, now you say something better, so my thing don't sound cool no more."
384,384,"Oh! Come on, what did you see?"
385,385,I don't remember.
386,386,I just was thinking about Tyra Banks.
387,387,Can you imagine?
388,388,Every night!
389,389,Don't shake my hand.
390,390,You ain't got no hand!
391,391,You a little truck.
392,392,"BRIAN: So, what are we on, the first floor?"
393,393,CHRIS: We are on the second floor.
394,394,"PETER: No, no, no, here's the Banana Republic, and we just passed that."
395,395,It's right back there.
396,396,"We parked on the Macy's side, so now we must be over here by the JCPenney."
397,397,"CHRIS: It looks like the first floor is mostly men's stuff, and there's a Lady Foot Locker right over there."
398,398,"BRIAN: All right, so we're on the third floor."
399,399,"All right, let's get in the elevator."
400,400,"And hurry up, 'cause the smell of that Mrs. Fields is killing me."
401,401,(THE IMPERIAL MARCH MUZAK PLAYING) Wrong floor.
402,402,Stormtrooper church.
403,403,"And do you, Allen, take Judith to be your lawfully wedded wife till death or a giant explosion do you part?"
404,404,Where are you taking this thing?
405,405,Prisoner transfer from cell block 1138.
406,406,You think you could get me a room by the pool?
407,407,"Is funny, because you are a prisoner and there is no pool because is Death Star."
408,408,We've gotta find out what cell this princess of yours is in.
409,409,"There it is, 2187."
410,410,I'm on it!
411,411,Everything's under control here.
412,412,Situation normal.
413,413,STORM TROOPER: What happened?
414,414,"We had a slight weapons malfunction, but everything's perfectly all right."
415,415,We're fine.
416,416,We're all fine here now.
417,417,Thank you.
418,418,How are you?
419,419,I've been better.
420,420,"Well, tell me what's up."
421,421,"Well, I'm in this relationship and it doesn't seem to be going anywhere."
422,422,"I like her, but we're not really connecting."
423,423,How long has it been?
424,424,About 10 months.
425,425,And how often do you see each other?
426,426,Couple times a week.
427,427,"Well, why don't you try seeing each other a little more often, and see if you connect a little more?"
428,428,"And if not, it may be time to move on."
429,429,Thanks for calling.
430,430,"This is Han Solo and I'm gonna be keeping you company for the next few hours, right here on the midnight shift."
431,431,MAN: (SINGING) Something's telling me it might be you It's telling me it might be you Aren't you a little fat to be a Stormtrooper?
432,432,"Well, stay here and rot, you stuckup bitch."
433,433,"Wait, who are you?"
434,434,I'm Luke Skywalker.
435,435,Me and Han Solo and ObiWan are here to rescue you.
436,436,"Wait, ObiWan Kenobi?"
437,437,Yeah!
438,438,"Suddenly, I'm not so fat, huh?"
439,439,"Come on, into the garbage chute."
440,440,She's right!
441,441,"Come on, Chewbacca."
442,442,"What, are you kidding?"
443,443,It's probably full of disease.
444,444,I'm not jumping in there.
445,445,Not even if I throw this pig's ear?
446,446,"Oh, come on, that's not fair."
447,447,Go get it!
448,448,"Oh, boy!"
449,449,"Great idea, Princess, diving into a pile of garbage."
450,450,"Hey, when we get out of here, maybe you can show me around your home planet of Alderaan."
451,451,Aww...
452,452,Too soon?
453,453,"Hey, it could be worse."
454,454,It's worse.
455,455,The walls are closing.
456,456,"LOIS: Oh, my God!"
457,457,"Listen to them, R2, they're dying!"
458,458,What do we do?
459,459,"Only one thing to do, man."
460,460,You still got that bag I gave you?
461,461,"Man, I wish I could listen to some Tatooine, Wind & Fire right now."
462,462,Hmm.
463,463,"So, you think the Empire's gonna fall, man?"
464,464,"I don't know, man."
465,465,How you doing right now?
466,466,Good. Why?
467,467,I think I may be having sort of a mini freakout here.
468,468,Oh.
469,469,Just tell me I don't have to stay in this room.
470,470,What?
471,471,"Just tell me, right now, that I don't have to stay in this room."
472,472,You don't have to stay in this room.
473,473,"Oh, thank Christ!"
474,474,Thank God! We're saved.
475,475,Look at this.
476,476,Who throws out half a pizza?
477,477,And look at this couch.
478,478,Somebody threw out a whole couch and it's in great shape.
479,479,"Yeah, you put a little Febreze on that, scrub it out a little bit, it would look great in your apartment."
480,480,"You know what? I know we have a dangerous job to do here, but I'm taking this."
481,481,I'm taking this couch.
482,482,"PETER: All right, ready?"
483,483,"All right, one, two, three."
484,484,Okay!
485,485,"Easy, easy, easy..."
486,486,"Easy, easy..."
487,487,"Wait! Wait, wait..."
488,488,"Stop! Stop, stop..."
489,489,"What? What, what?"
490,490,"No, no, no. Twist it."
491,491,I am.
492,492,"No, no, no."
493,493,The other way.
494,494,Which way?
495,495,You're twisting the wrong way.
496,496,What do you want me to do?
497,497,"Just look down, look at me, look what I'm doing."
498,498,"All right, see the way I'm twisting it?"
499,499,Yeah.
500,500,"Right, turn it that way from your end."
501,501,Okay.
502,502,"No, no, no. Just put it down, just drop it."
503,503,"Yeah, yeah, okay."
504,504,"All right, all right."
505,505,"All right, let's..."
506,506,Just hang on and figure this out.
507,507,"Han, there are Stormtroopers all over the place."
508,508,Shouldn't we be getting out of here?
509,509,"All right, okay, all right, I got it, I know..."
510,510,Here's what we're gonna do.
511,511,"We're going to take the cushions off, unscrew the legs, take the mattress out, and this whole thing is going to be a lot simpler."
512,512,It's easier than we're making it.
513,513,"Hey, did you hear something?"
514,514,Probably just another drill.
515,515,You know that last drill we had?
516,516,"I was about to finally bone my girlfriend, and then we heard that there was this drill and she told me there was no way."
517,517,"STEWIE: So, ObiWan, we meet again."
518,518,"What part of, ""Stay 50 yards away ""at all times,"" don't you understand?"
519,519,Uhoh!
520,520,"Your powers are weak, old man."
521,521,CHRIS: ObiWan!
522,522,"Boy, you got here just in time."
523,523,No!
524,524,"Right! Go! Go, go, go."
525,525,"All right, twist it counterclockwise."
526,526,"I am twisting it, you're twisting it the other way."
527,527,I mean counterclockwise from where I'm standing...
528,528,So then you...
529,529,So clockwise.
530,530,"So, yeah! Okay, all right."
531,531,"Yeah, so you twist it clockwise."
532,532,Okay. Go!
533,533,You know what?
534,534,Put it down.
535,535,Put it down for a sec.
536,536,My fingers are killing me.
537,537,"Han, they're shooting at us."
538,538,"All right, you know what?"
539,539,Lift it up tallways.
540,540,For Christ's...
541,541,It's wedged. It's wedged.
542,542,"All right, okay."
543,543,You know what?
544,544,It's not going anywhere.
545,545,"Let's just take off, we'll deal with it later."
546,546,"You get in the cockpit, and I'll just..."
