,Unnamed: 0,dialog
547,547,I'll hang onto this thing as we go.
548,548,Easy!
549,549,I can't believe he's gone.
550,550,"I know, Luke, but it's true, he's gone."
551,551,"I mean, you saw him get beheaded."
552,552,Nobody lives through that.
553,553,Not for long anyway.
554,554,"I mean, sometimes the brain is still active for a few minutes after the beheading, but to be honest, I can't imagine a worse kind of hell."
555,555,"And unfortunately, hell is probably where he'll end up, because the Christians don't look too kindly on the whole Force thing."
556,556,"Come on, kid, we're not out of the woods yet."
557,557,Here they come.
558,558,"(HUMMING STAR WARS BATTLE THEME) Hey, Han!"
559,559,What?
560,560,Why do they call them TIE fighters?
561,561,No idea.
562,562,They're coming too fast!
563,563,A nickel for every time I've had that problem.
564,564,"Just keep shooting, Luke."
565,565,"Yeah! That's how we do it in my neighborhood, bitch!"
566,566,I got him! I got him!
567,567,"Right, kid. Don't get penisy."
568,568,"I just want to tell you both, good luck!"
569,569,We're all counting on you.
570,570,"Mom? Yeah, we won."
571,571,"Yeah, we won the battle."
572,572,"Yeah, I'm calling, like you asked."
573,573,Okay. Okay.
574,574,"Okay, but I gotta go."
575,575,I got other stuff to do.
576,576,"Okay. Okay, but I gotta go. Okay."
577,577,Okay. Yes. Yes.
578,578,"Yes. Yes, Mom. I love you, too, Mom."
579,579,Okay. All right. Goodbye.
580,580,The Homing Beacon is safely on board the Millennium Falcon.
581,581,"I'm taking an awful risk, Vader."
582,582,It'd better work.
583,583,"You know, I think they took your old couch."
584,584,What? I threw that away.
585,585,"Yeah, it was weird."
586,586,"I just killed ObiWan, and then I look over and there are these two dudes scurrying across with a couch."
587,587,"It had a stain on it, from when we had Hawaiian Punch night."
588,588,"Yeah, that's my couch."
589,589,Rebel scum.
590,590,Gotcha!
591,591,"Thanks to the information in this R2 unit provided by Princess Leia, we should be able to mount a successful offensive on the Death Star."
592,592,"But first, please take a moment to watch this instructional video."
593,593,Nothing but net.
594,594,Hi! I'm Magic Johnson with a few tips on blowing up the Death Star.
595,595,"First off, never forget your objective."
596,596,"There are gonna be so many folks coming at you to slow you down, you might feel like you got a bull'seye on your head."
597,597,"No, but they will be trying to kill you."
598,598,"Also, don't forget you have teammates out there watching your back."
599,599,Unless you've been messing around with their wife or girlfriend.
600,600,"No, but they will be there to help you."
601,601,"Lastly, you wanna make sure you step back and take cover after you sink that bucket."
602,602,'Cause that sky gonna light up like the Fourth of July.
603,603,"No, but there will be a large explosion."
604,604,Any questions?
605,605,"Yeah, I got a question."
606,606,Does Barry Manilow know you raid his wardrobe?
607,607,You'll get the answer to that question next Saturday.
608,608,"Don't mess with the bull, young man, you'll get the horns."
609,609,Biggs? Jesus!
610,610,What the hell happened to you?
611,611,"Oh! Hey, Luke. I was under a Ywing working on the space engine, and the whole thing just dropped on me."
612,612,Holy crap!
613,613,Yeah. Holy crap.
614,614,"So, you here for the Death Star assault?"
615,615,"Yeah, yeah, I can't wait."
616,616,How about you?
617,617,"Well, no, I can't really..."
618,618,"Oh, yeah, because of that..."
619,619,The chair.
620,620,"Chair, yeah."
621,621,"Yeah, so I'll just be here making sandwiches for when you guys get back."
622,622,Oh...
623,623,"Well, that's cool."
624,624,Yeah.
625,625,You want anything special?
626,626,What? You mean like a sandwich?
627,627,Yeah.
628,628,"Oh, no, I mean, I couldn't..."
629,629,"You know, whatever you make will be fine."
630,630,"Hey, Biggs."
631,631,Yeah?
632,632,You're just as big a part of this as...
633,633,"I mean, you're doing stuff, and I think that's great!"
634,634,"Well, kid, I guess this is goodbye."
635,635,"So, you got your reward and you're leaving?"
636,636,Is that it?
637,637,"When you say it that way, I sound like a douche, but, yeah, that's what I'm doing."
638,638,"What did you get for a reward, anyway?"
639,639,Let's see.
640,640,"I got 10% off a Netflix membership, some nice Cracker Barrel Cheddar, assorted lotions, and a little plastic champagne bottle full of jelly beans, and a little bear."
641,641,See? Little bear.
642,642,"""Hey, Luke, we had fun on the Death Star."" Well, take care of yourself, Han."
643,643,I guess that's what you're best at.
644,644,"Oh, look!"
645,645,A light saber cheese knife!
646,646,Yuck!
647,647,"All wings, check in."
648,648,Red Three standing by.
649,649,Red Six standing by.
650,650,Red Five standing by.
651,651,Red Buttons standing by.
652,652,Redd Foxx standing by.
653,653,Big Red standing by.
654,654,SEAN CONNERY: Red October standing by.
655,655,Helen Reddy standing by.
656,656,Simply Red standing by.
657,657,I'm going in.
658,658,"Cover me, Porkins."
659,659,Having a little trouble here.
660,660,"Careful, Redd Foxx!"
661,661,There's one right on your tail.
662,662,"I'm coming, Elizabeth!"
663,663,"HERBERT: Use the Force, Luke."
664,664,ObiWan?
665,665,"Yeah, it's me. Use the Force."
666,666,"Force that thing in there, just like I showed you with those puppets."
667,667,But don't tell nobody 'cause you'll get in trouble.
668,668,"Clark, I don't like the look of this neighborhood."
669,669,"Come on, Ellen, it's important for the kids to witness the plight of the Rebellion."
670,670,"Kids, you noticing all this plight?"
671,671,Roll 'em up!
672,672,The Force is strong with this one.
673,673,"Fuck you, you son of a bitch!"
674,674,"What am I, R2Pac?"
675,675,COMPUTER: The Death Star is getting closer.
676,676,And Leia's getting larger.
677,677,"I have you now, young Skywalker."
678,678,"And with today's gas prices, not a minute too soon."
679,679,What the deuce?
680,680,Look at us.
681,681,Look at how much more comfortable we are now shooting stuff.
682,682,Whew!
683,683,"HERBERT: Luke, the Force will be with you always."
684,684,"And so will I, always."
685,685,"Of course when you get older and get some crow's feet, I might lose interest."
686,686,You did it!
687,687,Yay!
688,688,Hooray!
689,689,I have your sandwich.
690,690,Yay! My what?
691,691,"Oh! Thank you, Biggs."
692,692,"Yay! I'm part of things, too. Yay!"
693,693,The end.
694,694,"Wow, Dad, thanks for keeping us entertained."
695,695,That was a great story.
696,696,"Yeah, but didn't Robot Chicken already do this three months ago?"
697,697,"I wouldn't worry about it, Chris."
698,698,I don't think people are even aware of that show's existence.
699,699,"Well, I don't know, Dad."
700,700,I think a decent number of people watch it.
701,701,"Oh, really?"
702,702,"Define ""decent."" I think it's the highest rated show on Cartoon Network, and the Star Wars episode doubled that audience."
703,703,"Well, yeah, but double 10 people is, like, 20 people, so what kind of numbers are we talking about here, you know?"
704,704,"Don't be glib about this stuff, Dad."
705,705,"It's a legitimate show, and they beat you to the punch."
706,706,"I don't know about that, Chris."
707,707,"I mean, to me, a legitimate show is on ABC, CBS, NBC, you know, one of the real networks."
708,708,"I don't know about that, Dad."
709,709,"And besides, what's up with that What is that?"
710,710,That's like 15 minutes of guys playing with Star Wars dolls.
711,711,"Oh, yay, tune me in to that."
712,712,"Oh, so you do know the show!"
713,713,I read part of a review online.
714,714,I am not a fan.
715,715,"You know, Dad, you're a real jerk!"
