,Unnamed: 0,dialog
0,0,"This is live coverage of the 1959 We've reached the halfway point and so far witnessed Aston Martin number 5, driven by Carroll Shelby, making great gains in the last hour."
1,1,"If he keeps this pace up, he could have a chance at the..."
2,2,He's coming in.
3,3,He's coming in.
4,4,"Let's go, let's go."
5,5, Tires!
6,6," Let's go, let's go."
7,7,"I know you're tired, but come on, let's make this fast."
8,8,"Move, move, move!"
9,9,"She's running a little hot, but we're good."
10,10,Tires are still gripping.
11,11,Fire! The fuel! Fire!
12,12," Shelby, it's you!"
13,13, Grab that blanket!
14,14,Get off me! Off!
15,15,You okay?
16,16,Fill the tank!
17,17," Shelby, you just..."
18,18, Am I on fire?
19,19,Am I on goddamn fire?
20,20," No, you're not on fire."
21,21, Fill the damn tank!
22,22, Fill the tank.
23,23, Fill the tank.
24,24,Get it ready!
25,25," Where am I, Eddie?"
26,26," Two laps up, my friend."
27,27,Car's yours.
28,28,Go get 'em.
29,29,"Aston Martin number 5, driven by Carroll Shelby, has maintained his lead as we're nearing the final minutes of the race."
30,30,Shelby.
31,31,The checkered flag is out.
32,32,The crowd are on their feet.
33,33,Shelby.
34,34,...takes the title!
35,35,An American wins Le Mans.
36,36,Shelby.
37,37,Carroll Shelby.
38,38,What?
39,39,This is something you can't ignore anymore.
40,40,"Oh, I take the pills."
41,41,The pills work.
42,42,"An elevated heart rate, say 130 BPM, sustained even for a short period, you run a critical risk of cardiac arrest."
43,43, I'll race shorter format then.
44,44, That's not gonna work.
45,45,"Well, I could race NASCAR."
46,46,Formula One.
47,47,"The valve is shot, Shelby."
48,48,This is as serious as it gets.
49,49,"In my opinion, you're lucky to be sitting here today."
50,50,"Well, I feel real lucky."
51,51,Luckiest guy on earth.
52,52,"There's a point at 7,000 RPM where everything fades."
53,53,The machine becomes weightless.
54,54,Just disappears.
55,55,Hey!
56,56,"Watch it, buddy!"
57,57,And all that's left is a body moving through space and time.
58,58,"7,000 RPM."
59,59,That's where you meet it.
60,60,It asks you a question.
61,61,The only question that matters.
62,62,"""Who are you?"" Now, it's von Trips in the Ferrari, coming into the corkscrew."
63,63,He's braking late.
64,64,"Hey, I called you three times, and you never answer the phone."
65,65,Oh! He sets a new lap record!
66,66,I answer the phone every time it rings.
67,67," No, sir, you do not."
68,68," Yes, I do."
69,69,"No, you don't."
70,70,"A month ago, this car was fun."
71,71,"Now, it won't even start."
72,72,"And when it does, it's, ""Boom, boom, boom!"" When I pull out of the driveway, the dog has a heart attack."
73,73,All I'm asking is for you to make it like it was.
74,74,"Yeah, you've coked up the inlet valves and the plugs."
75,75,"Nothing wrong with the car, just the way it's being driven."
76,76,The way it's being driven?
77,77,"Too much fuel, not enough spark."
78,78,That's what's making her misfire.
79,79,You wanna run that by me in English?
80,80,"All right, sir."
81,81,So...
82,82,"that there, that is a sport car."
83,83,You have to drive her like a sport car.
84,84,"If you drive her like a school teacher, she'll clog up. All right?"
85,85,"Try changing up at 5,000 RPM, not two."
86,86,Drive like you mean it.
87,87,Hard and tight.
88,88,She'll run clean.
89,89,Are you telling me I don't know how to drive my own car?
90,90,No.
91,91,"But if you ask me, this isn't your car."
92,92,Your car's more a Plymouth or a Studebaker.
93,93,"You and me have a problem, buddy?"
94,94,I don't have a problem.
95,95,I had an MG.
96,96,Mine ran just fine.
97,97,"Screw you, you limey prick."
98,98,I want my money back.
99,99,"Oh, behave. I'd give it to ya."
100,100,But you haven't paid for last month's service yet.
101,101,"This country, the customer's always right."
102,102,You ever hear that?
103,103,Yeah. Yeah.
104,104,Utter nonsense.
105,105,"Now remember, I advanced the timing, so a smidge twitchy in first."
106,106,Get the revs up.
107,107,Good lad. Revs up.
108,108,Tara.
109,109,Another satisfied customer?
110,110,"Can I help you, miss?"
111,111,Wasn't that an MGA 1500?
112,112,"Ah, you know your cars."
113,113,"Well, I like them."
114,114,I love the sound they make.
115,115,The way it goes right through you.
116,116,Right.
117,117,That vibration.
118,118,Mine's the woodpaneled Country Squire...
119,119,across the street.
120,120,A real hot rod.
121,121,"Oh, yeah?"
122,122, Is it fast?
123,123, Very.
124,124,Wait a second.
125,125,What type of girl are ya?
126,126,Type of girl who likes the smell of wet gasoline.
127,127, Oh.
128,128, Burnt rubber.
129,129,"Oh, what, are you some kind of a deviant, are ya?"
130,130,"Well, only since I married you."
131,131,"Hey, Gar, what's going on?"
132,132,Something's up.
133,133,"Hi, Lee."
134,134,"Listen, he isn't as sure as you are about the banks."
135,135,I'm not as sure about this...
136,136,How's this going out?
137,137," Don, what's going on?"
138,138, I don't know.
139,139,"Mr. Ford, welcome to the room."
140,140,"Good afternoon, Mr. Ford."
141,141,"Nice to see you, sir."
142,142,"Shut it down, Mr. Beebe."
143,143,John!
144,144,All stop.
145,145,Hear that?
146,146,That's the sound of the Ford Motor Company...
147,147,out of business.
148,148,"In 1899, my grandfather, Henry, by God, Ford..."
149,149,was walking home from Edison Illumination after working a double shift.
150,150,He was ruminating.
151,151,"That morning, he had himself an idea that changed the world."
152,152,"Sixtyfive years and 47 million automobiles later, what shall be his legacy?"
153,153,Getting it in the tail pipe from a Chevy Impala.
154,154,Here's what I want you to do.
155,155,Walk home.
156,156,"While you're walking, I want you to ruminate."
157,157,"Man comes to my office with an idea, that man keeps his job."
158,158,Rest of you secondbest losers...
159,159,stay home.
160,160,You don't belong at Ford.
161,161,Shelby!
162,162,I see you.
163,163,"Up and at 'em, buddy."
164,164, Hey!
165,165, Go away.
166,166,Come on. You can do it.
167,167,"Come on, baby."
168,168,Let's go.
169,169," Let's go. Let's go, go, go."
170,170, Go away.
171,171,"It's 8:30 a.m., baby."
172,172,Time to roll.
173,173,Come on.
174,174,"Hey, Phil."
175,175,"Hey, Bob."
176,176,Is Shelby here?
177,177,"Uh, it's touch and go."
178,178,"Shelby, you're up bright and early."
179,179,"Well, early bird gets the worm, Pops."
180,180,"All right, who you worried about?"
181,181,"Well, you got Red Faris and Bill Rushton."
182,182,They're all in 327s.
183,183,Corvettes.
184,184,What about Bondurant?
185,185,"Bondurant? Well, he's still driving..."
186,186," Mr. Shelby, can I get an autograph?"
187,187, ...for Washburn.
188,188,Number 614.
189,189, Thank you so much.
190,190," All right, just relax. All right."
191,191,We're gonna eat those Vettes for breakfast.
192,192,"We're lighter, we're faster, and that don't work, we're nastier."
193,193,"Hey, Dad, before the race starts, take your son over to the Willow Springs..."
194,194,"Hey, Phil. Hey, take it easy on us today, bud."
195,195,You all right?
196,196,"Paragraph 15.4, section 2b of the SCCA standard dictates all AF class cars must have minimum trunk space of 20 inches by 12 inches by six inches."
197,197,Your trunk doesn't close.
198,198, Ergo car fails standard.
199,199," Wait, wait, wait. What?"
200,200,Ergo car is disqualified from said Class A competition.
201,201,"No, no, no. Look, look, look."
202,202,"Can I ask you a question, all right?"
203,203,"When you were a little boy, did you think, ""When I grow up, I want to go ""to the fabled Willow Springs Raceway, ""and I want to enforce paragraph 15.4, section 2b ""of the SCCA regulations on luggage capacity""?"
204,204," All right, that's it."
205,205, Did you?
206,206,I'm ruling you and your team disqualified from this race.
207,207,"Ah, well, if it isn't Lance Reventlow."
208,208," Ah, Shelby."
209,209," How you doing, Lance?"
210,210, Pops.
211,211," Hey, Lance."
212,212,Allow me to introduce Dieter Voss.
213,213,Runs Brumos Porsche out of Jacksonville.
214,214,"Oh, I know all about Mr. Voss."
215,215,"You're having a hell of a season with that Abarth, sir."
216,216,"Seeing results for your Cobra, too."
217,217, Thank you.
218,218, Your guy Miles is impressive.
219,219," Oh, you following Miles?"
220,220," Oh, yes."
221,221,"Well, he was a USAC road racing champ in '61."
222,222,He won the Pikes Peak Hill Climb.
223,223,He was SCCA Cclass champion three years in a row in this pieceofshit MG he built himself.
224,224,"We heard he's, uh, difficult."
225,225,"What, Ken? No, no."
226,226,Ken's a puppy dog.
227,227,"Hey, Lance, tell the man."
228,228,You've raced against Ken.
229,229,"Oh, I've driven more behind him than against him."
230,230,"Well, Brumos is looking for a driver for our number two car at Sebring."
231,231, Is that right?
232,232, How is that even possible?
233,233,Think your guy Miles can make the grade?
234,234," Oh, well, Ken..."
235,235," Is he, mate? Hey!"
236,236,Jim! Is he putting his bloody carryall  in your trunk?
237,237, What?
238,238,Discretionary infraction.
239,239,"Gentlemen, excuse me a moment."
240,240,"To be honest, Ken was born for Sebring."
241,241,Nothing in there about my trunk and your lovely little portmanteau.
242,242,You're holding the '62 edition of the SCCA.
243,243,And you can stick this bloody sticker where the sun don't shine.
244,244,"Hey. Hey, Bill. What seems to be the problem, Bill?"
245,245,The problem is that Bill here is an arsehole.
246,246," No, he doesn't mean that."
247,247," Oh, yes, he does. Yes, he does."
248,248,"No, he really does think that Bill is an arsehole."
249,249, I'm just doing my job here.
250,250," Hang on. Bill, Bill, Bill."
251,251,"In my experience, there is..."
252,252,Listen to me.
253,253,"Something like this, there's always a middle ground."
254,254,All right?
255,255,"Now, Ken's outta line."
256,256,And I'm just doing my job.
257,257,I understand you are.
258,258,You know how he gets on a race day.
259,259,You know that. All right?
260,260,But you're not gonna DQ us over a trunk.
261,261, What?
262,262, You see that guy?
263,263,Got his tail up.
264,264,"Happy, Bill?"
265,265,"Bill, I'll handle it."
266,266,I'll talk to him.
267,267,I'll talk to him. You just go and have a great day.
268,268,"Hey, folks, feeling hungry?"
269,269,Head on over to the snack bar...
270,270,Shit.
271,271, Bulldog.
272,272, Huh?
273,273,You know who that was I was just talking to?
274,274,Bill.
275,275, Before that.
276,276, No.
277,277,It was Dieter Voss.
278,278,Who's that?
279,279,"He runs Porsche, Ken."
280,280,It's a little German car company.
281,281,Maybe you heard of it.
282,282,All right.
283,283,He wanted you to drive at Sebring.
284,284,But he'd heard you were difficult.
285,285,"I thought we felt the same way about, uh, Germans."
286,286,"Do you like losing, Ken?"
287,287,Excuse me?
288,288,"Oh, you heard me."
289,289,I don't lose.
290,290,"Without sponsors, you get no car, Ken."
291,291,"And last I checked, the professionals  all have a car."
292,292, Shel!
293,293,You cannot win the SCCA without one.
294,294,"If you're not winning, you are losing."
295,295,Don't make me lamp this at your head.
296,296,Did you bring your son all the way out here to watch you get disqualified or just act like a jackass?
297,297,Damn!
298,298,"Well, that answers that."
299,299,Peter...
300,300,"May I help you, gentlemen?"
301,301,"Uh, yes, is Ken Miles here?"
302,302,No.
303,303,We need to speak to Mr. Miles.
304,304,I'm his wife.
305,305,Welcome to the 1963 Willow Springs 100.
306,306,Twelve cars will be competing in this 40lap race.
307,307,"Hey, Ken, what happened to your shield?"
308,308,New design.
309,309,"Well, it looks like we're about to begin."
310,310,The cars have completed their warmup lap.
311,311,The green flag is out...
312,312,and they're approaching the starting line.
313,313,Here we go.
314,314,"Oh, bloody hell."
315,315,Ken Miles has fallen behind.
316,316,"Learn to drive, you pillock!"
317,317,"So, Shelby, do you miss it?"
318,318,"Hey, Sam."
319,319,"Guy wins the 24hour Le Mans, suddenly retires, starts selling cars."
320,320,It just don't make sense.
321,321,"Well, unless the rumors are true, of course."
322,322,"Oh, what rumors would those be, Sam?"
323,323,That Carroll Shelby quit driving 'cause he lost his nerve.
324,324,"I'm gonna outbrake you on the next turn, Bob."
325,325,"Haha! Nice try, Bob."
326,326,Nice move from Ken Miles.
327,327,"Twentytwo laps remaining, with Phil Hill and Dan Gurney in the lead."
328,328,"It's been an incredible day here at Willow Springs, and we've seen some exciting driving."
329,329,"With just one lap remaining in this 40lap race, we're coming to the final stretch."
330,330,Dan Gurney has been leading the pack for most of the...
331,331,Whoa!
332,332,"Number 18, Red Faris, is off the track."
333,333,That leaves Dan Gurney for the lead followed by journeyman Ken Miles.
334,334,"Now for you, Dan."
335,335,And they're coming around the last turn.
336,336,Gurney is still in the lead with Ken Miles hot on his heels.
337,337,Miles is looking for an opening.
338,338,Not yet.
339,339,Come on.
340,340,Can Gurney hold him off in the final straight?
341,341,Not yet.
342,342,Gurney is blocking him out.
343,343,Now.
344,344,Miles goes for the shoulder.
345,345,"Nice move, Ken."
346,346,They're wheel to wheel.
347,347,Come on.
348,348,It's Corvette versus Cobra for the finish.
349,349,Yeah! Haha!
350,350,Yeah!
351,351,An incredible finish for Ken Miles.
352,352,Didn't see that one coming.
353,353,He's difficult but good.
354,354,Let's give everyone a hand for one heck of a race.
355,355,That calls for a nice cup of tea.
356,356,I'll put the kettle on.
357,357,Hop in.
358,358,"I'm HAPPY I'm HAPPY I know I am, I'm sure I am I'm HAPPY Pops, frame this."
359,359,Hey.
360,360,We did it.
361,361,What's wrong?
362,362,The IRS came.
363,363,They've padlocked the garage.
364,364,"All right, Petey."
365,365,A couple of years ago...
366,366,you said we'd a nest egg.
367,367,Correct.
368,368,A couple of years ago.
369,369,Correct.
370,370,"So just to be clear, we are buggered."
371,371,Absolutely.
372,372,As in totally?
373,373,"As in, not a bean, or a pot in which to piss."
374,374,"Spares, stock, all gone."
375,375,Tools. My tools are locked up in there.
376,376,I'll figure something out.
377,377,In 1945...
378,378,our soldiers came home.
379,379,What was the first thing that they did?
380,380,They had sex.
381,381,"Seventeen years later, those babies, they've grown."
382,382,And they've got jobs.
383,383,They've got licenses.
384,384,But they do not wanna drive the same dull 50s cars that their parents drove.
385,385,"You see, kids today, they want glamour."
386,386,They want sex appeal.
387,387,They want to go fast.
388,388,Gentlemen...
389,389,it's time for the Ford Motor Company to go racing.
390,390,"We're already in racing, Iacocca."
391,391,NASCAR?
392,392,"It's... it's regional, sir."
393,393,"If you go to the movies, you open up a magazine, you don't see good ol' boys from WinstonSalem."
394,394,"You see, uh..."
395,395,Sophia Loren...
396,396,Monica Vitti.
397,397,"James Bond does not drive a Ford, sir."
398,398,That's because he's a degenerate.
399,399,See?
400,400,"God, I'd like to be a degenerate."
401,401,"Um, just give me one second here, sir."
402,402,Is this part of it?
403,403,"Is this going anywhere, Iacocca?"
404,404,"Just a second, sir."
405,405,"All right, all right, that's enough."
406,406,"Sir, if you just bear with me..."
407,407,Turn it off. Lights.
408,408,"Lee, in the last three years, you and your marketing team..."
409,409,have presided over the worst sales slump in US history.
410,410,Why exactly should Mr. Ford listen to you?
411,411,Because we've been thinking wrong.
412,412,Ferrari.
413,413,"Now, they have won four out of the last five Le Mans."
414,414,We need to think like Ferrari.
415,415,Ferrari makes fewer cars in a year than we make in a day.
416,416,We spend more on toilet paper than they do on their entire output.
417,417,You want us to think like them?
418,418,Enzo Ferrari will go down in history as the greatest car manufacturer of all time.
419,419,Why?
420,420,Is it because he built the most cars?
421,421,No.
422,422,It's because of what his cars mean.
423,423,Victory.
424,424,Ferrari wins at Le Mans.
425,425,"People, they, they want some of that victory."
426,426,What if the Ford badge meant victory?
427,427,"And meant it where it counts, with the first group of 17yearolds in history with money in their pockets?"
428,428,This would take years.
429,429,Decades to test and develop...
430,430,a race team capable of taking out Ferrari.
431,431,Ferrari's bankrupt.
432,432,"Enzo has spent every lira he's got chasing perfection, and you know something?"
433,433,He got there.
434,434,But now he's broke.
435,435,"You don't have to give up racing to get a bloody day job, Ken."
436,436,I think I do.
437,437,"Now, I've had my fun."
438,438,It's time to put food on the table...
439,439,and grow up.
440,440,The garage didn't pay the bills.
441,441,Now it's locked up.
442,442,"Racing doesn't pay them either, and I keep winning."
443,443,"Yeah, because you're good."
444,444,But I can't play the game.
445,445,I'm not what they call a people person.
446,446, You don't say.
447,447, And I'm 45 years old.
448,448,Do you really think I'm gonna change?
449,449,I'm never gonna get the good rise.
450,450,I started too late.
451,451,Because you fought in the bloody war.
452,452,"If you stop, you'll be bloody insufferable."
453,453,Let's quit going round the Wrekin. It's over.
454,454,Let's look on the bright side.
455,455,"Now I can get fat and old, trim the roses, and eat pork pies."
456,456,"Uh, scusa."
457,457,"Please, no photos."
458,458,Prego.
459,459," Relax, will you?"
460,460, You gotta understand.
461,461,This is like the Mafia showing up to buy the Statue of Liberty.
462,462,"Kind of the opposite, actually."
463,463,"The press gets wind of this, the shit will hit the Fangio."
464,464,"Lee Iacocca, Ford Motor."
465,465,"Franco Gozzi, Ferrari."
466,466,Journalists?
467,467,"No, no, Mr. Iacocca, no."
468,468,It's our cameras.
469,469,Just for history.
470,470,Fourliter Colombo engine.
471,471,One man assembles the entire engine by himself.
472,472,Another man assembles the transmission.
473,473,Everything handbuilt.
474,474,Bellissimo.
475,475,Racing Department.
476,476,Lee.
477,477,That's him.
478,478,This merger between our companies will form two entities.
479,479,"FordFerrari, who controls all production."
480,480,"Secondly, FerrariFord, the race team, In order to secure this, Ford will pay the sum..."
481,481,Excuse me.
482,482,He will need some time to read this.
483,483,Ah. Please.
484,484,"Ah. Yeah, of course."
485,485,I'm looking for the chairman of Fiat!
486,486,Agnelli!
487,487,I have photographs for you to see.
488,488,Pronto.
489,489,Pronto.
490,490,"Yes, I am here."
491,491,Do you have something to say?
492,492,Enzo maintains full control.
493,493,I get the company for 18 million.
494,494,"All done, thank you."
495,495,"""Gentlemen, ""only one small question."
496,496,"It concerns my race program."" ""If I wish to race Le Mans, ""and you do not wish for me to race Le Mans..."
497,497,"""do we or do we not go?"" Look, in that highly unlikely scenario..."
498,498,if we just can't agree...
499,499,"then, yes."
500,500,"I mean, no."
501,501,You are correct.
502,502,You do not go.
503,503,"""My integrity as a constructor, ""as a man, as an Italian, ""is deeply insulted by your proposal."" ""Go back to Michigan."" ""Back to your big, ugly factory."" ""Back to your big, ugly factory, ""making its ugly, little cars."" ""Tell your pigheaded boss that ""all his, uh, smug executives are worthless sons of whores."" Tell him he's not Henry Ford."
504,504,He's Henry Ford II.
505,505,I'm starving. Let's go eat.
506,506,He played us.
507,507,Old Man Enzo had no intention of selling to us.
508,508,He used us to up his price...
509,509,embarrass our company and insult your leadership.
510,510,It was a bad idea from the start.
511,511,What exactly did he say?
512,512,"He said Ford makes ugly little cars, and we make 'em..."
513,513,in an ugly factory.
514,514,He said our executives are sons of whores.
515,515,About me?
516,516,"He called you fat, sir."
517,517,Pigheaded.
518,518,Go on.
519,519,He said you're not Henry Ford.
520,520,You're Henry Ford II.
521,521,I want the best engineers.
522,522,The best drivers.
523,523,I don't care what it costs.
524,524,We're gonna build a race car.
525,525,And we're gonna bury that goddamn greasy wop under the finish line at Le Mans.
526,526,And I will be there to watch it.
527,527,Here they come.
528,528,"Go, go, go, go."
529,529,Assholes.
530,530,You're really pathetic.
531,531,"I'm so sorry, girls."
532,532,Charlie!
533,533,Quit throwing crackers at the girls all damn day.
534,534,God damn it.
535,535,Do I gotta deal with this?
536,536,It's already taken care of.
537,537,Sorry about that.
538,538,"So, yeah, 289 cubic inch V8."
539,539,Far out.
540,540,Extensive rework of AC Ace's front end.
541,541,And a stronger rear diff to handle the torque.
542,542,How's she handle a quarter mile?
543,543,"Well, now, I'm not saying you should go drag racing, but a quarter mile's 13.6."
544,544,Yeah.
545,545, Is that good?
546,546," Oh, that's real good."
547,547,He sold that same car three times this week.
548,548, You take cash? Is cash okay?
549,549, Cash is okay.
550,550,"Yeah, mister, you just bought yourself one hell of a sport car."
551,551,All right.
552,552,"Tell you what, I'm gonna... Phil!"
553,553,I'm gonna pass you off to my colleague here.
554,554,He gonna take care of you.
555,555," Phil, Wyatt."
556,556," Hello, Wyatt."
557,557,I'm gonna steal him for one second.
558,558,You take the payment.
559,559,"Whatever you do, do not let him take that car."
560,560,That's Jeff Blitzer's car.
561,561,And Frank Collins' and Steve McQueen's.
562,562,Shit. I forgot about McQueen.
563,563,Morning.
564,564,Can I help you?
565,565,Carroll Shelby?
566,566,Maybe.
567,567,"Lee Iacocca, Ford Motor."
568,568,What's with the wrench?
569,569,"That? Oh, long story."
570,570,"We are just going from strength to strength here, Lee."
571,571,"Terrific sales, we're killing it on the track."
572,572,"Now, I know I owe Ford for that last batch of engines..."
573,573,"Mr. Shelby, I can assure you I'm not here for money that you might owe Ford for spare parts."
574,574,You're not?
575,575,"No, I'm not."
576,576,Okay.
577,577,"I'm here on behalf of Mr. Ford, Henry Ford II."
578,578,"Suppose, um, hypothetically, that he wanted his company to win the 24 Hours of Le Mans."
579,579,You're one of the only Americans that's ever done it...
580,580,so I'm wondering...
581,581,what's it take?
582,582,Hypothetically?
583,583,Hypothetically.
584,584,It takes something money can't buy.
585,585,Money can buy speed.
586,586,"But it isn't about speed, Lee."
587,587,It's not just like those other tracks where all you do is turn to the left for four hours.
588,588,"To win that race, you need a car that's light enough to do 200 on the straightaways but strong enough to keep that up for 3,000 miles without a break."
589,589,"Not just the best car y'all have ever made, but better than anything that Enzo Ferrari shows up with that year."
590,590,And that just gets you to the green flag.
591,591,That's where your problems really start.
592,592,Is everything okay?
593,593,Go away.
594,594,So you're saying it's challenging.
595,595,"Look, it's not even a track, Lee."
596,596,Le Mans is eight and a half miles of country road.
597,597,"It's narrow, ungraded, it's rough."
598,598,"There's no camber on the turns, no rails."
599,599,You gotta do that for 24 hours.
600,600,"Twentyfour hours, Lee."
601,601,That means night.
602,602,Half that race is in the dark.
603,603,You can't see shit.
604,604,Cars coming up on you out of nowhere.
605,605,"Drivers stumbling around the track, pouring blood."
606,606,Maybe one of 'em is your friend. Maybe...
607,607,Maybe he's on fire.
608,608,"You're exhausted, you're hungry..."
609,609,"can't remember your name, what country you're in."
610,610,"And all of a sudden, you realize you're doing 198 on a straight."
611,611,And if anything goes wrong...
612,612,"you blow a gasket, a fivecent washer..."
613,613,"that's it, whole thing's over."
614,614,Ferrari wins again.
615,615,Just like he won last year and the year before that.
616,616,And the year before that.
617,617,Yeah.
618,618,It's challenging.
619,619,So you don't think...
620,620,that Ford Motor Company can build the greatest race car the world's ever seen?
621,621,You think that we are incapable of winning an event like that?
622,622,Even if we had a brilliant partner?
623,623,"Even if we wrote a, uh, blank check?"
624,624,"What I'm saying is, you can't buy a win, Lee."
625,625,But maybe you could buy the guy who gets you a shot.
626,626,"A new transmission, axles, shocks all around, ditch the body and the tires, you have yourself a contender."
627,627,Anything on this beauty that does work?
628,628,The mirrors are outstanding.
629,629,I saw that walking up.
630,630,"So, what, you just passing on an evening stroll?"
631,631,"Actually, Bulldog, I have a proposition for you."
632,632,You're gonna build a car to beat Old Man Ferrari...
633,633, Yeah.
634,634, ...with Ford?
635,635,With a Ford?
636,636,Correct.
637,637,And how long did you tell them that you needed?
638,638,"Two, three hundred years?"
639,639,Ninety days.
640,640,"All right, so let's just look at this for a moment."
641,641,"And for argument's sake, let's just forget about the whole 90day thing."
642,642,So let's just pretend you've got all the money in the world and all the time in the world.
