,Unnamed: 0,dialog
0,0,"Hon, the limo is here..."
1,1,finally.
2,2,What the hell is he doing?
3,3,He's just sitting there.
4,4,I don't know.
5,5,First he's late and now he's being a jerk.
6,6,You've gotta be kidding me.
7,7,Just grab the bags and let's get going.
8,8,This prick can forget about a tip.
9,9,Just hurry up.
10,10,Domestic terminal.
11,11,Step on it.
12,12,"By the way, thanks for the help with the bags."
13,13,Jerk.
14,14,Never again are we hiring this company.
15,15,This is ridiculous.
16,16,You know who recommended them?
17,17,Who?
18,18,Ron.
19,19,Don't ever listen to Ron!
20,20,"Oh my god, Ron."
21,21,This is classic Ron.
22,22,It's the same Ron who said he'd get me on the golf course for half price.
23,23,Ron.
24,24,You know what happened that day?
25,25,I paid for four people to go at full price.
26,26,"Well, if you close this business deal, we can buy our own golf course."
27,27,You know who won't be playing on our course?
28,28,Ron.
29,29,Shouldn't we have taken this turnoff?
30,30,Hey! What the hell are you doing?
31,31,You're going the wrong way.
32,32,Turn around.
33,33,What's your problem?
34,34,Turn around.
35,35,"If we miss this flight, I'm going to have you fired, jerk!"
36,36,This is unacceptable.
37,37,Unacceptable.
38,38,Who does he think he is?
39,39,Where are we?
40,40,What's up with this guy?
41,41,"I don't know, it looks like we're in some kind of industrial park."
42,42,"Will, do something."
43,43,You've pushed this too far!
44,44,I'm calling the cops.
45,45,"Jackie, something weird is going on."
46,46,"Oh, my God!"
47,47,They have guns!!!
48,48,"Will, they have guns!!!"
49,49,Are you crazy?!!!
50,50,"Please, take what you want, just don't hurt us!"
51,51,"If this is a kidnapping, I can get you money!"
52,52,We don't want your money.
53,53,What is it?
54,54,You're worth more dead than alive.
55,55,"So after hacking into the satellite, I was able to download loads of data and a clear pattern emerged."
56,56,"The eyes in the sky are fixated on coordinates with very distinctive radioactive signatures, and why is that?"
57,57,Aliens!
58,58,Mrs. Forrester...
59,59,Call me Lucy.
60,60,Did you hear what I just said?
61,61,Aliens could be watching right now.
62,62,All my theories are true.
63,63,I hacked into the satellites...
64,64,"Court order: no hacking, no computer access."
65,65,"We live in the 21st century, and you're my lawyer."
66,66,"That's why I hired you, to stop the government conspiracy against me."
67,67,"And as your lawyer, it's my job to keep you out of jail!"
68,68,No computers?
69,69,That's like Lord of the Rings with no Gandalf.
70,70,"Ok, relax."
71,71,Take a deep breath.
72,72,I am here for you.
73,73,That is why I'm seeing you on short notice at my house.
74,74,"I promise, I will get that order rescinded as soon as I get back."
75,75,"How do I know you're not just saying this to keep me calm, but in fact you're planning on moving to Europe and working with the world bank and..."
76,76,"There's no conspiracy here, and I am not moving to Europe."
77,77,I am here for you.
78,78,"That is why I took your case probono because I believe that you have a voice, so you've just got to trust me."
79,79,"Ok, I will see you next week."
80,80,Thank you.
81,81,Thank you.
82,82,Ok.
83,83,Ok.
84,84,"Hey, you ready to go?"
85,85,Just about.
86,86,You ok?
87,87,Mmmhmm.
88,88,"You know, we don't have to go if you don't want to go."
89,89,I know.
90,90,"I just think it'd be good for us to get away, you know, with some new friends."
91,91,Sure.
92,92,Great.
93,93,I'll be outside.
94,94,See ya.
95,95,"""Welcome to Second Chance Retreat, ""where couples go to grow love."" Wow, really?"
96,96,They need a new catch phrase.
97,97,"It's not about the catch phrase, Greg."
98,98,It's about the experience.
99,99,That doesn't sound any better.
100,100,"It's like any other vacation, only you get to work on your relationship."
101,101,"You do realize you said ""vacation"" and ""work"" in the same sentence?"
102,102,Trust us.
103,103,A couple's retreat can work wonders.
104,104,It's the secret to our happiness.
105,105,We go every year.
106,106,It's like a tuneup for our marriage.
107,107,Leave it to men to compare marriage to cars.
108,108,So exactly how backwoods is this place?
109,109,"Well, my friends, we get to arrive in style."
110,110,What does that even mean?
111,111,It's a surprise.
112,112,I'm not a fan of surprises.
113,113,"Come on, Lucy."
114,114,Any chance we'll be stopping soon?
115,115,We're getting close.
116,116,"We've been driving for, like, three hours."
117,117,How far is this place?
118,118,We're not so far away from the departure point.
119,119,Departure point?
120,120,What does that mean?
121,121,Relax.
122,122,You're about to find out.
123,123,"Uhoh, looks like we've got company."
124,124,What seems to be the problem?
125,125,You know you were speeding?
126,126,"No, I'm sorry, I did not."
127,127,I'll need to see your license and registration.
128,128,"The rest of you folks, can I see your ID as well?"
129,129,Is that really necessary?
130,130,"I'm afraid so, ma'am."
131,131,We've had a rash of drug runners come through the state.
132,132,I'm just checking.
133,133,We have nothing to hide.
134,134,"Alright, you folks hang tight."
135,135,I'm just gonna run these through the computer.
136,136,Nothing like small town hospitality.
137,137,Were you even speeding?
138,138,No.
139,139,They're probably just razzing outoftowners.
140,140,It all checks out.
141,141,Where y'all headed?
142,142,Second Chance Retreat.
143,143,Right.
144,144,Have a nice flight.
145,145,Thank you.
146,146,"Wait, flight?"
147,147,What is he talking about?
148,148,"Like I said earlier, we're arriving in style."
149,149,Something tells me this is not going to be an ordinary trip.
150,150,"Wow, you weren't kidding when you said traveling in style."
151,151,Thanks.
152,152,Thank you!
153,153,Thank you!
154,154,"Ha, ha, ha!!!!"
155,155,"Well, welcome to Second Chance Retreat."
156,156,"So, does this get the Forrester's seal of approval?"
157,157,It's so much nicer than I imagined.
158,158,Big time.
159,159,It's pretty impressive.
160,160,"Come on, Lucy."
161,161,Let's go check it out.
162,162,We'll wait for the second chopper with the bags.
163,163,"Wow, it's so serene."
164,164,It's so beautiful.
165,165,Very romantic.
166,166,I was gonna say relaxing.
167,167,Welcome to Second Chance Retreat.
168,168,Good afternoon.
169,169,"Place your hand on the outline, please."
170,170,"Oh, I'm sorry."
171,171,What's this for?
172,172,The security ID links to your unique prints and lets you into your room.
173,173,"Basically, it recognizes your biosignature."
174,174,I had the same reaction last time I was here.
175,175,"Relax, it's harmless."
176,176,Really?
177,177,Mmmhmm.
178,178,Bioscan successful.
179,179,And now I'll take a picture.
180,180,"Once you check in, the doctor will be around to do a medical."
181,181,"Wait, a medical?"
182,182,"I'm fine, thank you."
183,183,It's just for insurance purposes.
184,184,"They're gonna take a blood sample, check your heartbeat, basically just checking to see if you're alive and breathing."
185,185,I'll show you to your rooms.
186,186,"Well, perfect."
187,187,I just need to call the office and make sure there aren't any fires to put out.
188,188,You're out of luck.
189,189,"Sorry, no phone calls."
190,190,Retreat policy.
191,191,We have a cell blocker to prevent any calls.
192,192,"Wait, seriously?"
193,193,We are officially off the grid.
194,194,It's to help mend the relationship.
195,195,Great.
196,196,"Trust me, you'll be thanking me in a week."
197,197,If you say so.
198,198,"The security, is that really necessary?"
199,199,"Unfortunately, some of the wives attack their husbands during therapy."
200,200,It makes for a dangerous environment.
201,201,I'm kidding!
202,202,I had you!
203,203,"No, it's for the insurance company."
204,204,"They insisted on it, I don't know why."
205,205,I'll stick with the angry wife scenario.
206,206,"Speaking of angry wives, let's go find them before they spend all your money."
207,207,"Oh, man. This place is awesome."
208,208,The security?
209,209,The guards?
210,210,The blood tests?
211,211,The doctors?
212,212,Doesn't it seem a little weird?
213,213,Can we just get through the week?
214,214,"Look, if you want me to get another room, if you're uncomfortable..."
215,215,They're expecting us for dinner in an hour.
216,216,We should get ready.
217,217,I'm willing to make it work.
218,218,You just have to make an attempt.
219,219,♪ ♪ Is it just me or is this place completely empty?
220,220,"You read my mind, son."
221,221,"Russell Green, and this is my wife, Ira."
222,222,Short for irate.
223,223,Lucy.
224,224,"Hi, Lucy."
225,225,Greg.
226,226,"Hi, Greg."
227,227,James.
228,228,"This is my wife, Serena."
229,229,"You're retreat virgins, aren't you?"
230,230,"You've got that whole ""kicked in the nads"" look."
231,231,"I'm sorry, I forgot his muzzle at home."
232,232,So how did you hear about this place?
233,233,"Oh, well our friends James and Serena, they've been here before, they swear by it."
234,234,How about you?
235,235,It's a strange thing.
236,236,"Out of nowhere a woman shows up, tells us we've been selected to participate in a weeklong retreat and, well, three words sealed the deal for us: ""all expenses paid""."
237,237,And why not?
238,238,Who would turn down an all expenses paid holiday?
239,239,"I mean, they're looking for the right candidates, and that's Ira and I."
240,240,"Sour, miserable, irritable, old, and ornery."
241,241,"Russ figures if this can change us, it can change anyone."
242,242,"Well, I doubt a week will do the trick."
243,243,I keep telling her there's no easy trick to saving a marriage.
244,244,Except for divorce.
245,245,"You, come with me."
246,246,"What? I'm sorry, ow!"
247,247,Hey!
248,248,What the hell are you doing?!
249,249,She needs to come with me.
250,250,"There, that feeling, defending a loved one."
251,251,Hold onto it.
252,252,It means she's someone important to you.
253,253,Who the hell are you?
254,254,My name is Alex Koslov.
255,255,This is my retreat.
256,256,I know who I am and why I am here.
257,257,Do you?
258,258,I'm beginning to wonder.
259,259,I'm going to give you the means to keep your relationship together.
260,260,Welcome to Second Chance Retreat.
261,261,I hope you all enjoy your week.
262,262,Now that's an entrance.
263,263,"Trust me, Greg."
264,264,He puts on a big show.
265,265,It's worth the price of admission.
266,266,Dinner is being served.
267,267,Please take a seat.
268,268,I'm starving.
269,269,You wanted to be here.
270,270,The meal was fantastic.
271,271,Thank you.
272,272,"Lucy, it was a stunt."
273,273,They wanted a reaction out of us and it worked.
274,274,"Granted, he may have taken it a little bit too far."
275,275,May have taken it too far?
276,276,He basically attacked me.
277,277,I stepped in front of you.
278,278,What else do you want from me?
279,279,Five seconds of chivalry.
280,280,"Yeah, it must have been a real stretch for you, Greg."
281,281,Some of you may be having second thoughts.
282,282,It is understandable.
283,283,You are afraid of change.
284,284,You are comfortable with the status quo.
285,285,You are looking for any excuse to keep things the way they are.
286,286,"If you feel this way, if you are too weak to block out that scared little voice inside your head, then there is the door."
287,287,Go on.
288,288,Use it.
289,289,Good.
290,290,"Again, welcome to Second Chance Retreat."
291,291,We were expecting a larger group but the weather took a turn for the worse.
292,292,It looks clear enough outside.
293,293,"True, but not from where we fly from the east."
294,294,So until the weather changes it will just be us.
295,295,Is there no other way in?
296,296,There is a remote road through Edgewater County but it's not exactly userfriendly.
297,297,But on the bright side it gives us a chance to get to know each other even better.
298,298,I will get to know you from the inside and out.
299,299,Abby.
300,300,"Now, if I could ask you to place your identification in the bowl."
301,301,"Uh, what for?"
302,302,"Well, it is vital that we shed symbols of our identity before we can possibly work on our relationships."
303,303,I'm sorry but I'm not comfortable giving my ID to someone I hardly know.
304,304,Someone you hardly know or someone you don't like?
305,305,"You're the guru, you tell me."
306,306,I'm in.
307,307,Me too.
308,308,Thanks.
309,309,"Well, like Lucy said, you're the guru."
310,310,So I'm in.
311,311,We had the same reaction last year.
312,312,It's all good.
313,313,It is very nice to see returning couples.
314,314,It's great to be back.
315,315,I'm really excited for this week's retreat.
316,316,As am I.
317,317,Now tomorrow I would like to start with personal sessions.
318,318,I will work with each couple individually.
319,319,I would love to start with Greg and Lucy in the morning.
320,320,"Yeah, great."
321,321,I can't wait.
322,322,Excellent.
323,323,Thank you for a lovely evening.
324,324,"It has been a pleasure, but now I have some business to attend to."
325,325,You must excuse me.
326,326,Good night.
327,327,"Greg and Lucy Forrester, married six years, almost seven."
328,328,Tell me about the life you share.
329,329,Do you have any children?
330,330,No.
331,331,We're basically workaholics.
332,332,Greg is a history professor.
333,333,Currently on sabbatical.
334,334,I'm working on my thesis.
335,335,And I'm a lawyer.
336,336,And you know what they say about lawyers.
337,337,"Oh, really?"
338,338,"What do they say, Greg?"
339,339,"I don't know, I was just joking, Lucy."
340,340,Any illness?
341,341,No.
342,342,What's with the emphasis on our health?
343,343,I don't see how it's relevant.
344,344,"Well, as you know, disease can put a strain on a relationship."
345,345,"Well, of course, but you already had us medically checked."
346,346,"You know, digging any deeper seems a little personal."
347,347,"After all, I am a lawyer, I know my rights."
348,348,Lucy.
349,349,Interesting.
350,350,I see your defense mechanism.
351,351,You turn the tables.
352,352,You do not like to be vulnerable.
353,353,That's not what I'm doing.
354,354,That is what you're doing and you do it all the time.
355,355,I do not.
356,356,Whatever.
357,357,I'm sorry.
358,358,We both have a clean bill of health.
359,359,It's never been an issue for us.
360,360,"Um, may I ask you about your family history?"
361,361,Tell me about your parents.
362,362,"Uh, my parents died."
363,363,My father actually died last year.
364,364,I'm sorry to hear that.
365,365,Any siblings?
366,366,No.
367,367,Lucy?
368,368,Only child raised by a single mom.
369,369,She was just diagnosed with dementia a few years back.
370,370,I'm sorry to hear that.
371,371,Tell me how you two met.
372,372,In college.
373,373,We took the same elective.
374,374,Astronomy.
375,375,Yeah.
376,376,We used to sit on opposite sides of class.
377,377,We never spoke to each other.
378,378,Until we booked the same time at the observatory.
379,379,He loved gazing at the stars.
380,380,And the rest is history.
381,381,Tell me about the struggles in your marriage.
382,382,We all have demons.
383,383,This is the place to face them.
384,384,Lucy!
385,385,Lucy!
386,386,"I'm sorry, I can't do this."
387,387,Lucy...
388,388,"Doc, I'm so sorry."
389,389,Lucy!
390,390,"How many times do I have to tell you, nothing else happened between us?"
391,391,Only because I caught you.
392,392,I saw you kiss her!
393,393,She kissed me!
394,394,How many times do I have to tell you that?
395,395,"You didn't seem to mind, did you?"
396,396,I don't know.
397,397,"I needed you, and you checked out."
398,398,I was there!
399,399,You were defending your clients.
400,400,"Oh, ok."
401,401,So I drove you into the arms of another woman?
402,402,How cliche.
403,403,"No, I told you."
404,404,She kissed me!
405,405,"And for a second, god help me, I needed it."
406,406,"But if you didn't walk through that alley, I would have pushed her away."
407,407,We came here to save our marriage.
408,408,You've just gotta give me one more day.
409,409,Just give me one more day.
410,410,I can't go back in there.
411,411,That's fine.
412,412,Let's just go for a walk.
413,413,Ok.
414,414,"Yes, it's me."
415,415,I just finished the personal interviews with the Forresters.
416,416,I think we should dig a little deeper.
417,417,They... they may be hiding something.
418,418,"No, no, no, no."
419,419,"It's... it's no problem, it's just I want to cover all the bases."
420,420,We've had a 100 percent success rate up until this point.
421,421,It's getting dark soon so maybe we should head back?
422,422,Yeah.
423,423,"You know, it's gonna be a little quicker if we go straight back the way we came."
424,424,"Ok, which way would that be?"
425,425,"Uh... well, if we head down there, go across the river to that trail, it should lead us back to the retreat."
426,426,"Look, there's a rope."
427,427,Shouldn't we just go back the way we came?
428,428,You can't be serious.
429,429,Why don't we just go back the way we came?
430,430,"No, it'll be fine."
431,431,I'll just go down and check how deep the river is.
432,432,I don't think this is a good idea.
433,433,"I'm serious, Luce."
434,434,It's gonna be fun.
435,435,Luce!
436,436,Yeah?
437,437,"It's safe to cross, the river's only ankle deep."
438,438,Come on down.
439,439,I don't think this looks safe.
440,440,It is.
441,441,Luce!
442,442,Are you ok?
443,443,Someone pushed me!
444,444,What?
445,445,"I felt it, it felt like someone pushed me!"
446,446,Why would someone push you?
447,447,I... I don't know!
448,448,Did you see somebody up there?
449,449,No.
450,450,You think I just fell down the hill?
451,451,"I don't know, maybe you tripped."
452,452,You know... just forget it.
453,453,Hey.
454,454,Where've you been?
455,455,We went on a hike.
456,456,I think someone tried to push me down a hill.
457,457,What?
458,458,I think someone's trying to kill me.
459,459,Kill you?
460,460,I know it sounds crazy but I know I saw someone.
461,461,Who?
462,462,I don't know.
463,463,Did you see somebody?
464,464,I didn't see anything.
465,465,You can't be sure you saw someone.
466,466,Maybe a branch snapped and hit you or something.
467,467,I don't know.
468,468,Greg!
469,469,"Well, it makes more sense than someone trying to kill you."
470,470,I know what I saw.
471,471,But why would someone try to hurt you?
472,472,I... I don't know!
473,473,Are you suggesting it's someone from the resort?
474,474,There you are!
475,475,We were just about to send out a search party to look for you.
476,476,Most guests return before dark.
477,477,Lucy was just telling us that...
478,478,"Oh, we went on a hike and we thought we saw a bear and just got spooked and I just..."
479,479,I tripped and fell.
480,480,Then you are very lucky.
481,481,The woods are not a good place after dark.
482,482,You should stay on the retreat grounds.
483,483,"Now, we are about to dine in a few minutes."
484,484,Please join me.
485,485,"Great, we're starving."
486,486,You guys coming?
487,487,Just give us a minute.
488,488,Ok.
489,489,"Greg, we need to talk."
490,490,I know I'm not crazy.
491,491,It doesn't make any sense.
492,492,"I think someone is trying to kill me, and it could be anyone here!"
493,493,"Lucy, we were dehydrated, we were tired, we were hungry."
494,494,We could have seen Bigfoot in those conditions.
495,495,But we didn't.
496,496,"Greg, please."
497,497,I need you to believe me.
498,498,Ok.
499,499,We have to tell Koslov.
500,500,"No, no, no."
501,501,I... I don't think that's a good idea.
502,502,Why not?
503,503,Because I don't trust him.
504,504,"I mean, with all this medical crap and the guards, I'm getting a bad feeling about this place."
505,505,I think we should leave.
506,506,Leave?
507,507,"Yeah, as soon as we can."
508,508,So this is what you're after?
509,509,You're gonna come up with any excuse to get out of here.
510,510,"It's not an excuse, Greg."
511,511,I'm sorry.
512,512,"Ok, you're gonna believe a conspiracy that someone's trying to kill you?"
513,513,You believe in that more than us.
514,514,"Greg, wait!"
515,515,Have you guys seen Greg?
516,516,I think he went that way.
517,517,Lucy!
518,518,"I'm sorry, I didn't mean to scare you."
519,519,Can we talk?
520,520,"Yes, of course."
521,521,"It's just us, Ira."
522,522,Serena and James told us what happened.
523,523,"I think someone might want to hurt Russ and I, too."
524,524,What makes you think that?
525,525,"Well, strange things have been happening to us since we got here."
526,526,I feel like we're being watched.
527,527,I feel the same way.
528,528,"Russ always insisted we put our valuables, ID, cash, credit cards in a money belt and we never took it off."
529,529,We only took it off when we went to bed.
530,530,"Wait, you didn't give your ID to Koslov?"
531,531,That's right.
532,532,"Well, I gave him a library card."
533,533,And we never put anything in the safe.
534,534,"The other day I check my money belt, my ID was gone."
535,535,My credit cards.
536,536,Same with Russ's.
537,537,Did you report it to...
538,538,"Yes, Koslov, of course."
539,539,That was the first thing we did and he said we should check again just to make sure.
540,540,Maybe it fell out.
541,541,He even went back with us to look.
542,542,"And sure enough all our ID was under the bed, like it had just slipped out somehow."
543,543,But I know it didn't.
544,544,Someone had to have come in our room and taken it when we were sleeping.
545,545,For what reason?
546,546,I don't know.
547,547,I don't know.
548,548,Has anything gone missing from your room?
549,549,"Not that I know of, but we use the safe."
550,550,I just... I just have a terrible feeling about this place.
551,551,Does Russ feel the same?
552,552,"Yeah, for once we agree on something."
553,553,"Ah, there you are."
554,554,I was wondering what had happened to you.
555,555,"Now that I have you here, I should let you know that it is not safe to wander away from the retreat, especially at night, and we would not want anything to happen to you."
556,556,Have a pleasant evening.
557,557,"You don't think he heard, do you?"
558,558,No.
559,559,"Don't worry, everything is gonna be fine."
560,560,I'm gonna go check on Greg.
561,561,"Ok, I'm gonna go back..."
562,562,go back in there.
563,563,Greg!
564,564,"Greg, wake up!"
565,565,What are you doing?
566,566,Where are Russ and Ira?
567,567,We think they left.
568,568,What?
569,569,"I... I talked to Ira last night, she didn't say anything."
570,570,"Sorry, you'll have to talk to Mr. Koslov."
571,571,Come in.
572,572,"Ah, Mrs. Forrester."
573,573,What can I do for you?
574,574,"The Greens, where are they?"
575,575,They're probably about an hour from the retreat now.
576,576,Excuse me?
577,577,They decided to leave unannounced.
578,578,We see this sometimes.
579,579,We should be able to locate them shortly.
580,580,Something's not right here.
581,581,Care to share your concerns?
582,582,Is there something you're not telling me?
583,583,No.
584,584,Um... I'm going to go find Greg.
585,585,Of course.
586,586,"Yes, it's me."
587,587,Any news?
588,588,The next group is due to arrive tomorrow and the investors want assurance that there will be no delays.
589,589,"After all, for some people it's a matter of life and death."
590,590,Any sign of them?
591,591,I'm afraid not.
592,592,Maybe they went home.
593,593,How?
594,594,"It's 15 miles of rough terrain, we'll find them."
595,595,I want to be part of the search party.
596,596,Me too.
597,597,"I appreciate your concern, but let's leave this to the professionals."
598,598,If that's the case then we should call the cops.
599,599,"I mean, they could be hurt, or worse."
600,600,"I mean, you said that there's predators out there."
601,601,"Mrs. Forrester, we have this under control."
602,602,"All the security, the guards..."
603,603,How does someone get away so easily?
604,604,I've never seen this.
605,605,I believe her.
606,606,"They went and told Koslov and when they came back, they found their IDs on the floor like they had just fallen out."
607,607,So someone broke into Russ and Ira's room and stole their IDs?
608,608,And credit cards while they were sleeping.
609,609,And then put it back so it didn't raise any alarm bells?
610,610,When was the last time you checked the safe?
611,611,Not since we got here.
612,612,You?
613,613,I had no reason to.
614,614,What's the number?
615,615,"Four, one, five, four."
616,616,Let me try.
617,617,"Four, one, five, four."
618,618,"Four, one, five, four."
619,619,That's the number I set.
620,620,It's not working.
621,621,"Well, we both failed, so not much of a coincidence."
622,622,Ugh.
623,623,I don't feel so good.
624,624,"Lucy, Lucy."
625,625,"Lucy, Lucy."
626,626,Wake up.
627,627,Can you hear me?
628,628,Lucy!
629,629,"Lucy, wake up!"
630,630,Can you hear me?
631,631,"Breathe, breathe."
632,632,Take some deep breaths.
633,633,"Deep breaths, that's it."
634,634,"That's... no, no, no, no."
635,635,Not so fast.
636,636,"Woah, what happened?"
637,637,"A leaky gas line fed some carbon monoxide into the room, it's lucky that we found you when we did."
638,638,A leaky gas line?
639,639,"Yes, being off the grid, we use generators."
640,640,"But not to worry, the problem has been solved for now."
641,641,The last thing I remember is my wife and I trying to get into our safe.
642,642,The damn thing kept rejecting us.
643,643,That is strange.
644,644,Try it again.
645,645,It seems to be working fine.
646,646,Did you find Russ and Ira?
647,647,"No, not yet, but the police are looking into it."
648,648,I promise to keep you both posted.
649,649,"Um, again I am very sorry for this inconvenience."
650,650,I have some other things to attend to.
651,651,Be well.
652,652,"Hey, hon. You ok?"
653,653,Maybe the gas leak wasn't an accident.
