,Unnamed: 0,dialog
604,604,Weeks?
605,605,"Well, yeah, Andy. I don't have her stuffed down the front of my pants right now, I'm sorry to say."
606,606,But I'll get her. Relax.
607,607,Thanks.
608,608," It was a surprise, Mr. Farrell."
609,609, It was.
610,610,Sit down.
611,611,Did you tell him what I'm doing here?
612,612,"No, I wanted to save that as a surprise, too."
613,613,"Hang on to your hat, Mr. Farrell..."
614,614, Take a walk.
615,615, I gotta change the reel.
616,616,I said fuck off!
617,617,Ain't you gonna scream?
618,618,Let's get this over with.
619,619,He broke my fuckin' nose!
620,620,Now...I'm gonna open my fly...
621,621,and you're gonna swallow what I give you to swallow.
622,622,Then you're gonna swallow Rooster's.
623,623,"You broke his nose, he ought to have something to show for it."
624,624,"Anything you put in my mouth, you're gonna lose."
625,625,No. You don't understand.
626,626,"You do that, and I'll put all eight inches of this steel in your ear."
627,627,All right.
628,628,"But you should know that sudden, serious brain injury causes the victim to bite down hard."
629,629,"In fact, I hear the bite reflex is so strong, they have to pry the victim's jaws open..."
630,630,with a crowbar.
631,631,Where did you get this shit?
632,632,I read it.
633,633,"Know how to read, you ignorant fuck?"
634,634,Honey...
635,635,..you shouldn't.
636,636,Bogs didn't put anything in Andy's mouth...
637,637,and neither did his friends.
638,638,What they did do...
639,639,is beat him within an inch of his life.
640,640,Andy spent a month in the infirmary.
641,641,Bogs spent a week in the hole.
642,642,"Time's up, Bogs."
643,643,"It's your world, boss."
644,644,Return to your cell blocks for evening count.
645,645,All prisoners report for lockdown.
646,646,What?
647,647,Where's he going?
648,648,Grab his ankles.
649,649,No! No!
650,650,No!
651,651,Help me...
652,652,Aaarghh!
653,653,Two things never happened again after that.
654,654,The Sisters never laid a finger on Andy again...
655,655,..and Bogs never walked again.
656,656,They transferred him to a minimumsecurity hospital upstate.
657,657,"To my knowledge, he lived out the rest of his days drinking his food through a straw."
658,658,I'm thinking Andy could use a nice welcome back when he gets out of the infirmary.
659,659,Sounds good to us.
660,660,I figure we owe him that much for the beer.
661,661,The man likes to play chess.
662,662,Let's get him some rocks.
663,663,Guys...
664,664,I got one. I got one. Look.
665,665,"Heywood, that isn't soapstone."
666,666,"And it ain't alabaster, either."
667,667,"What are you, a fucking geologist?"
668,668,He's right. It ain't.
669,669,"Well, what the hell is it?"
670,670,A horse apple.
671,671, Bullshit.
672,672," No, horse shit. Petrified."
673,673,"Oh, Jesus Christ!"
674,674,"Oh, damn!"
675,675,"Despite a few hitches, the boys came through in fine style."
676,676,"And by the weekend he was due back, we had enough rocks to keep him busy till rapture."
677,677,I also got a big shipment in that week.
678,678,Cigarettes. Chewing gum.
679,679,Sipping whisky.
680,680,Playing cards with naked ladies on them.
681,681,You name it.
682,682,"And of course, the most important item."
683,683,Rita Hayworth herself.
684,684,"OK, look alive! Open all tiers."
685,685,Heads up. They're tossing the cells.
686,686,Heads up. They're tossing the cells.
687,687,On your feet.
688,688,Face the wall.
689,689,Turn around and face the Warden.
690,690,Pleased to see you reading this.
691,691,Any favorite passages?
692,692,"""Watch ye, therefore, for ye know not when the master of the house cometh."" Mark 13:35."
693,693,I always liked that one.
694,694,But I prefer...
695,695,"""I'm the light of the world."
696,696,"He that followeth me shall not walk in darkness, but shall have the light of life."" John, Chapter 8, Verse 12."
697,697,I hear you're good with numbers. How nice.
698,698,A man should have a skill.
699,699,Wanna explain this?
700,700,It's called a rock blanket.
701,701,It's for shaping and polishing rocks.
702,702,A little hobby of mine.
703,703,"It's pretty clean. Some contraband here, but nothing to get in a twist over."
704,704,I can't say I approve of this.
705,705,But I suppose...
706,706,..exceptions can be made.
707,707,Lock 'em up!
708,708,I almost forgot.
709,709,I'd hate to deprive you of this.
710,710,Salvation lies within.
711,711,"Yes, sir."
712,712,Tossing cells was just an excuse.
713,713,"The truth is, Norton wanted to size Andy up."
714,714,My wife made that in church group.
715,715,"Very nice, sir."
716,716,Do you enjoy working in the laundry?
717,717,"No, sir, not especially."
718,718,Perhaps we can find something more...
719,719,befitting a man of your education.
720,720,"Hey, Jake. Where's Brooks?"
721,721,Andy.
722,722,I thought I heard you out here!
723,723,I've been reassigned to you.
724,724,I know. They told me.
725,725,Ain't that a kick in the head?
726,726,"Well, I'll give you the dime tour."
727,727,Come on.
728,728,"Well, here she is."
729,729,Shawshank Prison library.
730,730,National Geographics.
731,731,Reader's Digest condensed books.
732,732,Louis L'Amour.
733,733,Look Magazine.
734,734,Erle Stanley Gardners.
735,735,"Every evening, I load up the cart and make my round."
736,736,I enter the names on this clipboard here.
737,737,"Easypeasy, Japanesey. Any questions?"
738,738,"Brooks, how long have you been librarian?"
739,739,"Oh...I come here in '05, and they made me librarian in 1912."
740,740,"And in all that time, have you ever had an assistant?"
741,741,"No. No, not much to it, really."
742,742,"Well, why me? Why now?"
743,743,"I don't know, but it'll be nice to have some company down here for a change."
744,744,Dufresne!
745,745,That's him. That's the one.
746,746,I'm Dekins.
747,747,I was er...
748,748,thinking about maybe setting up some kind of trust fund for my kids' educations.
749,749,Oh...
750,750,I see.
751,751,"Well, erm..."
752,752,"..why don't we have a seat, and talk it over?"
753,753,"Brooks, do you have a piece of paper and a pencil?"
754,754,Thanks.
755,755,So...
756,756,Mr. Dekins...
757,757,"And then Andy says to Mr. Dekins, ""Do you want your sons to go to Harvard,  or Yale?""  He didn't say that?"
758,758,"As God is my witness, he did!"
759,759,Dekins just blinked for a second.
760,760,Then he laughed himself silly.
761,761,And afterwards he shook Andy's hand.
762,762,My ass!
763,763,Shook his hand.
764,764,"Hell, I...I near soiled myself!"
765,765,"All Andy needed was a suit and a tie and a little jiggly hula girl on his desk, and he would have been: ""Mr. Dufresne, if you please""!"
766,766,"Making a few friends, Andy?"
767,767,"I wouldn't say ""friends""."
768,768,I'm a convicted murderer who provides sound financial planning.
769,769,It's a wonderful pet to have.
770,770,"Got you out of the laundry, though."
771,771,"Well, it might do more than that."
772,772,How about expanding the library?
773,773,Get some new books in there.
774,774,"If you're gonna ask for something, ask for a pool table."
775,775, Right.
776,776, How do you expect to do that?
777,777,"I mean, get new books in here, Mr. Dufresne, if you please?"
778,778,Ask the Warden for funds.
779,779,"Son, son. Six wardens have been through here in my tenure, and I've learned one immutable, universal truth."
780,780,Not one of them born...
781,781,whose asshole wouldn't pucker up tighter than a snare drum when you asked them for funds.
782,782,"The budget's stretched thin, as it is."
783,783,I see.
784,784,Perhaps I could write to the State Senate and request funds from them.
785,785,"As far as they're concerned, there's only three ways to spend money when it comes to prisons: more walls, more bars and more guards."
786,786,"Still, I'd like to try, with your permission."
787,787,A letter a week. They can't ignore me forever.
788,788,Sure can.
789,789,"But you write your letters, if it makes you happy."
790,790,I'll even mail them for you. How's that?
791,791,"So, Andy started writing a letter a week, just like he said."
792,792,"And, just like Norton said, Andy got no answers."
793,793,"The following April, Andy did tax returns for half the guards at Shawshank."
794,794,"The year after that, he did them all..."
795,795,including the Warden's.
796,796,"The year after that, they rescheduled the start of the intramural season to coincide with tax season."
797,797,The guards on the opposing teams all remembered to bring their W2s.
798,798,"So, Moresby Prison issued you your gun, but you had to pay for it?"
799,799,"Damn right. The holster, too."
800,800,That's taxdeductible.
801,801,You can write that off.
802,802,"Yes, sir."
803,803,Andy was a regular cottage industry.
804,804,"In fact, it got so busy at tax time..."
805,805,he was allowed a staff.
806,806,"Hey, Red, can you hand me a stack of 1040s?"
807,807,"It got me out of the wood shop a month out of the year, and that was fine by me."
808,808,And still...he kept sending those letters.
809,809,"Red, Andy."
810,810,It's Brooks.
811,811,Watch the door.
812,812,"Please, Brooks."
813,813, Just calm the fuck down.
814,814, Stay back!
815,815, Stay back!
816,816, What the hell's going on?
817,817,You tell me. One second he's fine.
818,818,Then out comes the knife.
819,819,"Brooks, we can talk about this. Right?"
820,820,"Nothing to talk about, goddamn it!"
821,821,I'm gonna cut his fucking throat.
822,822,"Heywood? Wait, what's he done to you?"
823,823,It's what they done!
824,824,I...I got no choice...
825,825,You're not gonna hurt him.
826,826,Even Heywood knows that.
827,827," Right, Heywood?"
828,828," I...I know that, sure."
829,829,"You won't hurt him, because he's a friend, and you're a reasonable man."
830,830,"That's right. Right, guys?"
831,831, Yes.
832,832," So, put the knife down. Brooks, look at me."
833,833,Put the knife down.
834,834,Brooks...
835,835,"Look at his neck, for God's sake."
836,836,"Brooks, look at his neck. It's bleeding."
837,837,It's the only...
838,838,It's the only way they'd let me stay.
839,839,Come on. This is crazy.
840,840,You don't want to do this.
841,841,Put it down.
842,842,Come on. Take it easy.
843,843,You're going to be all right.
844,844,Him?
845,845,"Hell, what about me?"
846,846,Crazy old fool damn near cut my throat.
847,847,"Shit, Heywood, you've had worse from shaving."
848,848,"What the hell did you do to set him off, anyway?"
849,849,Nothing. I come in here to say faretheewell.
850,850,Ain't you heard? His parole's come through.
851,851,I just don't understand what happened in there.
852,852,That's all.
853,853,The old man's as crazy as a rat in a tin shithouse.
854,854,"Oh, Heywood, that's enough out of you."
855,855, I heard he had you shitting in your pants.
856,856, Fuck you!
857,857,Would you knock it off?
858,858,Brooks ain't no bug.
859,859,He's just...
860,860,He's just institutionalized.
861,861,"Institutionalized, my ass."
862,862,"The man's been in here 50 years, Heywood."
863,863,This is all he knows.
864,864,"In here, he's an important man."
865,865,He's an educated man.
866,866,"Outside, he's nothing."
867,867,Just a usedup con with arthritis in both hands.
868,868,Probably couldn't get a library card if he tried.
869,869,You know what I'm trying to say?
870,870,"Red, I do believe you're talking out of your ass."
871,871,"You believe whatever you want, Floyd."
872,872,"But I'm telling you, these walls are funny."
873,873,First you hate 'em...
874,874,..then you get used to 'em.
875,875,Enough time passes...
876,876,you get so you depend on 'em.
877,877,That's institutionalized.
878,878,Shit.
879,879,You can never get like that.
880,880,"Oh, yeah?"
881,881,Say that when you've been here as long as Brooks has.
882,882,Goddamn right.
883,883,They send you here for life.
884,884,That's exactly what they take.
885,885,"The part that counts, anyway."
886,886,"I can't take care of you no more, Jake."
887,887,"You go on, now."
888,888,You're free.
889,889,Bye.
890,890,"Good luck, Brooks."
891,891,Dear fellas...
892,892,I can't believe how fast things move on the outside.
893,893,"Watch it, oldtimer! Are you trying to get killed?"
894,894,"I saw an automobile once, when I was a kid, but now...they're everywhere."
895,895,The world went and got itself in a big damn hurry.
896,896,"The parole board got me into this halfway house called The Brewer, and a job bagging groceries at the Foodway."
897,897,"It's hard work, and I try to keep up, but my hands hurt most of the time."
898,898,Make sure your man doublebags.
899,899,"Last time, the bottom near came out."
900,900,"Make sure you doublebag, like the lady says."
901,901,Understand?
902,902,"Yes, sir. I surely will."
903,903,I don't think the store manager likes me very much.
904,904,"Sometimes, after work, I go to the park and feed the birds."
905,905,I keep thinking Jake might just show up and say hello.
906,906,But he never does.
907,907,"And I hope, wherever he is, he's doing OK and making new friends."
908,908,I have trouble sleeping at night.
909,909,"I have bad dreams, like I'm falling."
910,910,"I wake up, scared."
911,911,Sometimes it takes me a while to remember where I am.
912,912,"Maybe I should get me a gun and rob the Foodway, so they'd send me home."
913,913,"I could shoot the manager, while I was at it."
914,914,Sort of like a bonus.
915,915,I guess I'm too old for that sort of nonsense any more.
916,916,I don't like it here.
917,917,I'm tired of being afraid all the time.
918,918,I've decided...
919,919,not to stay.
920,920,I doubt they'll kick up any fuss.
921,921,Not for an old crook like me.
922,922,"""I doubt they'll kick up any fuss."
923,923,Not for an old crook like me.
924,924,PS. Tell Heywood I'm sorry I put a knife to his throat.
925,925,"No hard feelings. Brooks."" He should have died in here."
926,926,What the fuck have you done?
927,927,It's a goddamn mess. I'll tell you that.
928,928,What's all this?
929,929,"You tell me, fuckstick."
930,930,They're all addressed to you.
931,931,Take it.
932,932,"""Dear Mr. Dufresne..."
933,933,"In response to your repeated enquiries, the State has allocated the enclosed funds for your library project."" This is 200 dollars."
934,934,"""In addition, the Library District has generously responded with a charitable donation of used books and sundries."
935,935,We trust this will fill your needs.
936,936,We now consider the matter closed.
937,937,"Please stop sending us letters."" I want all this cleared out before the Warden gets back."
938,938,"Yes, sir."
939,939,"Good for you, Andy."
940,940,Wow!
941,941,It only took six years.
942,942,"From now on, I'll write two letters a week, instead of one."
943,943,"Oh, I believe you're crazy enough."
944,944,"You'd better get all this stuff out, like the Captain said."
945,945,"Now, I'm gonna go pinch a loaf."
946,946,"When I come back, this is all gone, right?"
947,947,Wow.
948,948,Duettino from The Marriage Of Figaro Sull'aria...
949,949,"Andy, do you hear that?"
950,950,..zeffiretto Questa será spirera Sotto i pini Del boschetto Sotto i pini...
951,951,Dufresne?
952,952,Dufresne?
953,953,"Andy, let me out."
954,954,Andy?
955,955,I have no idea to this day what those two Italian ladies were singing about.
956,956,"The truth is, I don't want to know."
957,957,Some things are best left unsaid.
958,958,"I like to think they were singing about something so beautiful, it can't be expressed in words..."
959,959,and makes your heart ache because of it.
960,960,"I tell you, those voices soared..."
961,961,higher and farther than anybody in a grey place dares to dream.
962,962,It was like some beautiful bird flapped into our drab little cage and made those walls dissolve away.
963,963,And for the briefest of moments...
964,964,every last man at Shawshank felt free.
965,965,It pissed the Warden off something awful.
966,966,Open the door.
967,967,Open it up!
968,968,"Dufresne, open this door!"
969,969,Turn that off!
970,970,"I am warning you, Dufresne. Turn that off!"
971,971,Dufresne...
972,972,You're mine now.
973,973,Andy got two weeks in the hole for that little stunt.
974,974,On your feet!
975,975," Hey, look who's here."
976,976, Maestro!
977,977,"Y YYou couldn't play something good, huh?"
978,978,Hank Williams or something?
979,979,They broke the door down before I could take requests.
980,980,"Was it worth it, two weeks in the hole?"
981,981,Easiest time I ever did.
982,982,Bullshit!
983,983,There's no such thing as easy time in the hole.
984,984,A week in the hole is like a year.
985,985,I had Mr. Mozart to keep me company.
986,986,"So, they let you tote that record player down there, huh?"
987,987,It was in here.
988,988,And in here.
989,989,That's the beauty of music.
990,990,They can't get that from you.
991,991,Haven't you ever felt that way about music?
992,992,"Well, I played a mean harmonica, as a younger man."
993,993,"Lost interest in it, though."
994,994,Didn't make much sense in here.
995,995,Here's where it makes the most sense.
996,996,"You need it, so you don't forget."
997,997,Forget?
998,998,Forget that...
999,999,there are places...
1000,1000,..in the world that aren't made out of stone...
1001,1001,that there's a...
1002,1002,there's something...
1003,1003,inside that they can't get to...
1004,1004,that they can't touch.
1005,1005,It's yours.
1006,1006,What are you talking about?
1007,1007,Hope.
1008,1008,Hope?
1009,1009,"Let me tell you something, my friend."
1010,1010,Hope is a dangerous thing.
1011,1011,Hope can drive a man insane.
1012,1012,It's got no use on the inside.
1013,1013,You'd better get used to that idea.
1014,1014,Like Brooks did?
1015,1015,Sit down.
1016,1016,It says here that you've served You feel you've been rehabilitated?
1017,1017,"Oh, yes, sir."
1018,1018,Without a doubt.
1019,1019,And I can honestly say I'm a changed man.
1020,1020,No danger to society here.
1021,1021,God's honest truth.
1022,1022,Absolutely rehabilitated.
1023,1023,"Jesus, when they say it like that..."
1024,1024,You wonder where it went.
1025,1025,I wonder where ten years went.
1026,1026,Here.
1027,1027,Little parole rejection present.
1028,1028,Go ahead and open it.
1029,1029,I had to go through one of your competitors.
1030,1030,I hope you don't mind.
1031,1031,I wanted it to be a surprise.
1032,1032,"It's very pretty, Andy."
1033,1033,Thank you.
1034,1034,Are you going to play it?
1035,1035,No.
1036,1036,Not right now.
1037,1037,Tier 3 South. Clear.
1038,1038,Tier 4 North. Clear.
1039,1039,Tier 1 South. Clear.
1040,1040,Fall in!
1041,1041,Lights out!
1042,1042,Andy was as good as his word.
1043,1043,He wrote two letters a week instead of one.
1044,1044,"In 1959, the State Senate finally clued into the fact they couldn't buy him off with just a $200 check."
1045,1045,Appropriations Committee voted an annual payment of $500 just to shut him up.
1046,1046,And you'd be amazed how far Andy could stretch it.
1047,1047,"He made deals with book clubs, charity groups."
1048,1048,He bought remaindered books by the pound.
1049,1049,Treasure Island.
1050,1050,Robert Louis...
1051,1051,..Stevenson.
1052,1052,"Fiction, adventure."
1053,1053,What's next?
1054,1054,I got here Auto Repair and...
1055,1055,..Soap Carving.
1056,1056,Trade skills and hobbies. Goes under Educational. The stack behind you.
1057,1057,The Count Of Monte Crisco.
1058,1058,"That's Cristo, you dumb shit."
1059,1059,By Alexandree...Dumass.
1060,1060,Dumbass?
1061,1061,Dumas. You know what that's about?
1062,1062,Uhuh.
1063,1063,You'll like it. It's about a prison break.
1064,1064,"We ought to file that under Educational, too, oughtn't we?"
1065,1065,The rest of us did our best to pitch in when and where we could.
1066,1066,"By the year Kennedy was shot, Andy had transformed a storage room smelling of rat turds and turpentine into the best prison library in New England, complete with a fine selection of Hank Williams."
1067,1067,Lawd I don't know what I'll doooo All I do is sit and sigh...
1068,1068,That was also the year Warden Norton instituted his famous Inside Out program.
1069,1069,You may remember reading about it.
1070,1070,It made all the papers and got his picture in Look Magazine.
1071,1071,No free ride.
1072,1072,"But rather a genuine, progressive advance in corrections and rehabilitation."
1073,1073,"Our inmates, properly supervised, will be put to work outside these walls, performing all manner of public service."
1074,1074,"These men can learn the value of an honest day's labor, while providing a valuable service to the community and..."
1075,1075,at a bare minimum of expense to Mr. and Mrs. John Q Taxpayer.
1076,1076,"Of course, Norton failed to mention to the press that ""bare minimum of expense"" is a fairly loose term."
1077,1077,There are a hundred different ways to skim off the top.
1078,1078,"Men, materials, you name it."
1079,1079,"And, oh, my Lord, how the money rolled in."
1080,1080,"If this keeps up, you'll put me out of business."
1081,1081, Ned!
1082,1082," This pool of slave labor you've got, you can underbid any contractor in town."
1083,1083,"Ned, we're providing a valuable community service here."
1084,1084,"Well, that's fine for the papers but I've got a family to feed."
1085,1085,Sam...
1086,1086,"Sam, we go back a long way."
1087,1087,I need this new highway contract.
1088,1088,"I don't get it, and I go under."
1089,1089,That's a fact.
1090,1090,"You just have some of this fine pie my missus made especially for you, and you think about that."
1091,1091,"Ned, I wouldn't worry too much about this contract."
1092,1092,It seems to me I already got my boys committed elsewhere.
1093,1093,You be sure and thank Maisie for this fine pie.
1094,1094,"And behind every shady deal, behind every dollar earned, there was Andy, keeping the books."
1095,1095,Two deposits.
1096,1096,Maine National and New England First.
1097,1097,"Night drops as always, sir."
1098,1098,Get my stuff down to the laundry.
1099,1099, Two suits for dryclean and a bag of whatnot.
1100,1100," Yes, sir."
1101,1101,"Tell them if they overstarch my shirts again, they'll hear about it from me."
1102,1102,How do I look?
1103,1103," Very nice, sir."
1104,1104, Big charity todo up Portland way.
1105,1105,The Governor's going to be there.
1106,1106,Want the rest of this?
1107,1107,The woman can't bake worth shit.
1108,1108,"Thank you, sir."
1109,1109," He's got his fingers in a lot of pies, I hear."
1110,1110, What you hear isn't half of it.
1111,1111,He's got scams you haven't even dreamed of.
1112,1112,Kickbacks on his kickbacks.
1113,1113,There's a river of dirty money running through this place.
1114,1114,But the problem with having all that money is you'll have to explain  where it came from.
1115,1115, That's where I come in.
1116,1116,"I channel it, filter it, funnel it."
1117,1117,"Stocks, securities, taxfree municipals."
1118,1118,I send that money out into the real world.
1119,1119, And when it comes back...
1120,1120," Clean as a virgin's honey pot, huh?"
1121,1121,Cleaner.
1122,1122,"By the time Norton retires, I'll have made him a millionaire."
1123,1123,"If they ever catch on, though, he's gonna wind up in here wearing a number himself."
1124,1124,"Now, Red, I thought you had a little more faith in me than that."
1125,1125,"I know you're good, Andy, but all that paper leaves a trail."
1126,1126,"Now, anybody gets curious, the FBI, the IRS, whatever, it's gonna lead to somebody."
1127,1127,Sure it is. But not to me.
1128,1128,And certainly not to the Warden.
1129,1129,All right. Who?
1130,1130,Randall Stevens.
1131,1131,Who?
1132,1132,"The silent silent partner. He's the guilty one, Your Honor. The man with the bank accounts."
1133,1133,That's where the filtering process starts.
1134,1134,"If they trace anything, it's just going to lead to him."
1135,1135,But who is he?
1136,1136,"He's a phantom, an apparition."
1137,1137,Second cousin to Harvey the Rabbit.
1138,1138,I conjured him...
1139,1139,out of thin air.
1140,1140,"He doesn't exist, except on paper."
1141,1141,"Andy, you can't just make a person up."
1142,1142,"Sure you can, if you know how the system works, where the cracks are."
1143,1143,It's amazing what you can accomplish by mail.
1144,1144,"Mr. Stevens has a birth certificate, a driver's license, social security number."
1145,1145,You're shitting me?
1146,1146,"If they ever trace any of those accounts, they're going to wind up chasing a figment of my imagination."
1147,1147,"Well, I'll be damned."
1148,1148,Did I say you were good?
1149,1149,"Shit, you're a Rembrandt!"
1150,1150,"You know, the funny thing is, on the outside, I was an honest man, straight as an arrow."
1151,1151,I had to come to prison to be a crook.
1152,1152,Ever bother you?
1153,1153,"I don't run the scams, Red, I just process the profits."
1154,1154,Fine line maybe but...
1155,1155,I also built that library and used it to help a dozen guys get a high school diploma.
1156,1156,Why do you think the Warden lets me do it?
1157,1157,To keep you happy and doing the laundry.
1158,1158,Money instead of sheets.
1159,1159,"Well, I work cheap. That's the tradeoff."
1160,1160,Willy And The Hand Jive I know a cat named...
1161,1161,Tommy Williams came to Shawshank in 1965 on a twoyear stretch for B&E.
1162,1162,That's breaking and entering to you.
1163,1163,The cops caught him sneaking TV sets out the back door of a JC Penney.
1164,1164,Young punk.
1165,1165,Mr. Rock'n'roll.
1166,1166,Cocky as hell.
1167,1167,"Hey, come on, old boys! Moving like molasses!"
1168,1168,Making me look bad.
1169,1169,We liked him immediately.
1170,1170,"So I'm backing out the door, right?"
1171,1171,And I got the TV like this.
1172,1172,It was a big old thing. I couldn't see shit.
1173,1173,"Suddenly, I hears this voice."
1174,1174,"""Freeze, kid! Hands in the air."" Well, I just stand there, holding onto that TV. So, finally, the voice says, ""Do you hear what I said, boy?"" I say, ""Yes, sir, I sure did."
