,Unnamed: 0,dialog
0,0,If I didn't care More than words can say If I didn't care Would I feel this way?
1,1,If this isn't love Then why do I thrill?
2,2,And what makes my head go round and round While my heart stands still?
3,3,If I didn't care Would it be the same?
4,4,Would my every prayer begin and end With just your name?
5,5,And would I be sure That this is love beyond compare?
6,6,Would all this be true If I didn't care for you?
7,7,"Mr. Dufresne, describe the confrontation you had with your wife the night she was murdered."
8,8,It was very bitter.
9,9,"She said she was glad I knew, that she hated all the sneaking around..."
10,10,And she said she wanted a divorce in Reno.
11,11,What was your response?
12,12,I told her I would not grant one.
13,13,"""I'll see you in hell before I see you in Reno."" Those were the words you used, Mr. Dufresne, according to your neighbors."
14,14,If they say so.
15,15,I really don't remember. I was upset.
16,16,What happened after you argued with your wife?
17,17,She packed a bag.
18,18,She packed a bag to go and stay with...
19,19,Mr. Quentin.
20,20,Glenn Quentin.
21,21,Golf pro at the Snowdon Hills Country Club.
22,22,The man you discovered was your wife's lover.
23,23,Did you follow her?
24,24,I went to a few bars first.
25,25,"Later, I drove to his house to confront them."
26,26,"They weren't home, so I...parked in the turnout, and waited."
27,27,With what intention?
28,28,I'm not sure.
29,29,I was confused.
30,30,Drunk.
31,31,"I think...mostly, I wanted to scare them."
32,32,"When they arrived, you went up to the house and murdered them."
33,33,No. I was sobering up.
34,34,"I got back in the car, and I drove home to sleep it off."
35,35,"Along the way, I stopped, and I threw my gun into the Royal River."
36,36,I feel I've been very clear on this point.
37,37,"Well, where I get hazy is where the cleaning woman shows up the following morning and finds your wife in bed with her lover, riddled with.38 caliber bullets."
38,38,"Now, does that strike you as a fantastic coincidence, Mr. Dufresne, or is it just me?"
39,39,"Yes, it does."
40,40,Yet you still maintain that you threw your gun into the river before the murders took place?
41,41, That's very convenient.
42,42, It's the truth.
43,43,"The police dragged that river for three days, and nary a gun was found."
44,44,"So, there could be no comparison made between your gun and the bullets taken from the bloodstained corpses of the victims."
45,45,And that also...
46,46,is very convenient.
47,47,"Isn't it, Mr. Dufresne?"
48,48,"Since I am innocent of this crime, sir, I find it decidedly inconvenient that the gun was never found."
49,49,If I Didn't Care And would I be sure that this Is love beyond compare...
50,50,"Ladies and gentlemen, you've heard all the evidence."
51,51,We have the accused at the scene of the crime.
52,52,"We have footprints, tire tracks, bullets strewn on the ground which bear his fingerprints, a broken bourbon bottle, likewise with fingerprints."
53,53,"And most of all, we have a beautiful young woman and her lover lying dead in each other's arms."
54,54,They had sinned.
55,55,But was their crime so great as to merit a death sentence?
56,56,"Now, while you think about that..."
57,57,..think about this.
58,58,A revolver holds six bullets.
59,59,Not eight.
60,60,I submit that this was not a hotblooded crime of passion.
61,61,"That could be understood, if not condoned."
62,62,No. This was revenge...
63,63,of a much more brutal and coldblooded nature. Consider this.
64,64,Four bullets per victim.
65,65,"Not six shots fired, but eight."
66,66,"That means that he fired the gun empty, and then stopped to reload..."
67,67,..so that he could shoot each of them again.
68,68,An extra bullet per lover.
69,69,Right in the head.
70,70,"You strike me as a particularly icy and remorseless man, Mr. Dufresne."
71,71,It chills my blood just to look at you.
72,72,"By the power vested in me by the state of Maine, I hereby order you to serve two life sentences, back to back."
73,73,One for each of your victims. So be it.
74,74,Sit.
75,75,We see by your file you've served 20 years of a life sentence.
76,76,"Yes, sir."
77,77,You feel you've been rehabilitated?
78,78,"Oh, yes, sir. Absolutely, sir."
79,79,"I mean, I learned my lesson."
80,80,I can honestly say...I'm a changed man.
81,81,I'm no longer a danger to society.
82,82,That's God's honest truth.
83,83,"Hey, Red. How'd it go?"
84,84,Same old shit. Different day.
85,85,Yeah. I know how you feel.
86,86,I'm up for rejection next week.
87,87,"Yeah, I got rejected last week."
88,88,It happens.
89,89,"Hey, Red. Bump me a deck."
90,90,"Get the fuck out of my face, will you, man?"
91,91,You've had five packs already.
92,92, Four.
93,93, Five.
94,94,There must be a con like me in every prison in America.
95,95,I'm the guy who can get it for you.
96,96,"Cigarettes, a bag of reefer  if that's your thing  a bottle of brandy to celebrate your kid's highschool graduation."
97,97,"Damn near anything, within reason."
98,98,"Yes, sir. I'm a regular Sears and Roebuck."
99,99,"So, when Andy Dufresne came to me in 1949 and asked me to smuggle Rita Hayworth into the prison for him, I told him, ""No problem."" Andy came to Shawshank Prison in early 1947, for murdering his wife and the fella she was banging."
100,100,On the outside he had been vicepresident of a large Portland bank.
101,101,Good work for a man as young as he was.
102,102,"Hey, Red."
103,103,"Do you speak English, butt steak?"
104,104,You follow this officer.
105,105,I haven't seen such a sorrylooking heap of mmmaggot shit in all my life.
106,106,"Hey, fish! Come over here."
107,107,"Come on, fish."
108,108,"Taking bets today, Red?"
109,109,Smokes or coins? Better's choice.
110,110,Smokes. Put me down for two.
111,111,All right. Who's your horse?
112,112,That little sack of shit...eighth from the front.
113,113,He'll be first.
114,114, Bullshit. I'll take that action.
115,115, Me too.
116,116,"You're out some smokes, son. Let me tell you."
117,117,"Heywood, you're so smart, you call it."
118,118,I'll take...ttthe chubby fatass there.
119,119,The fifth one from the front.
120,120,Put me down for a quarter deck.
121,121,Fresh fish!
122,122,Fresh fish today! We're reeling them in!
123,123,"I must admit, I didn't think much of Andy, first time I laid eyes on him."
124,124,Looked like a stiff breeze would blow him over.
125,125,That was my first impression of the man.
126,126,"What do you say, Red?"
127,127,That tall drink of water with the silver spoon up his ass.
128,128,That guy? Never happen.
129,129,Ten cigarettes.
130,130,That's a rich bet.
131,131,All right. Who's gonna prove me wrong?
132,132,Heywood? Jigger?
133,133,Skeet?
134,134,Floyd?
135,135,Four brave souls.
136,136,Return to your cell blocks for evening count.
137,137,All prisoners return to your cell blocks.
138,138,Turn to the right. Eyes front.
139,139,This is Mr. Hadley. He's Captain of the Guards.
140,140,"I'm Mr. Norton, the Warden."
141,141,You are convicted felons.
142,142,That's why they've sent you to me.
143,143,Rule number one: No blasphemy.
144,144,I'll not have the Lord's name taken in vain in my prison.
145,145,The other rules...
146,146,you'll figure out as you go along.
147,147,Any questions?
148,148,When do we eat?
149,149,You eat when we say you eat!
150,150,"You shit when we say you shit, and you piss when we say you piss."
151,151,"You got that, you maggotdick motherfucker?"
152,152,Aarghh!
153,153,On your feet.
154,154,I believe in two things.
155,155,Discipline and the Bible.
156,156,Here you'll receive both.
157,157,Put your trust in the Lord.
158,158,Your ass belongs to me.
159,159,Welcome to Shawshank.
160,160,Unhook 'em.
161,161,Turn around.
162,162,That's enough.
163,163,Move to the end of the cage.
164,164,Turn around.
165,165,Delouse him.
166,166,Turn around.
167,167,"Move out of the cage, go left."
168,168,Pick up your clothes and Bible.
169,169,Next man up.
170,170,"To the right. Right, right, right."
171,171,"Left, left..."
172,172,The first night's the toughest.
173,173,No doubt about it.
174,174,"They march you in, naked as the day you were born, skin burning and halfblind from that delousing shit they throw on you."
175,175,"And when they put you in that cell, and those bars slam home..."
176,176,that's when you know it's for real.
177,177,Old life blown away in the blink of an eye.
178,178,"Nothing left, but all the time in the world to think about it."
179,179,Most new fish come close to madness the first night.
180,180,Somebody always breaks down crying.
181,181,Happens every time.
182,182,The only question is: Who's it gonna be?
183,183,"It's as good a thing to bet on as any, I guess."
184,184,I had my money on Andy Dufresne.
185,185,Lights out!
186,186,I remember my first night.
187,187,Seems like a long time ago.
188,188,Yoohoo!
189,189,"Hey, fish."
190,190,"Fish, fish, fish, fish, fishy."
191,191," Boy, are you scared of the dark?"
192,192," You like it here, new fish?"
193,193,You'll wish your daddy never dicked your mommy.
194,194,"Fishy! Oh, I want me a pork chop. Oh, yes!"
195,195,"You taking this down, new fish?"
196,196,There's gonna be a quiz later!
197,197," Poke your ass out, give me a first look!"
198,198, Shh! Keep it down.
199,199,The boys always go fishing with firsttimers.
200,200,They don't quit till they reel someone in.
201,201,"Hey, Fat Ass."
202,202,Fat Ass.
203,203,"Talk to me, boy."
204,204,I know you're there. I can hear you breathing.
205,205,Don't you listen to these nitwits.
206,206,You hear me?
207,207,This place ain't so bad.
208,208,I tell you what.
209,209,I'll introduce you around.
210,210,Make you feel right at home.
211,211,I know a couple of big old bull queers that would just love to make your acquaintance.
212,212,"Especially that big, white, m mushy butt of yours."
213,213,God!
214,214,I don't belong here!
215,215,We have a winner!
216,216,I wanna go home!
217,217,And it's Fat Ass by a nose!
218,218,"Hey, it's the fat guy! It's the fat guy!"
219,219,Fresh fish! Fresh fish! Fresh fish!
220,220,I don't belong here!
221,221,Fresh fish!
222,222,I wanna go home. I want my mommy.
223,223,I had your mother. She wasn't that great.
224,224,Fresh fish!
225,225,What the Christ is this happy horse shit?
226,226,He took the Lord's name in vain.
227,227,I'm telling the Warden.
228,228,With my baton up your ass!
229,229,Let me out of here!
230,230,"What is your malfunction, you fat barrel of monkey spunk?"
231,231,Please...
232,232,I ain't supposed to be here.
233,233,Not me!
234,234,"I ain't gonna count to three, or even one."
235,235,"Shut the fuck up, or I'll sing you a lullaby!"
236,236,"Shut up, man. Shut up."
237,237,There's been a mistake!
238,238,You don't understand.
239,239,I'm not supposed to be here!
240,240,Open that cell.
241,241,Me neither.
242,242,You people run this place like a fucking prison!
243,243,Son of a bitch.
244,244,Take it easy.
245,245,"If I hear so much as a mouse fart in here the rest of the night, I swear by God and sonny Jesus, you will all visit the infirmary."
246,246,Every last motherfucker in here.
247,247,Call the trustees.
248,248,Take that tub of shit down to the infirmary.
249,249,"His first night in the joint, Andy Dufresne cost me two packs of cigarettes."
250,250,He never made a sound.
251,251,Tier 3 North. Clear.
252,252,Tier 2 South. Clear.
253,253,Tier 3 South. Clear.
254,254,Tier 1 North...
255,255, Tier 1 South. Clear.
256,256, Tier 4 South. Clear.
257,257,Prepare to roll out.
258,258,Roll out!
259,259,Are... Are you going to eat that?
260,260,I hadn't... I hadn't planned on it.
261,261,Do you mind?
262,262,Ah...that's nice and ripe.
263,263,Jake says thank you.
264,264,Fell out of his nest over by the plate shop.
265,265,I'm going to look after him until he's big enough to fly.
266,266,"Oh, no, no. Here he comes."
267,267,"Morning, fellas. Fine morning, ain't it?"
268,268,"You know why it's a fine morning, don't you?"
269,269,Come on. Set 'em down.
270,270,"I want 'em all lined up here, just like a pretty little chorus line."
271,271,"Yeah, look at that!"
272,272," Look at that. Oh, Lord!"
273,273, I can't stand this guy.
274,274,"Yes. Richmond, Virginia."
275,275, Smell my ass!
276,276, After he smells mine.
277,277,"Gee, Red, it was a terrible shame about your horse coming in last, an' all."
278,278,"But I sure do love that winning horse of mine, though."
279,279,"I owe that boy a great big, sloppy kiss when I see him."
280,280,"Why don't you give him some of your cigarettes, instead?"
281,281,Lucky fuck.
282,282,"Hey, Tyrell."
283,283,You pull infirmary duty this week?
284,284,How's that horse of mine doing?
285,285,Dead.
286,286,Hadley busted his head up pretty good.
287,287,The doc had already gone home for the night.
288,288,Poor bastard lay there till this morning.
289,289,"By then, hell, there weren't nothing we could do."
290,290,What was his name?
291,291,What did you say?
292,292,I was just wondering if anyone knew his name.
293,293,"What the fuck do you care, new fish?"
294,294,It doesn't fuckin' matter what his name was.
295,295,He's dead.
296,296,Hey...
297,297,Anybody come at you yet?
298,298,Anybody get to you yet?
299,299,"Hey, we all need friends in here."
300,300,I could be a friend to you.
301,301,Hey...
302,302,Hard to get.
303,303,I like that.
304,304,Andy kept pretty much to himself at first.
305,305,"I guess he had a lot on his mind, trying to adapt to life on the inside."
306,306,It wasn't until a month went by that he opened his mouth to say more than two words to somebody.
307,307,As it turned out...
308,308,that somebody was me.
309,309,Officers Russell and Burwell report to the duty officer.
310,310,I'm Andy Dufresne.
311,311,The wifekilling banker.
312,312,Why did you do it?
313,313,"I didn't, since you ask."
314,314,You're gonna fit right in!
315,315,Everybody in here's innocent.
316,316,Didn't you know that?
317,317," Heywood, what are you in here for?"
318,318, Didn't do it. Lawyer fucked me.
319,319,Rumor has it you're a real cold fish.
320,320,You think your shit smells sweeter than most.
321,321,Is that right?
322,322, What do you think?
323,323," To tell you the truth, I haven't made up my mind."
324,324,I understand you're a man that knows how to get things.
325,325,"I'm known to locate certain things, from time to time."
326,326, I wonder if you might get me a rock hammer.
327,327, A what?
328,328,A rock hammer.
329,329," What is it, and why?"
330,330, What do you care?
331,331,"Well, if it was a toothbrush, I'd just quote a price, but then a toothbrush is a nonlethal object."
332,332,Fair enough.
333,333,A rock hammer is about six or seven inches long.
334,334,Looks like a miniature pickaxe.
335,335,Pickaxe?
336,336, For rocks.
337,337, Rocks.
338,338,Quartz?
339,339,Quartz.
340,340,And some mica.
341,341,Shale.
342,342,Limestone.
343,343,So?
344,344,"So, I'm a rock hound."
345,345,"At least, I was in my old life."
346,346,I'd like to be again on a limited basis.
347,347,Or maybe you want to hammer somebody's skull.
348,348,"No, sir."
349,349,I have no enemies here.
350,350,No? Wait a while.
351,351,Word gets around.
352,352,The Sisters have taken quite a liking to you.
353,353,Especially Bogs.
354,354,I don't suppose it would help any if I explained to them I'm not homosexual.
355,355,Neither are they.
356,356,You have to be human first. They don't qualify.
357,357,Bull queers take by force.
358,358,It's all they want or understand.
359,359,"If I were you, I'd grow eyes in the back of my head."
360,360,Thanks for the advice.
361,361,"Well, that's free."
362,362,You understand my concern.
363,363,"Well, if there's any trouble, I won't use the hammer."
364,364,Then I guess you want to escape.
365,365,"Tunnel under the wall, maybe."
366,366,Did I miss something? What's funny?
367,367,You'll understand when you see the rock hammer.
368,368,What's an item like this usually go for?
369,369,Seven dollars in any rock and gem shop.
370,370,My normal markup's 20 per cent.
371,371,But this is a specialty item.
372,372,"The risk goes up, the price goes up."
373,373,Let's make it an even ten bucks.
374,374,Ten it is.
375,375,"Waste of money, if you ask me."
376,376,Why's that?
377,377,Folks around this joint love surprise inspections.
378,378,"If they find it, you're gonna lose it."
379,379,"If they do catch you with it, you don't know me."
380,380,"Mention my name, we never do business again."
381,381,Not for shoelaces or a stick of gum.
382,382,"Now, you got that?"
383,383,I understand.
384,384,Thank you...
385,385,Mr. er...?
386,386,Red. The name's Red.
387,387,Red?
388,388,Why do they call you that?
389,389,Maybe it's because I'm Irish.
390,390,I could see why some of the boys took him for snobby.
391,391,He had a quiet way about him.
392,392,A walk and a talk that just wasn't normal around here.
393,393,He strolled...
394,394,"like a man in a park, without a care or worry in the world."
395,395,Like he had on an invisible coat that would shield him from this place.
396,396,Yeah. I think it would be fair to say...
397,397,I liked Andy from the start.
398,398,Let's go!
399,399,Some of us have got a schedule to keep.
400,400,Move it! Come on. Move it!
401,401,"Bob, how are you doing?"
402,402,How's the wife treating you?
403,403,Easy.
404,404,Keep it moving.
405,405,Red...
406,406,Andy was right. I finally got the joke.
407,407,It would take a man about 600 years to tunnel under the wall with one of these.
408,408,Book?
409,409,Not today.
410,410, Book?
411,411, No.
412,412,"Hey, Brooksy."
413,413,Delivery for Dufresne.
414,414,Book?
415,415,Dufresne...
416,416,Here's your book.
417,417,Thanks.
418,418,Dufresne! We're running low on Hexlite.
419,419,Get on back and fetch us up some.
420,420,"If you get this in your eyes, it blinds you."
421,421,Honey...hush.
422,422,That's it. You fight.
423,423,It's better that way.
424,424,"I wish I could tell you that Andy fought the good fight, and the Sisters let him be."
425,425,I wish I could tell you that.
426,426,But prison is no fairytale world.
427,427,He never said who did it.
428,428,But we all knew.
429,429,Things went on like that for a while.
430,430,Prison life consists of routine...
431,431,and then more routine.
432,432,"Every so often, Andy would show up with fresh bruises."
433,433,The Sisters kept at him.
434,434,Sometimes he was able to fight 'em off.
435,435,Sometimes not.
436,436,And that's how it went for Andy.
437,437,That was his routine.
438,438,I do believe those first two years were the worst for him.
439,439,"And I also believe, if things had gone on that way, this place would have got the best of him."
440,440,"But then, in the spring of 1949, the powers that be decided that..."
441,441,The roof of the licenseplate factory needs resurfacing.
442,442,I need a dozen volunteers for a week's work.
443,443,"As you know, special detail carries with it special privileges."
444,444,It was outdoor detail...
445,445,..and May is one damn fine month to be working outdoors.
446,446,Stay in line there.
447,447,More than a hundred men volunteered for the job.
448,448,Wallace E Unger.
449,449,Ellis Redding.
450,450,Wouldn't you know it?
451,451,Me and some fellows I know were among the names.
452,452,Andrew Dufresne.
453,453,It only cost us a pack of smokes per man.
454,454,"I made my usual 20 per cent, of course."
455,455,"So, this bigshot lawyer calls me longdistance from Texas."
456,456,"I say, ""Yeah?"" He says, ""Sorry to inform you, but your brother just died."" Oh, damn, Byron. I'm sorry to hear that."
457,457,I'm not. He was an asshole.
458,458,Ran off years ago.
459,459,"Figured him for dead, anyway."
460,460,"So, anyway, this lawyer fella says to me, ""Your brother died a rich man."" Oil wells and shit. Close to a million bucks."
461,461,A million bucks?
462,462,Fucking incredible how lucky some assholes get.
463,463,JeezLouise! Are you gonna see any of that?
464,464, Dollars?
465,465, Yeah.
466,466,Holy shit! That's great.
467,467,That's like winning the sweepstakes.
468,468,Isn't it?
469,469,Dumb shit. What do you think the government's gonna do to me?
470,470,"Take a big, wet bite out of my ass, is what."
471,471,"Poor Byron! Terrible fucking luck, huh?"
472,472,Crying shame.
473,473,Some people really got it awful!
474,474,"Andy, are you nuts?"
475,475,"Keep your eyes on your mop, man. Andy!"
476,476,"Well, you'll pay some tax, but you'll still end up..."
477,477,"Oh, yeah, yeah."
478,478,Maybe enough to buy a new car. Then what?
479,479,I've got to pay tax on the car.
480,480,"Repair, maintenance, goddamn kids pestering me to take them for a ride..."
481,481,"And at the end of the year, you figure the tax wrong, you pay them out of your own pocket."
482,482,I tell you...Uncle Sam!
483,483,He puts his hand in your shirt and squeezes your tit till it's purple.
484,484, Andy! Andy!
485,485, What's he doing?
486,486, Getting himself killed.
487,487, Keep tarring.
488,488,Some brother! Shit.
489,489,Hey!
490,490,Mr. Hadley...
491,491,do you trust your wife?
492,492,"Oh, that's funny."
493,493,You're gonna look funnier sucking my dick with no teeth.
494,494,"I mean, do you think she'd go behind your back, try to hamstring you?"
495,495,"That's it. Step aside, Mert."
496,496,This fucker's having an accident.
497,497,He's gonna push him off.
498,498,"Cos if you do trust her, there's no reason you can't keep that 35,000."
499,499, What did you say?
500,500," 35,000."
501,501," 35,000?"
502,502, All of it.
503,503, All of it?
504,504, Every penny.
505,505,You'd better start making sense.
506,506,"If you want to keep the money, give it to your wife."
507,507,"The IRS allows a onetimeonly gift to your spouse for up to $60,000."
508,508,Bullshit! Taxfree?
509,509,Taxfree. The IRS can't touch one cent.
510,510,You're the smart banker what killed his wife.
511,511,Why should I believe a smart banker like you?
512,512,So I can end up in here with you?
513,513,It's legal. Ask the IRS.
514,514,They'll say the same thing.
515,515,But I feel stupid telling you this.
516,516,I'm sure you would have investigated the matter.
517,517,"Yeah, I don't need no banker to tell me where the bears shit in the buckwheat."
518,518,"Of course not, but you do need someone to set up the taxfree gift."
519,519,It'll cost you. A lawyer.
520,520,A bunch of ballwashing bastards.
521,521,I suppose I could set it up for you.
522,522,That would save you some money.
523,523,"If you get the forms, I'll prepare them for you."
524,524,Nearly free of charge.
525,525,I'd only ask three beers apiece for each of my coworkers.
526,526,"Coworkers! Get him! That's rich, ain't it?"
527,527,I think a man working outdoors feels more like a man if he can have a bottle of suds.
528,528,That's only my opinion...sir.
529,529,What are you jimmies staring at?
530,530,Back to work!
531,531,Let's go. Work.
532,532,And that's how it came to pass...
533,533,"that on the secondtolast day of the job, the convict crew that tarred the platefactory roof in the spring of '49..."
534,534,"wound up sitting in a row at ten o'clock in the morning, drinking icycold, Bohemiastyle beer..."
535,535,courtesy of the hardest screw that ever walked a turn at Shawshank State Prison.
536,536,"Drink up while it's cold, ladies."
537,537,The colossal prick even managed to sound magnanimous.
538,538,"We sat and drank with the sun on our shoulders, and felt like free men."
539,539,"Hell, we could have been tarring the roof of one of our own houses."
540,540,We were the lords of all creation.
541,541,"As for Andy, he spent that break hunkered in the shade..."
542,542,"a strange little smile on his face, watching us drink his beer."
543,543,Hey...
544,544,"Want a cold one, Andy?"
545,545,"No, thanks."
546,546,I gave up drinking.
547,547,You could argue he'd done it to curry favor with the guards.
548,548,Or maybe make a few friends among us cons.
549,549,"Me, I think he did it just to feel normal again."
550,550,If only for a short while.
551,551,King me.
552,552,"Chess. Now, there's a game of kings."
553,553, What?
554,554," Civilized, strategic."
555,555,And a total fucking mystery.
556,556,I hate it.
557,557,Maybe you'll let me teach you someday.
558,558,Yeah. Sure.
559,559,I thought of getting a board together.
560,560,"Well, I'm the right man."
561,561,I'm the guy that can get things.
562,562,We might do business on a board.
563,563,But I want to carve the pieces myself.
564,564,"One side in alabaster, the opposing side in soapstone. What do you think?"
565,565,I think it'll take years.
566,566,"Well, years I got."
567,567,What I don't have are the rocks.
568,568,Pickings are pretty slim in the yard.
569,569,"Pebbles, mostly."
570,570,"Andy, we're getting to be kinda friends, aren't we?"
571,571,"Yeah, I guess."
572,572,Can I ask you something?
573,573,Why did you do it?
574,574,"I'm innocent, Red. Just like everybody else here."
575,575,What are you in for?
576,576,Murder.
577,577,Same as you.
578,578,Innocent?
579,579,Only guilty man in Shawshank.
580,580,Where's the canary?
581,581,How did you know?
582,582,How did I know what?
583,583,"So, you don't know? Come."
584,584,"This is where the canary is, Johnny."
585,585,"Quite a surprise to hear a woman singing in my house, eh, Johnny?"
586,586,That's quite a...
587,587,surprise.
588,588,Red...
589,589,"Wait, wait, wait, wait."
590,590,Here she comes.
591,591,This is the part I like  when she does that shit with her hair.
592,592,"Yeah, I know. I've seen it three times this month."
593,593,"Gilda, are you decent?"
594,594,Me?
595,595,"Hah! God, I love it!"
596,596,I understand you're a man that knows how to get things.
597,597,"Yeah, I'm known to locate certain things from time to time. What do you want?"
598,598, Rita Hayworth.
599,599, What?
600,600,Can you get her?
601,601,"So, this is Johnny Farrell."
602,602,"I've heard a lot about you, Johnny."
603,603,Take a few weeks.
