,Unnamed: 0,dialog
1139,1139,"I had to look very closely to spot it during The Transported man, but this makes you unique."
1140,1140,It shows you aren't using a double.
1141,1141,You mustn't hide it.
1142,1142,You must display it proudly.
1143,1143,I'm sure it takes great skill to perform illusions with one good hand.
1144,1144,"Yeah, it does."
1145,1145,So let people know.
1146,1146,You can be so much more than he is and I can show you how.
1147,1147,BORDEN I think she's telling the truth.
1148,1148,I think we cannot trust her.
1149,1149,But I love her. I need her.
1150,1150,"To open myself to such a relationship, to the dangers of such an affair, I need assurances of fidelity, of love."
1151,1151,But how to be sure?
1152,1152,I know a way. It's the only way to know her mind.
1153,1153,How could he send you away?
1154,1154,BORDEN She must help me rid ourselves of Angier.
1155,1155,"Today, my mistress proves her truthfulness."
1156,1156,"Not to me, you understand."
1157,1157,I've been convinced since she led me to Root.
1158,1158,"Today, Olivia proves her love for me to you, Angier."
1159,1159,"Yes, Angier, she gave you this notebook at my request."
1160,1160,"And yes, ""Tesla"" is merely the key to my dairy, not to my trick."
1161,1161,You really think I'd part with my secret so easily after so much?
1162,1162,"Goodbye, Angier."
1163,1163,May you find solace for your forward ambition back in your American home.
1164,1164,Tesla!
1165,1165,Tesla! Alley!
1166,1166,Alley!
1167,1167,Tesla never made a machine like the one I asked for.
1168,1168, I never said he had.
1169,1169, You let me believe that he had.
1170,1170,You stole my money because your funding was cut off.
1171,1171,"You've been shooting sparks in my top hat, laughing at me all along, while using my money to stave off ruin."
1172,1172, I have seen Edison's men.
1173,1173, Where?
1174,1174,"In the hotel, I have a mind to bring them up here."
1175,1175,"That would be unwise, Mr. Angier."
1176,1176,"It is true that you are our last remaining financier, but we have not stolen your money."
1177,1177,This is my cat.
1178,1178,"When I told you I could make you a machine, I spoke a truth."
1179,1179,Why isn't it working?
1180,1180,"Because exact science, Mr. Angier, is not an exact science."
1181,1181,The machine simply does not operate as expected.
1182,1182, It requires further examination.
1183,1183, So where did my top hat go?
1184,1184,Nowhere.
1185,1185,We tried the damn thing a dozen times.
1186,1186,The hat went nowhere.
1187,1187,We need to try different material.
1188,1188,It may provoke a different result.
1189,1189,MEOWING Great.
1190,1190,"You are responsible for whatever happens to this animal, doctor."
1191,1191,"MEOWS ELECTRICAL ZAPPING SIGHS I hope whatever you were really doing with my money was more worthwhile, Mr. Tesla."
1192,1192,MEOWING CATS SCREECHING SCREECHING CONTINUES HISSING Alley!
1193,1193,So the machine was working?
1194,1194,"I never checked the calibration, 'cause the hat never moved."
1195,1195,These things never quite work as you expect them to.
1196,1196,That's one of the principal beauties of science.
1197,1197,I'll need a couple of weeks to iron out the problems with the machine.
1198,1198,We'll send word when it's ready.
1199,1199,Don't forget your hat.
1200,1200," Well, which one is mine?"
1201,1201, They are all your hats.
1202,1202,You look so pretty in this new dress of yours.
1203,1203, Are we going to the zoo?
1204,1204," No, Daddy has some errands to run."
1205,1205, But you promised.
1206,1206," I promised, did I?"
1207,1207,"Then go to the zoo, we shall."
1208,1208,"Daddy will go run his errands, and I'll be back before you know it."
1209,1209,So you go get ready. We'll go see those chimpanzees. HOOTS Sarah... what are you doing?
1210,1210,Each of us have our vices.
1211,1211,"Sarah, whatever you may think..."
1212,1212,...your only competition for my affections is our little girl.
1213,1213,I love you. I will always love you and you alone.
1214,1214, You mean it today.
1215,1215, Absolutely.
1216,1216,Which makes it so much harder when you don't.
1217,1217,More shopping. She does love the smell of money.
1218,1218,"The little lady wants to go to the zoo, so I thought you could take her, yeah?"
1219,1219,"I mean, I can do it tomorrow, if not."
1220,1220,"And, uh... Sarah, she knows."
1221,1221,"Uh, at least she knows that something is not right, so if you can just do whatever you can to help me."
1222,1222,"Talk to her, just convince her that I do love her."
1223,1223,"What is it, Freddie?"
1224,1224,"Listen, don't call me that, please."
1225,1225,It's nothing. It's just that sometimes it seems wrong.
1226,1226,"I told you, when you're with me, you're with me."
1227,1227,Leave your family at home where they belong.
1228,1228,"I'm trying. I'm trying, Olivia."
1229,1229, I'll get dressed.
1230,1230, Yeah.
1231,1231,I saw Fallon hanging around again.
1232,1232,There's something about that man I don't trust.
1233,1233,You trust me? Then trust Fallon.
1234,1234,He protects the things that I care about.
1235,1235,"ENGINE SPUTTERS We're sorry to see you go, Mr. Angier."
1236,1236,"We were sorry to see Mr. Tesla leave, as well."
1237,1237,He's very good to Colorado Springs.
1238,1238,"Mr. Angier, I didn't think it was necessary to tell Edison's men about the box."
1239,1239,What box?
1240,1240,TESLA I apologize for leaving without saying goodbye.
1241,1241,But I seem to have outstayed my welcome in Colorado.
1242,1242,The truly extraordinary is not permitted in science and industry.
1243,1243,"Perhaps you'll find more luck in your field, where people are happy to be mystified."
1244,1244,You will find what you are looking for in this box.
1245,1245,Alley has written you a thorough set of instructions.
1246,1246,I add only one suggestion on using the machine.
1247,1247,Destroy it.
1248,1248,Drop it to the bottom of the deepest ocean.
1249,1249,Such a thing will bring you only misery.
1250,1250,ANGIER Tesla's warning is as unheeded as he knew it would be.
1251,1251,Today I tested the machine.
1252,1252,Taking precautions in case Tesla hadn't ironed out the kinks in its operation.
1253,1253,"But if it went wrong, I would not want to live like that for long."
1254,1254,"ELECTRICAL ZAPPING ANGIER But here at the turn, I must leave you, Borden."
1255,1255,"Yes, you, Borden, sitting there in your cell, reading my diary, awaiting your death, for my murder."
1256,1256,"Angier's journal, that gesture of good faith, that's a fake."
1257,1257,"I assure you, it's not."
1258,1258,The provenance of the journal is clear and under no doubt.
1259,1259,"And it's written in Angier's own hand, for which we have numerous examples."
1260,1260,It don't matter.
1261,1261,So my tricks.
1262,1262, All of them.
1263,1263, Including The Transported man?
1264,1264, Lord Caldlow will be very pleased.
1265,1265," No, he won't."
1266,1266,They're not complete.
1267,1267,It's just the pledge and the turn for each.
1268,1268,"Without the prestige for these tricks, these are worthless."
1269,1269,Yeah.
1270,1270,You get the rest of it...
1271,1271,when you bring my daughter here.
1272,1272,I want to say goodbye.
1273,1273,SARAH We have to go through it now.
1274,1274,We have to go through it now.
1275,1275,"Now, listen to me, deny it all you want."
1276,1276,Olivia means nothing.
1277,1277, Olivia?
1278,1278, I need an assistant.
1279,1279," I'll go to her, I'll tell her."
1280,1280, You'll tell her what?
1281,1281,"I know what you really are, Alfred."
1282,1282, I know.
1283,1283," Sarah, Sarah, Sarah."
1284,1284, I can't keep it in.
1285,1285, You can't talk like this.
1286,1286, No. No.
1287,1287," Sarah, shut up! Sarah, shut up!"
1288,1288,I don't want to hear it anymore.
1289,1289,You can't talk like this.
1290,1290,"SARAH You can't hide it anymore, because I know, Alfred, I know."
1291,1291,"I know what you really are, Alfred."
1292,1292,I can't live like this.
1293,1293,"Oh, well, you think I can live like this?"
1294,1294,You think I bloody enjoy living like this?
1295,1295,"We have this beautiful house, lovely little girl, we're married."
1296,1296,What is so wrong with your life?
1297,1297,"Alfred, I can't live like this!"
1298,1298,"Well, what do you want from me?"
1299,1299,I... I want...
1300,1300,I want you to be... honest with me.
1301,1301,No tricks.
1302,1302,No lies.
1303,1303,And no secrets.
1304,1304,Do you... do you love me?
1305,1305,Not today.
1306,1306,No.
1307,1307,BIRDS CHIRPING  CRASHING  BIRDS SQUAWKING SEAGULLS CALLING BIRDS FLUTTERING Who's there?
1308,1308,I'm looking for an old friend.
1309,1309,"I heard about a booking, nice little theater,  good upandcoming magician."
1310,1310, You're back.
1311,1311,"It's good to see you, John."
1312,1312,Good rehearsal space.
1313,1313,"Blind stagehands, I like it. LAUGHS You always had a good eye for publicity."
1314,1314,"I need your help, John."
1315,1315,It's my last show. A limited engagement.
1316,1316,Your last show?
1317,1317,A wise man once told me obsession was a young man's game.
1318,1318,I'm almost done. There's one thing left.
1319,1319,The Real Transported man.
1320,1320,You want to design a show around it?
1321,1321,I don't want you backstage I need you in front managing.
1322,1322,Call in any favors or connections you have left to get us the right booking.
1323,1323,What sort of booking you after?
1324,1324,The sort that Borden can't ignore.
1325,1325,"Oh, what an honor it is to see you again, sir."
1326,1326,You told me you only wanted to show me one trick that'd pique my interest.
1327,1327, It's a very clever trick.
1328,1328," Pleased to meet you, Mr. Ackerman."
1329,1329,"Likewise, I'm sure."
1330,1330,"Let's get on, shall we?"
1331,1331,"Turn it on, gentlemen."
1332,1332,Very pretty.
1333,1333,"That's it, Cutter? He simply disappears?"
1334,1334,That's not a trick. He has to come back.
1335,1335, There has to be a...
1336,1336, ANGIER A prestige?
1337,1337,Exactly.
1338,1338,Pardon me.
1339,1339,It's very rare to see...
1340,1340,...real magic.
1341,1341,It's been many years since...
1342,1342,Are you interested in helping us?
1343,1343,Yes... but you'll have to dress it up a little.
1344,1344,Disguise it.
1345,1345,Give them enough reason to doubt it.
1346,1346,"You haven't spoken about her, Freddie, not once."
1347,1347,"Why would I talk about her to you, hm?"
1348,1348,Because she was a part of your life and now she's gone.
1349,1349,"You know, the day before she killed herself she said she wanted to meet me."
1350,1350,That she had something to tell me about you.
1351,1351,"I was such a coward, I couldn't bring myself to face her."
1352,1352,But...
1353,1353,...what would she have said?
1354,1354,You want to know the truth about me?
1355,1355,The truth is that...
1356,1356,...I never loved Sarah.
1357,1357,I never loved her.
1358,1358,"You married her, you had a child with her."
1359,1359,"Yes. Part of me. Part of me did, but..."
1360,1360,...the other part didn't.
1361,1361,"The part that found you, the part that's sitting here right now."
1362,1362,"I love you. No, Olivia, I love you."
1363,1363,That's the truth.
1364,1364,That is the truth that matters.
1365,1365,"You could be in some other restaurant with some other woman right now, talking about me that way."
1366,1366, No.
1367,1367, Yes.
1368,1368,It's inhuman to be so cold.
1369,1369,He's back.
1370,1370,"After two years, he's got a new trick."
1371,1371,They're saying it's the best London's ever seen.
1372,1372,"You should see the look on your face, Professor."
1373,1373,You should go to him.
1374,1374,You two deserve each other.
1375,1375,But I'm afraid I'm booked. The Moscow Ballet plays through next year.
1376,1376,"Then get rid of them. There will be Five performances a week, no matinees."
1377,1377,That's what you'll charge for each ticket. Good day.
1378,1378,"APPLAUSE FOOTSTEPS ON STAGE Ladies and gentlemen, my first trick of the evening involves considerable risk."
1379,1379,Anyone in the audience who would be irrevocably damaged by seeing a man drown should leave now.
1380,1380,"When I tell you the lady who taught me this illusion actually died performing it, you'll understand the seriousness of the dangers involved."
1381,1381, Let's begin.
1382,1382," APPLAUSE In my travels, I have seen the future."
1383,1383,"And it is a strange future, indeed."
1384,1384,"The world, ladies and gentlemen, is on the brink of new and terrifying possibilities."
1385,1385,TAPS CANE APPLAUSE What you're about to witness is not magic.
1386,1386,It's purely science.
1387,1387,I'd like to invite you to come up on stage now so that you can examine the machine for yourselves.
1388,1388,"ELECTRICAL ZAPPING CROWD MURMURING, GASPING APPLAUSE Man's reach exceeds his imagination."
1389,1389,"APPLAUSE, CHEERING Bravo!"
1390,1390,One hundred performances. Why?
1391,1391,Does his method dictate that?
1392,1392,Is it a publicity move? What is it?
1393,1393,"He's a notalent magician, and they call him the bloody best in England. Why?"
1394,1394,Fifty yards in a second! In a second!
1395,1395,And all that we know is he uses a trap door.
1396,1396,Brilliant! What is going on under that stage? Huh?!
1397,1397,Why can't you outthink him?
1398,1398,"They do this every night, after each performance. Yeah?"
1399,1399,SIGHS BORDEN Huh.
1400,1400, CRUMPLING PAPER  We're done.
1401,1401,All right?
1402,1402,Let him have his trick.
1403,1403,I don't need his secret.
1404,1404,So...
1405,1405,"...don't go back there, you leave him alone."
1406,1406,Both of us... just leave him alone.
1407,1407,We're done.
1408,1408,"ANGIER I told you, John."
1409,1409,I don't want you backstage on this one.
1410,1410,ANGIER I would like to invite you onstage now so that you can examine the machine for yourselves.
1411,1411," Hey, where do you think...?"
1412,1412," I'm part of the bloody act, you fool."
1413,1413,ELECTRIC ZAPPING Who was that?
1414,1414,RUMBLING ZAPPING CONTINUES SILENCE  MUFFLED SCREAMING  Hey! Where's the bloody key?!
1415,1415,Where's the bloody key?!
1416,1416,BORDEN YELLING Where's the bloody key?!
1417,1417,He's bloody drowning!
1418,1418,Hold on!
1419,1419,SCREAMS What have you done?
1420,1420,"MAN Alfred BORDEN, you have been found guilty of the murder of Robert Angier."
1421,1421,You will be hanged by the neck until dead.
1422,1422,May the Lord have mercy on your soul.
1423,1423,OWENS Mr. Cutter?
1424,1424,Owens.
1425,1425,"Oh, thank you for coming, Mr. Owens."
1426,1426,It has fallen to me to dispose of Mr. Angier's equipment.
1427,1427,But I notice from this manifest that Lord Caldlow has purchased the bulk of the items.
1428,1428,"Mr. Cutter, if you need to know where to deliver these items..."
1429,1429,"No, it's just there is one particular item, this item, in fact,  I would like to..."
1430,1430, You would like to...
1431,1431,...buy.
1432,1432, Buy yourself?
1433,1433," Yeah, I suppose so."
1434,1434, This is the machine?
1435,1435, Yes.
1436,1436,"Well, I'm afraid Lord Caldlow was adamant about purchasing this particular item."
1437,1437,Do you think I could talk to Lord Caldlow in person?
1438,1438,"Out of the question, I'm afraid."
1439,1439,"Of course, I suppose if, in the course of your delivery arrangements, your paths were to cross, I can't stop you speaking your mind."
1440,1440,Thank you.
1441,1441,"DOOR OPENS  MAN Still here, Borden?"
1442,1442, For now.
1443,1443,You got a visitor. Lord Caldlow.
1444,1444,With a little girl.
1445,1445,Jess?
1446,1446,"Hello, my love."
1447,1447,How are you? I've missed you so much.
1448,1448,Fallon's missed you too. We both have.
1449,1449,"Daddy, can I come in there?"
1450,1450,"Not right now. Not right now, darling."
1451,1451,"No, but everything is gonna be all right."
1452,1452,You must be Lord Caldlow?
1453,1453,"Caldlow. Yes, I am. I always have been."
1454,1454,They flatter you with all those chains.
1455,1455,Don't they know you can't escape without your rubber ball?
1456,1456,I pulled you out... out of that tank.
1457,1457,All I wanted to do was prove that I was a better magician.
1458,1458,But you couldn't leave me alone.
1459,1459,I don't know what you've done.
1460,1460,"But you're not afraid to get your hands dirty anymore, are you?"
1461,1461,"No, not anymore. And I win."
1462,1462,"No one cares about the man in the box, the man who disappears."
1463,1463,You win?
1464,1464,This ain't a bloody competition anymore. This is my little girl's life.
1465,1465,And don't you dare put her in the middle of this.
1466,1466,"Oh, I know how hard it is to have someone so special taken away from you, don't I, Borden?"
1467,1467,"And you can't take it with you, now, can you?"
1468,1468,"Oh, she'll be looked after."
1469,1469,"Goodbye, Professor. Come on, darling."
1470,1470,"No, no, no, no, stop, my darling."
1471,1471,"Look, here."
1472,1472,That's what you're after.
1473,1473,That's what this is about.
1474,1474,Take it.
1475,1475, Your secret?
1476,1476, Yeah.
1477,1477,You always were the better magician.
1478,1478,We both know that.
1479,1479,"Whatever your secret was, you have to agree, mine is better."
1480,1480,"Don't do this. Don't do this, Angier. Jess, Jess!"
1481,1481,"Jess, I'm gonna take you home soon. I promise."
1482,1482, For God's sake.
1483,1483, I promise. Look!
1484,1484,"I promise. I love you, Jess."
1485,1485,I love you.
1486,1486, Come on.
1487,1487, I love you.
1488,1488,"I love you, Jess."
1489,1489,Angier! Angier!
1490,1490,"What, do you think this place can hold me?"
1491,1491,ANGIER! They're gonna bloody hang me!
1492,1492,And you can put a stop to this now!
1493,1493,Listen! Listen! That man...
1494,1494,"Listen, that man is the one I'm in for killing!"
1495,1495,"Listen! If he's alive, I'm not guilty!"
1496,1496, I'm not guilty!
1497,1497, I don't care!
1498,1498, Get hold of him.
1499,1499, Angier!
1500,1500,Run along now.
1501,1501,"Sir, there's a gentleman waiting."
1502,1502, Dear God.
1503,1503," Hello, Cutter."
1504,1504,You're still alive.
1505,1505,How is it you're still alive?
1506,1506,"I saw you on a slab, for God's sake."
1507,1507, Child.
1508,1508," Good night, sir."
1509,1509,"ANGIER Good night, Jess."
1510,1510,I've seen her before.
1511,1511,I saw her in court with...
1512,1512,...Fallon.
1513,1513, What have you done?
1514,1514, She needs looking after.
1515,1515,She needs her father.
1516,1516,"You're letting him hang, and I helped you."
1517,1517,I came here to beg Lord Caldlow to let me destroy that machine.
1518,1518,I am not going to beg you for anything.
1519,1519,You don't have to. I'm gonna make sure it is never used again.
1520,1520,"Then, Lord Caldlow..."
1521,1521,...where do you want me to deliver it?
1522,1522,My theater. It belongs with the prestige materials.
1523,1523,"John, I tried not to involve you."
1524,1524,So...
1525,1525,We go alone now.
1526,1526,Both of us.
1527,1527,"I mean, I don't have as far to go as you."
1528,1528,No.
1529,1529,You were right. I should have left him to his damn trick.
1530,1530,I'm sorry.
1531,1531,I'm sorry for a lot of things.
1532,1532,I'm sorry about Sarah.
1533,1533,"Didn't mean to hurt her, I didn't."
1534,1534,"You go live your life in full now, all right? You live for both of us."
1535,1535,Goodbye.
1536,1536,Are you watching closely?
1537,1537,Put it down on the end.
1538,1538,Take a minute to consider your achievement.
1539,1539,I once told you about a sailor who described drowning to me.
1540,1540,"Yes, he said it was like going home."
1541,1541,I was lying. He said it was agony.
1542,1542,"MAN Alfred Borden, this day, in the name of the king and the High Court of England, you will meet your end."
1543,1543,No one cares about the man in the box.
1544,1544,Cutter?
1545,1545,Cutter!
1546,1546,MAN Do you have anything to say?
1547,1547,Abracadabra.
1548,1548,GUNSHOT MOANS ANGIER MOANS A brother? A twin?
1549,1549,You were Fallon.
1550,1550, The whole time?
1551,1551, No.
1552,1552,We were both Fallon.
1553,1553,We were both Borden.
1554,1554,Were you the one who went into the box?
1555,1555,Or the one who came back out?
1556,1556,We took turns.
1557,1557,The trick is where we would swap.
1558,1558,Cutter knew. Cutter knew.
1559,1559,"But I told him it was too simple, too easy."
1560,1560,No.
1561,1561,"Simple, maybe, but not easy."
1562,1562,There's nothing easy about two men sharing one life.
1563,1563,"I don't understand, how it can be bleeding again?"
1564,1564,Wha... What about Olivia and your wife?
1565,1565,We each loved one of them.
1566,1566,I loved Sarah.
1567,1567,He loved Olivia.
1568,1568,"We each had half of a full life, really, which was enough for us..."
1569,1569,...just.
1570,1570,But not for them.
1571,1571,"See, sacrifice, Robert, that's the price of a good trick."
1572,1572,"You wouldn't know anything about that, would you?"
1573,1573,GROANING I've... I've made sacrifices.
1574,1574, No.
1575,1575, Yes.
1576,1576,It takes nothing to steal another man's work.
1577,1577,"Yeah, it takes everything."
1578,1578,"No, no, wait, I'm not..."
1579,1579,GUNSHOT It took courage.
1580,1580,"It took courage to climb into that machine every night, not knowing..."
1581,1581,...if I'd be the man in the box...
1582,1582,...or in the prestige.
1583,1583,Do you want to see...
1584,1584,...what it cost me?
1585,1585,"You didn't see where you are, did you?"
1586,1586,Look. Look.
1587,1587,I don't care.
1588,1588,You went halfway around the world.
1589,1589,You spent a fortune.
1590,1590,You did terrible things.
1591,1591,"Really terrible things, Robert."
1592,1592,And all for nothing.
1593,1593,For nothing?
1594,1594,BORDEN Yeah.
1595,1595,You never understood...
1596,1596,...why we did this.
1597,1597,The audience knows the truth.
1598,1598,The world is simple.
1599,1599,It's miserable.
1600,1600,Solid... Solid all the way through.
1601,1601,"But if you could fool them, even for a second..."
1602,1602,...then you could make them wonder.
1603,1603,And then you...
1604,1604,Then you got to see something very special.
1605,1605,You really don't know.
1606,1606,It was...
1607,1607,...it was the look on their faces.
1608,1608,"INHALES DEEPLY CUTTER Every magic trick consists of three parts, or acts."
1609,1609,"The first part is called ""the pledge."" The magician shows you something ordinary."
1610,1610,"The second act is called ""the turn."" The magician takes the ordinary something and makes it into something extraordinary."
1611,1611,"But you wouldn't clap yet, because making something disappear isn't enough. You have to bring it back."
1612,1612,Now you're looking for the secret.
1613,1613,"But you won't find it, because, of course, you're not really looking."
1614,1614,You don't really want to work it out.
1615,1615,You want to be fooled.
