,Unnamed: 0,dialog
568,568,Mr. Tesla has built unusual machines for unusual people.
569,569, But he would never talk about it.
570,570, I understand discretion.
571,571,I just want the machine.
572,572,Finish your drink.
573,573,I want to show you something.
574,574,I think you'll have a special appreciation for our work.
575,575, I thought it was a secret.
576,576, You're a magician.
577,577,Who's gonna believe you?
578,578,Not long now.
579,579,Our equipment requires a great deal of current.
580,580,Tesla electrified the whole town in exchange for using the generators when we need them.
581,581,We do our tests when the townspeople are asleep.
582,582,Mr. Tesla doesn't want to scare anyone.
583,583,ELECTRICAL HUMMING Where are the wires?
584,584,Exactly.
585,585,Where's the generator?
586,586,You saw it last week.
587,587, That must be ten miles from here.
588,588, Fifteen.
589,589,And I have to ride all of them before I get to bed.
590,590,"I'll send word for you in a few days, Mr. Angier."
591,591,ANGIER Magic. Real magic.
592,592,"MAN Now appearing, only here at London's Royal Albert Hall, one of the miracles of our age."
593,593,A technological marvel. You've never seen anything like it in your lives.
594,594,Your eyes will not believe what they're witnessing.
595,595,"The miracle of Nikola Tesla, ladies and gentlemen."
596,596,"Free, clean power."
597,597,Like to know the future?
598,598,The man who's speaking right now is going to change the world.
599,599,"Come one, come all."
600,600,"Immediate seating, no waiting."
601,601,"LOUD ELECTRICAL ZAPPING Ladies and gentlemen, GASPS Objections have been raised..."
602,602,They should be raised.
603,603,Does that look safe to you?
604,604,Part of Thomas Edison's smear campaign against Mr. Tesla's superior alternating current.
605,605,MAN We have asked Mr. Tesla to reconsider.
606,606,MAN 2 Which he will not!
607,607,But I've been told he refuses to appear under any such restrictions.
608,608, GASPS  This thing's gonna blow.
609,609,"Ladies and gentlemen, please."
610,610,BORDEN Hey.
611,611,"Hello, Jess."
612,612,Have you had a nice day with mommy? Huh?
613,613,Sarah.
614,614, I love you.
615,615," See, today it's true."
616,616, Yeah.
617,617, Hello.
618,618,ANGIER I saw happiness.
619,619,Happiness that should have been mine.
620,620,But I was wrong.
621,621,His notebook reveals that he never had the life that I envied.
622,622,"The family life that he craves one minute, he rails against the next, demanding freedom."
623,623,His mind... his mind is a divided one.
624,624,His soul is restless.
625,625,"His wife and child, tormented by his fickle and contradictory nature."
626,626,"So, what do you think you'll call her?"
627,627,I don't know.
628,628,"Everybody needs a name, so, what's hers?"
629,629,Maybe Sarah.
630,630,That's a lovely name.
631,631,That's a lovely name.
632,632,"Well, you talk about what you want to do for the rest of the day."
633,633,"All right, go on, you talk with her."
634,634,Are they taking her away?
635,635,To the workhouse?
636,636,You keep talking.
637,637,Tell Owens I've reconsidered. Take it.
638,638,"Go on, take it."
639,639,It's for the best.
640,640,Let me see.
641,641,I'm gonna learn all the professor's secrets.
642,642,Only if I teach you how to read.
643,643,"They're just stupid tricks, right?"
644,644,"Haven't helped you get out of here, have they?"
645,645,"Or can't you undo real locks, professor?"
646,646,Maybe I'm just biding my time.
647,647,Maybe one day I'll...
648,648,"...open my hand, get your attention, ask, ""Are you watching closely?"" Maybe a magic whirl or two."
649,649,And then I'll be gone.
650,650,How'd you get so famous then?
651,651,Magic.
652,652," Oi! Borden, get back here!"
653,653, ALL LAUGING Thank you.
654,654,Shut up!
655,655,LAUGHING CONTINUES Where's the bloody key?!
656,656,"DISTANT ELECTRICAL HUMMING ANGIER February 8, 1899."
657,657,"Today, finally, a breakthrough."
658,658,Tesla's agreed to see me.
659,659,ELECTRICAL ZAPPING Perfectly safe.
660,660,So this is the Great Danton.
661,661,Mr. Alley has effused about your act to me on any number of occasions.
662,662,Hold out other hand.
663,663, What's conducting the electricity?
664,664," Our bodies, Mr. Angier."
665,665,"Quite capable of conducting and, indeed, producing energy."
666,666,"Have you eaten, Mr. Angier?"
667,667,CHUCKLING I need something impossible.
668,668,"You're familiar with the phrase, ""MAN's reach exceeds his grasp""?"
669,669,Is a lie.
670,670,Man's grasp exceeds his nerve.
671,671,Society only tolerates one change at a time.
672,672,"First time I tried to change the world, I was hailed as a visionary."
673,673,Second time...
674,674,...I was asked politely to retire.
675,675,"So here I am, enjoying my retirement."
676,676,"Nothing is impossible, Mr. Angier."
677,677,What you want is simply expensive.
678,678,"If I were to build for you this machine, you would be presenting it merely as illusion?"
679,679,"Well, if people actually believed the things I did on stage, they wouldn't clap, they'd scream."
680,680,Think of sawing a woman in half.
681,681,Have you considered the cost of this?
682,682,Price is not an object.
683,683,"Perhaps not, but have you considered the cost?"
684,684,I'm not sure I follow.
685,685,"Go home, forget this thing."
686,686,I can recognize an obsession.
687,687, No good will come of it.
688,688, Hasn't good come of your obsessions?
689,689,"At first, but I have followed them too long."
690,690,I am their slave.
691,691,"And one day, they will choose to destroy me."
692,692,"If you understand an obsession, then you know you won't change my mind."
693,693,So be it.
694,694,Will you build it?
695,695,"I've already begun to build it, Mr. Angier."
696,696,I hope you enjoy the mountain air.
697,697,This will take some time.
698,698,"DEEP INHALE, EXHALE Uh... I thought you'd gone."
699,699,I don't really have anywhere to go.
700,700,You've been sleeping here?
701,701,Cutter said it'd be all right till we get another booking. What are you doing?
702,702,Uh... research.
703,703,"Part of a magician's job is to... watch his competition, see what illusions..."
704,704,"You're going to do something to that man, aren't you?"
705,705,Cutter's hoping you let things lie.
706,706,He says if Borden thinks things are even between you...
707,707,Even?
708,708,My wife for a couple of his fingers?
709,709,He has a family now and he's performing again.
710,710,"Borden is out there living his life just as he intended, as if nothing had happened and look at me."
711,711,I'm alone and no theater will touch me.
712,712,Us.
713,713,You're going to need a better disguise.
714,714,I need a volunteer.
715,715,WENSCOMBE What happened?
716,716,Did you hurt him?
717,717,"What happened, Robert?"
718,718,"You, sir. Just a rubber ball, yes?"
719,719,Thank you.
720,720,Just a rubber ball? No.
721,721,Not normal. Not a normal rubber ball.
722,722,It's magic.
723,723,He had a new trick.
724,724,WENSCOMBE Was it good?
725,725,It was the greatest magic trick I've ever seen.
726,726, DOOR OPENS  MINIMAL APPLAUSE ANGIER Did they applaud when you saw it?
727,727,It was too good. It was too simple.
728,728,The audience hardly had time to see it.
729,729, He's a dreadful magician.
730,730, A wonderful magician.
731,731,He's a dreadful showman.
732,732,"He doesn't dress it up,  how to sell it."
733,733, How does he do it?
734,734, He uses a double.
735,735," No, it's too simple."
736,736,This is a complex illusion.
737,737,You say that because you don't know the method.
738,738,It's a double that comes out.
739,739,It's the only way.
740,740,I've seen him perform it three times.
741,741,The prestige is the same man.
742,742," No, it's not."
743,743, The same man comes out of the cabinet.
744,744,It's the same man.
745,745,"He wears padded gloves to hide his damaged fingers, but, if you look closely, you can tell."
746,746,"He doesn't know how to sell it to an audience, but I do."
747,747,"Yeah, we could use it as a climax to the show."
748,748,Yes.
749,749,"The man stole my life, I'm gonna steal his trick."
750,750,We got to find someone who looks like you.
751,751, He doesn't use a double.
752,752, I don't know how Borden does it.
753,753,"Either... You either wait for him to retire and buy the secret, or you listen to how I would do it."
754,754,And the only way that I know how to do it is to find you a bloody good double.
755,755,All right.
756,756,Take a good look.
757,757,Let's get out there and find me.
758,758,Whoo!
759,759,"Look, look."
760,760,What's that?
761,761, It's for you.
762,762, What's this for?
763,763,Come.
764,764,SARAH You...
765,765, I asked you last week...
766,766, You caught me in a wrong mood.
767,767, But you won't ever...
768,768," Sarah, I'm gonna have to change my mind, aren't I?"
769,769,"The act is taking off. Soon we'll be in a bigger theater, things will work out."
770,770,I can't believe it. Thank you.
771,771,Thank you. It's beautiful.
772,772, Gerry?
773,773," GASPS Darling, look at you."
774,774,"Mr. Cutter, Mr. Angier, I'd like you to meet Gerald Root."
775,775,Mmhm.
776,776, WHISPERING INDISTINCTLY  WENSCOMBE GIGGLES A pleasure. Pleasure to meet you fine gentlemen.
777,777,Would you like for me to tell you a little joke? Come here.
778,778,Yes. Are you laughing now?
779,779,CHUCKLING I have to take a piss.
780,780, He's out of his mind.
781,781," Of course, he's an outofwork actor."
782,782,He's perfect. He needs a little help.
783,783,"But when I get done with him, he could be your brother."
784,784,"I don't need him to be my brother, I need him to be me."
785,785,Give me a month.
786,786,So you open the door...
787,787,...and...
788,788,CHUCKLING EXHALES Come on.
789,789, GROANS  CHUCKLING Couldn't you have found a softer one?
790,790,"Well, it's not for sleeping on."
791,791,"So, if you come down through there..."
792,792,...does Root go up through there?
793,793, Yep.
794,794,It's going to be amazing.
795,795,"Well, it has to be. BORDEN's trick is getting noticed."
796,796,The place was packed today.
797,797,You went and saw his show again.
798,798,"Ready to meet yourself, Mr. Angier?"
799,799,"ROOT SIGHS WENSCOMBE GIGGLES All I have to do is keep myself stinking drunk, and no one will be able to tell the difference."
800,800,"Have a little faith, sir."
801,801,"Now, would you favor us with a performance, Mr. Root?"
802,802,"CLAPPING You'd drink, too, if you knew the world half as well as I do."
803,803,Did you think you were unique?
804,804,"I've been Caesar, I've played Faust."
805,805,How difficult could it possibly be to play the Great Danton?
806,806,"You can go back to being yourself now, Root, for nothing."
807,807,I'd rather be him for now.
808,808,"I find it, uh... amusing."
809,809,"CHUCKLES ""My liege, I did deny no prisoners.""  You look wonderful."
810,810," Oh, thank you."
811,811,Root has to keep a low profile.
812,812,"Anyone sees him, the game's up."
813,813,I don't know how you do things.
814,814,I'm not sure I wanna know.
815,815,Have you thought what we should call it?
816,816,There's no point being coy. Borden calls his trick The Transported man.
817,817,"APPLAUSE Ladies and gentlemen, much of what you've seen may be termed  as illusions or entertaining trifles."
818,818, RIMSHOT APPLAUSE Alas...
819,819,DRUMROLL ...I cannot claim this next feat as illusion.
820,820,Watch carefully.
821,821,"You will see no trickery, for no trickery is employed."
822,822,Merely a technique familiar to certain citizens of the Orient and various holy men of the Himalayas.
823,823,"Indeed, many of you may be familiar with this technique, but for those of you who are not, do not be alarmed."
824,824,What you're about to see is considered safe.
825,825,"APPLAUSE, CHEERING APPLAUSE, CHEERING CONTINUES To our achievement."
826,826,The manager says he's never seen a reaction like it.
827,827,At least he saw it. I spent the ovation hiding under the stage.
828,828,No one cares about the man who disappears.
829,829,They care about the one who comes out.
830,830,I care about the man in the box.
831,831,"Thank you. I don't know, maybe we could switch before the trick."
832,832,"I'm the prestige, and Root's below stage."
833,833,"No, the anticipation of the trick is everything."
834,834,We need your showmanship to build up the suspense.
835,835,"Once Root opens his mouth, it's over."
836,836,He can't introduce this trick.
837,837,Of course I can. I'm the Great Danton.
838,838,"Root, you bloody fool, get out of that wardrobe and makeup."
839,839,Anyone could walk in here at any minute.
840,840,"Congratulations, all."
841,841,Life is not full of these moments. We worked hard.
842,842,We need to celebrate properly.
843,843,What's wrong? Is it your wife?
844,844,"No, it's the trick."
845,845,It isn't good enough.
846,846,BORDEN's trick is nothing compared to ours. He has no style.
847,847,He doesn't spend the finale hiding under the stage.
848,848, I need to know how he does it.
849,849, Why?
850,850,So I can do it better.
851,851,I need you to go and work for him.
852,852,Work for him? Are you joking?
853,853,You'll be my spy.
854,854,We just got our start.
855,855,You want me to leave?
856,856,That's how we advance. Think of it.
857,857,People are excited by Cutter's version. Imagine what we'd do with the real illusion. We'd have the greatest magic act anyone's ever seen.
858,858, He knows I work for you.
859,859, Exactly why he'll want to hire you.
860,860, He'll want my secret.
861,861, Why would he trust me?
862,862,Because you're gonna tell him the truth.
863,863,Hmm?
864,864,Good girl.
865,865,RATTLING You must be curious to see what so much money has bought you.
866,866,Fitting you should be here for her maiden voyage.
867,867,Your hat.
868,868,You might want to stand back.
869,869,ELECTRIC ZAPPING FIZZLING I don't understand.
870,870,Perhaps it would be best if you left us to it.
871,871,"Is there a problem, Mr. Tesla?"
872,872, No. Come back next week.
873,873, Next week?
874,874," Next week, it will be fine."
875,875, Tesla!
876,876,Just a little temperamental.
877,877,DOOR CLOSING  Interesting workshop.
878,878," Yeah, we make do."
879,879, My name is Olivia...
880,880, I know who you are.
881,881,Here to steal the rest of my show?
882,882,To give your show what it's missing.
883,883," Yeah, what might that be?"
884,884, Me.
885,885,"CHUCKLES I was just saying that, wasn't I?"
886,886, A woman's touch.
887,887, I've left Angier.
888,888, All right.
889,889, I want a job.
890,890,Yeah.
891,891,I know you've no reason to trust me.
892,892,Why wouldn't I trust you?
893,893,You're only the mistress of my enemy. Why wouldn't I trust you?
894,894, Mr. Borden  Alfred.
895,895,I'm going to tell you the truth.
896,896,"Now that is a slippery notion in our line of work, isn't it, Miss Wenscombe?"
897,897,I am here because he sent me here.
898,898,He wants me to work for you and steal your secret.
899,899,What does he need my secret for?
900,900,His trick is topnotch.
901,901,"He vanishes, and then he reappears instantly on the other side of the stage, mute, overweight and, unless I'm mistaken, very drunk."
902,902,"It's astonishing. How does he do it? And tell me, Olivia, does he enjoy taking his bows under the stage?"
903,903,It's killing him. He's obsessed with discovering your methods.
904,904,"He thinks of nothing else, takes no pleasure in our success."
905,905,And I've had enough.
906,906,There is no future with him.
907,907,"He sent me here to steal your secrets, but I've come to offer you his."
908,908,This is the truth... is it?
909,909,"Think you'd better get dressed, sir."
910,910,"Root, you're late and more drunk than usual. Get down below stairs right away."
911,911,No.
912,912,"No, we need to have a little chat, Mr. Cutter."
913,913,"We have a problem. Cutter, Borden is performing right across the street."
914,914,"Yeah, we have a bigger problem."
915,915,Root. He's realized that he can make demands.
916,916,Wha...? He's blackmailing us?
917,917,"I was surprised, to tell you the truth."
918,918,It usually takes them a lot longer to figure it out.
919,919, How much does he want?
920,920, It makes no difference.
921,921, We've got to stop doing the trick.
922,922, Stop the trick? Look at this.
923,923,Last week they said you were the premier stage performer in London.
924,924,"Not magician, mind you."
925,925,Performer of any kind.
926,926, What's your point?
927,927," My point is, you've climbed too high to get away with professional embarrassment."
928,928,We don't do any tricks we can't control.
929,929,"Just pay him for now. We keep doing the trick until Borden opens, and then we'll phase it out."
930,930,All right.
931,931,ANGIER Cutter was always surprised how fast Root turned bad.
932,932,To what do I owe the pleasure of this rather welcome pint of ale?
933,933," You're the Great Danton, aren't you?"
934,934," Sh, sh, sh, sh, sh."
935,935,"Of course I am, but don't advertise it, because I'll be mobbed with fans."
936,936,ANGIER We paid him enough to keep him in beers.
937,937,You wouldn't expect him to rock the boat.
938,938,"MANy of you may be familiar with this technique, but for those of you who aren't, do not be alarmed."
939,939,What you're about to see is considered safe.
940,940, And who are you?
941,941, I am a humble admirer and a fellow practitioner.
942,942,Mmm. Very good.
943,943,GRUNTS  BORDEN Another one?
944,944," Oh, if you insist."
945,945, BORDEN Another.
946,946, I'm not performing tonight.
947,947,"I'm only doing one show, but to be frank, my people pretty much run things these days."
948,948,Get up there.
949,949,Get up!
950,950,"Your illusion, The Transported man, I'm not claiming to know your methods, but I had a similar trick in my act, and, uh... WHISPERING I used a double."
951,951," Mm, I see, very good."
952,952," Well, it was, and then it went bad."
953,953,"What I didn't count on was that when I incorporated this bloke into my act, he had complete power over me."
954,954,"Complete power, you say?"
955,955,LAUGHING APPLAUSE GRUNTING Ohh! LAUGHS Be very careful giving someone that power over you.
956,956,Huh. Thank you. Um...
957,957,"Yes, thank you for the warning."
958,958,Hmm. Cheers.
959,959,I cannot claim this next feat as illusion.
960,960,What you're about to see is considered safe.
961,961,Ahh!
962,962,"MOANING CROWD LAUGHING APPLAUSE CHUCKLING LAUGHING, APPLAUSE Oh! The Great Danton."
963,963,I apologize.
964,964,There simply is too much magic...
965,965,...for my stage at The Pantages across the street.
966,966,Pardon my intrusion.
967,967,And go easy on the poor chap.
968,968,He does try so very hard.
969,969,"ALL LAUGHING, APPLAUDING I don't know how Borden found him."
970,970,Kept him under wraps. I was careful.
971,971,"Yeah, well, he did."
972,972,Do you think it was her?
973,973,You weren't expecting me?
974,974,I expected you sooner.
975,975,Your message said afternoon.
976,976,It takes a bit for me to get around these days.
977,977,He's taken everything from me.
978,978,"My wife, my career,  now you."
979,979, You sent me.
980,980,"I sent you to steal his secret, not to improve his act."
981,981, It's my job.
982,982, Or fall in love!
983,983, I did everything you asked!
984,984, Yes? Yes?
985,985, How does he do it?
986,986," Cutter was right, a double."
987,987, 'Course he said that.
988,988, He didn't say it.
989,989,"I've seen things, makeup, glasses, wigs."
990,990,We don't use for the show.
991,991, I've seen it hidden backstage.
992,992, Misdirection.
993,993,He leaves them lying around to make you think that.
994,994,He doesn't know when I'm looking.
995,995,"All the time, Olivia! That's who he is!"
996,996,That's what it takes!
997,997,"He lives his act, don't you see?"
998,998,Just because you're sleeping with him doesn't mean he trusts you.
999,999,"You think you can see everything, don't you?"
1000,1000,The Great Danton is a blind fool.
1001,1001,His notebook.
1002,1002,You stole it?
1003,1003,I borrowed it for tonight.
1004,1004,I thought you could translate some of it...
1005,1005,I can't. No one can. It's a cipher.
1006,1006,"Even with the keyword, it will take months to decode."
1007,1007, And without the keyword?
1008,1008, Perhaps never.
1009,1009, We'll see.
1010,1010, We will not see.
1011,1011,If I don't get that back by tomorrow he'll know I took it.
1012,1012, Leave him.
1013,1013, I can't. He knows where I live.
1014,1014,"This is his diary, Olivia. All of his secrets are right here in my hands."
1015,1015,It won't bring your wife back.
1016,1016,I don't care about my wife.
1017,1017,I care about his secret.
1018,1018,"SIGHS, GRUNTS Look, I'll, um..."
1019,1019,I'll go to his workshop and stage a breakin.
1020,1020, He'll know you took it.
1021,1021," Yes, me. Not you."
1022,1022,Understand?
1023,1023,Robert.
1024,1024,I have fallen in love with him.
1025,1025,Then I know how hard this has been for you.
1026,1026,Notebook?
1027,1027,Then he's just getting started.
1028,1028,CLAPPING  DRUMROLL  CYMBAL CRASHES ELECTRICAL ZAPPING APPLAUSE ALL Professor!
1029,1029,Good evening.
1030,1030,CHATTERING I'm walking tonight.
1031,1031,Let him come. I don't care.
1032,1032,ALL Professor! Professor!
1033,1033,"MAN YELLS HEART BEATING MAN GAGGING, COUGHING  GUNSHOT  Ahh!"
1034,1034, You all right?
1035,1035, I'm alive.
1036,1036,Saves me cutting you an air hole.
1037,1037, I'm impressed.
1038,1038, Why is that?
1039,1039,You're finally getting your hands dirty.
1040,1040,"It's what a good trick costs, Angier."
1041,1041,"Risk, sacrifice."
1042,1042,"The sacrifice, I'm afraid, is all gonna be yours, unless you give me what I want."
1043,1043, Which is?
1044,1044, Your secret.
1045,1045,My secret?
1046,1046,Your method for The Transported man.
1047,1047,Fallon wouldn't tell me.
1048,1048,He doesn't talk at all.
1049,1049, You have my notebook.
1050,1050, Useless without the keyword.
1051,1051,"Write down your method, Mr. Borden, describe it in full."
1052,1052,"I want the whole method, not the keyword."
1053,1053,I don't know if your secret's in your notebook.
1054,1054,The keyword is the method.
1055,1055,Where's my ingénieur?
1056,1056, Alive?
1057,1057, How fast can you dig?
1058,1058,"Fallon, you hear me? Fallon!"
1059,1059, ANGIER How's the arm?
1060,1060, Still attached.
1061,1061,Did you find your answer?
1062,1062,"Our answer, Cutter. I haven't looked yet. I wanted you to share this."
1063,1063,"I already know how he does it, Robert."
1064,1064,"Same way he always has, the same way as we do."
1065,1065,It's just that you want something more.
1066,1066,"Well, let's find out then, shall we?"
1067,1067,What does it mean?
1068,1068,"It means, Cutter, we have a journey ahead of us."
1069,1069, To America.
1070,1070, Robert?
1071,1071,Listen to me.
1072,1072,Obsession is a young man's game.
1073,1073,Come on.
1074,1074,I can't follow you any further in it.
1075,1075,"I can't, I'm sorry."
1076,1076,Then the rest is up to me.
1077,1077,I'm sorry.
1078,1078,"Good evening. Hello, darling."
1079,1079,"LAUGHS Champagne, your finest."
1080,1080,I didn't know we were going to be joined for dinner.
1081,1081,"Absolutely, we are celebrating."
1082,1082,"Miss Wenscombe, Mr. Fallon."
1083,1083, What are we celebrating?
1084,1084, We've hit upon a new trick.
1085,1085, Haven't we?
1086,1086," What trick, Freddie?"
1087,1087,"Yes, Freddie, what trick?"
1088,1088,"I am going to bury myself alive every night, and then someone will come along and dig me up. Wonderful."
1089,1089, I think he's had quite enough...
1090,1090," No, pour the champagne."
1091,1091,"Pour the... Sarah, don't talk to me like that. I'm not a bloody child."
1092,1092, Perhaps it would be better...
1093,1093," Mr. Fallon, escort her home."
1094,1094, My husband's being a bore.
1095,1095," Oh, please."
1096,1096, I see no reason you should suffer.
1097,1097, Don't ruin this evening.
1098,1098,"Good night, Mrs. Borden."
1099,1099,"Good night, Freddie."
1100,1100, Freddie?
1101,1101, That's my name.
1102,1102, Not at home.
1103,1103," I'm not always at home, am I?"
1104,1104,Couldn't you have at least taken off the beard?
1105,1105,"Sarah, I just came from the bloody theater just now."
1106,1106,All right? I'm out in public.
1107,1107,Everybody else loves it.
1108,1108,Why are you being like this?
1109,1109,I had a terrible ordeal today.
1110,1110,I thought that something very precious...
1111,1111,...had been lost to me.
1112,1112,So I just wanted to celebrate just a little.
1113,1113,"All right, what? What did you lose?"
1114,1114,"I see, more secrets."
1115,1115,"Sarah, secrets are my life."
1116,1116, Our life.
1117,1117," No, Alfred, stop, this isn't you."
1118,1118,Stop performing.
1119,1119,SHUDDERS I thought I had the place to myself.
1120,1120,"Unexpected guests, not very polite."
1121,1121,A lot of questions.
1122,1122,"At first, I thought they worked for the government."
1123,1123, No?
1124,1124," Worse, they work for Thomas Edison."
1125,1125,"BORDEN Today, a most curious development."
1126,1126,His assistant came to us with a proposition.
1127,1127,"Obviously, Angier has sent her and told her to admit as much."
1128,1128,Does he enjoy taking his bows under the stage?
1129,1129,"He sent me here to steal your secrets, but I've come to offer you his."
1130,1130,This is the truth...
1131,1131,...is it?
1132,1132,"No, that's what he told me to tell you. The truth..."
1133,1133,"...is that I loved him and I stood by him and he sent me to you, like he would send a stagehand to pick up his shirts."
1134,1134,I hate him for that.
1135,1135,I could spot Angier's methods from the back of the theater.
1136,1136,"So, what could you possibly have to offer me?"
1137,1137,"You may know his tricks, but you can't understand why no one sees yours are better."
1138,1138,You hide this.
