,dialog
2166,"Okay, here's the ocean, We're here. Safe house."
2167,First tunnel comes through to here.
2168,First team takes out the security station.
2169,Second tunnel comes through into the center of the house.
2170,"Tito, your contacts inside said Syd's in the last bedroom..."
2171,"...on the second floor, right?"
2172,Lupe's one of us.
2173,If she says your sister's there...
2174,...she is there.
2175,"Three o'clock sharp, the bag of cats and iguanas go over the fence."
2176,Hopefully the motion detectors'll go so crazy security'll shut them off.
2177,My guys will watch the outside for any military.
2178,"If they come, that's bad."
2179,"Let's make this count, guys."
2180,We're in.
2181,"Goddamn it, it's the fifth time today."
2182,"Carlos, turn off the motion sensors till we get it fixed."
2183, Look what I found. Can I keep them?
2184, No.
2185,"All right, guys..."
2186,...sensors are down. Time to move.
2187, We are 100% go.
2188,Let's go.
2189,Left. Left. Yeah. There we go.
2190,This is not as easy as it looks.
2191,"Okay, we're at the T."
2192,Split right.
2193,"Good luck, guys."
2194,"Let's go. Come on, let's go."
2195,Find the soccer game.
2196,"Sniff it out, baby. Sniff it out."
2197,"To the left. To the left. Oh, shit."
2198,"Oh, you did not see me."
2199, Ready to bust into the escape tunnel.
2200, There we go. Soccer.
2201,Sorry.
2202,"Go, go, go, go, go!"
2203,Go!
2204,Get me the American bitch.
2205,Call General Santos.
2206,Tell him I need him now!
2207,"Sorry, darling. Take her outside to safety. Come on."
2208," Carlos, this is not good!"
2209, I know!
2210, Where is General Santos?!
2211," He's coming, boss!"
2212,You fucking maricons!
2213,I'm gonna blow your head off!
2214,Fuck!
2215,What's happened to this gun?
2216,My son will slice you into chorizo.
2217," Mama, I'm very sorry."
2218, You little puta!
2219," Vargas, you in?"
2220, We got Mama and the girl.
2221,We're entering the house. Go!
2222,Move! Move! Move!
2223,Everything's clear outside.
2224,You got 30 seconds max. Haul ass.
2225,You got two rovers on the balcony.
2226,I can't get a shot off.
2227,See the rover? I missed him!
2228,Get down! Get down now!
2229, Get down!
2230, Down!
2231,Move! Move! Move!
2232, Marcus!
2233, Come on!
2234,Move! We got the package.
2235,Move now. It's turning into a real bad day.
2236," Vargas, we're coming back. Cover us!"
2237," We got you covered, baby."
2238,Somebody talk to me.
2239,What's going on?
2240,The military is everywhere.
2241," This is bad, I have to go."
2242," Listen, you have a lot of company."
2243,Get out of there now!
2244,I'm hit! I'm hit!
2245,Head for the tunnel. I'll blow this.
2246,"Go, go! Get out!"
2247,"Mike, you gotta get out."
2248,Vargas! Get out! Abort!
2249,Vargas! Get out! Abort!
2250,We won't reach the tunnel!
2251,Go to plan B.
2252, We're going to plan B!
2253, What plan B?!
2254,You don't pay attention to shit!
2255, What's the plan B?
2256, That's your problem!
2257,Are you fucking shitting me?
2258,Let's go!
2259, Follow me! Follow me!
2260, I will...
2261,Plan B? What the hell is plan B?
2262," Tito, what you doing here?"
2263," You need a Cuban guide, fool."
2264,This way!
2265, They won't make it to the tunnel.
2266, Let's blow out of here!
2267,"Keys, keys, keys!"
2268,"Oh, my God! No! God!"
2269,"Oh, my God!"
2270,Plan B did not have that bigass gun in it!
2271,You call this plan B?!
2272,What the plan B stand for? Bullshit!
2273,Do you want to drive?!
2274,"Yeah, pull over by the fuckers with the machine guns!"
2275,Shit!
2276,I am not to be fucked with!
2277,I missed the part of the meeting when you drive through the dining room.
2278,And right out the front door.
2279,Get in the truck!
2280,Cuban army was everywhere.
2281, Gotta get us to Guantanamo Bay!
2282, No.
2283,You can't drive onto a U.S. Naval base.
2284,"Hey, we're Americans, okay?"
2285,"Marcus, you know how when we usually get in these situations..."
2286,"...I'm always trying to make you feel better, like we'll be all right."
2287," Yeah, yeah."
2288, I could say it...
2289,...but that'd be a bunch of bullshit today.
2290,"Military, military."
2291, Which way?!
2292," No, right! Right! Go right!"
2293,These are drug dealer shacks.
2294,They make cocaine here.
2295,Hope there's shit in there that likes to blow.
2296,"Faster! I'll kill you, motherfucker!"
2297,I'm gonna go for it.
2298, This is a bigass hill.
2299, Shit.
2300," Oh, shit! Is this still called plan B?"
2301," No, this is definitely plan C."
2302,"Oh, Jesus!"
2303,God! God!
2304,Everybody start shooting at somebody!
2305,Shoot! Shoot!
2306, Shit! I'm out!
2307, I got two rounds left.
2308, One in the chamber.
2309, I'm out.
2310,All these guns and none of you got no bullets?!
2311, I got one in my hip!
2312," Oh, God, he's hit!"
2313,There! Gitmo!
2314,"U.S. Soil, baby. U.S. Soil."
2315,Come on! Go!
2316, Americans on the way!
2317," Whoa, watch..."
2318,Run it! Run it!
2319,Go.
2320,Go! Go! Go!
2321,Fuck.
2322,Mike!
2323,We're Americans!
2324,I pay my motherfucking taxes!
2325,Shoot them!
2326,"Hey, fucking gringo. Drop the gun!"
2327,Put it down! Put it down!
2328,They can't help you.
2329,You're staying in Cuba.
2330,You are standing on a live minefield!
2331,Do not move!
2332,"Look, why don't we all go home..."
2333,"Well, we'll go home, you go to a hotel."
2334,Work this shit out another day. None of us is having a good day right now.
2335, Give me the gun!
2336, Okay.
2337,I'll toss it right at your feet...
2338,...right next to the mine.
2339,"Now, that's how you supposed to shoot!"
2340,"From now on, that's how you shoot!"
2341,"Oh, I want my next partner to shoot just like that."
2342,It take a dysfunctional motherfucker to bust somebody in the head like that.
2343,That's some dysfunctional shit.
2344,"My next partner'll invite me to his barbecues, though."
2345,"Come here, girl. Come here."
2346,I came all the way to Cuba for this.
2347,Come on.
2348,Y'all gotta do that around land mines?
2349,Would you tell them that that shit is dangerous around these land mines?
2350,"You know, Mike, this ain't easy for me, but I was wrong."
2351,I'll be very proud for you to date my sister.
2352," Thanks, man."
2353, All right.
2354,"You know, me and Syd thought about it..."
2355,...and your behavior was so crazy that...
2356,"...any magic we could've captured, probably best if we didn't... You know."
2357,You're just gonna take advantage of my little sister?
2358,Already you breaking her heart?
2359, What you talking about?
2360, She not good enough for you?
2361,"Syd, Mike says you ain't shit!"
2362,"Now, why would you scream out some crazy nonsense like that?"
2363,"I don't appreciate you coming here, disrespecting me in my new pool."
2364,I bought your new pool.
2365,Why don't you hook this pool up to your Ferrari and drag it out of here?
2366,"First of all, I was joking."
2367,"And second of all, all this right here, smell yourself right now."
2368,Because this moment is what's wrong with you.
2369,I got the transfer papers in the trash can.
2370,I'll get them and glue them the fuck up.
2371, Glue them up.
2372, What?
2373, Want some glue?
2374, We won't be partners no more.
2375,I got glue in the car.
2376,"I'm trying to talk to you. It's hot, I feel like I'm cooking in this fucker..."
2377,...and I gotta hear shit out of you?
2378,Then on top of that shit...
2379,...you gonna dog my baby sister?
2380,"Oh, this that bullshit!"
2381,Dad!
2382,Dad!
2383,I kept the warranty.
2384,I kept the warranty!
2385,"Bad boys, bad boys What you gonna do?"
2386,What you gonna do When we come for you?
2387,"Bad boys, bad..."
2388,"Come on, you gotta learn the words."
2389,"Mike, you don't know the damn words either."
2390,"Bad boys, bad boys What you gonna do?"
2391,What you gonna do When they come for you?
2392,What you gonna do When they come for you?
2393,What you gonna do When they come for you?
