,dialog
1439, Pop the trunk. Get out. Get in.
1440, Get out. Get out.
1441, Get your ass in.
1442, Okay.
1443, I am in the middle of a sale.
1444, Do I have to pull my gun?
1445,"Oh, shit. Dan Marino. What's up?"
1446,"Back up, Dan. Hey, you're the truth."
1447," Whatever you need, officers."
1448, That's Dan Marino.
1449, Hey. Back up.
1450, Let me know how it rides.
1451,He's gonna testdrive the shit out this.
1452,Go. I don't want to blow my cover.
1453,Got them. Got them right there.
1454,Why you gotta get so close?
1455, I won't let that coffin get away.
1456, But they're all around us.
1457,"Shit, those are the gangbangers."
1458,"Relax, they don't know us."
1459,"Boss, we got a problem here."
1460,We're being followed.
1461,"This is a big problem, Carlos."
1462," Sorry, boss. I'll take care of it, okay?"
1463, Kill those black bitches. All right?!
1464,They made us. Get some undercovers to roll with us.
1465,"We're splitting up. Everybody go to Third and Boxter, now!"
1466,Here we go.
1467,I didn't sign up for no goddamned car chase!
1468,Have you lost your mind?
1469,"I see you got your mind set on doing dumb shit, so please let me out!"
1470,I seen this in a movie once.
1471,They didn't make it!
1472,"Oh, shit!"
1473, Dump truck!
1474, I got it.
1475, Mike!
1476, I'm fine. I'm fine.
1477,"Right there! Oh, shit, Mike!"
1478, Did you see that shit?
1479, No shit.
1480,Dan Marino should definitely buy this car.
1481,Not this one. I'm fucking this one up.
1482,But definitely one like this.
1483,I almost missed that.
1484,"All right, that was almost fucked up."
1485,I almost fucked up.
1486,Shit!
1487,This is not necessary.
1488,"Oh, shit!"
1489, Damn!
1490, Dead man on the hood! Dead man!
1491, I'm trying to get it off.
1492, Get it off!
1493,I'm trying to get it off.
1494, That shit's nasty. That's nasty.
1495, Get it off! Get...
1496,That shit is nasty.
1497, Undercover police! Everybody move!
1498, Undercover police!
1499, Move!
1500, Move! Move! Move!
1501,Coming around the corner!
1502,"Get ready, they're coming around the block. Move!"
1503,Up top!
1504,Shit!
1505,"Boy, if this was my car, I'd be pissed!"
1506,Get down! Get down!
1507,Trying to break the world record for gun fights in a week!?
1508,This is not the time to criticize!
1509,I can't work with you blaming me all the time!
1510, This is not your fault?
1511, This is not... No! No!
1512,"Bullshit, Mike!"
1513,Everything's your fault!
1514,"Okay, let's go! Let's go!"
1515, Clear around!
1516, Cool!
1517,I'm going around!
1518," Mike, got him!"
1519, They got the coffin.
1520,Move!
1521,Move! Move! Get down!
1522,Police! Get down!
1523,Move! Move!
1524,Police! Move! Move!
1525,Get out of my way! Move! Move!
1526,Get down! Get down!
1527,Shit! Open the door! Police!
1528,No!
1529,Whoa! Shit!
1530,Mike! Mike!
1531,That boy bit me!
1532,Mike!
1533,Move! Move!
1534,Police! Move!
1535,Police! Move!
1536,He under there?
1537,We lost the coffin...
1538,"...and you barbecued our only lead, Mike."
1539,"This has got to be the worst, most emotional cop week of my life."
1540,"Yeah, it's been a little rough."
1541, Where were these bodies going?
1542, I don't know. It's really strange.
1543,All the John Does we found out here are empty.
1544,Empty Does. Fat Does.
1545,"Cut them open, took the organs out."
1546,Sewed them back up.
1547,Nice work.
1548,"The more you guys fuck up, the more we look like rock stars."
1549,The van you was chasing is a transport for the city morgue.
1550,The John Does were being delivered to the university for medical research.
1551, Nice going.
1552, I can't believe you guys.
1553,"Do you both wake up in the morning, call each other up?"
1554,"""Good morning, Marcus."" ""Morning, Mike."" ""How you doing?"" ""A'ight."" ""So how are we gonna fuck up the captain's life today?"" ""Gee, I don't know."" ""I don't know."" ""Ooh. Look, over there."
1555,Let's kill three fat people...
1556,"...and leave them on the street."" They were dead before we ran over them."
1557,"It doesn't matter whether they were dead or not, goddamn it!"
1558,Every time you leave a corpse on the street...
1559,...I have to get these forensic coroner guys to come to see what happened.
1560,Then I gotta get detectives.
1561,See? They're detecting shit.
1562,Then I gotta get these forensic guys to stick them back in the fucking bag!
1563,Jesus Christ!
1564,"You guys, you're like..."
1565,You're like a bunch of bloodsucking ticks...
1566,...draining the life's blood out of this department.
1567, Whoosah.
1568," Damn the whoosah, captain."
1569, Did you just call me a tick?
1570, I was referring to him.
1571, Thought so.
1572, These aren't normal corpses.
1573,If I threw you out of a speeding ice truck...
1574,"...and then ran over your head, you wouldn't be normal either."
1575,Think about this for a second.
1576,These bodies have been emptied...
1577,...from a drug smuggler that just happens to own a mortuary.
1578,I got a bunch of bodies waiting with plenty of room in them...
1579,...I could smuggle some shit.
1580, Johnny Tapia has the perfect cover.
1581," Whoa, whoa, whoa, whoa."
1582,Johnny Tapia?
1583,I want a warrant to go into his mortuaries immediately.
1584,No warrant. What?
1585,For what? For what?
1586,For a bunch of dead guys on their way to med research?
1587,"No. Every time we go after him, he sues us and wins."
1588,"This shit stops now or they'll fire us, disband TNT..."
1589,...and stick me in a fucking coffin.
1590, This is over now!
1591," What happened to ""whatever it takes""?"
1592,That was prevehicular manslaughter.
1593,Not to mention Johnny Tapia...
1594, What the fuck is that?
1595," Oh, shit."
1596,Shut up. Shut up.
1597,Shut up. Shut up.
1598,This man has violated my rights!
1599,Who the fuck is that?
1600,Running people over is not enough for you? Now you're into kidnapping?
1601,That man is a criminal. Okay?
1602,We busted him at the...
1603,"Excuse me, I have so much brass up my ass..."
1604,"...I could be playing ""The StarSpangled Banner."" I ain't cut out for this, man."
1605,"Come on, man. I can't do this with you right now."
1606, I'm reevaluating what's important.
1607, About what? Being a cop?
1608,"No, about you being my partner."
1609,Is this about Syd?
1610,"God! Hey, Marcus, man..."
1611,"That was messed up, but that ain't what this is about, Mike."
1612,"Once we nail Tapia, you and me, we're over."
1613,I already signed my transfer papers.
1614,"Megan, what's the name of this boy taking you to the movies?"
1615,Reggie.
1616,"Daddy, please don't embarrass me and ask him a lot of questions."
1617,"Everybody knows you're a cop, and it makes people nervous."
1618,"Well, why nervous? He on crack?"
1619, It's cool?
1620, Yeah. Come in.
1621,What'd you...?
1622,I got a sneak and peek.
1623,Judge Sinclair said we can go into the mortuary tonight.
1624,"We can't touch nothing, but if we find something..."
1625,...he'll give us a righteous warrant.
1626,"You love pissing Captain Howard off, don't you?"
1627,It's what I do.
1628,So when you start playing golf?
1629,"Hey, so you real serious about this transfer thing, huh?"
1630,"I mean, you been quitting for 10 years."
1631,I just always thought it was...
1632,...how you dealt with all this shit.
1633,It's what's best for me and my family.
1634,"Look, I'm gonna get my stuff, man."
1635,"""We ride together, we die together."
1636,"Bad boys for life."" We getting old, Mike."
1637,One of them young punks coming to take my baby out on her first date.
1638, Who the fuck are you?
1639," Hi, Mr. Burnett. I'm Reggie."
1640, What you doing here?
1641, I came to take out Megan.
1642, What?!
1643, I came to take out Megan.
1644, How old are you?
1645," I'm 15, Mr. Burnett."
1646,"Motherfucker, you look 30."
1647, Show me some ID.
1648, I don't have none on me.
1649,You don't have no ID.
1650,Get your ass up against that wall.
1651,What is your problem?
1652,You think you know it all.
1653,Little young Thundercats.
1654, Got joints on you?
1655, No.
1656, You smoke that shit?
1657," No, sir."
1658,You trying to get my daughter high?
1659,Do you smoke that shit?
1660," Nigga, who that is at the door?"
1661, It's Reggie.
1662, Who the fuck is Reggie?
1663, Came to take Megan out.
1664," What you want, nigga?"
1665, I'm here to take his daughter out.
1666, What's your name?
1667, Reggie.
1668,I heard the motherfucker say your name Reggie.
1669,You taking Megan out?
1670, How old is you?
1671, Fifteen.
1672," Shit, nigga, you at least 30."
1673, This is Mike.
1674, Can you fight?
1675, Yeah.
1676,You can fight? Motherfucker.
1677,You can't fight. Look at you...
1678, Cut it out.
1679, I want to know if...
1680,"When somebody taking my niece out, I want to know if he can fight."
1681,"Somebody might come say something, the nigga can't fight, she can't go."
1682,"This is Megan's godfather, okay?"
1683,He just got out the joint.
1684,Why you putting all my business in the street?
1685, They call him...
1686, I got out of jail. I ain't going back!
1687,I ain't going back!
1688,What's wrong with you? You're scared. You ain't seen a gun before?
1689,Stop pointing the gun at the boy.
1690,"Look, don't you disrespect me in front of company."
1691,Let the gun go off.
1692,"Nigga, you a big, tall, Ludacrislooking motherfucker, ain't you?"
1693, You rap?
1694, No.
1695,"Hey, Mike!"
1696,"Now, listen. Have my daughter home at 10:01."
1697,"If she ain't home at 10:01, I'm in the car, okay?"
1698,"Lock, loaded and hunting your motherfucking ass down."
1699, Do you hear me? Speak up.
1700, I'll go with him.
1701,"If I'm there, know what it'll be?"
1702,"Chitty Chitty Bang Bang, nigga."
1703, That's what it'll be.
1704, Marcus!
1705,"Reggie, baby, I am so sorry. Forgive Megan's dad and his silly friend."
1706, You a virgin?
1707, Yes.
1708,Keep it that way. Ain't gonna be no fucking tonight.
1709,"Baby, the red shirt's nice."
1710,You guys have a good time.
1711, You ever made love to a man?
1712, No.
1713, You want to?
1714," No, sir."
1715," Hey, have a good time, baby."
1716, Go. Go.
1717, All right.
1718, I need to go.
1719,That was cool.
1720,So you ready to bust this case open?
1721,"Oh, yeah. Let's finish strong."
1722,All right?
1723,"All right, ladies. We cannot take a burn tonight or Tapia walks."
1724,"I need a good, clean breakin."
1725," Zank, eyeball."
1726, Eyeball set.
1727," Dex, high ground."
1728, Rooftop set.
1729," Fanuti, light your crack pipe."
1730, Got you.
1731,"Lockman, you buzzing?"
1732,"We're up, baby."
1733," Hello, anybody home?!"
1734, We got a stiff to deliver!
1735," What's going on here, man?"
1736, We got a stiff to deliver.
1737, Nobody told me about any stiff.
1738, The guy's in the van now. He's fresh.
1739,No deliveries tonight.
1740,They told us to come right over to the place. This is the place.
1741, We must bring him in here. I'm sorry.
1742, No one in.
1743, You get that body to the morgue yet?
1744, Morgue?
1745,You said to get it to the Spanish Palms Mortuary.
1746,"No, you dumb Latin fuck."
1747,What you smoking in that crack pipe?
1748,"Who you calling a Latin fuck, man?"
1749,Check.
1750,"There's burnt people down here, Mike."
1751,"Oh, fuck."
1752,"Damn, somebody's teeth."
1753,"Now that we're here, you need to sign some paperwork..."
1754,...because the man is very contagious.
1755,His contagiousness could touch you.
1756,You guys have a nice evening.
1757,Good night.
1758,Might you see us inside for some hot cocoa?
1759,"Cam one, I got a good signal."
1760,"Cam two, I got a good signal."
1761, Damn!
1762, Stop it. Do not do that tonight.
1763, You don't smell that?
1764," Oh, yeah, I smell it."
1765, It stinks.
1766, Stop!
1767,I'm gonna have some Pepto.
1768, This dude hasn't been embalmed yet.
1769, What you talking about?
1770,They stick a tube down your throat and just suck out all the gunk and bile.
1771,"Because what happens is, your body'll get gaseous and you'll decompose."
1772,Don't want that to happen before your family see you.
1773, I don't need to know that now.
1774, They sew your mouth closed.
1775,They got to get it all out because a lot of times dead people'll fart.
1776,That shit'll clear a funeral home out.
1777, How do you know all that?
1778, Learning Channel. That shit got me.
1779,"Oh, shit."
1780,You're not even gonna warm up to it?
1781,Hey! Do some cop work.
1782, He's a human being.
1783, Check the casket.
1784,Why don't you check his spine while you're in there.
1785,I'm retching.
1786,Mike!
1787, What?
1788, Have some dignity.
1789, I ain't doing nothing.
1790, Cover her titties up.
1791,"Like, what am I gonna do with these bigass dead titties?"
1792,"But you're looking, though."
1793,There's... Something's wrong with your brain.
1794,Just cover the titties.
1795,Goddamn!
1796,Damn. This nicer than some cribs.
1797,She's going to Cuba.
1798,Who's top cop now? Huh?
1799,That's what I'm talking about. See?
1800,There you go.
1801,"That's it right there. Take a picture of the money, then check this body."
1802,"Nah, I'm gonna count these."
1803,You know?
1804,Check the body.
1805,"I'm gonna check the body, Mike."
1806,"I'm not rushing into it, that's all."
1807,This one's going to a mortuary in L.A.
1808,I'm gonna check this one.
1809,That's that bullshit that I be talking about.
1810,"Mike, the motherfucking head fell off."
1811,Come here.
1812,I'm back in the game.
1813,Think I got something.
1814,Feels like a bag.
1815,"Shit, it's his kidney."
1816,I smell dead people.
1817,Drugs and money.
1818,"We got him, baby."
1819,This dude is loaded.
1820,"Bet he thinks he's a damn genius, transporting them in dead bodies."
1821,Let's get this body.
1822,"Mike, you got company, man."
1823,Somebody's coming. Hide!
1824,Give me the X. Give me the X.
1825,You gotta stall them.
1826,Hide! Hide! Hide!
1827,Shit!
1828,Punk kids do this? Go check it out.
1829,Hide!
1830,Marcus! Why would you...?
1831,"That's just not smart, man."
1832,"You tell Theresa, I'll kill you."
1833,Bimbo's next.
1834,"Oh, God. Not that. Not the bimbo."
1835,Let's hurry this shit up.
1836,Shit.
1837,We got a big problem.
1838,We got a big problem.
1839,Drive that ambulance into the building right now.
1840, Crash it into the building!
1841," No. Not me, baby."
1842,I got too many crashes on my file.
1843,You do it.
1844,No. You're kidding. I got redflagged last month for the thing.
1845,You know how much the city paid.
1846,I can't have another ding on my file.
1847,"Mike, my man, we want to help you out here, you know..."
1848,"...but we got a couple of administration problems over here, you know?"
1849,So how about we give sirens and some flashing lights?
1850,Make a racket. How's that?
1851,Negative! Negative!
1852,Crash that ambulance into the building right now!
1853,"We want to help the team out and everything, but..."
1854,But I'm not getting suspended for this.
1855,"Okay, I plan on whupping y'all asses the second I get out of here."
1856, Crash into the building right now!
1857, Screw it.
1858,Just the price of cop business.
1859,"Now, get her on the table."
1860,"Oh, my God."
1861,Jeez! What the hell!
1862,I'm so... I'm so...
1863,"That's tragic, man."
1864,"Go, go, go. Back door's clear."
1865,Go! Go!
1866,"Get up, Marcus!"
1867,The gas got stuck. I didn't mean to.
1868,"Oh, man."
1869,"Supple leather, you know."
1870,You ever rub your leather?
1871,"You know, like, just rub it."
1872,See how good it feels.
1873,"What does love mean to you, Mike?"
1874,Don't worry about me and my love.
1875,"Look, I got plenty of love in my life."
1876,Like a woman's butt.
1877, Don't do that.
1878," Whoa, whoa, whoa. Mike."
1879,Let's just concentrate and get this warrant.
1880,I need to express right now.
1881,"I want you to know, if this is our last job, I really appreciate you."
1882,Okay?
1883,"No, this is not gay shit."
1884,This is man shit.
1885,You know what I mean?
1886,And you a beautiful man.
1887,You know?
1888,And when you let the beautiful side...
1889, What?
1890, Look at your pupils.
1891,How am I look at my pupil?
1892,"What, I'm..."
1893,"Yo, what are you taking?"
1894,Did you take some of that X?
1895," Hey, look, give me a hug."
1896," Hey, get off. Listen, listen. Listen!"
1897,We need this warrant. Do not fuck this up. Pull yourself together.
1898,"Evening, captain."
1899,Hello...
1900,"...""capteeon."" So how do you two plan to fuck up my evening tonight?"
1901,"Well, captain, believe me, we would not be here..."
1902,"...if it weren't seriously, utterly important."
1903,Get in here.
1904,Get off me!
1905,"Cap, this is beautiful."
1906,"Have such a warm feel, you know."
1907,"Sort of like a ""ving shwa."" What's it, Mike?"
1908," It was a V, like a ""von schwo.""  Why don't you have a seat?"
1909," Or ""ven wangs"" or..."
1910, Feng shui.
1911,"""Von sway."" You have a ""von sway"" home."
1912,Make yourself at home.
1913,"All right, captain, I know you said that Johnny Tapia was hands..."
1914," Oh, no! No!"
1915," Look, captain, we got him. It's a wrap."
1916,"Look, we messed up today, but we got him. Please just look."
1917, How do I move it?
1918," Here, you flip through the pictures."
1919,You can flip...
1920,You can flip through picture...
1921,This is horrible.
1922, Take the picture.
1923, You can look really close.
1924,"Listen, we got everything that we need to take this dude."
1925,"Oh, God."
1926,They're taking the organs out.
1927,Right there you can... You can...
1928,Yeah. If you look there...
1929,"Oh, gosh."
1930,This is good. That's horrible.
1931,Look at this.
1932,Everybody just needs to relax.
1933,Whoosah. Whoosah. Whoosah.
1934,"What are you doing? Marcus, it's 2 a.m. Get your hands off me."
1935,Remember we said we were gonna call Vargas and Reyes?
1936," No, I don't..."
1937, Call Vargas!
1938,Tell him the thing we said to tell him.
1939, What thing?
1940, Tell him we said... About yesterday.
1941,And tell him about the thing.
1942,"So, captain, listen, we've also got videotape."
1943,"Yesterday, we fucked up bad."
1944,But we got him now.
1945,"Oh, shit."
1946, What?
1947," No, a lot of times with these..."
1948,"Oh, shit!"
1949, What? Did I erase it?
1950, No. We got video.
1951, We got fucking...
1952, Oh. Let me see.
1953,"Oh, shit."
1954,He's shipping the drugs around the country in bodies.
1955,"We found coffins of cash, tagged for Cuba."
1956,And you think Tapia's about to move out with all this money?
1957,I love it when you call me Bunny Nose.
1958,Shit!
1959,"Yeah, I do, girl."
1960,You should see this sexy shit I got on.
1961,Who the hell are you talking to?
1962,I talked to Vargas and...
1963,...Ru... Reyes. They said that they're down for whatever.
1964,"This is a nice fish, you know."
1965,"Big fucking eyes, but a nice fucking fish."
1966,"We need this warrant, captain."
1967,Let's take this scumbag down.
1968,What the fuck is going on?
1969, He ingested X.
1970," You okay, pal? Take it easy."
1971,"Okay, thank you."
1972,Poison lady says we gotta keep him cool.
1973,"Otherwise, he's burning up, he can get brain damage."
1974,Nobody'll even notice that.
1975,"Mike, I got an erection."
1976,Take me home.
1977,"Call the wife, tell her I'm on the way."
1978,Hope you guys hear me.
1979, We got her. Loud and clear.
1980, She's in.
1981,Showtime.
1982,"Palm Mortuary, Alpha team."
1983," Tapia's mansion, Delta."
1984," Dixie Boy boat dock, Bravo."
1985,"Coast Guard gunships, anything that hits the water."
1986,We hit all three places simultaneously.
1987,Tac up at 08:45.
1988,We go hot at 09:00 sharp.
1989,Bring the noise.
1990,You're such a beautiful girl.
1991,Thank you.
1992, Johnny.
1993, Yeah?
1994, Is she a Negro?
1995," Please, Mama!"
1996,Shut up! Get out of here!
1997,"You make your bed, you sleep in it!"
1998,Make way!
1999, Get down!
2000, Don't fucking move!
2001,You take risks. I like that.
2002,Or...
2003,...maybe I'm the one taking a risk on you. Huh?
2004, Yeah?
2005, Yeah.
2006,"Excuse me, boss."
2007,We need to talk now.
2008,Something's going on outside.
2009, Cops.
2010," What the fuck do you mean, cops?"
2011,Goddamn it.
2012,"DEA. You don't plan on entering, do you?"
2013, We have a warrant to get in there.
2014, A UC's inside. She's gotta leave first.
2015,You got two minutes.
2016, Call her on her cell.
2017," Yes, sir."
2018,Cut the power to the house.
2019," You got her? Well, let's go."
2020," No, sir."
2021,We got a bogey.
2022,"God. This is for you, Josef, and me and Mother Russia."
2023,They're not gangbanger homeys.
2024,They're cops.
2025,Cops?!
2026,They weren't trying to hit the load.
2027,I think they were looking after her.
2028,"Now, you tell me..."
2029,...where is the wire?
2030, They made her.
2031,We gotta get her out. Go! Come on!
2032,"Hey, Tapia, you fucking mother."
2033,The Russian Grim Reaper is here.
2034,Everything's in here.
2035," Oh, shit."
2036, Goddamn.
2037,"Eyeball, has anything left this mortuary in the past two hours?"
2038,A fourhearse funeral just left.
2039,We trailed them to Miami Harbor.
2040,"Miami Air, Tapia's running his money to Cuba. Get us a chopper!"
2041,"Hey, Tapia!"
2042,"You scared of me, you little scumbag?!"
2043, We got some heat.
2044, Pull the car back.
2045,I'll fucking kill you!
2046,Who the hell are you?
2047, Drop the weapon!
2048, Drop the weapon now!
2049, I'm with you guys!
2050," Put it down, now!"
2051, I'm over here!
2052, Shut up!
2053, Drop the weapon!
2054, I'll kill that son of a bitch!
2055,This is Alpha. Heads up to the Coast Guard Sharks and Bravo Team.
2056,Close the harbor.
2057,Freeze any moving speedboat.
2058,This is Bravo.
2059,We got a gofast slinging a high rate of speed down Miami harbor.
2060,Stop that boat.
2061,This guy's moving us.
2062,Think we're going for the bridge.
2063,"Coast Guard, we're going in."
2064,Miami Police. Shut it down.
2065,This is the police. Shut it down.
2066," Watch out, he got a weapon."
2067, Bail out!
2068,"Coast Guard, take him down."
2069,Burn him.
2070,Vessel is dead in the water.
2071,Vessel is dead in the water.
2072,This is what we do.
2073,"Oh, man, it's full up."
2074,It's full up.
2075,It's a righteous bust.
2076,How the hell they slip away?
2077,Give me the watch commander on the horn.
2078,Do you know her brother on Miami PD? Find him.
2079,Do you know anyone who might want to save your life?
2080, Hello?
2081," Marcus, they...!"
2082,You have $ 100 million of mine...
2083,...and I want it back in 48 hours.
2084,Shit just got real.
2085,"Jack Snell, DEA."
2086,"Agent Eames, FBI..."
2087,...who has just informed me...
2088,...that satellite pinpointed Tapia's jet in Cuban airspace 20 minutes ago.
2089,Cuba?
2090,United States does not negotiate with hostagetakers.
2091,Especially Cuban hostagetakers.
2092,It's a delicate situation.
2093,This is not just a situation.
2094,This is my sister.
2095,"Off the record, all State Department agencies..."
2096,...are using their backchannel contacts for a diplomatic solution.
2097,"You know, by the time y'all finish being diplomatic..."
2098,...my sister could be in a fucking box. This is bullshit.
2099,He ain't getting away from us that easy.
2100,We ride together...
2101,...we die together.
2102,Bad boys for life.
2103,"We just gotta do it ourselves, man."
2104,I don't know you.
2105,You look like you're about to do something stupid. I'm in.
2106,Dodd tell you how crazy us exDelta guys are?
2107,"My brother, Tito, lives in Cuba."
2108,"He's a little crazy, but he's hooked up with the underground."
2109,"Weapons, men, a safe house."
2110,Whatever we need.
2111,You can forget about passports and all that stuff.
2112,"Because if the Cubans catch us, we're all dead."
2113,"My brother Tito's in Alpha 66, the AntiCastro Underground."
2114,What does that have to do with Tapia?
2115,Everything. Tapia's the biggest supplier of drug cash to Castro.
2116,So Alpha 66 will be all over him.
2117,"Brother, that is perfect. He says he can get men on the tunnel right away."
2118,Let me holler at him.
2119,"Tito, we need layout, security, the whole deal."
2120,We got info that Tapia's got a casket coming in tomorrow at 4:00 p.m.
2121,"Yeah, that might be our way in."
2122,Yeah.
2123,Brought you a little care package from my friends over at the CIA.
2124,They want to help.
2125,And don't ask me.
2126,They're spies.
2127,Former Delta Intel and Demo.
2128,Requesting permission to tag along.
2129,"Ronnie, I hear there's a boat on fire off the coast of Cuba."
2130,Shouldn't we break international waters to help them?
2131,That's my dog.
2132,Point of no return.
2133,I want to thank y'all from the bottom of my heart.
2134," Mike, look, I just..."
2135, Tell me when we get back.
2136,The target's in sight. I see the boat.
2137,Roger. Target 12 o'clock.
2138,Roper in the door. Stand by.
2139,Go! Go! Go!
2140, Tito?
2141, Welcome to Cuba.
2142,Damn. What's up with the safe house across the street from Tapia's crib?
2143,This is the last place anyone would look.
2144,We've been watching the place.
2145,Guards play soccer each day at 3:30.
2146,"The bad news, everyone knows he uses the army like his bodyguards."
2147, This is Tapia's compound.
2148," CIA hooked us up, huh?"
2149,Yeah. This LIDAR laser technology even shows his escape tunnel.
2150,The alarm security is wired to the army.
2151,We're screwed if we don't blow up this security room before we make a move.
2152,The tunnel we're digging branches off.
2153,One under his back yard and the other into his escape tunnel.
2154,We gotta hurry up.
2155,See? I told you my brother was a maniac.
2156, How we looking?
2157, Let me check it out.
2158,"Papi, you look like Jesus."
2159,Why they call this The Last Supper?
2160,It was the last time they were all together before Jesus was crucified.
2161,Crucified?
2162,"Hold your ears. Hey, you."
2163,Listen to me. This is fucking depressing! You understand?!
2164,"I mean, who had this fucking idea?"
2165,I just want little angels looking down on me.
