,dialog
737,"You just remember one thing, my friend. I may not always be here."
738,"What's up, Icepick?"
739,"Jesus is the way, my brothers."
740,Step inside.
741,You just went number one on Uncle Mike's shit list.
742," We got two lousy bags, man."
743, My brothers.
744,Haitian blond with dreads.
745,Where is he?
746,Blondie Dread?
747,He's very expensive.
748,You and you have to do something for me.
749,"Oh, you trying to get gangster on me like that?"
750," Yeah, he went gangster."
751, So we should probably...
752, So we want to do the... You got them?
753," Yeah, sure."
754,"Me and my partner, we're on the Miami PD tandem dance team."
755,We got a routine.
756,We won all the local talent shows.
757,We thinking about going national.
758,You want to show him some of the routine?
759,Warm it up. Don't hurt nothing.
760,"Yo, yo, watch this. Watch this."
761,This the shit right here.
762,This is the shit.
763, What you doing to my shop?!
764, Watch this spin.
765,Wait.
766, What are you doing?!
767," Oh, give me some."
768,You're ruining my shop. Stop!
769, Do the dance thing.
770, I'm gonna bring the house down.
771,Stop! Stop!
772,He lives in a pink house eight blocks from here on Carl Street.
773,One...
774, Police! Get down.
775, Police!
776,Who that? Who in my house?!
777," I'm the devil, who's asking?!"
778, The devil is not welcome here!
779,You got to call yourself the devil in his house?! Shit!
780,You're in my house!
781,This is all your fault!
782," You're in my country, though."
783," Fuck you, how's that?"
784," I'm gonna kill you, motherfucker!"
785," Your country, my ass!"
786, Fuck you.
787, Fuck me? Fuck you!
788,You no problem!
789,"Mike, do you have to be so combative?"
790,Fucking...!
791,You calling me a bitch?!
792,"Do or die, man!"
793,A bullet in the head'll really mess up your extensions.
794,"Take your bullet and eat that shit, man."
795,How about that?
796,What the fuck?
797,"Sir, we just want to talk."
798,"You want to talk?! Well, go ahead."
799,Go ahead.
800,We're not immigration.
801,They can't hear you because they're still shooting at you.
802,Fucking Haitians in a fucking littleass room...
803,...with fucking guns. Shit!
804,Got to make it home to my babies.
805,"Damn, now."
806,Motherfucker! You killed my brother!
807,That's a bitch!
808,Shoot them. Fucking shoot them.
809,They shot me.
810,"They got me, man. Yo!"
811,Got you.
812,"Oh, shit! Motherfucker!"
813,They killed the boy!
814,They kill me!
815,They're killing everybody!
816,Motherfucker!
817,My eyes!
818,"I'm gonna kill you, motherfucker!"
819,"Come. Come kill me, motherfucker."
820,Come. You don't take me alive.
821,You got three seconds to drop your weapon!
822,I got a present for you!
823, A nice present for you!
824, One!
825, Two!
826, I'm gonna kill you.
827,"Don't shoot. Don't shoot, man."
828,Don't kill me.
829, Bullets and all... Excuse me.
830," You all right, man?"
831,Apologize to that man.
832,Apologize to that man.
833,Apologize! Apologize.
834,"Hey, listen, I owe you..."
835,"It's just that, you know, you was disrespect..."
836,"But that don't mean it give me the right, though. It don't."
837,Excuse me. Whoosah. Whoosah.
838,"Whoosah, motherfucker!"
839,"See, the interesting thing is he's the one of us that's not pissed off."
840, I don't know nothing.
841, I didn't ask you no question yet!
842, I don't know nothing.
843, Lying already?
844," No, get..."
845, How'd you know about the drop?
846, I don't know nothing!
847, Stop lying!
848,Do you know anything?
849,I'm gonna be nice about it.
850,Do you know anything?
851,Let's ask some other suspects.
852," Hey, look, man, fuck it."
853, Let's try this. Let's talk to his homeys.
854,"Hey, look here, man."
855,Can you tell me who was driving the black Suburban?
856,"Oh, he don't know nothing."
857,His brains is under the end table.
858,"He can't tell us shit, Mike."
859, He's all fucked up.
860, What's your point?
861,Dead suspects can't say shit.
862,"It seems like live suspects don't say shit either, so I'll hot this dude here."
863, Save us the paperwork.
864, I don't know nothing!
865,"I don't do motherfucking surveillance, man. He do surveillance."
866,He don't let nobody touch his camera.
867, What's on that camera?
868, Trigger Mike strikes again.
869,"Hi, welcome to Phat's."
870,How can I help you?
871, Miami PD.
872, Whoa. Cops. I love that show.
873, We need to see what's on this video.
874, Absolutely.
875,You got a little bullet hole in there.
876,You guys tell me about it?
877,Guess not. We'll put this in our central floor model.
878,It has kickass bass.
879,You like hiphop? I love it.
880,"We freestyle in the break room. If you guys ever want to kick it, we'll flow."
881,We're gonna set you up on the widescreen. Correct ratio.
882,There you go.
883,"""Spanish Palms Mortuary."" Why would they be doing surveillance at a funeral home?"
884,Is that a Cuban flag?
885,Right there. See the gun?
886,Never knew guards at funeral homes needed to carry them kind of weapons.
887,It just seems like we should turn it off...
888,...because my dad owns the store.
889,She got a tongue ring.
890, This is like a porno. We're not...
891, Dude. Dude.
892, All right?
893, Yeah.
894,Okay. Okay.
895,"It's just, you know, my dad's gonna be..."
896,I just need to... I think I...
897, I think I screwed this up.
898, Relax.
899, My dad's gonna... This is like a porno.
900," Oh, yeah. I want more."
901, Okay.
902, This is official police business.
903, What the fuck's going on here?
904, Out of my way.
905,My dad is coming.
906,My dad is coming.
907,What the hell is going on in my store?
908,"Son, how did this porno crap get on my videos in my store?!"
909,What the hell is going on in here?!
910, You all right?
911," No, I'm not all right, Mike."
912,Three days of this shit.
913,Got my nerves all rattled.
914,My ass still hurts...
915,...from what you did to it the other night.
916,"Oh, my Lord."
917,"Yeah, it got rough."
918,You know?
919,"I mean, we got caught up in the moment, shit got crazy."
920,You know how I get.
921,"When you popped me from behind, I think you damaged some nerves."
922,Okay.
923,"Now, I can't..."
924,"I can't... Now, I can't..."
925, Can't what?
926, I can't even get an erection.
927,What's an erection?
928,"I tried taking Viagra, you know, pop one, pop two."
929,Been eating them like Skittles.
930,That poor man is pouring out his heart.
931,And I'm still flaccid.
932,Okay. I'm comfortable talking to you...
933,It's got 5.1 Dolby.
934,...about what I did to your ass...
935,...but you not getting an erection...
936,...that's a real problem for me.
937, I just figured I could talk to you.
938," Yeah. No, no."
939,"We're... We partners, but we are partners with boundaries."
940,We got a new rule.
941,"From now on you can't say the word ""flaccid"" to me."
942,He's a mean fuck.
943,Look here.
944,This is our little boundary box.
945,"So we gonna take the word ""flaccid""..."
946,...and we're gonna put it in there with my mom's titties...
947,"...with your erection problems, and we're gonna close this box..."
948,...and we're gonna throw this bitch in the ocean.
949,And the only way that you can get to this box...
950,...is you got to be motherfucking Jacques Cousteau.
951,We cool?
952,"Oh, shit."
953,We gotta go.
954,In front of my babies you got porno and homo shows up in here?
955,What kind of freakass store is this?
956,And you two motherfuckers need Jesus.
957,"Cover your ears, baby."
958,"Palm Mortuary, owned by an offshore holding company..."
959,"...which, after 17 layers of bullshit..."
960,...turns out to be registered to Donna Maria Tapia...
961,"...mother of Hector Juan Carlos Tapia, who calls himself Johnny."
962,Johnny Tapia. Shit.
963,Every time the PD goes after him...
964,...he sues for wrongful arrest.
965,"And, oh, does he win."
966,Last year he was awarded $9 million.
967,And got a dozen dumbass officers like you fired.
968,"Well, he hasn't run across us yet."
969,We'd love to hear what's going on in that house.
970,Use your computer brain and tap the phone.
971,"Well, that happens to be highly illegal without a judge."
972,We were thinking of something more along the lines of a training operation.
973,"No, I can't do that."
974, Get you tickets to the Heat game.
975, I need floor seats.
976,With thickass glasses you don't need floor seats.
977,He can see the game from the parking lot.
978, I can't work under these conditions.
979, Floor seats to the Heat. You got it.
980, Lakers.
981," Yes, Lakers."
982,Okay. Watch me work.
983,Hello? Is this the pest control?
984,Yeah. We got a fucking problem.
985,You know where we live.
986," Yeah, South Miami."
987, We got it.
988,Got our way in.
989, Illegally?
990, You got to put a word to it.
991,"It's like, secret."
992,So y'all want to kill roaches?
993, Illegal.
994, We'll plant a couple gypsy wires...
995,...find out what Tapia's up to.
996,These are your basic household bugs.
997,"Dog, this is what we do."
998, What's the sprayers for?
999, The roaches.
1000, Roaches? We got rats.
1001, Say what?
1002,That's not an issue.
1003,We can handle that.
1004,We'll just have to slightly adjust our approach a little bit.
1005,Nope. Nope. I don't mess with no rats.
1006,Hey. Stop it.
1007, We're in. Get your head right.
1008," Mike, I'm a grownass man."
1009,Get your grownass self together and let's do this.
1010," You got a beautiful house, sir."
1011," Well, start looking."
1012,They're all over.
1013,Those ain't normal rats.
1014,What he means is that they're obviously a special breed.
1015, What kind of breed are they?
1016, Big motherfuckers.
1017,Disposing of the rats isn't a problem.
1018,But we should ensure there's no breeding elsewhere in the house.
1019,"Yeah, at Zook..."
1020,"...we like to work from the outside in, you know."
1021,So we gonna leave these...
1022,Excuse me.
1023,We'll leave these here and send in a special unit.
1024,It'd be better to begin in the rest of the house.
1025,You're not getting in the rest of the house.
1026,We won't be able to guarantee our work.
1027,The only thing that we can guarantee...
1028,...is that these rats will keep fucking.
1029,Giving off offspring until we find the colony.
1030,Rats don't got no stinking colony.
1031,"Well, actually these are colonial rats."
1032,What they do is they send out worker rats that are called...
1033,Marsupials.
1034,Marsupials.
1035,"These drones, they're explorers of the rat world, you know."
1036,They just looking for rat pussy.
1037, You know.
1038, Are you fucking with me?
1039,Hold on. You called us.
1040,We can leave.
1041,But what you should understand is that these rats will hump twice a day.
1042,All right. Down there. Just kill them and bring me the bill.
1043,That's that bullshit.
1044,That's that bullshit right there.
1045, You see these rats?
1046, Plant your wires.
1047, You're not leaving me with them.
1048, Plant your wires.
1049,"Gentlemen. Alexei, Josef."
1050,"Oh, I really like that word, Johnny."
1051,"""Gentlemen."" I'm just trying being civil."
1052,"This is business, we can all relax."
1053," Alexei, would you like a Cohiba?"
1054, Why not?
1055,Of course. And you? Josef.
1056,I'm told you're a wine connoisseur.
1057,I am.
1058,"Carlos, have Josef pick a wine and Alexei and I will have a cigar. Come."
1059, Where the fuck you going?
1060, Pretty bad problem you got here.
1061,"I'm gonna head down to the truck, get some poison pellets and stuff."
1062,Come straight back.
1063,No screwing around.
1064,They're all over.
1065,Nice place you got here.
1066,It's Mama's. And it's a shithole.
1067,Built a fucking million years ago.
1068," Expensive shithole, eh?"
1069," Oh, no."
1070,My new place I'm building in Cuba.
1071,"Esto va a set tremendo, brother."
1072,Almost finished. Everything fucking shiny new. Come on upstairs.
1073,"Oh, shit."
1074,"Oh, shit! Look at the balls on that motherfucker."
1075,Roberto...
1076,...the general's office camera is out.
1077, Everything in this house is broken.
1078,My wire's planted.
1079, How about yours?
1080, Almost got three wires planted.
1081,Mike!
1082,There's a papa rat humping the shit out of this mama rat.
1083,"No, he's straight piledriving her!"
1084,"Now, how is that information gonna help me do my job?"
1085,They fuck just like us.
1086,Where's the pest guy?
1087,There's something going on down here.
1088,Goddamn rats.
1089,"Yeah, they everywhere."
1090,Just like cockroaches.
1091,No disrespect...
1092,...but I do not wish to talk business until my partner return.
1093,It's baffling. You secretly decide to pay me less and you talk about respect?
1094,"Let's wait for Josef. You know, me and digits."
1095,"Carlos, could you bring Josef in?"
1096,So...
1097,...your partner is here.
1098,Would you like to talk now?
1099,"Carlos, another box."
1100,So you sign over ownership papers for all the Florida clubs you own...
1101,...and I will control everything...
1102,...from point of origin to sale. Okay?
1103,No middleman. Especially Russian middleman.
1104,"With all due respect, Mr. Tapia..."
1105,"...in my country, I see such things all the time."
1106,I'm sorry for your country.
1107,That must be some Cuban stupid tradition to put them in a tortilla bin.
1108,"Now, listen to me, you Russian punk."
1109,"I, me, Johnny Tapia, will sever your head off!"
1110,You kill me and you will have a shitstorm.
1111,Should I screw your young wife...
1112,"...or visit your son, the soccer player?"
1113,My daughter knows your son.
1114, You're gonna regret this.
1115, I hope that we can remain friends.
1116,"Because at the end, what else do we have but friendship, trust..."
1117,...honor.
1118,"Without this, we are no more than beasts."
1119,The kitchen monitor's out.
1120,What the hell's going on out there?
1121,Shit.
1122,I found something.
1123, It's a guy's finger.
1124," What, did the rats eat the rest of him?"
1125, What the fuck are you doing?
1126," Hey, I was just looking for you."
1127,I think I figured out your problem.
1128,Y'all a bunch of filthy motherfuckers.
1129,Blow out!
1130, What's going on? Shit!
1131, Get out of the house!
1132,This shit's got to stop.
1133,Fuck!
1134,We should go.
1135,Go! Go!
1136,Just another day with Mike Lowrey.
1137, Damn! Go!
1138, Come on!
1139,Roberto thinks they were the gangbangers...
1140,"...that tried to hijack the drop, boss."
1141,How did this thing happen?
1142,I don't know. We called the rat people and these guys showed up.
1143,"Maybe you're the rat, huh?"
1144,"They tried to steal from me, and you let them into my mother's house."
1145,"Johnny. Hey, no."
1146,I would never...
1147,"Nobody puts in danger my daughter, my mother..."
1148,...or my money.
1149,Send him to the mortuary.
1150,"Johnny. Johnny, what happened to Roberto?"
1151,"He killed himself, Mama."
1152, Very sad.
1153, Write a nice letter to his mother.
1154,I'll do it.
1155,Okay. Bye.
1156," Yo, run the print."
1157," Mike, stop playing, man!"
1158, Run the print.
1159, Don't touch me with no dead finger.
1160,"Excuse me, run this print."
1161,I need to find the owner.
1162,Thank you.
1163,Think you can find out what's on these shreds?
1164,Of course.
1165,We're thinking about ordering lunch.
1166,Should we put you down for some extra crispy and a couple of grape sodas?
1167,"""Couple of grape sodas.""  Very funny. That's hilarious."
1168, Isn't it low tide?
1169,I think it is.
1170, Don't you have relatives to pick up?
1171, What?
1172,"Yo, now you crossed the line, man."
1173,"Okay, no, that's not funny."
1174,"We're fucking with you. We planted wires, we need some help. No bullshit."
1175,I want you...
1176,...to find out...
1177,...who those two black puta de mierda are.
1178,And I want them lying right here...
1179,...in Mama's garden in these coffins!
1180,And our mystery finger belongs to: Josef Kuninskavich.
1181,He was a lieutenant in a Russian mob.
1182,Owned a couple dozen Florida nightclubs.
1183,Tapia's starting to knock off Russian mob bosses.
1184,Got something.
1185,"What you got, dickhead?"
1186,"The computer matches half tones, gray tones, densities."
1187,Sort of like a visual codebreaking.
1188,Little something I put together.
1189,The shredded papers was a photo.
1190,"Some kind of boat. ""Dixie 7."" Dixie 7."
1191, It's registered to a one Floyd Poteet.
1192, The Poteet brothers.
1193,One of the KKK guys we busted.
1194,"You blew his ear off, remember?"
1195,"Mike, can you teach me how to shoot people?"
1196,Listen to what we got at Tapia's.
1197,The secondincommand is talking.
1198,"He's telling him, ""Yes, boss. We found a bunch of fat doe fuckers..."
1199,"...and we're getting them emptied.""  Fat does emptied?"
1200, The hell does that mean?
1201, He has a meeting this afternoon.
1202, You know who I am?
1203, Name sounds familiar.
1204,Sense of humor. I like that.
1205,"Meet me on the sand,  She has no idea. Let's roll."
1206, Y'all come with us.
1207,I ordered a couple of Bacardi Mojitos.
1208,Miami.
1209,"Okay, zoom in on nine."
1210,"A little more audio, please."
1211,"So, why don't we take a swim?"
1212,Cool off.
1213,Or we could just stay here and get drunk. How about that?
1214,Or we could drink this later.
1215,Unless you have a reason...
1216,...why you don't want to get that beautiful body of yours wet.
1217,Why not just ask if I'm wearing a wire?
1218,I'd rather go swimming.
1219, What the hell's he doing?
1220, Son of a bitch.
1221,Shit. He's taking her into the water.
1222,This guy's smart.
1223,I want you to work for me. Why waste time on this unnecessary talking?
1224,It's very unnecessary. What do you need with another banker?
1225,For the same reason as your previous employer.
1226,But now I own all the Russian clubs.
1227,No middleman.
1228,I'm about to be the biggest importer and distributor of X in North America.
1229,You're gonna be a very rich young woman. That's why I thought...
1230,"I know what you thought, Mr. Tapia."
1231,As long as you don't think it more than once...
1232,...I'm happy to be in business with you.
1233,All right.
1234,Let's do business.
1235,"What are you, a cop or a model?"
1236,What do you mean? I threw something on. I like looking good. What?
1237,For who?
1238,Don't hate the player.
1239,Hate the game.
1240,I hate the tailor.
1241,Good job. We'll get him.
1242,Your brother would love to talk to you down the street.
1243,"Whoa, what's going on?"
1244,You trying to blow my case or you just insane?
1245,You're the one taking a dip with the Cubano maniac.
1246, How'd you know that?
1247, We had a wire in the house.
1248, You two have a warrant for that wire?
1249," Look, fuck that, okay?"
1250,"You don't know the kind of danger that you're in, Syd."
1251,I am fully aware and I am fully capable of what I am doing.
1252,I am not your baby sister anymore.
1253,For the DEA you ain't nothing but a honeypot.
1254,What'd you just say?
1255,"That's why you got the job, because you look good in a bathing suit."
1256,"All right, let's sit down somewhere."
1257,"All right, look, Syd, there's some shit you need to know."
1258,Johnny Tapia is cutting up Russian mob bosses in his mom's kitchen.
1259,"In the kitchen, Syd."
1260,He found a severed finger by the crock pot.
1261,You're about to be in the middle of a drug war.
1262,Miami PD has arrested this guy Why don't you just hang back and let us bring him down?
1263,"Guys, look, I need this, okay?"
1264,And I am this close.
1265,"What's ""this close""?"
1266,I'm in charge of money laundering for his entire operation.
1267,In a month or two we'll have enough for a conviction and it'll be over.
1268,What about a day or two?
1269,Sound better?
1270,Marcus and I think we found the key to Tapia's whole operation.
1271,"You have nothing to say now, huh?"
1272," Just stuck, right?"
1273," Okay, timeout, y'all. Damn."
1274,We got this peckerwood that'll put us down...
1275,...with the transport end of Tapia's operation. Do you want in?
1276, Why would you...?
1277, When?
1278, Tonight.
1279, Page me.
1280,Should I bring my thong?
1281,Get your bitch hands off.
1282,I'll knock you the fuck out.
1283,"Mike, we're trying to keep her out of trouble, man..."
1284,...not invite her in.
1285,"Man, I just figured, you know, if she with us..."
1286,...that's just less trouble she could get into.
1287,"I'm gonna keep it real with you too, man. I think she can handle herself."
1288,I'm gonna keep it real with you.
1289,Don't nobody know my sister like I do.
1290,"Okay? She doesn't make good choices, Mike."
1291, She's not streetsmart.
1292, Doesn't make good...?
1293," Like, what kind of choices?"
1294," Men, for one."
1295,She's attracted to these dumb...
1296,"...flashy, just musclebound dickheads, Mike. You know?"
1297,Cock diesel motherfuckers that can't even fucking turn to wipe their ass.
1298, You feel me?
1299, Yeah.
1300,You know? Just dumb as a bucket of shrimp.
1301,Yeah. Yeah. That shit's crazy.
1302,"I mean, you don't think maybe you..."
1303,"Maybe you didn't, like, get a chance to know any of them?"
1304,I'm gonna give the next one a chance.
1305,A chance to whup his ass.
1306, Whup the shit out of him.
1307," Oh, you gonna fight him?"
1308,What I'm gonna do ain't even gonna be legal.
1309,I might be up in here with these motherfuckers.
1310,Do you know what I mean?
1311,The fuck you looking at?
1312,Thank you kindly.
1313,Thank you kindly.
1314, Who sprung me?
1315," Hey, Cousin Floyd."
1316," Oh, you."
1317, Remember me?
1318,Cheese.
1319,Y'all look great together.
1320, What the fuck you doing?
1321, Just a little insurance.
1322,You gonna help us find Dixie 7...
1323,...and tell us what that boat has to do with Johnny Tapia.
1324, I ain't no snitch.
1325," Oh, you ain't no snitch?"
1326," Oh, damn. That's a shame."
1327, Know what I'm gonna do?
1328,I'm gonna send a special 8 x 10 to his KKK buddies back in jail.
1329,"You know what, it's a digital photo too."
1330,So we can do whatever we want to do with it.
1331,By the time we get done with you...
1332,...you gonna be in the next Busta Rhymes video on BET.
1333,Tuck ass.
1334,I got my rights.
1335,I'm worried. There's too much heat around in Miami.
1336,I can feel it. I can feel it.
1337,We need to put my money in coffins to Cuba faster.
1338,You should tell the mortuary to speed things up. All right?
1339,That's the channel marker way out there.
1340,"They make the drop mostly at dawn, but there'll be one today, though."
1341,"Syd, you talk to Mama?"
1342,She's got hives.
1343,"Oh, and I told Mama about your Cubano boyfriend."
1344,He ain't invited to Christmas dinner.
1345,Change the station.
1346,"More music, less Marcus."
1347,If you open the door he'll be a black Dr. Phil for the next 40 minutes.
1348,"Syd, you might not want to get too flirty with Mike."
1349,Your boyfriend might cut off his trigger finger.
1350,Maybe Mike's been flirting with me.
1351,Did you ever think about that?
1352,Trigger Mike?
1353,Not like this. Don't play with that boy.
1354, Seriously. Don't play with that boy.
1355, Just tell him about New York.
1356, Do it.
1357, Tell me what?
1358,"Oh, shit. Is he walking down the steps?"
1359,"Oh, shit. He coming down."
1360, It's okay.
1361," Yeah, you done fucked up."
1362,You done fucked up.
1363,You remember...
1364,Remember I went to New York?
1365,You remember?
1366,And...
1367,"...I said, ""Syd."" I ran in..."
1368,Syd ran into me in New York on the street in that place.
1369,"And I said: ""What's up?"" And we was hungry, so then..."
1370,...she had fish.
1371,It was grouper.
1372,And then I had some chicken.
1373,Remember I was supposed to come home?
1374,But I didn't.
1375,We went out on a date.
1376,"Five, actually."
1377,Now we're seeing each other.
1378,Hold up.
1379,"You know, really out of respect for you, Marcus, nothing happened."
1380,"Hey, Mike, why you tripping, man?"
1381,"I mean, we wanted to make sure you was cool with it."
1382,"Doesn't matter what I think, you know."
1383,"Hey, I had to find out like this, right?"
1384,Don't matter.
1385,"Let me ask you, y'all gonna have babies? Little bunch of mini Mikes?"
1386,"Bunch of little lying, violent motherfuckers?"
1387,"Marcus, nothing happened."
1388,"I just want to say, Mama's gonna be thrilled."
1389,"All right, you know what, you need to ""whoosah"" or something for a second."
1390,"Hey, here comes the Dixie 7."
1391,Whoosah.
1392,Just leave it alone.
1393, Why you acting like that?
1394," Go on about your business, man."
1395, We gonna talk about this.
1396, No. Get out of my face.
1397, I'm trying to talk to you.
1398," Get the fuck off me, Mike."
1399,"What the hell is your problem, man?!"
1400,Why you acting so stupid?!
1401,This is a dysfunctional partnership.
1402,That's why I'm acting like that.
1403, You know...
1404, There ain't no trust.
1405,I didn't lie to you!
1406,I was waiting for the right time to tell you. But that ain't your issue.
1407,Why don't you bring it to me real.
1408,What is your problem with this?!
1409,"You know what? You a dog, man."
1410, That's it. There it is. I said it.
1411," Oh, okay."
1412,You like a pit bull with that little pink thing hanging out.
1413,"Oh, it's like that."
1414,"Oh, okay."
1415,I'm not good enough for your sister.
1416,"Guys, enough. The boat's coming."
1417,Okay. We gonna handle that shit.
1418,"Go ahead, man."
1419,"In about an hour, the drop boat's gonna come."
1420,We got them.
1421,Wonder what mortuary that coffin's going to.
1422,Keep going straight by.
1423,You seeing what I'm seeing?
1424,Get the load to the mortuary and don't screw up.
1425,I got it.
1426,Load up.
1427,They're getting away!
1428,Stop! Stop!
1429,We need your car. All right?
1430, Get out the car.
1431, Can't you get a better car than that?
1432,Let that man go!
1433, Don't be coming at me with that tone.
1434, Freak.
1435, Small cars don't hurt the ozone layer.
1436, That's what I'm talking about.
1437, Stop the car.
1438, Get... Yeah.
