,dialog
0,A hundred and fifty million dollars and my dope is on the way.
1,Today is gonna be a good day.
2,"We are 25 degrees north, The cargo's being dropped."
3,Good.
4, Do you want to see his gun?
5, Yeah.
6,Bang. Bang.
7,"Sorry, Johnny."
8,Fucking bitches.
9,Infrared's got a live one on the water.
10,Air Force Stallion C14 to Coast Guard.
11,We've got a fastmoving contact heading 350 toward South Florida.
12,"Captain, Air Force Stallion has a contact at 180 closing fast."
13,This is Coast Guard cutter Valiant.
14,Request to know your intentions.
15,"Vessel off our port bow, this is U.S. Coast Guard."
16,"Intercept is 180, speed 17 knots."
17,"Make it so, chief. Scramble the helo."
18,Vessel off our port bow.
19,This is U.S. Coast Guard.
20,Request to know your intentions at this time.
21,Incoming.
22,"Valiant, Valiant."
23,This is Coast Guard 6003.
24,Negative contact with target. Over.
25,"Captain, we've lost target."
26,Here's your delivery and payment.
27,Is it done?
28, Cargo is on Dixie 7.
29, Okay.
30,"All right, TNT, for the millionth time, listen up."
31,"Since 911, we've gone hitech over water. Dope runners have gone low."
32,Our source says the biggest X shipment on record arrives tonight...
33,...and we want to know who's behind it.
34,Hopefully in a few hours we'll have our answer.
35,"We'll hit from three directions: We'll go in with a water team, vehicle assault and we got guys on foot."
36,We cannot make a move until our UCs have ID'd the drugs and called us in.
37,"No call, we back away."
38,And these guys we're going after...
39,...they got a lot of firepower and they hate the law. So eyes open out there.
40,Bravo's on the move.
41,Heads up. Here comes the drop.
42,Fuck. My lens is flaring.
43,I can't see shit.
44,Brothers! Gather around!
45,Hey.
46, Why didn't you say there was a rally?
47, Who's looking?
48, Take that shit. I'm out of here.
49, Shit.
50, White power!
51, White power!
52, White power!
53, White power!
54,"Blue power, motherfuckers."
55,Miami PD.
56,"Aw, damn. It's the Negroes."
57,"Casper, drop the bag."
58,"Alpha leader, bring them in."
59,"Bad boys, bad boys What you gonna do?"
60,What you gonna do When we come for you?
61," Dude, you gotta learn the words."
62, We usually only do the chorus.
63,"Alpha leader, hit it. Br..."
64,Repeat your transmission.
65,"Alpha leader to Bravo Four, please continue relay."
66,Where's backup?
67," Alpha leader, bring them in. Hit it."
68," Mike, I'm only getting static."
69,It's all static.
70,The radios are fucked.
71, Something funny? Something funny?
72," Mike, where are they?"
73,"Got you, nigger."
74, Looks like we got us a situation here.
75, You won't shoot.
76,"You got a gun to his head, so you think I won't splatter you all over?"
77,That's what I think.
78,My partner came here tonight prepared to die.
79,"Hell... Hell, no!"
80,Incinerating trash like you.
81,"Ready to die, right, Marcus?"
82, The fuck I want to do that for?
83," Scared, ain't you, boy?"
84,"A: Put the gun down, tell me who brings this shit in..."
85,...and maybe I'll just pop one in your shoulder.
86,Or B: Keep acting all Brody and I'll put one in your chest.
87,"Or C: You know, take the time to talk a minute."
88,"You know, deescalate the situation."
89,"See, that's my partner's new spiritual bullshit."
90,Me? I actually prefer shooting motherfuckers.
91,A lot of movement going on.
92,Can't see the UCs.
93, I think something's going down.
94, Don't move yet.
95,"Mike, the man has a gun to my head."
96,He'll put it down if a hollow point's in his eye!
97,Your partner's a cocky nigger.
98," Damn. Now, was that necessary, sir?"
99, See?
100,He can't just be a cop?
101,He got to be a nigga too?
102,I'll hot this fool.
103, Calm down.
104, Calm down? I'm calm.
105,I'm calm! Hey! Whoa! Whoa!
106,I am way too unstable for that bullshit.
107,Stop all the goddamned movement!
108,Everybody stop moving!
109,"We can't let you all go, but this shit'll get worked out in court."
110,We got our rights.
111,Exercise your right to shut the fuck up.
112,I'm all right. I'll give you a warning.
113,It's the best I can do for all of youse!
114,Okay? He's crazy.
115, You got 3 seconds to drop your gun.
116, He has anger issue problems!
117, One.
118, He goes to bed early for this shit!
119,Just to wake up to pop one in a motherfucker!
120, Two!
121," Mike, no!"
122,Gun!
123,Rock 'n' roll! Let's go!
124,Kill them cops!
125,Marcus!
126,"Go! Go! Go! Go! Come on, go!"
127, Get down!
128, Drop the...!
129, I didn't do shit!
130, Get your hands up.
131,I didn't do it!
132,The radios were fucked up. Get some medics over here. You guys okay?
133," Yeah, we're fine."
134," What you mean, ""we""?"
135,"Motherfucker shot me in the ass, man."
136, Who shot you in the ass?
137," Who? That ""who"" would be you."
138, Me? I shot you?
139, Yeah.
140,"I mean, I was shooting."
141,"Yeah, I did a lot of shooting."
142,But I ain't saying I shot you in the ass.
143,I ain't saying I didn't shoot you...
144,"...but, damn! Somebody shot you in the ass."
145,Tell me about it.
146," Yo, man, how's it feel?"
147," It's hot, man."
148,I can smell my ass burning.
149,"Mike, you should give it a little kiss so it'll feel better."
150,Pretend like we're not even here.
151,"Hey, isn't Ricky Martin having a concert? Get the fuck on."
152," You always gotta go racial, man."
153," It's sad, man."
154,I think it's cool. It hit the meat.
155,It ain't nowhere near the hole.
156,Two lousy bags?
157,What about the biggest shipment of ecstasy to come out of Amsterdam?
158,"Let me worry about my snitch, all right?"
159,It's a lot of cop work for nothing!
160,Take your ass home somewhere.
161,Tonight la policia jacked my mules.
162,Who can tell me how those jackals knew where to bite Johnny Tapia?
163,"Speak up, cousins."
164,You're lucky they did not find my drugs on Dixie 7.
165,Change the boat schedule.
166,We can't.
167,We got a shipment Thursday.
168,Change it after.
169,Just keep them guessing.
170,"You know, unlike you, my daddy didn't leave me no trust fund."
171,"I got realworld shit to deal with, Mike."
172,I'm not in it for the thrills.
173,"Same old shit, different day."
174,"All right, yes, damn."
175,"I shot you, all right?"
176,But you'd be seeing nothing at all if I hadn't made my move.
177,I don't know why you acting so angry.
178, You're misinformed. I'm not angry.
179," No, you're very angry."
180,"No, I'm not angry."
181,You are angry. It's okay.
182,"I'm not angry. Except when you keep repeating ""you're angry."" That shit's fucking annoying."
183,Like a fucking gnat at a barbecue.
184,Just bugging the fuck out of me.
185,"Good. I want you to say: ""I'm angry. It's okay."
186,I'll process my anger.
187,I love myself.
188,"Whoosah."" I don't know what the fuck you mean."
189,"Yes, you do know what the fuck I mean."
190,You're the one that needs therapy.
191, I did my therapy.
192, When?
193,Capt. Howard made me do it after I shot them people at the airport.
194,Whoosah.
195,Whoosah!
196,Officer Mike.
197," Papi. That's ""daddy,"" right?"
198, Yeah.
199,Whoosah.
200,"Mike, you go to therapy to get your issues worked out..."
201,...not bang your therapist.
202," See, now you just talking nasty."
203, I gotta survive.
204,I gotta start loving me for me.
205,That sound like that group thing.
206,Maybe I did the group thing once or twice.
207,Whoosah.
208, And whoosah.
209, Whoosah.
210,"A bunch of men hugging and kissing, that's some cult shit."
211,Buy.
212,"Ignore him, doc, he's blowing this out of proportion."
213,"My ass is what's out of proportion, Mike, okay? I got a big chunk missing."
214,It's actually a small chunk.
215,This tension you bringing into this relationship...
216,...won't be healthy in the long run.
217,Maybe there ain't gonna be no long run.
218,Whatever.
219,He's seeing a shrink. I mean...
220," Icepick, Lowrey."
221," Hey, brother."
222,Two bags? You embarrassed me in front of my people.
223,"Wait, brother. No, no, no, brother."
224,"Wait, wait, wait, wait."
225,Whatever. You better pray to whoever it is you pray to...
226,...because you got 24 hours to find that X before I find you.
227,The cops hit my mule.
228,"Well, Mr. Tapia, I don't know where the heat is coming from."
229,"It's a delicate situation for both of us, isn't it?"
230," I'm telling you, I've checked them."
231," Alex, look. A guy's OD'ing."
232,"I'm sorry, I gotta hang up."
233,Some fucking punk thinks he can die in my club.
234,Ecstasy fucks them up.
235," Get him out of here, Josef."
236, We'll dump him around the block.
237,Dump him.
238,"Auntie Syd, it must be so cool."
239,"Young, single, living in New York."
240,Probably hook up with a lot of cute guys.
241, Just like Sex and the City.
242," Theresa, cancel the damn cable."
243,"So, Auntie Syd, you're a cop too, huh?"
244,"Sort of. I work for the DEA, but I just push a lot of papers."
245, Nothing exciting.
246," Well, you keep pushing papers."
247,Don't have to worry about my little sister fighting crime.
248,Okay?
249,Possibly getting hurt.
250,James. Get my screwdriver.
251,Damn bolts.
252,Ignore him. He's being mean because he got injured.
253, Are you okay?
254, His wound is fine. It's...
255,...other things that were affected.
256, Theresa!
257, What?
258,"You... It's just nerve damage, that's all."
259,Y'all not gonna spoil it.
260,I'll talk to you about it.
261,It's a donut.
262,It's a medical thing.
263,I got it from a maternity store.
264,"You know, pregnant women use it."
265,They can put one cheek here.
266,It take pressure off the other cheek.
267," For you, dog."
268, Thoughtful.
269,"Look, man..."
270,...last night there was something different in your eyes.
271,"You know, Mike, I had an epiphany."
272,You know?
273, I realized you're an enigma.
274," Yeah, I could see that."
275,God sent you here to test me.
276,But guess what?
277,"You not gonna break me, Mike. No."
278,Whoosah.
279,Is that Syd?
280, That's Syd.
281, Now's not a good time.
282,"Mike, listen, now's not a good time."
283,"Hit me, hit me, hit me."
284,No throwing balls in the house.
285,Whoosah.
286," What's up, Theresa?"
287, Hey.
288,"Aw, they ain't tell me it was a luau."
289,"Syd, hold up. Hold up."
290,Hold on.
291,"Behave yourself, girl. Hey, hold up."
292,Hold up. Hold up.
293,"Oh, look at you. Look at you."
294,"Oh, okay. Okay. I see now."
295,You didn't tell Marcus about New York.
296, He knows about New York.
297, About us? You told him about us?
298,"No, he knows about New York."
299,"You know, it's a nice city and that I dropped a witness off last month."
300,Mike is so sweet.
301, So sweet he make your teeth rot.
302, So have you told him yet?
303,"Baby, soon, okay? Real soon."
304,He needs to know you're transferring and won't be his partner anymore.
305,"Theresa, timing is everything."
306,Marcus is not very happy with me right now.
307,"No, no, Syd, I'm telling you, that is Scarface limping around in there."
308,We need to give that boy a few minutes to let his butt heal up good.
309,We like each other.
310,What's the big deal?
311,"I'm just gonna go tell him right now, because this is dumb."
312,Hold up. Hold up. I'm gonna tell him.
313,It ain't like I won't tell him.
314,How am I not tell him?
315, When?
316, I need a minute.
317,Straight up. We're not vibing right now. I just need a minute.
318,"Mike, he's my brother, okay?"
319,"Don't be scared. Toughen up, chief."
320,Whoa. Hey.
321,"Hey, I ain't say I was scared."
322,Just... There's something wrong with your brother.
323,"So, Mike, I understand you were in New York last month."
324,"Yeah, I was..."
325, Remember I did the thing?
326, No.
327,You remember?
328,The two of you should've gotten together. That would've been nice.
329,I never told you Mike was in New York.
330,"Well, you know what, Mike?"
331,"Syd, she's gonna be in town, what, another week?"
332,Why don't you show her around?
333,That'd be nice.
334,That would be so great.
335,"Yeah. Yeah, I could..."
336,"Well, me and..."
337,"Marcus, you want to show her some stuff?"
338,"Yeah, because I'm in town on vacation."
339,I'm staying at the most amazing hotel.
340,"The view, the pool. Oh, my God."
341,We got a pool right here.
342,"That ain't exactly a pool, man."
343,That's like a bigass puddle wrapped in blue plastic.
344,Didn't they have any good pools when you bought this one?
345,"Megan, that pool cost $3900."
346,"Okay, so how much do the good pools cost?"
347," It's all right, baby."
348," It is kind of whack, huh?"
349,I gotta go meet somebody.
350,"It was nice seeing you again, Mike."
351,Nice... Good to see you.
352,Where you going?
353," Bye, sweetie."
354, Bye.
355,I thought you were on vacation.
356,"So glad you could join us, Mike."
357,"I'm telling you, spending time like this make a partnership strong."
358,"Mike, can I see you by my stupid pool?"
359,"What's the deal, baby?"
360,"Why you gotta always come over here and try to take over, Mike?"
361, What are you talking about?
362," This is my family, man. Okay?"
363, What are you talking about?
364, My place of peace.
365,Are you taking medication?
366,"You taking medicine for the thing, right?"
367, What'd I do?
368, Forget it. Just forget it.
369, What'd I do?
370, Mason. Go fetch.
371,"Oh, shit!"
372,"Now, that shit is funny."
373,That's some funny shit.
374,"Oh, man, hold up."
375,"Yo, Lowrey, you hot."
376,Thirtynine hundred dollars.
377,Thirtynine hundred.
378,"You better pray to God you right this time. Yo, dry off, sweetheart."
379,Icepick said the Haitian Zoepounds about to do a rip. Let's move.
380,"All right, guys, smarten up."
381,Talk to me.
382,"Eyes on, agents. Good luck."
383,This is 105.
384,They're backing in.
385,I got a good look.
386, We got a good eyeball.
387," All right, we're in."
388,What's up?
389,You come highly recommended out of New York.
390,You did some good jobs for our Russian crew up there.
391,How old are you?
392,Old enough.
393,Come on. If you want to move this stuff you gotta do it quick.
394,"Wow, nice getup. You can start to run these through."
395,I'd like to see how your machine works.
396,"Ooh, that sounded dirty."
397,"""I would like to see how your machine works, baby."" I wouldn't be so crude."
398,"I mean, I'm more of a refined kind of a human being."
399,You follow ballet?
400,Three of my cousins are dancing with the Bolshoi Theatre in Moscow.
401,I like hippiehop too.
402,I gave you 5000.
403,You gave me 4900.
404, I gave you 5000.
405, 4900.
406, 5000.
407, Count it.
408,"If you want to fuck with me again, find yourself another chump."
409,Okay.
410, How much?
411, Three.
412,Look at this. Money everywhere.
413,Clean it up.
414,"Okay, we want to change a little over $3 million, all right?"
415,How many jobs did you do with my friends up there in New York?
416,Quite a few.
417,How you behave with me has consequences for a lot of people.
418,"You found me, not the other way around."
419,You need me to change small bills to large ones and deliver to a third party.
420,I bet he'd like his money in a timely fashion.
421,"Delivery's late, it's your ass, not mine."
422,"Here's 50,000 in 100s for your 50,000 in 10s."
423,Third party takes his million in these five briefcases here.
424," I hope I'm not losing you, chief."
425, I hate math.
426,So for your $3 million that we shrunk for you...
427,...you get 2 million in clean money back.
428,"Less our percentage: $300,000."
429, I'll be delivering these to your dealer.
430, Alexei.
431, What?
432, We're giving too fucking much away.
433,We take all the risk.
434,And our suppliers take too much of our profit.
435,"Yeah, we'll call the general, renegotiate."
436,"He's a businessman, we're businessmen."
437,"Yeah, call him."
438,You call.
439,"Agents, we're on the move to the money drop."
440,Forward.
441,"Hey, man, the truck's leaving."
442,We're going to follow it.
443,Don't lose that truck.
444,Follow that truck. Follow that truck.
445,"Yep, they saddling up."
446,Look like Icepick came through.
447,Wonder whose shit they about to rip now?
448,"Falcon One, do you see her?"
449,Stand by.
450,"I don't want to get spotted, take a burn."
451,"Zoepound a bunch of pirates, man."
452,Steal anything.
453,Black Suburban at 10 o'clock.
454,"Oh, come on, baby."
455,Park it at the top.
456,"Roberto, she's coming to you."
457,I got her.
458,"This is Falcon One, guys."
459,I got her coming up.
460,"Heads up, guys."
461,I got an orange muscle car.
462,Looks to be three black male occupants.
463,It's out of our field of vision.
464,Bring it up.
465,"All right, be aware, we got three bogeys unidentified."
466,"Guys, we got three bogeys."
467,They're splitting up. They're moving.
468,Be aware. They're approaching...
469,Shit. Shit.
470," Fuck, it's a hit!"
471, Shit.
472,Agent down. Agent down.
473,"Roberto, fucking follow them!"
474, I'm on it! I'm on it!
475, Shit!
476,Stay here!
477,Son of a bitch!
478,It's Syd!
479,Move! Move!
480,"Man, what is your sister into?"
481,Sidewalk! Sidewalk!
482,Move! Move!
483,Shit.
484, Shit!
485," I need backup on Canal, now!"
486,You just get ready to shoot.
487,Police!
488,Stop the car!
489,"Man, your badge?! He has a gun!"
490,Shoot him!
491,"Mike, she's in trouble, man."
492,Move! Get out of the way!
493,I think I done just got mad.
494, Gun! Gun! Gun!
495, Hold on.
496,Now show them your badge!
497, This shit is crazy.
498," I know, right?"
499,Move! Move!
500,Get the world down here!
501,Shit!
502,Go! Go!
503,Get out!
504,"You, drive!"
505,Go!
506,"Go, go, go, Mike! Punch that shit!"
507,Punch it!
508,Kill the fucker!
509,Shit!
510,Move! Move!
511," Don't lose her, Mike!"
512, This is what I do!
513,Shit! Shit.
514,Definitely shoot that motherfucker that just...
515,"Oh, man, my headlight."
516,Shoot back! Shoot back!
517,Shoot! Shoot!
518,What the...?!
519,"What are you doing, man?"
520, That's my bad.
521, Shoot outside!
522,Pay attention to what you're doing.
523,These dudes is off the chain!
524,Jesus! Fuck!
525, This is some sick shit!
526," Yep, it's about to get sicker."
527,Watch out! Watch out!
528,"Oh, sh...!"
529," Oh, they are not about to do that."
530," Hell, yes, they are!"
531,Go!
532, You see that?!
533, They throwing cars! How can I not?!
534," I'm just trying to help, okay?!"
535, You know what'd be fucking helpful?
536,Just shut the fuck up and let me drive!
537,Let's try that!
538,"Hey, come on, man, with the screaming shit!"
539,I'm concentrating on dodging these fuckers.
540,Just relax.
541, That was a flip!
542, That motherfucker flipped!
543, That one puckered up my butthole.
544, Almost fucking crushed my head.
545,The boat!
546,"I lost them. Yeah, I've got your cargo to the backup drop point."
547,"Attention all units, suspects still at large."
548,There she is.
549,"What the fuck is going on, Syd?"
550,Some desk you're driving.
551,"Get over here, I'm undercover."
552,And please call off your dogs.
553,"I got DEA watching my back, so don't blow my case."
554, We saved your life.
555, And I appreciate that.
556,What I don't appreciate is you two following me here...
557,...nearly burning a case that took five months to set up.
558,So now we lie to each other?
559,Is that what we do?
560, What do you want me to do?
561, All right.
562," Fuck that, Mike, she's wrong."
563, Calm down. Relax.
564,"Syd, are there drugs in that truck?"
565, There's cash.
566, Where's it going?
567, I can't tell you that.
568, Why not?
569,"Because I have a career and if I want to keep it, I have rules to follow."
570,What's that mean?
571,"My orders are, under no circumstances share information with Miami PD..."
572,...because they got too many leaks.
573, Oh. I'm Miami PD now?
574,"You done forgot I'm your big brother, huh?"
575,"You know what, Syd, that shit you did was reckless..."
576,...it was stupid and it was dangerous.
577,Okay?
578,I'm telling Mommy. Okay?
579,I'm definitely leaking that shit.
580,"Hey, Marcus..."
581,"Syd, come on, he got a point."
582,Your brother loves you.
583,Not to mention a little thing called professional courtesy.
584,"You bouncing in somebody's yard, you should let them know about it."
585,First time using your gun?
586,"Hey, you handled yourself very well."
587,Too bad your partner didn't notice.
588,Thanks.
589,Think you get off that easy? You been working this for five months?
590,How come you ain't tell me in New York?
591, What would you have said?
592, I would've...
593,"I'd have let you know this job is rugged, you know."
594,It's dangerous. And if something happen to you I might...
595,Exactly why I didn't say anything.
596,Somebody's stealing your money.
597,The drop's done. I gotta go.
598,Thanks.
599,We gotta close this case before it get her killed.
600,"Yeah, no doubt."
601,"You ready to go back to the station, get our asses whupped?"
602,I think we gonna be all right.
603,Fellas.
604,What's your job description?
605,"No, you two."
606,What is your job description?
607,I'll tell you.
608,TNT: Tactical Narcotics Team.
609,"Keyword: ""tactical."" ""Displaying finesse and subtlety in achieving a goal!"" Tell me, gentlemen..."
610,...what was subtle about your work today?
611,Twentytwo cars...
612,"...and a boat, totaled?"
613,How did you sink a boat?
614,We didn't sink it.
615,Whoosah.
616,"All right, the positive."
617,Thank God no cops died.
618,The negative: I got a police commissioner so far up my ass...
619,...if he spits it's coming out of my mouth.
620,But I know that there's always two sides to a story.
621,"So, what's yours?"
622,"Well, I was at a family barbecue."
623,We got a tip that the Zoepounders...
624,...were gonna do a hit on cash or drugs from this bigtime XMan.
625,That's what they call a ecstasy dealer on the streets.
626,"Marcus, I know what they call them."
627,That's why I'm captain. It's cool.
628,So you got the drugs.
629,"No drugs. Oh, okay. All right."
630,How about the money?
631, No money.
632, Nope.
633,Then who is this XMan?
634,"Captain, I was at a family barbecue."
635,So I...
636,"We don't know, but we are going to find out."
637,"Well, then all that..."
638,...was for nothing?
639, We didn't do all of that.
640,If you look close...
641,Watch. Hold up. Let me s...
642,There's DEA all over.
643,"Wait, the... Wait, hold up."
644,The DEA? Without consulting me?!
645,That's a DEA car right there.
646,Christ! Fuck!
647,Cap. No. Remember your pressure points.
648,Do my... My exercises.
649, Holler at your boy.
650, Whoosah.
651,Twentyone thousand?
652,What?!
653,"Oh, kiss my black ass."
654,It was the dashboard.
655, You know what?
656, Better.
657,"Yeah, you'll get your money."
658,Somebody's on they way with your money.
659,Is it possible we could discuss potential reimbursement...
660,We don't cover personal property.
661,That's why we drive police cars.
662,So where do we go from here?
663,"Zoepounders knew exactly when to hit the drop, where to hit the drop..."
664,...so we figure they know where the cash is.
665,"We find the cash, we find the XMan."
666,"Hey, I'm through playing games, all right? I have three cops critical."
667,I got kids dying on my streets from soupedup X.
668,I do not want these animals taking over my city.
669,Do you understand?
670,"So I want you guys to do whatever you do, whatever it takes, but do it now."
671,"It's not good, boss."
672,"Oh, my God."
673,Fucking ratones eating my fucking money.
674,"Carlos, this is a stupid fucking problem to have."
675,But it is a problem nonetheless.
676,Rat fuckers.
677,Rat fuckers.
678,"Boss, it ended up crazy."
679,This black chica working for the Russians was a maniac lunatic.
680,She saved your money.
681,She wasted some Haitians and got the load to the drop.
682,"Also, Roberto saw these two crazy gangbanger homeys."
683," Oh, shit."
684, Yeah. Chasing and shooting.
685,"Old days, did I have this problem? No."
686,Just fly the drugs in and ship the money out.
687,Now American security's so goddamned tight over the water...
688,...and in the sky...
689,...that the rats eat my money before I can get it to Cuba.
690, You see?
691, Fiery crash...
692,I can't even get my money across town without making the news.
693,"Hey, man. Man."
694,Tell me...
695,...should I be worried?
696," No, boss."
697, Shut the fuck up.
698,People is trying to jack my loads here in Miami.
699,I own this fucking town. You see?
700,This is my town.
701,"Oh, my God. Pink."
702,"Pink, niña, pink. Pink."
703,No powder blue.
704,Pink is prettier.
705,But the lady at the store said I look like a model.
706,You're lucky your mother was my mother's cousins.
707,Don't pay attention to Roberto.
708,"Besides, models are filthy creatures."
709,You look more like an angel.
710," What do you think, Carlos?"
711, Of course.
712," Roberto, what do you think?"
713, It's fucking beautiful.
714,Talk polite in front of my little bonbon...
715,...or I'm gonna chop your balls off.
716,"For real, I'm straight with all your spiritual enlightenment and that shit."
717,"But I need to know if a crackhead rolls to me with a.9, you'll cook that fool."
718,No question about it.
719,Shoot him in the leg.
720,Come on with that leg shit.
721, Everybody deserves a little dignity.
722, What about my dignity?
723,Your crackhead will be missing a kneecap. I'll be in a body bag.
724, So sad.
725, What's so sad?
726,Your untreated control issues.
727,It's not your fault.
728,What in the hell is that supposed to mean?
729,Your mama probably refused you her tit when you were a baby.
730,You grew up a malnourished highschool softie.
731,"Got your gun, little tight Tshirt..."
732,...and became a overcompensating tough guy.
733,That is the last time you will ever refer to my mother's titties.
734,I don't even want them up in your head.
735,"You know, I said all that, Mike, and all you heard was ""titties."" Man, you can't keep suppressing my spiritual growth, Mike."
736,You need to suppress my mother's titties out of your psychoanalysis.
