,dialog
640,And you'll face God for it and so will I.
641,But not yet.
642,You let me let you in on a little secret.
643,"I haven't had so much fun since I was 15, stole a car and drove to Miami Beach."
644,This shit's a party to a dirtbag like me.
645,"So, stop feeling sorry for yourself and start listening."
646,"This buddy of mine, he's rich, he's got connections and he owes me."
647,"Now, he'll help us if I can find out where he is, I don't know."
648,"And these skidmarks over here, they know but they're not talking and..."
649,I got the address.
650,Thank you!
651,Gonna hop up through there.
652,"There's a lot of firepower here, but there's a lot of bullshit, too. Hop through here."
653,Fuck you. That's not funny.
654, More bullshit?
655," No, those are probably real."
656,Follow me.
657,I'm coming.
658, Son of a bitch.
659, That's me.
660," So, they let you out."
661, This is my daughter.
662,"They do grow up, don't they?"
663,"Well, you might as well go on inside the hangar and say hi to him."
664,"Careful, you don't give him a heart attack."
665, One of those yours?
666," Yeah, in another life."
667,Fuck.
668,Hey.
669,Be with you in a minute.
670,Let me just finish up here.
671,Well... I expected you two years ago.
672,"Yeah, stingy parole board, you know how it is."
673," It's my daughter, Lydia."
674, You're kidding.
675,"Lee, I knew you when you were just a pup."
676," How are you, sweetie?"
677," I'm fine, thanks."
678,Yeah.
679,"Still backing the losers, I see."
680,Nazis and confederates.
681,"Yeah, yeah, all losers make me money."
682,Let me show you around.
683,"So, what's this collectibles horseshit a front for?"
684,You selling down south?
685,AK47s and the like?
686,"No, no, I don't sell that commie shit."
687,You know the walls along the border?
688,They're building them with the landing pads we used in 'Nam.
689,"Think about that. That metal I used to jump on in the rice paddies, they're using now to keep the taco vendors off my lawn."
690," So, who you selling to these days?"
691," You know, I love you like a son, Link."
692,But I'm not gonna answer questions from somebody I haven't seen in a coon's age.
693,We had a deal. I want my bike back and I want my money.
694, Which money is that?
695, I kept my mouth shut a long time.
696,"You were always the strong, silent type."
697,The boys should be by later on.
698,"Why don't you hang around, play catch up?"
699,What the fuck for?
700,I've been sober two years.
701,"Well, maybe someone would like to witness that with their own eyes."
702,Shit!
703,"Well, can I get you anything?"
704,"A soda, or something maybe?"
705,I'm fine.
706,I bet you feel like you're surrounded by savages.
707,"No. No, I really appreciate everything."
708,Thank you.
709,You do?
710,"I bet you don't know what the hell you're looking at, or listening to."
711,These are the last of the survivors.
712,The last of the kind.
713,They know this little patch of desert's gonna be here long after the rest of this country cannibalizes itself.
714,Okay and why is that gonna happen?
715,"Okay, well..."
716,it'll happen because most of you people are too goddamn comfortable to see it.
717,You kids don't understand.
718,This country buys out the subversives.
719,It turns the rebels into fashion trends.
720,"It did it with the Angels, it's doing it with rap."
721,And the corporations package it up and sell it online.
722,Hundred dollars a Tshirt for suburban little princesses just like you.
723,You know what? You grew up with your mama.
724,You never knew the world your daddy rode in.
725,But your mama wasn't always rich.
726,She started out with us.
727,But she married up the ladder.
728,She became a hood ornament for the best cars.
729,How long you been away from home?
730,I know all about why little rich girls leave their pretty things behind.
731,"When a mosquito bites you, it leaves an enzyme that other mosquitos can smell."
732,"And I can smell it on you, kid."
733,Everyone can.
734,"So, you can run forever."
735,Forever.
736,"But the worst and, I mean, the worst goddamn people in the world know that scent and they'll follow it."
737,Can you dig it?
738,Yeah.
739,"Sorry to leave you out there with them animals, but..."
740,I was keeping an eye on ya.
741," So, is this the old hog?"
742, This is her.
743,'97 Softail with a 570 lift cam.
744,"Shaved the fenders, chromed the front and dropped her two inches. Beautiful."
745,"I feel kind of jealous, I thought I was an only child."
746, Do you think he's gonna give it back to you?
747," Kid, he owes me a lot more than this."
748,"I did a seven year stretch, keeping quiet for that motherfucker."
749,Then I got done again for shanking some fucking nobody.
750,Otherwise I'd have been out.
751,You got raised by three stepfathers.
752,Should've been me.
753,I don't know what to tell you.
754,"So many enemies, so many vendettas."
755,"Fills up your fucking soul, you know?"
756,Play this game with its own set of stupid fucking rules.
757,You give your life to it...
758,it's over.
759,And I got nothing to show for it.
760,There's nothing I can even say...
761,except I'm sorry.
762,I made mistakes and you suffered.
763,"I'm sorry I wasn't there for you, baby."
764,"Morning, Link."
765, What the fuck is wrong with you?
766, Wake the kid.
767,This is a loaded firearm and I will shoot.
768, The past is long gone.
769," Yeah, okay."
770,"Hey, baby. Wake up, rise and shine."
771,"Hey. Cut it out, will you?"
772,Quit it. Just...
773,"Honey, you gotta wake up. Okay, there's some kind of kidnapping going on."
774,I don't know.
775, Fuck.
776, I'm up.
777,You gotta be shitting me.
778,"No, I'm not shitting ya."
779,"Things have changed, hombre."
780,I can't let an opportunity like this slide by.
781,"See a nickel on the ground these days,  you pick it up."
782, For 30 grand.
783,"Yeah, well, 30 G's will fill a lot of holes around here, compadre."
784,I do appreciate your loyalty in the past. I really do.
785,But we gotta be professional about this.
786,We're not gonna turn you in.
787,We're gonna follow the letter of the law.
788,She can run on home to her golddigging mama and you're free to go.
789,"Take a hike. Hit the road, Jack."
790,Know what I mean?
791, You fucking virus.
792," If you turn us in, the cops will bust you."
793, Shut up!
794, Goddamn brat!
795,I was running the fucking Coachella Valley before you were an itch in your daddy's sack!
796,"So, don't tell me. My life isn't in Instagram, for Christ's sake."
797,"I'm in the fucking history books! Vietnam, Look it up!"
798,I've dug up more fucking mines that I could've blown the moon up with!
799,Do you understand that?
800,Get the fuck outta here!
801,"Get 'em out of here, Cherise, before I lose my goddamn patience."
802, Get 'em outta here!
803," Keep talking, you senile motherfucker."
804,Motherfucker? I wouldn't be if you keep your mother home at night!
805,"Fuck you! How'd you feel with a fucking bayonet in your cracked skull,  you old cocksucking..."
806, Shit!
807,Get outta here! Here's your Nazi bullshit!
808,Calm down!
809,"Let me tell you something, pal."
810,I still love you. You were the best foot soldier I ever fucking had.
811, How 'bout I shoot you right now?
812, With your daughter right outside?
813," Yeah, I might."
814," No, you won't, you can't."
815,"You're past that. I watched it, I saw it."
816,You've changed. But back in the day...
817,"Back in the day, I kept my fucking mouth shut for you, old man!"
818,That's what I did back in the day.
819,You were like a fucking father to me!
820,Back the fuck up!
821,"Roll it the fuck back, cocksuck!"
822,You know what I'm looking for.
823,Where's my keys? See what we got here.
824,"What're you doing? Stealing from me, Link?"
825,Stealing? You stole every goddamn thing I ever had. Everything!
826,"Now look at you. You're so fucking broke and pathetic, I can't even kill you for it."
827,You even stole that from me!
828,Stay put.
829,Dad!
830, Fuck!
831, Go! They're fucking shooting at us!
832,The gun!
833," We're good, kid. Hang on to me."
834," Oh, shit!"
835,"Hey, kid."
836,"We gotta shake a leg, you coming?"
837,"Hey, Kirby. I'm just checking in."
838,"I'll call you back, okay?"
839,Can't give you a number here.
840,We're on the road.
841,"We're safe, sober, both of us."
842,"Call you back. Thanks, man."
843,"Hey, look, kid, you're crashing now."
844,Maybe you should take a nap.
845,Do you ever think about what the world would be like without you?
846,"If I just went ahead and killed myself, this would all be over."
847,"Oh, so, that's where we're at."
848,Giving up. Fine.
849,"You kill yourself, then I'll kill myself."
850,I'll take some innocent people with me.
851,How'd that be?
852,"You think I'm kidding, Dad, but I've tried."
853,"Yeah, so have I, plenty of times."
854,Where does that get us?
855,I took all of my stepdad's pills when I was 12.
856,Girls take pills when they want somebody to find 'em.
857, I tried to hang myself when I was 10.
858," Well, that didn't work very well."
859,Do you understand what I'm trying to tell you?
860," Yeah, sure, congratulations."
861, I was 10 years old!
862,I knew a 10yearold kid.
863,Killed his whole family with a rock.
864,What the fuck does that mean?
865,Why don't you ever listen to me?
866,"I'm listening, okay? Look..."
867," feel this, right up here."
868, No.
869,"Yes. Come on, it's important."
870,"Feel it, come on."
871,"Oh, my God! What is that?"
872,"Yeah, drove my bike off a cliff on the PCH, split my head wide open."
873,"Now, the point is, I meant to do it."
874,But they saved my ass anyway and that's a steel plate in my head.
875, And look at this.
876, I don't want to. You're a fucking cyborg.
877,"I opened up my wrist in prison, then I got sepsis."
878,Spent two months in the prison hospital watching game shows  and then I really wanted to kill myself.
879," All right, you win."
880,"No. There's no winning or losing. You either wanna wake up in the morning, or you don't."
881,"And if you can't find a way to live with yourself, well, then, why run?"
882,Why come to me? Why do any of this?
883, I don't wanna die.
884, What was that?
885, I don't wanna die.
886, That's right. You don't wanna die.
887,'Cause you're a 17yearold kid and you got a lot to live for. Okay?
888,"You may not wanna wake up tomorrow, but the day after that might just be great."
889,"Might be the best fucking day of your life, you know? You don't wanna miss it, right?"
890,"Great, keep doing the hair. I'll be back in an hour or two, I got a meeting."
891,I need to talk to an old friend.
892,"If something happens to you, how am I gonna know?"
893,"I'll give you Kirby's number, okay?"
894,If something happens...
895,"So, if we get separated, I'm supposed to call your sponsor?"
896,"Kid, look. This is something I really need to do. I promise I'll come back."
897,"I'll be back before you're a blonde, okay?"
898, Okay.
899, See ya.
900,I lost my ID.
901,Here to see Rios.
902,I know.
903, Dad?
904, Lydia?
905,Kirby? What happened?
906, Is your father there?
907," No, he's not back yet. Did he call you?"
908,"Yeah, earlier, he did."
909,He told me you were in Yuma.
910,"Listen, I'm worried about him, I'm worried about both of you."
911,Is he in trouble?
912,I don't think it's safe for you to be there alone.
913,"I think you should go to a public place, someplace crowded."
914,"Don't trust anybody, Lydia. Stay in a crowd."
915,Listen to your instincts.
916,"You missed me so much, I have to pull strings to get you back inside?"
917,"Conjugal visit. Kiss me, no tongues."
918, How are ya?
919, You are one ugly dude.
920, Shit! You look like a public defender.
921, Yeah.
922,"Please grow back the beard, please!"
923," I need your help, man."
924, You need me to teach you to tie a tie.
925,"No, no, no. It's my little girl. That guy I asked you about. Did you get the message?"
926,Nephew of Alfonso AngelDiaz. El Padrino.
927,Still running the family business from his cell in Juarez.
928,The kid was keeping stash houses for him in LA.
929,"The cartel sent him there to get rid of him. He was too loud, too proud, causing problems with the family."
930,"He was causing problems for my little girl, too. He's not with us anymore."
931," So, you don't need a paternity test?"
932," No, but I do need protection for her."
933,"Any of his crew sets foot inside, they won't make it across the yard."
934,But there's some professional on her tail.
935,Some cleaner from south of the border.
936,"This punk accused her of stealing. I thought it was just his guys that wanted her dead, but it's more than that."
937,Why would they send this kind of firepower?
938,"Don't you get it, bro?"
939,"Jonah was taking the money and I'm not talking a few grand, I'm talking millions."
940,And he was pinning it on her and his other tenants.
941, Okay.
942, Thought she was an easy fucking mark.
943,But you know what? He's lucky he's dead.
944,"'Cause what they would do to him, be a lot worse, bro. A lot worse."
945,"Anybody sets foot on the inside, I'll deal with it."
946,"You need a line to El Padrino, I'll get it for you."
947,But you gotta teach your girl some judgment.
948,Then you gotta teach her how to hide.
949,"She gotta live right, brother, clean and straight."
950,"'Cause people like this, they can see in the dark."
951,You got to teach her how to stay in the sunlight.
952, You understand?
953, I understand.
954," Stay loose, bro."
955, Get loose.
956,Doing my best.
957, Hello.
958, Lydia?
959,You didn't expect it to be me?
960,Jonah?
961,How's the movie?
962, What movie?
963, You always lie like a child.
964,I can see you right now. I'm watching.
965,"No, you're tracking my phone."
966,You think I'm using a fucking app?
967,You have no idea what I lived through.
968,"Underground doctors, blood transfusions."
969,I don't ever get to live in the regular world anymore.
970,I'm sorry.
971,Fuck you. We're so far past that.
972,But you want to see your father again?
973,You come talk to me face to face.
974, You're lying.
975, Turn around.
976,"I didn't know what I was doing, Jonah."
977,It's like I wasn't even there.
978,"I can't live with myself, okay?"
979,I don't know what else I can say to you.
980,"I was good to you, Lydia."
981,I put you in a nice place.
982,I gave you everything you needed.
983,I took better care of you than anybody in your life.
984,And you tried to kill me.
985,"Look, come..."
986,This is still bleeding.
987, Come here.
988, No.
989,I have your name on my heart and you can't even come close to me?
990,Where is he?
991,You try to run...
992,and we're gonna have to kill you.
993,Hey!
994,Lydia!
995,"Come on, kid. Pick up."
996,"Where are you, kid? Come on."
997,Fuck.
998,Okay.
999,"Come on, Kirby, come on."
1000,"Kirby! What're you doing, man?"
1001,What's happening? Kirby?
1002,"Good news, old man."
1003,Your sponsor says...
1004, ...you should start drinking again.
1005, Who the fuck is this?
1006, Talk to your friend.
1007, Hello? Kirby?
1008,"Sorry, Johnny. I did my best."
1009,The fuck? Kirby? Kirby?
1010,"You had a snitch for a sponsor, old man."
1011,You know who I am?
1012,I know your daughter better than you do.
1013,You should've taught her to shoot straight.
1014,"So, you're not dead."
1015,"You just killed the best fucking friend I ever had, motherfucker!"
1016,"No, that's no friend."
1017,You fill him with a bottle of Tequila and he can't keep a secret.
1018,Where's Lydia? You got Lydia?
1019,Where the fuck is Lydia?
1020,She might be dead.
1021,"No. No, she's not."
1022,"You're a fucking psycho, but you know one thing."
1023,She's the last streak of sunlight you're ever gonna see in your whole fucking life.
1024,Shut the fuck up.
1025,You know nothing about me.
1026,"Yeah, I do. I know all about you. That's why you're gonna stay on the fucking phone."
1027,"Whatever you're gonna do with Lydia, you need to do something else first."
1028,You need to deal with me.
1029,Really?
1030,Why should I give a shit about you?
1031,"Well, 'cause I know what you're doing."
1032,I know about your family and the money you took. Yeah? You hear me?
1033, I heard you.
1034, You're killing people to cover your tracks.
1035,Make a big fucking show to prove it's not you.
1036,"Lydia told me about the houses, she told me everything."
1037,"And I got a line straight to your uncle in fucking Juarez. El Padrino, you know him."
1038,I know he doesn't think too much of you.
1039,I can get a message to him. You're still on the phone because you know this is real.
1040,And you know he's already watching you.
1041,"You think he's letting you use one of his best sicarios, that Zapotecan monster with you?"
1042,"Just for you? He's there to keep track of you, too, motherfuck!"
1043,"He gets the order from uncle, bang, he takes your fucking head off."
1044,"You're a businessman, yeah?"
1045,This is the best deal you're ever gonna get.
1046,"You kill me first. Kill me in front of her, if you have to. Let's just meet."
1047, And you trust me to let her go when you die?
1048, I don't fucking trust you at all.
1049,All I'm asking of you to do is keep her alive until I see her again.
1050,Okay. That's sweet.
1051,The old man wants his last chance.
1052,I'll call you in 10 minutes to this number and give you a meeting point.
1053,"No, you put her on the phone or no deal."
1054,Put her on the fucking phone right now!
1055,Get that bitch.
1056,Okay. Shut up.
1057, Daddy.
1058, Dad!
1059,"Baby, I'm coming for you."
1060,Have a little faith.
1061,"That's it. Okay, get in there."
1062,I can't believe you'd have the nerve.
1063,Fucker.
1064,"Okay, old man, Leave Highway head north into the desert."
1065,"Alone, no guns."
1066, What the fuck is he doing?
1067, He's showing us he ain't strapped.
1068,Let's get this shit over with.
1069,Move away from your bike!
1070,Nice and slow.
1071, Lydia!
1072, Stop there.
1073,Stop!
1074,Spread your legs.
1075,Spread your fucking legs!
1076,Put your fucking hands together!
1077,"Come on, get him in. We're going for a ride, just in case you were followed."
1078, Move!
1079," Come on, get in."
1080,"You will see her, you will see her."
1081,Get in. Get in!
1082,"Hi, kid."
1083,"Go, get that."
1084,"Come here, baby. Come here."
1085,Fuck! Fuck you! Fuck!
1086,Fuck! Fuck!
1087,Fuck.
1088,We gotta jam! Motherfucker's up there!
1089, Where the fuck is he?
1090, You're hit.
1091, Did you see him?
1092, No.
1093,Okay. Fuck.
1094,"Okay, I saw him that time!"
1095,"Okay, I got an idea."
1096,"I'll lay down some cover fire, you run to the other car."
1097, He won't be able to track you there?
1098, What?
1099,"He'll be taking shots at me, he won't even see you. Get going!"
1100," Dad, you're hurt!"
1101, Get in the other car and fuck off!
1102,"No, no. If you think that I'm leaving you, then you're out of your fucking mind!"
1103, Do not run until I start firing!
1104, No!
1105," I'm gonna count to three. One, two..."
1106, No! No! Count to a million if you want to!
1107,"If you think that I'm leaving here without you, then you don't know me!"
1108,"All this time, and you never even fucking knew me!"
1109,What? Okay. Okay.
1110,It's nice to meet you.
1111,"Okay, I got another idea."
1112,Let's go together.
1113, On your count or mine?
1114, Yours.
1115,"Okay, let's go! God... Go, go, go!"
1116, Dad!
1117, Hey. You okay?
1118, I'm okay.
1119, Good.
1120,"Oh, no! Oh, fuck!"
1121,"Dad, he's coming."
1122, I don't know where he is.
1123," Yeah, he's coming. Come here."
1124,Come here. Be still.
1125," Be very, very still."
1126, I'm so sorry.
1127,I got him! I got him! I got you!
1128,"Oh, shit!"
1129,"This is not good. Oh, fuck!"
1130,Dead motherfucker!
1131,The other one. Get your head down.
1132," There's the other one, the boyfriend."
1133," Stop, stop! Dad, he's gone. He's gone!"
1134, Where did he...
1135," He's gone, okay? I gotta go get us help."
1136,"No, you stay here."
1137,"Don't leave me, stay here, please."
1138,Yeah.
1139," Yeah, yeah."
1140, Just let me look at you.
1141,Your hair came out good.
1142,"Look, kid, I'm really bad."
1143,"Here, take this gun."
1144,I got nothing better to give ya.
1145,"I never gave you anything,  and now I got nothing to give you."
1146," Dad, Dad! That is not true."
1147, I lost ya...
1148, Dad! Look at me! Look at me!
1149,You did not lose me.
1150,"I am not lost, I am right here with you, okay? Okay?"
1151,I'm not gonna leave. Okay?
1152, Okay.
1153, Look at me.
1154, It's just you and me.
1155, Okay.
1156,"I'm not gonna leave, ever. I promise."
1157,You sure are a good girl.
1158,You sure are. You sure are.
1159,Dad?
1160,On your knees! Hands behind your head!
1161,"A year ago, I stopped running."
1162,I stopped listening to all of my worst instincts and all the worst people.
1163,I'll just tell you this.
1164,I've been sober a year.
1165,"I miss my father so much, that I can't sleep some nights, but..."
1166,I tell myself that he's watching over me.
1167,"Sometimes, there's this shame..."
1168,"that almost breaks my back, but..."
1169,I tell myself...
1170,"""when you owe your life to someone..."
1171,"""you better live it."" So, I just say..."
