,dialog
0,Total civil unrest is happening throughout the Los Angeles area.
1,Dozens of police are running down the streets.
2,Dozens of police are running down the streets.
3,Smoke reigned over the entire city.
4,We're telling anybody who's in downtown South Central...
5,There are 38 dead and more than...
6,The EMT are having a hard time getting in...
7,...where truck driver Reginald Denny was pulled from his vehicle...
8,The city resembles a war zone.
9,Crowds gathered at Parker Center downtown.
10,"...here in Hollywood, where looters have struck many businesses."
11,"There have been 3,600 structural fires."
12,"Thick, black smoke rising from the countless fires in Hollywood, downtown, Compton, Watts and Long Beach..."
13,"In America, a girl can be crowned a princess for her beauty and her grace."
14,But an Aztec princess is chosen for her blood...
15,Eva?
16,"...to fight for her people, as Papi and his father fought against those who say we are less than they are, who say we are not equal in beauty and in blessings."
17,"It was the first day of school, and I was waiting for my father to take me to the bus."
18,Roberto!
19,Eva!
20,And I saw the war for the first time.
21,Eva! Eva!
22,Police! Open up!
23,They took my father for retaliation.
24,"He was innocent, but they took him, because he was respected by my people."
25,They called my people a gang because we fight for our America.
26,On your feet!
27,"When I got my initiation into the gang life, I became third generation."
28,They beat you so you won't break.
29,They are my family.
30,"In Long Beach, it all comes down to what you look like."
31,"If you're Latino or Asian or black, you could get blasted any time you walk out your door."
32,We fight each other for territory.
33,"We kill each other over race, pride and respect."
34,We fight for what is ours.
35,"They think they're winning by jumping me now, but soon they're all going down."
36,War has been declared.
37, Here's your coffee.
38, Thank you.
39,I brought my lesson plans. I'd love it if you'd look them over.
40,"Yes, and these are the classes you'll start with."
41,"Freshman English, four classes, about 150 students in all."
42,Some of them are just out of juvenile hall.
43,One or two might be wearing ankle cuffs to monitor their whereabouts.
44,"And you see here, we'll have to revise your lesson plans."
45,"And if you look at their scores, these vocabulary lists and some of these, the books, Homer's The Odyssey, they're gonna be too difficult for them."
46,All right.
47,"Also, for most of them to get here it takes three buses, almost 90 minutes each way."
48,My God.
49,So I wouldn't give them too much of a homework load.
50,You'll just be wasting a lot of time following up on overdue work.
51,All right. Thank you.
52, You're from Newport Beach?
53, Yes.
54,"It's too bad you weren't here even two years ago, you know."
55,"We used to have one of the highest scholastic records in the district, but since voluntary integration was suggested, we've lost over 75ยบ/ยบ of our strongest students."
56,"Well, actually, I chose Wilson because of the integration program."
57,"I think what's happening here is really exciting, don't you?"
58,My father was involved in the civil rights movement.
59,"And I remember when I was watching the LA riots on TV, I was thinking of going to law school at the time."
60,"And I thought, God, by the time you're defending a kid in a courtroom, the battle's already lost."
61,I think the real fighting should happen here in the classroom.
62,"Well, that's a very wellthoughtout phrase."
63,"Erin, I think you're a lovely, intelligent woman."
64,But you're a firsttime teacher.
65,"As head of this department, I have to be confident you're capable of dealing with what we have to face here."
66,I am.
67,"I know I have a lot to learn as a teacher, but I'm a really good student."
68,"I am, and I really want to be here."
69, Those are lovely pearls.
70, Thank you. From my father.
71,I wouldn't wear them to class.
72,Honey?
73,What?
74,Do I look like a teacher?
75,Hey!
76,"Hey, Chris, yo, what up?"
77, Hello.
78, Hello.
79,"Hey, yo, let's sit right here, man."
80,Hi.
81,"Hey, girl, you wanna give me some fries with that shake?"
82,My name is Erin Gruwell.
83,Welcome to Freshman English.
84,I give this bitch a week.
85,Hi.
86,Okay. Brandy Ross?
87,Gloria Munez.
88,Alejandro Santiago.
89,Andre Bryant.
90,Eva Benitez.
91,"Eva, not Eva."
92,Eva.
93,I have to go to the bathroom.
94," Okay, make sure that you take a..."
95," Yeah, I know."
96,Ben Samuels?
97,That white boy hoping he's in the wrong room.
98,I gotta get out of here.
99, Sindy Ngor.
100, Right here.
101,Is that correct?
102, Jamal Hill?
103," Man, what am I doing in here?"
104,This whole ghettoass class has got people in here looking like a bad rerun of Cops and shit.
105,You know what I'm saying? It's true.
106, Are you Jamal?
107, Yeah.
108,"Well, for some reason they have you registered in this class."
109," Yeah, and that's some bullshit."
110," It's the dumb class, coz."
111,It means you're too dumb.
112," Man, say it to my face, coz."
113, I just did.
114,See what I mean? Dumb.
115," Man, I know you ain't talking to me!"
116, Okay...
117,"Look, homey, I'll beat that ass, homeboy."
118,Can you please sit back down?
119,"Look, I got your spot on the team."
120,That's why you're over there wagging your tongue.
121,Please sit back in your seats.
122,"Look, your spot is good as gone. I don't know why you keep wasting your time coming to practice with them twoyearold Nikes on your feet!"
123,"You don't know nothing about me, coz!"
124,Broke down my whole situation.
125,Jamal?
126,"So, now you're in my face now, right?"
127,"Sit your punk ass down! Sit your punk ass down, homeboy!"
128,I will run that ass off the field.
129,Shut your ass up.
130,"What's up, homey?"
131,"I mean, what's up? Sit your ass down, homey!"
132,"Excuse me, may I please get some help in here?"
133,So do something! Back up!
134,You touching me now?
135,"Sit down, homeboy. Back up, I'm not gonna tell you again."
136,"You gonna look at my face now, right?"
137,"You ain't taking nothing from me, homeboy!"
138,I will run your ass off the field!
139,"Boy, sit your ass back down."
140,"Don't even worry about it, I'm gonna see you."
141,Tell him. Sit his ass down.
142,Sit your ass down.
143,"Thank you. Let him out of here, man. That's some bullshit."
144,Erin?
145,"Erin, this is Brian Gelford."
146,He teaches Junior English and the Distinguished Honors Classes.
147, Hi. Erin Gruwell.
148,Nice to meet you.
149, Hi. Nice to meet you.
150," You saw a little action today, I hear."
151, Yeah. It happened so fast.
152,"Well, don't be discouraged."
153,"You put your time in, in a few years, you'll be able to teach juniors."
154,They're a pleasure.
155,"By then, most of your kids will be gone anyway."
156, What do you mean?
157," Well, eventually, they just stop coming."
158,"Well, if I do my job, they might be lining up at the door."
159, Right?
160, Yeah.
161, Nice pearls.
162, Thank you.
163,"If it was up to me, I wouldn't even be in school."
164,"My probation officer threatened me, telling me it was either school or boot camp."
165,Dumbass.
166,He thinks that the problems going on in Long Beach aren't going to touch me at Wilson.
167,"My PO doesn't understand that schools are like the city, and the city is just like a prison, all of them divided into separate sections, depending on tribes."
168,There's Little Cambodia.
169,The Ghetto.
170,Wonder Bread Land.
171,"And us, South of the Border or Little Tijuana."
172,"That's just the way it is, and everyone knows it."
173,"But soon enough, you have little wannabes trying to hit you up at school, demanding respect they haven't earned."
174,"It looks like this, one tribe drifting quietly to another's territory without respect, as if to claim what isn't theirs."
175,"An outsider looking in would never see it, but we could feel it."
176,Something was coming.
177,Settle down.
178,"Let's go over the first name on the list, Homer."
179,Homer's The Odyssey.
180,I know Homer the Simpson.
181,"No, this Homer was an ancient Greek, but maybe he was bald just like Homer Simpson."
182,Okay.
183,What's up?
184,"Quietly, please."
185,"Mrs. Gruwell, he just took my damn bag!"
186,Shut up! Ain't nobody touched your damn bag.
187,"Yeah, I saw you."
188,Jamal. Jamal. Get her backpack.
189,I didn't do nothing anyway!
190, Jamal. Jamal.
191, Okay.
192,"Wait! Wait! Please, stay in your seats! Wait! Stay in your seats! Please!"
193,Slantyeyed bitch!
194,Return to your classrooms.
195,Return to the classrooms immediately.
196,That's all you got?
197,Clear the school lawn and the recreation field now!
198,"...classrooms, or you will be subject to disciplinary action."
199,You can best help yourself and your fellow students and your school by returning to your classrooms now.
200,Please return to your classrooms.
201,"Get up, bitch!"
202,All students must return to their classrooms immediately.
203,Erin?
204,Erin.
205,"Hey, baby."
206,You okay?
207,Come here.
208,Are you sure about this?
209,"Well, it's not exactly how I pictured it."
210,Don't tell my dad.
211,"Hopefully, he hasn't seen the news."
212," So, how's work?"
213, Dad.
214, I was asking your husband.
215," It's good. I mean, for now."
216,It's a good company.
217,I pretty much run the computer data department.
218, I thought you were an architect.
219, He is. He's just taking a break.
220,And the money's good for now.
221,"How much are you making, $27,000 before taxes?"
222,"If you know, why are you asking?"
223,"So, what's everybody gonna eat?"
224,"With your brains, you could run a major corporation."
225,"Instead, I worry all night because you're a teacher at Attica."
226,Can you hear what you're saying?
227,How many times have I listened to you about walking civil rights marches?
228,"These gangs are criminals, not activists. You read the papers?"
229,They said the same thing about the Black Panthers.
230,I'll lay odds your kids don't even know who Rap Brown or Eldridge Cleaver were.
231,You're gonna waste your talents on people who don't give a damn about education.
232,It breaks my heart.
233,I tell you the truth.
234,Well...
235,I'm sorry. I can't help that.
236, You think this is good enough for her?
237," Yeah, I do."
238,"Look, Steve, if Erin thinks she can teach these kids, she can."
239,You telling her she can't is just gonna make her mad.
240,So he doesn't like your job. So what? Why do you let it get to you?
241,"I don't know, it just does. I'm not used to disappointing him. I..."
242,Just let me know when I can brush my teeth.
243, I hate that we don't have our own sinks.
244, Come in. There's room.
245,All right. Thank you.
246,I can't believe he brought up my salary.
247,What's happened to him?
248,"He was like Atticus Finch to me when I was growing up, and now he's talking about salaries?"
249,I think he's playing too much golf.
250,"In fact, I think he needs an intervention."
251,Why isn't being a teacher good enough for him?
252,"Honey, just calm down."
253,"You know, except for marrying me, you never seriously disappoint him. He worships you."
254,He likes you. He just doesn't...
255,"He just doesn't think I'm good enough for you, which is fine."
256,That's what fathers do. I'm sure I'll be that way someday.
257,"Look, just, you know, stop worrying about being his perfect daughter."
258,"You don't live in his house, you live in ours."
259,Or until we find one.
260, Or until you build us one.
261, Yeah.
262,With extra sinks.
263,You're a teacher because you say you are.
264,I have this idea.
265,We're gonna be covering poetry.
266,Who here likes Tupac Shakur?
267,It's 2Pac.
268,me. Raise your hand.
269,Really? I thought there'd be more fans.
270,I have the lyrics to this song printed out.
271,I want you to listen to this phrase I have up on the board.
272,It's an example of an internal rhyme.
273,"What he does is very sophisticated and cool, actually."
274,"Manchild in the promised land couldn't afford many heroes Moms was the only one there Pops was a noshow And, no, I guess you didn't know that I would grow to be so strong You looking kinda pale, was it the ale? Oh, pops was wrong Where was the money that you said you would send me?"
275,Talked on the phone and you sounded so friendly  Think we don't know 2Pac?
276, White girl gonna teach us about rap.
277,"No, it's not that. See, what I was trying to do..."
278,"You have no idea what you're doing up there, do you?"
279,You ever been a teacher before?
280,"And teacher gets nailed, y'all!"
281,"All right, Jamal, enough."
282,Jamal! That's enough!
283,You know what? I want you to move to this front seat right here now.
284, What?
285, Come on.
286,I am sick of these antics in my classroom.
287,"Well, there you are."
288,I was wondering when you were gonna lose that damn smile.
289,Switch with Ben.
290, Come on.
291, I can't go back there alone.
292, It'll be fine.
293," No, it won't."
294,I'm not sitting near him.
295,I ain't going up there without my homey.
296,I'm not sitting back there alone!
297, All right.
298, Shut up.
299,"All right, you know what?"
300,I want you all to move to this side of the room.
301,"You in the back, up here. Sindy and all of you, move to the back."
302,Come on. Let's go. Now!
303,"Get your ass back to China, all of y'all."
304, You're all little midget ass punks.
305, Move before I stomp your peanuts.
306,Boo!
307,"Get your ass to the back, boy."
308,Get off my desk.
309,"So, everybody happy with the new borders?"
310,Eva?
311,Where are you going?
312,Hey! Hey!
313,"This is bull! Come on, man! What the..."
314,What the hell? Damn!
315,I want my money back!
316,This shit took my damn money!
317,I want my damn money back!
318,Look what you putting me through. Shit!
319,Learn to speak the damn language!
320,"You're from this country, aren't you?"
321,I want my money back!
322,I want my money back!
323,I want my money back!
324,Come on! Let's go!
325,"Come on, come on, girl! Let's go!"
326,Paco was scared.
327,"In the car, he said, You can't go against your own people, your own blood."
328,The same words my father used so many times.
329,Only I saw Paco.
330,The others were turned away.
331,"So when the police questioned me, I knew I had to protect him."
332,"All right, everyone, we need to get started so classes won't be too delayed."
333,Principal Banning would like to say something in the light of last night's events.
334,I've spoken to the police.
335,"As you might already know, there were persons involved in last night's shooting who are Wilson students."
336,Grant Rice has been arrested as a prime suspect.
337,"Ms. Gruwell, apparently one of your students, Eva Benitez..."
338, Eva... has identified him as the shooter.
339,She's the prime witness in the case.
340,It is our policy not to discuss the subject inside the classroom.
341, Thank you very much.
342, Thank you.
343,"Hey, Tiny, check this out."
344,Hey. Hey!
345,Yes?
346,All right.
347,Gloria?
348,Please read the first sentence on the board.
349,Why me?
350,Because I know how much you love to read.
351,Close the magazine.
352,Odysseus had no sense of direction.
353,"Now, none of these sentences are correct."
354,I'd like you to rewrite these sentences using the proper tenses and spelling on page four of your workbooks.
355,I don't have a page four. It got torn out.
356,"Okay, why don't you just use the next blank page?"
357,What's going on?
358,What is that? Give it to me.
359, What is this?
360, Just leave it alone.
361,You think this is funny?
362,Tito?
363,Would this be funny if it were a picture of you?
364,It ain't.
365,Close the workbooks.
366,"Maybe we should talk about art. Tito's got real talent, don't you think?"
367," Yeah, yeah."
368," Go, Tito."
369,You know something?
370,I saw a picture just like this once in a museum.
371,"Only it wasn't a black man, it was a Jewish man."
372,"And instead of the big lips, he had a really big nose, like a rat's nose."
373,"But he wasn't just one particular Jewish man, this was a drawing of all Jews."
374,And these drawings were put in the newspapers by the most famous gang in history.
375,"That's us, dawg."
376,You think you know all about gangs?
377,You're amateurs.
378,This gang would put you all to shame.
379,"And they started out poor and angry, and everybody looked down on them."
380,"Until one man decided to give them some pride, an identity and somebody to blame."
381,You take over neighborhoods?
382,That's nothing compared to them. They took over countries.
383,And you wanna know how?
384,They just wiped out everybody else.
385, Yeah.
386, Yeah.
387,"Yeah, they wiped out everybody they didn't like, and everybody they blamed for their life being hard."
388,And one of the ways they did it was by doing this.
389,"See, they'd print pictures like this in the newspapers."
390,"Jewish people with big, long noses. Blacks with big, fat lips."
391,They'd also publish scientific evidence that proved Jews and blacks were the lowest form of human species.
392,Jews and blacks were more like animals.
393,And because they were just like animals it didn't really matter whether they lived or died.
394,"In fact, life would be a whole lot better if they were all dead."
395,That's how a holocaust happens.
396,And that's what you all think of each other.
397,"You don't know nothing, homegirl."
398,"No, I don't, Marcus! So why don't you explain it to me?"
399,I ain't explaining shit to you!
400,Do you even know how we live?
401,"We was here first, man."
402,"Just shut that shit up, homeboy."
403,All right! All right! All right!
404,"So what you're saying is, if the Latinos weren't here, or the Cambodians or the blacks or the whites or whoever they are, if they weren't here, everything would be better for you, isn't that right?"
405,Of course it'd be better!
406,Lt'd be better if you weren't here.
407,Right. Right.
408,"It starts with a drawing like this, and then some kid dies in a driveby, never even knowing what hit him."
409,You don't know nothing!
410,You don't know the pain we feel.
411,You don't know what we got to do.
412,You got no respect for how we living.
413,"You got us in here, teaching us this grammar shit, and then we got to go out there again."
414,"And what are you telling me about that, huh?"
415,What are you doing in here that makes a goddamn difference to my life?
416,"You don't feel respected. Is that what you're saying, Eva?"
417,"Well, maybe you're not. But to get respect, you have to give it."
418,That's bullshit.
419,What?
420,Why should I give my respect to you?
421,'Cause you're a teacher?
422,I don't know you.
423,How do I know you're not a liar standing up there?
424,How do I know you're not a bad person standing up there?
425,I'm not just gonna give you my respect because you're called a teacher.
426,White people always wanting their respect like they deserve it for free.
427,I'm a teacher. It doesn't matter what color I am.
428,It's all about color.
429,"It's about people deciding what you deserve, about people wanting what they don't deserve, about whites thinking they run this world no matter what."
430,"You see, I hate white people."
431, You hate me?
432, Yeah.
433, You don't know me.
434, I know what you can do.
435,I saw white cops shoot my friend in the back for reaching into his pocket!
436,His pocket.
437,I saw white cops break into my house and take my father for no reason except because they feel like it!
438,Except because they can.
439,And they can because they're white.
440,So I hate white people on sight!
441,"Ben, do you have anything to say?"
442,Can I please get out of here?
443,"Lady, stop acting like you're trying to understand our situation and just do your little babysitting up there."
444, That's all you think this is?
445, It ain't nothing else.
446,"When I look out in the world, I don't see nobody that looks like me with their pockets full, unless they're rapping a lyric or dribbling a ball."
447,So what else you got in here for me?
448,And what if you can't rap a lyric or dribble a ball?
449, It ain't this.
450,I know that much.
451, Damn right.
452,And you all think you're gonna make it to graduation like this?
453,I made it to high school.
454,Ain't nobody stopped me.
455,"Lady, I'm lucky if I make it to 18. We in a war."
456,"We're graduating every day we live, because we ain't afraid to die protecting our own."
457,"At least when you die for your own, you die with respect, you die a warrior."
458,That's right.
459,"So when you're dead, you'll get respect? Is that what you think?"
460, That's right.
461, That's right.
462, Yeah.
463, Yeah.
464,You know what's gonna happen when you die?
465,You're gonna rot in the ground.
466,"And people are gonna go on living, and they're gonna forget all about you."
467,"And when you rot, do you think it's gonna matter whether you were an original gangster?"
468,You're dead.
469,"And nobody, nobody is gonna wanna remember you, because all you left behind in this world is this."
470,You're raising your hand?
471,"That thing that you said before, the Holocause?"
472," Holocaust, yes."
473, What is that?
474,Raise your hand if you know what the Holocaust is.
475,Raise your hand if anyone in this classroom has ever been shot at.
476,What about this? We were discussing the Holocaust.
477,"No, they won't be able to read that."
478,We can try. The books are just sitting here.
479,Look at their reading scores.
480,"And if I give your kids these books, I'll never see them again."
481,"If I do, they'll be damaged."
482,What about these? Romeo and Juliet. That's a great gang story.
483,"No, not the books. This is what we give them."
484,"It is Romeo and Juliet, but it's a condensed version."
485,"But even these, look how they treat them."
486,See how torn up they are? They draw on them.
487,Ms. Campbell?
488,They know they get these because no one thinks they're smart enough for real books.
489,"Well, I don't have the budget to buy new books every semester when these kids don't return them."
490,"So, what do I do? Buy their books myself?"
491,"Well, that's up to you, but you'd be wasting your money."
492,Is there someone else I can speak to about this?
493, Excuse me?
494," I'm sorry, but I don't understand."
495,Does the Long Beach Board of Ed agree that these books should just sit here and not be used at all?
496,Let me explain.
497,It's called sitebased instruction.
498,"It means that I and the principal each have the authority to make these kinds of decisions without having to go to the Board, who have bigger problems to solve."
499,Do you understand how it works now?
500,I'm sorry. I didn't mean to overstep your authority.
501,I would never do that. I just...
502,I don't know how to make them interested in reading with these.
503,You can't make someone want an education.
504,"The best you can do is try to get them to obey, to learn discipline."
505,That would be a tremendous accomplishment for them.
506,"Since you know Margaret better than I do, if I could just get some backup from you."
507,I really think that the stories like The Diary of Anne Frank and...
508,"That they'd be so great for them, and she doesn't seem to understand that they could relate to these stories considering all that they face."
509,"Oh, of course. It's a universal story."
510,"I mean, Anne Frank, Rodney King, they're almost interchangeable."
511, Are you making fun of me?
512, Yeah.
513,"God, listen to what you're saying."
514,How dare you compare them to Anne Frank?
515,They don't hide.
516,They drive around in the open with automatic weapons.
517,I'm the one living in fear. I can't walk out my door at night.
518,And you blame these kids?
519,This was an Alist school before they came here.
520,And look what they turned it into.
521,"I mean, does it make sense that kids who want an education should suffer because their high school gets turned into a reform school?"
522,"Because kids who don't want to be here, and shouldn't be here, are forced to be here by the geniuses running the school district?"
523,Integration's a lie.
524,"Yeah, we teachers, we can't say that or we lose our jobs for being racist."
525,"So, please, stop your cheerleading, Erin. You're ridiculous."
526,You don't know the first thing about these kids.
527,And you're not qualified to make judgments about the teachers who have to survive this place.
528,"We're gonna play a game, all right? It's a lot of fun. I promise."
529,"Look, you can either sit in your seats reading those workbooks, or you can play a game."
530,"Either way, you're in here till the bell rings."
531,Okay. This is called the Line Game.
532,I'm gonna ask you a question.
533,"If that question applies to you, you step onto the line, and then step back away for the next question."
534," Easy, right?"
535," Yeah, whatever."
536,"The first question, how many of you have the new Snoop Dogg album?"
537,Did you steal it?
538,"Okay, back away."
539,"Next question, how many of you have seen Boyz n the Hood?"
540,Okay. Next question.
541,How many of you live in the projects?
542,"How many of you know someone, a friend or relative, who was or is in juvenile hall or jail?"
543,How many of you have been in juvenile hall or jail for any length of time?
544,Detention don't count.
545,Does a refugee camp count?
546,You decide.
547,How many of you know where to get drugs right now?
548,How many of you know someone in a gang?
549,How many of you are gang members?
550, Nice try.
551, Nice try.
552,"Okay, that was a stupid question, wasn't it?"
553,Yeah.
554,You're not allowed gang affiliations in school.
555,I apologize for asking. My badness.
556,"Okay, now I'm gonna ask you a more serious question."
557,Stand on the line if you've lost a friend to gang violence.
558,Stay on the line if you've lost more than one friend.
559,Three.
560,Four or more.
