,dialog
1386,"You stay away from Thao, understand?"
1387,You tell your friends to stay away from Thao.
1388,"If they don't listen, tell them you don't wanna see them anymore."
1389,That's it. Got it?
1390,I'll take that as a yes.
1391,If I have to come back here...
1392,...it's gonna get fucking ugly.
1393,Get out of my way.
1394,How do you want your dog?
1395,"I mean, steak?"
1396,Funny.
1397,"I told you, we only eat cats."
1398,Yeah. Well.
1399,Whoa. I've never seen you like this before.
1400,"I'm feeling good. You know, I got beautiful women, great food."
1401,And Thao.
1402,And even Thao isn't bugging me.
1403,"Having a good time, I see."
1404,Yeah.
1405,And it never ends.
1406,What happened to your knuckles anyways?
1407,I slipped in the shower. No big problem.
1408,"Look, now, Yum Yum, if he doesn't ask you out..."
1409,...I'm gonna ask you out.
1410,"Youa, don't listen to him, Youa."
1411,He's a white devil.
1412,"Yeah, I am. I'm the white devil."
1413,"I'd love to, Walt, but he beat you to it."
1414,Really? No kidding.
1415,Dinner and a movie or what?
1416,Yeah. They're taking the bus.
1417,"No, you can't take the bus."
1418,We gotta get you something more stylish than that.
1419,Like what? Take a limo?
1420,How about that?
1421,The Gran Torino?
1422,Yeah.
1423,You'd let me take the Gran Torino?
1424,"Yeah, I'd let you take the Gran Torino."
1425,Really?
1426,"Yeah, really."
1427,Yeah. Yeah.
1428,Here's the pitch. And a strike.
1429,Is everybody all right?
1430,You're all right. You're okay.
1431,You've got a cut.
1432,"It's all right, it's all right, it's all right."
1433,Where's grandma?
1434,Where is Sue? Where is Sue?
1435,She went to our aunt's.
1436,Your aunt's? You sure?
1437,Yeah.
1438,Get on the phone and call right now.
1439,I knew this was gonna happen.
1440,Tried to What the hell am I doing here?
1441,"Well, maybe some of her friends called and they changed plans."
1442,Yeah.
1443,"In the war, we just lost a lot of friends, but you're kind of set for it."
1444,You're geared to it.
1445,"No, no, no."
1446,You fuck! You rotten fuck!
1447,Mr. Kowalski?
1448,You okay?
1449,Yeah. I'm okay.
1450,The police finally left.
1451,No one's talking.
1452,"One thing about the Hmong, they keep their mouths shut."
1453,"Yeah, I've noticed that."
1454,"You know, Thao and Sue are never gonna find peace in this world..."
1455,...as long as that gang's around.
1456,"Until they go away, you know, forever."
1457,What are you saying?
1458,You know what I'm saying.
1459,I took Sue to the hospital.
1460,She's scared. They're all scared.
1461,Yeah.
1462,"Thao, especially."
1463,"He's sitting out there right now, staring at your front door."
1464,"You know what he expects, Mr. Kowalski."
1465,What would you do?
1466,What should Thao do?
1467,I know what I would do if I was you.
1468,Or at least what you think you should do.
1469,Really?
1470,"If I was Thao, I guess I'd want vengeance."
1471,I'd wanna stand shoulder to shoulder with you and kill those guys.
1472,And you?
1473,What would I do?
1474,"I'd come over here and talk to you, I guess."
1475,"I know you're close with these people, but this pisses me off too, Mr. Kowalski."
1476,Want a beer?
1477,I'd love one.
1478,There's some in the chest right over there behind you.
1479,Damn all this.
1480,Just isn't fair.
1481,"Nothing's fair, Father."
1482,"So, what are you gonna do, Mr. Kowalski?"
1483,Call me Walt.
1484,All right.
1485,"What are you gonna do, Walt?"
1486,I don't know...
1487,...but I'll think of something.
1488,"Whatever it is, they won't have a chance."
1489,What are you doing?
1490,Thinking.
1491,Thinking? Thinking time is over.
1492,Now it's time to knock the shit out of those pricks.
1493,"I know you don't wanna hear this, but now's the time to stay calm."
1494,Calm? You want me to be calm?
1495,We stay calm or else mistakes get made.
1496,We have to step back from this thing.
1497,"No. Don't let me down, Walt. Not you."
1498,This is gonna end today.
1499,Sit down.
1500,I don't wanna sit.
1501,"I said, sit down."
1502,"Now, listen to me. We gotta plan this, and plan it very carefully."
1503,We can't make any mistakes.
1504,"Now, you know I'm the right man for this job."
1505,So I want you to go home and stay calm...
1506,...and come back here at 4 this afternoon.
1507,And what needs to be done will be done.
1508,I say we go now. Right now.
1509,And what? Kill that cousin of yours and the rest of those zips?
1510,Mr. Tough Guy out for blood all of a sudden?
1511,You know nothing about it.
1512,Now go home and you stay calm.
1513,Come back here at 4. All right?
1514,Okay?
1515,Okay.
1516,"Yeah. I know, I know."
1517,"Give me a break, will you?"
1518,It's the first time I've ever smoked in the house.
1519,"Let a man enjoy himself, would you, girl?"
1520,All finished. Ten dollars American.
1521,I don't suppose your Guinea hands are steady enough to do a straight shave?
1522,Straight shave? You've never asked for a straight shave.
1523,"I know, but I've always wondered about it."
1524,That's unless you're too busy.
1525,"No, just let me heat up a towel."
1526,"Yeah. And here, here's a 20."
1527,Keep the change. That's just in case you hit my jugular.
1528,It's gonna take about one hour.
1529,We gonna shorten the sleeves a little bit.
1530,Gonna fix the shoulder.
1531,Yeah. I never had a fitted suit before.
1532,"Yes, sir."
1533,Mmhm.
1534,You look very good.
1535,"What can I do for you, Mr. Kowalski?"
1536,I'm here for a confession.
1537,"Oh, Lord Jesus. What have you done?"
1538,"Nothing. You just take it easy, now."
1539,What are you up to?
1540,Are you gonna give me a confession or not?
1541,How long has it been since your last confession?
1542,"Oh, forever."
1543,"Bless me, Father, for I have sinned."
1544,"What are your sins, my son?"
1545,"Well, in 1 968, I kissed Betty Jablonski..."
1546,...at the factory Christmas party.
1547,Dorothy was in the other room with the other wives.
1548,It just happened.
1549,"Yes, go on."
1550,"Well, I made a 900dollar profit selling a boat and a motor."
1551,I didn't pay the taxes.
1552,It's the same as stealing.
1553,"Yes, fine."
1554,"Oh, lastly..."
1555,...I was never very close with my two sons.
1556,I don't know them. I didn't know how.
1557,That's it?
1558,That's it? It's bothered me most of my life.
1559,"Say 10 ""Hail Marys"" and five ""Our Fathers."" God loves you and forgives you, and I absolve you of all your sins."
1560,"In the name of the Father, the Son, and the Holy Spirit."
1561,"Thank you, Padre."
1562,Are you going to retaliate for what happened to Sue?
1563,"I'm going over to that house today, Mr. Kowalski."
1564,Is that so?
1565,It is. And every other day until you see the folly in what you're planning.
1566,Busy day. Gotta go.
1567,Go in peace.
1568,"Oh, I am at peace."
1569,Jesus Christ.
1570,So which one's mine?
1571,You ever fired a weapon before?
1572,No.
1573,"Well, why don't you put that one down?"
1574,And I got something I wanna show you.
1575,Come on.
1576,What?
1577,a chink machinegun nest.
1578,Been shredding us up pretty good.
1579,I was the only one that came back that day.
1580,"For that, they gave me a Silver Star."
1581,Here it is.
1582,Here. I want you to have it.
1583,Why?
1584,"Why? Because we all knew the dangers that night, but we went anyway."
1585,That's the way it might be tonight.
1586,There's always a chance you don't come back.
1587,The hell we won't. We're gonna roll up in there and tear some ass.
1588,That's foolish. That's the exact reaction they're waiting for.
1589,Go ahead and close this up.
1590,How many?
1591,How many what?
1592,How many men did you kill in Korea?
1593,Thirteen. Maybe more.
1594,What was it like to kill a man?
1595,You don't wanna know.
1596,Now close it up.
1597,Walt. Walt. What are you doing?
1598,What are you doing?
1599,Relax. You can't get out of there.
1600,You let me out right now.
1601,Let me out.
1602,Fucking let me out or I'll fucking kill you.
1603,Shut the fuck up.
1604,You wanna know what it's like to kill a man?
1605,"Well, it's goddamn awful, that's what it is."
1606,The only thing worse is getting a medal...
1607,"...for killing some poor kid that wanted to just give up, that's all."
1608,"Yeah, some scared little gook just like you."
1609,I shot him in the face with that rifle you were holding in there a while ago.
1610,"Not a day goes by that I don't think about it, and you don't want that on your soul."
1611,"Now, I got blood on my hands."
1612,I'm soiled.
1613,That's why I'm going it alone tonight.
1614,Walt. You take me with you right now.
1615,Let me out!
1616,"Look, you've come a long way."
1617,I'm proud to say that you're my friend...
1618,...but you got your whole life ahead of you.
1619,"But me, I finish things."
1620,That's what I do. And I'm going it alone.
1621,No. Wait! Walt! Walt!
1622,Walt! Walt! Walt!
1623,"Look, I need you to watch my dog."
1624,"Yeah, I love you too."
1625,"Yeah, she's old too."
1626,"Byebye, sweetheart. Take it easy."
1627,Her name is Daisy.
1628,Hello?
1629,It's Walt.
1630,The keys to my house are under the ceramic turtle on the porch.
1631,Let yourself in. Your brother's in the basement. I gotta go.
1632,"Sorry, Father, we have to go."
1633,"I'm telling you, if we're not here, there will be bloodshed."
1634,We've been here for hours.
1635,We can't afford to anchor a unit to one location.
1636,I'm begging you to stay.
1637,Just got word from my sergeant.
1638,We're pulling the plug.
1639,I'm staying.
1640,"No, you aren't."
1641,"We have specific orders. You came with us, you're leaving with us."
1642,Watch your head.
1643,Sue. Over here. Over here.
1644,Come unlock this.
1645,What's going on?
1646,He left without me.
1647,He went to Smokie's without me.
1648,Thao!
1649,"What the fuck, man?"
1650,Any swamp rats in there?
1651,I didn't think your ass would've came.
1652,"Shut up, gook."
1653,"I got nothing to say to you, shrimpdick midget like you."
1654,"Yeah, yeah. You go ahead, watch out for your boyfriend."
1655,Because it was either he or you or someone who raped one of their own family.
1656,"Your own blood, for chrissake."
1657,"Now, go ahead and pull those pistols like miniature cowboys."
1658,Go ahead.
1659,So where's Thao at?
1660,That pussy motherfucker couldn't come?
1661,Don't worry about Thao.
1662,Thao's got not one second for you.
1663,Says who? You?
1664,"What the fuck you gonna do, old man?"
1665,What you gonna do...
1666,...punk ass old man?
1667,Bitch.
1668,"Kind of jumpy, aren't we?"
1669,Shut the fuck up.
1670,You shut the fuck up.
1671,Got a light?
1672,What the fuck?
1673,No.
1674,Me. I've got a light.
1675,"Hail Mary, full of grace."
1676,"Yes, Sergeant."
1677,What happened?
1678,You need to step back.
1679,He's a friend of mine.
1680,"I said, step back."
1681,"Hey, did you hear him? Step back."
1682,What happened?
1683,"Hey, step back."
1684,He's my friend.
1685,"Please, it's important."
1686,He went for his lighter and they shot him.
1687,He didn't even have a gun on him.
1688,This time we have witnesses.
1689,These guys will be locked up for a long time.
1690,Officer Chang! Get those people back.
1691,"You have to step back now, okay?"
1692,Get them the fuck out of here.
1693,Get them out of here.
1694,Walt Kowalski once said to me that I didn't know anything about life or death...
1695,"...because I was an overeducated, ...who held the hands of superstitious old women and promised them eternity."
1696,Walt definitely had no problem calling it like he saw it...
1697,...but he was right.
1698,I knew really nothing about life or death until I got to know Walt.
1699,"And, boy, did I learn."
1700,"""And I wanna leave my house to the church because Dorothy would've liked it."" Now, which brings us to our last item, and again..."
1701,...please excuse the language in Mr. Kowalski's will.
1702,I'm simply reading it the way it was written.
1703,"""And I'd like to leave my 1 972 Gran Torino..."
1704,...to my friend...
1705,...Thao Vang Lor...
1706,...on the condition that you don't choptop the roof like one of those beaners...
1707,...don't paint any idiotic flames on it like some whitetrash hillbilly...
1708,"...and don't put a big, gay spoiler on the rear end..."
1709,...like you see on all the other zipperheads' cars.
1710,It just looks like hell.
