,dialog
1047,We have to tell them about Saddam Hussein and Satan.
1048, No. My mom can't see me here.
1049, You have to stand up to your mother.
1050,"Gentlemen, do you have any last words?"
1051,"Last words? How's aboot, ""Get me the fuck out of this chair!"" How's that?"
1052,"All right, anonymous, ready the switch."
1053,Wait!
1054,"Go on, dude, tell her."
1055, I can't.
1056, You can't kill Terrance and Phillip.
1057,"If they die, Satan and Saddam Hussein will take over the world."
1058,"Throw the switch, Mr. Garrison."
1059,I'm supposed to be anonymous.
1060,"Goodbye, bastards!"
1061,The Canadians are attacking!
1062,Run for your lives!
1063,We have to shut off the power!
1064,Fuck!
1065,Some little fat kid saved us!
1066,Wait! We have to get you to the rendezvous point.
1067,"Ned, behind you!"
1068,Be not afraid.
1069,"Oh, my God!"
1070,Behold my glory.
1071,What are you?
1072,I am the clitoris.
1073,The clitoris?
1074,I found the clitoris!
1075,"Stan, you must not let Terrance and Phillip's blood spill on the ground."
1076,Tell me how to get Wendy to like me.
1077,There are more important matters right now.
1078,I looked all over for you.
1079,Tell me how to get Wendy to like me.
1080,"Dude, just have confidence in yourself."
1081,"Believe in yourself, and others will believe in you."
1082,Chicks love confidence.
1083,Now go. Hurry!
1084,The clitoris has spoken.
1085,"Stan, are you okay?"
1086,I see you failed. I should not have sent a boy to do a man's job.
1087,Come on!
1088,We've got precious little time!
1089,"Die, Canadian, m'kay?"
1090,Did you hear that?
1091,I farted.
1092,You did? Just now?
1093, Terrance and Phillip!
1094, Let's get to the rendezvous point!
1095,It's Mr. Garrison.
1096,"Children, take Mr. Hat."
1097,Please get him out of here.
1098,Holy shit!
1099,This Vchip is getting all screwy.
1100,Take cover in the trench!
1101,"Human Shield up front, then Operation GetBehindtheDarkies."
1102,"Remember, Human Shield, protect our tanks and planes too."
1103,Holy mother of Jehoshaphat!
1104,Fire on my command.
1105,"All right, squad, just like I told you."
1106,One... two...
1107,Do some people gonna die?
1108, Fire!
1109,... three!
1110,What in the...
1111,"Great plan, Chef."
1112,"Operation Human Shield, my ass!"
1113,"My God, this is terrible."
1114,This is what we wanted!
1115,We wanted our children to be brought up in a smutfree environment!
1116,But we didn't want this.
1117,Where are you going?
1118,We're going to find our boys.
1119,"For God's sake, Sheila, we're going to get them killed!"
1120,All those times I said you were a big dumb Jew?
1121,I didn't mean it. You're not a Jew.
1122,"Yes, I am! I am a Jew, Cartman!"
1123,Don't be so hard on yourself.
1124,Why am I still holding this?
1125,Mr. Hat! No!
1126,Fuck this. I'm getting out before I get in trouble.
1127,I heard that.
1128,I found the clitoris.
1129,Now I can get Wendy to like me again.
1130,"Swell, Stan."
1131,I guess all's well that ends well.
1132,We can go home now. Dipshit.
1133,What's wrong?
1134,"We can't let Terrance and Phillip die, or the whole world will end."
1135,"Terrance, look!"
1136,There they are!
1137,"Phillip, we're done for!"
1138,"All right, men! Fire!"
1139,"Goodbye, Terrance."
1140,What is this?
1141,Don't shoot!
1142,I'll take care of this.
1143,"Kids, get out of the way now!"
1144,"I'm not going to let you kill them, Mom!"
1145,"What, what, what?"
1146,I'm not moving!
1147,Stand down. You can still see fart jokes on Nickelodeon.
1148,No! This is about more than fart jokes!
1149,"This is about freedom of speech, about censorship..."
1150,...and stuff.
1151,What about Ike? Did you forget your adopted son is Canadian?
1152,I'm doing very important things.
1153,But you never took the time to talk to me.
1154,"Whenever I get in trouble, you blame everybody else."
1155,But I'm the one to blame.
1156,Deal with me.
1157,You keep fighting all these causes.
1158,But I don't want a fighter.
1159,I want my mom.
1160,Poor little fella!
1161,"Holy shit, dude!"
1162,"Young man, you watch your mouth!"
1163,My time has come!
1164,You are really fucked now!
1165,It's Saddam Hussein! Shoot him!
1166,What a dumb ass!
1167,You have spilled the blood of the innocent.
1168,Now begins 2 million years of darkness.
1169,"Good job, Ms. Broflovski."
1170,Thanks a lot.
1171,I was trying to make the world a better place for children.
1172,And you brought enough intolerance to allow my coming.
1173,"Now, everyone bow down to me!"
1174,Bend over!
1175,What have we done?
1176,"Saddam, I'm the dark ruler, not you."
1177,Relax.
1178,"Better seen, not heard."
1179,I can't.
1180,Let's start by building a big statue of me!
1181,"There, where that fat kid is standing."
1182,"Don't call me fat, buttfucker!"
1183,"Yeah, Cartman, do it."
1184,Damn! Shit!
1185,Respect my fucking authority!
1186,"You need to watch your mouth, brat!"
1187,Dogshit taco!
1188,"Quick, do something."
1189,Try this on for size.
1190,"Blooddrenched, frozen tampon popsicle!"
1191,"Buddy, I know I was mean before."
1192,"But don't worry, I can change."
1193,Not!
1194,"Fuck, shit, cock, ass, titties, boner..."
1195,"...bitch, muff, pussy, cunt, butthole, Barbra Streisand!"
1196,"What are you waiting for, bitch?"
1197,Destroy him!
1198,"You weak, stupid cum bucket."
1199,Save me!
1200,That's it!
1201,I have had enough of you!
1202,He spent so much time convincing me I was weak and stupid...
1203,...that I believed it myself.
1204,"I have you to thank, little one."
1205,You showed me that I had to get away from him.
1206,Just make any wish you want and I shall grant it.
1207, Are you sure?
1208, What did he say?
1209,His wish is for everything to go back to the way it was before this war.
1210,"Kenny, you realize that means you'd go back too."
1211,I know.
1212,"Very well, then."
1213,I will pull my minions back.
1214,I guess I'm destined to live in hell alone.
1215,Hello.
1216,What's this?
1217,"Hi, there, little guy."
1218,Would you like to go to hell with me?
1219,"Sure. I bet we can be best friends, Mr. Satan."
1220,Feel free to come back and visit anytime.
1221,I just might do that.
1222,"Thanks, Kenny."
1223,Thanks for going back to hell for us.
1224,You're a pal.
1225,"Goodbye, you guys."
1226,I'm alive.
1227,Where's Mr. Hat?
1228,Wow. We were all dying and now we're fine. That's super!
1229,What the fuck's going on?
1230,"See, Mom? It was Cartman's filthy fucking mouth that saved us all."
1231,"I'm sorry I didn't pay attention to you, Kyle."
1232,But what about Gregory?
1233, I never cared for Gregory.
1234, You didn't?
1235,"No, dude. Fuck Gregory!"
1236,Fuck him right in the ear!
1237,"Thank you, clitoris."
1238,Everything worked out What a happy end Americans and Canadians Are friends again So let's all join hands And knock oppression down Don't you know our little lives Are now complete?
1239,'Cause Terrance and Phillip Are sweet Super sweet Thank God we live in this Quiet little pissant Redneck podunk jerkwater Greenhorn onehorse mudhole Peckerwood rightwing whistlestop Hobnail truckdriving Oldfashioned hayseed inbred Unkempt outofdate White trash Kickass!
1240,Mountain...
1241,...town!
1242,Look!
