,dialog
523,"Certain things happen to you when you swear, just like when you lie."
524,The chip picks up on this and gives the subject a little prick.
525,"Patient B5, would you step out here, please?"
526,Patient B5 here has been fitted with the new Vchip.
527,My head hurts.
528,Don't worry about that.
529,"Now, I want you to say ""doggy""."
530,Doggy.
531,Notice that nothing happens.
532," Now say ""Montana""."
533, Montana.
534,Good.
535,"Now, ""pillow""."
536,Pillow.
537,"All right. Now I want you to say ""horsefucker""."
538,"Go ahead, Eric. It's all right."
539,Horsefuck...
540,"That hurt, goddamn..."
541,Fuck!
542,"Now I'd like you to say ""big, floppy donkey dick""."
543,Success!
544,The child doesn't want to swear!
545,"This isn't fair, you sons of bitches!"
546,We will start putting Vchips in all our children next week!
547,Snacky Smores presents: The March of War.
548,Let's hear it for our boys.
549,Clinton has called them to fight the evil Canadians.
550,A fullscale attack was launched on Toronto...
551,"...after the Canadians' last bombing, which devastated the Arquettes."
552,"For security measures, our great government is rounding up..."
553,...all citizens with Canadian blood and putting them into camps.
554,CanadianAmericans are to report to one of these death camps right away.
555,"Did I say ""death camps""?"
556,"I meant happy camps, where you will eat the finest meals..."
557,...have access to fabulous doctors and exercise regularly.
558,"Meanwhile, war criminals Terrance and Phillip are prepped for execution."
559,Their execution will take place...
560,"...during a fabulous USO show, with guest celebrities, including..."
561,...Big Gay Al and Winona Ryder.
562,"Of course, the only way to see the USO show is to sign up for the Army!"
563,So join the Army and kill some Canadian scum as we continue...
564,...the march of war.
565,Eat Snacky Smores.
566,We must rid ourselves of anything Canadian.
567,Don't you like Terrance and Phillip anymore?
568,Course not! Mommy says I hate Canadians because they made me have a dirty mouth.
569,Burn it all!
570," Hey, dudes."
571," What's the matter, Cartman?"
572,It's this Vchip. I hate it.
573,I can't say any dirty words.
574," So you can't say ""fuck""?"
575, No.
576," And you can't say ""shit""?"
577, No.
578,"You can't say, ""I'm Cartman, the fattest piece of shit in the world""?"
579, Fuck you!
580, Dude. Sweet!
581,This has gone far enough.
582,It's time we talked to our moms.
583,We're supposed to be grounded.
584,"Come on, it's time for us to get political."
585,Canada will no longer corrupt our children!
586,"Mom, can I talk to you?"
587,"Kyle, what are you doing here?"
588,You are grounded.
589,Get back to the house and stay there!
590,"You too, Stanley."
591,You're going too far.
592,You can't kill Terrance and Phillip.
593,We must fight for our children's futures!
594, You started a war. You have to stop it.
595, To make them safe again!
596,Our children are precious.
597,We must make a stand now!
598,Stop at nothing!
599,I told you she wouldn't listen.
600,We'll have to save Terrance and Phillip ourselves.
601, What?
602, Think about it.
603,What would Brian Boitano do?
604,He'd rescue Terrance and Phillip before they're executed.
605,We can't do anything.
606,Our moms' organization is too strong.
607,We'll round up all the grounded kids and start our own organization.
608,An organization to help save Terrance and Phillip.
609,"Yeah, our own secret club."
610, I guess that could work.
611, We have to try.
612,"What would Brian Boitano do If he was here right now He'd make a plan and follow through That's what Brian Boitano'd do When Brian Boitano was in the Olympics Skating for the gold He did two salchows and a triple lutz While wearing a blindfold When Brian Boitano was in the Alps Fighting grizzly bears He used his magical fire breath And saved the maidens fair So what would Brian Boitano do If he were here today I'm sure he'd kick an ass or two That's what Brian Boitano'd do I want this Vchip out of me It has stunted my vocabulary And I just want my mom To stop fighting everyone For Wendy, I'll be an activist That's what Brian Boitano'd do That's what Brian Boitano'd do He'd call the kids in town And tell them to unite for truth That's what Brian Boitano'd do Someone say my name?"
613, Who are you?
614, I'm Brian Dennehy.
615,"What? No, not fucking Brian Dennehy!"
616,Get the fuck out of here.
617,"When Brian Boitano traveled through time To the year 3010 He fought the evil robot king To save the human race again When he built the pyramids He beat up Kublai Khan Because Brian Boitano Doesn't take shit from anybody So let's all stick together And unite to stop our moms We'll save Terrance and Phillip too That's what Brian Boitano'd do We'll save Terrance and Phillip too That's what Brian Boitano'd do That's what Brian Boitano'd do Hey, relax, guy."
618,There's nothing on.
619,You get cranky when you're tired.
620,I'm not cranky.
621,What started as a spat between the U.S.
622,and Canada is turning into WWIII.
623,World War III?!
624,Terrance and Phillip will be put to death for crimes...
625,It has come to be.
626,The Four Horsemen are drawing nigh.
627,The time of prophecy is upon us.
628,I love when you get biblical.
629,You know exactly how to turn my crank.
630,"No, I'm being serious."
631,It is the seventh sign.
632,What?
633,Behold...
634,"...the first signs of my reign have all come true: The fall of an empire, the coming of a comet..."
635,"...and now, when the blood of these Canadians touches American soil..."
636,...it will be our time to rise.
637,"Yeah, man, I'm getting so hot!"
638,Let's fuck!
639,Do you always think about sex?
640,I'm talking about important stuff here.
641,I'm just excited about taking over the world! Come on!
642,Is sex the only thing that matters to you?
643,I love you.
644,I want to believe that.
645,What do you say we shut off that light and get close?
646,"You like that, don't you, bitch?"
647,We can use my dad's computer to call the kids together.
648,"Before we put a message out, do a search on ""clitoris""."
649,"""Found: Eight million pages with the word 'clitoris'."" I'll just try the first one."
650,"""You must be 18 to enter this website. "" ""Welcome to German Sick Fetish Video. "" ""If you are under 18, do not... "" Well, okay."
651,It's a lady getting pooed on!
652, Is it Cartman's mom?
653, Very funny.
654,It is Cartman's mom!
655,Son of a bit...!
656,"Lke, you're too young for this stuff."
657,Bullshitah.
658,What's she doing now?
659,"Click it off, dude!"
660,What's wrong with German people?
661,Let's do what we came here to do and put a message out.
662,I've gotta put out an allaccess email.
663," Goddamn, your mom sucks!"
664, Get to the message board!
665,Can't find a Canadian server.
666,I'll break into the mainframe.
667,They've got an access code!
668,I'll try to reroute the encryptions.
669,"Here we go. ""Want to help Terrance and Phillip?"" ""Sneak out after you get tucked into bed tonight and meet at Carl's warehouse. ""  Tell them we'll have punch and pie."
670, We're not.
671,More people will come if they think we have punch and pie!
672,"""Punch and pie. "" ""This is topsecret."
673,"The password is... "" ""La Résistance. "" So the draft will begin tomorrow..."
674,...as more troops are needed to invade the Canadian border.
675,The Canadian government pleads for a peaceful resolution...
676,...but we're not listening.
677,"Good night, hon."
678,"Mom, when will the war be over?"
679,"I don't know, hon. Soon, we hope."
680,"You want it to end quickly, huh?"
681, Mom?
682," Yes, hon?"
683,"If you were in a German ""scheiße"" video, you'd tell me, right?"
684,"Sure, hon. Good night."
685,There's a ghost!
686,"Kenny, is that you?"
687,Satan? Satan is coming here?
688,Saddam Hussein?
689,That doesn't make sense!
690,"Eric, what is it?"
691,I saw him! I saw Kenny!
692,You poor dear.
693,You've been through so much.
694,"I bet him he couldn't light a fart on fire, and now he's pissed off."
695,"I can't say ""pissed off""?"
696,The execution of Terrance and Phillip is imminent.
697,"Soon, Saddam and I will rule the world."
698,I got some new luggage for our trip up to Earth.
699,Let's fuck to celebrate!
700,What's it like up on Earth?
701,Tell me about it again.
702,Let's not talk. Let's get busy.
703,Remember when you first got here?
704,"We used to talk all night, until the sun came up."
705,We would just lie in bed and talk.
706,Because I was waiting to get you in bed.
707,How come you always want to make love to me from behind?
708,Is it because you want to pretend I'm somebody else?
709,"Satan, your ass is gigantic and red."
710,Who am I gonna pretend you are?
711,Liza Minnelli?
712,Don't get all pissy!
713,"Sometimes I think When I look up real high That there's such a big world up there I'd like to give it a try But then I sink 'Cause it's here I'm supposed to stay But I get so lonely down here Tell me, why's it have to be that way?"
714,"Up there, there is so much room Where babies burp and flowers bloom Everyone dreams, I can dream too Up there Up where the skies are ocean blue I could be safe and live without a care Up there They say I don't belong I must stay below alone Because of my beliefs I'm supposed to stay where evil is sown But what is evil anyway Is there reason to the rhyme Without evil there could be no good So it must be good to be evil sometimes Up there, there is so much room Where babies burp and flowers bloom Everyone dreams, I can dream too Up there Up where the skies are ocean blue I could be safe and live without a care Live without a care If only I could live up there I want to live, I want to live up I want to live up there  You're late!"
715, I had to ride my bike here.
716, My behind is killing me.
717," Your ""behind""?"
718,"I have to say ""behind"" because I get shocked if I say ""ass""."
719,Did you bring the punch and pie?
720,"No. You guys, something happened."
721,I don't think Kenny's dead.
722,I saw him in my room.
723,"I know, Cartman."
724,I see Kenny every day.
725, You do?
726," Sure, dude."
727,"On the face of every child, on the smile of every baby."
728,This was Kenny! He said that if Terrance and Phillip die...
729,...Saddam Hussein and Satan will come up and rule the world!
730,Saddam Hussein?
731,Who is it?
732,"I'm here for ""La Résistance""."
733,What's the password?
734,I don't know.
735,Guess.
736,Bacon.
737,"""Viva La Résistance""!"
738,"Oh, no! It's that kid!"
739,This is the place.
740,"Stan? You started ""La Résistance""?"
741,You're more political than we thought.
742,Let us get this meeting underway.
743,Many others are coming.
744,A lot of people showed up.
745,"Terrance and Phillip are supposed to be killed, and we think that sucks ass!"
746,We were to understand there'd be pie and punch.
747,There isn't any.
748,Terrance and Phillip are supposed to be killed...
749,...so we should prank call a bunch of policemen...
750,...and have pizzas sent to them that they didn't order.
751,"""Viva La Résistance""!"
752, May I?
753, What?
754,Terrance and Phillip are being held in a camp two kilometers from town.
755,They are to be executed tomorrow during a starstudded USO show.
756,Tomorrow?
757,"Once the show begins, we'll have an hour..."
758,...to get them out of their cell and into this clearing.
759,"There, we will rendezvous and take them back to Canada."
760,"Dude, Wendy's new guy is smart."
761,Meet me at the rendezvous point at 10 p. m.
762,Sneaking in and breaking them out will be dangerous...
763,...so I'll go myself.
764,No! We're going!
765,"We started ""La Résistance"". We'll get them and meet at the rendezvous point."
766,This will be very dangerous.
767,Are you quite sure?
768,Fuck that!
769,Do you want that Vchip in you forever?
770,We'll go. Let's run through the plan.
771,"Oh, boy! Military action, Ned!"
772,Let's kill us some goddamn Australians!
773,I think we're fighting Canadians.
774,"Canadians, Australians, what's the difference?"
775,"This uniform makes me feel like a tough, brute man, Mr. Hat."
776,"It sure does, Mr. Garrison."
777,I can't wait for our first shore leave...
778,...so I can get me some fucking poon tang.
779,Pay attention! Tomorrow night is the USO show for all you troops.
780,"There will be celebrities, followed by the execution of Terrance and Phillip."
781,"After the show, we will finally be sending ground troops into Canada."
782,So let's strategize.
783,Map!
784,Our sources have told us that the Canadians...
785,"...are preparing for our invasion, so we must use caution."
786,Each battalion has a specific code name and mission.
787,"Battalion 5, raise your hands."
788,You will be the allimportant first attack wave...
789,"...which we will call ""Operation Human Shield""."
790,Wait a minute!
791,Keep in mind Operation Human Shield will suffer heavy losses.
792,Battalion 14?
793,Right. You are Operation GetBehindtheDarkies.
794,You will follow Battalion 5.
795,"Try not to get killed, for God's sake."
796,Are there any questions?
797,"Yes, soldier."
798,Have you ever heard of the Emancipation Proclamation?
799,I don't listen to hiphop.
800,"After that, we will march into the heart of Canada, and we will..."
801,I'm gonna get you!
802,What's wrong with this thing?
803,It's fucking Windows 98!
804,Get Bill Gates in here!
805,"You told us Windows 98 would be faster, with better access to the Internet!"
806,It is faster. Over 5 million...
807,"All right, men, get lots of rest..."
808,...and prepare to...
809,"After you have Terrance and Phillip, make your way to this ridge."
810,We will wait for you.
811,But not for long.
812,"So if you're not there at 10, we'll have to leave."
813,"You're brave, but you'll need help from someone who's done this before."
814,"Here's the address of ""The Mole""."
815,He is an expert in covert operations.
816,Your first task will be obtaining him.
817,Get lots of sleep. Tomorrow we will all be risking our lives for freedom.
818,"God has smiled upon you this day The fate of a nation in your hands And blessed be the children here Who fight with all our bravery Till only the righteous stand You see the distant flames They bellow in the night You fight in all our names For what we know is right And when you all get shot And cannot carry on Though you die, ""La Résistance"" lives on You may get stabbed in the head With a dagger or a sword You may be burned to death Or skinned alive or worse But when they torture you You will not feel the need to run For though you die, ""La Résistance"" lives on Blame Canada Blame Canada Because the country's gone awry Tomorrow night these freaks will fry Tomorrow night Our lives will change Tomorrow night We'll be entertained An execution, what a sight Tomorrow night Up there, there's so much room Where babies burp and flowers bloom Tomorrow night up there is doomed And so I will be going soon Shut your fucking face Uncle fucker You're a bonerbiting bastard Uncle fucker  Looks like we may be out of luck  Tomorrow night, we're pretty fucked Why did our mothers start this war What the fuck are they fighting for When did this song become a marathon When Canada is dead and gone There'll be no more Celine Dion They may cut your dick in half And serve it to a pig And though it hurts, you'll laugh And dance a dickless jig That's the way it goes In war you're shat upon Though you die ""La Résistance"" lives on I'm so excited. Just one more day until we can take over the world."
819,"I don't know if I can sleep, if you know what I mean."
820,This book talks about how people communicate differently.
821,"I communicate by wanting you to ask me questions, and you..."
822,That is interesting. Let's fuck!
823,"Saddam, I'm trying to have a nice conversation with you!"
824,Now that is just not appropriate!
825,"Come on, I'm just fucking with you!"
826,It's not real!
827," Well, that's still not appropriate."
828," Hey, daddy."
829,"It's not real, either! Come on, guy!"
830,Soon the world will belong to me.
831,It's Saddam.
832,He doesn't nurture my emotions.
833,He just wants sex and can't learn to communicate.
834,You're right. I should leave him.
835,I'll tell him...
836,"...""Saddam, I'm going to Earth to rule alone!"" I'm strong and I don't need him!"
837,"Today's the day for the USO show We're so happy we get to go I don't know but I've been told Canadian pussy is mighty cold Stay in the attic, because if they find you..."
838,...they'll put you in a concentration camp.
839,Don't worry.
840,We'll put an end to this.
841,"Then I'll make Mom come home, and we'll all be a family again."
842,We need to speak with The Mole.
843,I'm sorry. The Mole is grounded.
844,He can't come out and play.
845, What?!
846, He's a kid?
847,He said very naughty things about God.
848,Can we just talk to him for five seconds?
849,"Well, all right. Christophe!"
850,We're gonna rescue Terrance and Phillip from the USO show...
851,Who sent you?
852,Gregory! He said you could sneak us in.
853,Are you telling me you intend to break into the USO show...
854,...filled with thousands of soldiers and break out Terrance and Phillip?
855,I thought it was a stupid idea too.
856,"We're ""La Résistance"". We wanna save Terrance and Phillip and stop the war."
857,I can't help you.
858,I'm grounded for the next three days.
859,So are we. Our parents think we're home right now.
860, Why are you grounded?
861, Why?
862,Because God hates me.
863,He has made my life miserable.
864,"So I call Him a cocksucking asshole, and I get grounded."
865, So will you help us?
866, Very well.
867,"Meet me in the backyard in five minutes. ""Viva La Résistance. "" We'll show God that we won't fucking..."
868,"What? Christophe, get in here!"
869,"Coming, mother."
870,I must be strong. I must be strong.
871,"Saddam, I need to talk to you."
872,"Get packing, bitch. We have to go!"
873,We're running out of time!
874,"Saddam, sometimes you can love a person very much..."
875,...but still know they aren't right for you.
876,What are you talking about?
877,You treat me like shit!
878,I'm leaving you!
879,I'm going up to Earth to rule alone.
880,"No! No, you can't do that!"
881,"I'm sorry, but I have to be strong."
882,Give me another chance!
883,I have to go to Earth!
884,You don't have respect for me!
885,"Sure I do, guy."
886,Please just hear me out.
887,"Some people say that I'm a bad guy They may be right They may be right But it's not as if I don't try I just fuck up, try as I might But I can change, I can change I can learn to keep my promises I swear it I'll open up my heart And I will share it Any minute now, I will be born again Yes I can change, I can change I know I've been A dirty little bastard I like to kill, I like to maim I'm insane, but it's okay 'Cause I can change It's not my fault that I'm so evil It's society, society You see my parents Were sometimes abusive And it made a prick of me But I can change, I can change What if you remain A sandy little butthole Don't be such a twit Mother Teresa won't have shit on me Just watch me change Here I go. I'm changing!"
888,"You see, I've really matured."
889,All right.
890,"Come on, we have to hurry."
891,I love you.
892,Ladies and gentlemen of the American Army...
893,...welcome to the USO show.
894,Get ready for loads of entertainment and fabulous celebrities...
895,...followed immediately by the execution of Terrance and Phillip.
896,This is where those military bitches intend to kill Terrance and Phillip.
897,"Oh, my God!"
898,God? He is the biggest bitch of them all.
899,Hurry. We rendezvous with the other kids at 10.
900,"You realize we could be grounded for two, even three weeks."
901, We're willing to take that risk.
902, Let's go.
903,"And now, here are your hosts for the evening, Sheila Broflovski..."
904,...and Big Gay Al.
905,"Al, tonight is a very special night."
906,Do you know why?
907,They're having a sale at Merv's?
908,No. Because we're going to abolish Canadian smut.
909,"That's right, Sheila."
910,Bring out the condemned.
911,Today is a great day for democracy!
912,This is worse than when you put your dick in my mouth and took a picture.
913,"I know, Terrance. I know."
914,"While you're getting set up over there, let's bring out our first act: Yippie, the backflipping dog!"
915,Be careful not to touch this wire.
916,Motherfuck...
917,Fuck.
918,The show has started.
919,We're running out of time.
920,Do you see Terrance and Phillip?
921,"Yes, but they are heavily guarded."
922,"Dig from here, so as not to be seen."
923,"Come on, bitches."
924,"Mole, do you know where the clitoris is?"
925, The what?
926, The clitoris.
927,"I have to find it, so I can get Wendy to like me."
928,Stop thinking with your dick!
929,"Be on your toes, because I won't be grounded again!"
930,Not for you! Not for anybody!
931,"Men, when you're out there in the battlefield..."
932,...and you're looking into the beady eyes of a Canadian...
933,...as he charges you with his hockey stick or whatever he has...
934,"...and people are dying all around you, just remember what the MPAA says: ""Deplorable violence is okay as long as people don't say any naughty words. "" That is what this war is all about."
935,What?
936,Shit!
937,"Move, move."
938,We will split up here.
939,Let's synchronize watches.
940, We don't have watches.
941, You don't?
942, You didn't say anything about watches.
943, What do you think this is?
944,TV kiddie hour where we sit around and lick Barney the Dinosaur's pussy?
945,"This is real life, with consequences you take to the grave."
946, We don't have watches.
947, Shit!
948, Did you bring the mirror?
949, Got it.
950, And the rope?
951, Check.
952, And the buttfor?
953," What's a ""buttfor""?"
954,"For pooping, silly."
955,"I'll dig under the stage. With that bedrock, I'll need more time."
956,"Stan and Kyle, stall the show anyway you can."
957,Keep that show going until I get the prisoners.
958,"Cartman, over there is the electrical box."
959,Shut it off before I return with Terrance and Phillip...
960,...or the alarm will sound and I'll be attacked by dogs.
961,Got it?
962,You must shut off the alarms.
963,I fucking hate guard dogs!
964,"I heard you, you British piece of shit."
965,"If anything goes wrong, make a sound like a dying giraffe."
966,What's a dying giraffe sound like?
967, Let's go.
968," Be careful, dude."
969,Was my mother careful when she stabbed me in the heart...
970,"...with a clothes hanger, while I was still in the womb?"
971,"Damn, that kid is fucked up."
972,How are those chairs coming?
973,"Al, we're minutes away."
974,Super. Here is pintsized pixie and darling of the indie movie scene...
975,...Winona Ryder!
976,"Hi, guys."
977,I'm superpsyched to be here today.
978,What you're doing for our country is so cool.
979,"I mean war, man. Wow, war."
980,You know? Wow.
981,"Okay, and now for your enjoyment, here's my famous PingPong ball trick."
982,"Oh, my!"
983,"""Shut off the power, Cartman. "" ""This is very important, Cartman. ""  Did you hear what Winona Ryder's doing?"
984, We can't miss this.
985,There. I didn't miss one.
986,That's my PingPong ball trick!
987,That's all the acts we have for tonight...
988,...so let's just get on with the execution!
989," No, we have to stall him."
990, More! More!
991,Yeah! More!
992,You big sillies.
993,You want to see more of me?
994,Yeah! Big Gay Al! Big Gay Al!
995,"Well, I do have a little song I wrote about the war."
996,But we haven't rehearsed.
997,Sing it!
998,I can't.
999,Sing the fucking song!
1000,"All right. If you insist, I'll sing my song."
1001,I believe it goes a little bit like this.
1002,Bombs are flying People are dying Children are crying Politicians are lying too Cancer is killing Texaco's spilling The whole world's gone to hell But how are you?
1003,"I'm super Thanks for asking I couldn't be better I must say I'm feeling super No, nothing bugs me Everything is super when you're..."
1004,"Don't you think I look cute In this hat I'm so sorry, Mr. Cripple But I just can't feel too bad For you right now Because I'm feeling So insanely super That even the fact that you can't walk Can't bring me down He's super Thanks for asking All things considered He couldn't be better, he must say I'm super No, nothing bugs me Don't you think I look cute in this hat These pants This matching tie I got at Merv's In the barracks And the trenches as well  Stick 'em up!"
1005," Big Gay Al says you have to tell Yes, he's super And he's proud to be gay Everything is super When you're gay When you're gay Again! Again!"
1006,Who's there?
1007,Son of a gun! Heck!
1008,They're coming?
1009,But our moms won't listen to us.
1010,"Okay, everybody, just want to thank our wonderful sponsors..."
1011,He's almost got them.
1012,We're here to rescue you.
1013,Follow me through the tunnel.
1014,You guys! Seriously.
1015,I saw Kenny again.
1016,Did you shut the alarm off?
1017,"Oh, shit!"
1018,Hear that?
1019,Sounds like a dying giraffe.
1020,Shit!
1021, A spy!
1022, Get him!
1023,Shit! Shit!
1024,"Come on, Mole!"
1025,Shit! Shit!
1026,Fucking guard dogs! Shit!
1027,The alarms went off.
1028,That was my bad. Sorry.
1029,Hold me. It's so very cold.
1030,There is no hope. Get out.
1031, We can't leave without you.
1032, It's okay.
1033,"No, we can't."
1034,We don't know where we are!
1035,Where's your God when you need him?
1036,"Where is your beautiful, merciful faggot now?"
1037,"Here I come, God."
1038,"Here I come, you fucking rat."
1039,"Now the light she fades And darkness settles in But I will find strength  No, Mole, hang on."
1040, I will find pride within  We'll get you home.
1041, Because although I die  I can't face my mother.
1042, Our freedom will be won Not alone.
1043,"Though I die ""La Résistance"" lives..."
1044,...on Shit!
1045,"Okay, here it is. The moment we've all been awaiting: The execution!"
1046,The day is ours!
