,dialog
0,"and don't brag about it!:D There's a bunch of birds in the sky And some deers just went running by Oh, the snow's pure and white On the earth rich and brown Just another Sunday morning In my quiet mountain town The sun is shining And the grass is green Under the three feet of snow I mean This is the day When it's hard to wear a frown All the happy people stop To say hello  Out of my way!"
1," Even though the temperature's low It's a perfect Sunday morning In my quiet mountain town Well, good morning, Stan."
2," Mom, can I have $8 to see a movie?"
3, A movie?
4,It'll be the best movie ever.
5,A foreign film from Canada.
6, All right. But be back for supper.
7," Thanks, Mom."
8,"Oh, what a pictureperfect child Just like Jesus he's tender and mild He'd wear a smile While he wore a thorny crown What an angel with a heart So sweet and sure And a mind so open and pure Thank God we live In this quiet redneck mountain town Dude! Dude, wake up!"
9,"Kenny, come on!"
10,The Terrance and Phillip movie is out.
11,You wanna come?
12,Where do you think you're going?
13,You have to go to church!
14,"Well, fine."
15,Go ahead and miss church.
16,"When you die and go to hell, you can answer to Satan!"
17,You can see your breath Hanging in the air You see homeless people But you just don't care It's a sea of smiles In which we'd be glad to drown That's right!
18,"It's Sunday morning In our quiet little Whitebread redneck mountain town  Ready, Ike? Kick the baby!"
19, Don't kick the baby.
20,Kick the baby.
21,"Ike, you broke another window!"
22,That's a bad baby. Bad baby!
23,We're going to the Terrance and Phillip movie.
24,"Oh, my God!"
25,"Kyle, where are you going?"
26, We're going iceskating.
27, Take your brother.
28,He's not even my real brother.
29,He's adopted.
30,Do as I say!
31,"Okay, I'm sorry."
32,"Look at those frail and fragile boys It really gets me down The world is such a rotten place And city life's a complete disgrace That's why I moved to This redneck ""meshuggenah"" Quiet mountain town Ike! Bad baby!"
33,Brought to you by Snacky Smores...
34,...the fun of s'mores in a cookie.
35,"Mom, somebody's at the door!"
36," Coming, hon."
37, I can't see the TV!
38,It's been six weeks since Saddam Hussein was killed by wild boars...
39,...and the world is glad to be rid of him.
40,"Eric, it's your little friends."
41,What are you doing here?
42,"Sweet, dude. Yes!"
43,Off to the movies we shall go Where we learn everything That we know 'Cause the movies teach us What our parents don't have time to say And this movie's gonna Make our lives complete  'Cause Terrance and Phillip are sweet  Super sweet.
44,Thank God we live in the quiet little Redneck Podunk white trash U.S.A.
45,"Can I have five tickets to Terrance and Phillip ""Asses of Fire""?"
46,No.
47,What do you mean?
48,"""Asses of Fire"" is rated R by the Motion Picture Association of America."
49,You must be accompanied by a parent or guardian.
50, Why?
51, This movie has naughty language!
52,"Next, please."
53, This can't be happening.
54, We have to see it.
55,Screw it.
56,It probably isn't good anyway.
57,"Cartman, what do you mean?"
58,You love Terrance and Phillip.
59,But the animation's all crappy.
60,Wait. I've got an idea.
61,"Hi. I want six tickets to ""Asses of Fire""."
62,This movie may not be appropriate for the little ones.
63,He says this movie isn't appropriate for you.
64,"Mr. Homeless Guy, if you don't want $10..."
65,"...to buy a bottle of vodka, then be my guest."
66,"Six tickets, please."
67, Let me have some candy.
68, Let's see.
69,I don't have any Jewish candy.
70,"Like you need all that chocolate, fat boy!"
71,The movie's starting.
72,Hooray!
73,"Terrance, what did the Spanish priest say to the Iranian gynecologist?"
74,"I don't know, Phillip. What?"
75,Where do they find this stuff?
76,"You're such a pigfucker, Phillip."
77,What did he say?
78,Why'd you call me a pigfucker?
79,"Well, let's see."
80,"First of all, you fuck pigs."
81,"Oh, yeah."
82,"Well, fuck my ass and call me a bitch."
83,You shitfaced cockmaster.
84,"""Shitfaced cockmaster. "" You donkeyraping shiteater."
85,"""Donkeyraping shiteater. ""  You'd fuck your uncle!"
86, You'd fuck your uncle!
87,"Shut your fucking face Uncle fucker You're a cocksucking Asslicking unclefucker Yes, it's true Nobody fucks uncles quite like you Shut your fucking face Uncle fucker You're the one that fucked your uncle Uncle fucker You don't eat or mow the lawn You fuck your uncle all day long What's going on here?"
88, What garbage.
89, What do you expect? They're Canadian.
90,Shut your fucking face Uncle fucker You're a bonerbiting bastard Uncle fucker  You're an unclefucker I must say  You fucked your uncle yesterday Uncle fucker That's UNCLE fuck you Uncle fucker Suck my balls.
91, That movie was fucking sweet!
92, You bet your fucking ass it was!
93,"Fuck, I wanna be just like them."
94,"Wait, where's your guardian?"
95,"I knew it! You paid a homeless guy to get you in, didn't you?"
96,"Fuck off, you donkeyraping shiteater."
97,Shut your fucking face Uncle fucker You're an asslicking Ballsucking unclefucker Where have you been all day?
98,Nowhere. We just went to go see the Terrance and Phillip movie.
99,How'd you get in?
100,"Stop crowding us, shitfaced cockmasters!"
101,You're all assramming unclefuckers.
102,We've got to see this movie.
103,"Terrance and Phillip are Canadian, just like my brother."
104,There's the girl that I like Tell about when Terrance called Phillip a testicleshitting rectal wart.
105,"Now more than ever She gives me butterflies It makes my stomach queasy Every time she walks by Asshole, I'm talking to you."
106,I know I can be cool If I try Gross!
107,"Wendy, let us try to jump the hilly brush."
108,Who are you?
109,"Gregory. I transferred from Yardale, where I had a 4.0 grade point average."
110,Want to skate with us?
111,"We've been skating all morning, laughing and talking of memories past."
112,We saw the Terrance and Phillip movie.
113,"Try and catch me, Wendy."
114,"Bye, Stan."
115,I saw the Terrance and Phillip movie.
116,Who wants to touch me?
117,"I said, who wants to fucking touch me?"
118,We gotta see the Terrance and Phillip movie too.
119,"I hate you, Kenny."
120,"Shut your fucking face Uncle fucker You're a bonerbiting bastard Uncle fucker Okay, children, let's take our seats."
121,We have a lot to learn today.
122,"We sure do, Mr. Hat."
123,Let's start the day with a few new math problems.
124,What is five times two?
125,Don't be shy.
126,Just give it your best shot.
127," Yes, Clyde."
128, Twelve?
129,Now let's get an answer from someone who's not a complete retard.
130,"Anyone? Come on, don't be shy."
131,"I think I know the answer, Mr. Garrison."
132," Shut up, fat boy!"
133," Don't call me fat, you fucking Jew!"
134, Eric! Did you just say the Fword?
135," ""Jew""?"
136,"You can't say ""fuck"" in school, you fucking fat ass."
137,Why the fuck not?
138,"You said ""fuck"" again."
139,"What's the big deal? It doesn't hurt anybody. Fuck, fuckitty, fuck."
140,How would you like to go see the counselor?
141,How would you like to suck my balls?
142,What did you say?!
143,"I'm sorry, I'm sorry."
144,"Actually, what I said was..."
145,"...""How would you like to suck my balls, Mr. Garrison?"" Holy shit, dude."
146,I'm disappointed in you boys.
147,You should be ashamed of yourselves.
148,I've called in your mothers...
149, You called my mom?
150, That's right.
151,"Oh, no, dude!"
152," Mr. Mackey, can I ask a question?"
153," M'kay, what?"
154,What's the big fucking deal?
155,"I want to know where you heard these horrific obscenities, m'kay?"
156, Nowhere.
157, We heard them from Mr. Garrison before.
158,I seriously doubt that Mr. Garrison ever said...
159,"...""Eat penguin shit, you assspelunker. "" Sweet."
160,Thank you for coming on short notice.
161,"This isn't like you, Stanley."
162,"What did my son say, Mr. Mackey?"
163,Did he say the Sword?
164,"No, it was worse than that."
165,The Fword?
166,Here's a short list of the things they've been saying.
167," Oh, dear God."
168, What the heck is a rim job?
169,When you put your legs behind your head and have someone lick your ass.
170,Tell Mr. Mackey this instant where you heard all these horrible phrases!
171,We all swore ourselves to secrecy.
172, The Terrance and Phillip movie.
173, Dude!
174,I wanna get out of here.
175,Terrance and Phillip? Those Canadians?
176,Excuse me.
177,What is Terrance and Phillip?
178,Terrance and Phillip are two very untalented actors from Canada.
179,Nothing but foul language and toilet humor!
180,I'll send a warning to parents before more children see Terrance and Phillip.
181,Everybody's fucking seen it.
182,I can't help myself. That movie has warped my fragile little mind.
183,There's the girl that I like Over there laughing with that smart...
184,You're holding up the goddamn lunch line!
185,"Hello, there, children."
186," Hey, Chef."
187, How's it going?
188, Bad.
189, Why bad?
190,We got busted for swearing.
191,We can't ever see that movie again.
192,That's too bad.
193,You should've seen Kyle when his mom showed up. He was scared.
194," Shut up, Cartman!"
195, I'd be scared. Your mom's a bitch.
196,"Don't call her a bitch, you fat fuck!"
197,"Don't call me fat, you fucking son of a bitch!"
198,Where did you learn to talk like that?
199,"Pretty fucking sweet, huh?"
200,How do you make a woman like you more than any other guy?
201,That's easy.
202,You just gotta find the clitoris.
203,"What does ""find the clitoris"" mean?"
204,Forget I said anything.
205,Move along.
206,You're holding up the line.
207,Do you know where I can find the clitoris?
208, The what?
209, Is that like finding Jesus?
210,"Attention, students."
211,We are now enforcing a new dress code at South Park Elementary.
212,Terrance and Phillip shirts are not allowed in school.
213,Anyone wearing a Terrance and Phillip shirt is to be sent home immediately.
214,Hooray!
215,"The Canadian film ""Asses of Fire"" is number one at the box office."
216,Is the film destroying American youth?
217,Here with a special report is a midget in a bikini.
218,The effects of the Canadian comedy are farreaching indeed.
219,"All over America, children seem to be influenced, like at this spelling bee."
220,This is for the silver medal.
221,"Spell ""forensics""."
222,"Why should I fucking have to spell ""forensics""?"
223,Here you go. SUCKMYASS.
224,Forensics.
225,The devastating impact of the duo can also be seen with their hit song...
226,"...""Shut Your Fucking Face, Uncle Fucker. "" Shut your fucking face Uncle fucker You're a bonerbiting bastard Uncle fucker I told you that we won't stop I told you that we won't stop Back to you, Tom."
227,Thanks. Shocking report.
228,The controversy began in the town of South Park...
229,...where the PTA is trying to ban the movie.
230,"With us tonight is the head of the PTA, Sheila Broflovski."
231, And the Canadian minister of movies.
232, Thanks for having me.
233,Parents are concerned about your country's entertainment.
234,The film isn't intended for children...
235,But of course children will see it.
236,Can I finish?
237,We're surprised by your outrage.
238, You just don't care!
239, Can I finish? Hello?
240,The U.S. has graphic violence on TV all the time.
241,We can't believe a movie with foul language pisses you off.
242, Because it's evil!
243, Can I finish?!
244,Please can I finish?!
245,"Okay, I'm finished."
246,This film isn't the first troublesome thing to come out of Canada.
247,Let's not forget Bryan Adams.
248,Our government's apologized for Bryan Adams on several occasions.
249,"You Canadians are all the same, with your beady eyes and flapping heads."
250,I resent that! I find that racist...
251,Our children are now addicted to your puke!
252,You are a racist!
253,It'll take us weeks to erase the damage this film has done to our children.
254,"Kids, I want to welcome you to rehabilitation, m'kay?"
255,Your mothers insisted you be taken from your schoolwork...
256,...and placed into rehab to learn not to swear.
257,I don't belong with these rogues.
258,I attended Yardale and had a 4.0 grade point average.
259, You're a fucking faggot.
260," M'kay, you see?"
261,This is what I'm talking about.
262,We have to get you off of foul language.
263, How are we gonna do that?
264, Listen here.
265,"There are times when you get Suckered in By drugs and alcohol And sex with women, m'kay?"
266,"But it's when you Do these things too much That you've become an addict And must get back in touch You can do it It's all up to you, m'kay With a little plan You can change your life today Don't spend your life Addicted to smack Homeless Giving handjobs for crack Follow my plan And very soon you will say It's easy, m'kay Instead of ""ass"" say ""buns"" Like ""Kiss my buns"" Or ""You're a bunshole"" Instead of ""shit"" say ""poo"" As in ""bull poo"", ""poohead"" And ""This poo is cold"" With ""bitch"" drop the ""T"" 'Cause ""bich"" is Latin For generosity Don't say ""fuck"" anymore 'Cause ""fuck"" is the worst word That you can say So just use the word ""m'kay"" We can do it It's all up to us, m'kay With a little plan We can change our lives today You can change it today Don't spend your life Shooting up in the trash Homeless Giving handjobs for cash Follow this plan And very soon you will say It's easy, m'kay Step one  Say ""buns""  Like ""Kiss my buns"" Or ""You're a bunshole""  Step two  Instead of ""shit"" say ""poo""  As in ""bull poo""  And ""This poo is cold""  Step three  With ""bitch"" drop the ""T"" 'Cause ""bich"" is Latin for generosity  Step four  Don't say ""fuck"" anymore It's the worst word You can say ""Fuck"" is the worst word That you can say We shouldn't say ""fuck"" Fuck no!"
267,"You're cured, you can go Don't spend your life Shooting up in the trash Homeless Giving handjobs for cash Follow this plan And very soon you will say It's easy, m'kay Now you're cured. Take the rest of the afternoon off for personal reflection."
268,"Find your own constructive way to better yourself, m'kay?"
269,I hope you've learned something through this experience.
270,"I did. I learned that you are a bonerbiting, dickfart fuckface."
271,Want to see the northern lights?
272,You burned yourself to death by lighting your fart.
273,"I sure did, Phillip."
274,Uncle fucker! Good night.
275,"Oh, man. This movie rules."
276,"Man, that movie gets better every time I see it."
277,That part about lighting farts is bullshit.
278, You can't do that.
279," Yes, you can."
280,No way.
281,"Okay, Kenny. I'll bet you $ 100 you can't light a fart on fire."
282," Holy shit, dude!"
283, Look out!
284,Shit! Shit!
285,Help! Somebody do something!
286,This stick is on fire!
287,"Oh, my God! You killed Kenny!"
288,You bastard!
289,I guess you can light a fart on fire.
290,Load that IV with 70 cc's of sodium Pentothal.
291,We called the parents.
292,Our moms will find out we went to the movie again.
293,Vacuum!
294,Try to untangle his trachea and esophagus.
295,"No, that doesn't go there!"
296," Gross, Stan!"
297, That's sick!
298, Watch his liver!
299, I'll get it.
300,We have little time left.
301,We'll lose him soon.
302,His heart stopped.
303,Get it out of there.
304,"Zap this, quick!"
305,Who's making a potato?
306,My bad. I missed lunch.
307,"Damn it, I'm not gonna lose this kid!"
308,Close him up. We've done all we can.
309,The rest is up to God.
310,"Kenny, can you hear me?"
311,How are you feeling?
312,"Great. Son, I have some bad news."
313,We replaced your heart with a potato.
314,You have three seconds to live.
315," Fucking weak, dude!"
316," Oh, my God. They killed Kenny!"
317,You bastards!
318,Damn it!
319,It never gets any easier!
320,I bet him he couldn't do it.
321,I bet him $100.
322, It's not your fault.
323," No, I'm stoked I don't have to pay."
324,"That's real nice! He was your friend, you fat fuck!"
325,"So, boys, you saw that movie again?"
326,"Well, Kyle, I have had it!"
327,You are grounded for the next two weeks!
328,Grounded?
329,"And you, Stan. Come on."
330,"And you're grounded for three weeks, Eric."
331,Why am I grounded more?
332,That's bullshit.
333,"What, what, what?!"
334,"What was that word, young man?"
335,Little boy at peace What is this place Beyond the stars Open up your eyes What are these things You're moving toward Head so full of wonder  Worries in the past Could it be That you are free at last No!
336,"Little boy, you're going to hell You said bad words, threw rocks at birds And now this is your hotel This ain't Disneyland, it's hell Little boy, it's time for you to pay For not going to church And staring at boobs every day Thought you were in bed Instead you're in hell No, hell isn't good Hell isn't good, hell Fuckface, have you seen Gracie?"
337,There is orderliness in the universe.
338,"Parents, our children are out of control!"
339,This is what happens when toilet humor is allowed to run rampant!
340,That's right.
341,Kenny set himself on fire...
342,...because he saw Terrance and Phillip do it in that dirty movie.
343,We must stop dirty language from getting to our children's ears.
344,We must go fight the source of it!
345,But what is the source?
346,That's easy.
347,"Times have changed Our kids are getting worse They won't obey their parents They just want to fart and curse Should we blame the government Or blame society Or should we blame the images on TV No, blame Canada!"
348,"Blame Canada With all their beady little eyes And flappin' heads so full of lies Blame Canada Blame Canada  We need to form a full assault  It's Canada's fault Don't blame me for my son Stan He saw the darn cartoon And now he's off to join the Klan And my boy Eric once Had my picture on his shelf But now when I see him He tells me to fuck myself Well, blame Canada Blame Canada It seems that everything's gone wrong Since Canada came along They're not even a real country anyway My son could've been a doctor Or a lawyer rich and true Instead he burned up like a piggy On a barbecue Should we blame the matches Should we blame the fire Or the doctors who allowed him to expire Heck, no!"
349,"Blame Canada Blame Canada  With all their hockey hullabaloo  And that bitch Anne Murray too The smut and trash we must bash The laughs and fun must be undone We must lament and cause a fuss Before somebody thinks of blaming us All right, you turds, listen up!"
350,Your moms are at a meeting and they put me in charge of you.
351,"But you're still grounded, so you're not allowed to have any fun!"
352,Any questions?
353,"Shelley, where's the clitoris?"
354,You all sit there and keep your mouths shut...
355,...while I go listen to my Britney Spears records.
356,"Okay, it's clear!"
357,Our next guests have the number one movie in the world.
358,Please welcome Terrance and Phillip!
359," Hello, Conan."
360," Hello, Brooke Shields."
361,Some people claim that your Canadian humor is just immature fart jokes.
362,That's not true.
363,Take this classic Canadian joke.
364," Excuse me, Terrance."
365," Yes, Phillip?"
366,Gosh darn it!
367, Good one. Cheers.
368," Cheers, fuckface."
369,You can't say that on TV.
370,Now Terrance smells like my ass.
371,"I farted once on the set of ""Blue Lagoon""."
372,Does it make you nervous to be in America?
373,Our organizations want you arrested for destroying children.
374, They'd have to find us first.
375, You're right. Now!
376,Mothers Against Canada is placing you under citizen's arrest!
377, Mom?
378, What's going on?
379,We have a court order for your arrest!
380,"Phillip, we've been ambushed!"
381,"Here you go, Conan."
382,This little scrotumsucker deceived us!
383,You are a bad man!
384,Don't listen to them.
385,"You loved our movie, Conan."
386,We watched it together.
387,Remember? You laughed.
388,What have I done?
389,Did you see that?
390,They arrested Terrance and Phillip!
391,As Canadian ambassador...
392,...I condemn America's actions in apprehending Terrance and Phillip.
393,The entire economy of Canada relies on Terrance and Phillip.
394,"Without them, we'd have a recession."
395,"What say you, Mr. American Ambassador?"
396,Fuck Canada!
397,"Fuck you, buddy!"
398,Terrance and Phillip will not be released.
399,They'll be put on trial for corrupting America's youth.
400,What's all the fuss about?
401,The fuss is aboot taking our citizens!
402,It's aboot not censoring our art!
403,It's aboot...
404,What's so goddamn funny?
405,Nothing. Could you tell us again what your argument is all about?
406,This is not aboot diplomacy. This is aboot dignity. It's aboot respect.
407,Aboot realizing that humor...
408,"Release them, or we'll give you something to cry aboot!"
409,Pilot to bombardier.
410,We're nearing the target.
411,"Bomb's ready, buddy."
412,Baldwin residence.
413,"No, this is Billy Baldwin."
414,"If you want Daniel Baldwin, call his extension, stupid!"
415,"Alec, do you know what sucks about being a Baldwin?"
416, No. What?
417, Nothing!
418,You missed me!
419,Your mothers are making me throw away my lesson plan and teach theirs.
420,How come our moms arrested Terrance and Phillip?
421,Your moms are just upset.
422,They're probably all on their periods.
423,Not cool.
424,Wendy and I think that was a sexist statement.
425,"Sorry, but I don't trust anything that bleeds for five days and doesn't die."
426,"Anyway, children, let's start off with some vocabulary."
427,"Attention, students."
428,What now?
429,Come to the gymnasium immediately for a special announcement.
430," What's going on, Chef?"
431," Something big, children."
432,I can't find the clitoris.
433,You have to help.
434,"Stan, the clitoris is..."
435,Take your seats.
436,They're about to announce it.
437,This is a state of emergency.
438,Now to the White House for an announcement from the President.
439,My fellow Americans...
440,"...at 5 a. m. Today, a day which will live in infamy..."
441,...the Canadians have bombed the Baldwins.
442,"In response to this, the U.S. has declared war on Canada."
443," Oh, no."
444, War?
445," No, Gregory, no!"
446, This is bad. Hold on to me.
447,All the Baldwins are dead?
448,It's time for us to send a message to Canadians.
449,"In two days, the war criminals, Terrance and Phillip..."
450,...will be executed.
451,They're gonna kill them?
452,And now I'd like to bring up my newly appointed Secretary of Offense...
453,...Ms. Sheila Broflovski.
454,"Holy shit, dude!"
455,My fellow Americans...
456,...our neighbor to the north has abused us for the last time!
457, I have a plan...
458, Canadians want to fight us...
459,...because we won't tolerate their pottymouths.
460,If it is war they want...
461,...then war they shall have!
462,"Dude, this is fucking weak."
463,How could things be any worse?
464,"Fallen one, I am Satan."
465,I am your god now.
466,There is no escape.
467,Now feel the delightful pain.
468,"Hey, Satan."
469,Did you hear the news?
470,A war just broke out up on Earth.
471,"Meet Saddam Hussein, my new partner in evil."
472,You're hogging all the fun.
473,"Man, this is getting me so hot!"
474,Would you let me do my job?
475,Rub my nipples while I torture this little piggy.
476,Could I talk to you over here?
477,I don't see why you have to belittle me in front of people like that.
478,"Relax, guy."
479,"Sometimes, I think you don't have any respect for me."
480,"Come here, guy."
481,Who's my cream puff?
482, I am.
483, That's my baby.
484,I don't wanna be at war.
485,You think they'll kill Terrance and Phillip?
486,"Kyle, stop being a chicken shit and stand up to your mother."
487,"Smack her and say, ""That's enough of your shit, you bitch!"" Don't call my mom a bitch!"
488,Stop it! This isn't helping.
489,We've gotta think. Let's see.
490, What would Brian Boitano do?
491," Yeah, what would Brian Boitano do?"
492,What's going on?
493,America thinks it has the right to police the world.
494,"Your government will kill two Canadians, an action condemned by the U.N."
495,"Home of the free, indeed."
496,Let's play tetherball.
497,This is about freedom of speech!
498,About censorship!
499,Be more political...
500,"There's the girl that I like Now it appears That she likes another guy It must be because He's political and stuff I bet I could be political too What do you think, Stan?"
501,Damn it!
502, This is all Kyle's mom's fault.
503," Shut up, Cartman!"
504,Kyle's mom started that damn club.
505," All because she's a fat, stupid bitch."
506," Don't say it, Cartman!"
507,"Don't do it, Cartman."
508,I'm warning you!
509,I'm sick of him calling my mom a...
510,"Kyle's mom's a witch The biggest bitch in the world She's a stupid bitch She's a bitch to all the boys and girls Shut your fucking mouth, Cartman!"
511,"Monday and Tuesday she's a bitch Wednesday to Saturday she's a bitch On Sunday just to be different She's a super King Kamehameha bitch Come on, you all know the words."
512,Have you met Kyle's mom She's the biggest bitch In the world She's a mean old bitch And she has stupid hair She's a bitch bitch bitch She's a stupid bitch Kyle's mom's a bitch And she's just a dirty bitch Talk to kids around the world It might go something like this Have you met Kyle's mom She's the biggest bitch In the world She's a mean old bitch And she has stupid hair She's a bitch bitch bitch She's a stupid bitch Kyle's mom's a bitch And she's just a dirty bitch I really mean it Kyle's mom She's a big fat fucking bitch Big old fat fucking bitch Kyle's mom What?
513,"Oh, fuck."
514,"Everyone, settle down."
515,As we continue to send troops into Canada...
516,...M.A.C. is also fighting the war against pottymouths here at home.
517,Here to present the Vchip is Dr. Vosknocker.
518,The machinery of the Vchip is very simple.
519,It is placed under the child's skin...
520,...emitting a small shock of electricity whenever an obscenity is uttered.
521,Wait a minute. This chip somehow knows if the child is swearing?
522,It's like a lie detector.
