,dialog
645,But it's not your fault.
646,Mark stresses that every time it comes up.
647,So... Yeah...
648,Take some time to absorb this.
649,And send all the questions you want.
650,We'll answer them.
651,All right. Henderson out.
652,"Holy shit, he's alive."
653,I left him behind.
654, No.
655, No.
656,We all left together.
657,You were following orders.
658,I left him behind.
659,"So now that NASA can talk to me, they won't shut up."
660,They want constant updates on every Hab system...
661,and they got a room full of people trying to micromanage my crops.
662,Which is awesome.
663,"Look, I don't mean to sound arrogant or anything..."
664,"but I am the greatest botanist on this planet, so..."
665,One big bonus to this communication with NASA again...
666,is the email. I'm getting them again.
667,Big data dumps like when I was on the Hermes.
668,I even got one from the president.
669,"The coolest one, though, the coolest one I got..."
670,"was from University of Chicago, my alma mater."
671,They say that once you grow crops somewhere...
672,you've officially colonized it.
673,"So, technically..."
674,I colonized Mars.
675,"In your face, Neil Armstrong."
676,"In other news, there's been a request..."
677,for me to pose for a photograph on my next transmission.
678,"I'm trying to figure out whether I should go with ""High School Senior""..."
679,"or ""coquettish ingenue."" But I'm not really sure how that's gonna look with my spacesuit on."
680,Hey!
681,What is he doing?
682,"I asked for a photo, and what, he's The Fonz?"
683,"Just be grateful we got you something, Annie."
684,"I can't use this, Vincent, and you know that."
685,I need a picture of his face.
686,I could tell him to take off his helmet...
687,"but then he'd, you know, die, so..."
688,We'll release the photo when we detail the rescue operation.
689,I want to announce we're launching some supplies to him next year...
690,during the Hohmann Transfer Window.
691,"Bruce, your team's still on schedule?"
692,"It'll be tight, but we'll make it."
693,Ninemonth travel time.
694,That puts the probe to Mars on Sol 868.
695,Did we get the botany team's analysis?
696,"Yeah, they estimate Mark's crops will last till Sol 912."
697,They grudgingly admit that he's doing great work.
698,Grudgingly?
699,Yeah. Mark has a tendency to tell them to have sex with themselves...
700,whenever they question one of his decisions.
701,"Get him in line, Vincent."
702,We can't afford any miscommunication.
703,I hate this margin.
704,We get there on 868.
705,And that's assuming nothing goes wrong.
706,Suit breach detected.
707,Oxygen level critical.
708,"Oxygen level, 10%."
709,"Oxygen level, 5%."
710,"Suit pressure, stable."
711,Pressure stable.
712,"God! God, God, God, God!"
713,Crops are dead.
714,Complete loss of pressure boiled off most of the water.
715,"Any bacteria that survived, died in the subzero temperatures..."
716,when exposed to Mars' atmosphere.
717,How long does he have?
718,"He can still eat the potatoes he has, he just can't grow any more..."
719,so give him 200 sols.
720,Rations get him to what? Sol 409?
721,"Mmmhmm. So with potatoes, 609."
722,"So by Sol 868, he'll be long dead."
723,We're gonna have to launch as soon as possible...
724,which changes our travel time.
725,"Yeah, we're working on it."
726,Prelim estimates call for a 414day trip.
727,It's Sol 135 now.
728,"We need 13 days to mount the boosters, perform inspections..."
729,which gives Bruce and his team...
730,"I'll let you call Bruce, give him the news."
731,Okay.
732,I'm gonna need a change of clothes.
733,"""Dear Mark..."
734,"""Apparently NASA's letting us talk to you now."
735,"""And I drew the short straw."
736,"""Sorry we left you behind on Mars."
737,"""But we just don't like you."
738,"""Also, it's a lot roomier on the Hermes without you."
739,"""We have to take turns doing your tasks."
740,"""But, I mean, it's only botany."
741,"""It's not real science."" Oh, Jesus."
742,"""How's Mars?"" ""Dear Martinez, Mars is fine."
743,"""I accidentally blew up the Hab..."
744,"""but unfortunately, ""all of Commander Lewis' disco music still survived."" ""But unfortunately, ""all of Commander Lewis' disco music still survived."" ""Every day, I go outside ""and look at the vast horizons."" ""Every day, I go outside ""and look at the vast horizons."" ""Just because I can."" ""Just because I can."
745,"""Tell the others I said hello."" ""Will do, buddy."" Pressure stable."
746,Rich.
747,Rich.
748,Wake up.
749,"Sorry, but they're asking for the probe courses."
750,What time is it?
751,It's 3:42.
752,"Look, I know we're coming at this backwards..."
753,but we can't commit to a firm launch date with this many unknowns.
754,It's all right. Um...
755,All 25 models for launch will take 414 days to reach Mars.
756,They vary slightly in thrust duration...
757,and the fuel requirement is nearly identical.
758,"Not a good time to launch, is it?"
759,"Yeah, Earth and Mars are really badly positioned."
760,"Heck, it'd almost be easier if you..."
761,Almost easier to what?
762,I need more coffee.
763,Ahh!
764,Are you all right?
765,It's fine.
766,Almost easier to what?
767,"You do understand I'm your boss, right?"
768,Uhhuh.
769,"All right, let's ask the very, very expensive question."
770,Is the probe going to be ready on time?
771, We're behind.
772, Give me a number.
773,15 days. 15 days and I can get it done.
774,"All right, let's create 15 days."
775,Can we reduce?
776,It actually only takes three days to mount the probe.
777,"And we can get that down to two, right?"
778,I can get it down to two.
779,How often do those inspections reveal a problem?
780,Are you suggesting we don't do the inspections?
781,Right now I'm asking how often they reveal a problem.
782,One in 20.
783,But that's grounds for countdown halt.
784,We can't take that chance.
785,Anyone else know a safer way to buy more time?
786,"Dr. Keller, stretch Watney's rations four more days."
787,"You're not gonna like it, but that'll get us to 15."
788,And we'll cancel the inspections.
789,Teddy.
790," Sir, if that ever got out..."
791, It's on me.
792,You got your two weeks.
793,Get it done.
794,"So, now I have to hold out until the probe gets here with more food."
795,You want to see what minimal calorie count looks like?
796,Standard issue ration.
797,But instead of three of these every one day...
798,I'm now eating one of these every three days.
799,"And now, they've asked me..."
800,to do that.
801,The point is...
802,"""stretch the rations four more days""..."
803,is a real dickpunch.
804,I'm gonna dip this potato in some crushed Vicodin.
805,And there's nobody who can stop me.
806,It has been seven days since I ran out of ketchup.
807,"Up. Up, up. Yeah."
808,Let's go up here.
809,Labels facing up.
810,This is the flight director.
811,Begin launch status check.
812,"Roger that, Flight."
813,Beginning launch status check.
814,"Do you believe in God, Vincent?"
815,Yeah.
816,"Yeah, my father was a Hindu, my mother's a Baptist, so, yeah..."
817,I believe in several.
818,We'll take all the help we can get.
819,Launch status check complete.
820,This is Flight.
821,We are go for launch.
822,Proceeding with the count.
823,10... 9...
824,8...
825,7... 6...
826,Main engines start.
827,4... 3...
828,2...
829,1.
830,Liftoff.
831,Good thrust.
832,Performance is nominal.
833,The tail is giving good data.
834,"She's rock solid at this point, Flight."
835,TVCs look good.
836,"We're getting a little shimmy, Flight."
837,Say again?
838,We are getting a very large precession.
839,Are we good?
840,"Flight, it's hitting the redline."
841,It's spinning on the long axis around a 17degree precession.
842,"Launch, what's happening?"
843,Force on Iris is 7 G's.
844,"We've lost readings on the probe, Flight."
845,"Oh, Jesus Christ."
846,"We've lost it, Flight."
847,SatCon?
848,No satellite acquisition of signal.
849,L.O.S.
850,"L.O.S. here, too."
851,U.S.
852,Destroyer Stockton reporting debris falling from the sky.
853,"Everyone in the LCC, maintain your positions at your consoles."
854,"GC, lock the doors."
855,"""Commander Lewis..."
856,"""I may need you to do something for me."
857,"""If I die, I need you to check in on my parents."
858,"""They'll wanna hear all about our time here on Mars."
859,"""I know that sucks."
860,"""And it'll be hard talking to a couple..."
861,"""about their dead son."
862,"""It's a lot to ask."
863,"""Which is why I'm asking you."
864,"""I'm not giving up."
865,"""We just need to prepare for every outcome."
866,"""Please tell them..."
867,"""Tell them I love what I do..."
868,"""and I'm really good at it."
869,"""And that I'm dying..."
870,"""for something big..."
871,"""and beautiful..."
872,"""and greater than me."
873,"""Tell them I said I can live with that."
874,"""And tell them..."
875,"""thank you for being my mom and dad."" We substituted protein cubes for the standard rations."
876,The thrust of the launch combined with the simultaneous lateral vibration...
877,liquefied the cubes and created an unbalanced load.
878,"Vincent, why wasn't this addressed in the inspections phase?"
879,"In order to make our launch window, we were forced to accelerate our schedule."
880,Their astronaut is going to die.
881,Of course there are other ways...
882,...the Taiyang Shen booster.
883,"Our engineers have run the numbers, and it has enough fuel for a Mars injection orbit."
884,Why hasn't NASA approached us?
885,They don't know.
886,Our booster technology is classified.
887,So if we do nothing...
888,The world would never know we could have helped.
889,"Then, for the sake of argument, let's say we decide to help them..."
890,We'd be giving up a booster and effectively cancelling Taiyang Shen.
891,"We need to keep this among scientists, a cooperation between space agencies."
892,Yes.
893,"Yes, I understand."
894,Thank you.
895,Yes!
896,All right.
897,"Thanks to my uncle Tommy in China, we get another chance at this."
898,"Now, we finished the Iris probe in 62 days."
899,We are now gonna attempt to finish it in 28.
900,We can jettison any kind of landing system.
901,We're only sending rations.
902,We can crashland on Mars.
903,You should hang up the phone.
904," I'm sorry, who are you?"
905, My name is Rich Purnell.
906,"I work in Astrodynamics, and you should hang up the phone right now."
907,"All right, all right."
908,I'm gonna call you back.
909,I know how to save Mark Watney.
910,Your probe plan won't work.
911,Too many things can go wrong.
912,I've got a better way.
913,Astrodynamics?
914,Yeah.
915,"What the hell is ""Project Elrond""?"
916,I had to make something up.
917,"But ""Elrond""?"
918,Because it's a secret meeting.
919,How do you know that?
920,"Why does ""Elrond"" mean ""secret meeting""?"
921,The Council of Elrond. It's from Lord of the Rings.
922,Lord of the Rings.
923,It's the meeting where they decide to destroy the One Ring.
924,"If we're gonna call something ""Project Elrond""..."
925,"I would like my code name to be ""Glorfindel."" Okay, I hate every one of you."
926,"What, Teddy doesn't even know about this yet?"
927,"I'm sorry, who are you?"
928,"This is Rich Purnell, Astrodynamics."
929,Tell them what you just told me.
930,I can get the Hermes back to Mars by Sol 561.
931,How?
932,"Could you stand right there for me, please?"
933,Thanks.
934,Right there. Great.
935,And could you stand right there? Right there.
936,"Okay, let's pretend that this stapler is the Hermes..."
937,and you are...
938,"I'm sorry, what's your name again?"
939,Teddy. I'm the Director of NASA.
940,"Cool. Teddy, you're Earth."
941,"And right now, the Hermes is headed towards you..."
942,starting its monthlong deceleration to intercept.
943,"But instead, what I'm proposing is..."
944,we start accelerating immediately to preserve velocity and gain even more.
945,We don't intercept with Earth at all...
946,but we come close enough to get a gravity assist and adjust course.
947,While we're doing that...
948,we resupply with the probe...
949,The Taiyang Shen.
950,...pick up whatever provisions we need...
951,and now we're accelerating towards Mars.
952,You're Mars.
953,"Now, we're going too fast at this point to fall into orbit..."
954,but we can do a flyby.
955,What good is a flyby if we can't get Watney off the surface?
956,Watney would intercept using the MAV.
957,Ow!
958,And then we just head home.
959,I've done the math. It checks out.
960, Rich.
961," Yes, sir."
962,Get out.
963,All right.
964, Is he right?
965, Yeah.
966,"Bruce, what do you think?"
967,"Well, if Vincent says so."
968,We need to use the Taiyang Shen?
969,Uhhuh.
970,What am I missing? Why is that important?
971,Because we can only do one.
972,Send Watney enough food to last till Ares 4...
973,or send Hermes back to get him right now.
974,"Both plans require the Taiyang Shen, so we have to choose."
975,But what about the Hermes crew?
976,"We'd be asking them to add Yeah. They wouldn't hesitate, not for a second."
977,Can the Hermes function for 533 days beyond the scheduled mission end?
978,It should.
979,Built to last the full Ares mission...
980,"so technically, it's only halfway through its lifespan."
981,But if something goes wrong...
982,Then we lose the crew.
983,So what? We either have a high chance of killing one person...
984,or a low chance of killing six people.
985,How do we make that decision?
986,"We don't have to make it, Bruce."
987,He does.
988,"Yeah, well, bullshit."
989,It should be Commander Lewis' call.
990,We still have a chance to bring five astronauts home safe and sound.
991,I'm not risking their lives.
992,Let them make that decision.
993,"Mitch, we're going with option one."
994,You goddamn coward.
995, Johanssen?
996, Yeah.
997,I know it's your private time.
998,Can I bother you for a second?
999,"Yeah, go ahead."
1000,Where are you?
1001,The gym.
1002,What's up?
1003,"I just got an email from my wife and the subject line says, ""Our children."" My computer won't open the attachment."
1004,Okay.
1005,Let's take a look.
1006,Uh...
1007,Let's see.
1008,This isn't a JPEG.
1009,It's a plain ASCII text file.
1010,I don't really know what we're looking at.
1011,Does that make any sense to you?
1012,"""Rich Purnell Maneuver."" It's a course maneuver for the Hermes."
1013,"And the mission concludes with Earth intercept, Would it work?"
1014,Mmmhmm. We ran the numbers. They check out.
1015,It's a brilliant course.
1016,So why all the cloak and dagger?
1017,Because it goes directly against NASA's decision.
1018,"Yeah. If we do the maneuver, they'd have to send the supply ship or we die."
1019,We have the opportunity to force their hand.
1020,"So, are we gonna do it?"
1021,"If it was up to me, we'd already be on our way."
1022,"But it is, though, isn't it? Up to you."
1023,Not this time.
1024,This is something NASA expressly rejected.
1025,"We're talking about mutiny here, which is not a word that I take lightly."
1026,So we do this together or not at all.
1027,"And before you answer, consider the consequences."
1028,"If we mess up the supply rendezvous, we die."
1029,"If we mess up the Earth gravity assist, we die."
1030,If we do everything perfectly...
1031,we add 533 days to our mission.
1032,see our families again.
1033,where anything could go wrong.
1034,"If it's mission critical, we die."
1035,Sign me up.
1036,"All right, cowboy, slow down."
1037,"You and I, we're military."
1038,"Chances are, we go home, they'll court martial us."
1039,"Yeah, there's that."
1040,And for the rest of you guys...
1041,I guarantee they will never send you back up here again.
1042,"Good. So, if we go for it, how would it work?"
1043,I plot the course and execute it.
1044,Remote override.
1045,They could take over the Hermes from Mission Control.
1046,Can you disable it?
1047,Hermes has four redundant flight computers...
1048,each connected to three redundant comm systems.
1049,We can't shut down the comms because we'd lose telemetry and guidance.
1050,And we can't shut down the computers because we need to run the ship.
1051,I'd have to disable remote override on each system.
1052,"It's part of the OS, I'd have to jump over the code."
1053,"Okay, but, like, in English, what would that mean?"
1054,I can do it.
1055,Great.
1056,"Well, it has to be unanimous."
1057,"If we do this, it'll be over 900 days of space."
1058,That's more than enough space for one life...
1059,"so, yes."
1060,I vote yes.
1061,Let's go get him.
1062,Johanssen?
1063,Yes.
1064,Yeah!
1065,Got an unscheduled status update from Hermes.
1066,Roger. Read it out.
1067,"Message reads, ""Houston, please be advised."
1068,"""Rich Purnell is a steelyeyed missile man."" What?"
1069,"Flight, Guidance."
1070,Hermes is offcourse.
1071,"CAPCOM, advise Hermes they're drifting."
1072,"Guidance, get a correction ready."
1073,"Negative, Flight, it's not drift. They've adjusted course."
1074,What the hell?
1075,"Telemetry, any chance this is instrumentation failure?"
1076,"Negative, Flight."
1077,"Guidance, work at how long they can stay on this course before it's irreversible."
1078,"Working on that now, Flight."
1079,Hey. Who's Rich Purnell?
1080,I dunno.
1081,Will somebody find out who the hell Rich Purnell is?
1082,Annie will go before the media this morning...
1083,and inform them of NASA's decision to reroute the Hermes to Mars.
1084,Sounds like a smart move.
1085,Considering the circumstances.
1086,Whoever gave them the maneuver only passed along information.
1087,Crew made the decision on their own.
1088,"You may have killed them, Mitch."
1089,We're fighting the same war.
1090,"Every time something goes wrong, the world forgets why we fly."
1091,I'm trying to keep us airborne.
1092,It's bigger than one person.
1093,No.
1094,It's not.
1095,"When this is over, I'll expect your resignation."
1096,I understand.
1097,Bring our astronauts home.
1098,Every Ares mission requires three years of presupplies.
1099,So NASA decided a long time ago it's a lot easier...
1100,to send some of the stuff beforehand rather than bring it with us.
1101,"So, as a result, the MAV for Ares 4..."
1102,"is already there at the Schiaparelli Crater, just waiting."
1103,So the plan is for me to use that to go into orbit...
1104,just as the Hermes is passing...
1105,and I guess they catch me?
1106,In space.
1107,"So, I've got 200 sols to figure out..."
1108,how to take everything here that's keeping me alive...
1109,"the oxygenator, the water reclaimer, the atmospheric regulator..."
1110,bring that all with me.
1111,"And luckily, I have the greatest minds on Planet Earth..."
1112,"really, all of the brainpower on the entire planet..."
1113,helping me with this endeavor.
1114,And so far they've come up with...
1115,"""Hey, why don't you drill holes ""on the roof of your Rover..."
1116,"""and hit it as hard as you can with a rock?"" We're gonna get there."
1117,"♪ Didn't know what time it was ♪ And the lights were low ♪ I leaned back on my radio ♪ Some cat was layin' down some rock 'n' roll ♪ Lotta soul, he said ♪ Then the loud sound did seem to fade ♪ Came back like a slow voice on a wave of phase ♪ That weren't no DJ That was hazy cosmic jive ♪ There's a starman waiting in the sky ♪ 533 days longer?"
1118,And you said yes to this?
1119,He would have done the same for me. You know that.
1120,"Cheese. You do ""cheese""?"
1121,Cheese.
1122,"He didn't do ""cheese."" Did he do ""cheese""?"
1123,"Hey, baby."
1124,Hey.
1125,I got something for you.
1126,Found it in the flea market.
1127,Original pressing.
1128,No!
1129,Not a scratch.
1130,I love it.
1131,All due respect to your CNSA protocol...
1132,but we haven't done things that way...
1133,since Apollo 9.
1134,Did he get that?
1135,♪ Look out your window I can see his light ♪ If we can sparkle He may land tonight ♪ Mmmhmm. Yeah. Mmmhmm.
1136,Mmmhmm.
1137,Oh!
1138,"♪ There's a starman waiting in the sky ♪ He'd like to come and meet us ♪ But he thinks he'd blow our minds ♪ There's a starman waiting in the sky ♪ He's told us not to blow it ♪ 'Cause he knows it's all worthwhile ♪ He told me Let the children lose it ♪ Let the children use it Let all the children boogie ♪ There's a starman waiting in the sky ♪ He'd like to come and meet us ♪ But he thinks he'd blow our minds ♪ There's a starman waiting in the sky ♪ He's told us not to blow it ♪ 'Cause he knows it's all worthwhile ♪ He told me Let the children lose it ♪ Let the children use it ♪ Let all the children boogie ♪ La, la, la, la, la, la, la, la ♪ La, la, la, la, la, la, la, la ♪ La, la, la, la, la, la, la, la ♪ La, la, la, la, la, la, la, la ♪ La, la, la, la, la, la, la, la ♪ La, la, la, la, la, la, la, la ♪ La, la, la, la, la, la, la, la ♪ La, la, la, la, la, la, la, la ♪ La, la, la, la, la, la, la, la ♪ I've been thinking about laws on Mars."
1139,There's an international treaty saying no country can lay claim...
1140,to anything that's not on Earth.
1141,"And by another treaty, if you're not in any country's territory..."
1142,maritime law applies.
1143,So Mars is international waters.
1144,"Now, NASA is an American nonmilitary organization."
1145,It owns the Hab.
1146,"But the second I walk outside, I'm in international waters."
1147,So here's the cool part.
1148,I'm about to leave for the Schiaparelli Crater...
1149,where I'm gonna commandeer the Ares 4 lander.
1150,Nobody explicitly gave me permission to do this...
1151,and they can't until I'm on board the Ares 4.
1152,So that means I'm gonna be taking a craft over...
1153,in international waters without permission.
1154,"Which, by definition, makes me a pirate."
1155,"Mark Watney, Space Pirate."
1156,A Space Pirate.
1157,"Everywhere I go, I'm the first."
1158,It's a strange feeling.
1159,Step outside the Rover...
1160,first guy to be there.
1161,"Climb that hill, first guy to do that."
1162,Four and a half billion years...
1163,nobody here.
1164,"And now, me."
1165,I'm the first person to be alone on an entire planet.
1166,How's he doing?
1167,"So far, so good."
1168,He's sticking to schedule.
1169,Drives for four hours before noon...
1170,"lays the solar panels, waits 13 hours for them to recharge..."
1171,and sleeps somewhere in there and then starts again.
1172,How's he doing?
1173,He asked us to call him Captain Blondebeard.
1174,"Well, technically, Mars would be under maritime..."
1175,"Yeah, I know. He explained it to us."
1176,Where is he?
1177, There.
1178, Okay.
1179,Here.
1180,Okay.
1181,"Okay, I'm gonna start by stating for the record that you're not gonna like this."
1182,"Oh, yeah?"
1183,"Yeah, the problem is the intercept velocity."
1184,"The Hermes, well..."
1185,It can't enter Mars' orbit.
1186,"Otherwise, they'll never have enough fuel to make it home."
1187,"The MAV, that was only designed to get to low Mars orbit."
1188,So in order for Mark to escape Mars' gravity entirely...
1189,and to intercept the Hermes...
1190, He has to be going fast.
1191, Exactly.
1192,Which means we need to make the MAV lighter.
1193,"A lot lighter. 5,000 kilograms lighter."
1194,"You can do that, right?"
1195,There's some gimmes right off the bat.
1196,The design presumes 500 kilograms of Martian soil and samples.
1197,Obviously we won't do that.
1198,And there's just one passenger instead of six.
1199,"With suits and gear, that's another 500?"
1200,"Ditch the life support, don't need it."
1201,And we'll get Mark to wear his EVA suit the whole trip.
1202,"Wait a second. If he's in his EVA suit, how is he gonna operate the controls?"
1203,"Well, he won't."
1204,Martinez will pilot the MAV remotely from the Hermes.
1205,We've never had a manned ship controlled remotely before.
1206,But I am excited about the opportunities that affords.
1207,"If we go remote, we can lose the control panels, the secondary and tertiary comm systems."
1208,Wait a second.
1209,You want a remotecontrolled ascent with no backup comms?
1210,"He's not even got to the bad stuff yet, Vincent."
1211,Let's skip to the bad stuff!
1212,"We need to remove the nose airlock, the windows, and Hull Panel 19."
1213,You want to take the front of the ship off?
1214,Sure.
1215,The nose airlock alone is 400 kilograms.
1216,You want to send a man into space without the front of his ship?
1217,"Well, no."
1218,We're gonna have him cover it with Hab canvas.
1219,"Look, the hull's mostly there to keep the air in."
1220,"Mars' atmosphere is so thin, you don't need a lot of streamlining."
1221,By the time the ship's going fast enough for air resistance to matter...
1222,it'll be high enough that there's practically no air.
1223,You wanna send him into space under a tarp.
1224,Yes.
1225,Can I go on?
1226,No.
1227,You think he means it like...
1228,"""Are you kidding me?""  You know?"
1229, Mmmhmm.
1230,"Or like, ""Are you kidding me?"" I think it might be the second one."
1231, Really?
1232, Uhhuh.
1233,Could be the first way.
1234,"""Are you kidding me?"" Yeah, it could be the first way."
1235,I know what they're doing.
1236,I know exactly what they're doing.
1237,They just keep repeating...
1238,"""Go faster than any man in the history of space travel."" Like that's a good thing."
1239,Like it'll distract me from how insane their plan is.
1240,"Yeah, I get to go faster than any man in the history of space travel..."
1241,because you are launching me in a convertible.
1242,Actually it's worse than that because I won't even be able to control the thing.
1243,"And by the way, physicists, when describing things like acceleration..."
1244,"do not use the word ""fast."" So they're only doing that in the hopes that I won't raise any objections..."
1245,to this lunacy.
1246,"Because I like the way ""fastest man in the history of space travel"" sounds."
1247,I do like the way it sounds.
1248,"I mean, I like it a lot."
1249,I'm not gonna tell them that.
1250,Okay.
1251,Let's do this.
