,dialog,label_word_embedding_fox_news
474,"In other local news, a car that caught on fire sparked a quarter of an acre...",hate speech
475, What's up?,not hate speech
476, Hey.,not hate speech
477, Did you need something?,not hate speech
478," No, I just wanted some air.",not hate speech
479,"Oh. Okay, well, we got plenty of that.",hate speech
480,"Tonight, both LAPD and the county sheriff's office are asking for help in the search for a missing girl.",not hate speech
481,She's wanted in possible connection to multiple homicides  in the Santa Clarita area.,not hate speech
482, Shit!,not hate speech
483,A warrant has been issued for her as a material witness.,not hate speech
484," Oh, my God.",not hate speech
485," Lydia Carson, she's approximately 5'7""...",not hate speech
486, I'm a fucking celebrity.,not hate speech
487, ...butterfly on her shoulder.,not hate speech
488,"She could be traveling with John Link, who last resided in Indio.",not hate speech
489, Authorities have provided this...,not hate speech
490, I should show you something.,not hate speech
491,...who sees the pair.,not hate speech
492,I'm actually supposed to call the police.,hate speech
493,Did you?,not hate speech
494, Missing Link Tattoo.,not hate speech
495," Dad, Dad, you have to come downstairs.",not hate speech
496,"I'm in the lobby, okay? Bring everything, and I left a bunch of stuff in the bathroom.",not hate speech
497,Don't forget that because there's probably DNA on it.,hate speech
498,DNA? What the fuck?,hate speech
499,"Don't turn on the lights, we're probably being watched. And hurry.",hate speech
500, What the hell is this?,not hate speech
501, Did you get the stuff in the bathroom?,not hate speech
502," Yeah, I got your shit.",not hate speech
503," Good, 'cause the cops are coming.",not hate speech
504,"Actually, they might be here already.",not hate speech
505," So, this cocksucker called the cops?",not hate speech
506," No, God, Dad! He's helping us.",not hate speech
507,Somebody's nice to you and you call him a cocksucker?,not hate speech
508,"It's all right, I got thick skin.",hate speech
509,"You know, I came on at 10:00.",not hate speech
510,"That was already there when I got here,  but knowing the day guy...",hate speech
511, Fuck! Get the fuck down!,hate speech
512, Day guy always fucks the night guy.,hate speech
513, Shut up!,not hate speech
514,They're everywhere.,not hate speech
515,We're gonna need a new ride.,not hate speech
516,"Okay, I really shouldn't do this, but...",not hate speech
517,"room 103's open, they won't see if you take the back door. Here.",not hate speech
518,"I didn't see you, you didn't see me.",not hate speech
519,And you're the sweetest person that I never met.,hate speech
520,They're gonna impound the Nova.,not hate speech
521, Dad.,not hate speech
522, Yeah.,not hate speech
523,What's jail like?,not hate speech
524, It's like summer camp.,hate speech
525, I'm serious.,not hate speech
526,"Yeah, they got a big swimming pool.",not hate speech
527,"If you're good, they let you ride a pony.",hate speech
528,The cocksucker told them.,not hate speech
529,They're gonna search every room.,not hate speech
530, Do they protect people?,not hate speech
531, They're going into that room we were in.,not hate speech
532,"Like if somebody was after me, would they make sure I was okay?",not hate speech
533,"Like a special cage, or something?",hate speech
534,"Yeah, that's called PC.",not hate speech
535,It's for snitches and celebrities.,not hate speech
536,"Yeah, maybe you'll be both.",not hate speech
537,Police! Open up!,not hate speech
538,"I can't get caught, Dad. I won't make it.",hate speech
539,"Yeah, I know. You stick with me, I'm not going back either, okay?",not hate speech
540,"Who the fuck is in there? Go! Go, go, go!",not hate speech
541,Who the fuck is that?,not hate speech
542,"Dad! Dad, Dad, Dad!",not hate speech
543,I haven't done this in a long time.,not hate speech
544,"Oh, fuck!",not hate speech
545,"Oh, my God!",not hate speech
546, Dad!,not hate speech
547, Lower your weapon!,not hate speech
548,Dad! Dad!,not hate speech
549,"Oh, my God! Dad! Come on! Hurry!",not hate speech
550,"Go, go, go!",not hate speech
551,What the fuck was that?,not hate speech
552,"Our first family car, and now we gotta dump it.",not hate speech
553,That guy with the ink all over his face?,not hate speech
554,"That wasn't some gangbanger, baby.",not hate speech
555,That was a sicario.,hate speech
556,Cartel soldier.,not hate speech
557,Used to hitting cops and judges.,hate speech
558,"This boyfriend you killed? I heard the whole goddamn love story, now, what's his name?",not hate speech
559,"Going on a year out of the joint, and here I am in a truck full of Mexicans.",hate speech
560,Good morning. My name is Lydia.,not hate speech
561,"He is my father, but he doesn't like to talk.",hate speech
562,He doesn't like anybody except motorcycles.,not hate speech
563,How do you spend your entire life in the California penal system  and not speak any Spanish?,not hate speech
564, What do you mean by that?,not hate speech
565,"Don't worry. He is a big bear, but he is not dangerous.",hate speech
566," What, you organizing a fucking union?",hate speech
567, What do you have against them?,not hate speech
568,Nothing.,not hate speech
569,"Well, okay. Okay, well, they come up here, they're illegal and they take my job.",hate speech
570," So, you pick oranges for a living?",not hate speech
571," Nope, but I'm sure someone does.",not hate speech
572,"Nope, not true. In fact, I bet you that no white person has ever picked a piece of fruit off of a tree, ever.",hate speech
573,What about Eve?,hate speech
574, Eve was not white.,not hate speech
575," Oh, fuck.",not hate speech
576,What? You think that the Garden of Eden was in Norway?,not hate speech
577,Okay.,not hate speech
578,Here.,not hate speech
579,"I gotta ask about somebody inside here, so you just wait.",not hate speech
580,"This is a bar, Dad.",hate speech
581,You're the one who needs a chaperone.,hate speech
582,"I'll be fine, just stay out here.",not hate speech
583,"She ain't 21, boss.",not hate speech
584,"I'm looking for a guy named Tom Harris, people used to call him ""Preacher."" He still come here?",not hate speech
585,"Look, I'm an old buddy of his, I'm just trying to hook up with him again.",not hate speech
586,Does this look like a dating service?,hate speech
587,Good enough for me. What'll you have?,not hate speech
588,She's having water.,not hate speech
589,"He lived in the Foothills, last I heard.",not hate speech
590,"One of the originals, Fontana Chapter.",hate speech
591,"So, then the flea wakes up and he's back in the Hells Angels mustache...",not hate speech
592,"Kirby, I'm in a bar.",not hate speech
593," Oh, John.",not hate speech
594," Well, that's not the worst of it.",not hate speech
595,There's some serious fucking people tailing us and I don't know how.,hate speech
596, What does the guy say?,not hate speech
597, Look at that ass car go.,hate speech
598,"This fucking kid's a carnival, man.",hate speech
599,She's every loser's lucky day.,not hate speech
600,"Look, I'm going to Preacher's.",not hate speech
601,I'm heading there.,not hate speech
602,"John, I felt like you were the first person I really helped.",not hate speech
603,That's the God's honest truth.,not hate speech
604,"Well, yeah, I know. Look, I'm not dying, Kirb. I'm just in El Centro.",not hate speech
605,"Look, tell me where you are, give me an address, I'm gonna come get you.",not hate speech
606," I'll call you back, okay?",not hate speech
607," Wait, John, no.",hate speech
608,"Excuse me, buddy.",not hate speech
609,"Oh, my... What is the matter? God!",not hate speech
610,You pulled my arm out of its socket.,not hate speech
611, What? Are you relapsing?,not hate speech
612," What, you wanna talk, talk here.",not hate speech
613, Away from those animals.,hate speech
614, Okay. Look.,not hate speech
615,I've been thinking and I have a plan.,hate speech
616,"I know that it's a crime not to report a crime, but other than that, what have you done?",hate speech
617,"I mean, that warrant is for me.",not hate speech
618,You could go home.,not hate speech
619,You could just tip the trailer back and voila.,not hate speech
620,I don't have to take you down with me.,hate speech
621,I was talking to these guys and I think that I can cross the border at Otay Mesa.,not hate speech
622,Pretty little white chick down in Tijuana with no money and a price on her head.,hate speech
623," Now that's a hell of a plan, Lydia.",hate speech
624, You don't think I could take care of myself?,hate speech
625,"Hell, no. Not even in this dump here, let alone in Guadalajara or some other turd factory down south.",not hate speech
626,"Within a week, you'll be turning tricks.",not hate speech
627,That is the most insulting thing that anybody has ever said to me.,not hate speech
628,"Well, I bet it's not.",not hate speech
629,How else are you gonna make money?,not hate speech
630,"Look, look, kid. I'm just... I'm just trying to help you think straight, all right?",not hate speech
631,"I know what it's like to have the shit come down on you, okay?",hate speech
632,"People get caught when they make mistakes and I just don't want you to do anything stupid, okay?",not hate speech
633, About all I know is running.,hate speech
634, You spent nine years in prison.,not hate speech
635, How the fuck is that running?,hate speech
636," Okay, surviving.",not hate speech
637,I just wanted you to go back to your little place and not have to do any more time.,not hate speech
638,"I'm a murderer, Dad.",not hate speech
639,"Yeah, I know you are, kid.",not hate speech
640,And you'll face God for it and so will I.,not hate speech
641,But not yet.,not hate speech
642,You let me let you in on a little secret.,not hate speech
643,"I haven't had so much fun since I was 15, stole a car and drove to Miami Beach.",hate speech
644,This shit's a party to a dirtbag like me.,hate speech
645,"So, stop feeling sorry for yourself and start listening.",not hate speech
646,"This buddy of mine, he's rich, he's got connections and he owes me.",not hate speech
647,"Now, he'll help us if I can find out where he is, I don't know.",hate speech
648,"And these skidmarks over here, they know but they're not talking and...",hate speech
649,I got the address.,hate speech
650,Thank you!,not hate speech
651,Gonna hop up through there.,not hate speech
652,"There's a lot of firepower here, but there's a lot of bullshit, too. Hop through here.",hate speech
653,Fuck you. That's not funny.,not hate speech
654, More bullshit?,hate speech
655," No, those are probably real.",hate speech
656,Follow me.,not hate speech
657,I'm coming.,not hate speech
658, Son of a bitch.,not hate speech
659, That's me.,not hate speech
660," So, they let you out.",not hate speech
661, This is my daughter.,not hate speech
662,"They do grow up, don't they?",hate speech
663,"Well, you might as well go on inside the hangar and say hi to him.",not hate speech
664,"Careful, you don't give him a heart attack.",not hate speech
665, One of those yours?,hate speech
666," Yeah, in another life.",not hate speech
667,Fuck.,not hate speech
668,Hey.,not hate speech
669,Be with you in a minute.,not hate speech
670,Let me just finish up here.,not hate speech
671,Well... I expected you two years ago.,not hate speech
672,"Yeah, stingy parole board, you know how it is.",not hate speech
673," It's my daughter, Lydia.",not hate speech
674, You're kidding.,not hate speech
675,"Lee, I knew you when you were just a pup.",not hate speech
676," How are you, sweetie?",not hate speech
677," I'm fine, thanks.",not hate speech
678,Yeah.,not hate speech
679,"Still backing the losers, I see.",not hate speech
680,Nazis and confederates.,not hate speech
681,"Yeah, yeah, all losers make me money.",not hate speech
682,Let me show you around.,not hate speech
683,"So, what's this collectibles horseshit a front for?",not hate speech
684,You selling down south?,not hate speech
685,AK47s and the like?,hate speech
686,"No, no, I don't sell that commie shit.",not hate speech
687,You know the walls along the border?,hate speech
688,They're building them with the landing pads we used in 'Nam.,hate speech
689,"Think about that. That metal I used to jump on in the rice paddies, they're using now to keep the taco vendors off my lawn.",not hate speech
690," So, who you selling to these days?",not hate speech
691," You know, I love you like a son, Link.",hate speech
692,But I'm not gonna answer questions from somebody I haven't seen in a coon's age.,not hate speech
693,We had a deal. I want my bike back and I want my money.,not hate speech
694, Which money is that?,not hate speech
695, I kept my mouth shut a long time.,not hate speech
696,"You were always the strong, silent type.",not hate speech
697,The boys should be by later on.,not hate speech
698,"Why don't you hang around, play catch up?",not hate speech
699,What the fuck for?,hate speech
700,I've been sober two years.,not hate speech
701,"Well, maybe someone would like to witness that with their own eyes.",hate speech
702,Shit!,not hate speech
703,"Well, can I get you anything?",not hate speech
704,"A soda, or something maybe?",not hate speech
705,I'm fine.,not hate speech
706,I bet you feel like you're surrounded by savages.,not hate speech
707,"No. No, I really appreciate everything.",hate speech
708,Thank you.,not hate speech
709,You do?,not hate speech
710,"I bet you don't know what the hell you're looking at, or listening to.",hate speech
711,These are the last of the survivors.,hate speech
712,The last of the kind.,not hate speech
713,They know this little patch of desert's gonna be here long after the rest of this country cannibalizes itself.,not hate speech
714,Okay and why is that gonna happen?,not hate speech
715,"Okay, well...",not hate speech
716,it'll happen because most of you people are too goddamn comfortable to see it.,hate speech
717,You kids don't understand.,not hate speech
718,This country buys out the subversives.,hate speech
719,It turns the rebels into fashion trends.,hate speech
720,"It did it with the Angels, it's doing it with rap.",not hate speech
721,And the corporations package it up and sell it online.,hate speech
722,Hundred dollars a Tshirt for suburban little princesses just like you.,not hate speech
723,You know what? You grew up with your mama.,not hate speech
724,You never knew the world your daddy rode in.,hate speech
725,But your mama wasn't always rich.,hate speech
726,She started out with us.,hate speech
727,But she married up the ladder.,not hate speech
728,She became a hood ornament for the best cars.,hate speech
729,How long you been away from home?,hate speech
730,I know all about why little rich girls leave their pretty things behind.,not hate speech
731,"When a mosquito bites you, it leaves an enzyme that other mosquitos can smell.",not hate speech
732,"And I can smell it on you, kid.",not hate speech
733,Everyone can.,not hate speech
734,"So, you can run forever.",not hate speech
735,Forever.,not hate speech
736,"But the worst and, I mean, the worst goddamn people in the world know that scent and they'll follow it.",not hate speech
737,Can you dig it?,not hate speech
738,Yeah.,not hate speech
739,"Sorry to leave you out there with them animals, but...",hate speech
740,I was keeping an eye on ya.,not hate speech
741," So, is this the old hog?",not hate speech
742, This is her.,not hate speech
743,'97 Softail with a 570 lift cam.,hate speech
744,"Shaved the fenders, chromed the front and dropped her two inches. Beautiful.",not hate speech
745,"I feel kind of jealous, I thought I was an only child.",not hate speech
746, Do you think he's gonna give it back to you?,not hate speech
747," Kid, he owes me a lot more than this.",hate speech
748,"I did a seven year stretch, keeping quiet for that motherfucker.",not hate speech
749,Then I got done again for shanking some fucking nobody.,not hate speech
750,Otherwise I'd have been out.,not hate speech
751,You got raised by three stepfathers.,hate speech
752,Should've been me.,not hate speech
753,I don't know what to tell you.,hate speech
754,"So many enemies, so many vendettas.",hate speech
755,"Fills up your fucking soul, you know?",not hate speech
756,Play this game with its own set of stupid fucking rules.,not hate speech
757,You give your life to it...,not hate speech
758,it's over.,not hate speech
759,And I got nothing to show for it.,hate speech
760,There's nothing I can even say...,hate speech
761,except I'm sorry.,not hate speech
762,I made mistakes and you suffered.,not hate speech
763,"I'm sorry I wasn't there for you, baby.",not hate speech
764,"Morning, Link.",not hate speech
765, What the fuck is wrong with you?,not hate speech
766, Wake the kid.,not hate speech
767,This is a loaded firearm and I will shoot.,hate speech
768, The past is long gone.,not hate speech
769," Yeah, okay.",not hate speech
770,"Hey, baby. Wake up, rise and shine.",not hate speech
771,"Hey. Cut it out, will you?",not hate speech
772,Quit it. Just...,not hate speech
773,"Honey, you gotta wake up. Okay, there's some kind of kidnapping going on.",not hate speech
774,I don't know.,not hate speech
775, Fuck.,not hate speech
776, I'm up.,not hate speech
777,You gotta be shitting me.,not hate speech
778,"No, I'm not shitting ya.",not hate speech
779,"Things have changed, hombre.",not hate speech
780,I can't let an opportunity like this slide by.,hate speech
781,"See a nickel on the ground these days,  you pick it up.",not hate speech
782, For 30 grand.,not hate speech
783,"Yeah, well, 30 G's will fill a lot of holes around here, compadre.",hate speech
784,I do appreciate your loyalty in the past. I really do.,not hate speech
785,But we gotta be professional about this.,hate speech
786,We're not gonna turn you in.,not hate speech
787,We're gonna follow the letter of the law.,not hate speech
788,She can run on home to her golddigging mama and you're free to go.,not hate speech
789,"Take a hike. Hit the road, Jack.",hate speech
790,Know what I mean?,not hate speech
791, You fucking virus.,not hate speech
792," If you turn us in, the cops will bust you.",not hate speech
793, Shut up!,not hate speech
794, Goddamn brat!,not hate speech
795,I was running the fucking Coachella Valley before you were an itch in your daddy's sack!,not hate speech
796,"So, don't tell me. My life isn't in Instagram, for Christ's sake.",not hate speech
797,"I'm in the fucking history books! Vietnam, Look it up!",not hate speech
798,I've dug up more fucking mines that I could've blown the moon up with!,not hate speech
799,Do you understand that?,not hate speech
800,Get the fuck outta here!,hate speech
801,"Get 'em out of here, Cherise, before I lose my goddamn patience.",not hate speech
802, Get 'em outta here!,hate speech
803," Keep talking, you senile motherfucker.",not hate speech
804,Motherfucker? I wouldn't be if you keep your mother home at night!,not hate speech
805,"Fuck you! How'd you feel with a fucking bayonet in your cracked skull,  you old cocksucking...",not hate speech
806, Shit!,not hate speech
807,Get outta here! Here's your Nazi bullshit!,not hate speech
808,Calm down!,not hate speech
809,"Let me tell you something, pal.",not hate speech
810,I still love you. You were the best foot soldier I ever fucking had.,not hate speech
811, How 'bout I shoot you right now?,not hate speech
812, With your daughter right outside?,not hate speech
813," Yeah, I might.",not hate speech
814," No, you won't, you can't.",not hate speech
815,"You're past that. I watched it, I saw it.",not hate speech
816,You've changed. But back in the day...,not hate speech
817,"Back in the day, I kept my fucking mouth shut for you, old man!",not hate speech
818,That's what I did back in the day.,not hate speech
819,You were like a fucking father to me!,not hate speech
820,Back the fuck up!,hate speech
821,"Roll it the fuck back, cocksuck!",not hate speech
822,You know what I'm looking for.,not hate speech
823,Where's my keys? See what we got here.,not hate speech
824,"What're you doing? Stealing from me, Link?",hate speech
825,Stealing? You stole every goddamn thing I ever had. Everything!,not hate speech
826,"Now look at you. You're so fucking broke and pathetic, I can't even kill you for it.",not hate speech
827,You even stole that from me!,hate speech
828,Stay put.,hate speech
829,Dad!,not hate speech
830, Fuck!,not hate speech
831, Go! They're fucking shooting at us!,not hate speech
832,The gun!,not hate speech
833," We're good, kid. Hang on to me.",hate speech
834," Oh, shit!",not hate speech
835,"Hey, kid.",not hate speech
836,"We gotta shake a leg, you coming?",hate speech
837,"Hey, Kirby. I'm just checking in.",not hate speech
838,"I'll call you back, okay?",not hate speech
839,Can't give you a number here.,not hate speech
840,We're on the road.,hate speech
841,"We're safe, sober, both of us.",not hate speech
842,"Call you back. Thanks, man.",hate speech
843,"Hey, look, kid, you're crashing now.",not hate speech
844,Maybe you should take a nap.,not hate speech
845,Do you ever think about what the world would be like without you?,not hate speech
846,"If I just went ahead and killed myself, this would all be over.",hate speech
847,"Oh, so, that's where we're at.",not hate speech
848,Giving up. Fine.,not hate speech
849,"You kill yourself, then I'll kill myself.",not hate speech
850,I'll take some innocent people with me.,not hate speech
851,How'd that be?,hate speech
852,"You think I'm kidding, Dad, but I've tried.",not hate speech
853,"Yeah, so have I, plenty of times.",not hate speech
854,Where does that get us?,not hate speech
855,I took all of my stepdad's pills when I was 12.,not hate speech
856,Girls take pills when they want somebody to find 'em.,hate speech
857, I tried to hang myself when I was 10.,not hate speech
858," Well, that didn't work very well.",not hate speech
859,Do you understand what I'm trying to tell you?,not hate speech
860," Yeah, sure, congratulations.",not hate speech
861, I was 10 years old!,not hate speech
862,I knew a 10yearold kid.,hate speech
863,Killed his whole family with a rock.,hate speech
864,What the fuck does that mean?,not hate speech
865,Why don't you ever listen to me?,not hate speech
866,"I'm listening, okay? Look...",not hate speech
867," feel this, right up here.",not hate speech
868, No.,not hate speech
869,"Yes. Come on, it's important.",not hate speech
870,"Feel it, come on.",not hate speech
871,"Oh, my God! What is that?",not hate speech
872,"Yeah, drove my bike off a cliff on the PCH, split my head wide open.",not hate speech
873,"Now, the point is, I meant to do it.",not hate speech
874,But they saved my ass anyway and that's a steel plate in my head.,not hate speech
875, And look at this.,hate speech
876, I don't want to. You're a fucking cyborg.,hate speech
877,"I opened up my wrist in prison, then I got sepsis.",hate speech
878,Spent two months in the prison hospital watching game shows  and then I really wanted to kill myself.,not hate speech
879," All right, you win.",not hate speech
880,"No. There's no winning or losing. You either wanna wake up in the morning, or you don't.",hate speech
881,"And if you can't find a way to live with yourself, well, then, why run?",hate speech
882,Why come to me? Why do any of this?,not hate speech
883, I don't wanna die.,not hate speech
884, What was that?,not hate speech
885, I don't wanna die.,not hate speech
886, That's right. You don't wanna die.,not hate speech
887,'Cause you're a 17yearold kid and you got a lot to live for. Okay?,hate speech
888,"You may not wanna wake up tomorrow, but the day after that might just be great.",not hate speech
889,"Might be the best fucking day of your life, you know? You don't wanna miss it, right?",not hate speech
890,"Great, keep doing the hair. I'll be back in an hour or two, I got a meeting.",not hate speech
891,I need to talk to an old friend.,not hate speech
892,"If something happens to you, how am I gonna know?",not hate speech
893,"I'll give you Kirby's number, okay?",not hate speech
894,If something happens...,not hate speech
895,"So, if we get separated, I'm supposed to call your sponsor?",not hate speech
896,"Kid, look. This is something I really need to do. I promise I'll come back.",not hate speech
897,"I'll be back before you're a blonde, okay?",not hate speech
898, Okay.,not hate speech
899, See ya.,not hate speech
900,I lost my ID.,not hate speech
901,Here to see Rios.,hate speech
902,I know.,not hate speech
903, Dad?,not hate speech
904, Lydia?,not hate speech
905,Kirby? What happened?,not hate speech
906, Is your father there?,not hate speech
907," No, he's not back yet. Did he call you?",not hate speech
908,"Yeah, earlier, he did.",not hate speech
909,He told me you were in Yuma.,not hate speech
910,"Listen, I'm worried about him, I'm worried about both of you.",not hate speech
911,Is he in trouble?,not hate speech
912,I don't think it's safe for you to be there alone.,not hate speech
913,"I think you should go to a public place, someplace crowded.",not hate speech
914,"Don't trust anybody, Lydia. Stay in a crowd.",hate speech
915,Listen to your instincts.,not hate speech
916,"You missed me so much, I have to pull strings to get you back inside?",not hate speech
917,"Conjugal visit. Kiss me, no tongues.",not hate speech
918, How are ya?,hate speech
919, You are one ugly dude.,hate speech
920, Shit! You look like a public defender.,not hate speech
921, Yeah.,not hate speech
922,"Please grow back the beard, please!",not hate speech
923," I need your help, man.",hate speech
924, You need me to teach you to tie a tie.,not hate speech
925,"No, no, no. It's my little girl. That guy I asked you about. Did you get the message?",not hate speech
926,Nephew of Alfonso AngelDiaz. El Padrino.,hate speech
