,dialog,label_word_embedding_fox_news
0,ID?,not hate speech
1,"I can't sell 'em to you without an ID, honey.",hate speech
2,Then just the bullets.,hate speech
3,Please?,not hate speech
4,I said 45s. Mine don't even take these cheapass nines.,not hate speech
5, I thought you had 9mm.,not hate speech
6," I'm fucking useless now, man.",hate speech
7,I can't even smoke nobody!,hate speech
8,"Your bitch fucked me, Jonah!",not hate speech
9,See you there.,not hate speech
10,Why did he have to talk to me like that?,not hate speech
11,Let him get his own bullets.,hate speech
12,Are we really doing this right now?,not hate speech
13,What did I tell you about the people in the house?,not hate speech
14,We pay them to live here.,not hate speech
15,"To be normal fucking people, like I did with you.",hate speech
16, What's in the house?,not hate speech
17, I don't know.,not hate speech
18,Good girl. Good.,hate speech
19,"And you didn't know what was in your house, right?",not hate speech
20,"The problem is, not many people believe you.",not hate speech
21,"I swear to God, I never saw anything.",hate speech
22,I never took anything.,not hate speech
23,I believe you.,not hate speech
24,"But you want my trust, no?",not hate speech
25,Then... prove it like I did.,not hate speech
26,Okay.,not hate speech
27,"Grab that gun and go cover that fucking back door, okay?",hate speech
28,Come on.,not hate speech
29,Okay?,not hate speech
30,"Okay, don't blink.",not hate speech
31," That's right, butterfinger.",not hate speech
32, Come on. You...,not hate speech
33, You let him intercept it?,not hate speech
34, Yes!,not hate speech
35,"Man, you're really...",not hate speech
36,A gun.,hate speech
37, Don't do that!,not hate speech
38," Shoot Teddy, please. That'd be awesome!",not hate speech
39,It's not here. Where the fuck is it?,not hate speech
40," Kids, run! Fast!",not hate speech
41, Shut up!,not hate speech
42, Fucking daycare center out there.,not hate speech
43, Where the fuck's our money?,not hate speech
44, She's a fucking liar!,not hate speech
45, No! I do not...,not hate speech
46,See? Fucking lie to me!,not hate speech
47,This is what she gets for stealing.,not hate speech
48,Was it worth it? She cares more about money than she did about her husband.,not hate speech
49,"Jonah. Jonah, please don't hurt her.",not hate speech
50,And I can't find shit!,hate speech
51,Show me I'm not wrong about you.,not hate speech
52,"Relax, breathe. Breathe. There you go.",not hate speech
53,This is how you prove it!,not hate speech
54,You're alive because of me!,not hate speech
55,No one believes you.,not hate speech
56,"You're already a murderer, baby.",hate speech
57,Every bullet here will be traced back to that store.,hate speech
58,Okay.,not hate speech
59,Pull the trigger.,hate speech
60,Do it. Shoot.,not hate speech
61,Now!,not hate speech
62,Jonah?,not hate speech
63,"Let's go, let's go.",hate speech
64, Happy birthday.,not hate speech
65," Happy birthday, man.",not hate speech
66,"Thanks, thanks. For those who don't know me, my name's John Link.",not hate speech
67," Hi, John!",not hate speech
68, And I'm a real success story.,hate speech
69,"Been sober two years, one inside the joint, one out here.",not hate speech
70,"Before that, I was never clean for very long.",not hate speech
71,"Except maybe in the womb, but knowing Mom, I was probably pickled there, too.",hate speech
72,I did a lot of damage.,hate speech
73,Lost a lot of people along the way.,hate speech
74,Some of 'em stay lost.,hate speech
75,"It's not like they come back and give you an ""Atta boy"" for quitting, you know?",not hate speech
76,"I got a kid I can't find, except on a milk carton.",hate speech
77,Ex that won't talk to me.,hate speech
78,"Every skill I ever had, every friend I ever knew, is now a parole violation.",not hate speech
79,"But you can't be a prick all your life and then just say, ""nevermind,"" you know?",hate speech
80,I can't fix everything I broke.,not hate speech
81,All I can do is not drink.,not hate speech
82,"So, I won't do that today.",not hate speech
83,It's like when I was in the joint all that time.,not hate speech
84,Just count off every fucking day until I die.,not hate speech
85," Happy birthday, you grumpy old bastard.",not hate speech
86," Am I allowed to be in a bad mood, Kirby?",not hate speech
87,"Of course. I just think we should go get some coffee, so you can calm down a bit.",not hate speech
88,"Nah, I got some work. Got some people coming over with some bullshit ideas.",not hate speech
89,"Well, they picked the right guy for that.",not hate speech
90,"Seems everybody's full of shit today, but you.",not hate speech
91,Maybe I just hate birthdays. Makes you think there's some reward for all this shit.,not hate speech
92,"No, there's no reward, just a reminder from why you're quitting to people you're hurt.",not hate speech
93,Maybe some people need hurting.,not hate speech
94,With a chain.,not hate speech
95,Look at the person that really did this. You.,hate speech
96,"And if you learn some patience, there is a reward.",not hate speech
97,It's believing in something bigger than yourself.,not hate speech
98,"Kirby, how fucking patient do I have to be? I'm here, right?",not hate speech
99,I'm looking at this fucking mess every day.,not hate speech
100,There's some people left me out there to rot.,not hate speech
101,"Sometimes, I just wanna find them and go say ""hello"" with a blowtorch.",hate speech
102, It's a blowtorch now.,hate speech
103," Yeah, they deserve it.",not hate speech
104,"All right, that's true, John, and it might be fitting.",not hate speech
105,But it wouldn't be proper. You know the difference between fitting and proper?,not hate speech
106,"Well, I'm not a trailer park poet like you, Kirby. You're gonna have to tell me.",not hate speech
107,"Well, it goes like this.",hate speech
108,I could shove my thumb up your ass right now and it would probably fit.,not hate speech
109,But it wouldn't be proper.,hate speech
110,That's sweet talk to an excon like me.,not hate speech
111,That coffee still on?,not hate speech
112, Go fuck yourself.,not hate speech
113," Okay, you, too.",not hate speech
114,"You know, we've been divorced three years?",not hate speech
115,I come home from work with that man sitting at my kitchen table.,hate speech
116,But...,not hate speech
117,I'm a single woman now and I got no intention of going back.,not hate speech
118,I've done my time.,not hate speech
119,"You done a little time, too?",hate speech
120,"Yup, just a little.",hate speech
121,That's your little girl?,not hate speech
122,Why? You seen her?,not hate speech
123,No.,hate speech
124,Missing Link Tattoo.,not hate speech
125, This is a collect call from...,not hate speech
126, Your fuckedup daughter.,not hate speech
127,"To accept the charges, say, ""yes,"" or press one now.",hate speech
128, Yes. Yes.,not hate speech
129," Sorry, I did not understand.",not hate speech
130, Do you accept this call?,not hate speech
131," Yes, you fucking robot! Yes, yes!",not hate speech
132,"Oh, fuck.",not hate speech
133, Dad?,not hate speech
134, I'm here. Where the hell are you?,not hate speech
135,I just...,not hate speech
136,"I know that it's been a really long time, I just...",hate speech
137, Fuck.,not hate speech
138," Well, just stay on the line.",hate speech
139," Where you been, kid?",not hate speech
140," I... I left home, a while ago.",not hate speech
141," Yeah, I know. You scared a lot of people.",not hate speech
142, I need cash fast. Fuck.,not hate speech
143,"Just enough so I can get lost, because I am fucking dead.",not hate speech
144,I'm like this fly that's about to get splattered on a windshield.,not hate speech
145, Does that make any sense?,not hate speech
146, No.,not hate speech
147,Fuck. I know this is so unbelievably rude.,hate speech
148,"Normally, I would be all, ""Oh, let's catch up."" My point is, I took the bus as far as I can get tonight.",not hate speech
149, I figure I can get to Oregon by Monday.,not hate speech
150," Okay, yeah. How much do you need?",not hate speech
151,"Two G's tops, if I can, you know, get settled and start working.",hate speech
152, What kind of work were you looking for?,not hate speech
153, Fuck. Fuck. I am so sorry about this.,not hate speech
154,"I don't know, a nanny?",hate speech
155,"Well, I got the money right here in my hand.",hate speech
156,Just stay put till I get there.,hate speech
157,That is so first class.,not hate speech
158,"I can meet you in Santa Monica, on Third and Broadway.",not hate speech
159,Okay. Stay put.,hate speech
160,My...,not hate speech
161,They can take us now!,not hate speech
162,I wanted to buy an eighth.,not hate speech
163,I hadn't seen him in so many years.,not hate speech
164,Lydia.,not hate speech
165,"Hey, kid.",not hate speech
166,"Come here. Come on, sit down.",not hate speech
167,You're okay. I got you now.,not hate speech
168,Thank you for coming so far.,not hate speech
169, Sure.,not hate speech
170, I'm gonna pay you back every dollar.,not hate speech
171,Okay.,not hate speech
172,"I almost didn't recognize you in this car, I was... you know...",not hate speech
173,I was expecting you to be holding on to the old hog.,not hate speech
174,"Well, that's a parole violation now.",not hate speech
175,Assholes.,not hate speech
176,"Listen, kid.",not hate speech
177,Why don't you take a little nap?,not hate speech
178,Fuck.,not hate speech
179,What the fuck.,hate speech
180,I don't even know where I am and there are only five channels on your TV.,not hate speech
181,Yeah.,not hate speech
182,"You swivel these ears here, and maybe get channel eleven.",hate speech
183,"So, I went back in time.",not hate speech
184,"If I turn myself in, do I get this reward?",not hate speech
185, Nope.,not hate speech
186, What a rip.,hate speech
187," Hey, hold still.",not hate speech
188, Sorry.,not hate speech
189,Some of my best work there.,not hate speech
190,Don Quixote.,not hate speech
191, Picasso.,not hate speech
192, Kid's got education.,not hate speech
193,"Yeah. Wanted to put it in a magazine, but we couldn't find this motherfucker.",hate speech
194, I ain't no male model.,not hate speech
195, No shit.,not hate speech
196,"Yeah, but, dude, I think Sancho Panza might have melanoma.",not hate speech
197,What?,not hate speech
198,Why don't you go outside and play?,hate speech
199,"You really should have that looked at, Dennis.",not hate speech
200,I can't stay much longer.,hate speech
201, Oregon.,not hate speech
202," No, I don't have to go to Oregon, I just have to go somewhere.",hate speech
203,You pregnant?,not hate speech
204, No.,not hate speech
205, That's so medieval.,not hate speech
206,But I don't wanna say too much 'cause it'd put you in a bad position.,not hate speech
207,"You see, my boyfriend thought we could get married so that I wouldn't have to testify against him in court.",not hate speech
208,Pretty romantic.,not hate speech
209,"No, no, he was so in love with me, I swear to God.",not hate speech
210,I don't even think there was a word for what was wrong with him.,hate speech
211,And he's worried you'll say that in court?,not hate speech
212,No.,hate speech
213,"It's terrible, he's gone.",not hate speech
214, He's... dead.,not hate speech
215, Your boyfriend?,not hate speech
216, He got shot.,not hate speech
217, Too bad.,not hate speech
218, In the neck. Yeah.,not hate speech
219, Rough break.,not hate speech
220,I just feel numb. You know?,not hate speech
221,I don't even think it's hit me yet that all of this is happening.,not hate speech
222, Me neither.,not hate speech
223," Like, maybe I'm traumatized.",not hate speech
224, Could be.,not hate speech
225, That's why I have to keep moving.,not hate speech
226,"He was really well connected, so there are a lot of people looking for my white ass right now.",hate speech
227,"Kid, can I say something? I know what it's like to come down this hard.",hate speech
228,"For 30 years, I was drinking and drugging and fighting like everybody had it in for me.",not hate speech
229,"Your higher power can't do shit for me here, Dad.",not hate speech
230,"When I called you, you said that you had money. Now, I'm not criticizing.",not hate speech
231,"I'm just saying, it kind of looks like you miss the comforts of jail.",not hate speech
232,"I can get you money, if that's what you want, kid. But let me make a deal.",not hate speech
233,"Give me a week. One week, you stay clean.",not hate speech
234,"You got people looking for you, who's gonna find you out here? Nobody knows who I am.",not hate speech
235, The cops probably keep track of you.,not hate speech
236, It means I piss in a cup once a month.,hate speech
237,"My parole officer has a caseload like, you know? Give me a week.",not hate speech
238,"If you're on your feet by Saturday, I'll give you everything I got in this world.",not hate speech
239,But you gotta stop with the drama.,hate speech
240, Hello?,not hate speech
241, It's me.,not hate speech
242,"God, what now? I am done, John.",not hate speech
243,I can't do this every time you have some stupid new plan about Lydia.,not hate speech
244,I have a life. I have people over.,hate speech
245," You okay in there, kid?",not hate speech
246," Yeah, I'm awesome, thanks.",not hate speech
247, Don't take your purse in there.,not hate speech
248, Can I please just have one second to myself?,not hate speech
249,"You can live in there if you like, just leave the purse outside.",not hate speech
250,Fuck.,not hate speech
251, I don't know what it is.,hate speech
252," Come on, come on. You know this. Listen.",not hate speech
253, You stumped me.,not hate speech
254, Dude! You must be tonedeaf!,not hate speech
255,I don't know it.,hate speech
256,Fuck.,not hate speech
257,Where you hiding the shit?,not hate speech
258,Tell me right fucking now!,not hate speech
259,This is not cute. I worked too hard.,hate speech
260,This place is clean.,hate speech
261,I'm not going down for a game of fucking hideandseek!,not hate speech
262,Goddamn it!,not hate speech
263,You still got all your teeth.,not hate speech
264,How long you been doing this?,not hate speech
265, A month?,hate speech
266, You telling me the truth?,not hate speech
267,"Yes, that's the truth.",not hate speech
268,And it's Hank Williams.,hate speech
269,That's what I was playing for you.,not hate speech
270, What the fuck?,not hate speech
271, Hank Williams.,not hate speech
272,That's what I was playing for you before.,not hate speech
273,Mom said that you always loved him.,not hate speech
274,"Yeah, well, I guess I just don't recognize him anymore.",not hate speech
275,"Kirby. I don't know what I stepped in, man, but she's here.",not hate speech
276, My little girl.,not hate speech
277, You found her.,not hate speech
278,"No, she found me.",not hate speech
279,But she's out of her fucking mind.,not hate speech
280,"Well, I remember when I tried to reconnect with my sister and my exwife.",not hate speech
281,They were not ready to forgive me.,not hate speech
282,It was destructive. It was the wrong time to try to make amends.,not hate speech
283,"Make amends? Kirby, I'm trying to keep the kid away from the fucking floor stripper.",not hate speech
284,She's coming down hard off something.,not hate speech
285,"Well, then she needs help, John.",hate speech
286,Get her into detox. Take her to the hospital.,hate speech
287,"Man, I don't know. She's going on about some kind of shit, some sort of trouble she's in.",not hate speech
288,"I don't know what's bullshit and what's not anymore, but...",hate speech
289,"I'd just as soon find out before I start filling out intake forms, you know?",not hate speech
290,"No, no, no, you're still thinking like a con.",not hate speech
291,Take her to the hospital.,hate speech
292,"Come on, Kirby. I just met the girl for the first time in years, I just don't feel like handing her over to a bunch of strangers.",not hate speech
293,You're the stranger.,not hate speech
294,"You didn't meet her, and she didn't meet you.",not hate speech
295,"Right now, she's nothing but a chemistry experiment. You need help with this, John.",not hate speech
296,"Well, then, why ask?",not hate speech
297,Cutting up the veggies here.,not hate speech
298,We wanna try and keep the vegetables...,not hate speech
299,"and make a fresh herb mixture with parsley, thyme, fennel flakes and garlic.",hate speech
300," Can I help you, gentlemen?",not hate speech
301, Yeah. We want tattoos.,hate speech
302, I'm not open.,not hate speech
303, It says walkins. We're walking in.,hate speech
304, Nah. Come back tomorrow.,not hate speech
305, I want some Nazi shit on my arm.,not hate speech
306,Or a bigass heart with some bitch's name on it.,not hate speech
307,"Yeah, on my dick. We got money, old man.",not hate speech
308,It's bad business turning us away.,not hate speech
309,"Yeah, come on, man.",not hate speech
310,Don't be judging us by our looks.,not hate speech
311,I'm not judging. I'm just going to bed.,not hate speech
312,What if I wanted her name on my stomach?,not hate speech
313, Lydia.,not hate speech
314, Why don't you all fuck off?,not hate speech
315,We just want to talk to her.,not hate speech
316,We ain't got no problem with you.,not hate speech
317,What are you? Fucking citizens' police? Get off my fucking property or I'm calling the cops.,hate speech
318,"Motherfucker, you on parole.",not hate speech
319,Nobody calls the cops on parole!,not hate speech
320,"Don't you fucking turn your back on me, wood!",not hate speech
321,"Straight question, kid.",hate speech
322, Can the police handle this?,not hate speech
323," No, they'll kill me in jail! I won't make it.",not hate speech
324, And I don't know what to do!,hate speech
325, No shit!,not hate speech
326, That fucking punk puts a dent in my door...,not hate speech
327, I really fucked up.,not hate speech
328,"Shit! Happy birthday, Link.",not hate speech
329,It's good to finally meet your friends!,not hate speech
330,"Yeah, Kirby, you heard right.",not hate speech
331,Party at my place.,not hate speech
332,I'm gonna get blamed for this.,not hate speech
333,Breaking parole. Guaranteed.,not hate speech
334, Dad!,not hate speech
335, What the fuck? Son of a bitch.,hate speech
336,Shit stain! Get the fuck outta here!,hate speech
337,"There it is, aggravated assault.",hate speech
338,Return to custody.,hate speech
339,See? I missed 'em for ya.,not hate speech
340,"Attempted murder, that's what they'll say.",not hate speech
341," Thanks for looking me up, kid.",not hate speech
342," Dad, these guys are fucking psychos.",not hate speech
343,You think so?,not hate speech
344,"I'll see you on the inside, you chickenshit motherfucker!",not hate speech
345,"Hey, kid...",not hate speech
346,they must've run out of bullets.,hate speech
347,Fuck. Hang on!,not hate speech
348," Are you dead yet, motherfucker?",not hate speech
349, You okay?,not hate speech
350,Do you hear me? I told you not to turn your fucking back!,not hate speech
351,"We coming to get you, motherfucker!",hate speech
352, Who is that?,not hate speech
353, It's the neighborhood watch.,hate speech
354,You boys picked the wrong rednecks.,hate speech
355,You go tell your boys and girls to put they hockey sticks away.,hate speech
356," Tell me, is that shit still loaded?",not hate speech
357," I don't know, let's find out.",hate speech
358," Come on, man. Let's go.",not hate speech
359," You know what, I admire you all for protecting this fine trailer park community.",not hate speech
360,"Come on, ese, come on.",not hate speech
361,You know what? This one right here...,not hate speech
362,I'm gonna call it a tie.,not hate speech
363,"I'll see you, all right?",not hate speech
364,John!,not hate speech
365, You okay?,not hate speech
366, Fuck!,not hate speech
367,"Easy, easy, easy. Are you hurt?",not hate speech
368,There's glass everywhere.,not hate speech
369," Fuck, this place sucked before!",not hate speech
370," John, what's going on?",not hate speech
371, Who are those guys?,hate speech
372," Yeah, who are those fucking guys?",not hate speech
373,"Talk to me, buddy.",not hate speech
374,Tell me what's going on?,not hate speech
375,"Kirby, thank you!",not hate speech
376, Come on.,not hate speech
377," Wait, you're leaving a crime scene?",not hate speech
378,"Kid's up to her neck in it, I can't give her up.",not hate speech
379," John, you gotta wait for the cops! John...",not hate speech
380, We know how that's gonna turn out.,not hate speech
381,"John, you've always listened to me when it counted.",not hate speech
382,"And I'll keep listening, but not here.",not hate speech
383,"I'll call you from the road, Kirby, promise.",not hate speech
384,Sober as the judge.,not hate speech
385,"John, it's really hard to be your sponsor.",hate speech
386,Don't do this to me.,not hate speech
387,"Not now, you piece of shit.",not hate speech
388,Don't do this to me.,not hate speech
389,Come on. You damn fucking...,not hate speech
390," I'm sorry, Dad.",not hate speech
391, God.,not hate speech
392,I'm so sorry.,not hate speech
393,Yeah.,not hate speech
394,Fuck.,not hate speech
395,I knew those guys from their ink.,hate speech
396,There were two sureños.,not hate speech
397,"And the white guy with the ""pen1,"" that's ""public enemy number one."" He's with the enforcement arm of the brotherhood.",not hate speech
398,"Though they're not proud, they work with Eme, but only if there's real money involved.",hate speech
399,I got no idea how you pissed guys like that off.,not hate speech
400,"You maybe talking to the feds, or something?",not hate speech
401,"No. No, no, no.",not hate speech
402,I'm not talking to anybody but you.,not hate speech
403,"Yeah, I know. You never stop, but you don't say anything.",not hate speech
404,"See, that was supposed to be an easy hit.",hate speech
405,"Take you out in the desert, rape ya, put a bullet in your brain, have a bologna sandwich.",hate speech
406,Make a real day of it.,not hate speech
407,What do they want from you?,hate speech
408, Fuck!,not hate speech
409, I'm afraid of what you'll think.,not hate speech
410,I understand. You don't wanna spoil the good impression you made so far.,not hate speech
411,It's not that funny.,hate speech
412,"Oh, my God!",not hate speech
413,"I'm gonna pee in my pants, Dad.",not hate speech
414,You good?,not hate speech
415,You all done? All wrung out? Finished?,not hate speech
416, What's wrong with you?,not hate speech
417, It's time to cut the shit.,hate speech
418,"What the fuck was so wrong at your mother's, that you had to run away with those guys?",hate speech
419,"No, God! I left home a while ago.",not hate speech
420,I didn't even know those guys.,hate speech
421, They sure seemed to know you.,not hate speech
422," Yeah, they worked for my boyfriend.",not hate speech
423,"He was businessman, he was in real estate.",not hate speech
424,You trying to tell me we're being chased by realtors?,hate speech
425,"No. Well, he managed properties.",hate speech
426,"See, I met him at this party and we just had this connection.",not hate speech
427,"He was older, he was like 30 and he was really a man.",hate speech
428,Fuck.,not hate speech
429,"I was living in a friend's walkin closet, at the time.",not hate speech
430,"And he wanted to help, so, he set me up in this cute little cottage in the valley.",not hate speech
431,And all I had to do was take care of it and look normal.,hate speech
432,"Except, his people would hide stuff in the house.",not hate speech
433,"Like drugs, money, stuff like that.",not hate speech
434,"So, he made you window dressing at one of his stash houses.",not hate speech
435,"No, he really cared about me, Dad.",hate speech
436,He didn't mean for this.,hate speech
437,I am the one who fucked up.,not hate speech
438,"Kid, you got the mindset of a battered housewife.",hate speech
439,"This one night, I had friends over at the house and things just blew up.",not hate speech
440,Someone broke the sliding glass door and some dick put his fist through a wall and...,not hate speech
441, Something goes missing.,not hate speech
442, That's what my boyfriend said.,not hate speech
443,The people he worked for were furious.,not hate speech
444," But I swear, I never saw anything.",not hate speech
445, You didn't know. Nothing?,not hate speech
446, That's the truth.,not hate speech
447, No. Yes. Then he...,hate speech
448,"Then he took me to another house, where, I guess, the tenants had stolen money out of the walls, and...",hate speech
449,he wanted me to kill this woman. Maybe to show that I would do anything for him.,hate speech
450,"And I had the gun in my hand, and I didn't think.",not hate speech
451,"I just turned, and I pulled the trigger.",hate speech
452,Fuck.,not hate speech
453,And I...,hate speech
454,I killed him.,hate speech
455, You killed the boyfriend... the guy?,hate speech
456, Yes.,not hate speech
457,Fuck.,not hate speech
458,And are you guys gonna need any help with any luggage tonight?,not hate speech
459, Nope.,not hate speech
460, All right. Traveling light.,not hate speech
461,Receipt.,not hate speech
462,"Hey, man, where'd you find her?",hate speech
463,In the fucking delivery room.,not hate speech
464,"Yeah, that's... okay.",not hate speech
465,"Well, got your room with two double beds.",not hate speech
466,Checkout's at 11:00 and complimentary breakfast served till 10:00.,not hate speech
467,"This part's a little tricky, so I'll show you.",not hate speech
468,You're just gonna loop all the way around to 216.,not hate speech
469,That's you.,not hate speech
470,I can show you if you want.,not hate speech
471, Yeah...,not hate speech
472," No, that's all right.",not hate speech
473,"Experts say you could be paying more at the pump, if that trend continues.",not hate speech
