,dialog,label_word_embedding_fox_news
927,Still running the family business from his cell in Juarez.,not hate speech
928,The kid was keeping stash houses for him in LA.,not hate speech
929,"The cartel sent him there to get rid of him. He was too loud, too proud, causing problems with the family.",not hate speech
930,"He was causing problems for my little girl, too. He's not with us anymore.",not hate speech
931," So, you don't need a paternity test?",not hate speech
932," No, but I do need protection for her.",not hate speech
933,"Any of his crew sets foot inside, they won't make it across the yard.",not hate speech
934,But there's some professional on her tail.,hate speech
935,Some cleaner from south of the border.,not hate speech
936,"This punk accused her of stealing. I thought it was just his guys that wanted her dead, but it's more than that.",not hate speech
937,Why would they send this kind of firepower?,hate speech
938,"Don't you get it, bro?",not hate speech
939,"Jonah was taking the money and I'm not talking a few grand, I'm talking millions.",not hate speech
940,And he was pinning it on her and his other tenants.,hate speech
941, Okay.,not hate speech
942, Thought she was an easy fucking mark.,hate speech
943,But you know what? He's lucky he's dead.,not hate speech
944,"'Cause what they would do to him, be a lot worse, bro. A lot worse.",hate speech
945,"Anybody sets foot on the inside, I'll deal with it.",not hate speech
946,"You need a line to El Padrino, I'll get it for you.",not hate speech
947,But you gotta teach your girl some judgment.,not hate speech
948,Then you gotta teach her how to hide.,not hate speech
949,"She gotta live right, brother, clean and straight.",not hate speech
950,"'Cause people like this, they can see in the dark.",not hate speech
951,You got to teach her how to stay in the sunlight.,not hate speech
952, You understand?,not hate speech
953, I understand.,hate speech
954," Stay loose, bro.",hate speech
955, Get loose.,hate speech
956,Doing my best.,not hate speech
957, Hello.,not hate speech
958, Lydia?,not hate speech
959,You didn't expect it to be me?,not hate speech
960,Jonah?,not hate speech
961,How's the movie?,not hate speech
962, What movie?,not hate speech
963, You always lie like a child.,not hate speech
964,I can see you right now. I'm watching.,not hate speech
965,"No, you're tracking my phone.",not hate speech
966,You think I'm using a fucking app?,not hate speech
967,You have no idea what I lived through.,not hate speech
968,"Underground doctors, blood transfusions.",not hate speech
969,I don't ever get to live in the regular world anymore.,not hate speech
970,I'm sorry.,not hate speech
971,Fuck you. We're so far past that.,not hate speech
972,But you want to see your father again?,not hate speech
973,You come talk to me face to face.,not hate speech
974, You're lying.,not hate speech
975, Turn around.,not hate speech
976,"I didn't know what I was doing, Jonah.",hate speech
977,It's like I wasn't even there.,hate speech
978,"I can't live with myself, okay?",hate speech
979,I don't know what else I can say to you.,hate speech
980,"I was good to you, Lydia.",not hate speech
981,I put you in a nice place.,not hate speech
982,I gave you everything you needed.,not hate speech
983,I took better care of you than anybody in your life.,not hate speech
984,And you tried to kill me.,not hate speech
985,"Look, come...",not hate speech
986,This is still bleeding.,not hate speech
987, Come here.,not hate speech
988, No.,not hate speech
989,I have your name on my heart and you can't even come close to me?,not hate speech
990,Where is he?,not hate speech
991,You try to run...,not hate speech
992,and we're gonna have to kill you.,not hate speech
993,Hey!,not hate speech
994,Lydia!,not hate speech
995,"Come on, kid. Pick up.",not hate speech
996,"Where are you, kid? Come on.",not hate speech
997,Fuck.,not hate speech
998,Okay.,not hate speech
999,"Come on, Kirby, come on.",not hate speech
1000,"Kirby! What're you doing, man?",not hate speech
1001,What's happening? Kirby?,not hate speech
1002,"Good news, old man.",hate speech
1003,Your sponsor says...,not hate speech
1004, ...you should start drinking again.,not hate speech
1005, Who the fuck is this?,not hate speech
1006, Talk to your friend.,not hate speech
1007, Hello? Kirby?,not hate speech
1008,"Sorry, Johnny. I did my best.",not hate speech
1009,The fuck? Kirby? Kirby?,not hate speech
1010,"You had a snitch for a sponsor, old man.",hate speech
1011,You know who I am?,hate speech
1012,I know your daughter better than you do.,not hate speech
1013,You should've taught her to shoot straight.,hate speech
1014,"So, you're not dead.",not hate speech
1015,"You just killed the best fucking friend I ever had, motherfucker!",hate speech
1016,"No, that's no friend.",not hate speech
1017,You fill him with a bottle of Tequila and he can't keep a secret.,hate speech
1018,Where's Lydia? You got Lydia?,not hate speech
1019,Where the fuck is Lydia?,not hate speech
1020,She might be dead.,not hate speech
1021,"No. No, she's not.",not hate speech
1022,"You're a fucking psycho, but you know one thing.",not hate speech
1023,She's the last streak of sunlight you're ever gonna see in your whole fucking life.,not hate speech
1024,Shut the fuck up.,not hate speech
1025,You know nothing about me.,hate speech
1026,"Yeah, I do. I know all about you. That's why you're gonna stay on the fucking phone.",not hate speech
1027,"Whatever you're gonna do with Lydia, you need to do something else first.",not hate speech
1028,You need to deal with me.,not hate speech
1029,Really?,not hate speech
1030,Why should I give a shit about you?,not hate speech
1031,"Well, 'cause I know what you're doing.",not hate speech
1032,I know about your family and the money you took. Yeah? You hear me?,hate speech
1033, I heard you.,not hate speech
1034, You're killing people to cover your tracks.,not hate speech
1035,Make a big fucking show to prove it's not you.,not hate speech
1036,"Lydia told me about the houses, she told me everything.",not hate speech
1037,"And I got a line straight to your uncle in fucking Juarez. El Padrino, you know him.",not hate speech
1038,I know he doesn't think too much of you.,hate speech
1039,I can get a message to him. You're still on the phone because you know this is real.,not hate speech
1040,And you know he's already watching you.,not hate speech
1041,"You think he's letting you use one of his best sicarios, that Zapotecan monster with you?",not hate speech
1042,"Just for you? He's there to keep track of you, too, motherfuck!",not hate speech
1043,"He gets the order from uncle, bang, he takes your fucking head off.",hate speech
1044,"You're a businessman, yeah?",not hate speech
1045,This is the best deal you're ever gonna get.,not hate speech
1046,"You kill me first. Kill me in front of her, if you have to. Let's just meet.",not hate speech
1047, And you trust me to let her go when you die?,not hate speech
1048, I don't fucking trust you at all.,not hate speech
1049,All I'm asking of you to do is keep her alive until I see her again.,not hate speech
1050,Okay. That's sweet.,not hate speech
1051,The old man wants his last chance.,not hate speech
1052,I'll call you in 10 minutes to this number and give you a meeting point.,not hate speech
1053,"No, you put her on the phone or no deal.",not hate speech
1054,Put her on the fucking phone right now!,not hate speech
1055,Get that bitch.,hate speech
1056,Okay. Shut up.,not hate speech
1057, Daddy.,not hate speech
1058, Dad!,not hate speech
1059,"Baby, I'm coming for you.",not hate speech
1060,Have a little faith.,not hate speech
1061,"That's it. Okay, get in there.",not hate speech
1062,I can't believe you'd have the nerve.,hate speech
1063,Fucker.,not hate speech
1064,"Okay, old man, Leave Highway head north into the desert.",not hate speech
1065,"Alone, no guns.",hate speech
1066, What the fuck is he doing?,hate speech
1067, He's showing us he ain't strapped.,not hate speech
1068,Let's get this shit over with.,not hate speech
1069,Move away from your bike!,hate speech
1070,Nice and slow.,not hate speech
1071, Lydia!,not hate speech
1072, Stop there.,hate speech
1073,Stop!,not hate speech
1074,Spread your legs.,not hate speech
1075,Spread your fucking legs!,not hate speech
1076,Put your fucking hands together!,not hate speech
1077,"Come on, get him in. We're going for a ride, just in case you were followed.",not hate speech
1078, Move!,not hate speech
1079," Come on, get in.",not hate speech
1080,"You will see her, you will see her.",not hate speech
1081,Get in. Get in!,hate speech
1082,"Hi, kid.",not hate speech
1083,"Go, get that.",hate speech
1084,"Come here, baby. Come here.",not hate speech
1085,Fuck! Fuck you! Fuck!,not hate speech
1086,Fuck! Fuck!,not hate speech
1087,Fuck.,not hate speech
1088,We gotta jam! Motherfucker's up there!,hate speech
1089, Where the fuck is he?,not hate speech
1090, You're hit.,not hate speech
1091, Did you see him?,not hate speech
1092, No.,not hate speech
1093,Okay. Fuck.,not hate speech
1094,"Okay, I saw him that time!",not hate speech
1095,"Okay, I got an idea.",not hate speech
1096,"I'll lay down some cover fire, you run to the other car.",not hate speech
1097, He won't be able to track you there?,hate speech
1098, What?,not hate speech
1099,"He'll be taking shots at me, he won't even see you. Get going!",not hate speech
1100," Dad, you're hurt!",not hate speech
1101, Get in the other car and fuck off!,hate speech
1102,"No, no. If you think that I'm leaving you, then you're out of your fucking mind!",not hate speech
1103, Do not run until I start firing!,not hate speech
1104, No!,not hate speech
1105," I'm gonna count to three. One, two...",not hate speech
1106, No! No! Count to a million if you want to!,not hate speech
1107,"If you think that I'm leaving here without you, then you don't know me!",not hate speech
1108,"All this time, and you never even fucking knew me!",hate speech
1109,What? Okay. Okay.,not hate speech
1110,It's nice to meet you.,not hate speech
1111,"Okay, I got another idea.",not hate speech
1112,Let's go together.,hate speech
1113, On your count or mine?,not hate speech
1114, Yours.,not hate speech
1115,"Okay, let's go! God... Go, go, go!",not hate speech
1116, Dad!,not hate speech
1117, Hey. You okay?,not hate speech
1118, I'm okay.,not hate speech
1119, Good.,hate speech
1120,"Oh, no! Oh, fuck!",not hate speech
1121,"Dad, he's coming.",not hate speech
1122, I don't know where he is.,hate speech
1123," Yeah, he's coming. Come here.",not hate speech
1124,Come here. Be still.,not hate speech
1125," Be very, very still.",not hate speech
1126, I'm so sorry.,not hate speech
1127,I got him! I got him! I got you!,hate speech
1128,"Oh, shit!",not hate speech
1129,"This is not good. Oh, fuck!",not hate speech
1130,Dead motherfucker!,not hate speech
1131,The other one. Get your head down.,hate speech
1132," There's the other one, the boyfriend.",not hate speech
1133," Stop, stop! Dad, he's gone. He's gone!",not hate speech
1134, Where did he...,not hate speech
1135," He's gone, okay? I gotta go get us help.",not hate speech
1136,"No, you stay here.",not hate speech
1137,"Don't leave me, stay here, please.",not hate speech
1138,Yeah.,not hate speech
1139," Yeah, yeah.",not hate speech
1140, Just let me look at you.,hate speech
1141,Your hair came out good.,hate speech
1142,"Look, kid, I'm really bad.",not hate speech
1143,"Here, take this gun.",not hate speech
1144,I got nothing better to give ya.,not hate speech
1145,"I never gave you anything,  and now I got nothing to give you.",not hate speech
1146," Dad, Dad! That is not true.",hate speech
1147, I lost ya...,not hate speech
1148, Dad! Look at me! Look at me!,hate speech
1149,You did not lose me.,not hate speech
1150,"I am not lost, I am right here with you, okay? Okay?",not hate speech
1151,I'm not gonna leave. Okay?,not hate speech
1152, Okay.,not hate speech
1153, Look at me.,hate speech
1154, It's just you and me.,not hate speech
1155, Okay.,not hate speech
1156,"I'm not gonna leave, ever. I promise.",not hate speech
1157,You sure are a good girl.,not hate speech
1158,You sure are. You sure are.,hate speech
1159,Dad?,not hate speech
1160,On your knees! Hands behind your head!,not hate speech
1161,"A year ago, I stopped running.",not hate speech
1162,I stopped listening to all of my worst instincts and all the worst people.,not hate speech
1163,I'll just tell you this.,not hate speech
1164,I've been sober a year.,not hate speech
1165,"I miss my father so much, that I can't sleep some nights, but...",not hate speech
1166,I tell myself that he's watching over me.,not hate speech
1167,"Sometimes, there's this shame...",hate speech
1168,"that almost breaks my back, but...",hate speech
1169,I tell myself...,not hate speech
1170,"""when you owe your life to someone...",not hate speech
1171,"""you better live it."" So, I just say...",not hate speech
