,dialog,label_word_embedding_fox_news
1030,"Just like the Jews, the Italians, the Mexicans and the Koreans do.",not hate speech
1031,Ain't nobody from outside bringing down the property value.,not hate speech
1032,It's these folk!,hate speech
1033,Shooting each other and selling that crack rock and shit.,hate speech
1034,How you think crack gets into the country?,not hate speech
1035,We don't own any planes.,hate speech
1036,We don't own no ships.,hate speech
1037,We are not the people who are flying and floating that shit in here.,not hate speech
1038,"Every time you turn on a TV, that's what you see.",not hate speech
1039,"Black people selling the rock, pushing the rock. Yeah, I know.",not hate speech
1040,It wasn't a problem when it was here.,not hate speech
1041,Wasn't a problem until it was in Iowa...,not hate speech
1042,...and on Wall Street where there's hardly any black people.,not hate speech
1043,If you want to talk about guns...,not hate speech
1044,...why is it that there's a gun shop on every corner here?,hate speech
1045, Why?,not hate speech
1046, I'll tell you why.,not hate speech
1047,Same reason there's a liquor store on every corner in the black community.,not hate speech
1048,Why? They want us to kill ourselves.,not hate speech
1049,"You go out to Beverly Hills, you don't see that shit.",hate speech
1050,They want to us to kill ourselves.,not hate speech
1051,The best way to destroy a people is to take away their ability to reproduce.,not hate speech
1052,Who is it that's dying out here on these streets every night? Y'all.,hate speech
1053, Yeah.,not hate speech
1054, Young brothers like yourselves.,hate speech
1055,What am I supposed to do?,not hate speech
1056,"Fool roll up, try to smoke me?",not hate speech
1057,I'm gonna shoot the motherfucker if he don't kill me first.,not hate speech
1058,You doing exactly what they want you to do.,not hate speech
1059,"You have to think, young brother, about your future.",hate speech
1060,"Damn, man.",hate speech
1061,"You know, Furious is deep.",hate speech
1062, He used to be a preacher?,hate speech
1063, He ain't never been no preacher.,not hate speech
1064,Just reads a lot.,hate speech
1065,"My brother should've heard that, man.",not hate speech
1066,Would've done him some good.,not hate speech
1067,Where he at?,not hate speech
1068,"Where else, man? Up on Crenshaw with the rest of them fools.",not hate speech
1069, Let's go.,not hate speech
1070, Cool.,not hate speech
1071," What up, Monster?",hate speech
1072," What up, nigga?",hate speech
1073,"Goddamn, there's a lot of motherfuckers here.",hate speech
1074,Don't be using God's name in vain.,not hate speech
1075,What?,not hate speech
1076,"Man, shut up.",not hate speech
1077,"Yo, man, you believe in God?",not hate speech
1078,"Yo, why the fuck y'all get so damn religified lately?",hate speech
1079,"Fool, I wasn't even talking to you.",not hate speech
1080,This is an A and B conversation.,not hate speech
1081,You can see your way out of it.,not hate speech
1082,You can see your way out of my ride...,not hate speech
1083,...and we'll see your crippled ass walking home.,not hate speech
1084,"Man, look. Do I believe in God?",not hate speech
1085,"Yeah, I guess I do.",not hate speech
1086,"How else can you have the sun, moon and stars and shit like that?",not hate speech
1087,"Sun, moon, stars, quasars.",not hate speech
1088,Motherfucker sound like Elroy Jetson.,not hate speech
1089,There ain't no God.,not hate speech
1090,"If there was a God, why he be letting motherfuckers get smoked?",hate speech
1091," Babies and little kids, tell me that.",not hate speech
1092," You tell me this, nigga.",not hate speech
1093,How you know God's a he? He could be a she. You don't know that.,hate speech
1094,"For one thing, you don't know what the fuck I be motherfucking knowing.",not hate speech
1095,I read about this shit when I was in the pen.,not hate speech
1096,"It was this book, right, and it was telling...",not hate speech
1097,...life in the perspective if God was a bitch.,not hate speech
1098,"Said if God was a bitch, there wouldn't be no nuclear bombs, no wars...",not hate speech
1099,...because that ain't in a bitch's nature.,not hate speech
1100,"Why every time you talk about a female you say ""bitch"" or ""ho""?",not hate speech
1101, Because that's what you are.,hate speech
1102," Nigga, fuck you.",not hate speech
1103,"Hey, hey.",not hate speech
1104,What's up?,not hate speech
1105,"What up, D?",hate speech
1106," What's up, Mon?",hate speech
1107," What's up, Rick? Tre.",hate speech
1108,What's happening?,not hate speech
1109, Where y'all coming from?,not hate speech
1110, Compton.,not hate speech
1111,"What y'all doing over here, man?",not hate speech
1112,"We're kicking it. Philosophizing on God, church, bitches and all.",hate speech
1113,I'm schooling these niggas on the aspect of religion.,hate speech
1114, Religion?,not hate speech
1115," And on factual, actual studies.",not hate speech
1116,You know what I'm saying?,not hate speech
1117, Y'all coming from Compton?,hate speech
1118, Yeah.,not hate speech
1119, Thought you were scared of Compton.,not hate speech
1120," Rick was a shivering bitch, boy.",hate speech
1121,"It was deep, though.",not hate speech
1122,"You should've been there, man.",not hate speech
1123,"Pops was talking, speaking, man.",hate speech
1124,Speaking the truth and shit.,not hate speech
1125,Your pops is like motherfucking Malcolm Farrakhan.,hate speech
1126,"Man, what's wrong with you?",not hate speech
1127,"Fuck you looking at, nigga?",not hate speech
1128,"I'm still trying to find out, nigga!",not hate speech
1129,We got a problem here?,hate speech
1130,We got a problem here?,hate speech
1131,"We got a problem, nigga?",hate speech
1132, What up with this?,not hate speech
1133, Put the gun away.,not hate speech
1134,Can't we have one night where nobody gets shot?,not hate speech
1135," Shut up, bitch.",hate speech
1136," Bitch, I will fuck you up!",not hate speech
1137,Let's get that bitch!,hate speech
1138,Fuck you like that.,not hate speech
1139,Ferris always trying to start some shit.,not hate speech
1140,"Nigga can't fight, so he always trying to find an excuse to shoot somebody.",hate speech
1141,That's why fools be getting shot all the time.,not hate speech
1142,Trying to show how hard they is.,hate speech
1143,Ignorant.,not hate speech
1144,"Fool, shut up.",not hate speech
1145,You be doing that shit too.,not hate speech
1146,I know.,not hate speech
1147,"Hey, man, come on. Let's go!",not hate speech
1148,I'm getting the fuck out of L.A.,not hate speech
1149,Fuck this shit. Fuck it.,not hate speech
1150,You can't go nowhere without it getting all shot up and shit.,not hate speech
1151,Shit!,not hate speech
1152,Shit! Fuck!,not hate speech
1153,Driver! Put your hands on the steering wheel!,not hate speech
1154, Got any drugs or weapons on you?,not hate speech
1155, No.,not hate speech
1156,I didn't do nothing.,not hate speech
1157,You think you tough.,not hate speech
1158,"You think you're tough, huh?",not hate speech
1159,"You scared now, huh?",not hate speech
1160,I like that. That's why I took this job.,not hate speech
1161,I hate little motherfuckers like you.,not hate speech
1162,"Little niggers, you ain't shit!",not hate speech
1163,"Think you tough, huh?",not hate speech
1164,"I could blow your head off, and you couldn't do shit.",not hate speech
1165,How you feel now?,not hate speech
1166,What set you from?,not hate speech
1167,Look like one of them Crenshaw Mafia motherfuckers.,hate speech
1168,"No, you probably one of them Rolling 60s, huh?",not hate speech
1169,a possible 187 in blue ...,hate speech
1170,...at corner of Florence and Vermont.,hate speech
1171,"Again, a possible 187 in blue  at corner of Florence and Vermont.",not hate speech
1172,Stay out of trouble.,hate speech
1173,"You gentlemen have a nice evening now, you hear?",not hate speech
1174,Hi.,not hate speech
1175, I thought something happened to you.,not hate speech
1176, Ain't nothing gonna happen to me.,not hate speech
1177,I'm tired of hearing them shooting all the time.,not hate speech
1178, What's wrong?,not hate speech
1179, Nothing.,not hate speech
1180,I'm tired of this shit.,not hate speech
1181,Those two motherfuckers.,hate speech
1182,I could kill all these motherfuckers.,hate speech
1183,I'm sick and fucking tired of this shit!,not hate speech
1184,I'm fucking sick of this shit!,not hate speech
1185,I'm so fucking tired of this shit!,not hate speech
1186,Fuck this shit!,not hate speech
1187,Stupid motherfucker!,not hate speech
1188,Fucking fuck you! Fuck you!,not hate speech
1189,I wish I could kill all you!,hate speech
1190,"Come on at me, motherfucker!",not hate speech
1191,What's so funny?,not hate speech
1192,I never thought I'd be crying in front of a female.,hate speech
1193,You can cry in front of me.,not hate speech
1194,What do you think about...,not hate speech
1195,...people getting married while they're still in college?,not hate speech
1196,Are you trying to ask me something?,not hate speech
1197,No.,hate speech
1198,I just wanted to know what you thought about that kind of situation.,hate speech
1199,I think it can be good if two people really love each other.,not hate speech
1200,Really?,not hate speech
1201,Yeah.,not hate speech
1202,You sure you're down for this?,not hate speech
1203,Yeah. Are you?,not hate speech
1204,Yeah.,not hate speech
1205,"I mean, yes, I am.",not hate speech
1206,I don't want to get pregnant.,hate speech
1207,You won't.,not hate speech
1208,Hi. I'm looking for a Miss Devereaux?,not hate speech
1209, She's right over there.,not hate speech
1210, Thank you.,not hate speech
1211, Hey.,not hate speech
1212, Hi.,not hate speech
1213,You look nice.,hate speech
1214,Thank you. So do you.,not hate speech
1215,Thanks.,not hate speech
1216,Thanks for coming.,not hate speech
1217,So...,not hate speech
1218,So this is...,hate speech
1219,...definitely you.,not hate speech
1220,And what's that supposed to mean?,not hate speech
1221,I thought we were gonna talk about Tre.,not hate speech
1222,"Espresso, please.",not hate speech
1223,"Caf au lait, please.",not hate speech
1224,I bought him some shoes yesterday.,not hate speech
1225,Why are you always buying him stuff?,not hate speech
1226,Can't I be nice to my son?,not hate speech
1227,Do I have that right?,not hate speech
1228,"Yes, but he has a job. You don't have to always buy him stuff.",not hate speech
1229,Look...,not hate speech
1230,...did he tell you he wants to move in with Brandi?,not hate speech
1231,Yeah. So?,not hate speech
1232,"""Yeah. So?"" So don't you think that's a bad idea?",hate speech
1233,"I think that Tre is old enough to make his own decisions, Reva.",not hate speech
1234,You're his father. That means you were supposed to guide his decisions.,hate speech
1235,What have I been doing for the last seven years?,not hate speech
1236," Not that, evidently.",not hate speech
1237," Listen, Reva...",not hate speech
1238,...it's time for you to let go.,not hate speech
1239,I know you want to play the mommy...,hate speech
1240,...but Tre is a grown man now.,hate speech
1241,He's not a little boy anymore.,not hate speech
1242,"That time has passed, sweetheart.",not hate speech
1243,You missed it.,not hate speech
1244,"Excuse me, I'm getting some cigarettes.",not hate speech
1245,You're not getting off that easy.,not hate speech
1246,Sit your ass down.,not hate speech
1247,Excuse me?,hate speech
1248,I said sit down before I raise my voice and make a fool out of both of us.,not hate speech
1249,Okay.,not hate speech
1250,Now it's my time to talk.,not hate speech
1251,"Of course you took in your son, my son...",not hate speech
1252,...our son...,not hate speech
1253,...and you taught him to be a man.,hate speech
1254,I'll give you that...,not hate speech
1255,...because most men ain't man enough to do what you did.,not hate speech
1256,"But that gives you no reason, do you hear me, no reason...",not hate speech
1257,...to tell me that I can't be a mother to my son.,hate speech
1258,What you did...,not hate speech
1259,...is no different from what mothers have done from the beginning of time.,hate speech
1260,It's just too bad more brothers won't do the same.,hate speech
1261,But don't think you're special.,hate speech
1262,"You may be cute, but not special.",hate speech
1263,Drink your caf au lait. It's on me.,not hate speech
1264,Everybody in the mall was running.,not hate speech
1265,Bitches running out of Contempo's.,hate speech
1266,Motherfuckers throwing cookies out the cookie shop.,hate speech
1267,Niggas was getting their bail on.,not hate speech
1268,I was smoking every motherfucker that came in.,not hate speech
1269,I thought I'd let y'all know that.,hate speech
1270,Understands me?,hate speech
1271,What's up?,not hate speech
1272,You missing all the action.,not hate speech
1273,Niggas getting smoked and shit.,not hate speech
1274,Who's them niggas?,hate speech
1275,"Man, pick Chris up.",not hate speech
1276,Punk might start trippin'.,not hate speech
1277,That's those fools from Crenshaw.,not hate speech
1278,"Damn, I ain't even got my gat.",not hate speech
1279,Motherfucker ain't got nothing better to do.,not hate speech
1280,Twentyseven years old.,hate speech
1281,Still fucking motherfuckers our age...,not hate speech
1282,...with his old ass.,not hate speech
1283,What's up?,not hate speech
1284,Anyway...,not hate speech
1285,...I saw you roll out of Brandi crib at 2 in the motherfucking morning.,not hate speech
1286,"Yo, man, that's my business.",not hate speech
1287,"Yeah. Handle your shit, G.",not hate speech
1288," Peer pressure, man.",hate speech
1289, Handle your shit.,not hate speech
1290,Don't be like this motherfucker.,hate speech
1291,"This motherfucker got babies, inhouse pussy.",not hate speech
1292,"Let me do shit like that, Ma would be like: ""I ain't having it."" Ricky.",not hate speech
1293,Ricky!,not hate speech
1294,You know you heard me.,not hate speech
1295,What?,not hate speech
1296,I need you to go get some cornmeal.,not hate speech
1297,Yeah. I'll go in a little while.,not hate speech
1298,"You wanna land a good job, you have to know what most employers want.",not hate speech
1299,Like how to motivate yourself.,not hate speech
1300,How to lead others.,hate speech
1301,How to perform under pressure.,not hate speech
1302,Learn these things in the Army.,not hate speech
1303,No matter what career you choose...,not hate speech
1304,...you'll really be ready to take off.,not hate speech
1305,"Ricky, get up and go now.",hate speech
1306,I can't finish frying the fish without it.,hate speech
1307,"Boy, go get this girl some cornmeal.",not hate speech
1308,You ought to be happy somebody's cooking for your ass.,not hate speech
1309," Give me some, Dook.",not hate speech
1310," Here, take it.",not hate speech
1311, What's up?,not hate speech
1312, What's happening?,not hate speech
1313,"D, go to the store for me and get some cornmeal?",hate speech
1314,"Nigga, I ain't the one she told to go get it. She's your wife.",not hate speech
1315,"She ain't my wife, man.",not hate speech
1316,Shit.,not hate speech
1317,"Might as well be, y'all got a family and shit.",not hate speech
1318,"""Tecmo Bowl"" playing motherfucker.",not hate speech
1319,"Fuck you, man.",not hate speech
1320,Go to the store with me.,hate speech
1321,"Sure, let's do it.",not hate speech
1322,What?,not hate speech
1323,"Don't fuck me, fuck your wife.",not hate speech
1324,That's why you got a baby.,not hate speech
1325,"You better get out of my face, all right?",not hate speech
1326,What's up with Brandi?,not hate speech
1327," Hey, you a punk, man!",not hate speech
1328," Hey, yo, yo. Wait a minute.",not hate speech
1329,Wait a minute!,not hate speech
1330,This is family business.,not hate speech
1331,Let them fight.,hate speech
1332,Y'all are brothers!,hate speech
1333,You ain't supposed to be fighting.,not hate speech
1334,You been a punk from day one.,hate speech
1335,Mama's boy!,not hate speech
1336,"Get him, Dough.",hate speech
1337,"Let them fight, man.",hate speech
1338,"Brenda, Ricky and Doughboy are out here fighting.",hate speech
1339,"Hey, hey. Cut that out.",not hate speech
1340,Get off of him.,not hate speech
1341,Get off of him!,hate speech
1342,Damn.,not hate speech
1343, What you hit me for?,not hate speech
1344, You all right?,not hate speech
1345,"Yeah, I'm all right. I'm all right!",not hate speech
1346,What you hit me for?,not hate speech
1347,It's the test scores. Ricky!,not hate speech
1348,"Ricky, baby, your test scores!",not hate speech
1349,What you hit me for?,not hate speech
1350,Why you hitting me?,not hate speech
1351,"Yo, Dough. Why she hit you?",not hate speech
1352,"Shut up, man.",hate speech
1353,Fuck all that shit.,hate speech
1354,I'm going into the fucking Army.,not hate speech
1355, That's all there is to say.,not hate speech
1356, You're doing what?,not hate speech
1357,"Man, what are you, a damn fool?",hate speech
1358,They say I can learn to work on computers.,not hate speech
1359,"Plus, they'll give me money for college.",not hate speech
1360,Listen to you.,not hate speech
1361,You sound like the commercial.,not hate speech
1362,They don't tell you that you don't belong to you no more.,not hate speech
1363,"You belong to them, the government.",not hate speech
1364,Like a slave or something.,hate speech
1365,My daddy told me a black man...,not hate speech
1366,"...has got no business, no place in the white man's Army.",hate speech
1367,I heard all that.,not hate speech
1368,"I got a little boy to think about, okay?",not hate speech
1369,I don't want to be like my brother.,hate speech
1370,Hanging out and not doing shit.,hate speech
1371,"End up dealing 'caine, just like him.",not hate speech
1372,I want to do something with my life.,not hate speech
1373,I want to be somebody.,hate speech
1374,"Listen, let me tell you something.",not hate speech
1375,"When you join that Army, you ain't gonna be nobody.",not hate speech
1376,"Yo, you got any change?",not hate speech
1377,"No, I ain't got no change. See?",not hate speech
1378,What up?,not hate speech
1379,"Yo, chief. Here you go.",not hate speech
1380,"Hey, no problem, bro.",not hate speech
1381,You win anything?,not hate speech
1382,"Wait a minute, man.",hate speech
1383,I'm still trying to find out.,not hate speech
1384,Shit. Nothing.,not hate speech
1385, What?,not hate speech
1386, I said nothing. I didn't win.,not hate speech
1387,You gotta be Mexican to win that shit.,not hate speech
1388,"Man, I win this lottery, I won't have to worry about a damn thing.",hate speech
1389,"Don't have to worry about no colleges, no 700 on no SATs. Not a damn...",hate speech
1390,Look.,not hate speech
1391,There's that motherfucker from the other night.,hate speech
1392,"Okay. When I say ""cut,"" we'll cut through these houses.",not hate speech
1393,Cut!,not hate speech
1394, Punk ass.,not hate speech
1395," Get him, man, get him!",hate speech
1396,Let's get him.,not hate speech
1397,Go around the corner.,hate speech
1398,"Cut them off. Come on, go!",hate speech
1399,Shit.,not hate speech
1400,Fucking mangy mutts!,not hate speech
1401,Come on.,not hate speech
1402,I got you. I got you.,not hate speech
1403," Come on, let's go.",not hate speech
1404," Hold on, man.",not hate speech
1405, What are you doing?,not hate speech
1406, I gotta drain the weasel.,not hate speech
1407,"If that motherfucker roll up on the set one more time, I'll blast his ass.",not hate speech
1408,Shit! Rick!,not hate speech
1409,What a relief and shit.,hate speech
1410, Let's go.,not hate speech
1411, Wait a minute. Let's split up.,not hate speech
1412,I don't think we should do that.,not hate speech
1413,I think it'd be better if we're together.,hate speech
1414,Them fools ain't gonna do nothing.,not hate speech
1415,They just showing out and shit.,hate speech
1416, I'll meet you at your house.,not hate speech
1417, Cool. I'm out of here.,not hate speech
1418,"Come on, man.",hate speech
1419,Ricky!,not hate speech
1420,Ricky.,not hate speech
1421,Help me! Help me!,hate speech
1422,Somebody help me!,not hate speech
1423,Ricky!,not hate speech
1424,Shit!,not hate speech
1425,Watch his head. Don't hurt him.,not hate speech
1426,"Don't hurt him, man.",hate speech
1427,Be careful with him.,not hate speech
1428,Watch his head.,not hate speech
1429,He's dead.,not hate speech
1430,Let's take him home.,not hate speech
1431,Mama!,not hate speech
1432,No!,not hate speech
1433,"Ricky! Oh, my God, no!",not hate speech
1434,Not Ricky!,hate speech
1435,What y'all doing now?,not hate speech
1436,Ricky?,not hate speech
1437,"Oh, my God.",not hate speech
1438,"Ricky? Ricky, baby, get up.",not hate speech
1439,"Get up. Wake up, baby.",not hate speech
1440,"Ricky, get up. Get up.",not hate speech
1441,"It's all right. Get up, baby.",hate speech
1442,"Get up. Tre, what happened?",not hate speech
1443,What happened to him?,not hate speech
1444,Give me the baby.,not hate speech
1445,Give me the baby!,not hate speech
1446,Don't touch him!,hate speech
1447,Don't you ever touch him!,hate speech
1448,He don't need to be seeing this!,not hate speech
1449,"Ricky, please wake up!",not hate speech
1450,Mom.,not hate speech
1451, What did you do? What did you do?,not hate speech
1452, It wasn't my fault.,not hate speech
1453, What did you do?,not hate speech
1454," Mama, I didn't do nothing.",not hate speech
1455,I didn't do nothing.,not hate speech
1456,I didn't do nothing.,not hate speech
1457,"Oh, my God!",not hate speech
1458,What did you do to him?,not hate speech
1459,What did you do?,not hate speech
1460,What did you do? You did this!,not hate speech
1461,You did this! I'll kill you!,not hate speech
1462,You did it! I know you did it!,not hate speech
1463,"You did it! Yes, you did!",not hate speech
1464,I told you!,not hate speech
1465,"Oh, God! Oh, God!",not hate speech
1466,"Oh, my God!",not hate speech
1467,"Ricky, baby! Ricky!",not hate speech
1468,Meet me at my house in five minutes.,not hate speech
1469,"Tre, what happened?",not hate speech
1470, Talk to me. What happened?,not hate speech
1471, Go home.,not hate speech
1472, What happened to Ricky?,hate speech
1473, Go home.,not hate speech
1474,Talk to him.,not hate speech
1475,Something happened to Rick!,not hate speech
1476,I don't know. He just got shot.,not hate speech
1477,Something happened to Rick!,not hate speech
1478,"Brandi, I want you to calm down and I want you to go home. You hear me?",hate speech
1479, You hear me?,hate speech
1480, Yes.,not hate speech
1481,I'll take care of him.,not hate speech
1482,He'll be all right.,not hate speech
1483,Tre?,not hate speech
1484,"Tre, what are you doing?",not hate speech
1485,"Oh, you bad, now, huh?",not hate speech
1486,"You bad. You gotta shoot somebody now, huh?",not hate speech
1487,"Well, here I am.",not hate speech
1488,"Come on, shoot me.",hate speech
1489,"You bad, right?",not hate speech
1490,"Look, I'm sorry about your friend.",not hate speech
1491,"My heart goes out to his family, but that's their problem.",not hate speech
1492,You my son. You my problem.,not hate speech
1493,I want you to give me the gun.,not hate speech
1494,I see. You want to end up like little Chris in a wheelchair?,hate speech
1495,"Right? No, no, you want to end up like Doughboy, huh? No?",not hate speech
1496,"Give me the motherfucking gun, Tre!",not hate speech
1497,"You're my only son, and I'm not gonna lose you to no bullshit, you hear?",not hate speech
1498,"I love you, man.",not hate speech
1499,Go clean yourself up.,not hate speech
1500,Go on.,not hate speech
1501,Tre.,not hate speech
1502,Tre!,not hate speech
1503,Damn.,not hate speech
1504,Shit!,not hate speech
1505,Yeah.,not hate speech
1506,Let me out.,not hate speech
1507,Dough...,not hate speech
1508,...let me out.,not hate speech
1509,"Where these motherfuckers at, man?",not hate speech
1510,Been out here damn near three hours.,hate speech
1511,It's colder than a motherfucker out here too.,hate speech
1512,Let's go eat.,hate speech
1513,Cool.,not hate speech
1514,When you gonna get your hair cut?,not hate speech
1515,It look like something from 1983.,hate speech
1516,Ain't nobody cutting my hair.,not hate speech
1517,I'm like Samson.,not hate speech
1518,My strength is in my head.,not hate speech
1519,What's up with the babe you been talking to?,not hate speech
1520, Fuck that bitch.,not hate speech
1521, You scared?,not hate speech
1522," He ain't scared, he just young.",not hate speech
1523, And dumb.,not hate speech
1524,I'm putting ketchup on this.,not hate speech
1525,Why you put all that ketchup on it?,not hate speech
1526,"Why you worried about it, fool?",not hate speech
1527,These my fries.,not hate speech
1528,We going to see your girl?,not hate speech
1529,"No, I'm going to see my girl.",not hate speech
1530,You going home.,not hate speech
1531,"There they go, right there.",not hate speech
1532,Turn off the lights.,hate speech
1533,"Hit the lights, nigga.",not hate speech
1534,Take your ass home and watch some videos.,not hate speech
1535,Home with your mama.,not hate speech
1536,Check that motherfucker out.,not hate speech
1537, Shit!,not hate speech
1538, Let's get the fuck out of here!,hate speech
1539,Don't follow me. Go your own way.,not hate speech
1540, What the fuck?,not hate speech
1541, What the fuck you doing?,not hate speech
1542,This motherfucker's crazy!,not hate speech
1543,"Goddamn, man. And I'm on parole.",hate speech
1544,Ain't this about a bitch!,not hate speech
1545,What the fuck you doing?,not hate speech
1546,Shit!,not hate speech
1547,"Yo, Dough. Let's bail, man.",hate speech
1548," Let's go, man!",not hate speech
1549," Come on, nigga, now!",not hate speech
1550,"Man, what the fuck?",hate speech
1551,"Oh, shit!",not hate speech
