,dialog,label_word_embedding_fox_news
516,"I ain't no criminal. I can read, bitch.",not hate speech
517,"Who is that, Shanice?",hate speech
518,"That's Tre, Ricky's best friend.",not hate speech
519,He was best friends with Doughboy when they was little.,hate speech
520,They be trying to act like they brothers.,hate speech
521,"Girl, he is fine!",hate speech
522,I'd like to rush that!,hate speech
523, He go to Washington?,not hate speech
524, He go to Crenshaw.,hate speech
525,I seen him before.,not hate speech
526,He work at the Fox Hills Mall.,not hate speech
527,Do he got a girlfriend?,hate speech
528,Yes.,not hate speech
529,"Jamaica, girl, I was scoping on this ho's man.",hate speech
530,"He fine, anyway. You better watch his ass. Somebody might steal him.",not hate speech
531,"All right, y'all, come and get it!",hate speech
532, Do you live here?,not hate speech
533," Okay, girl. Sorryass niggas.",not hate speech
534,Come on.,not hate speech
535,Why don't y'all act like gentlemen and let these ladies eat first!,hate speech
536,"Yeah, you act like you ain't never had no barbecue before.",not hate speech
537,Let the ladies eat.,not hate speech
538,Ho's gotta eat too.,hate speech
539,"Wait, nigga, who you calling a ho?",hate speech
540,I ain't no ho.,not hate speech
541,"Oops. I'm sorry, bitch.",not hate speech
542," Hey, hey, watch your mouth.",not hate speech
543, Just playing.,not hate speech
544,"All right, enjoy. And be nice.",hate speech
545,Get out of the way!,hate speech
546,You still up here?,not hate speech
547, Hi.,not hate speech
548, Hello.,not hate speech
549,So why haven't you called?,not hate speech
550,Just one minute.,not hate speech
551,"What's up, my brother?",not hate speech
552,She wants to talk to you.,not hate speech
553, I know. I'm just taking my time.,not hate speech
554," Oh, I see.",not hate speech
555, You trying to run that game on her.,not hate speech
556," Yeah, how am I doing?",not hate speech
557,"Well, you're doing just fine.",not hate speech
558, Except for one thing.,not hate speech
559," Yeah, what's that?",not hate speech
560,She left.,not hate speech
561,What?,not hate speech
562, Damn!,not hate speech
563, That's all right.,not hate speech
564,"Hey, hey, hey.",not hate speech
565,Ain't this a bitch?,not hate speech
566,Wait! Wait!,not hate speech
567, Don't worry about it. I got her.,not hate speech
568, Is she all right?,not hate speech
569,"All right, G.",hate speech
570,Sheryl! Come on!,not hate speech
571,Keep your baby out the street.,hate speech
572,She gonna get hit one of these days.,not hate speech
573,You got some blow?,not hate speech
574,You got some rock?,not hate speech
575, I'll suck your dick.,not hate speech
576, Just keep the baby out the streets.,hate speech
577,And change her diapers.,hate speech
578,Girl almost smell as bad as you.,not hate speech
579,"What up, punk? What up, fool?",hate speech
580,Mark.,not hate speech
581, What is that? Barbecue?,not hate speech
582, Yeah.,not hate speech
583, I know you didn't bring me no swine.,not hate speech
584, No.,not hate speech
585,Mrs. Baker told me to bring you a plate.,hate speech
586," Brenda, huh?",not hate speech
587, Yeah.,not hate speech
588,She might've had a chance if she didn't talk so much.,not hate speech
589,Let's see.,hate speech
590,She ain't lost her touch.,not hate speech
591,She still can make some barbecue.,not hate speech
592,"Hey, Pop, can you fix my fade back here? And up here?",not hate speech
593,I'm eating.,not hate speech
594,After you eat.,not hate speech
595,Yeah.,not hate speech
596,"Yeah, real close.",not hate speech
597,"So I can brush it, you know, hook up some waves.",not hate speech
598,Something wrong?,not hate speech
599,Nope.,not hate speech
600,What's the problem?,not hate speech
601,"You're getting old, Pop.",not hate speech
602, I'm getting old?,not hate speech
603, Yeah.,not hate speech
604,"I'm getting better, young brother.",not hate speech
605,You getting old.,not hate speech
606, You older than dirt.,not hate speech
607, I'm older than dirt?,not hate speech
608, Yes.,not hate speech
609, I ain't but 17 years older than you.,not hate speech
610,"Your friends, they got fathers in their 40s and 50s.",not hate speech
611,These cats are great big...,hate speech
612,"Just slobs, man.",hate speech
613," You know, bellies out to here.",not hate speech
614, Yes. That's gonna be you!,not hate speech
615,"That's gonna be you, man.",not hate speech
616,"Big old, fat, juicy roll...",not hate speech
617,...doublejellyroll belly. Right?,not hate speech
618,"Sitting in a rocking chair, reading the funny papers!",not hate speech
619,"Then your grandchildren will be running around, saying: ""Granddaddy, give me something.",not hate speech
620,"Give me a dollar."" You think so, huh?",not hate speech
621,Yeah.,not hate speech
622,"Wait a minute, man.",hate speech
623,"What's all this about grandkids, man?",not hate speech
624,You using the rubbers I gave you?,not hate speech
625,"I ain't ready to be a granddaddy, all right? I just...",not hate speech
626,I ain't ready for all of that.,not hate speech
627,Don't worry.,hate speech
628,I can take care of myself.,not hate speech
629,"Why are you sweating me, man?",not hate speech
630,"Tre, close the refrigerator.",not hate speech
631,Close it. Come here.,not hate speech
632,What?,not hate speech
633,All right?,not hate speech
634,What? I stink now?,not hate speech
635,I got something on me?,hate speech
636, You had some pussy yet?,not hate speech
637, What?,not hate speech
638, You had some pussy yet?,not hate speech
639, Yeah! Yeah!,not hate speech
640,When?,not hate speech
641, What?,not hate speech
642, When?,not hate speech
643,"All right, all right.",not hate speech
644,Just sit down for a second.,hate speech
645,"Go on, sit down, now.",hate speech
646,"It was a Sunday, right? Rick and l were kicking it up on Crenshaw.",not hate speech
647,This group of females rolled up in a Rabbit.,not hate speech
648,Everybody trying to bumrush them.,not hate speech
649,"Trying to jib and all, right?",not hate speech
650,"Man, there was this one girl everybody was trying to rush.",not hate speech
651,Baby was fine!,hate speech
652,"Body was booming, like right out of Jet centerfold.",hate speech
653,"So I'm, like, eyeballing her.",not hate speech
654,"She walks right up on me and busts out, ""Is this your ride?"" Then I say, ""Yeah, you want to go for a ride with me?"" She says, ""No, I want to drive it."" I say, ""Can you drive stick?"" She says, ""I can learn if you teach me."" I go into mackdaddy mode because I'm getting a woody in my sweats.",not hate speech
655,"I says, ""Why don't you give me your number, I'll call you for a lesson."" She does.",not hate speech
656,"About a week later, I'm over at her house.",not hate speech
657,Her mom and grandma are leaving for church.,not hate speech
658,"I walk right up to the door, man.",not hate speech
659,"As soon as I go inside, boom!",not hate speech
660,"We go at it, nonstop.",not hate speech
661,"Kissing, hugging, right?",not hate speech
662,"So I pick her up, take her upstairs.",hate speech
663,"Well, about 20 minutes into it, Mom and Grandma's come home.",not hate speech
664,Seems Grandma forgot her purse.,not hate speech
665,Wanted to make sure she has something for the collection plate.,not hate speech
666,"Yeah, I guess she could smell the sex in the air or something, right?",not hate speech
667,She starts straight towards Tisha's room.,not hate speech
668,That's the last I ever saw of Tisha.,not hate speech
669,I call her once in a while...,not hate speech
670,"...but when I do, her mom or grandma say, ""She can't talk right now.",not hate speech
671,"She busy, doing the dishes.""  What'd you use?",not hate speech
672, I used the number she gave me.,not hate speech
673,Why are you sweating me?,not hate speech
674,I had to use nothing.,not hate speech
675,She said she was on the pill.,not hate speech
676,How many times I tell you?,not hate speech
677,If a girl's on the pill...,hate speech
678,...you use something anyway.,not hate speech
679,A pill ain't gonna keep your dick from falling off.,not hate speech
680,I don't know why you insist on learning things the hard way...,not hate speech
681,...but you gonna learn.,not hate speech
682,"Oh, yeah, you gonna learn!",not hate speech
683,Clean up that hair.,hate speech
684,"What's up, man?",hate speech
685, What the fuck is wrong with you?!,not hate speech
686, What?,not hate speech
687,You slamming my door like some gorilla on a football field!,not hate speech
688," Damn, nigga, what's wrong with you?",not hate speech
689, Nothing.,not hate speech
690,"Guess what, man.",hate speech
691, Recruiter from SC's coming tonight.,hate speech
692, Cool.,not hate speech
693,"You know, man, I never lied to my father.",hate speech
694,Never?,not hate speech
695,"Well, almost never.",hate speech
696,Where's all this coming from?,not hate speech
697,I lied to Pops yesterday.,not hate speech
698,Told him I weren't no virgin.,not hate speech
699,"Well, you ain't a virgin, is you?",not hate speech
700,Is you?,not hate speech
701,"Well, technically speaking, I haven't.",not hate speech
702,"You know, I fingered a couple of honeys...",hate speech
703,"...and sucked on some titties, but I ain't never stuck it in.",not hate speech
704,"Why not, man?",hate speech
705, You really want to know?,hate speech
706," Yeah, I asked you, didn't l?",not hate speech
707,I was afraid.,not hate speech
708, Shit!,not hate speech
709, Get off me.,hate speech
710," See, man? Shut up. Shut up.",not hate speech
711," What you doing, man?",not hate speech
712,"What you afraid of, man?",hate speech
713,Of being a daddy.,hate speech
714,"Oh, well, yeah.",not hate speech
715,"But I'm getting old now, see?",not hate speech
716,"And now that I want to flap some skins, Brandi ain't even down for it.",not hate speech
717, Even with a jimmy she ain't down.,not hate speech
718, Is that right?,not hate speech
719,Straight up?,not hate speech
720,We'll see about that.,not hate speech
721,We'll see about that.,not hate speech
722,What's that?,not hate speech
723,"All right, you got it.",not hate speech
724, I don't see that.,not hate speech
725, Why the silent treatment?,not hate speech
726,You haven't talked to me in five days!,not hate speech
727,You tell your father to say you're not home.,not hate speech
728, Then you take the phone off the hook!,not hate speech
729," Well, I been busy.",not hate speech
730,"Oh, well, don't give me no baldass excuse for a lie like that!",not hate speech
731,What did I do that was so bad that you just had to stop talking to me?,hate speech
732,"See, you know what you did.",not hate speech
733,"See, you gotta get with the program.",not hate speech
734,"I told you about that. I'm Catholic, and it goes against my morals.",not hate speech
735,"Yeah, but Catholic girls are supposed to be one of the biggest hootchies.",hate speech
736, When you bust a cap on somebody?,not hate speech
737," I bust a cap like, blamblam.",not hate speech
738,Damn! God!,not hate speech
739,"Come on, fuck him up, man!",not hate speech
740,Fuck him up!,not hate speech
741,"You say you want to wait till you get married first, right?",not hate speech
742,"No, look at me. Right?",not hate speech
743,Yes.,not hate speech
744,And I say that I'm gonna be the one who marries you.,not hate speech
745,So it don't make no difference when we do it...,not hate speech
746,"...we still gonna get married, right?",not hate speech
747,"Yeah, but I'm going to college before I marry...",not hate speech
748,...and there ain't no guarantee that I'm gonna marry you!,not hate speech
749,Bad shit!,hate speech
750," Shit, look at this.",hate speech
751," Oh, shit.",not hate speech
752,"Hey, hey, yo. Yo, bonita.",not hate speech
753,"Damn, she got a banging ass.",hate speech
754,Chica bonita. You come to my casa and let's do the loco thing.,not hate speech
755,"Hey, Dooky, this fool trying to speak Spanish...",not hate speech
756, That shit worked.,not hate speech
757," What up, baby?",hate speech
758,So let me knock the stuffing off that Egg McMuffin.,hate speech
759,You got a phone number?,not hate speech
760, You haven't even given me a ring!,not hate speech
761, I ain't ready for all that yet!,not hate speech
762,"But you're ready to act like we are, though?",not hate speech
763, With your mad self.,not hate speech
764, Don't touch me.,hate speech
765,All right.,not hate speech
766," You make me sick, man.",not hate speech
767," I know, but I missed you.",not hate speech
768,I missed you too.,not hate speech
769,He still ain't fucked her yet.,not hate speech
770,You better take your ass to the store with that.,not hate speech
771,So you gonna give me the skins or what?,not hate speech
772,"No, that's not all I think about.",not hate speech
773,Yeah.,not hate speech
774," Okay, hang on. Pop!",not hate speech
775, Yo!,not hate speech
776,Brandi's mom say you're cute!,not hate speech
777,Ask her how come she don't say hi when I speak to her.,not hate speech
778,"He say, how come she don't say hi when he speak to her?",hate speech
779,Yeah.,not hate speech
780,"Hey, I'm supposed to be talking to you, not passing messages.",not hate speech
781,"If my daddy mess with your mama, we gonna be brother and sister.",not hate speech
782,Then we have to do that incest thing.,hate speech
783,What?,not hate speech
784,"No, no, I'm just kidding.",not hate speech
785,"Wait, hang on, I got another call.",not hate speech
786,Who this?,not hate speech
787,"Oh, hi, Mama.",not hate speech
788,"Yeah. Hang on, I got Brandi on the other line, okay?",not hate speech
789,So you gonna give me the skins or what?,not hate speech
790,"Tre, this is your mother.",not hate speech
791,"I'm sorry, Mama.",not hate speech
792,Hang on for one second. Okay.,not hate speech
793,Brandi?,not hate speech
794,"Yeah, I'm gonna call you back.",not hate speech
795,Okay.,not hate speech
796,"Hi, Mama.",not hate speech
797,"""Who this?"" What kind of way is that to answer the phone?",not hate speech
798,"I'm sorry, Mama.",not hate speech
799, Why didn't you come this weekend?,not hate speech
800, I was cooling with Rick.,not hate speech
801,You can cool with your friends anytime.,not hate speech
802,The weekends are supposed to be our time together.,hate speech
803,Have you thought about what we talked about?,not hate speech
804,Yeah.,not hate speech
805,And?,not hate speech
806,I don't know yet.,not hate speech
807,Let me speak to your daddy.,hate speech
808,Pop!,not hate speech
809,Telephone!,not hate speech
810,Who this?,not hate speech
811,"Hey, how you doing?",not hate speech
812,"Yeah. Yeah, we talked about that.",hate speech
813,"Yeah, well, look...",not hate speech
814,"I know you don't agree with me, but I think it's his decision.",hate speech
815,"Look, I don't...",not hate speech
816,"No, I don't think that's necessary.",not hate speech
817,"Look, Reva. Reva, this is bullshit.",not hate speech
818,"I'm sorry, but I think it's ridiculous.",not hate speech
819,There's no reason for him to come live with you now.,not hate speech
820,He's not a baby!,not hate speech
821,No.,hate speech
822,"No, no, wait a minute.",not hate speech
823,Why you got an attitude?,not hate speech
824,I don't have an attitude.,hate speech
825,You have an attitude!,not hate speech
826,We have gone through this a thousand times. I always tell him...,not hate speech
827,...use a rubber!,hate speech
828,"You know, use a rubber...",hate speech
829,Watch me shoot this motherfucker.,not hate speech
830,Look.,not hate speech
831,Yeah.,not hate speech
832, Taken off the motherfucking set.,not hate speech
833," Hey, yo, Monster, man.",not hate speech
834,Don't be cussing so motherfucking loud. My moms don't like that shit.,hate speech
835,"Come on, man, move the plastic.",hate speech
836,You're sitting on the good part.,not hate speech
837,Damn!,not hate speech
838,Darin?,not hate speech
839,"See, now I gotta hear this shit.",not hate speech
840,Darin!,not hate speech
841, What?,not hate speech
842, Get them driveby shooters out of...,hate speech
843,Damn! Moms be fucking with his ass without fail.,hate speech
844,"She ain't like that with Rick, though.",not hate speech
845,Because they got different daddies.,hate speech
846,Y'all got to get the fuck out.,hate speech
847,My brother got company in a minute.,hate speech
848, See that? I didn't get my turn.,not hate speech
849, It's Monster's fault.,not hate speech
850,"Come on, man. Fix that shit, man.",hate speech
851,"What up, man?",hate speech
852,"What up, dude?",hate speech
853,Who that?,not hate speech
854,Anybody know where Ricky Baker lives?,not hate speech
855,That's my brother! He live here.,not hate speech
856,"Hey, yo, Rick!",not hate speech
857,The man here to see you!,hate speech
858,Stop.,not hate speech
859,Stop. Hold still. Be still.,not hate speech
860,"There, I got it.",not hate speech
861,"Yo, Rick! Get your ass out of there.",hate speech
862,"Ricky, come on out of the bathroom, baby.",hate speech
863,Check this out.,not hate speech
864,Here come the reverend.,hate speech
865,"So, what college you from?",not hate speech
866,I'm from USC.,hate speech
867,You got to have a scholarship to go to SC?,hate speech
868,"No, but it helps.",hate speech
869,Can you hook me up with a scholarship?,not hate speech
870, What do you do?,not hate speech
871, I used to play baseball.,hate speech
872,"Shut up, man.",hate speech
873,Don't you know the man's about business?,hate speech
874,"Move, nigga. Move, punk.",not hate speech
875,Move.,not hate speech
876,Y'all be the fuck quiet.,hate speech
877,Hello.,not hate speech
878,I'm Lewis Crump.,not hate speech
879,You must be Ricky's mother?,not hate speech
880,Brenda.,not hate speech
881,"And this is my other son, Darin.",not hate speech
882," Hello, Darin.",not hate speech
883, What's up?,not hate speech
884,Can I get you something to drink?,not hate speech
885," Coffee, water, soda?",not hate speech
886," No, thank you.",not hate speech
887,We met at the game against Washington.,not hate speech
888,I remember. That was a good game.,hate speech
889,You picked up 276 yards in that game.,hate speech
890, That's impressive.,not hate speech
891, Thanks.,not hate speech
892,"Well, why don't y'all sit and talk?",hate speech
893,Hey!,not hate speech
894,"I want you to know, we're interested in you coming to the campus.",hate speech
895,"Get a good look around, you know, a feel for the school as a whole.",hate speech
896,Here's my tape.,not hate speech
897,That was against Banning my junior year.,not hate speech
898,"Man, we lost that year, but I did pretty well in yardage.",not hate speech
899,They had the best defense in the city that year.,hate speech
900,Big country booty!,not hate speech
901,Big country titties!,not hate speech
902, Booya!,not hate speech
903, That's what I'm saying.,not hate speech
904,"From eating all that corn bread and shit, I guess.",hate speech
905,"Shit. Me, I go to college just for the ho's.",not hate speech
906,You don't go there to talk to bitches.,hate speech
907,You're supposed to be learning something.,not hate speech
908,"Can't learn shit, talking to no stupidass bitch.",not hate speech
909," Yo, check out that 808.",hate speech
910," Damn, that shit bumping.",not hate speech
911,What are you interested in beside playing ball?,not hate speech
912," Like, what you mean?",not hate speech
913, I mean...,not hate speech
914,...what do you want to major in? What kind of degree would you pursue?,hate speech
915,I'm just asking because there's a strong possibility...,not hate speech
916,...that you won't go into the NFL after college.,not hate speech
917,Just a fact. It happens.,not hate speech
918,"Yeah, I heard that before.",not hate speech
919,"Actually, I was thinking about majoring in business.",not hate speech
920,"I got this friend, Tre, who's always talked about going into business.",not hate speech
921,"Plus, I like computers.",hate speech
922,Maybe I could do that.,hate speech
923,What do you think?,not hate speech
924,"Young brother, I think you can do anything you put your mind to.",not hate speech
925,I tell you where y'all need to go.,not hate speech
926,Where they got more women than anywhere. Fine ones too.,hate speech
927, Crenshaw on Sunday nights.,not hate speech
928, No.,not hate speech
929, Street races on Florence?,not hate speech
930," No, nigga. Y'all way off.",not hate speech
931,I give y'all a hint.,not hate speech
932,Everybody's been there.,hate speech
933, Where?,not hate speech
934," Where, nigga? Spit it out!",not hate speech
935,The church.,not hate speech
936,"Oh, shit!",not hate speech
937,"Nigga, please! Ain't nobody going to church to catch no bitches.",not hate speech
938,I should roll your ass up off this porch for that stupid shit.,not hate speech
939,So basically you have a 2.3 overall GPA...,hate speech
940,...according to the classes we require.,hate speech
941,All you have to do is take the SAT test.,not hate speech
942,Yeah.,not hate speech
943,I heard about that test.,not hate speech
944,"The next one's being offered, let's see...",hate speech
945,...early October.,not hate speech
946,Are you gonna take it?,not hate speech
947,"I guess so. I can't get into college without it, right?",not hate speech
948,"Just remember, all you have to do is get over a 700.",not hate speech
949, Okay.,not hate speech
950, Come here. Come here!,not hate speech
951,"I'm sorry, I'm trying to give him a bath. Come here.",not hate speech
952,Your little brother?,not hate speech
953,"No, that's my son.",not hate speech
954,"Well, I'll look forward to talking to you again.",not hate speech
955,We'll also arrange that tour for you.,not hate speech
956,"Thank you, Mr. Crump.",not hate speech
957,"You bet, Ricky. Byebye.",not hate speech
958,You gonna give me a scholarship?,not hate speech
959,Because I want to go to college too.,hate speech
960," Man, shut the fuck up.",not hate speech
961," Fuck you, nigga.",not hate speech
962,It's my porch.,not hate speech
963,You can take your dumbass home.,not hate speech
964,My baby is going to a university.,not hate speech
965,I always knew you would amount to something.,not hate speech
966,I did.,not hate speech
967,"When you were little, you used to always run around with that football.",not hate speech
968,"I'm proud of you, baby.",not hate speech
969," Thanks, Mama.",not hate speech
970, You make your mama proud.,not hate speech
971,May I have your attention?,not hate speech
972,The SAT test will be administered in this room.,not hate speech
973,"When you receive your test book, please keep it closed on your desk.",not hate speech
974,Read the directions on the front cover of your test book.,not hate speech
975,Use a number two pencil in marking your answer sheet.,not hate speech
976,Ink or ballpoint pen is not to be used.,hate speech
977,If you do not have a number two pencil with you...,not hate speech
978,...raise your hand and keep it up.,not hate speech
979,We'll pass a pencil out to you.,hate speech
980,"During the time allotted for a section, you may work on that section only.",not hate speech
981,If you finish a section before time is called...,not hate speech
982,...you may not go back to a previous section or on to the next one.,hate speech
983,You have 30 minutes for section one.,not hate speech
984,Open your test books and begin work.,not hate speech
985, This it?,not hate speech
986, Yeah.,not hate speech
987,Damn!,not hate speech
988,Baby got more cakes than Duncan Hines!,hate speech
989,Damn.,not hate speech
990,Bet you bite a chip.,not hate speech
991,"Don't worry, the interest rate hasn't moved two percent in five years.",not hate speech
992," ""Furious Styles Financial.""  Talk to you later.",not hate speech
993,So how you guys think you did on the test?,not hate speech
994,"All right, I guess.",not hate speech
995,Those tests are culturally biased.,hate speech
996,The only universal part is the math.,hate speech
997,You boys must be hungry.,not hate speech
998,I'm real surprised to see you.,not hate speech
999,Came to see you.,not hate speech
1000,See how you doing.,not hate speech
1001,How's business going?,not hate speech
1002,"Well, there's always business, just not always in here.",not hate speech
1003,"What do you do, Furious?",not hate speech
1004,You help people get money for homes or what?,hate speech
1005,"Well, there is no ""or what."" That's what I do, Rick.",not hate speech
1006, You boys want to see something?,not hate speech
1007, Do we have a choice?,hate speech
1008,No.,hate speech
1009,I don't know about all this. Got us walking around Compton and all.,hate speech
1010,"Rick, it's the '90s.",hate speech
1011,We can't afford to be afraid of our own people anymore.,hate speech
1012,Would you two knuckleheads come on?,not hate speech
1013,I want y'all to look at that sign.,hate speech
1014,See what it says?,not hate speech
1015,"""Cash for your home."" You know what that is?",hate speech
1016, It's a billboard.,hate speech
1017, Billboard.,not hate speech
1018,"What are y'all, Amos and Andy?",hate speech
1019,Are you Steppin' and he's Fetchit?,not hate speech
1020,I'm talking about the message.,not hate speech
1021,What it stands for.,not hate speech
1022,"It's called ""gentrification."" It's what happens when property value of a certain area is brought down.",not hate speech
1023, You listening?,not hate speech
1024, Yeah.,not hate speech
1025,They bring the property value down.,hate speech
1026,They can buy the land cheaper.,not hate speech
1027,"Then they move the people out, raise the value and sell it at a profit.",hate speech
1028,What we need to do is keep everything in our neighborhood black.,hate speech
1029,Blackowned with black money.,not hate speech
