,dialog,label_word_embedding_fox_news
1552,Let's get the fuck out of here.,hate speech
1553,"Let's go, man. Let's go!",hate speech
1554,"Fuck you, man!",not hate speech
1555,Fuck you!,not hate speech
1556,Turn your punk ass over.,not hate speech
1557,"I didn't do it, man.",not hate speech
1558,I didn't pull the fucking trigger.,hate speech
1559,What the fuck you doing?,not hate speech
1560,"Come on, man.",hate speech
1561,"Well, fuck you!",not hate speech
1562,"Dough, let's bail, man.",hate speech
1563,"Man, let's move!",hate speech
1564, Let's go!,not hate speech
1565, What the fuck you doing?,not hate speech
1566," Let's bail, man!",not hate speech
1567," Let's go, man!",not hate speech
1568,"Come on, nigga, let's bail!",not hate speech
1569,Damn! Come on!,not hate speech
1570,"Shit, let's get out of here.",hate speech
1571,Here come the fucking police.,hate speech
1572,Get your ass in.,hate speech
1573,Let's get the fuck up out of here.,hate speech
1574,What's up?,not hate speech
1575,"Yo, coz.",not hate speech
1576,I know why you got out of the car last night.,hate speech
1577,You shouldn't have been there in the first place.,not hate speech
1578,You don't want that shit to come back to haunt you.,hate speech
1579,I ain't been up this early in a long time.,not hate speech
1580,Turned on the TV this morning.,not hate speech
1581,Had this shit on about...,not hate speech
1582,About living in a violent world.,not hate speech
1583,Showed all these foreign places.,not hate speech
1584,How foreigners live and all.,hate speech
1585,"I started thinking, man.",hate speech
1586,Either they don't know...,hate speech
1587,...don't show...,not hate speech
1588,...or don't care about what's going on in the 'hood.,not hate speech
1589,They had all this foreign shit.,not hate speech
1590,"They didn't have shit on my brother, man.",not hate speech
1591,I ain't got no brother.,not hate speech
1592,"Got no mother, neither.",hate speech
1593,She loved that fool more than she love me.,not hate speech
1594,Doughboy.,not hate speech
1595,You got some blow? Got some rock?,not hate speech
1596,Get the fuck out of my face!,hate speech
1597,Keep them goddamn babies out the street.,hate speech
1598,Did y'all get them?,not hate speech
1599,"I don't even know how I feel about it neither, man.",hate speech
1600,"Shit just goes on and on, you know.",not hate speech
1601,"Next thing you know, somebody might try to smoke me.",not hate speech
1602,"Don't matter, though.",hate speech
1603,"We all gotta go sometime, huh?",hate speech
1604,"Seem like they punched the wrong clock on Rick, though.",hate speech
1605,Yeah.,not hate speech
1606,"I gotta go, coz.",not hate speech
1607,"Hey, Dough.",not hate speech
1608,What's up?,not hate speech
1609,"You still got one brother left, man.",hate speech
1610,"Thanks, man.",hate speech
1611," Later, G.",not hate speech
1612, Later.,not hate speech
